question,contexts,answer,ground_truth,faithfulness,answer_relevancy,answer_similarity,context_relevancy,context_precision,context_recall
"Complete the following paragraph: A more complete paradigm of molecular biology must therefore include glycans, often in covalent combination with other macromolecules (i.e., glycoconjugates, such as glycoproteins and glycolipids). In analogy to the current situation in Cosmology, glycans can be considered as the “dark matter” of the biological universe: a major and critical component that has yet to be fully incorporated into the “standard model” of biology.","['In addition, simple, rapidly turning over, protein-bound glycans are abundant within the nucleus and cytoplasm, in which they can serve as regulatory switches. A more complete paradigm of molecular biology must therefore include glycans, often in covalent combination with other macromolecules (i.e., glycoconjugates, such as glycoproteins and glycolipids). In analogy to the current situation in Cosmology, glycans can be considered as the “dark matter” of the biological universe: a major and critical component that has yet to be fully incorporated into the “standard model” of biology. However, unlike the situation with dark matter in the Universe, there is already a lot known about glycans. The chemistry and metabolism of carbohydrates were prominent matters of interest in the first part of the 20th century. Although engendering much attention, they were primarily considered as a source of energy or as structural materials, apparently lacking other biological activities. Furthermore, during the molecular biology revolution of the 1970s, studies of glycans lagged far behind those of other major classes of molecules. This was in part because of their inherent structural complexity, the difficulty in determining their sequences, and the fact that their biosynthesis could not be directly predicted from a DNA template. The development of many new technologies for exploring the structures and functions of glycans has since opened a new frontier of molecular biology called “glycobiology”—a word first coined in the late 1980s to recognize the coming together of the traditional disciplines of carbohydrate chemistry and biochemistry with a modern understanding of the cell and molecular biology of glycans and, in particular, their conjugates with proteins and lipids. Glycobiology is now one of the more rapidly growing fields in the natural sciences, with broad relevance to many areas of basic research, biomedicine, and biotechnology. The field includes the chemistry of carbohydrates, the enzymology of glycan formation and degradation, the recognition of glycans by specific proteins, roles of glycans in complex biological systems, and their analysis or manipulation by various techniques.'
 'With ongoing sequencing of numerous genomes, spectacular gains in understanding the biology of nucleic acids and proteins have occurred. Thus, many scientists assume that studying just these molecules will explain the makeup of cells, tissues, organs, physiological systems, and intact organisms. In fact, making a cell requires many small molecule metabolites as well as two other major classes of macromolecules—lipids and carbohydrates—which serve as intermediates in generating energy and as signaling effectors, recognition markers, and structural components. Taken together with the fact that they encompass some of the major posttranslational modifications of proteins, lipids, and carbohydrates help explain how the relatively small number of genes in the typical genome can generate the enormous biological complexities inherent in the development, growth, and functioning of diverse organisms. The biological roles of carbohydrates are particularly prominent in the assembly of complex multicellular organs and organisms, which requires interactions between cells and the surrounding matrix. However, without any known exception, all cells and numerous macromolecules in nature carry an array of covalently attached sugars (monosaccharides) or sugar chains (oligosaccharides), which are generically referred to in this book as “glycans.” Sometimes glycans can also be freestanding entities. Being on the outer surface of cellular and secreted macromolecules, many glycans are in a position to modulate or mediate a variety of events in cell–cell, cell–matrix, and cell–molecule interactions critical to the development and function of a complex multicellular organism. They can also mediate interactions between organisms (e.g., between host and a parasite, pathogen, or a symbiont). In addition, simple, rapidly turning over, protein-bound glycans are abundant within the nucleus and cytoplasm, in which they can serve as regulatory switches. A more complete paradigm of molecular biology must therefore include glycans, often in covalent combination with other macromolecules (i.e., glycoconjugates, such as glycoproteins and glycolipids).'
 ""Furthermore, glycans are often highly branched and their structures cannot be described as a simple linear sequence (Chapter 3). The critical role of glycomics in systems biology. Glycan structures have no template from which to be predicted, are regulated by cellular metabolism and glyco-enzyme expression, and modify both proteins and lipids. Glycomics thus requires the tools (more...) Because of this biosynthetic and structural complexity, it is not currently possible to accurately predict the structures of the glycans that an organism can produce under different environments or how these glycans are conjugated with other molecules, armed only with knowledge of the genome or proteome. Rather, the identity of each glycan in a biological sample must be identified using analytical methods (Chapter 50 and Chapter 51) that are sufficiently sophisticated to detect and discern the glycan's diverse structural features. Thus, research aimed at understanding the biological roles and consequences of glycan structures depends on the availability of integrated glycoinformatics databases. A consortium of international scientists under the GlySpace Alliance have made considerable progress in this area in recent years to streamline the annotation of glycans and related expression patterns such that they can be linked across diverse databases. Thus, a clearer path from glycan structure to biosynthetic pathways is beginning to emerge from these efforts. Interpreting glycan structural information in the context of diverse types of biological and chemical information is a challenge. For example, most glycans in animals are covalently linked to proteins or lipids. The glycan moieties of a glycoprotein are linked to specific amino acids (usually asparagine, serine, or threonine) (Chapters 9 and 10). Which sites are glycosylated and which structures are present at a particular site often vary, depending on many factors, including the type, developmental stage, and disease state of the cell or tissue.""
 'It seems likely that this is a consequence of the intimate involvement of glycans in the most rapidly evolving aspects of biological systems (i.e., host–pathogen interactions, immunity, and reproduction). Further studies are needed to ascertain if glycans are indeed involved in the process of speciation.  When Will the Integration of Glyosciences into the Mainstream of Bioinformatics Be Achieved?  Currently, searches of the main genome and protein databases used by essentially all biologists yield almost no information on the glycosylation state of glycoproteins. Indeed, there is as yet no central comprehensive database of glycan structures that an investigator can mine to determine the occurrence, provenance, or phylogeny of a specific glycan of interest. An international effort led by nearly every major country involved in the glycosciences has come together to agree on uniform standards for describing glycans in computer databases and to develop methods to curate and maintain glycan structural data. Together with the expanding use of uniform symbol nomenclature (Chapter 1), this is the first step toward integrating glycomic data into mainstream protein databases (Chapter 52).  When Will Glycobiology Completely Merge into a Holistic Approach to Biology?  As with other fields like protein sciences, there will always be a small cadre of investigators whose primary interest is in the structure, chemistry, biochemistry, and biology of glycans. But a combination of advances in methodology and education will eventually integrate glycosciences into the general awareness of biologists who are currently not trained to understand the significance of glycans. As our understanding of the functions of glycans increases, biochemists and biologists will come to recognize that glycan modifications are no less important than the amino acids that make up the polypeptide backbone or the nucleotides and nucleotide derivatives that make up DNA and RNA. In the long run, glycobiology will merge into a holistic approach to biological systems. When that intellectual singularity is eventually achieved, further editions of this book may no longer be necessary.'
 'As research on glycan biosynthetic pathway simulation progresses, its integration with genomics, transcriptomics, proteomics, lipidomics, and metabolomics data represents the next step. This will result in a holistic understanding of biological processes (Figure 52.1), such that glycomics data can be viewed in the context of complementary data. Such integrated knowledge will result in better elucidation of the glycosylation process, reveal new interactions with GBPs, and enhance our understanding of related functional consequences. The current coordinated trend toward RDF-based data integration is already shaping future developments of glycoscience databases. It will help bridge the gap between glycomics and other -omics that have already adopted RDF ontologies but that are still very much DNA sequence–centered. Indeed, 50 years after the advent of sequencing technology, DNA sequences, along with their links to other data types (gene expression, protein structure, etc.), remain the most prominent entities in molecular biology databases and repositories. Scientists gather sequence-centered information in the course of elucidating a cellular process or a pathological behavior, simply because a gene/protein sequence is usually the common element shared across -omics domains. The problem here is that glycans are only linked to the gene via their biosynthetic enzymes and substrates. The advancement of glycoscience as a discipline depends on expanding the integration of data describing glycoproteins, glycolipids, glycosaminoglycans, lipopolysaccharides, and the genome-coded enzymatic machinery that generates or breaks down these glycans, together with the ever-increasing information about the interactions of these glycoconjugates with other components of the cell. It is the ultimate goal of glycoscience research to be able to link glycan structures with their function. Although it is still difficult to completely identify fully defined glycan structures on their conjugates in a high-throughput manner, various hypotheses regarding the relationships between the specific structure of a glycan and its biological functions have been developed. One hypothesis maintains that the structural features characteristic of a group of glycans, rather than of a single structure, are required for biological function.'
 'Mixtures of glycans need to be studied next, to mimic “clustered saccharide patches” that more closely mimic natural states. Significant progress has also been made in Systems Glycobiology by better integration of glycomics with genomics, transcriptomics, and proteomics. Our understanding as to how miRNAs and transcription factors regulate glycan expression has also improved in the last few years (Chapters 51 and 52). At the present time, the study of glycan structure/function relationships requires highly specialized expertise in synthetic and analytical chemistry. The inherent difficulty in studying glycans remains a major challenge preventing glycobiology—the study of glycan function—from entering mainstream conceptual frameworks of biology. In response to this challenge, strong emphasis has recently been placed on the development of facile technologies that will allow nonglycobiologists without specialized analytical chemistry skills to study glycans in a meaningful way. In fact, the use of glycosyltransferase and glycosidase probes to manipulate glycans is not any more difficult than the use of restriction enzymes and endonucleases to analyze DNA. The use of antibodies and lectins specific for glycans also exemplifies methods that can be readily applied by biologists lacking expensive analytical equipment or extensive glycobiology expertise (Chapter 49). In fact, several kits for the study of glycans have emerged, as companies recognize the future market potential of glycobiology. In addition, companies are offering highly purified enzymes, antibodies, and chemistries, making it much easier to study glycans. In contrast, few glycans are available for experimental purposes and most enzymes that act on glycans are not commercially available. Equally important, most investigators are not trained to know what questions to ask regarding the roles of glycans attached to their favorite glycoconjugate. In addition to new and facile methods to study glycans, education of the next generation of cell biologists and biochemists with respect to the importance of glycans will be key to advancing glycoscience to the next level. It is clear from the chapters in this book that glycans affect all aspects of life on this planet.'
 'NCBI Bookshelf. A service of the National Library of Medicine, National Institutes of Health. Varki A, Cummings RD, Esko JD, et al., editors. Essentials of Glycobiology [Internet]. 4th edition. Cold Spring Harbor (NY): Cold Spring Harbor Laboratory Press; 2022.  doi: 10.1101/glycobiology.4e.1 Ajit Varki and Stuart Kornfeld. This chapter provides a historical background to the field of glycobiology and an overview of this book. General terms found in the volume are considered, common monosaccharide units of glycoconjugates mentioned, and a uniform symbol nomenclature used for structural depictions presented. The major glycan classes discussed in the book are described, and an overview of the general pathways for their biosynthesis is provided. Topological issues relevant to biosynthesis and functions of glycoconjugates are also considered, and the growing role of these molecules in medicine, biotechnology, nanotechnology, bioenergy, and materials science is mentioned. Defined in the broadest sense, glycobiology is the study of the structure, biosynthesis, biology, and evolution of saccharides (also called carbohydrates, sugar chains, or glycans) that are widely distributed in nature and of the proteins that recognize them. How does glycobiology fit into the modern concepts of molecular biology? The central paradigm driving research in molecular biology has been that biological information flows from DNA to RNA to protein. The power of this concept lies in its template-based precision, the ability to manipulate one class of molecules based on knowledge of another, and the patterns of sequence homology and relatedness that predict function and reveal evolutionary relationships. With ongoing sequencing of numerous genomes, spectacular gains in understanding the biology of nucleic acids and proteins have occurred. Thus, many scientists assume that studying just these molecules will explain the makeup of cells, tissues, organs, physiological systems, and intact organisms.']","However, unlike the situation with dark matter in the Universe, there is already a lot known about glycans. The chemistry and metabolism of carbohydrates were prominent matters of interest in the first part of the 20th century. Although engendering much attention, they were primarily considered as a source of energy or as structural materials, apparently lacking other biological activities. Furthermore, during the molecular biology revolution of the 1970s, studies of glycans lagged far behind those of other major classes of molecules. This was in part because of their inherent structural complexity, the difficulty in determining their sequences, and the fact that their biosynthesis could not be directly predicted from a DNA template. The development of many new technologies for exploring the structures and functions of glycans has since opened a new frontier of molecular biology called “glycobiology”—a word first coined in the late 1980s to recognize the coming together of the traditional disciplines of carbohydrate chemistry and biochemistry with a modern understanding of the cell and molecular biology of glycans and, in particular, their conjugates with proteins and lipids. Glycobiology is now one of the more rapidly growing fields in the natural sciences, with broad relevance to many areas of basic research, biomedicine, and biotechnology. The field includes the chemistry of carbohydrates, the enzymology of glycan formation and degradation, the recognition of glycans by specific proteins, roles of glycans in complex biological systems, and their analysis or manipulation by various techniques.","However, unlike the situation with dark matter in the Universe, there is already a lot known about glycans. The chemistry and metabolism of carbohydrates were prominent matters of interest in the first part of the 20th century. Although engendering much attention, they were primarily considered as a source of energy or as structural materials, apparently lacking other biological activities. Furthermore, during the molecular biology revolution of the 1970s, studies of glycans lagged far behind those of other major classes of molecules. This was in part because of their inherent structural complexity, the difficulty in determining their sequences, and the fact that their biosynthesis could not be directly predicted from a DNA template.",1.0,0.6275600375565363,0.9329506726505106,0.01098901098901099,0.9999999999857143,1.0
"Complete the following paragraph: Monosaccharide names are frequently abbreviated; most common are three-letter abbreviations for simple monosaccharides (e.g., Gal, Glc, Man, Xyl, Fuc). There are nine common monosaccharides found in vertebrate glycoconjugates (Figure 2.4). Once incorporated into a glycan, these nine monosaccharide building blocks can be further modified to generate additional sugar structures.","['Monosaccharide names are frequently abbreviated; most common are three-letter abbreviations for simple monosaccharides (e.g., Gal, Glc, Man, Xyl, Fuc). There are nine common monosaccharides found in vertebrate glycoconjugates (Figure 2.4). Once incorporated into a glycan, these nine monosaccharide building blocks can be further modified to generate additional sugar structures. For example, glucuronic acid (GlcA) can be epimerized at C-5 to generate IdoA. Many more monosaccharides exist in glycoconjugates from other species and as intermediates in metabolism. We use a symbolic notation for the monosaccharides that are most abundant in vertebrate glycoconjugates (see Chapter 1). Common monosaccharides found in vertebrates. N-Acetylneuraminic acid is the most common form of sialic acid.  Monosaccharides exist in solution as an equilibrium mixture of acyclic and cyclic forms. The percentage of each form depends on the sugar structure. The cyclic form of a monosaccharide is characterized by a hemiacetal group formed by the reaction of one of the hydroxyl groups with the C-1 aldehyde or ketone. For reasons of chemical stability, five- and six-membered rings are most commonly formed from acyclic monosaccharides. Hexoses (six-carbon aldoses) and hexuloses (six-carbon ketoses) form six-membered rings via a C-1—O—C-5 ring closure; they form five-membered rings through a C-1—O—C-4 ring closure (Figure 2.5). A five-membered cyclic hemiacetal is labeled a “furanose” and a six-membered cyclic hemiacetal is called a “pyranose.” Pentoses can form both pyranose and furanose forms. Cyclization of acyclic D-glucose to form pyranose and furanose structures.'
 'Although several hundred distinct monosaccharides are known in nature, only a minority of these are commonly found in well-studied glycans. Examples of common monosaccharides in vertebrate cells are listed below, along with their standard abbreviations (for details regarding their structures, see Chapter 2, and embedded links from the symbols in Online Appendix 1B). Pentoses: five-carbon neutral sugars—D-xylose (Xyl)Hexoses: six-carbon neutral sugars—for example, D-glucose (Glc)Hexosamines: hexoses with an amino group at the 2-position, which can be either free or, more commonly, N-acetylated—for example, N-acetyl-D-glucosamine (GlcNAc)6-Deoxyhexoses: for example, L-fucose (Fuc)Uronic acids: hexoses with a carboxylate at the 6-position—for example, D-glucuronic acid (GlcA)Nonulosonic acids: family of nine-carbon acidic sugars, of which the most common in animals is the sialic acid N-acetylneuraminic acid (Neu5Ac, also sometimes called NeuAc or, historically, NANA) (see Chapter 15) For simplicity, the symbols D- and L- are omitted from the full names of common monosaccharides from here on unless a less common variant occurs. This limited set of monosaccharides dominates the glycobiology of more recently evolved (so-called “higher”) animals, but several others have been found in “lower” animals (e.g., tyvelose [Chapters 25 and 26], bacteria and Archaea [e.g., keto-deoxyoctulosonic acid, rhamnose, L-arabinose, and muramic acid; Chapters 21 and 22], and plants [e.g., arabinose, apiose, and galacturonic acid; Chapter 24]). A variety of modifications of glycans further enhance their diversity in nature and often serve to mediate specific biological functions.'
 'Thus, the relationship of monosaccharides to oligosaccharides or polysaccharides is analogous to that of amino acids and proteins or nucleotides and nucleic acids (polynucleotides). The term “glycoconjugate” is often used to describe a macromolecule that contains monosaccharides covalently linked to proteins or lipids. The prefix “glyco” and the suffixes “saccharide” and “glycan” indicate the presence of carbohydrate constituents (e.g., glycoproteins, glycolipids, and proteoglycans). Just as is observed with proteins in nature, additional structural diversity can be imparted to glycans by modifying their hydroxyl groups with phosphate, sulfate, or acetyl esters, and/or their amino groups with acetyl or sulfate groups. A carbohydrate may be termed “complex” if it contains more than one type of monosaccharide building unit. The glucose-based polymer cellulose is an example of a “simple” carbohydrate, whereas a galactomannan polysaccharide, composed of both galactose and mannose, is an example of a complex carbohydrate. However, even so-called simple glycans, such as cellulose and starch, often have very complex molecular structures in three dimensions. The term complex carbohydrates includes glycoconjugates, whereas the term carbohydrates per se would not. Additional nomenclature issues are covered in this chapter and Chapter 3. A more detailed and comprehensive listing of carbohydrate nomenclature rules has been published (see McNaught 1997 and Varki et al. 2015 in Further Reading at the end of this chapter, and Online Appendix 1B). The classification of monosaccharide structures began in the late 19th century with the pioneering work of Emil Fischer. All simple monosaccharides have the general empirical formula Cx(H2O)n, where n is an integer ranging from 3 to 9.'
 'The chiral central carbon in glyceraldehyde gives rise to two possible configurations of the molecule, termed D and L.  The numbering of carbon atoms follows the rules of organic chemistry nomenclature. The aldehyde carbon is referred to as C-1 and the carbonyl group in ketoses is referred to as C-2. The overall configuration (D or L) of each sugar is determined by the absolute configuration of the stereogenic center furthest from the carbonyl group (i.e., with the highest numbered asymmetric carbon atom; this is C-5 in hexoses and C-4 in pentoses). The configuration of a monosaccharide is most easily determined by representing the structure in a Fischer projection. If the OH (or other non-H group) is on the right in the Fischer projection, the overall configuration is D. If the OH (or other non-H group) is on the left, the overall configuration is L (Figure 2.2). This figure also shows D- and L-glucose in the cyclic form (chair conformation) found in solution. Most vertebrate monosaccharides have the D configuration with the exception of fucose and iduronic acid (IdoA) L sugars. The Fischer projections shown in Figure 2.3 illustrate the acyclic structures of all D-aldoses through the aldohexose group. D- and L-glucopyranose in Fischer projection and chair conformation.  Fischer projections for the acyclic forms of the D series of aldoses, ranging from triose to hexose.  Any two sugars that differ only in the configuration around a single chiral carbon atom are called epimers. For example, D-mannose is the C-2 epimer of D-glucose, whereas D-galactose is the C-4 epimer of D-glucose (Figure 2.4). Monosaccharide names are frequently abbreviated; most common are three-letter abbreviations for simple monosaccharides (e.g., Gal, Glc, Man, Xyl, Fuc).'
 '2015 in Further Reading at the end of this chapter, and Online Appendix 1B). The classification of monosaccharide structures began in the late 19th century with the pioneering work of Emil Fischer. All simple monosaccharides have the general empirical formula Cx(H2O)n, where n is an integer ranging from 3 to 9. As mentioned briefly in Chapter 1, all monosaccharides consist of a chain of chiral hydroxymethylene units, which terminates at one end with a hydroxymethyl group and at the other with either an aldehyde group (aldoses) or an α-hydroxy ketone group (ketoses). Glyceraldehyde is the simplest aldose and dihydroxyacetone is the simplest ketose (Figure 2.1). The structures of glyceraldehyde and dihydroxyacetone are distinct in that glyceraldehyde contains an asymmetric (chiral) carbon atom (Figure 2.1), whereas dihydroxyacetone does not. With the exception of dihydroxyacetone, all monosaccharides have at least one asymmetric carbon atom, the total number being equal to the number of internal (CHOH) groups (n–2 for aldoses and n–3 for ketoses with n carbon atoms). The number of stereoisomers corresponds to 2k, where k equals the number of asymmetric carbon atoms. For example, an aldohexose with the general formula C6H12O6 and four asymmetric carbon atoms (i.e., four (CHOH) groups) can be described in 16 possible isomeric forms (Figure 2.1). Structures of glyceraldehyde and dihydroxyacetone. (A) Fischer projection. (B) D- and L-glyceraldehyde. The chiral central carbon in glyceraldehyde gives rise to two possible configurations of the molecule, termed D and L.  The numbering of carbon atoms follows the rules of organic chemistry nomenclature. The aldehyde carbon is referred to as C-1 and the carbonyl group in ketoses is referred to as C-2.'
 'Thus, whereas three different nucleotides or amino acids can only generate six trimers, three different hexoses could theoretically produce (depending on which of their forms are considered) anywhere from 1056 to 27,648 unique trisaccharides. This difference in complexity becomes even greater as the number of monosaccharide units found in natural glycan increases (now numbering in the hundreds). Fortunately for the student of glycobiology, naturally occurring biological macromolecules in a given species tend to contain relatively few of the possible monosaccharide units, and they are in a limited number of combinations. Of course, the great majority of glycans in most species have yet to be discovered and structurally defined. Thus, much of the possible diversity may yet exist in nature. Although several hundred distinct monosaccharides are known in nature, only a minority of these are commonly found in well-studied glycans. Examples of common monosaccharides in vertebrate cells are listed below, along with their standard abbreviations (for details regarding their structures, see Chapter 2, and embedded links from the symbols in Online Appendix 1B).'
 'These two types of monosaccharides are therefore named aldoses and ketoses, respectively (for examples, see below, and for more details, see Chapter 2). Free monosaccharides can exist in open-chain or ring forms (Figure 1.2). Ring forms of the monosaccharides are the general rule in oligosaccharides, which are linear or branched chains of monosaccharides attached to one another via glycosidic linkages (the term “polysaccharide” is typically used for large glycans composed of repeating oligosaccharide motifs; for examples, see Chapter 3). The ring form of a monosaccharide generates a chiral anomeric center at C-1 for aldo sugars or at C-2 for keto sugars (for details, see Chapter 2). A glycosidic linkage involves the attachment of a monosaccharide to another residue, typically via the hydroxyl group of this anomeric center, generating α-linkages or β-linkages that are defined based on the relationship of the glycosidic oxygen to the anomeric carbon and ring (Chapter 2). These two linkage types confer very different structural properties and biological functions on sequences that are otherwise identical in composition, as classically illustrated by the differences between starch and cellulose (both are homopolymers of glucose, the former largely α1-4-linked and the latter β1-4-linked throughout). A glycoconjugate is a compound in which one or more monosaccharide or oligosaccharide units (the glycone) are covalently linked to a noncarbohydrate moiety (the aglycone). An oligosaccharide that is not attached to an aglycone possesses the reducing power of the aldehyde or ketone in its terminal monosaccharide component, with the exception of oligosaccharides in which the sugars are linked together at their reducing ends, as in derivatives of sucrose or trehalose.']","N-Acetylneuraminic acid is the most common form of sialic acid. Monosaccharides exist in solution as an equilibrium mixture of acyclic and cyclic forms. The percentage of each form depends on the sugar structure. The cyclic form of a monosaccharide is characterized by a hemiacetal group formed by the reaction of one of the hydroxyl groups with the C-1 aldehyde or ketone. For reasons of chemical stability, five- and six-membered rings are most commonly formed from acyclic monosaccharides. Hexoses (six-carbon aldoses) and hexuloses (six-carbon ketoses) form six-membered rings via a C-1—O—C-5 ring closure; they form five-membered rings through a C-1—O—C-4 ring closure. A five-membered cyclic hemiacetal is labeled a “furanose” and a six-membered cyclic hemiacetal is called a “pyranose.” Pentoses can form both pyranose and furanose forms. Cyclization of acyclic D-glucose to form pyranose and furanose structures.","For example, glucuronic acid (GlcA) can be epimerized at C-5 to generate IdoA. Many more monosaccharides exist in glycoconjugates from other species and as intermediates in metabolism. We use a symbolic notation for the monosaccharides that are most abundant in vertebrate glycoconjugates (see Chapter 1). Common monosaccharides found in vertebrates. N-Acetylneuraminic acid is the most common form of sialic acid.  Monosaccharides exist in solution as an equilibrium mixture of acyclic and cyclic forms. The percentage of each form depends on the sugar structure. The cyclic form of a monosaccharide is characterized by a hemiacetal group formed by the reaction of one of the hydroxyl groups with the C-1 aldehyde or ketone. For reasons of chemical stability, five- and six-membered rings are most commonly formed from acyclic monosaccharides. Hexoses (six-carbon aldoses) and hexuloses (six-carbon ketoses) form six-membered rings via a C-1—O—C-5 ring closure; they form five-membered rings through a C-1—O—C-4 ring closure (Figure 2.5). A five-membered cyclic hemiacetal is labeled a “furanose” and a six-membered cyclic hemiacetal is called a “pyranose.” Pentoses can form both pyranose and furanose forms. Cyclization of acyclic D-glucose to form pyranose and furanose structures. The cyclization reaction produces both the α and β anomers (i.e., C-1 epimers).",0.8125,0.4835567006689963,0.8942989202374253,0.04,0.9428571428382857,0.7692307692307693
"Complete the following paragraph: In solution, NMR studies show IdoA2S and IdoA residues to be present in a mixture of 1C4 and 2S0 conformations. The conformational flexibility in IdoA residues likely allows orientation of the sulfate groups in HS to maximize the binding affinity to proteins.","['HS, for example, is involved in trimolecular interactions with growth factors and growth factor receptors, and thereby participates in regulating embryonic development. HS interacts with proteases and protease inhibitors in the blood to control the coagulation process and binds to viral envelope proteins as a receptor for viral infections. Also, heparin, a highly sulfated form of HS, is a commonly used anticoagulant drug in the clinic. A more complete discussion of the biological function of HS can be found in Chapters 17 and Chapter 38. This section uses the interaction between HS and proteins to illustrate how structural factors affect binding between GAGs and proteins in general. One factor that contributes to the structural diversity of HS-protein interactions is the conformational flexibility of L-IdoA and its derivative, L-IdoA2S (2-O-sulfo iduronic acid). Present in the pyranose form, the six-membered ring structure of IdoA or IdoA2S can adopt either chair or skew-boat conformations (Figure 3.3B). Until now, only the 4C1 chair conformation has been verified experimentally for GlcA and GlcN in HS, but both the 1C4 chair and the 2S0 conformations have been found for IdoA2S residues in crystal structures containing HS. In solution, NMR studies show IdoA2S and IdoA residues to be present in a mixture of 1C4 and 2S0 conformations. The conformational flexibility in IdoA residues likely allows orientation of the sulfate groups in HS to maximize the binding affinity to proteins. Structural elements that dictate preferences for one form over the other, including the possible effects from the sulfated monosaccharide sequences around the IdoA/IdoA2S residue, are subject to further investigation. A second factor contributing to structural diversity and selective interactions with certain HS-binding proteins is the size of the sulfated saccharide domains.'
 'Analysis of the conformation of individual sugars shows that N-acetylglucosamine and glucuronic acid residues assume a preferred conformation in solution, designated 4C1 (indicating that carbon 4 is above the plane defined by carbons 2, 3, and 5 and the ring oxygen, and that carbon 1 is below the plane; Chapter 2). In contrast, IdoA2S assumes the 1C4 or the 2S0 conformation (Figure 38.1), which reorients the position of the sulfo substituents, thereby creating a different orientation of charged groups. In many cases when a protein binds to an HS chain, it induces a change in conformation of the IdoA2S residue resulting in a better fit and enhanced binding. IdoA2S residues have always been found in domains rich in N-sulfo and O-sulfo groups (for biosynthetic reasons; Chapter 17), which is also where proteins usually bind. Thus, the greater degree of conformational flexibility in these modified regions may explain why so many more proteins bind with high affinity to heparin, HS, and DS than to other GAGs. The presence of an N-acetyl group in an N-acetylglucosamine residue changes the preferred conformation of the neighboring IdoA residue, showing that even minor modifications can influence conformation and chain flexibility. Binding to GAGs that have a low degree of sulfation may require larger domains in the protein to interact with longer stretches of an oligosaccharide. Molecular dynamic simulations on large heparin oligosaccharides, even in the presence of proteins, are possible with recent advances in computer performance (Online Appendix 38A). Such simulations can be used to predict the conformational flexibility of different domains within the chain and, when combined with recent advances in protein–GAG docking, can provide additional insights into GAG–protein interactions. Conformation of heparin oligosaccharides.'
 'Structural elements that dictate preferences for one form over the other, including the possible effects from the sulfated monosaccharide sequences around the IdoA/IdoA2S residue, are subject to further investigation. A second factor contributing to structural diversity and selective interactions with certain HS-binding proteins is the size of the sulfated saccharide domains. HS isolated from natural sources shows domain-like structures, with clusters of six to eight saccharides forming the highly sulfated domains known as S-domains. These regions are separated by nonsulfated saccharide residues, consisting of GlcA-GlcNAc RUs, known as NAc-domains. The S-domains contain primarily IdoA residues that likely contribute the flexibility needed to optimize binding to proteins and elicit desired biological activities. The contribution of NAc-domains to the functions of HS has not been fully established. However, a possible role may be to appropriately position S-domains in a single polysaccharide chain for interaction with multiple proteins. One example is the interaction of heparin with antithrombin and thrombin. In this complex, one part of the heparin chain interacts with antithrombin, and another part of the heparin chain interacts with thrombin. Between the antithrombin-binding domain and thrombin-binding domain, a linker of six to seven saccharide residues exists. Unlike proteins and nucleic acids, the biosynthesis of GAGs is not regulated by a well-defined template. Instead, each member of the GAG family is synthesized by a unique pathway (Chapter 17). The HS synthesis pathway, for example, involves multiple enzymes, including specific glycosyltransferases (or HS polymerase), an epimerase, and several sulfotransferases. Moreover, HS is biosynthesized as a polymer covalently linked to a proteoglycan that consists of a core protein and polysaccharide side chains; the functions of these proteoglycans are, in fact, dominated by the properties of the HS chains added. Although this is a non-template-driven process, the overall structures of HS generally remain unchanged between generations.'
 'The fact that suitable crystals are less apt to form in the presence of HS oligomers contributes to the lack of structures of complexes. Also, it is difficult to obtain homogeneous preparations of large oligomers, because of the variable sulfation patterns and variable conversion of GlcA to IdoA. Computational modeling offers an alternative route to structures for many of these complexes. Specific patterns of sulfation and IdoA substitution are generated with ease. Yet, there are some challenges related to the flexibility of the HS chains and the ionic character of interactions that dominate their energetics; glycosidic angles in HS chains are variable, and IdoA rings sample several conformations, including a chair, 1C4, and a skew-boat conformer, 2S0. Moreover, orientations of the sulfate groups are variable, as are the side-chains of the lysine and arginine residues with which they tend to interact. Enhanced docking methodology combined with MD simulations overcomes some of these challenges. Leukocyte common antigen-related protein (LAR) is a type IIa receptor protein tyrosine phosphatase (RPTP) important for signal transduction in biological processes, including axon growth and regeneration. Glycosaminoglycan chains, including HS, act as ligands that regulate LAR signal transduction. Knowing where HS binding sites are and what molecular interactions drive binding is an important step in the design of agents that could promote regeneration. Figure 30.6 shows a snapshot of an HS pentamer bound to LAR. The structure was generated using the docking program HADDOCK. It employed several types of NMR data (chemical shift perturbation, STDs, and trNOEs) to guide selection of an initial set of 20 docked structures. The top scoring structures were subjected to short (50-nsec) MD runs in explicit water using GLYCAM06 force-field parameters for the HS fragment. The snapshot is from a longer (1-µsec) run, now highlighted in a movie (see Online Appendix 38A).'
 'For example, one can measure binding to cells with altered GAG composition (Chapter 49) or after treatment with specific lyases to remove GAG chains from the cell surface (Chapter 17) and then determine whether the same response occurs as observed in the presence of GAG chains. The interaction can then be studied more intensively using the in vitro assays described above. Methods to measure glycosaminoglycan (GAG)–protein interaction  As mentioned above, most GAG-binding proteins interact with HS and/or heparin. The likely basis for this preference is greater sequence heterogeneity and more extensive and variable sulfation compared with other GAGs. The unusual conformational flexibility of iduronic acid, which is found in heparin, HS, and DS, also has a role in their ability to bind proteins. GAGs are linear helical structures, consisting of alternating residues of N-acetylglucosamine (GlcNAc) or N-acetylgalactosamine (GalNAc) with glucuronic acid (GlcA) or IdoA (with the exception of KS, which consists of alternating N-acetylglucosamine and galactose residues; Chapter 17). Inspection of heparin oligosaccharides containing highly modified domains ([GlcNS6S-IdoA2S]n) shows that the N-sulfo and 2-O-sulfo groups of each disaccharide repeat lie on opposite sides of the helix from the 6-O-sulfo and carboxyl groups (Figure 38.1). Analysis of the conformation of individual sugars shows that N-acetylglucosamine and glucuronic acid residues assume a preferred conformation in solution, designated 4C1 (indicating that carbon 4 is above the plane defined by carbons 2, 3, and 5 and the ring oxygen, and that carbon 1 is below the plane; Chapter 2).'
 'Among these is the two-dimensional 1H-15N heteronuclear single quantum coherence (HSQC) experiment, which correlates an amide 1H-15N pair through the appearance of a crosspeak at the chemical shifts of the amide proton and nitrogen of a particular protein residue. Once crosspeaks in this experiment are assigned, changes in chemical shift on addition of a glycan ligand can be used to identify a binding site. These changes often arise from small perturbations in residue geometry rather than a direct effect of the ligand on chemical shift, but the effects are usually sufficiently localized to identify the binding site. Figure 30.3 shows an example of changes occurring on the interaction of a hexamer of chondroitin sulfate (CS), sulfated at the O4 position of each GalNAc residue (Chapters 3 and 17). There are actually two types of perturbations observed: gradual changes in chemical shift as ligand is added (arrows in Figure 30.3A) and the disappearance of one peak while another appears (ellipses in Figure 30.3A). These correspond to fast exchange on and off a weak binding site and slow exchange on and off a strong binding site, respectively. Perturbed residues can be mapped onto an existing structure of the protein, as shown in Figure 30.3B for the strong binding site. As with many complexes involving a sulfated GAG, positively charged residues are involved; in this case histidine residues and a lysine residue are among those showing chemical shift changes. The advantage of these experiments is that a range of ligands can be examined, even those that may fail to produce well-ordered crystals for crystallographic analyses. A limitation is that the backbone resonances of the protein need to be assigned first. Chemical shift mapping of slow and fast exchange binding sites for a 4-sulfated chondroitin sulfate (CS) hexamer on the Link module of TSG6. (A) Crosspeaks from spectra with increasing amounts of hexamer are superimposed.'
 'Such simulations can be used to predict the conformational flexibility of different domains within the chain and, when combined with recent advances in protein–GAG docking, can provide additional insights into GAG–protein interactions. Conformation of heparin oligosaccharides. (A) Glucosamine (GlcN) and glucuronic acid (GlcA) exist in the 4C1 conformation, whereas iduronic acid (IdoA) exists in equally energetic conformations designated 1C4 and 2S0. (B) Space-filling model of a heparin (more...) The discovery of multiple GAG-binding proteins led a number of investigators to examine whether there is a consensus amino acid sequence for GAG binding. In retrospect, this strategy was overly simplistic because it assumed that all GAG-binding proteins have a common evolutionary origin and would recognize the same oligosaccharide sequence within heparin or, at least, sequences that would share many common features. It is now known that the convergently evolved GAG-binding proteins interact with different oligosaccharide sequences. The binding sites in the protein always contain basic amino acids (lysine and arginine), whose positive charges presumably interact with the negatively charged sulfates and carboxylates of the GAG chains. However, the arrangement of these basic amino acids can be quite variable, consistent with the variable positioning of sulfo groups in the GAG partner. Selectivity is also a function of H-bonding and van der Waal interactions of amino acid residues with the oligosaccharide. Most proteins are formed from α-helices, β-strands, and loops. Therefore, to engage a linear GAG chain electrostatically, the positively charged amino acid residues must align along the same side of the protein segment. α-Helices have periodicities of 3.4 residues per turn, which would require the basic residues to occur every third or fourth position along the helix to align with an oligosaccharide. In β-strands, the amino acid side chains alternate sides every other residue.']","The conformational flexibility in IdoA residues likely allows orientation of the sulfate groups in HS to maximize the binding affinity to proteins. This flexibility enables the IdoA residues to adopt a mixture of 1C4 and 2S0 conformations in solution, which may play a crucial role in optimizing the binding affinity of HS to proteins by allowing for varied orientations of the sulfate groups.","Structural elements that dictate preferences for one form over the other, including the possible effects from the sulfated monosaccharide sequences around the IdoA/IdoA2S residue, are subject to further investigation. A second factor contributing to structural diversity and selective interactions with certain HS-binding proteins is the size of the sulfated saccharide domains. HS isolated from natural sources shows domain-like structures, with clusters of six to eight saccharides forming the highly sulfated domains known as S-domains. These regions are separated by nonsulfated saccharide residues, consisting of GlcA-GlcNAc RUs, known as NAc-domains. The S-domains contain primarily IdoA residues that likely contribute the flexibility needed to optimize binding to proteins and elicit desired biological activities.",1.0,0.7556070971272313,0.7493498655777427,0.023529411764705882,0.9999999999857143,0.6
"Complete the following paragraph: After more than three billion years of evolution, every free-living cell and every cell type within eukaryotic organisms remains covered with a dense and complex layer of glycans (Chapter 20). Even enveloped viruses that bud from infected cells carry with them the glycosylation patterns of the host. Additionally, most secreted molecules are glycosylated and extracellular matrices of multicellular organisms are rich in glycans and glycoconjugates. Matrices secreted by unicellular organisms when they congregate (e.g., bacterial biofilms [Chapter 21]) also contain glycans. Thus, evolution has repeatedly and consistently selected glycans as being the most diverse and flexible molecules to position at the interface between cells and the extracellular milieu.","['NCBI Bookshelf. A service of the National Library of Medicine, National Institutes of Health. Varki A, Cummings RD, Esko JD, et al., editors. Essentials of Glycobiology [Internet]. 4th edition. Cold Spring Harbor (NY): Cold Spring Harbor Laboratory Press; 2022.  doi: 10.1101/glycobiology.4e.4 Karen J. Colley, Ajit Varki, Robert S. Haltiwanger, and Taroh Kinoshita. This chapter provides an overview of glycosylation from the perspective of a single cell, taking into account the patterns of expression, topology, and other features of the biosynthetic and degradative enzymes that are common to most cell types. The focus is mostly on the organization of glycosylation in eukaryotic cells. Chapters 21 and 22 further address prokaryotic glycosylation mechanisms. After more than three billion years of evolution, every free-living cell and every cell type within eukaryotic organisms remains covered with a dense and complex layer of glycans (Chapter 20). Even enveloped viruses that bud from infected cells carry with them the glycosylation patterns of the host. Additionally, most secreted molecules are glycosylated and extracellular matrices of multicellular organisms are rich in glycans and glycoconjugates. Matrices secreted by unicellular organisms when they congregate (e.g., bacterial biofilms [Chapter 21]) also contain glycans. Thus, evolution has repeatedly and consistently selected glycans as being the most diverse and flexible molecules to position at the interface between cells and the extracellular milieu. Possible reasons include their relative hydrophilicity, flexibility, and mobility in aqueous environments and their extreme diversity, allowing facile short-term and long-term adaptations to changing environments and pathogen regimes. In bacteria, Archaea, and fungi, glycans serve critical structural roles in the cell wall and in resisting large differences in osmolarity between cytoplasm and environment.'
 'Possible reasons include their relative hydrophilicity, flexibility, and mobility in aqueous environments and their extreme diversity, allowing facile short-term and long-term adaptations to changing environments and pathogen regimes. In bacteria, Archaea, and fungi, glycans serve critical structural roles in the cell wall and in resisting large differences in osmolarity between cytoplasm and environment. In eukaryotes, both secretory proteins and membrane proteins typically pass through an endoplasmic reticulum (ER)–Golgi pathway, the cellular system in which many major glycosylation reactions occur (see below). Most proteins in the blood plasma of animals (with the exception of albumin) are also heavily glycosylated, and the glycosylation of these and other secreted proteins may provide solubility, hydrophilicity, and negative charge, thus reducing unwanted intermolecular interactions and protecting against proteolysis. Cell-surface membrane proteins like receptors, adhesion molecules, and channels are typically glycosylated, and this modification can promote their proper folding, ensure their stability, and impact function. The classic work of George Palade indicated that most cell-surface and secreted proteins in eukaryotic cells are cotranslationally translocated into the ER where they are folded, modified, and subjected to quality control mechanisms. They then make their way via an intermediate compartment (IC) through multiple stacks of the Golgi apparatus, finally being distributed to various destinations from the trans-Golgi network (TGN). Secretory pathway proteins can be N-glycosylated, O-glycosylated, and/or modified with glycosylphosphatidylinositol (GPI) anchors, and some called proteoglycans are modified with attached glycosaminoglycan chains. The enzymes involved in each of these modification pathways are distinct. N-linked glycans and GPI anchors are preassembled before being transferred to proteins and then further modified in the ER–Golgi pathway.'
 'Importantly, glycan structures are not directly encoded in the genome. They are synthesized and modified by a network of enzymes in a template-independent manner, and glycophenotypes represent the outcome of co-expressed gene networks and nutrients. Glycans expressed by most free-living Bacteria (Eubacteria) and Archaea have relatively little in common with those of eukaryotes. They contain a much larger number of monosaccharide types and include many glycans exclusive to such microbes. In contrast, most major glycan classes in animal cells seem to be represented in some related form among other eukaryotes, and sometimes in Archaea. Figure 20.1 shows a circular depiction of the phylogeny of cellular life on earth. The rich glycan diversity encountered in the best-studied vertebrate species suggests similar diversity in other groups of organisms, and existing information points to complicated patterns. On the one hand, glycan patterns can form “trends” and characterize entire phylogenetic lineages, wherein one encounters further biochemical variation with subsets unique to certain sublineages. Conversely, many glycans show discontinuous distribution across phyla and distantly related organisms can produce surprisingly similar glycans, using either shared, ancient pathways or convergently (independently) evolved mechanisms. Circular depiction of phylogeny of cellular forms of life on earth. The lines inside the circle represent all 2.3 million species that have been named. However, biologists have genomic sequences for only ∼5% of them; as more sequences become available, (more...) The broadest base of evolutionary information concerns asparagine–N-linked glycans, a “general” glycosylation system found in all domains of life (Chapter 9). In prokaryotes, protein N-glycosylation takes place in the periplasm at the plasma membrane, whereas in eukaryotes, covalent attachment of an oligosaccharide takes place intracellularly at the endoplasmic reticulum (ER) membrane, with the protein-bound glycan being further processed in the ER and Golgi.'
 'Hosts can, however, to the degree possible, be expected to evolve glycans that are difficult for microbes to mimic, such as the vertebrate-specific sialic acid Neu5Gc (Chapter 15) and sulfated GAGs, prokaryotes do not seem to have reinvented (Chapter 17). Because microorganisms and parasites that bind glycans evolve in parallel with their multicellular hosts, they must adapt their glycan-binding “repertoire” to any change in glycan structure presented by the host. At the same time, each of these microorganisms is itself host to its own suite of parasites (phages), known to exploit the cell surface glycans of microbes in order to infect these. Host populations (multicellular organisms infected by microbes or microbes infected by phages) may evolve new modifications of the structures targeted by their parasites, especially if the latter had meanwhile evolved a vital function elsewhere within the organism. This would constrain the preservation of the underlying scaffolding on which the latest modification was placed, while adding yet another layer of complexity to host glycans. Such cycles of evolutionary interaction between (nested sets of) microbes and hosts might explain some of the complex and extended sugar chains found in multicellular organisms, especially in areas of frequent microbial contact, such as in secreted mucins on mucosal surfaces. In this manner, “junk” glycans (i.e., glycans without current adaptive value) could accumulate, akin to “junk” DNA. An important distinction is that much of the junk DNA consists of selfish DNA elements capable of replicating, whereas glycans cannot encode additional copies of themselves, given that their synthesis relies on the activity of a coordinated network of gene products. Although such structures may still function as structural scaffolding, they may have no other specific role in a particular cell type at that particular time in evolution. They would, of course, provide fodder for future evolutionary selection, either for new organism-intrinsic functions or selective responses to a new pathogen. Additionally, neutral drift (which is now acknowledged as a major process in evolution) may explain some of the apparent “junk” glycans.'
 'Host lectins may also be “hijacked” by glycans on viral surface glycoproteins. For example, Sialoadhesin (Siglec-1; Chapter 15) is used by the heavily sialylated porcine reproductive and respiratory syndrome virus (PRRSV) to gain entry into macrophages. Viral protein sequence can also influence host glycosylation (e.g., by structural constraints on access for glycosyltransferases or hydrolases), in a manner that favors viral antigenicity, such as the high-mannose N-glycans on HIV-1 envelope gp120 trimers. Despite the enormous potential for structural diversity, a rather limited subset of all possible monosaccharides and their possible linkages and modifications are found in eukaryotic cells. Why one encounters only such a limited subset of the possible glycan structures is a puzzling question. Could there be trade-offs between the variety of glycan structures and the additional resources, such as energy and biosynthetic pathways, that cells/organisms need in order to maintain that variety? Or maybe the variety of structures is limited by a combination of positive and negative selection due to both, its intrinsic functions and interactions with symbionts and pathogens? Regardless, this limited subset has allowed better elucidation of structures of eukaryotic glycans. In contrast, Bacteria and Archaea have had several billion additional years to respond to selective pressure from pathogens; in particular, phages. These organisms also have short generation times and can exchange genetic material across vast phylogenetic distances via plasmid-mediated horizontal gene flow. Glycosylation in Bacteria and Archaea is far more diverse, both in terms of the range of monosaccharides used or synthesized, and in the types of linkages and modifications (Chapters 21 and 22). In addition, prokaryotic cell–cell interactions both within and between species are often mediated by glycans. However, most work to date has focused on the glycans of pathogens, and we may have barely scratched the surface of prokaryotic glycan diversity.'
 'There are scattered reports of glycosylation in unexpected locations—for example, gangliosides in mitochondria and GAGs and N-glycans in the nucleus. Many of these claims are based on incomplete evidence (Chapter 18). One possibility is that there are indeed glycans in these unexpected locations, but that their true structures are novel. Conversely, although structural evidence might be strong, there may be inadequate evidence to be certain about the topology of the claimed structures. Regardless, past experience tells us that the cell biology of glycosylation can hold many surprises, and dogmatic positions about such controversial issues are not warranted. Like all components of living cells, glycans constantly turn over. Some glycoconjugates, such as transmembrane heparan sulfate proteoglycans, turn over by shedding from the cell surface through limited proteolysis. Most glycoconjugate turnover occurs by endocytosis and subsequent degradation in lysosomes (Chapter 44). Endoglycosidases can initially cleave glycans internally, producing substrates for exoglycosidases in the lysosome. Once broken down, individual monosaccharides are then typically exported from the lysosome into the cytoplasm, so that they can be reused (Figure 1.8, Chapter 1). In contrast to the relatively slow turnover of glycans derived from the ER–Golgi pathway, glycans of the nucleus and cytoplasm may be more dynamic and rapidly turned over (Chapters 18 and 19). Glycans in bacterial cells (especially those in the cell wall) also turn over during cell division when the cell wall undergoes cleavage and remodeling. The authors acknowledge contributions to previous versions of this chapter by Jeffrey D. Esko and appreciate helpful comments and suggestions from James H. Prestegard.'
 'The connections between nutrient state, UDP-GlcNAc levels, and O-GlcNAcylation mean that gene regulation has an important metabolic dimension. Conserved homologs of the responsible O-GlcNAc transferase have been found in many eukaryotic taxa and in a wide range of bacteria. An independent clade of enzymes evidently originating in bacteria mediates O-fucosylation instead of O-GlcNAcylation in plants and numerous protists (Chapter 18). Most interestingly, in some animal pathogenic members of Pasteurellaceae and Enterobacteriaceae, homologs of the O-GlcNAc transferase catalyze a cytoplasmic N-glycosylation within N-X-S/T sequons of adhesins. Molecular mimicry of eukaryotic N-glycoproteins might be the driving force for this convergent evolution of an N-glycosylation system. Surprisingly, O-GlcNAcylation is apparently absent in yeast. However, nucleocytoplasmic yeast proteins can carry O-mannose in the same conserved regions that are modified with O-GlcNAc in mammals, suggesting that a cytoplasmic O-mannosylation evolved in yeast by convergent evolution to function similarly to O-GlcNAcylation. The most abundant biopolymers in nature include secreted polysaccharides such as cellulose, hemicellulose, chitin, and glycosaminoglycans. These large, chemically stable molecules provide crucial structural support for capsules, cell walls, exoskeletons, and extracellular matrices of countless organisms. The repeated β1-4 glycosidic linkages of cellulose and chitin also represent chemically extremely resistant sequestrations of accumulated glycans, given the inability of most organisms to hydrolyze these robust linkages. Compared to other types of glycans, structural polysaccharides show relatively little variation in evolution, which may indicate a more stringent selection for chemical and mechanical properties required for their functions.']","Glycans have been chosen by evolution as the most diverse and flexible molecules to position at the interface between cells and the extracellular milieu. This selection is evident in the dense and complex layer of glycans covering every free-living cell and cell type within eukaryotic organisms, as well as in the glycosylation patterns carried by enveloped viruses. Furthermore, the glycosylation of most secreted molecules and the presence of glycans in extracellular matrices of multicellular organisms and matrices secreted by unicellular organisms in bacterial biofilms highlight the ubiquity and versatility of glycans in biological systems.","Possible reasons include their relative hydrophilicity, flexibility, and mobility in aqueous environments and their extreme diversity, allowing facile short-term and long-term adaptations to changing environments and pathogen regimes. In bacteria, Archaea, and fungi, glycans serve critical structural roles in the cell wall and in resisting large differences in osmolarity between cytoplasm and environment. In eukaryotes, both secretory proteins and membrane proteins typically pass through an endoplasmic reticulum (ER)–Golgi pathway, the cellular system in which many major glycosylation reactions occur (see below). Most proteins in the blood plasma of animals (with the exception of albumin) are also heavily glycosylated, and the glycosylation of these and other secreted proteins may provide solubility, hydrophilicity, and negative charge, thus reducing unwanted intermolecular interactions and protecting against proteolysis. Cell-surface membrane proteins like receptors, adhesion molecules, and channels are typically glycosylated, and this modification can promote their proper folding, ensure their stability, and impact function.",1.0,0.7929704867942438,0.7602473216304008,0.056179775280898875,0.9999999999857143,1.0
"Complete the following paragraph: In eukaryotic cells, glycosylation occurs mostly in the endoplasmic reticulum (ER) and Golgi apparatus, whereas monosaccharide activation and interconversions occur mostly in the cytoplasm. Nucleotide sugar–specific transporters carry activated sugar donors into the Golgi and to a lesser extent into the ER. In some cases, nucleotide sugars are used to synthesize activated lipid-linked intermediates before glycan transfer. This chapter describes how cells accomplish these tasks, with an emphasis on animal cells.","['NCBI Bookshelf. A service of the National Library of Medicine, National Institutes of Health. Varki A, Cummings RD, Esko JD, et al., editors. Essentials of Glycobiology [Internet]. 4th edition. Cold Spring Harbor (NY): Cold Spring Harbor Laboratory Press; 2022.  doi: 10.1101/glycobiology.4e.5 Hudson H. Freeze, Michael Boyce, Natasha E. Zachara, Gerald W. Hart, and Ronald L. Schnaar. In nature, most glycans are synthesized by glycosyltransferases, enzymes that transfer activated forms of monosaccharides from nucleotide sugars and lipid-linked sugar intermediates to acceptors, including proteins, lipids, and growing glycan chains. Monosaccharide precursors are imported into the cell, salvaged from degraded glycans, or created enzymatically from other sugars within the cell. In eukaryotic cells, glycosylation occurs mostly in the endoplasmic reticulum (ER) and Golgi apparatus, whereas monosaccharide activation and interconversions occur mostly in the cytoplasm. Nucleotide sugar–specific transporters carry activated sugar donors into the Golgi and to a lesser extent into the ER. In some cases, nucleotide sugars are used to synthesize activated lipid-linked intermediates before glycan transfer. This chapter describes how cells accomplish these tasks, with an emphasis on animal cells. Glucose and fructose are the major carbon and energy sources for organisms as diverse as yeast and humans. Most organisms can synthesize the other monosaccharides needed for glycan biosynthesis from these sources. Not all of these biosynthetic pathways are equally active in all types of cells. However, there are some general principles. Monosaccharides must be activated to a high-energy donor for use in glycan synthesis. This process requires nucleoside triphosphates (typically UTP or GTP) and a glycosyl-1-P (monosaccharide with a phosphate at the anomeric carbon).'
 'This point illustrates that functional, biochemical analyses are essential; genetic homology is insufficient to infer specificity. Moreover, not all of the potential transport-like genes have been assigned specific physiological substrates. Theoretically, glycosylation may be controlled in part by regulating the availability of nucleotide sugars within the Golgi, presumably by regulating the transporters. The subcompartmental location (cis, medial, trans) of the transporters in the Golgi is not known nor are the physical relationships of the transporters to the various glycosyltransferases they service. Clearly, a functional Golgi compartment requires both the nucleotide sugar donor and the acceptor with a colocalized transferase. There have been few studies on how the actual glycosylation reactions occur within the Golgi. Is it more like solution chemistry or like solid-state transfers? Are there really “soluble pools” of nucleotide sugars? Dramatic time-lapse videos of green fluorescent protein (GFP)-tagged glycosyltransferases show that the proteins are highly mobile within the Golgi, but there is also physical evidence for multiglycosyltransferase complexes involved in the biosynthesis of N-linked glycans, glycosphingolipids, and heparan sulfate. Many transporters appear to function as homodimers, and the GDP-Man transporter in Saccharomyces cerevisiae (VRG4) oligomerizes in the ER and appears to be transported to the Golgi by an active process. Also, synthesis of galactosylceramide occurs in the ER and a portion of the UDP-Gal transporter binds specifically to galactosylceramide synthase and is retained in the ER to provide donor substrate (Chapter 11). The discovery of protein O-GlcNAcylation, as well as the enzymes that cycle O-GlcNAc, in mitochondria suggests the presence of nucleotide sugar transporters that bridge the outer and inner mitochondrial membranes to the cytosol. Recent data suggest that a pyrimidine nucleotide carrier is an effective transporter of UDP-GlcNAc.'
 'However, there are some general principles. Monosaccharides must be activated to a high-energy donor for use in glycan synthesis. This process requires nucleoside triphosphates (typically UTP or GTP) and a glycosyl-1-P (monosaccharide with a phosphate at the anomeric carbon). They can be activated by a kinase (reaction 1) or generated from a previously synthesized activated nucleotide sugar (reactions 2 and 3):    The most common nucleotide sugar donors in animal cells are shown in Table 5.1. Sialic acids and their evolutionary ancestors (prokaryotic nonulosonic acids and Kdo) are the only monosaccharides in animals activated as CMP-mononucleotides. Iduronic acid does not have a nucleotide sugar parent because it is formed by epimerization of glucuronic acid after it is incorporated into glycosaminoglycan (GAG) chains. In some instances, one nucleotide sugar can be formed from another either by direct epimerization (reaction 2 above) or by a nucleotide exchange reaction (reaction 3 above). For example, UDP-Gal is made from UDP-Glc by exchange of Gal-1-P for Glc-1-P. Activated sugar donors in animal cells  Three types of sugar transporters carry sugars across the plasma membrane into cells. First are energy-independent facilitated diffusion transporters, such as the glucose transporter (GLUT) family of hexose transporters found in yeast and most mammalian cells. The genes encoding these proteins are named SLC2A (solute carriers 2A). Second are energy-dependent transporters—for example, the sodium-dependent glucose transporters (SGLT; gene names SLC5A) in intestinal and kidney epithelial cells. The third type includes transporters that couple ATP-dependent phosphorylation with sugar import. These are found in bacteria (Chapter 21) and are not covered in this chapter. GLUT family transporters were first described in yeast, where at least 18 genes are known. Humans have 14 GLUT homologs.'
 'This transport mechanism was determined biochemically in isolated vesicles and genetically in various mutant cell lines. The Km of the transporters ranges from 1 to 10 µm. Using in vitro systems, the transporters have been shown to increase the concentration of the nucleotide sugars within the Golgi lumen by 10- to 50-fold. This is usually sufficient to reach or exceed the calculated Km of glycosyltransferases that use these donors. Some known transporters for nucleotide sugars, PAPS (3′-phosphoadenosine-5′-phosphosulfate), and ATP are located in the Golgi membranes of mammals, yeast, protozoa, and plants. These proteins are antiporters and return the corresponding (more...) Most of these antiporters are found in the Golgi, but some are also found in the ER. They are organelle-specific and their location usually corresponds to the location of the relevant glycosyltransferases (Table 5.2; Figure 5.4). Nucleotide sugar import into the Golgi is not energy-dependent nor affected by ionophores. However, the import is competitively inhibited by the corresponding nucleoside monophosphates and diphosphates in the cytosol but not by the monosaccharides. There are also transporters for ATP and PAPS (3′-phosphoadenosine-5′-phosphosulfate), which are used for carbohydrate and protein sulfation. Nucleotide transport in Golgi and ER  The glucuronidation of bile and xenobiotic compounds in the ER explains the need for UDP-GlcA transporter in the ER of liver cells. The presence of a Golgi transporter is consistent with the location of the glycosyltransferases that use UDP-GlcA for the formation of GAG chains and other classes of glycans. The observation that reglycosylation of misfolded glycoproteins occurs in the ER (Chapter 39) explains the need for an ER UDP-Glc transporter.'
 'Here, TDP-glucose is dehydrated to 3-keto-6-deoxyglucose and the amino group is added via a transamination reaction, probably involving a vitamin B6-dependent reaction. Plants and bacteria also contain a number of branched-chain sugars. For instance, apiose is a component of the polysaccharide apiogalacturonan of L. minor, and strepose is a component of the antibiotic streptomycin, produced by Streptomyces griseus. Apiose (Figure 5.2) is synthesized from UDP-GlcA via a 4-keto intermediate that can yield UDP-Xyl or UDP-apiose. Apiose synthesis removes carbon 3 from the chain to give the branched sugar by an unknown mechanism. Although the syntheses of other branched-chain sugars have not been delineated, they probably follow similar reaction pathways. In eukaryotes, nucleotide sugars are synthesized in the cytoplasm or nucleus, whereas most glycosylation occurs inside the ER or Golgi compartments (exceptions being hyaluronan [Chapter 16] and nucleocytoplasmic glycosylation [Chapters 18 and 19]). Therefore, newly synthesized nucleotide sugars are on the “wrong” side of the membrane for most glycosylation reactions and so must be transported into the ER and Golgi. Negative charge prevents these donors from simply diffusing into these compartments. To overcome this hurdle, eukaryotic cells have a set of energy-independent nucleotide sugar antiporters that deliver nucleotide sugars into the lumen of these organelles, with the simultaneous exiting of nucleoside monophosphates, most of which must first be generated from the nucleoside diphosphates by a nucleoside diphosphatase (Figure 5.4). This transport mechanism was determined biochemically in isolated vesicles and genetically in various mutant cell lines. The Km of the transporters ranges from 1 to 10 µm.'
 'M6PRs transport lysosomal hydrolases to an acidified compartment which ultimately fuses with the lysosome. The details of this trafficking pathway are presented in Chapter 33. The glycosyltransferases in the ER are mainly multitransmembrane proteins woven into the ER membrane. In contrast, the glycosyltransferases in Golgi compartments are generally type II membrane proteins with a small cytoplasmic amino-terminal domain, a single transmembrane domain, and a large lumenal domain that includes an elongated stem region extending from the membrane, and a globular catalytic domain (Chapter 6). The stem region is often cleaved by signal peptide peptidase-like proteases, particularly SPPL-3, releasing the catalytic domain into the lumen of the Golgi and allowing its secretion. Thus, extracellular soluble forms of many glycosyltransferases exist in tissues and sera and may function as transferases if nucleotide sugars are present extracellularly. Nucleotide sugars are synthesized in the cytoplasm, except for CMP-sialic acids, which are synthesized in the nucleus (Chapter 5). They are subsequently concentrated in the appropriate compartment following transport across the membrane by specialized nucleotide sugar transporters that translocate CMP-Sia, UDP-Gal, UDP-Glc, UDP-GlcNAc, GDP-Fuc, and other nucleotide sugars. A few of these transporters can transport more than one nucleotide sugar. Each transporter is a multitransmembrane protein that usually contains 10 membrane-spanning domains. Some CMP-sialic acids can be further modified within the lumen of the Golgi by O-acetyl groups before transfer to a glycan acceptor (Chapter 15). Glycoproteins usually have a range of different N-glycans on a particular Asn-X-Ser/Thr N-glycosylation sequon, leading to glycan heterogeneity at each site.'
 'N-glycans are partially assembled on lipid donors on the cytoplasmic face of the ER and then flipped across the membrane where the oligosaccharide assembly is completed and transfer to the nascent protein occurs. This oligosaccharide is then trimmed and extended by the addition of one monosaccharide at a time as the protein passes through the ER and the Golgi. These glycosylation reactions use activated forms of monosaccharides (nucleotide sugars; Chapter 5) as donors for reactions that are catalyzed by glycosyltransferases (for details about their biochemistry, molecular genetics, and cell biology, see Chapters 4, 6, and 8). The nucleotide sugar donors are synthesized within the cytosolic or nuclear compartment from monosaccharide precursors of endogenous or exogenous origin and then actively transported across a membrane bilayer into the lumen of the ER and Golgi compartments (Chapter 5). Notably, the portion of the glycoconjugate that faces the inside of these compartments will ultimately face the outside of the cell or the inside of a secretory granule or lysosome and will be topologically unexposed to the cytosol. The biosynthetic enzymes (glycosyltransferases, sulfotransferases, etc.) responsible for catalyzing these reactions are well studied (Chapter 6), and their location has helped to define various functional compartments of the ER–Golgi pathway. A classical model envisioned that these enzymes are physically lined up along this pathway in the precise sequence in which they actually work. This model appears to be oversimplified, as there is considerable overlap in the distribution of these enzymes, and the actual distribution of a given enzyme depends on the cell type. All topological considerations mentioned above are reversed with regard to nuclear and cytoplasmic glycosylation, because the active sites of the relevant glycosyltransferases face the cytosol, which is in direct communication with the interior of the nucleus.']","Cells in eukaryotic organisms primarily carry out glycosylation processes in the endoplasmic reticulum (ER) and Golgi apparatus, while monosaccharide activation and interconversions predominantly take place in the cytoplasm. Specialized nucleotide sugar transporters facilitate the transfer of activated sugar donors into the Golgi and, to a lesser extent, into the ER. Additionally, in certain instances, nucleotide sugars are utilized to generate activated lipid-linked intermediates prior to glycan transfer. This chapter delves into the mechanisms through which cells achieve these functions, focusing particularly on animal cells.","Glucose and fructose are the major carbon and energy sources for organisms as diverse as yeast and humans. Most organisms can synthesize the other monosaccharides needed for glycan biosynthesis from these sources. Not all of these biosynthetic pathways are equally active in all types of cells. However, there are some general principles. Monosaccharides must be activated to a high-energy donor for use in glycan synthesis. This process requires nucleoside triphosphates (typically UTP or GTP) and a glycosyl-1-P (monosaccharide with a phosphate at the anomeric carbon). They can be activated by a kinase (reaction 1) or generated from a previously synthesized activated nucleotide sugar (reactions 2 and 3)",0.8571428571428571,0.6905356573002233,0.6720856385664213,0.021052631578947368,0.9150793650641138,0.8333333333333334
"Complete the following paragraph: The biosynthesis of glycans is primarily determined by glycosyltransferases that assemble monosaccharide moieties into linear and branched glycan chains. As might be expected from the complex array of glycan structures found in nature, glycosyltransferases constitute a very large family of enzymes.","['NCBI Bookshelf. A service of the National Library of Medicine, National Institutes of Health. Varki A, Cummings RD, Esko JD, et al., editors. Essentials of Glycobiology [Internet]. 4th edition. Cold Spring Harbor (NY): Cold Spring Harbor Laboratory Press; 2022.  doi: 10.1101/glycobiology.4e.6 James M. Rini, Kelley W. Moremen, Benjamin G. Davis, and Jeffrey D. Esko. Glycosyltransferases and glycosidases are responsible for the assembly, processing, and turnover of glycans. In addition, there are a number of transferases that modify glycans by the addition of acetyl, methyl, phosphate, sulfate, and other groups. This chapter covers the general characteristics of enzymes involved in glycan initiation, assembly, and processing, including aspects of substrate specificity, primary sequence relationships, structures, and enzyme mechanisms. The biosynthesis of glycans is primarily determined by glycosyltransferases that assemble monosaccharide moieties into linear and branched glycan chains. As might be expected from the complex array of glycan structures found in nature, glycosyltransferases constitute a very large family of enzymes. In many cases, they catalyze a group-transfer reaction in which the monosaccharide moiety of a simple nucleotide sugar donor (electrophile) substrate (e.g., UDP-Gal, GDP-Fuc, or CMP-Sia; Chapter 5) is transferred to the acceptor (nucleophile) substrate. In some instances, the donor substrates contain a lipid moiety, such as dolichol-phosphate, linked to mannose or glucose. For other glycosyltransferases, the donor substrate is dolichol-pyrophosphate, linked to an oligosaccharide, and in these cases the entire oligosaccharide is transferred en bloc to the acceptor substrate (Chapter 9).'
 'For other glycosyltransferases, the donor substrate is dolichol-pyrophosphate, linked to an oligosaccharide, and in these cases the entire oligosaccharide is transferred en bloc to the acceptor substrate (Chapter 9). Similarly, other lipid-linked sugars serve as donor substrates for bacterial glycosyltransferases involved in the assembly of peptidoglycan (e.g., GlcNAc-MurNAc(pentapeptide)-undecaprenyl pyrophosphate), lipopolysaccharide, and capsules (Chapters 21 and 22). Glycosyltransferases that use monosaccharides, oligosaccharides, proteins, lipids, small organic molecules, and DNA as acceptor substrates have been characterized (activity to RNA has also been suggested), but only glycosyltransferases involved in the biosynthesis of glycoproteins, proteoglycans, and glycolipids are discussed in this chapter. Among these enzymes, the vast majority is responsible for elongating the glycan moieties of these glycoconjugates; the remainder is responsible for the transfer of either a mono- or oligosaccharide directly to the polypeptide or lipid. Generally speaking, the enzymes that elongate glycans act sequentially so that the product of one enzyme yields a preferred acceptor substrate for the subsequent action of another. The end result is a linear and/or branched structure composed of monosaccharides linked to one another. Acceptor recognition by these glycan-elongating glycosyltransferases does not typically involve the polypeptide or lipid moiety of the acceptor substrate when it exists, although there are several notable exceptions as discussed below. Glycosidases that remove monosaccharides to form intermediates that are then acted on by glycosyltransferases also play a role in the biosynthesis of some glycan types. These are to be contrasted with glycosidases that are involved in the degradation of glycans (e.g., in lysosomes [Chapter 44]).'
 'However, the examples described above are all exceptions to the generally strict donor, acceptor, and linkage specificity shown by most glycosyltransferases, a property that serves to define and limit the number and type of glycan structures observed in a given cell type or organism. The glycosyltransferases that transfer monosaccharides or oligosaccharides directly to polypeptide or lipid moieties also show a high degree of substrate specificity and this will be discussed in more detail below for those involving polypeptide. Glycosyltransferases that initiate the synthesis of glycosphingolipids transfer a monosaccharide moiety to what was originally a serine residue in the ceramide lipid precursor of sphingolipids (see Chapter 11). Because different glycolipids have different ceramide moieties, it appears that some glycosyltransferases, such as the sialyltransferases, differentially recognize their substrates based on the nature of the ceramide moiety. The glycosyltransferases that transfer sugar directly to the polypeptide chain of a protein or glycoprotein recognize their acceptor substrates in a number of different ways. All eukaryotic N-glycans are initiated by oligosaccharyltransferase (OST), generally an ER-resident multisubunit enzyme that transfers en bloc Glc3Man9GlcNAc2 to the side chain of asparagine residues in the sequence motif Asn-X-Ser/Thr (where X can be any amino acid except proline; Chapter 9). In contrast, the polypeptide GalNAc transferases, responsible for the initiation of mucin-type O-glycans, act after the protein has been folded and transported to the Golgi (Chapter 10). The polypeptide O-GalNAc transferases do not recognize a specific sequence motif and in general, they transfer N-acetyllgalactosamine to the side chain hydroxyl group of serine and threonine residues found in relatively unstructured regions of the folded protein.'
 'NCBI Bookshelf. A service of the National Library of Medicine, National Institutes of Health. Varki A, Cummings RD, Esko JD, et al., editors. Essentials of Glycobiology [Internet]. 4th edition. Cold Spring Harbor (NY): Cold Spring Harbor Laboratory Press; 2022.  doi: 10.1101/glycobiology.4e.54 Hermen S. Overkleeft and Peter H. Seeberger. Glycosyltransferases are the biosynthetic enzymes responsible for the construction of interglycosidic linkages and glycosidases catalyze the opposite reaction, hydrolysis of interglycosidic linkages. The diversity of natural glycans is reflected by the numerous glycosyltransferases and glycosidases encountered in nature, each exhibiting a defined substrate specificity. Natural glycans are often encountered in heterogeneous form and often produced in minute amounts making their isolation and characterization from natural sources often cumbersome. Therefore, glycobiology relies heavily on synthetic glycans, and synthetic methodology to produce glycans has witnessed tremendous progress (see Chapter 53). Glycosyltransferases and glycosidases offer advantages in the construction of glycans as these biocatalysts are very powerful under controlled conditions. This chapter summarizes recent developments in the use of (mutant) glycosidases and glycosyltransferases for the synthesis of tailored glycans, including combinations of both enzyme classes and in conjunction with chemically synthesized intermediates are presented. The mechanism of action of glycosyltransferases resembles the way an interglycosidic linkage is installed by chemical synthesis (Chapter 53). An activated donor saccharide, represented by UDP-glucose (Figure 54.1) is condensed with an acceptor moiety (here, ceramide) to give, after expulsion of the leaving group (here, UDP), the glycoconjugate (glucosylceramide). In contrast to chemical synthesis, the regioselectivity is regulated by the enzyme active site that also selects for the donor and the acceptor.'
 'Glycosidases that remove monosaccharides to form intermediates that are then acted on by glycosyltransferases also play a role in the biosynthesis of some glycan types. These are to be contrasted with glycosidases that are involved in the degradation of glycans (e.g., in lysosomes [Chapter 44]). In addition, glycans can be modified by many other enzyme types, including sulfotransferases, phosphotransferases, O-acetyltransferases, O-methyltransferases, pyruvyltransferases, and phosphoethanolamine transferases. Most glycosyltransferases show a high degree of specificity for both their donor and acceptor substrates, and this led Saul Roseman and coworkers to advance the “one enzyme–one linkage” hypothesis. The human B blood group α1-3 galactosyltransferase exemplifies this concept. This enzyme catalyzes a glycosylation reaction in which galactose is added in α-linkage to the C-3 hydroxyl group of a galactose residue on the acceptor substrate (Figure 6.1). However, the enzyme only acts on galactose modified by fucose in α1-2-linkage and prior modification by other monosaccharides, such as α2-6-linked sialic acid, yields a glycan that is not a substrate (Figure 6.1). The strict acceptor substrate specificity of glycosyltransferases is illustrated by the human B blood group α1-3 galactosyltransferase. The B transferase adds galactose in α1-3-linkage to the H antigen (top middle) to form the B antigen (more...) We now know that there are instances in which more than one glycosyltransferase can use the same acceptor to make the same linkage. The human fucosyltransferases III–VII, for example, all attach fucose in α1-3-linkage to N-acetyllactosamine moieties on glycans (Chapter 14).'
 'The subcellular localization, activity levels, and substrate specificities of glycosyltransferases involved in the assembly of O-GalNAc glycans play a critical role in determining the range of O-glycans synthesized by a cell (Table 10.2 and Figures 10.2 and 10.3). The glycosyltransferases that are involved in the assembly of O-GalNAc glycans are listed in Table 10.2. However, other enzymes that contribute to the synthesis of N-glycans and glycolipids also act on O-glycans, and some of these prefer O-glycans as acceptor substrates (Chapter 14). In vitro assays have shown that the activities of glycosyltransferases are controlled by factors such as metal ions and pH. Biosynthesis of core 1 and 2 O-GalNAc glycans as described in the text. Green lines are protein.  Glycosyltransferases that synthesize O-GalNAc glycans  The first and essential step of O-GalNAc glycosylation is the addition of GalNAc in α-linkage to Ser or Thr by a polypeptide GalNAc-transferase (ppGalNAcT; GALNT) (Table 10.2; Figure 10.2). Humans have 20 genes encoding GALNTs. The large number of GALNTs provides redundancy and also reflects differences in substrate specificity. Studies in the fly indicate that certain GALNTs (PGANTs in the fly) are required for normal development (Chapter 26). Deletion of single GALNTs in mammals results in organ and cell differentiation defects. The GALNTs are found throughout the animal kingdom but not in bacteria, yeast, or plants. All GALNTs are classified in the GT27 CaZy family with a GT-A fold (Chapter 8), and most have a lectin (ricin-like) domain at the carboxyl terminus, which is unique among glycosyltransferases.'
 'The use of glycosidases in this way is particularly important in the biosynthesis of N-glycan-containing glycoproteins in more evolutionarily advanced eukaryotes and is thought to be associated with the acquisition of complex N-glycans during the evolution of multicellular organisms. In this case, the nascent glycoprotein glycan, Glc3Man9GlcNAc2-Asn, is trimmed by glucosidases and mannosidases in the ER and Golgi to generate substrates for the glycosyltransferases that lead to elaborated complex and hybrid-type N-glycans (Chapter 9). Glucosidase II, one of the two ER-resident glucosidases involved, also works in conjunction with UGGT during glycoprotein folding to allow repeated deglucosylation/reglucosylation during what has been termed the calnexin/calreticulin quality control cycle (Chapter 39). An interplay between glycosylation and deglycosylation is also found to occur with the O-GlcNAc moiety that appears in many nuclear and cytoplasmic proteins (transferred by O-GlcNAc transferase; Chapter 19). In this case, removal of the N-acetylglucosamine moiety by the glycosidase, O-GlcNAcase, provides a means of dynamically regulating the extent of O-GlcNAcylation and the diverse processes that it mediates. Glycosyltransferases catalyze their reactions with either inversion or retention of stereochemistry at the anomeric carbon atom of the donor substrate (Figure 6.5). For example, β1-4 galactosyltransferase, an inverting glycosyltransferase, transfers galactose from UDP-α-Gal to generate a β1-4-linked galactose-containing product.']","In many cases, glycosyltransferases catalyze a group-transfer reaction in which the monosaccharide moiety of a simple nucleotide sugar donor substrate is transferred to the acceptor substrate. Some glycosyltransferases use lipid-linked sugars as donor substrates, while others transfer sugars directly to polypeptides or lipids. The strict donor, acceptor, and linkage specificity exhibited by most glycosyltransferases defines and limits the number and type of glycan structures observed in cells or organisms.","In many cases, they catalyze a group-transfer reaction in which the monosaccharide moiety of a simple nucleotide sugar donor (electrophile) substrate (e.g., UDP-Gal, GDP-Fuc, or CMP-Sia; Chapter 5) is transferred to the acceptor (nucleophile) substrate. In some instances, the donor substrates contain a lipid moiety, such as dolichol-phosphate, linked to mannose or glucose. For other glycosyltransferases, the donor substrate is dolichol-pyrophosphate, linked to an oligosaccharide, and in these cases the entire oligosaccharide is transferred en bloc to the acceptor substrate (Chapter 9). Similarly, other lipid-linked sugars serve as donor substrates for bacterial glycosyltransferases involved in the assembly of peptidoglycan (e.g., GlcNAc-MurNAc(pentapeptide)-undecaprenyl pyrophosphate), lipopolysaccharide, and capsules (Chapters 21 and 22). Glycosyltransferases that use monosaccharides, oligosaccharides, proteins, lipids, small organic molecules, and DNA as acceptor substrates have been characterized (activity to RNA has also been suggested), but only glycosyltransferases involved in the biosynthesis of glycoproteins, proteoglycans, and glycolipids are discussed in this chapter.",1.0,0.563374501608755,0.8952386614725134,0.02531645569620253,0.9999999999857143,1.0
"Complete the following paragraph: Over the years, many theories have been advanced regarding biological roles of glycans. Although there is evidence to support all the theories, exceptions to each one can also be found. This should not be surprising, given the abundance and enormous diversity of glycans in nature. Complexities also arise because glycans are frequently bound by microbes and microbial toxins, making them a liability to the organism that synthesizes them. Biological functions of glycans can be divided into three broad categories:","['Although there is evidence to support all the theories, exceptions to each one can also be found. This should not be surprising, given the abundance and enormous diversity of glycans in nature. Complexities also arise because glycans are frequently bound by microbes and microbial toxins, making them a liability to the organism that synthesizes them. Biological functions of glycans can be divided into three broad categories: (1) structural contributions (e.g., extracellular scaffolds: cell walls and extracellular matrices, protein folding and function); (2) energy metabolism (e.g., carbohydrates as carbon sources for storage and manipulation of animal behavior: pollination and seed dispersal); and (3) information carriers (e.g., molecular patterns recognized by glycan binding proteins [GBPs]) (Figure 7.1). The GBPs can be subdivided into two groups: (1) intrinsic GBPs, which recognize glycans from the same organism and (2) extrinsic GBPs, which recognize glycans from another organism. Intrinsic GBPs typically mediate cell–cell interactions or recognize extracellular molecules, but they can also recognize glycans on the glycocalyx of same cell. Extrinsic GBPs comprise pathogenic microbial adhesins, agglutinins, or toxins, which evolved for host colonization or invasion, but also include proteins that mediate symbiotic relationships or host defense directed at microbial glycans. Intrinsic and extrinsic glycan recognition can also act as opposing selective forces, simultaneously constraining and driving evolutionary change respectively (Chapter 20), likely accounting for the enormous diversity of glycans in nature. Further diversity arises because microbial pathogens also engage in “molecular mimicry,” evading immune reactions by decorating themselves with glycans typical of their hosts, and even in “glycan gimmickry,” modulating host immunity toward increased tolerance. Finally, most microbes are also themselves targets of pathogens that use microbial glycans for attachment and infection (e.g., bacteriophages that invade bacteria). General classification of the biological functions of glycans. A simplified and broad classification is presented, emphasizing the roles of organism-intrinsic and -extrinsic glycan-binding proteins in recognizing glycans.'
 'NCBI Bookshelf. A service of the National Library of Medicine, National Institutes of Health. Varki A, Cummings RD, Esko JD, et al., editors. Essentials of Glycobiology [Internet]. 4th edition. Cold Spring Harbor (NY): Cold Spring Harbor Laboratory Press; 2022.  doi: 10.1101/glycobiology.4e.7 Pascal Gagneux, Thierry Hennet, and Ajit Varki. This chapter provides an overview of the biological functions of glycans in three broad categories: structural roles in, on, and outside cells; energy metabolism, including nutrient storage and sequestration; and information carriers, that is, specific recognition—most commonly by glycan-binding proteins of intrinsic or extrinsic origin. The chapter then presents some general principles for understanding and further exploring biological functions of glycans. For details, see the sources cited and other chapters in this book. As with other major classes of macromolecules, the biological functions of glycans span the spectrum from relatively subtle to crucial for development, growth, maintenance, or survival of the organism that synthesizes them. For many glycans, specific functions are not yet evident. The same glycan may also have different functions depending on which aglycone (protein or lipid) it is attached to. Over the years, many theories have been advanced regarding biological roles of glycans. Although there is evidence to support all the theories, exceptions to each one can also be found. This should not be surprising, given the abundance and enormous diversity of glycans in nature. Complexities also arise because glycans are frequently bound by microbes and microbial toxins, making them a liability to the organism that synthesizes them.'
 'Finally, most microbes are also themselves targets of pathogens that use microbial glycans for attachment and infection (e.g., bacteriophages that invade bacteria). General classification of the biological functions of glycans. A simplified and broad classification is presented, emphasizing the roles of organism-intrinsic and -extrinsic glycan-binding proteins in recognizing glycans. There is some overlap between (more...) Other general principles emerge based on existing literature. The biological consequences of experimentally altering glycosylation in various systems seem to be highly variable and unpredictable. Also, a given glycan can have different roles in different tissues, at different times in development (organism-intrinsic functions) or in different environmental contexts (organism-extrinsic functions). As a broad generalization, it can be stated that terminal sequences, unusual structures, and modifications of glycans are more likely to mediate specific biological functions within the organism. However, such glycans or their modifications are also more likely to be targets for pathogens and toxins. Perhaps as a consequence, intra- and interspecies variations in glycosylation are relatively common, and at least some of the diversity of glycans in nature may represent signatures of past or current host–pathogen or symbiotic interactions (Chapter 20). Finally, genetic defects in glycosylation are easily obtained in cultured cells, but often have limited biological consequences in vitro. In contrast, the same defects often have major and even catastrophic consequences in whole organisms. This generalization indicates that many major functions of glycans are operative mainly within an intact, multicellular organism. Some of these principles are briefly discussed below. Experimental approaches to elucidating biological roles of glycans include prevention of initial glycosylation, prevention of glycan chain elongation, alteration of glycan processing, enzymatic or chemical deglycosylation of completed chains, genetic elimination of glycosylation sites, addition of unnatural monosaccharides, and studies of mutant and naturally occurring genetic variants in glycosylation enzymes. The consequences of such manipulations can range from being essentially undetectable, to the complete loss of particular functions, or even to loss of the entire glycoconjugate bearing the altered glycan.'
 'Like any biological system, the optimal approach carefully considers the relationship of structure and biosynthesis to function (Chapter 7). As might be imagined from their ubiquitous and complex nature, the biological roles of glycans are remarkably varied. Indeed, asking what these roles are is akin to asking the same question about proteins. Thus, all of the proposed theories regarding glycan function turn out to be partly correct, and exceptions to each can also be found. Not surprisingly for such a diverse group of molecules, the biological roles of glycans also span the spectrum from those that are subtle to those that are crucial for the development, growth, function, or survival of an organism (Chapter 7). The diverse functions ascribed to glycans can be simply divided into two general categories: (i) structural and modulatory functions (involving the glycans themselves or their modulation of the molecules to which they are attached) and (ii) specific recognition of glycans by glycan-binding proteins. Of course, any given glycan can mediate one or both types of functions. The binding proteins in turn fall into two broad groups: lectins and sulfated GAG-binding proteins (Chapters 27, 28, and 38). Such molecules can be either intrinsic to the organism that synthesized the cognate glycans (e.g., see Chapters 31–36, 38, and 39) or extrinsic (see Chapters 37 and 42 for information concerning microbial proteins that bind to specific glycans on host cells). The atomic details of these glycan–protein interactions have been elucidated in many instances (Chapters 29 and 30). Although there are exceptions to this notion, the following general theme has emerged regarding lectins: monovalent binding tends to be of relatively low affinity, and such systems typically achieve their specificity and function by achieving high avidity, via interactions of multivalent arrays of glycans with cognate lectin-binding sites.'
 'They would, of course, provide fodder for future evolutionary selection, either for new organism-intrinsic functions or selective responses to a new pathogen. Additionally, neutral drift (which is now acknowledged as a major process in evolution) may explain some of the apparent “junk” glycans. The microheterogeneity inherent in glycan synthesis processes may be producing “neutral noise,” but this noise may also contribute to evolutionary flexibility. Some functions of glycans are discovered serendipitously. In other instances, the investigator who has elucidated complete details of the structure and biosynthesis of a specific glycan is left without knowing its functions. It is necessary to design experiments that can differentiate between trivial and crucial functions mediated by each glycan. Various approaches are discussed below, emphasizing the advantages and disadvantages of each approach (also presented in schematic form in Figure 7.2). Approaches for elucidating the biological functions of glycans. The figure assumes that a specific biological role is being mediated by recognition of a certain glycan structure by a specific glycan-binding protein. Clues to this biological role could (more...) Many current approaches to understanding glycan diversity (Chapters 50 and 51) involve extraction and identification of the entire complement of glycans found in a given organ or tissue, without regard to the fact that individual cell types and even basal versus apical sides of the same cell can have widely varying glycan expression patterns. However, cell type–specific localization of glycans can be explored using highly specific GRPs (GBPs or antibodies, see Chapter 48). Once a specific glycan has been localized in an interesting biological context, it is natural to consider introducing the cognate GRP into the intact system, hoping to interfere with a specific function and generate an interpretable phenotype. Such an approach is likely to give confusing results with regard to glycan function. Some GRPs (e.g., antibodies against glycans) tend to have weak affinity and show cross-reactivity. Although some plant lectins seem very specific for animal glycans, they often originate from organisms that typically do not contain the same ligand.'
 'For example, Man-6-P-containing glycans were first found on lysosomal enzymes and are involved in lysosomal trafficking (Chapter 33). However, such glycans are now known to occur on some apparently unrelated proteins, for different functional roles. Likewise, the sialylated fucosylated lactosamines critical for selectin recognition (Chapter 34) are found in a variety of unrelated cell types in mammals, and the polySia chains that play an important part in embryonic nervous system neural cell adhesion molecule (NCAM) function (Chapter 15) are also found on a G protein–coupled receptor (GPCR) (CCR7) expressed in dendritic cells, where they appear to be important for targeting of these cells to the lymph nodes. Given that glycans are added posttranslationally, these observations should not be surprising. Once a new glycan or modification has been expressed in an organism, several distinct functions could evolve independently in different tissues and at different times in development. If any of these situations mediated a function valuable to survival and reproduction, the genetic mechanisms responsible for expression of the glycan and its expression pattern would remain conserved in evolution. A further example of dual roles is the recognition of fragments of structural glycans as danger or damage-associated molecular patterns (DAMPs) by the immune systems of multicellular organisms. Examples include cell wall fragments in plants and hyaluronan fragments in vertebrates. The core structures of major glycan classes tend to be conserved across many species; for example, the core structure of N-glycans is conserved across all eukaryotes and at least some Archaea (Chapter 9). However, there can be considerable diversity in outer-chain glycosylation, even among relatively similar species. Such interspecies variation in glycan structure indicates that some glycan sequences do not have fundamental and universal roles in all tissues and cell types in which they are expressed. Of course, such diversity could be involved in generating differences in morphology and function between species. Such variations could also reflect the outcome of differing selection pressures by exposure to variant pathogen regimes.'
 'The consequences of such manipulations can range from being essentially undetectable, to the complete loss of particular functions, or even to loss of the entire glycoconjugate bearing the altered glycan. Even within a particular class of molecules (e.g., cell-surface receptors), the effects of altering glycosylation are variable and unpredictable. Moreover, the same glycosylation change can have markedly different effects in different cell types or when studied in vivo or in vitro. The effect may depend on the structure of the glycan, the biological context (including interactions with cognate glycan receptors), GBPs, and the specific biological function. Given all of the above considerations, it is difficult to predict the functions that a given glycan on a given glycoconjugate might mediate and its relative importance to the organism. Glycans have many protective, stabilizing, organizational, and barrier functions. The glycocalyx that covers all eukaryotic cells and the polysaccharide coats of various prokaryotes represent a substantial physical barrier. Cellulose provides the material for cell walls in plants, and chitin fulfills this role in fungi. Arthropods evolved resistant chitin-rich exoskeletons. Cellulose and chitin represent the two most abundant biopolymers on the planet. In multicellular organisms, glycan constituents of matrix molecules, such as proteoglycans, are important for maintenance of tissue structure, porosity, and integrity. Such molecules can also contain binding sites for other specific glycans, which, in turn, aid overall matrix organization. The external location of glycans on most glycoproteins can provide a general shield, protecting the underlying polypeptide from recognition by proteases (mucins), blocking antibody binding (viral glycoproteins), and even (as in the case of mucins) protecting entire tissue surfaces from microbial attachment. Another structural role of glycans is their involvement in folding of newly synthesized polypeptides in the endoplasmic reticulum (ER) and/or in the subsequent maintenance of protein solubility and conformation (Chapter 39).']","structural contributions (e.g., extracellular scaffolds: cell walls and extracellular matrices, protein folding and function); energy metabolism (e.g., carbohydrates as carbon sources for storage and manipulation of animal behavior: pollination and seed dispersal); and information carriers (e.g., molecular patterns recognized by glycan binding proteins [GBPs]).","(1) structural contributions (e.g., extracellular scaffolds: cell walls and extracellular matrices, protein folding and function); (2) energy metabolism (e.g., carbohydrates as carbon sources for storage and manipulation of animal behavior: pollination and seed dispersal); and (3) information carriers (e.g., molecular patterns recognized by glycan binding proteins [GBPs])",1.0,0.7344159042217094,0.9578184844598753,0.01,0.8734126983981415,1.0
"Complete the following paragraph: The glycome comprises all the glycan structures synthesized by an organism. It is analogous to the genome, the transcriptome, and/or the proteome but even more dynamic, and it has higher structural complexity that has yet to be fully defined. Cells of different types synthesize a subset of the glycome based on their differentiation state and physiological environment.","['The systems-level analysis of all proteins expressed by cells, tissues, or organisms is known as “proteomics.” The proteome, like the transcriptome, but unlike the DNA sequence of the genome, is fundamentally dynamic. The repertoire of proteins expressed by a cell is highly dependent on tissue type, microenvironment, and stage within the life cycle. As cells receive external and internal cues in the form of growth factors, hormones, metabolites, or cell–cell interactions, the expression of various genes is modulated and may be transcribed at levels ranging from silence to more than 104 mRNA copies per cell and 107 protein molecules per cell. Thus, proteomes and their modifications vary during cell differentiation, activation, trafficking, and malignant transformation. However, no systems-level analysis of a biological process is complete without interrogating the glycome, defined as the entire complement of glycan structures (be it protein-/lipid-bound or -free) produced by cells, in addition to the genome, transcriptome, proteome, lipidome and metabolome. Vertebrates synthesize N-linked and O-linked glycoproteins, glycolipids (Chapters 11 and 12), proteoglycans, glycosaminoglycans (GAGs), and glycosylphosphatidylinositol (GPI) anchors covalently attached to proteins, as well as free oligosaccharides (Chapter 3). As with the proteome, each cell type has its own distinct glycome that is governed by local cues and the metabolic state of the cell. Other organisms have distinct glycomes; those of plants (Chapter 24) and prokaryotes (Chapter 21) are distinctly different from the vertebrate and invertebrate glycomes (Chapters 25–27). The size of any particular cellular glycome has not yet been established, but the combinatorial possibilities that can occur with numerous glycan structures on multiple glycoconjugates means that determining a “complete” glycome is not straightforward.'
 'Although human GHs are infrequently modular, those of microbes involved in plant cell-wall degradation can have more than five different modules assembled in a single polypeptide. Human acidic chitinase is an example of a mammalian modular GH having a CBM14 domain appended at the carboxyl terminus of the GH18 catalytic domain. The most intricate architecture of GHs is found in certain bacteria, such as Clostridium thermocellum, which elaborate a macromolecular complex called a “cellulosome” in which a large variety of modular plant cell-wall hydrolases are assembled together on a scaffolding protein. This strategy enables the assembly of dozens of catalytic modules simultaneously targeting the various polysaccharides that make up the plant cell wall. In summary, the genome, comprising the DNA of an organism, includes all the genes that produce the glycome, which comprises all of the glycans made by an organism. Although, within an organism, almost every cell that contains a nucleus and mitochondria has an identical genome; cells typically differ in the portion of the genome and, therefore the glycome, they express. Thus, the glycan complement of a cell depends on which genes are actively transcribed and which transcripts are translated and stably expressed. Transcription, splicing, translation, and posttranslational processing may vary depending on the state of differentiation and the physiological environment of a cell. Therefore, during development and differentiation, and under different environmental conditions, the glycan repertoire of a cell represents a subset of all the glycans that an organism is capable of making. To describe this variation, it is common to qualify the term glycome when referring to the glycans made by a particular tissue or cell type (e.g., T-cell glycome, hepatocyte glycome, or serum glycome), and to note the particular stage of development (e.g., fetal liver glycome, breast cancer serum glycome). The glycome of a given cell in an organism can undergo substantial changes in response to environmental stimuli ranging from pH and ionic strength to hormonal stimulation or inflammation.'
 'The size of any particular cellular glycome has not yet been established, but the combinatorial possibilities that can occur with numerous glycan structures on multiple glycoconjugates means that determining a “complete” glycome is not straightforward. The notion that glycans should be studied as a totality (glycomics), as well as simply one glycan or glycoconjugate at a time, developed when it became apparent that glycans form patterns on cells that change during development (Chapter 41), cancer progression (Chapter 47), infection (Chapters 42 and 43), and many other diseases (Chapters 44–46). Many glycan-binding proteins, such as lectins, are oligomerized on the cell surface and interact with multivalent arrays of glycans on the same or opposing cells (Chapters 28–38). Sometimes, multiple discrete glycans and their matching glycan-binding proteins work together to engage two cells or to deliver signals between cells. Thus, the term “glycomics” was coined to describe the many aspects of glycobiology that can be understood only with a systems-level analysis of the glycome. Clues regarding the composition and complexity of the glycome are found in the genome, transcriptome, and proteome of a cell. Thus, if a gene encoding a glycosyltransferase is not expressed (absent from the transcriptome), no glycans in that cell can carry the sugar transferred by that glycosyltransferase at that particular time. The action of many glycosyltransferases and glycoside hydrolases competing for the same substrates in the biosynthetic pathway renders the complete glycome impossible to predict with current tools and knowledge. As an example, the reduced expression of a single glycosyltransferase can perturb the biosynthesis of dozens of glycans. Furthermore, unlike the genome, the glycome is sensitive to exogenous nutrient levels and metabolic fluxes including salvage pathways.'
 ""Notably, glycans altered in a disease may reflect downstream consequences of the disease on remote organs, changes in the patient's immune system, or other effects of the disease. One major caveat is the currently unknown extent of natural variation among individual human glycomes. The glycome is known to respond to dietary and environmental changes and vary in elusive ways with age, gender, and acquired disease susceptibility (Chapter 46). Studies of evolutionary biology also have much to gain from comparative glycomics. Evolution of the vertebrate immune system, for example, was accompanied by the acquisition of new classes of glycan-binding proteins, including Siglecs (Chapter 35) and selectins (Chapter 34). Likewise, the glycomes and glycan-binding proteins of microbes and their vertebrate hosts appear to have coevolved in some instances (Chapter 42). The glycome can be determined at different levels of granularity. First, “glycomics” constructs an inventory of glycans separated from their protein or lipid scaffolds from the cell, organ, or organism of interest. This is an important starting point for any comprehensive glycome analysis. The second level of analysis defines specific glycans associated with individual proteins or lipids. Analysis of the complete repertoire of a cell's glycoconjugates, including the microheterogeneity of glycans present at individual sites of attachment, lies, for example, at the intersection of glycomics and proteomics (“glycoproteomics”) and of glycomics and lipidomics (“glycolipidomics”). A third level of complexity involves determining which glycans and/or glycoconjugates are expressed in specific cells, tissues, or secretions at specific times or conditions. This level of analysis is essential if the goal is to reveal new functions in cell–cell communication or to correlate particular glycomes with specific diseases. Of course, none of these approaches recapitulates the actual arrangement of the complex glycan forest present on the surface of cells or in extracellular matrices.""
 ""As an example, the reduced expression of a single glycosyltransferase can perturb the biosynthesis of dozens of glycans. Furthermore, unlike the genome, the glycome is sensitive to exogenous nutrient levels and metabolic fluxes including salvage pathways. Thus, variations in dietary monosaccharides, such as glucose, galactose, glucosamine, fucose, mannose, and N-glycolylneuraminic acid (Chapter 15), may change the composition of the glycome. The numerous factors that influence the glycome (the transcriptome, the proteome, environmental nutrients, the secretory machinery, pH, and many other determinants) create a glycome that is highly diverse, adaptable, and dynamic. Thus, the glycome of a cell can change dramatically over time. It is this enormous structural plasticity in response to cellular and environmental states that underlies the essential roles of glycans in development, communication, and disease processes. Because the glycome is influenced by both genetic and environmental factors, the information contained therein sheds light on intra- and interspecies variations, including providing indicators of disease that can be used for diagnosis and for monitoring the efficacy of drugs. Comparative glycomics, the comparison of glycome profiles obtained from two or more individuals, tissues, or conditions of interest, is therefore an exciting frontier in biology and medicine. For example, as discussed in detail in Chapter 47, numerous changes in the glycome have been associated with malignancy and metastasis, including altered N- and O- linked protein glycosylation, up-regulation of conjugated sialylated and fucosylated glycans, and altered GAGs. Regardless of functional consequence, a change in the glycome that is highly correlated with malignancy (or any disease) may serve as a diagnostic marker candidate. Notably, glycans altered in a disease may reflect downstream consequences of the disease on remote organs, changes in the patient's immune system, or other effects of the disease. One major caveat is the currently unknown extent of natural variation among individual human glycomes.""
 'Directed in vitro synthesis of glycans by chemical and enzymatic methods has also made great strides in recent years, providing many new tools for exploring glycobiology (Chapters 53, 54, and 57). The generation of complex glycan libraries by a variety of routes has further enhanced this interface of chemistry and biology (Chapters 53 and 54), including the generation of glycan microarrays. Analogous to genomics and proteomics, glycomics represents the systematic methodological elucidation of the “glycome” (the totality of glycan structures) of a given cell type or organism (Chapters 51 and 52). In reality, the glycome is far more complex than the genome or proteome. In addition to the vastly greater structural diversity in glycans, one is faced with the complexities of glycosylation microheterogeneity (see above) and the dynamic changes that occur in the course of development, differentiation, metabolic changes, aging, malignancy, inflammation, or infection. Added diversity arises from intraspecies and interspecies variations in glycosylation. Thus, a given cell type in a given species can manifest a large number of possible glycome states. Glycomic analysis today generally consists of extracting entire cell types, organs, or organisms; releasing all the glycan chains from their linkages; and cataloging them via approaches such as mass spectrometry. In a variation called glycoproteomics, the glycans are analyzed while still attached to protease-generated fragments of glycoproteins. The results obtained represent a spectacular improvement over what was possible a few decades ago, but they are still analogous to cutting down all the trees in a forest and cataloging them, without attention to the layout of the forest and the landscape (Chapter 15 discusses this complex issue from the perspective of just one monosaccharide class, sialic acids; see Figure 15.3).'
 'For simplicity, this section has focused primarily on vertebrate glycans. Many other classes of glycans exist in other branches of the tree of life (Chapters 21–26). Unlike protein sequences, which are primary gene products, glycan structures are not encoded directly in the genome and are secondary gene products. A few percent of known genes in the human genome are dedicated to producing the enzymes and transporters responsible for the biosynthesis and assembly of glycans (Chapter 8), typically as posttranslational modifications of proteins or by glycosylation of core lipids. The glycans themselves represent numerous combinatorial possibilities, generated by a variety of competing and sequentially acting glycosidases and glycosyltransferases (Chapter 6) and the subcompartmentalized “assembly-line” mechanisms of glycan biosynthesis in the Golgi apparatus of eukaryotes (Chapter 4). Thus, even with full knowledge of the expression levels of all relevant gene products, one cannot accurately predict the precise structures of glycans elaborated by a given cell type. Furthermore, small changes in environmental cues can cause dramatic changes in glycans produced by a given cell. It is this variable and dynamic nature of glycosylation that makes it a powerful way to generate and modulate biological diversity and complexity. Of course, it also makes glycans much more difficult to study than nucleic acids and proteins. One of the most fascinating and yet frustrating aspects of protein glycosylation is the phenomenon of microheterogeneity. Thus, at any particular glycan attachment site on a given protein synthesized by a particular cell type, a range of variations might be found in the structures of the attached glycan (and in some instances, the glycan may be missing). Effectively, a given polypeptide encoded by a single gene can exist in numerous “glycoforms,” each constituting a distinct molecular species. For some glycoproteins the microheterogeneity at a particular site may be quite limited, whereas for other sites it may be extensive, even within the same glycoprotein species.']","The glycome comprises all the glycan structures synthesized by an organism. It is analogous to the genome, the transcriptome, and the proteome but even more dynamic, and it has higher structural complexity that has yet to be fully defined. Cells of different types synthesize a subset of the glycome based on their differentiation state and physiological environment.","The human and mouse glycomes have many glycan structures in common, but a few are unique or have divergent functional properties. For example, unlike humans, rodents synthesize cytidine monophospho-N-glycolylneuraminic acid (CMP-Neu5Gc), for the transfer of Neu5Gc to N- and O-glycans (Chapter 15). Similarly, the gene encoding α-1,3-galactosyltransferase (A3GALT2) is functional in the mouse but not in human (Chapter 20). The human and fly genomes include orthologous genes encoding GTs that catalyze the same reaction, but they also have GTs that are unique. Thus, protein O-fucosyltransferase 1 (POFUT1) in mammals and Ofut1 in flies transfer fucose to Notch receptors and are examples of an evolutionarily conserved GT. In contrast, flies do not make complex N-glycans with four branches, which are common in mammalian glycoproteins (Chapters 9 and 20). Additionally, flies make unique glycolipids absent from mammals that are important for conserved signaling pathways mediated by the epidermal growth factor (EGF) receptor or Notch receptors (Chapter 26).",1.0,0.7221644822269857,0.5873307426522445,0.0125,0.9999999999833333,1.0
"Complete the following paragraph: In mammals, there are two different catalytic STT3 subunits that both associate with ribophorins I and II, OST48, OST4, and DAD1 proteins (homologs of the yeast Ost1p, Swp1p, Wbp1p, Ost4p, and Ost2p, respectively).","['All OST subunits are transmembrane proteins with between one and 13 transmembrane domains. The OST complex cleaves the high-energy GlcNAc-P bond, releasing Dol-P-P in the process (Figure 9.3). Yeast OST is comprised of eight different subunits Stt3p, Ost1p, Wbp1p, Swp1p, Ost2p, Ost4p, Ost5p, and Ost3p or Ost6p. Stt3p is the catalytic subunit of the enzyme. The two OST complexes (containing either of the thioredoxin-subunit Ost3p or Ost6p) have a different protein–substrate specificity. The complexity of OST increases in multicellular organisms. In mammals, there are two different catalytic STT3 subunits that both associate with ribophorins I and II, OST48, OST4, and DAD1 proteins (homologs of the yeast Ost1p, Swp1p, Wbp1p, Ost4p, and Ost2p, respectively). The STT3A complex (OSTA), closely associated with the translocon, contains the KCP2 and DC2 subunits, whereas the STT3B complex (OSTB) that has either MAGT1 or TUSC3 (homologs of yeast Ost3p/Ost6p) glycosylates polypeptides posttranslationally after their translocation into the ER. On binding to the catalytic STT3 subunit, the client peptide adopts a 180° turn, making polypeptide folding a competing reaction for N-glycosylation. Indeed, the thioredoxin subunits of the OST complex (Ost3p/Ost6p; MAGT1/TUSC1) modulate the oxidative folding of the client polypeptide, thereby extending the polypeptide substrate range of OST. As of February 2021, the UniProt database reports 1911 N-glycosylation sites in yeast and 13,648 in murine glycoproteins.'
 'EGF and TSR domains are present as tandem repeats in numerous proteins of multicellular organisms. Ofut1/POFUT1 and POFUT2 selectively fucosylate only properly folded protein domains, suggesting a role of this glycosylation in folding quality control. Indeed, several POFUT2 targets including ADAMTSL1 and ADAMTSL2 (scaffolding proteins in the extracellular matrix), ADAMTS9 (a matrix remodeling protease), and ADAMTS13 (the von Willebrand factor cleaving protease) strictly require O-fucosylation for efficient secretion. Indeed, O-fucosylation appears to stabilize folded TSRs. The case of Ofut1/POFUT1 is a bit more ambiguous. Studies performed in Drosophila on the efficiency of cell-surface expression of the Ofut1 substrate Notch showed that Ofut1 is required as a chaperone for Notch folding and cell-surface expression, and that chaperone activity is largely independent of the O-fucosyltransferase activity. In contrast, POFUT1 does not appear to be absolutely required for cell-surface expression of Notch receptors in all mammalian cells, suggesting that cell-specific chaperones may be able to compensate for loss of POFUT1 in certain contexts. It has been reported recently that O-mannosylation in S. cerevisiae ER might be responsible for terminating futile cycles of association–dissociation between proteins unable to attain their native conformation and Kar2p (the budding yeast homolog of mammalian BiP/Grp78 chaperone). The loss of CNX and CRT in most multicellular organisms causes a severe phenotype. Mice deficient in CNX reach full term, but half die within 2 days of birth, and very few survive beyond 3 months. The runts that survive have obvious motor disorders with loss of large myelinated nerve fibers. CRT-deficient mice and ERp57-null mice also show embryonic lethality. In contrast, CNX and CRT null Caenorhabditis elegans mutants are viable.'
 'All of these enzymes transfer only the sugar portion of the nucleotide sugar. The Man5GlcNAc2-P-P-Dol precursor translocates across the ER membrane bilayer via a “flippase” encoded by the RFT1 locus in yeast. Man5GlcNAc2-P-P-Dol is extended by the addition of four Man and three Glc residues transferred from Dol-P-Man and Dol-P-Glc, respectively. Dol-P-Man and Dol-P-Glc donors are formed on the cytoplasmic side of the ER membrane from GDP-Man and UDP-Glc. Dol-P-Man and Dol-P-Glc must also be flipped across the ER membrane. Mammalian MPDU1 is an ER membrane protein necessary for the utilization of Dol-P-Man and Dol-P-Glc in the ER lumen in the synthesis of the mature N-glycan precursor Glc3Man9GlcNAc2-P-P-Dol (Figure 9.3). This 14-sugar glycan is transferred by oligosaccharyltransferase (OST) to Asn in receptive Asn-X-Ser/Thr sequons in protein regions that have translocated across the ER membrane. OST is a multisubunit protein complex in the ER membrane, except in the case of the kinetoplastids (Chapter 43). OST catalyzes the transfer of the oligosaccharide from Dol-P-P to Asn-X-Ser/Thr in newly synthesized regions of proteins during passage through the translocon into the ER. OST has a high specificity for the completely assembled oligosaccharide, which is Glc3Man9GlcNAc2 in most eukaryotes. When incomplete oligosaccharides are assembled, transfer efficiency is reduced, resulting in hypoglycosylation of glycoproteins that mature with empty N-glycan sites. All OST subunits are transmembrane proteins with between one and 13 transmembrane domains. The OST complex cleaves the high-energy GlcNAc-P bond, releasing Dol-P-P in the process (Figure 9.3).'
 'The OFT was first discovered genetically in plants as Spy, in which it controls transcriptional processes. In the protist pathogen Toxoplasma gondii, OFT modifies numerous proteins involved in transcription, mRNA biogenesis, nuclear transport, and cell signaling. Recently, Greb1, derived from another lineage of enzymes, was shown to O-β-GlcNAcylate estrogen receptor-α and potentially other nuclear proteins, which if verified is an interesting example of convergent evolution. Paralogs of these enzymes have not been described in the well-studied Saccharomyces cerevisiae, but biochemical data suggests that this yeast modifies intracellular proteins with mannose (Man) and even di- and tri-Man. Furthermore, several reports suggest that select intracellular proteins of mammalian cells are modified by N-acetylgalactosamine (GalNAc). The significance of these intriguing latter examples awaits identification of the responsible glycosyltransferases and evidence for their roles in cells. Examples in which the glycosyltransferases are known are represented schematically in Figure 18.1A and summarized in Table 18.1. Cellular topography of nucleocytoplasmic glycosylation. (A) Monoglycosylation (m) in the cytoplasm (e.g., O-GlcNAc and O-Fuc). (B) Complex (c) glycosylation in the cytoplasm by O-GlcNAc transferases (GTs) that extend the first sugar. (C) Cytoplasmic monoglycosylation (more...) Examples of nuclear or cytoplasmic glycosylation events  Highly conserved homologs of OGT and OFT are found in numerous bacterial genomes, although studies of their functional roles are essentially nonexistent. An example of bacterial monoglycosylation that leads to a known function comes from the EF-P protein, the bacterial homolog of eukaryotic elongation initiation factor 5a. In some bacteria, EF-P suppresses translational stalling by a mechanism that involves oxidation of a critical lysyl residue, and its eukaryotic ortholog is regulated by hypusylation.'
 'Elimination of B3glct in mice phenocopies many of the defects seen in Peters-plus syndrome. TSRs are also often frequently modified with C-mannose (Figure 13.4), although the relationship between the two modifications is not yet clear. A number of biologically interesting proteins are known or predicted to contain this modification, including thrombospondin-1 and -2, all ADAMTS (a disintegrin and metalloproteinase with thrombospondin motifs; ADAMTS 1–20) and ADAMTS-like proteins, properdin, and F-spondin (Table 13.1). O-Fucosylation of TSRs in several proteins including ADAMTS 13 and ADAMTS-like 1 is needed for their secretion, suggesting that O-fucosylation of TSRs may be involved in quality control or folding, similar to the predicted role of O-fucose on EGF repeats in Drosophila. Like POFUT1, POFUT2 is an ER-localized enzyme that only fucosylates properly folded TSRs. POFUT2 and B3GLCT appear to function in a novel ER quality control pathway required for proper folding of TSRs. In thrombospondin-1, the region of the TSR modified with O-fucose mediates interactions between TSRs and several cell-surface receptors. Thus, the presence of O-fucose in this region could influence interactions between TSRs and adjacent cells, much as O-fucose on EGF repeats regulates Notch ligand binding. TSRs allow proteins like the thrombospondins to bind to cells and/or to other components in the ECM, an essential step in the antiangiogenic functions of these proteins. Modifications of thrombospondin type-1 repeats (TSRs). These repeats have six conserved Cys (yellow), three disulfide bonds (gray lines), and consensus sites for O-fucose (red) and C-mannose (pink) addition.'
 'This affords two checkpoints ensuring that only misfolded glycoproteins, and not folding intermediates, are driven toward proteasomal degradation after a relatively long ER residence. In yeast, only an ER α-mannosidase and one EDEM-like protein called Htm1p are present. The former transforms M9 to M8B very rapidly in practically all glycoproteins, whereas the latter converts M8B to M7BC slowly, thus affording only one checkpoint for the exclusive degradation of terminally misfolded glycoproteins. Htm1p forms a complex with PDI. More recent evidence further suggests that mammalian EDEMs act as active α-mannosidases forming complexes with distinct oxidoreductases. In the case of yeast the oxidoreductase-Htm1p association enhances the α-mannosidase activity of the latter and the complex participates in the recognition of ERAD substrates. However, not all glycoproteins with N-glycans terminating in α1–6Man are driven to degradation. For instance, 3-hydroxy-3-methylglutaryl acetyl-coenzyme-A reductase, a key ER enzyme in sterol biosynthesis, carries Man5GlcNAc2 and Man6GlcNAc2 N-glycans that do not target it for degradation (see below). Retrotranslocation of misfolded glycoproteins from the ER lumen to the cytosol for proteasomal degradation ultimately depends on various protein complexes, some of which contain integral ER membrane proteins. ER membrane proteins with folding defects in the cytosolic domain are extracted from the ER membrane by the Doa10 complex via ERAD-C, whereas those in which the folding defect is present in the luminal (ERAD-L) or membrane (ERAD-M) domains use the Hrd1 complex. Both Doa10p and Hrd1p are integral membrane proteins with E3 ligase activity in their cytosolic portion. Other proteins in these complexes include chaperones, proteins with E2 ubiquitin-conjugating activity or proteins that recognize misfolded proteins.'
 'Both Doa10p and Hrd1p are integral membrane proteins with E3 ligase activity in their cytosolic portion. Other proteins in these complexes include chaperones, proteins with E2 ubiquitin-conjugating activity or proteins that recognize misfolded proteins. For instance, glycoproteins with N-glycans containing a terminal α1–6Man are bound by Yos9p and undergo ERAD only if the N-glycans are in unstructured protein, a feature recognized by Hrd3p in the Hrd1 complex. Finally, proteins common to both complexes such as yeast Cdc48 (p97 in mammals) are responsible for membrane extraction of misfolded proteins in an ATP-dependent manner. Although the pore by which ERAD-L substrates are actually transported to the cytosol has not been identified, it is known that the substrates must be unfolded in the ER lumen. Although studies on ERAD complexes have been mainly performed in S. cerevisiae, mammalian cells have homologs of nearly all proteins described in the yeast complexes. N-Glycans are removed from unfolded glycoproteins during proteasomal degradation. A cytoplasmic peptide:N-glycanase (PNGase, N-glycanase, NGLY1) plays an important role in both removing the glycan and constructing an efficient predegradation complex (Figure 39.3). NGLY1 recognizes only misfolded or denatured glycoproteins. The enzyme is bound to the proteasome by subunits S4 and HR23B as a complex with Cdc48, a component of ERAD complexes. Degradation of the released N-glycan occurs in two stages. First, cleavage occurs between the two GlcNAcs (chitobiose) in the core of the N-glycan via a cytoplasmic endo-β-N-acetylglucosaminidase.']","The STT3A complex (OSTA), closely associated with the translocon, contains the KCP2 and DC2 subunits, whereas the STT3B complex (OSTB) that has either MAGT1 or TUSC3 (homologs of yeast Ost3p/Ost6p) glycosylates polypeptides posttranslationally after their translocation into the ER.","The STT3A complex (OSTA), closely associated with the translocon, contains the KCP2 and DC2 subunits, whereas the STT3B complex (OSTB) that has either MAGT1 or TUSC3 (homologs of yeast Ost3p/Ost6p) glycosylates polypeptides posttranslationally after their translocation into the ER. On binding to the catalytic STT3 subunit, the client peptide adopts a 180° turn, making polypeptide folding a competing reaction for N-glycosylation. Indeed, the thioredoxin subunits of the OST complex (Ost3p/Ost6p; MAGT1/TUSC1) modulate the oxidative folding of the client polypeptide, thereby extending the polypeptide substrate range of OST. As of February 2021, the UniProt database reports 1911 N-glycosylation sites in yeast and 13,648 in murine glycoproteins.",0.5,0.6015435183564484,0.8861182065436934,0.011764705882352941,0.9999999999857143,1.0
"Complete the following paragraph: Sialic acids may be modified by O-acetylation, and Gal and GlcNAc by sulfation. The length of O-GalNAc glycans may vary from a single GalNAc to more than 20 sugar residues and can include blood group and other glycan epitopes. This chapter describes the structures, biosynthesis, and functions of O-GalNAc glycans in mammals.","['Less common elongation reactions are the formation of GalNAcβ1-4GlcNAc (LacdiNAc) and Galβ1-3GlcNAc- sequences. Linear poly-N-acetyllactosamine units can be branched by members of the β1-6 N-acetylglucosaminyltransferase family (e.g., GCNT2), resulting in the I antigen (Table 10.2). Most of these elongation and branching reactions also occur on O- and N-glycans and glycolipids. Some sialyltransferases and sulfotransferases prefer O-GalNAc glycans as substrates but many of these enzymes have an overlapping specificity and also act on N-glycans. A family of α2-6 sialyltransferases (ST6GALNAC1–ST6GALNAC4) with distinct specificities synthesizes sialyl-Tn and sialylated core 1 O-GalNAc glycans. A family of α2-3 sialyltransferases is responsible for the synthesis of sialylated O-GalNAc glycans, with ST3GAL1 being mainly involved in the sialylation of the Galβ1-3 residue of core 1 and 2 O-GalNAc glycans. Sialylation blocks the further linear extension of O-glycan chains. Sulfotransferases are localized in the Golgi and cap O-GalNAc glycans with a sulfate ester linked to the 3-position of Gal or the 6-position of GlcNAc. The sulfate group is transferred from 3′-phosphoadenosine-5′-phosphosulfate (PAPS). This adds a negative charge to O-GalNAc glycans of lung, intestinal, and other mucins that has a considerable effect on the chemical and metal ion binding properties of these glycans. GAL3ST4 is the major sulfotransferase acting on the Gal residue of core 1 O-glycans.'
 'NCBI Bookshelf. A service of the National Library of Medicine, National Institutes of Health. Varki A, Cummings RD, Esko JD, et al., editors. Essentials of Glycobiology [Internet]. 4th edition. Cold Spring Harbor (NY): Cold Spring Harbor Laboratory Press; 2022.  doi: 10.1101/glycobiology.4e.10 Inka Brockhausen, Hans H. Wandall, Kelly G. Ten Hagen, and Pamela Stanley. Many glycoproteins carry glycans initiated by GalNAc attached to the hydroxyl of Ser or Thr residues. Mucins are the class of glycoproteins carrying the greatest number of O-GalNAc glycans (also called mucin-type O-glycans), but this posttranslational modification is common among many glycoproteins. The sugars found in O-GalNAc glycans include GalNAc, Gal, GlcNAc, Fuc, and Sia, whereas Man, Glc, or Xyl residues are not represented. Sialic acids may be modified by O-acetylation, and Gal and GlcNAc by sulfation. The length of O-GalNAc glycans may vary from a single GalNAc to more than 20 sugar residues and can include blood group and other glycan epitopes. This chapter describes the structures, biosynthesis, and functions of O-GalNAc glycans in mammals. About 150 years ago, E. Eichwald and E. Hoppe-Seyler noted that highly glycosylated proteins that contain hundreds of O-GalNAc glycans, which they termed mucins, are found throughout the body (Figure 10.1). Since then we have learned that O-GalNAc glycans are not only found as dense clusters on mucins, but also at single sites on most secreted and membrane-bound proteins.'
 'This adds a negative charge to O-GalNAc glycans of lung, intestinal, and other mucins that has a considerable effect on the chemical and metal ion binding properties of these glycans. GAL3ST4 is the major sulfotransferase acting on the Gal residue of core 1 O-glycans. Skeletal type keratan sulfate (KS) is also an O-GalNAc-linked highly sulfated polysaccharide (Chapter 17). O-acetyltransferases that add O-acetyl esters to one or more hydroxyl groups of Sia residues remain poorly characterized. Some evidence suggests that the esters can be added to CMP-Sias before transfer. The α1-2 fucosyltransferases FUT1 and FUT2 synthesize the blood group H determinant of O-GalNAc glycans which can be converted by an α1-3 Gal-transferase to blood group B or by an α1-3 GalNAc-transferase to blood group A (Table 10.1). In addition, α1-3 and α1-3/4 fucosyltransferases synthesize the Lewis antigens (Table 10.1). A number of uncommon and antigenic sugars are also found on O-GalNAc glycans. For example, neuropilin-2 in the nervous system has core 1 and 2 O-GalNAc glycans that carry polysialic acid residues synthesized by polysialytransferase IV (ST8SIA4). These highly charged glycans play a critical role in the negative regulation of cell adhesion during maturation of the nervous system. An α1-4 GlcNAc-transferase in gastric tissue adds GlcNAc in α1-4 linkage to β1-4 Gal in core 1 and 2 O-GalNAc glycans. The α1-4 GlcNAc-containing glycans appear to inhibit colonization by Helicobacter pylori. The functions of O-GalNAc glycans are many and varied, depending on their structure and density, as well on as the protein to which they are attached.'
 'A single GalNAc residue attached to Ser/Thr forms the Tn antigen. As mentioned above, the core 1 O-GalNAc glycan (Galβ1-3GalNAc on Ser/Thr) forms the Thomsen–Friedenreich (TF or T antigen). Although Tn and T antigens are usually cryptic because they are extended by other sugars, they are found at increased levels in mucins from cancer cells. They can also carry Sia and form sialyl-Tn or sialyl-T antigens. O-GalNAc cores are often extended to form complex O-GalNAc glycans that may include the ABO and Lewis blood group determinants (Chapter 14), polysialic acid, the linear i antigen (Galβ1-4GlcNAcβ1-3Gal), and the GlcNAc β1-6-branched I antigens (Table 10.1). Extensions by Type 1 (Galβ1-3GlcNAc) or Type 2 (Galβ1-4GlcNAc) units can be repeated and provide scaffolds for the attachment of additional sugars or functional groups. The termini of O-GalNAc glycans may contain Fuc and Sia in α-linkages, and Gal, GalNAc, and GlcNAc in both α- and β-linkages, and sulfate. Many of these terminal sugars are antigenic or recognized by lectins. In particular, the sialylated and sulfated Lewis antigens are ligands for selectins (Chapter 34), and Gal-terminating structures are ligands for galectins (Chapter 36). Some sugar residues, or their modifications, may mask underlying antigens or receptors. For example, O-acetyl groups on the Sia of the sialyl-Tn antigen prevent recognition by anti-sialyl-Tn antibodies. Gut bacteria may actively remove this mask. Dense O-glycosylation of mucin domains provides almost complete protection from protease degradation.'
 'Thus, sialidase treatment followed by O-glycanase releases most simple, core 1 O-GalNAc glycans. Terminal Sia residues can also be easily removed with mild acid treatment. There are no known enzymes that can release more complex and extended whole O-GalNAc glycans, but mixtures of exoglycosidases can be used to sequentially remove sugars from O-GalNAc glycans on a glycoprotein. Glycoproteins with clusters of sialylated O-GalNAc glycans may be digested by an O-sialoglycoprotein endopeptidase. Released, intact O-GalNAc glycans may be separated by different chromatographic methods, including high-performance liquid chromatography (HPLC). Chemical derivatization of GalNAc at the reducing end helps in the separation and subsequent analysis of sugar composition and linkages by gas chromatography and mass spectrometry (MS) (Chapter 50). Another tool to isolate O-glycans with specific epitopes is affinity chromatography using lectins. For example, Helix pomatia agglutinin binds to terminal GalNAc, whereas peanut lectin binds to unsubstituted core 1 (Table 10.1). The structures of O-GalNAc glycans released from mucins and other glycoproteins may be determined by a combination of liquid or gas chromatography, MS, and nuclear magnetic resonance (NMR) spectroscopy. The anomeric linkage of each sugar can be determined using specific glycosidases that distinguish between α- or β-linked sugars, and by one- and two-dimensional NMR methods (Chapter 50). The sites of O-GalNAc glycan modification in mucins are difficult to determine directly, but this has been achieved by sensitive MS methods and new enzymatic tools. A big step forward in understanding the extent of the O-GalNAc glycoproteome came with the proteome-wide mapping of O-GalNAc glycosylation sites.'
 'Branching is a prime characteristic of many glycans found on mammalian cell surfaces. Glycans representing two major types of eukaryotic protein glycosylation are shown in Figure 3.1. An N-glycan makes a glycosidic bond with the side-chain nitrogen of an asparagine residue that is a part of a consensus peptide sequence NX(S/T). An O-glycan makes a glycosidic bond with the terminal oxygen of a serine or threonine residue. N-Glycans contain a core composed of three mannose residues and two N-acetylglucosamine residues (Manα1-6[Manα1-3]Manβ1-4GlcNAcβ1-4GlcNAcβ1-N-Asn). The depicted glycan is a biantennary glycan with branches linked at the 3- and 6-positions of the first mannose residue in the glycan chain. However, more complex structures exist with three and four branches. Details of the synthesis and biological importance of these glycans are presented in Chapter 9. The depicted O-glycan contains a typical core structure (one of four common cores) that begins at the reducing end with an N-acetylgalactosamine α-linked to a serine or threonine (GlcNAcβ1-6[Galβ1-3]GalNAcα1-O-Ser/Thr). It begins as a biantennary structure but can be further extended toward the nonreducing end to form more complex structures. The synthesis and biological importance of O-glycans are described in Chapters 10 (O-GalNAc) and 19 (O-GlcNAc). Examples of branched structures in N- and O-linked glycans.  Both glycans depicted are terminated with a sialic acid (often Neu5Ac in humans) at their nonreducing end. Sialylation is characteristic of mammalian glycans and important for immune response.'
 'It should be noted that these represent only the most common classes of glycans reported in eukaryotic cells. There are several other less studied glycan types found on one or the other side of the cell membrane in animal cells (Chapters 13, 17, and 18) and many others in plants, algae, and prokaryotes. Although different glycan classes have unique core regions by which they are distinguished, certain outer structural sequences are often shared among different classes of glycans. For example, animal N- and O-glycans and glycosphingolipids frequently carry the subterminal disaccharide Galβ1-4GlcNAcβ1-(N-acetyllactosamine or LacNAc) or, less commonly, GalNAcβ1-4GlcNAcβ1-(LacdiNAc) units. The LacNAc units can sometimes be repeated, giving extended poly-N-acetyllactosamines (sometimes incorrectly called “polylactosamines”) (Chapter 14). Less commonly, the LacdiNAc motif can also be repeated (termed polyLacdiNAc). Outer LacNAc units can be modified by fucosylation or by branching and are typically capped in vertebrates by sialic acids or, less commonly, by sulfate esters, Fuc, α-Gal, β-GalNAc, or β-GlcA units (Chapters 14 and 15). In contrast, eukaryotic glycosaminoglycans are linear copolymers of acidic disaccharide repeating units, each typically containing a hexosamine (GlcN or GalN) and a hexose (Gal) or hexuronic acid (GlcA or IdoA) (Chapter 17).']","Sialic acids may be modified by O-acetylation, and Gal and GlcNAc by sulfation. The length of O-GalNAc glycans may vary from a single GalNAc to more than 20 sugar residues and can include blood group and other glycan epitopes. This chapter describes the structures, biosynthesis, and functions of O-GalNAc glycans in mammals. Mucins are the class of glycoproteins carrying the greatest number of O-GalNAc glycans, but this posttranslational modification is common among many glycoproteins. The sugars found in O-GalNAc glycans include GalNAc, Gal, GlcNAc, Fuc, and Sia, whereas Man, Glc, or Xyl residues are not represented.","About 150 years ago, E. Eichwald and E. Hoppe-Seyler noted that highly glycosylated proteins that contain hundreds of O-GalNAc glycans, which they termed mucins, are found throughout the body (Figure 10.1). Since then we have learned that O-GalNAc glycans are not only found as dense clusters on mucins, but also at single sites on most secreted and membrane-bound proteins. O-GalNAc glycans are involved in almost every aspect of biology, including cell–cell communication, cell adhesion, signal transduction, immune surveillance, epithelial cell protection, and host–pathogen interactions.",0.7272727272727273,0.7384490772140523,0.8011843039963324,0.022988505747126436,0.9266666666481335,0.6666666666666666
"Complete the following paragraph: Nearly all glycolipids in vertebrates are GSLs, which, in turn, are part of the larger family of sphingolipids (lipids built on sphingoid bases) that includes the major membrane phospholipid, sphingomyelin, and the second messenger sphingosine 1-phosphate that regulates angiogenesis and immune cell trafficking.","['The structure of the lipid, a long-chain amino alcohol in amide linkage to a fatty acid, was so difficult to determine that the amino alcohol was dubbed “sphingosine” after the enigmatic Egyptian Sphinx. Animal cells synthesize various sphingosines and related long-chain amino alcohols, together referred to as sphingoid bases. Nearly all glycolipids in vertebrates are GSLs, which, in turn, are part of the larger family of sphingolipids (lipids built on sphingoid bases) that includes the major membrane phospholipid, sphingomyelin, and the second messenger sphingosine 1-phosphate that regulates angiogenesis and immune cell trafficking. Other GSLs were later identified because they accumulate to pathological levels in tissues of patients with lysosomal storage diseases, genetic disorders in which glycan degrading enzymes are faulty or missing (Chapter 44). For example, a sialic acid–containing GSL (GM2) was first isolated from the brain of a victim of Tay–Sachs disease, in which it accumulates, and was named “ganglioside” based on its location in nerve clusters or “ganglia” in the brain. Likewise, glucosylceramide (GlcCer) was first isolated from the spleen of a Gaucher disease patient, where it accumulates. As purification, separation, and analytical techniques improved, GSLs were found in all vertebrate tissues. Hundreds of unique GSL structures were found that vary in glycan structures alone, each of which are presented on several distinct ceramides. Structures of representative glycosphingolipids (GSLs) and glycoglycerolipids. GSLs, such as GalCer, are built on a ceramide lipid moiety that consists of a long-chain amino alcohol (sphingosine) in amide linkage to a fatty acid.'
 'Structures of representative glycosphingolipids (GSLs) and glycoglycerolipids. GSLs, such as GalCer, are built on a ceramide lipid moiety that consists of a long-chain amino alcohol (sphingosine) in amide linkage to a fatty acid. In comparison, glycoglycerolipids, (more...) Glycoglycerolipids are distinguished from GSLs by their lipid, having glycans linked to the C-3 hydroxyl of diacylglycerol or alkyl(acyl)glycerol (Figure 11.1). Very minor constituents of most animal tissues (other than the testes), glycoglycerolipids are widely distributed in microbes and plants. Glycolipids of fungi, plants, and invertebrates are covered in Chapters 20 and 23–26. Glycosylphosphatidylinositols (GPIs), a different family of glycolipids, are often attached to proteins as membrane, and may also exist as free glycolipids (discussed in Chapter 12). The lipopolysaccharides of Gram-negative bacteria are discussed in Chapter 21. The ceramide lipid of GSLs consists of a sphingoid base with a fatty acid amide at the C-2 amine. Sphingosine is the most common sphingoid base in mammals, with hydroxyls at the C-1 and C-3 carbons and a trans double bond between C-4 and C-5 (Figure 11.1). Sphinganine is the same structure without the double bond, and phytosphingosine lacks the double bond and has an additional hydroxyl on C-4. Ceramides containing sphinganine and phytosphingosine are less abundant in animals, whereas phytosphingosine is prominent in the glycosphingolipids of plants and fungi. The fatty acid components of ceramides vary widely, with lengths ranging from C14 to C30 or greater.'
 'NCBI Bookshelf. A service of the National Library of Medicine, National Institutes of Health. Varki A, Cummings RD, Esko JD, et al., editors. Essentials of Glycobiology [Internet]. 4th edition. Cold Spring Harbor (NY): Cold Spring Harbor Laboratory Press; 2022.  doi: 10.1101/glycobiology.4e.11 Ronald L. Schnaar, Roger Sandhoff, Michael Tiemeyer, and Taroh Kinoshita. Glycosphingolipids (GSLs), a subclass of glycolipids found in the cell membranes of organisms from bacteria to humans, are the major glycolipids of animals. The emphasis of this chapter is on vertebrate glycosphingolipids. Information on glycolipids of fungi, plants, and invertebrates is covered elsewhere (Chapters 20 and 23–26), as are glycosylphosphatidylinositols (GPIs), glycolipids attached to proteins as membrane anchors (Chapter 12). This chapter describes the characteristic features of GSLs, pathways for their biosynthesis, and insights into their biological roles in membrane structure, host–pathogen interactions, cell–cell recognition, and modulation of membrane protein function. The first GSL to be characterized was galactosylceramide (GalCer). Among the simplest of glycolipids, it is also one of the most abundant molecules in the vertebrate brain. It consists of a single galactose residue in β-glycosidic linkage to the C-1 hydroxyl group of a lipid moiety called ceramide (Figure 11.1). The structure of the lipid, a long-chain amino alcohol in amide linkage to a fatty acid, was so difficult to determine that the amino alcohol was dubbed “sphingosine” after the enigmatic Egyptian Sphinx. Animal cells synthesize various sphingosines and related long-chain amino alcohols, together referred to as sphingoid bases.'
 'Ceramides containing sphinganine and phytosphingosine are less abundant in animals, whereas phytosphingosine is prominent in the glycosphingolipids of plants and fungi. The fatty acid components of ceramides vary widely, with lengths ranging from C14 to C30 or greater. Although often saturated, they may be variably unsaturated or have α-hydroxyl groups. Ceramide structures modulate membrane associations and functions of GSLs. Although ceramide variations add significant diversity to GSL structures, major structural and functional classifications are based on the glycans. The first sugars linked to ceramide in vertebrates are typically β-linked galactose (GalCer) or glucose (GlcCer). GalCer and its analog sulfatide, with sulfate at the C-3 hydroxyl of galactose, are the major glycans in the kidney and the brain. In the brain they have essential roles in the structure and function of myelin, the insulator that allows for rapid nerve conduction. Interestingly, the related sulfogalactoglycerolipid, seminolipid (Figure 11.1), is abundant only in the male reproductive tract, where it is essential for spermatogenesis. Sialylated GalCer (Neu5Acα2-3GalβCer; GM4) is also found in myelin. These galactolipids are seldom extended with larger saccharide chains; rather, most other members of the large and diverse family of GSLs in animals are built on GlcCer (Figure 11.2). GlcCer itself is abundant in certain tissues. In skin, it is a precursor of special ceramides that are required for creating the essential surface water barrier when embedded into the stratum corneum of the epidermis (see below). Glycosphingolipid (GSL) neutral cores and their designation based on IUPAC (International Union of Pure and Applied Chemistry) Nomenclature.'
 'In skin, it is a precursor of special ceramides that are required for creating the essential surface water barrier when embedded into the stratum corneum of the epidermis (see below). Glycosphingolipid (GSL) neutral cores and their designation based on IUPAC (International Union of Pure and Applied Chemistry) Nomenclature. In the official nomenclature, saccharide and other substituents that extend or branch from the neutral core structures (more...) The vast majority of GSL structures are classified based on seven common tetrasaccharide neutral sugar core sequences (Figure 11.2). GSLs sharing the same neutral core sequence are said to be of that “series”; the quantitatively major series in vertebrates are ganglio-, globo-, and neolacto-series, whereas in invertebrates the mollu- and arthro-series predominate. GSL series are expressed in tissue-specific patterns. In mammals, ganglio-series GSLs, although broadly distributed, predominate in the brain, whereas neolacto-series glycolipids are common on certain hematopoietic cells including leukocytes. In contrast, lacto-series glycolipids are prominent in secretory organs and globo-series glycolipids are the most abundant in erythrocytes. This diversity presumably reflects important differences in GSL functions. GSLs are further subclassified as neutral (no charged sugars or ionic groups), sialylated (having one or more sialic acid residues), or sulfated. Traditionally, all sialylated GSLs are known as “gangliosides” regardless of whether they are based on the ganglio-series neutral sugar core. In the official nomenclature, saccharide and other substituents that extend or branch from the neutral core structures are indicated by a roman numeral designating which of the neutral core sugars carries the substituent (counting the sugar closest to the ceramide as “I”), and a superscript designating which hydroxyl on that sugar is modified (Figure 11.2).'
 'Species differences among glycolipids also occur, one example being the expression of Forssman antigen, GalNAcα1-3GalNAcβ1-3Galα1-4Galβ1-4GlcβCer. This molecule is a good immunogen in Forssman antigen–negative species, such as rabbit, rat, and human, which have a mutated α1-3 N-acetylgalactosaminyltransferase that cannot transfer N-acetylgalactosamine to the precursor Gb4Cer. In contrast, guinea pig, mouse, sheep, and goat are Forssman antigen–positive. The breakdown of GSLs occurs stepwise by the action of lysosomal hydrolases. GSLs on the outer surface of the plasma membrane are internalized, along with other membrane components, in invaginated vesicles that then fuse with endosomes, resulting in the GSL glycan facing the endosome lumen. GSL-enriched areas of the endosomal membrane may then invaginate once again to form intraluminal vesicles within the endosome. When endosomes fuse with primary lysosomes, GSLs become exposed to lysosomal hydrolases. Absence of any one of these glycosidases results in lysosomal storage diseases (Chapter 44). As GSLs are successively cleaved to smaller structures, the remaining “core” monosaccharides become inaccessible to the water-soluble lysosomal hydrolases and require assistance from activator proteins that are referred to as “liftases.” These include GM2-activator protein and four structurally related saposins, all of which are derived from a single polypeptide precursor by proteolytic cleavage. Saposins are thought to bind to their glycolipid substrate, disrupt its interaction with the local membrane environment, and facilitate access of the glycans to the water-soluble hydrolytic enzymes.'
 'Lipid rafts are apparently dynamic, short-lived (msec), and small (10–50 nm in diameter), each containing perhaps hundreds of lipid molecules along with a few protein molecules. It has been argued that external clustering of lipid rafts into larger structures might bring signaling molecules such as kinases and their substrates together to enhance intracellular signaling. Thus, GSLs may act as intermediaries in the flow of information from the outside to the inside of cells. This idea is supported by the observation that antibody-induced GSL clustering activates lipid-raft-associated signaling and has led to the concept of plasma membrane “glycosignaling domains” or “glycosynapse.” Interactions between glycans and glycan-binding proteins, as well as glycan–glycan interactions, are also very much influenced by the density of glycans in terms of binding affinity. Multiple glycans clustered in a limited area can increase the avidity of cognate binding proteins compared with a single molecule of a glycan (Chapter 29). Natural multivalency adds unique functional properties to plasma membrane glycolipids. Indeed, several growth factor receptors including the epidermal growth factor (EGF) receptor, insulin receptor, and the nerve growth factor receptor are localized in membrane microdomains, and structural studies identified binding sites occupied by specific GSLs that modulate receptor signaling functions. When expressed in the outer leaflet of the plasma membrane of cells, with their glycans facing the external milieu, GSL functions fall into two major categories: mediating cell–cell interactions via binding to complementary molecules on apposing plasma membranes (trans recognition) and modulating activities of proteins in the same plasma membrane (cis regulation). At the single-cell level, GSLs are not essential for life. Using specific chemical inhibitors and genetic ablation of biosynthetic genes, cells without GSLs survive, proliferate, and even differentiate. However, GSLs are required for development at the whole-animal level. Mice engineered to lack the gene for GlcCer synthesis fail to develop, with arrest occurring just past the gastrula stage because of extensive apoptosis in the embryo.']","Other GSLs were later identified because they accumulate to pathological levels in tissues of patients with lysosomal storage diseases, genetic disorders in which glycan degrading enzymes are faulty or missing. For example, a sialic acid–containing GSL (GM2) was first isolated from the brain of a victim of Tay–Sachs disease, in which it accumulates, and was named “ganglioside” based on its location in nerve clusters or “ganglia” in the brain. Likewise, glucosylceramide (GlcCer) was first isolated from the spleen of a Gaucher disease patient, where it accumulates. As purification, separation, and analytical techniques improved, GSLs were found in all vertebrate tissues. Hundreds of unique GSL structures were found that vary in glycan structures alone, each of which are presented on several distinct ceramides.","Other GSLs were later identified because they accumulate to pathological levels in tissues of patients with lysosomal storage diseases, genetic disorders in which glycan degrading enzymes are faulty or missing (Chapter 44). For example, a sialic acid–containing GSL (GM2) was first isolated from the brain of a victim of Tay–Sachs disease, in which it accumulates, and was named “ganglioside” based on its location in nerve clusters or “ganglia” in the brain. Likewise, glucosylceramide (GlcCer) was first isolated from the spleen of a Gaucher disease patient, where it accumulates. As purification, separation, and analytical techniques improved, GSLs were found in all vertebrate tissues. Hundreds of unique GSL structures were found that vary in glycan structures alone, each of which are presented on several distinct ceramides. Structures of representative glycosphingolipids (GSLs) and glycoglycerolipids. GSLs, such as GalCer, are built on a ceramide lipid moiety that consists of a long-chain amino alcohol (sphingosine) in amide linkage to a fatty acid. In comparison, glycoglycerolipids, (more...) Glycoglycerolipids are distinguished from GSLs by their lipid, having glycans linked to the C-3 hydroxyl of diacylglycerol or alkyl(acyl)glycerol (Figure 11.1).",1.0,0.4612719877844594,0.9510091855546002,0.011363636363636364,0.9999999999857143,1.0
"Complete the following paragraph: Proteins attached to glycosylphosphatidylinositol (GPI) via their carboxyl termini are generally found in the outer leaflet of the lipid bilayer facing the extracellular environment. The GPI membrane anchor may be conveniently thought of as an alternative to the single transmembrane domain of type-I integral membrane proteins. This chapter reviews the discovery, distribution, structure, biosynthesis, properties, and suggested functions of GPI anchors and related molecules, as well as their roles in diseases.","['NCBI Bookshelf. A service of the National Library of Medicine, National Institutes of Health. Varki A, Cummings RD, Esko JD, et al., editors. Essentials of Glycobiology [Internet]. 4th edition. Cold Spring Harbor (NY): Cold Spring Harbor Laboratory Press; 2022.  doi: 10.1101/glycobiology.4e.12 Sneha Sudha Komath, Morihisa Fujita, Gerald W. Hart, Michael A.J. Ferguson, and Taroh Kinoshita. Plasma membrane proteins are either peripheral proteins or integral membrane proteins. The latter include proteins that span the lipid bilayer once or several times, and a second class that are covalently attached to lipids. Proteins attached to glycosylphosphatidylinositol (GPI) via their carboxyl termini are generally found in the outer leaflet of the lipid bilayer facing the extracellular environment. The GPI membrane anchor may be conveniently thought of as an alternative to the single transmembrane domain of type-I integral membrane proteins. This chapter reviews the discovery, distribution, structure, biosynthesis, properties, and suggested functions of GPI anchors and related molecules, as well as their roles in diseases. The first tentative evidence for the existence of protein-phospholipid anchors appeared in 1963 with the finding that crude bacterial phospholipase C (PLC) selectively releases alkaline phosphatase from mammalian cells. Phosphatidylinositol (PI)-protein anchors were first postulated in the mid-1970s when highly purified bacterial PI-specific PLCs were observed to release proteins, such as alkaline phosphatase and 5′-nucleotidase, from mammalian plasma membranes. By 1985, these predictions were confirmed by compositional and structural data from studies on Torpedo acetylcholinesterase, human and bovine erythrocyte acetylcholinesterase, rat Thy-1, and the sleeping sickness parasite Trypanosoma brucei variant surface glycoprotein (VSG).'
 'By 1985, these predictions were confirmed by compositional and structural data from studies on Torpedo acetylcholinesterase, human and bovine erythrocyte acetylcholinesterase, rat Thy-1, and the sleeping sickness parasite Trypanosoma brucei variant surface glycoprotein (VSG). The first complete GPI structures, which were for T. brucei VSG and rat Thy-1, were solved in 1988 (Chapter 1, Figure 1.3). To date, hundreds of GPI-anchored proteins (GPI-APs) have been identified in many eukaryotes, ranging from protozoa and fungi to plants and humans (Online Appendix 12A). The range of described GPI-APs and the distribution of putative GPI biosynthesis genes suggests that (1) GPI anchors are almost ubiquitous among eukaryotes; (2) GPI-APs are functionally diverse and include hydrolytic enzymes, adhesion molecules, complement regulatory proteins, receptors, protozoan coat proteins, and prion proteins; and (3) in mammals, alternative messenger RNA (mRNA) splicing may lead to the expression of transmembrane and/or soluble and GPI-anchored forms of the same gene product. These variants may be developmentally regulated. For example, neural cell adhesion molecule (NCAM) exists in GPI-anchored and soluble forms when expressed in muscle and in GPI-anchored and two transmembrane forms when expressed in brain. The substructure Manα1-4GlcNα1-6myo-inositol-1-P-lipid is a universal hallmark of GPI anchors and related structures. All but one protein-linked GPI anchor share a larger common core structure (Figure 12.1; Online Appendix 12B, panels I–IV). The protein–carbohydrate association in GPI-APs is unique in that the reducing terminus of the GPI oligosaccharide is not attached to the protein but to the D-myo-inositol head group of a PI moiety by an α1-6 linkage.'
 'The protein–carbohydrate association in GPI-APs is unique in that the reducing terminus of the GPI oligosaccharide is not attached to the protein but to the D-myo-inositol head group of a PI moiety by an α1-6 linkage. A distal, nonreducing mannose (Man) is attached to the protein via an ethanolamine phosphate (EtNP) bridge between its C-6 hydroxyl and the α-carboxyl group of the carboxy-terminal amino acid. GPIs are one of the rare instances in which GlcN is found without either an N-acetyl or N-sulfate (as in proteoglycans) moiety (Chapter 17). General structure of glycosylphosphatidylinositol (GPI) anchors attached to proteins. All characterized GPI anchors share a common core consisting of ethanolamine-PO4-6Manα1-2Manα1-6Manα1-4GlcNα1-6myo-inositol-1-PO4-lipid. (more...) Beyond the common core, the structures of mature GPI anchors are quite diverse, depending on both the protein to which they are attached and the organism in which they are synthesized (Figure 12.1; Online Appendix 12B). Modifications to the core include additional EtNP and a wide variety of linear and branched glycosyl substituents of largely unknown function. There is considerable variation in the PI moiety. Indeed, GPI is a rather loose term because, strictly speaking, PI refers specifically to D-myo-inositol-1-P-3(sn-1,2-diacylglycerol) (i.e., diacyl-PI), whereas many GPIs contain other types of inositolphospholipids, such as lysoacyl-PI, alkylacyl-PI, alkenylacyl-PI, and inositolphosphoceramide (Online Appendix 12B).'
 'Some basic details of the known mammalian and yeast components and their topologies in the ER membrane are described in Table 12.1. Predicted topologies for the mammalian enzymes are shown in Figure 12.3. The GPI precursor is transferred to proteins via a multisubunit transamidase complex. The reaction involves two complex substrates, the preassembled GPI precursor and the carboxyl terminus of a partially folded nascent protein (Figure 12.4). The carboxy-terminal GPI-addition signal peptide (GPIsp) contains three domains: (1) three relatively small amino acids (Ala, Asn, Asp, Cys, Gly, or Ser) located at ω, ω+1, and ω+2, where ω is the amino acid attached to the GPI anchor and ω+1 and ω+2 are the first two residues of the cleaved peptide; (2) a relatively polar domain of typically five to 10 residues; and (3) a hydrophobic domain typically comprising 15–20 hydrophobic amino acids. These GPIsp sequences have no strict consensus, but are easily identified by eye and by automated algorithms. The final hydrophobic stretch of amino acids often resembles a transmembrane domain, but the absence of positively charged and polar residues immediately downstream makes a GPIsp easy to spot. Like N-glycosylation sequons, a GPIsp will only be functional if the protein is translocated into the ER. Hence, all GPI-APs are synthesized with an amino-terminal ER localization signal peptide as well. (A) Features of glycosylphosphatidylinositol (GPI)-anchored proteins and their processing by GPI transamidase. GPI-anchored proteins have an amino-terminal signal peptide for translocation into the ER and a carboxy-terminal GPI-addition signal peptide (more...) GPIs present microheterogeneity in their glycan side-chains depending on the species, cell types, and proteins (Online Appendix 12B, panels I–IV).'
 'GPI-APs with two long hydrocarbon chains (i.e., those containing diacylglycerol, alkylacylglycerol, alkenylacylglycerol, or ceramide) are stably associated with the lipid bilayer. It follows that inositol-acylated GPI proteins with three fatty-acid chains should be more stably associated. On the other hand, Leishmania LPG, with a single C24:0 alkyl chain, has a half-life of only minutes at the cell surface and is secreted intact into the medium. The thermodynamics of bilayer interactions also depend on the length and degree of saturation of the fatty-acid chains. In this regard, the saturated nature of most (but not all) mammalian GPI anchors (Online Appendix 12B, panels III and IV) is thought to explain why GPI-APs associate with “lipid rafts.” The current model for mammalian lipid rafts is that of transient liquid-ordered nanoclusters of membrane components. These are dependent on dynamic cortical actin asters that, through adaptor proteins, cluster phosphatidylserine (PS) on the inner face of the plasma membrane bilayer. This coupling effect occurs because the long, saturated lipid chains from inner leaflet PS overlap and interact with those of GPI-APs and glycosphingolipids in the middle of the bilayer, thereby generating functional membrane domains. A compelling aspect of this model is that, although dynamic cortical actin can organize molecules across the leaflet into nanoclusters, the clustering of GPI-APs or glycosphingolipids at the outer leaflet can also, conversely, organize the inner leaflet and recruit molecules that may favor liquid-ordered domains. This provides a possible explanation for the perplexing, yet well-characterized, ability of GPI-APs to transduce signals across the plasma membrane. There are many examples of transmembrane signaling via the cross-linking of GPI-APs with antibodies and clustering with a second antibody on various cells, particularly leukocytes.'
 'GPI-anchored proteins have an amino-terminal signal peptide for translocation into the ER and a carboxy-terminal GPI-addition signal peptide (more...) GPIs present microheterogeneity in their glycan side-chains depending on the species, cell types, and proteins (Online Appendix 12B, panels I–IV). A small number of enzymes involved in these reactions in mammals, yeast and T. brucei are known (Online Appendix 12B, panel V). Yeast and some mammalian GPIs possess a fourth α1-2Man (Man-4) residue added by Smp3/PIG-Z during GPI precursor assembly in the ER. Yeast GPI-APs have a fifth αMan (Man-5) residue added in the Golgi. A proportion of mammalian GPI-APs contain Man-1 modified by a β1-4N-acetylgalactosamine (GalNAc), and which may be further modified with a β1-4galactose (Gal), in the Golgi. An α2-3 sialic acid (Sia) could be added to the Gal. In T. brucei bloodstream forms, GPI-APs present glycan side-chains consisting of Gal, whereas the procyclic GPIs carry sialylated poly-N-acetyllactosamine and poly-lacto-N-biose structures. The transport of GPI-APs from the ER to the Golgi is mediated by coat protein II (COPII)-coated transport vesicles. Their packaging into the vesicles requires a transmembrane cargo receptor, a complex of four p24 family proteins, that links luminally oriented GPI to COPII components on the cytoplasmic side of the ER membrane. GPI-APs with two long hydrocarbon chains (i.e., those containing diacylglycerol, alkylacylglycerol, alkenylacylglycerol, or ceramide) are stably associated with the lipid bilayer. It follows that inositol-acylated GPI proteins with three fatty-acid chains should be more stably associated.'
 'First, the unsaturated sn-2 fatty acid (C18:1) is exchanged for a C26:0 chain. Next, the diacylglycerol is exchanged for ceramide on many, but not all, GPI-APs. Lipid remodeling in mammalian cells is more complex. Many protein-linked GPIs contain sn-1-alkyl-2-acyl-PI with two saturated fatty chains, whereas the major cellular PI is sn-1-stearoyl-2-arachidonoyl-PI (i.e., with C18:0 and C20:4 fatty acids and few, if any, alkyl or alkenyl species). Two processes are involved in these structural changes. First, remodeling from the diacyl-PI to diradyl-PI (mixtures of 1-alkyl-2-acyl-PI and diacyl-PI), having unsaturated fatty acid at the sn-2-position, occurs early in the pathway, within the ER, to produce GlcN-aPI with the remodeled lipid tail. The reaction responsible for this is not known, but alkyl phospholipids synthesized in the peroxisome serve as the alkyl donors. Second, fatty-acid remodeling, involving exchange of the unsaturated sn-2 fatty acid for a saturated fatty acid, mainly stearate (C18:0), occurs after the GPI-APs are transported to the Golgi. The GPI pathway genes were identified principally by expression cloning using GPI-deficient mutants of mammalian cells and temperature-sensitive yeast mutants. More recently, epitope tagging/pull-down/proteomic approaches have been used to identify GPI pathway–associated components. Some basic details of the known mammalian and yeast components and their topologies in the ER membrane are described in Table 12.1. Predicted topologies for the mammalian enzymes are shown in Figure 12.3. The GPI precursor is transferred to proteins via a multisubunit transamidase complex.']","The first complete GPI structures, which were for T. brucei VSG and rat Thy-1, were solved in 1988. To date, hundreds of GPI-anchored proteins (GPI-APs) have been identified in many eukaryotes, ranging from protozoa and fungi to plants and humans. The range of described GPI-APs and the distribution of putative GPI biosynthesis genes suggests that GPI anchors are almost ubiquitous among eukaryotes. GPI-APs are functionally diverse and include hydrolytic enzymes, adhesion molecules, complement regulatory proteins, receptors, protozoan coat proteins, and prion proteins. In mammals, alternative messenger RNA (mRNA) splicing may lead to the expression of transmembrane and/or soluble and GPI-anchored forms of the same gene product. These variants may be developmentally regulated.","The first tentative evidence for the existence of protein-phospholipid anchors appeared in 1963 with the finding that crude bacterial phospholipase C (PLC) selectively releases alkaline phosphatase from mammalian cells. Phosphatidylinositol (PI)-protein anchors were first postulated in the mid-1970s when highly purified bacterial PI-specific PLCs were observed to release proteins, such as alkaline phosphatase and 5′-nucleotidase, from mammalian plasma membranes. By 1985, these predictions were confirmed by compositional and structural data from studies on Torpedo acetylcholinesterase, human and bovine erythrocyte acetylcholinesterase, rat Thy-1, and the sleeping sickness parasite Trypanosoma brucei variant surface glycoprotein (VSG). The first complete GPI structures, which were for T. brucei VSG and rat Thy-1, were solved in 1988 (Chapter 1, Figure 1.3). To date, hundreds of GPI-anchored proteins (GPI-APs) have been identified in many eukaryotes, ranging from protozoa and fungi to plants and humans (Online Appendix 12A).",1.0,0.3648706898004874,0.7604027999218155,0.024691358024691357,0.9999999999857143,1.0
"Complete the following paragraph: Other classes of eukaryotic glycoprotein glycosylation  EGF repeats, also known as EGF domains, are small protein domains (∼40 amino acids) defined by six conserved Cys residues, which form three disulfide bonds (Figure 13.1A). They are found in a few hundred cell-surface and secreted proteins in metazoans and, depending on their sequence, may be modified with O-glycans as described in Table 13.1.","['O-Linked Glc-Gal disaccharides are added to hydroxylysine residues and play an important role in collagen fibril formation. Although the glycans described here are found on relatively few glycoproteins, they play specific and important roles in biology. In glycoproteins, the linkage between the first sugar of a glycan and the protein defines its glycosylation class (Chapter 1, Figure 1.7) including the common GlcNAc-N-Asn, GalNAc-O-Ser/Thr, and Xyl-O-Ser linkages present in glycoproteins and proteoglycans. The novel, nonclassical glycan Glcβ1–3Fucα-O-Thr was first discovered in human urine but garnered little interest at the time. However, finding O-fucose directly linked to various clotting proteins and signaling receptors, such as Notch, sparked considerable interest. Monoclonal antibodies that detect glycans on specific proteins such as α-dystroglycan provided tools to identify other novel glycans. In addition, mass spectrometry revealed unusual protein modifications, such as mannose linked to protein as a C-glycoside. Table 13.1 describes many of the less common linkages synthesized in the endoplasmic reticulum (ER)–Golgi secretory pathway. Chapters 18 and 19 describe the very few known glycosylation linkages synthesized in the nucleus and cytoplasm. Other classes of eukaryotic glycoprotein glycosylation  EGF repeats, also known as EGF domains, are small protein domains (∼40 amino acids) defined by six conserved Cys residues, which form three disulfide bonds (Figure 13.1A). They are found in a few hundred cell-surface and secreted proteins in metazoans and, depending on their sequence, may be modified with O-glycans as described in Table 13.1.'
 'They are found in a few hundred cell-surface and secreted proteins in metazoans and, depending on their sequence, may be modified with O-glycans as described in Table 13.1. Proteins with EGF repeats harboring these O-glycans include several involved in blood clot formation and dissolution, and the Notch family of receptors and canonical Notch ligands (Delta and Serrate/Jagged) involved in cell fate decisions. These glycan modifications are important because they regulate signal transduction during embryonic development and adult organ maintenance, cell differentiation, and the growth of several cancers. Moreover, mutations in several enzymes involved in the addition or elongation of these glycans have been found in human diseases (Chapter 45). Modifications of epidermal growth factor (EGF) repeats. (A) EGF repeats can be modified by O-fucose, O-glucose, and O-GlcNAc. A schematic representation of an EGF repeat is shown: (yellow) conserved Cys residues; (gray lines between the cysteines) disulfide-bonding (more...) The signaling pathway best known to be regulated by O-glycans on EGF repeats is the Notch signaling pathway. Notch was originally identified in Drosophila, and homologs have been found in all metazoans, with four Notch receptors in mammals. Activation of Notch signal transduction is controlled at numerous levels, and dysregulation of Notch signaling results in a number of human diseases, including several types of cancer and a variety of developmental disorders. Two classes of canonical ligands bind to and activate Notch signaling in Drosophila: Delta and Serrate. Mammals have three Delta-like homologs (DLL1, DLL3, and DLL4), and two Serrate homologs called Jagged 1 and 2 (JAG1 and JAG2). These ligands are single-pass transmembrane glycoproteins that bind to and trans-activate Notch receptors on an adjacent cell.'
 'See Table 6.1 for some amino acid–consensus sequences or glycosylation motifs used in the formation of glycopeptide bonds. Amino acid–consensus sequences or glycosylation motifs for the formation of glycopeptide bonds  The endoplasmic reticulum (ER)-resident O-fucosyltransferases, POFUT1 and POFUT2, that specifically fucosylate epidermal growth factor (EGF)-like domains and thrombospondin type 1 repeats (TSRs), respectively (Chapter 13), differ fundamentally from most other glycosyltransferases. In addition to recognizing a specific sequence motif containing the target serine or threonine residue (Table 6.1), these enzymes only act on EGF-like domains and TSRs that are properly folded and disulfide-bonded. Glycosyltransferases that add O-Glc and O-GlcNAc to other serine and threonine residues in the EGF-like domain also exist and these enzymes also recognize a specific sequence motif and require a folded EGF-like domain. A number of the glycan-elongating glycosyltransferases that act on glycoproteins also recognize the polypeptide moiety of their acceptor substrates. The glycoprotein hormone GalNAc transferase (a member of the family of β1-4GalNAcTs) provides an interesting example in which modification of an N-glycan is dependent on the presence of the protein sequence motif Pro-X-Arg/Lys positioned several amino acids amino-terminally to the N-glycan being modified. The motif is typically followed closely by additional positively charged residues. The X-ray crystal structure of its acceptor substrate, human chorionic gonadotropin, shows that the Pro-X-Arg/Lys motif is at the beginning of a short surface-exposed helix that also contains the additional positively charged residues (Figure 6.2).'
 'Homologs of POGLUT1, termed POGLUT2 and POGLUT3, are responsible for modifying this site. The O-glucose at this site has not been reported to be elongated past the monosaccharide. Although β-linked O-GlcNAc is very common on proteins in the nuclear and cytosolic compartments (Chapter 19), the same modification can be found in comparatively few membrane and secreted proteins. Addition of O-GlcNAc occurs between the fifth and sixth conserved Cys of an EGF repeat at the putative consensus C5XXXX(S/T)GX2-3C6 (Figure 13.1A) in mouse and Drosophila Notch. However, sites have been mapped on only a few proteins. The O-GlcNAc can be elongated by β1,4Gal followed by a sialic acid to form Siaα2-3/6Galβ1-4GlcNAc. The EGF-specific O-GlcNAc transferase, EOGT, is distinct from OGT, the GlcNAc-transferase that modifies nuclear and cytoplasmic proteins (Chapter 19). Inactivation of Drosophila Eogt is pupal lethal and causes a wing-blistering defect if deleted in the wing. The Drosophila phenotype can be explained by an EOGT substrate Dumpy and no obvious Notch-deficient phenotypes have been observed. However, genetic interactions between eogt and Notch pathway gene mutations occur in the fly and mutations in human EOGT result in skin and skeletal problems in AOS (Adams–Oliver syndrome type 4; OMIM 615297), a disorder with links to the Notch pathway. Consistently, EOGT in mice regulates vascular development and integrity by potentiating Delta-like ligand-mediated Notch signaling. O-Fucose is also found on TSRs. Similar to EGF repeats, TSRs are small protein domains (50–60 amino acids) with six conserved Cys that form three disulfide bonds (Figure 13.4).'
 'NCBI Bookshelf. A service of the National Library of Medicine, National Institutes of Health. Varki A, Cummings RD, Esko JD, et al., editors. Essentials of Glycobiology [Internet]. 4th edition. Cold Spring Harbor (NY): Cold Spring Harbor Laboratory Press; 2022.  doi: 10.1101/glycobiology.4e.13 Robert S. Haltiwanger, Lance Wells, Hudson H. Freeze, Hamed Jafar-Nejad, Tetsuya Okajima, and Pamela Stanley. This chapter focuses on less-easily categorized types of glycan linkages that occur on certain proteins or domains. O-linked sugars on epidermal growth factor (EGF)-like repeats (O-fucose, O-glucose, and O-GlcNAc) regulate Notch signaling and the functions of several other proteins. O-Fucosylation of thrombospondin type-1 repeats (TSRs) is required for folding of these domains in a number of secreted matricellular proteins. O-mannosylation of α-dystroglycan is essential for interactions with several extracellular matrix (ECM) proteins. Defects in the glycosyltransferases that add these glycans (O-fucose, O-glucose, O-GlcNAc, and O-mannose) result in human diseases. C-Mannosylation is a unique form of glycosylation in which mannose is linked through a carbon–carbon bond to tryptophan. O-Linked Glc-Gal disaccharides are added to hydroxylysine residues and play an important role in collagen fibril formation. Although the glycans described here are found on relatively few glycoproteins, they play specific and important roles in biology.'
 'The enzymes involved in each of these modification pathways are distinct. N-linked glycans and GPI anchors are preassembled before being transferred to proteins and then further modified in the ER–Golgi pathway. The stepwise assembly of O-linked glycans and glycosaminoglycans, as well as the glycosylation of lipids, involve reactions in both the ER and Golgi (Chapters 9–13 and 17). Figure 4.1 superficially depicts some steps in the synthesis of the major glycan classes in the ER–Golgi pathway of animal cells. Initiation and maturation of the major types of eukaryotic glycoconjugates in relation to subcellular trafficking in the ER–Golgi–plasma membrane pathway. This illustration outlines the different mechanisms and topology for initiation, (more...) In the ER–Golgi pathway, some glycan chains are made on the cytoplasmic face of intracellular membranes and flipped across to the other side, but most are added to the growing chain on the inside of the ER or the Golgi (Figure 4.1). Regardless, the portion of a molecule that faces the inside of the lumen of the ER or Golgi will ultimately face the outside of the cell or the inside of a secretory granule or lysosome. To date, there are no well-documented exceptions to this topological rule. Of course, these topological considerations are reversed for nuclear and cytoplasmic glycosylation (see below), because the active sites of the relevant glycosyltransferases for these reactions face the cytoplasm. Not surprisingly then, the types of glycans found on the two sides of the cell membrane so far appear to be distinct from each other. Some “leaderless secretory proteins” destined for the extracellular space never enter the ER lumen, but are instead transferred directly through the plasma membrane, by as yet poorly defined mechanisms, including cytokines such as IL-1β and IL-18, growth factors such as fibroblast growth factor 2 (FGF2), and galectins.'
 'These enzymes are involved in the synthesis of the Man-6-P targeting signal of newly synthesized lysosomal hydrolases (see Chapter 33). Some ER glycosylation enzymes are synthesized as soluble proteins. These include the UDP-glucose glycoprotein glucosyltransferase (UGGT) involved in ER quality control (Chapter 39), and enzymes involved in epidermal growth factor (EGF) repeat or thrombospondin type 1 repeat (TSR) glycosylation such as the two protein O-fucosyltransferases, POFUT1 (EGF-like repeats) and 2 (TSR), protein O-glucosyltransferases 1, 2, and 3 (POGLUT1-3; EGF-like repeats), EGF-specific O-GlcNAc transferase (EOGT; EGF-like repeats), and β1-3-glucosyltransferase (B3GLCT; TSR) (Chapter 13). In addition, one of the sulfotransferases involved in heparan sulfate synthesis, GlcNAc 3-O-sulfotransferase 1, is a soluble enzyme in the Golgi. All forms of glycosylation in the secretory pathway are highly ordered and sequential processes, typically involving glycosyltransferase reactions. These enzymes, their glycan substrates (attached to protein or lipid), and the appropriate nucleotide sugar donor must be located in the same compartment. Biochemical and ultrastructural studies indicate that glycosyltransferases segregate into distinct overlapping compartments within the secretory pathway. Generally speaking, enzymes acting early in the biosynthetic pathway localize to cis- and medial-Golgi compartments, whereas those acting later in the pathway tend to localize in the trans-Golgi cisternae and the TGN. These observations prompted extensive exploration of mechanisms whereby glycosyltransferases and processing glycosidases achieve this compartmental segregation.']","Other classes of eukaryotic glycoprotein glycosylation include EGF repeats, which are small protein domains defined by six conserved Cys residues forming three disulfide bonds. These EGF repeats are present in a few hundred cell-surface and secreted proteins in metazoans and can be modified with O-glycans based on their sequence, as outlined in Table 13.1.","Proteins with EGF repeats harboring these O-glycans include several involved in blood clot formation and dissolution, and the Notch family of receptors and canonical Notch ligands (Delta and Serrate/Jagged) involved in cell fate decisions. These glycan modifications are important because they regulate signal transduction during embryonic development and adult organ maintenance, cell differentiation, and the growth of several cancers. Moreover, mutations in several enzymes involved in the addition or elongation of these glycans have been found in human diseases (Chapter 45).",1.0,0.6646057827892193,0.7158819319572785,0.05,0.9999999999857143,1.0
"Complete the following paragraph: Blood banks perform typing and cross-matching assays. First, units of erythrocyte products typed for the A and B antigens are chosen to match the patient's ABO type. To ensure that these are truly “compatible,” the patient's serum is cross-matched by mixing with a small aliquot of each prospective erythrocyte unit. Erythrocytes of compatible units do not agglutinate (form an erythrocyte clump), whereas incompatibility is indicated by agglutinated erythrocytes formed by antibodies in the patient's serum.","[""Blood banks perform typing and cross-matching assays. First, units of erythrocyte products typed for the A and B antigens are chosen to match the patient's ABO type. To ensure that these are truly “compatible,” the patient's serum is cross-matched by mixing with a small aliquot of each prospective erythrocyte unit. Erythrocytes of compatible units do not agglutinate (form an erythrocyte clump), whereas incompatibility is indicated by agglutinated erythrocytes formed by antibodies in the patient's serum. Blood typing is used to ensure compatibility not only for red blood cell transfusions but also for transfusion with platelets and plasma. Similar ABO compatibility concerns are important in heart, kidney, liver, and bone marrow transplantation procedures. The “type and cross” procedures have virtually eliminated ABO blood group transfusion reactions in the developed world. Attempts are being made to enzymatically modify A or B erythrocytes using glycosidases to remove GalNAc (A) and/or Gal (B), in order to convert them to “O”, the “universal donor” type. The few individuals with AB type are “universal acceptors.” In addition to accurately typing AB blood types, A1 and A2 blood group distinctions are important clinically as A2 individuals can generate anti-A1 antibodies, although these antibodies are often not clinically meaningful. Furthermore, when crossing ABO(H) barriers during solid organ transplantation, A2 donor organs have better overall survival when compared to A1 following transplantation into a blood group O or B recipient; this is presumably because of the lower expression of the A antigen in A2 individuals. In addition to transfusion and transplantation, ABO(H) alloantigens are some of the most frequent allogeneic barriers crossed during fetal development. IgG anti-A,B antibodies present in blood group O mothers, which react with the A and B antigen, can cross the placenta and engage A or B antigens on the surface of fetal red blood cells (RBCs).""
 ""Early in the postnatal period, the immune system generates IgM antibodies against ABO antigen(s), even though they are absent from erythrocytes. This is because glycan antigens similar or identical to the A and B blood group determinants are carried by colonizing bacteria and fungi. Thus, type-O individuals do not synthesize A or B determinants but show relatively high titers of circulating IgM antibodies (termed isoagglutinins) against A and B blood group determinants. Similarly, blood group B individuals show circulating IgM anti-A isoagglutinins, but they do not make isoagglutinins against the blood group B determinant, a “self” antigen. Conversely, serum from blood group A individuals contains anti-B but not anti-A antibodies. Finally, people with the AB blood group do not make either anti-A or anti-B IgM isoagglutinins, because both are “self” antigens. Anti-H(O) antibodies are not made in most people because a substantial fraction are converted to A or B determinants or they are a “self” antigen. IgM isoagglutinins efficiently trigger the complement cascade and circulate in human plasma at titers sufficient to cause complement-dependent lysis of transfused erythrocytes that display the corresponding blood group antigens. Such rapid erythrocyte lysis causes an immediate, acute transfusion reaction, which can lead to hypotension, shock, acute renal failure, and death from circulatory collapse. This problem is avoided by ensuring that the ABO type of transfused erythrocytes is compatible with the recipient's ABO type. Thus, an A recipient may receive erythrocytes from A or O persons but not from a person of type B or AB. Blood banks perform typing and cross-matching assays. First, units of erythrocyte products typed for the A and B antigens are chosen to match the patient's ABO type. To ensure that these are truly “compatible,” the patient's serum is cross-matched by mixing with a small aliquot of each prospective erythrocyte unit.""
 'A, B, and H determinants of the epidermis are primarily on Type-2 units, whereas mucins of the gastric mucosa and in ovarian cyst fluid carry A, B, and H antigens on Type-3 units (Figure 14.4). Epithelial cells lining the digestive, respiratory, urinary, and reproductive tracts, and epithelia of some salivary and exocrine glands, synthesize soluble forms of the ABO(H) determinants, largely carried on Type-1 units (Figure 14.4). Expression of the A, B, and H determinants in secretory tissues is a function of the α1-2FucT encoded by the Se gene (FUT2), because the H gene (FUT1) is not expressed there. Humans with an inactive FUT2 gene do not express soluble forms of the A, B, or H determinants in saliva or milk oligosaccharides or in other tissues and are termed “nonsecretors.” Serology is used to characterize erythrocytes for transfusion and has identified variants of the A and B blood group determinants that typically yield weak reactivity with blood typing reagents. Interestingly, plant lectins were used historically to aid in typing blood. For example, the lectin from Dolichos biflorus agglutinates erythrocytes from most blood group A individuals (termed A1 individuals), but it does not agglutinate erythrocytes from individuals of the A2 subgroup, and it is still used currently to distinguish individuals with these two different blood types. The A1 and A2 subgroup antigens are distinct (Figure 14.5) reflecting the different A transferases encoded by the A1 versus A2 allele at the ABO locus. Heritable erythrocyte antigenic polymorphisms determined by the ABO locus have important medical implications. Early in the postnatal period, the immune system generates IgM antibodies against ABO antigen(s), even though they are absent from erythrocytes. This is because glycan antigens similar or identical to the A and B blood group determinants are carried by colonizing bacteria and fungi.'
 'IgG anti-A,B antibodies present in blood group O mothers, which react with the A and B antigen, can cross the placenta and engage A or B antigens on the surface of fetal red blood cells (RBCs). However, unlike IgG antibodies against other alloantigens, such as RhD, IgG anti-A,B antibodies rarely cause life-threatening anemia in a fetus or neonate, presumably because of the relatively low level of A and B antigen expression present on fetal RBCs. However, despite the lower level of A and B expression on fetal RBCs, anti-A and anti-B antibodies present in maternal circulation can rapidly remove A or B positive fetal RBCs following exposure during parturition, reducing the probability of alloimmunization to other alloantigens. This was the first example of antibody-mediated immunosuppression clinically and formed the basis of highly successful anti-RhD formularies designed to prevent Rh alloimmunization and therefore hemolytic disease of the fetus and newborn. Cross-matching procedures helped to identify a rare ABO blood group phenotype termed the Bombay phenotype, so named because the first identified individual lived in that city (now Mumbai). Affected persons have erythrocytes and tissue cells lacking A, B, and H determinants because they have inactive FUT1 and FUT2 genes, and therefore no α1-2FucT enzyme. Bombay sera contain IgM antibodies that react with erythrocytes from virtually all donors, including O erythrocytes (H antigen-positive, A and B antigen-negative). They show robust titers of anti-H, anti-A, and anti-B IgM antibodies and cannot receive erythrocytes from any donor except those of the same Bombay blood type. A related phenotype, termed para-Bombay, occurs in people with an inactive FUT1 gene, but at least one functional Se (FUT2) allele (secretor-positive). The fact that Bombay individuals appear generally healthy implies that developmental or physiological functions for the A, B, and H antigens, if they ever existed, are no longer relevant.'
 'Sickle cell anemia is an inherited disorder of hemoglobin that leads to various acute and chronic painful complications. Symptoms were thought to be caused by vaso-occlusion due to abnormally shaped and/or membrane-modified hypoxic erythrocytes. Now, it is clear that abnormal adhesion of multiple cell types is responsible, and that this is partially mediated by selectins. Blocking selectin action with analogs of natural ligands such as sLex or heparin can restore blood flow in a mouse model of sickle cell disease. A pan-selectin inhibitor (GMI-1070, “rivipansel”) has undergone clinical trials for reduction of severity and duration of sickle cell crisis. Notably, glycopeptide mimetics of PSGL-1 and antibodies that block PSGL-1-P-selectin interactions (e.g., FDA-approved crizanlizumab) can mitigate sickle cell vaso-occlusive crises. Blood transfusion medicine first identified the ABO blood group system, defined by differential expression of α-GalNAc and α-Gal transferases across populations (Chapter 14). These and other less prominent glycan antigens can cause hemolytic transfusion and rejection reactions, mostly because of errors in blood typing. Although anti-A and anti-B titers likely influence transfusion and transplantation outcomes, simple assessment of antibody levels fails to fully account for the clinical impact(s) of an ABO(H) incompatible transfusion. Efforts to generate “universal donor” red blood cells, via enzymatic conversion of blood group A and B antigens to the O state using bacterial enzymes, are underway. Occasionally, patients with diseases such as cirrhosis and hepatocellular carcinoma spontaneously secrete a circulating anticoagulant and have an unusual coagulation test profile that makes it appear as if the patient has been treated with heparin. The anticoagulant activity can be purified from the plasma and has been identified as an HS glycosaminoglycan. Its source is unknown and therapy is difficult without correcting the underlying disease or transplanting the liver.'
 'Glycomimetics that preserve the essential functionality of the parent tetrasaccharide but eliminate unwanted polar functional groups and synthetically cumbersome glycan components have been successful. The design of a monosaccharide glycomimetic starting from sialyl-Lewis x is shown in Figure 57.3. First, the sialic acid residue was replaced with a charged glycolic acid group, the N-acetylglucosamine residue was then replaced with an ethylene glycol linker, and finally the galactose residue was replaced with a linker moiety. The resulting glycomimetic had E-selectin binding affinity comparable to sialyl-Lewis x. Glycomimetic E-selectin inhibitors based on sialyl-Lewis x.  GMI-1070, targeting E-, P-, and L-selectin, yielded unconvincing results in Phase 3 clinical trials as a treatment for sickle cell crisis and is under further investigation. A variety of glycans, including the classical A and B blood group determinants, can act as barriers to blood transfusion and transplantation of organs (Chapters 13 and 46). Rejection of mismatched blood or organs occurs because hosts have a high titer of preexisting antibodies against the glycan epitopes, presumably as a prior reaction to related structures found on bacteria or other microbes. In the case of the ABO blood groups, incompatibility is routinely managed by blood and tissue typing and finding an appropriate donor for the recipient. Bacterial enzymes can be used in vitro to remove the A and B blood group determinants from A and B red cells, converting them into “universal donor” O red cells. A related problem is found in xenotransplantation (i.e., the transplantation of organs between species), which is actively being pursued as a solution for the shortage of human organs for patients. The animal donors of preference are pigs, because many porcine organs resemble those of humans in size, physiology, and anatomy. However, unlike humans and certain other primates, pigs and most other mammals produce the terminal “α-Gal” epitope on glycoproteins and glycolipids.'
 'Additional variants of α1-3GalNAcT and α1-3GalT exist that are enzymatically active, but at a much lower level. These variants are largely responsible for individuals who are initially typed as blood group O, but actually express very low levels of the A or B blood group antigen. The ABO antigens are expressed on membrane glycoproteins and glycolipids on the surface of erythrocytes and many epithelial or endothelial cells in tissues. Some tissues also synthesize soluble forms on secreted glycoproteins, glycolipids, and free glycans. As discussed below, the ability to secrete soluble molecules carrying ABO(H) blood group antigens is a genetically determined function of alleles at the Se (FUT2) locus. On each human red blood cell, ∼80% of the 1–2 million ABO(H) determinants are attached to the anion transport protein Band 3, and ∼15% are carried by the erythrocyte glucose transport protein Band 4.5. Both of these integral membrane proteins carry ABO(H) antigens on a single, branched N-glycan with poly-LacNAc. Each erythrocyte has other glycoproteins and approximately half a million glycolipids with ABO(H) determinants. Many of these glycolipids have A, B, and H determinants on poly-LacNAc chains and have been termed polyglycosylceramides or macroglycolipids. A, B, and H determinants based on Type-4 chains (Figure 14.4) are also present in human erythrocyte glycolipids. A, B, and H determinants of the epidermis are primarily on Type-2 units, whereas mucins of the gastric mucosa and in ovarian cyst fluid carry A, B, and H antigens on Type-3 units (Figure 14.4).']","Erythrocytes of compatible units do not agglutinate (form an erythrocyte clump), whereas incompatibility is indicated by agglutinated erythrocytes formed by antibodies in the patient's serum. Blood typing is used to ensure compatibility not only for red blood cell transfusions but also for transfusion with platelets and plasma. Similar ABO compatibility concerns are important in heart, kidney, liver, and bone marrow transplantation procedures. The “type and cross” procedures have virtually eliminated ABO blood group transfusion reactions in the developed world.","Blood typing is used to ensure compatibility not only for red blood cell transfusions but also for transfusion with platelets and plasma. Similar ABO compatibility concerns are important in heart, kidney, liver, and bone marrow transplantation procedures. The “type and cross” procedures have virtually eliminated ABO blood group transfusion reactions in the developed world. Attempts are being made to enzymatically modify A or B erythrocytes using glycosidases to remove GalNAc (A) and/or Gal (B), in order to convert them to “O”, the “universal donor” type. The few individuals with AB type are “universal acceptors.” In addition to accurately typing AB blood types, A1 and A2 blood group distinctions are important clinically as A2 individuals can generate anti-A1 antibodies, although these antibodies are often not clinically meaningful. Furthermore, when crossing ABO(H) barriers during solid organ transplantation, A2 donor organs have better overall survival when compared to A1 following transplantation into a blood group O or B recipient; this is presumably because of the lower expression of the A antigen in A2 individuals.",1.0,0.6580310412808009,0.828038561947218,0.011764705882352941,0.9761904761742063,1.0
"Complete the following paragraph: Given their high density and widespread location on vertebrate cells, Sias also exert many functions via electronegative charge, such as repulsion of cell–cell interactions, protein stabilization, ion binding, and ion transport. Early nomenclature of these molecules was tied to their discovery, being first isolated by Gunnar Blix from salivary mucins in 1936 and independently by Ernst Klenk from brain glycolipids in 1941. Blix named his substance “sialic acid” after the Greek word for saliva (σíαλoν), and Klenk named his “neuraminic acid” for neurons in the brain. By the time the relationship of these substances became evident, both names were already in use and have persisted.","['Early nomenclature of these molecules was tied to their discovery, being first isolated by Gunnar Blix from salivary mucins in 1936 and independently by Ernst Klenk from brain glycolipids in 1941. Blix named his substance “sialic acid” after the Greek word for saliva (σíαλoν), and Klenk named his “neuraminic acid” for neurons in the brain. By the time the relationship of these substances became evident, both names were already in use and have persisted. Although 5-N-acetylneuraminic acid (Neu5Ac, sometimes called “NANA”) is the most common sialic acid (Sia) in humans, the Sia family is comprised of related structures (Figure 15.1) that vary at the C-5 carbon, including 5-N-glycolylneuraminic acid (Neu5Gc) and 3-deoxy-D-glycero-D-galacto-non-2-ulosonic acid (also known as 3-deoxy-nonulosonic acid, 2-keto-3-deoxy-nononic acid, or Kdn) with a hydroxyl group at C-5. Similar 9-carbon backbone 2-keto acid monosaccharides were later discovered in some bacterial lipopolysaccharides and initially called “bacterial sialic acids.” The resulting confusion was resolved by suggesting that the term “sialic acid” (Sia) be limited to its original use in describing neuraminic acid (Neu), Kdn, and their derivatives in deuterostomes and their pathogens, and that the term “nonulosonic acid” (NulO) be used to encompass the entire group of 9-carbon backbone non-2-ulosonic acids (Figure 15.1). Base structures representing the larger family of NulO molecules are shown in Figure 15.1 for comparison. This chapter will largely deal with the biology, metabolism, and functions of Sias in mammals.'
 'Several bacterial toxins also target sialoglycans. Cholera toxin and the structurally related E. coli heat-labile enterotoxin both bind to Sias on ganglioside GM1 on the intestinal epithelium, whereas tetanus and related botulinum toxins bind to more complex gangliosides (Chapter 37). The toxin from the human pathogen Salmonella Typhi binds specifically to Neu5Ac on glycans but not Neu5Gc; influenza C virus expresses a hemagglutinin that binds only to 9-O-acetylated Sias. The complexities of Sia diversification are thought to be the outcome of an ongoing evolutionary “arms race” between animals and microbial pathogens (Chapter 20). In this regard, it is notable that O-acetyl and N-glycolyl groups on Sias can limit action of bacterial sialidases and block the binding of some pathogens. Alternately, the same modifications may facilitate binding of pathogens that have adapted to them. Sialoglycans at environmental surfaces (like mucins) or free in biological fluids might provide protection by virtue of their “decoy” inhibition of microbial adherence and/or sialidases. The evolutionary persistence of sialoglycans despite their role in virulent diseases suggests critical physiological roles, some of which are addressed below. A few classic examples of sialic acid–binding proteins in nature  Sias in vertebrates can act as “biological masks,” preventing recognition of underlying glycans (especially β-linked Gal residues) by intrinsic and extrinsic glycan-binding proteins. They are also essential components of recognition molecules, with roles that vary according to cell type, tissue type, and species. The first mammalian Sia-binding protein found was the complement regulatory molecule factor H, a soluble serum factor that binds cell-surface Sias and protects cells from autoimmune attack, providing recognition of “self-associated molecular patterns” (SAMPs), which are also recognized by CD33-related Siglecs (Chapter 35).'
 'NCBI Bookshelf. A service of the National Library of Medicine, National Institutes of Health. Varki A, Cummings RD, Esko JD, et al., editors. Essentials of Glycobiology [Internet]. 4th edition. Cold Spring Harbor (NY): Cold Spring Harbor Laboratory Press; 2022.  doi: 10.1101/glycobiology.4e.15 Amanda L. Lewis, Xi Chen, Ronald L. Schnaar, and Ajit Varki. Sialic acids (Sias) are abundant on vertebrate glycoproteins, glycolipids, and milk oligosaccharides, as well as on some microbial surface glycans, mediating diverse functional roles. Originally discovered within the Deuterostome lineage of animals and associated microbes, they are actually a subset of a more ancient family of α-keto acid monosaccharides with a 9-carbon backbone called nonulosonic acids (NulOs), which are also found in some Eubacteria and Archaea. Biosynthesis of all NulO-glycans requires the activation of NulO to a CMP-sugar, before the NulO is transferred to glycan acceptors. NulOs are remarkable for the number and the type of functional groups on one monosaccharide. Further complexity arises from various epimers, modifications, and diverse linkages to other glycans, making these molecules well-suited to carry information for glycan–protein, cell–cell, and pathogen–host recognition. NulOs are among the most rapidly evolving classes of monosaccharides in nature and exist in tremendous variety, particularly in the microbial world. Given their high density and widespread location on vertebrate cells, Sias also exert many functions via electronegative charge, such as repulsion of cell–cell interactions, protein stabilization, ion binding, and ion transport. Early nomenclature of these molecules was tied to their discovery, being first isolated by Gunnar Blix from salivary mucins in 1936 and independently by Ernst Klenk from brain glycolipids in 1941.'
 'The stability of each modification to analytical conditions must be considered—for example, O-acetyl groups are labile to common methods that use alkaline conditions (permethylation and beta-elimination). Sia-binding lectins are also useful for detecting sialoglycans and their linkages in situ and on isolated sialoglycans. Sambucus nigra (elderberry) lectin binds selectively to α2-6-linked Sias and Maackia amurensis lectins bind selectively to α2-3-linked Sias. Because plants do not express Sias, these lectins may perhaps deter animal ingestion. Alternatively, the natural ligands of these lectins may not be Sias. Improved probes are now being developed, taking advantage of the fact that many microbes have spent millions of years optimizing their binding to vertebrate sialomes (e.g., the B subunits of various toxins). An interesting tool for detecting a specific Sia modification is the hemagglutinin of influenza C or bovine coronavirus, which bind specifically to 9-O-acetyl Sias on isolated sialoglycans, cells, and tissues, if the esterase function is inactivated. Sias are endowed with a rich diversity of chemical modalities within a single monosaccharide, which evolution uses to modulate the biophysical environment, to mask underlying glycans, and for specific recognition by complementary Sia-binding proteins that mediate biological processes. These functions are not mutually exclusive—for example, highly sialylated molecules with major biophysical roles (such as mucins) may also express specific sialoglycans that serve as ligands in recognition processes. For simplicity, different roles of Sias are addressed separately below. Mucins are heavily glycosylated O-GalNAc-modified sialoglycoproteins secreted or membrane-bound at epithelial surfaces in airways and in the gastrointestinal and urogenital tracts of animals (Chapter 10). Mucins can be remarkably large (several in the range of 5 to >20 MDa).'
 'In humans, there are 14 Siglecs with sialic acid–dependent functions (13 and 17 are missing in humans and 12 does not bind sialic acid), all but one of which are found on the surface of different blood cell types. In several cases, binding of Siglecs to their sialoglycan targets on other cells or their own cell surface modulates ongoing immune responses, either damping them to protect from hyperimmune reactions or activating them. The one Siglec not found in the immune system, Siglec-4 (myelin-associated glycoprotein), is in the nervous system, where it aids cell–cell interactions between nerve cells and myelin, the protective and insulating membrane sheath essential to rapid nerve conduction. Notably, all the above examples of vertebrate Sia-recognizing proteins were discovered serendipitously, via the unexpected abrogating effect of sialidases on a biological process. To date, there has been no systematic effort to search for other examples, but other likely vertebrate Sia-binding lectins are PECAM-1, PILRs, L1-CAM, HMGB-1, and an as-yet-unidentified uterine agglutinin. The many functions of Sias in vertebrates make these molecules particularly attractive targets for microbes that co-exist with the host, whether harmoniously or not. As discussed elsewhere, there are several independent mechanisms of Sia mimicry, which promote bacterial interactions with host factor H and Siglecs to enable survival in the host. Some Sia-binding lectins are found in organisms that do not themselves appear to express Sias (see Table 15.1 for examples). In these cases, Sia binding may defend against sialylated pathogens, such as the protein limulin in the hemolymph (blood-like fluid) of the horseshoe crab, which can trigger foreign cell lysis. Sia-binding lectins in plants, such as elderberry shrubs, may suppress consumption by animals.'
 'Mucins are heavily glycosylated O-GalNAc-modified sialoglycoproteins secreted or membrane-bound at epithelial surfaces in airways and in the gastrointestinal and urogenital tracts of animals (Chapter 10). Mucins can be remarkably large (several in the range of 5 to >20 MDa). Their dense anionic charge and their propensity to bind water make them efficient as a hydrating and protective barrier at tissue surfaces in contact with the environment. On mucins, as well as other glycoproteins, closely spaced O-GalNAc-linked sialoglycans generate extended polypeptide configurations that would collapse without glycosylation. Clustered sialoglycans along the polypeptide chain can also protect the underlying protein from proteases. Membrane-bound sialoglycans on glycoproteins and glycolipids, which are often quite dense, provide cell surface anionic charge that acts as a barrier and regulates cell surface functions. An extreme example of these biophysical effects is polySia, whose functional impacts are detailed above. Given Sia abundance on cell surfaces (see Figure 15.3), it is not surprising that numerous animal pathogens evolved to target these molecules. Indeed, highly specific Sia-binding proteins were first discovered on human pathogens and their toxins. In the search for host cell receptors for influenza viruses, it was discovered that isolated viruses cross-linked red blood cells, resulting in hemagglutination. Over time, the red cells dispersed and could no longer be agglutinated by fresh viruses. This led to the concept of a viral “hemagglutinin” (a term still used in virus typing; e.g., the “H” in H1N1) that binds to a receptor on the red blood cell, which is also susceptible to a “receptor destroying enzyme” from the virus.'
 'These properties are likely biologically significant, but have not been well investigated. Microbial sialidases and trans-sialidases (see also Chapter 43) can be powerful virulence factors that may promote cellular invasion, unmask potential binding sites, and modulate the immune system. Sias liberated by sialidases at mucosal sites also provide nutrients for some bacteria or provide access to underlying carbohydrates. Viral neuraminidases facilitate release and spreading of newly formed viruses, and specific viral neuraminidase inhibitors are widely used as the antiviral drugs such as anti-influenza A virus drugs Relenza and Tamiflu (Chapter 42). Once a free Sia molecule is released in the lysosome of a vertebrate cell, it is returned to the cytosol by a specific exporter (SLC17A5, also called Sialin), in which it is either reused or degraded. Human mutations in Sialin cause Salla disease and infantile sialic acid storage disease, resulting in accumulation of Sia in lysosomes and excretion of excess Sia in the urine. Some pathogens scavenge Sias from the extracellular space, using high-efficiency transporters to concentrate them from trace levels. In contrast, there is no evidence for plasma membrane Sia transporters in eukaryotic cells. Nevertheless, free Sias can be taken up into mammalian cells via fluid-phase macropinocytosis, eventually arriving in the lysosomes, from which they are exported into the cytoplasm by Sialin. Intact sialoglycans can also be taken up and transported to lysosomes, where sialidases release Sias for delivery to the cytoplasm and then to the nucleus to be reused by the cellular CMP-Sia synthetase. However, at the whole-body level, free Sias in the bloodstream derived from cellular sources or digestive processes are rapidly excreted in the urine. Thus, uptake of sialoglycoproteins (followed by lysosomal release by NEU1 and export by Sialin) may better account for the incorporation of dietary Neu5Gc in human tissues.']","Sias are abundant on vertebrate glycoproteins, glycolipids, and milk oligosaccharides, as well as on some microbial surface glycans, mediating diverse functional roles. Originally discovered within the Deuterostome lineage of animals and associated microbes, they are actually a subset of a more ancient family of α-keto acid monosaccharides with a 9-carbon backbone called nonulosonic acids (NulOs), which are also found in some Eubacteria and Archaea. Biosynthesis of all NulO-glycans requires the activation of NulO to a CMP-sugar, before the NulO is transferred to glycan acceptors. NulOs are remarkable for the number and the type of functional groups on one monosaccharide. Further complexity arises from various epimers, modifications, and diverse linkages to other glycans, making these molecules well-suited to carry information for glycan–protein, cell–cell, and pathogen–host recognition. NulOs are among the most rapidly evolving classes of monosaccharides in nature and exist in tremendous variety, particularly in the microbial world.","Although 5-N-acetylneuraminic acid (Neu5Ac, sometimes called “NANA”) is the most common sialic acid (Sia) in humans, the Sia family is comprised of related structures (Figure 15.1) that vary at the C-5 carbon, including 5-N-glycolylneuraminic acid (Neu5Gc) and 3-deoxy-D-glycero-D-galacto-non-2-ulosonic acid (also known as 3-deoxy-nonulosonic acid, 2-keto-3-deoxy-nononic acid, or Kdn) with a hydroxyl group at C-5. Similar 9-carbon backbone 2-keto acid monosaccharides were later discovered in some bacterial lipopolysaccharides and initially called “bacterial sialic acids.” The resulting confusion was resolved by suggesting that the term “sialic acid” (Sia) be limited to its original use in describing neuraminic acid (Neu), Kdn, and their derivatives in deuterostomes and their pathogens, and that the term “nonulosonic acid” (NulO) be used to encompass the entire group of 9-carbon backbone non-2-ulosonic acids (Figure 15.1).",1.0,0.6874831099090112,0.7019997891598098,0.012345679012345678,0.9999999999857143,0.6666666666666666
"Complete the following paragraph: Large hyaluronan polymers in the extracellular space can be internalized following interaction with cell-surface receptors that trigger endocytosis, which may be facilitated by the membrane-associated hyaluronidases, HYAL2 and/or TMEM2, or through association with CEMIP.","['HARE appears to be the major clearance receptor for hyaluronan delivered systemically by lymph and blood. The current understanding of this catabolic process is that hyaluronidases at the cell surface and in the lysosome cooperate to degrade the chains. Large hyaluronan polymers in the extracellular space can be internalized following interaction with cell-surface receptors that trigger endocytosis, which may be facilitated by the membrane-associated hyaluronidases, HYAL2 and/or TMEM2, or through association with CEMIP. The hyaluronan fragments may be returned to the extracellular space via recycling endosomes or enter a pathway to lysosomes for complete degradation to monosaccharides, probably involving HYAL1 and the two exoglycosidases β-glucuronidase and β-N-acetylglucosaminidase. The importance of the turnover process for growth and survival is demonstrated by the respective embryonic lethal phenotypes in animal models. Hyal2-null mice and Tmem2-deficient zebrafish both suffer embryonic lethality as a result of cardiac developmental defects. CEMIP is important for clearing hyaluronan accumulation during bacterial infection in mice. In humans, a lysosomal storage disorder was found to result from mutation of HYAL1 (Chapter 44). Hyaluronan fragments have been suggested to act as an endogenous signal of injury, or during infection by Group A Streptococcus, which contains a hyaluronan capsule. The signaling activity of hyaluronan fragments is mediated through binding of cell-surface receptors, such as CD44, which in turn modulates response through Toll-like receptors. Signaling through these and other receptors is affected by the size of the hyaluronan fragments, but the mechanism underlying the dependence of activity on the size of the fragments remains an area of active research. Hyaluronan has multiple roles in early development, tissue organization, and cell proliferation. The Has2-null mouse shows an embryonic lethal phenotype at the time of heart formation, whereas Has1-, Has3-null, and Has1/3 compound mutant mice show no obvious developmental phenotype.'
 'Thus, the presence of the BX7B motif should not be taken as proof that the protein interacts with hyaluronan. Hyaluronan production has long been implicated in enhanced cell adhesion and locomotion because it is present abundantly during morphogenesis and in both physiological and pathological invasive processes. Five different types of cell signaling proteins have been found to mediate the complex breadth of functions associated with hyaluronan (Figure 16.6). Hyaluronan signaling in health and disease. CD44, cluster of differentiation antigen, a type I transmembrane receptor; FAK, focal adhesion kinase; FGF, fibroblast growth factor; HARE, hyaluronan receptor for endocytosis; LYVE-1, lymphatic vessel endothelial (more...) Toll-like receptors TLR2 and TLR4, which are components of the innate immune system responsive to bacterial pro-inflammatory stimuli such as lipopolysaccharide (LPS), have been found to signal differentially in response to the generation of hyaluronan oligosaccharides by hyaluronidase. Depending on cell type, this may occur through direct binding of the hyaluronan oligosaccharides by TLR2/4. Alternatively, because hyaluronan encapsulation can obstruct access of TLR2/4 by other known ligands, hyaluronidase-mediated capsule degradation can also facilitate TLR2/4 activation by allowing other ligands to bind. HARE is expressed on the cell surface of a variety of sinusoidal endothelial cell types, where it is capable of binding hyaluronan and other glycosaminoglycan ligands, subsequently triggering receptor-mediated endocytosis and thereby clearing these components from circulation. Signaling occurs optimally during uptake of 50- to 250-kDa hyaluronan; smaller or larger hyaluronan does not activate signaling and blocks signaling by 50- to 250-kDa hyaluronan. Signaling through both TLR2/4 and HARE activate NF-κB and promote the secretion of pro-inflammatory and pro-apoptotic cytokines.'
 'Importantly, LYVE-1 signals uniquely through growth factor stimuli in lymphatic vasculature and lymph nodes to promote circulating leukocyte adhesion and support lymphatic development. Many cells also express RHAMM, which is also known as HMMR (homeostasis, mitosis, and meiosis regulator) and is involved in cell motility and cell division. The RHAMM pathway is thought to induce focal adhesions to signal the cytoskeletal changes required for elevated cell motility seen in tumor progression, invasion, and metastasis. RHAMM splice variants exist, some of which may be intracellular. RHAMM possesses a BX7B sequence that promotes electrostatic interaction with hyaluronan but is also part of a basic leucine zipper motif that is capable of centrosome and microtubule interactions. Thus, RHAMM is also a nonmotor spindle assembly factor. Hyaluronan binding to RHAMM activates SRC, FAK, ERK (extracellular mitogen-regulated protein kinase), and PKC (protein tyrosine kinase C) (Chapter 40). These pathways are relevant to tumor cell survival and invasion; their inhibition by hyaluronan oligomers and soluble hyaluronan-binding proteins suggests novel therapeutic approaches for treating cancer (Chapter 47). Some pathogenic bacteria (e.g., certain strains of Streptococcus and Pasteurella) produce hyaluronan as an extracellular capsule; also see Chapter 21). Capsular hyaluronan, like other capsular polysaccharides, increases virulence by helping to shield the microbe from host defenses. For example, the capsule blocks phagocytosis and protects against complement-mediated killing. Because bacterial hyaluronan is identical in structure to host hyaluronan, the capsule can also prevent the formation of protective antibodies. Thus, the formation of hyaluronan capsules by bacteria is a form of molecular mimicry. The capsule also can aid in bacterial adhesion to host tissue, facilitating colonization (Chapter 37).'
 'The human hyaluronidase gene (HYAL) family is complex, with two sets of three contiguous genes located on two chromosomes, a pattern that suggests two ancient gene duplications followed by a block duplication. In humans, the cluster on chromosome 3p21.3 (HYAL1, 2, and 3) appears to have major roles in somatic tissues. HYAL4 in the cluster on chromosome 7q31.3 codes for a protein that appears to have chondroitinase, but not hyaluronidase, activity; PHYAL1 is a pseudogene; and SPAM1 (sperm adhesion molecule 1, PH-20) is restricted to testes. The role of SPAM1 in fertilization is discussed below. Two additional enzymes with hyaluronan depolymerizing activity at neutral pH have been subsequently identified in multiple tissues and termed TMEM2 (transmembrane protein 2) and KIAA1199 (CEMIP, cell migration–inducing protein). The turnover of hyaluronan in most tissues is rapid (e.g., a half-life of ∼1 day in epidermal tissues), but its residence time in some tissues can be quite long and dependent on location (e.g., in cartilage). It has been estimated that an adult human contains ∼15 g of hyaluronan and that about one-third turns over daily. Turnover appears to occur by receptor-mediated endocytosis and lysosomal degradation either locally or after transport by lymph to lymph nodes or by blood to liver. The endothelial cells of the lymph node and liver sinusoids remove hyaluronan via specific receptors, such as LYVE-1 (a homolog of CD44) and HARE (hyaluronan receptor for endocytosis). HARE appears to be the major clearance receptor for hyaluronan delivered systemically by lymph and blood. The current understanding of this catabolic process is that hyaluronidases at the cell surface and in the lysosome cooperate to degrade the chains.'
 'The activity of shedding extracellular domains can contrast with that of the intact transmembrane proteoglycan and digestion by heparanase can similarly generate glycosaminoglycan fragments with distinct and contrasting activity. This is a particular feature of invading cells in which secreted heparanase can act in concert with matrix metalloproteases to remodel the ECM. Because heparanase has been implicated in the progression of various cancers, there is considerable interest in the development of inhibitors. This has led to clinical trials involving inhibitors either alone or in combination with other therapeutic agents (Chapter 47). Cells also internalize a large fraction of cell-surface heparan sulfate proteoglycans by endocytosis. These internalized proteoglycans first encounter proteases and heparanase and the core protein and the heparan sulfate chains are cleaved endolytically. The resulting smaller heparan sulfate fragments eventually appear in the lysosome and undergo complete degradation by way of a series of exoglycosidases and sulfatases (Chapter 44). Chondroitin sulfate and dermatan sulfate proteoglycans follow a similar endocytic route. One of the human hyaluronidases (HYAL-4) has been found to be involved in endolytic degradation of chondroitin sulfate. The authors appreciate helpful comments and suggestions from Barbara Mulloy.'
 'A soluble form of SPAM1 is secreted during the acrosome reaction. The release of acrosomal hyaluronidase and proteases renders the sperm capable of fusing with the egg and eventually destroys the entire matrix to allow the fertilized oocyte to implant and develop. There are several hyaluronan-binding proteins with homologous link modules (Figure 16.3). The four homologous link proteins belong to a subfamily called the “hyaluronan and proteoglycan link proteins” (HAPLNs); these are expressed in many tissues. Four cell-surface receptors have extracellular domains with one link module: CD44, LYVE-1 (lymphatic vessel endothelial hyaluronan receptor), HARE/Stabilin-2 (hepatic hyaluronan clearance receptor), and Stabilin-1, which are expressed on discontinuous endothelial cells and some activated macrophages. Of these, all functionally bind hyaluronan through the link module except Stabilin-1. Other hyaluronan-binding proteins are secreted and include the chondroitin sulfate proteoglycans that comprise the aggrecan superfamily and TSG-6, which has one link module. The three-dimensional structure of the link module fold in TSG-6 has been determined by nuclear magnetic resonance and defines a consensus fold of the two α-helices and two triple-stranded antiparallel β-sheets (Figure 16.5). The fold consists of about 100 amino acids and contains four cysteines disulfide-bonded in the pattern Cys1-Cys4 and Cys2-Cys3. This fold has only been found in vertebrates, consistent with the fact that hyaluronan is a relatively recent evolutionary invention. The link module fold is related to that found in the C-type lectins, but it lacks the Ca++ binding motif (Chapter 34).'
 'The homology was instrumental in the subsequent identification of the three members of the mammalian HAS gene family, HAS1–3. These genes code for homologous proteins predicted to contain five to six membrane-spanning segments and a central cytoplasmic domain. Hyaluronan biosynthesis by hyaluronan synthase (HAS) occurs by addition of UDP-sugars (UDP-GlcNAc and UDP-GlcA) to the reducing end of the polymer with release of the anchoring UDP. M++ refers to a metal ion cofactor.  As described in Chapter 17, cells synthesize sulfated glycosaminoglycans (heparan sulfate, chondroitin sulfate, and keratan sulfate) on core proteins of proteoglycans as they transit through the Golgi, and elongation of the chains occurs at their nonreducing ends. In contrast, hyaluronan synthesis normally occurs at the inner surface of the plasma membrane in eukaryotic cells and at the cytoplasmic membrane of bacteria that produce hyaluronan capsules. The synthases use the cytosolic substrates UDP-GlcA and UDP-GlcNAc and extrude the growing polymer through the membrane to form extracellular matrices (Figure 16.2). According to the model, the reducing end of the growing chain would have a UDP moiety that is displaced when the next nucleotide sugar is added. In keeping with its evolutionary history, it appears HA synthesis is initiated by production of a chitin oligosaccharide (GlcNAcβ4GlcNAc)n. In typical cultured mammalian cells, division under conditions of hyperglycemia (two to four times normal glucose level) results in hyaluronan synthesis in the endoplasmic reticulum (ER), Golgi, and transport vesicles. Under these conditions, the elongating hyaluronan chains are inserted inappropriately into these compartments, inducing abnormalities in cellular functions (e.g., kidney nephropathy and proteinurea). The activity of the HAS enzymes also can be regulated by phosphorylation and the addition of O-GlcNAc (Chapter 19).']","The hyaluronan fragments may be returned to the extracellular space via recycling endosomes or enter a pathway to lysosomes for complete degradation to monosaccharides, probably involving HYAL1 and the two exoglycosidases β-glucuronidase and β-N-acetylglucosaminidase.","The hyaluronan fragments may be returned to the extracellular space via recycling endosomes or enter a pathway to lysosomes for complete degradation to monosaccharides, probably involving HYAL1 and the two exoglycosidases β-glucuronidase and β-N-acetylglucosaminidase.",1.0,0.6403969750920143,1.0000000000000004,0.012345679012345678,0.9999999999857143,1.0
"Complete the following paragraph: Genetic evidence from studies of C. elegans suggests that N-acetylgalactosamine addition during chondroitin assembly is mediated by the same enzyme that is involved in chain polymerization (Sqv5), but biochemical evidence suggests that more than one enzyme may exist in vertebrates. In heparin/heparan sulfate formation, the addition of the first N-acetylglucosamine residue is catalyzed by an enzyme called EXTL3, which differs from the transferases involved in heparan polymerization (called EXT1 and EXT2).","['The biosynthesis of chondroitin sulfate (left chain) and heparan sulfate (right chain) is initiated by the formation of a linkage region tetrasaccharide (green circles in Fig. 17.1). Addition of the first hexosamine commits the intermediate to either (more...) After xylose addition, a linkage tetrasaccharide assembles by the transfer of two galactose residues catalyzed by unique members of the β4 galactosyl-, β3 galactosyl-, and β3 glucuronosyltransferase families of enzymes (Figure 17.4). This intermediate can undergo phosphorylation at the C-2 position of xylose and in the case of chondroitin sulfate, sulfation of the galactose residues. In general, phosphorylation and sulfation occur substoichiometrically, but phosphorylation may be transient. Phosphorylation occurs early in the assembly process and creates the preferred substrate for B4GALT7; a phosphatase removes the phosphate at a later stage of biosynthesis. The function of galactose sulfation in chondroitin sulfate remains unclear. The linkage tetrasaccharide lies at a bifurcation in the biosynthetic pathway: addition of β4-linked N-acetylgalactosamine, which initiates chondroitin sulfate assembly, or addition of α4-linked N-acetylglucosamine, which initiates heparan sulfate assembly (Figure 17.4). Genetic evidence from studies of C. elegans suggests that N-acetylgalactosamine addition during chondroitin assembly is mediated by the same enzyme that is involved in chain polymerization (Sqv5), but biochemical evidence suggests that more than one enzyme may exist in vertebrates. In heparin/heparan sulfate formation, the addition of the first N-acetylglucosamine residue is catalyzed by an enzyme called EXTL3, which differs from the transferases involved in heparan polymerization (called EXT1 and EXT2). These enzymes are important control points because they ultimately regulate the type of glycosaminoglycan chain that will assemble.'
 'The poly-N-acetyllactosamine chains of KS I are generally longer than those of KS II and may contain up to 50 disaccharide units (20–25 kDa). The chains can be fucosylated and sialylated as well (Chapter 14). Vertebrate chondroitin sulfate consists of repeating sulfate-substituted GalNAcβ4GlcAβ3 disaccharides polymerized into long chains (Figure 17.2). In contrast, invertebrates such as C. elegans and D. melanogaster make either nonsulfated or low sulfated chains. The assembly process for the backbone appears to be highly conserved, based on the presence of homologous genes for all of the reactions (Chapters 25 and 26). As described above, the assembly process is initiated by the transfer of GalNAcβ3 to the linkage tetrasaccharide (Figure 17.4). In both vertebrates and invertebrates, the polymerization step is catalyzed by one or more bifunctional enzymes (chondroitin synthases) that have both β3 glucuronosyltransferase and β4 N-acetylgalactosaminyltransferase activities. Vertebrates also express homologs that can transfer individual sugars to the chain. Chondroitin polymerization also requires the action of the chondroitin polymerizing factor (CHPF), a protein that lacks independent activity but collaborates with the polymerases to enhance the formation of polymers. Sulfation of chondroitin in vertebrates is a complex process, with multiple sulfotransferases involved in 4-O-sulfation and 6-O-sulfation of N-acetylgalactosamine residues (Figure 17.5). Biosynthesis of chondroitin sulfate/dermatan sulfate involves the polymerization of N-acetylgalactosamine and glucuronic acid units and a series of modification reactions including O-sulfation and epimerization of glucuronic acid to iduronic acid.'
 'N-acetylglucosamine N-deacetylase/N-sulfotransferases (NDST1-4) act on a subset of N-acetylglucosamine residues to generate N-sulfated glucosamine (GlcNSO3) units, many of which occur in clusters along the chain. Generally, the enzyme deacetylates N-acetylglucosamine and rapidly adds sulfate to the free amino group to form GlcNSO3, but a small number of glucosamine residues with unsubstituted amino groups may arise from incomplete N-sulfation. An epimerase (GLCE), different from the one involved in dermatan sulfate synthesis, then acts on some glucuronic acid residues, followed by 2-O-sulfation of some of the iduronic acid units (catalyzed by HS2ST). Some glucuronic acid units also undergo 2-O-sulfation by the same enzyme. The addition of 2-O-sulfate groups to glucuronic or iduronic acid prevents the reversible epimerization reaction. Next, 6-O-sulfotransferases (HS6ST1-3) add sulfate groups to selected glucosamine residues. Finally, certain subsequences of sulfated sugar residues and uronic acid epimers provide targets for 3-O-sulfotransferases (HS3ST1-6). Unlike other glycosaminoglycans, heparan sulfate is further modified once displayed at the plasma membrane. A family of plasma membrane endosulfatases (SULFs) can remove sulfate groups from internal 6-O-sulfated glucosamine residues in heparan sulfate and a heparanase can cleave the chains at limited sites. This post-assembly processing of the chains at the cell surface results in altered response of cells to growth factors and morphogens. Intriguingly, the mammalian genome contains other sulfatases of unknown function, raising the possibility that other post-assembly processing reactions of glycosaminoglycans may occur.'
 'These enzymes are important control points because they ultimately regulate the type of glycosaminoglycan chain that will assemble. Control of the addition of β4GalNAc or α4GlcNAc appears to be manifested at the level of enzyme recognition of the polypeptide substrate. Keratan sulfate chains contain a mixture of nonsulfated (Galβ4GlcNAcβ3), monosulfated (Galβ4GlcNAc6Sβ3), and disulfated (Gal6Sβ4GlcNAc6Sβ3) disaccharide units (Figure 17.2). The biosynthesis of the poly-N-acetyllactosamine backbone is described in Chapter 14. At least two classes of sulfotransferases, one or more N-acetylglucosaminyl 6-O-sulfotransferases (e.g., CHST4 or CHST6), and one or two galactosyl 6-O-sulfotransferases (CHST1 and CHST3) catalyze the sulfation reactions. These enzymes, like other sulfotransferases, use activated sulfate (PAPS [3′-phosphoadenyl-5′-phosphosulfate]) as a high-energy donor (Chapter 5). 6-O-Sulfation of N-acetylglucosamine occurs on the nonreducing terminal residue, encouraging further chain elongation, whereas sulfation of galactose residues takes place on nonreducing terminal and internal galactose residues, with a preference for galactose units adjacent to a sulfated N-acetylglucosamine residue. Sulfation of a nonreducing terminal galactose residue blocks further elongation of the chain, providing a potential mechanism for controlling chain length. The poly-N-acetyllactosamine chains of KS I are generally longer than those of KS II and may contain up to 50 disaccharide units (20–25 kDa). The chains can be fucosylated and sialylated as well (Chapter 14).'
 'Biosynthesis of chondroitin sulfate/dermatan sulfate involves the polymerization of N-acetylgalactosamine and glucuronic acid units and a series of modification reactions including O-sulfation and epimerization of glucuronic acid to iduronic acid. Heparan (more...) Additional enzymes exist for epimerization of D-glucuronic acid to L-iduronic acid in dermatan sulfate (DSE1-2), sulfation at the C-2 position of the uronic acids, and other patterns of sulfation found in unusual species of chondroitin (Table 17.2). The location of sulfate groups is easily assessed using bacterial chondroitinases (ABC, B, and ACII) that cleave the chains into disaccharides. Many chains are hybrid structures containing more than one type of chondroitin disaccharide unit. For example, dermatan sulfate is defined as having one or more iduronic acid–containing disaccharide units (chondroitin sulfate B) as well as glucuronic acid–containing disaccharides (chondroitin sulfate A and C). Animal cells also degrade chondroitin sulfate in lysosomes using a series of exolytic activities (Chapter 44). Types of chondroitin sulfates  Heparan sulfate assembles as a copolymer of GlcNAcα4GlcAβ4 (Figure 17.5), which then undergoes extensive modification reactions, catalyzed by at least four families of sulfotransferases and one epimerase. N-acetylglucosamine N-deacetylase/N-sulfotransferases (NDST1-4) act on a subset of N-acetylglucosamine residues to generate N-sulfated glucosamine (GlcNSO3) units, many of which occur in clusters along the chain.'
 'Notably, in humans and bovine, the large chondroitin sulfate proteoglycan found in cartilage (aggrecan) contains a segment of four to 23 hexapeptide repeats (E-E/L-P-F-P-S) where the keratan sulfate chains are located, whereas aggrecan in rats and other rodents lacks this motif and does not contain keratan sulfate. Keratan sulfates (KS) contain a sulfated poly-N-acetyllactosamine chain, linked to either asparagine or serine/threonine residues. Chst1 and 5 can add sulfate groups at the indicated positions. The actual order of the various sulfated and nonsulfated (more...) Two classes of glycosaminoglycan chains—chondroitin sulfate/dermatan sulfate and heparan sulfate/heparin—are linked to serine residues in proteins by way of xylose (Figure 17.4). Xylosyltransferase initiates the process using UDP-xylose as donor. Two isoforms of the enzyme are known in vertebrates (XYLT1 and XYLT2), but only one isozyme exists in C. elegans and D. melanogaster. A glycine residue invariably lies to the carboxy-terminal side of the serine attachment site, but a perfect consensus sequence for xylosylation does not exist. At least two acidic amino acid residues are usually present, and they can be located on one or both sides of the serine, usually within a few residues. Several proteoglycans contain clustered glycosaminoglycan attachment sites, raising the possibility that xylosyltransferase could act in a processive manner. Xylosylation is an incomplete process in some proteoglycans, which may explain why proteoglycans with multiple potential attachment sites contain different numbers of chains in different cells. The biosynthesis of chondroitin sulfate (left chain) and heparan sulfate (right chain) is initiated by the formation of a linkage region tetrasaccharide (green circles in Fig. 17.1).'
 'Chondroitin proteoglycans (CPGs) of Caenorhabditis elegans.  HS biosynthesis in C. elegans follows the same pattern observed in vertebrate systems (Chapter 17). Mutations in the pathway for HS biosynthesis are lethal in C. elegans. Two of the key genes involved in this pathway are rib-1 and rib-2, homologs of the vertebrate genes Ext2 and Ext1, respectively, which catalyze the polymerization of the backbone of HS chains (GlcAβ1-4GlcNAcα1-4) (Chapter 17). Mutants in rib-2, the worm homolog of Ext1, have defects in development and egg laying. The worm genome also contains a single gene for glucuronic acid C-5 epimerase (hse-5) and five genes for sulfotransferase activities (GlcNAc N-deacetylase/N-sulfotransferase [Ndst], hst-1; uronyl 2-O-sulfotransferase, hst-2; 3-O-sulfotransferases, hst-3.1 and hst-3.2; and 6-O-sulfotransferase, hst-6), all of which are homologs of vertebrate genes involved in HS synthesis. In contrast, vertebrates contain four Ndsts, three 6-O-sulfotransferases, and seven 3-O-sulfotransferases. Although mutations in the epimerase (hse-5) and the sulfotransferases (hst-6, hst-2) do not affect viability, they cause defects in specific cell migration, axonal outgrowth, and/or neurite branching. Consistent with this finding, inactivation of the cell surface HS proteoglycan syndecan (sdn-1) affects neural migration and axonal guidance. C. elegans also produces two GPI-anchored HS proteoglycans.']","In heparin/heparan sulfate formation, the addition of the first N-acetylglucosamine residue is catalyzed by an enzyme called EXTL3, which differs from the transferases involved in heparan polymerization (called EXT1 and EXT2).","These enzymes are important control points because they ultimately regulate the type of glycosaminoglycan chain that will assemble. Control of the addition of β4GalNAc or α4GlcNAc appears to be manifested at the level of enzyme recognition of the polypeptide substrate. Keratan sulfate chains contain a mixture of nonsulfated (Galβ4GlcNAcβ3), monosulfated (Galβ4GlcNAc6Sβ3), and disulfated (Gal6Sβ4GlcNAc6Sβ3) disaccharide units (Figure 17.2).",1.0,0.7312235795424072,0.6132206244751617,0.028169014084507043,0.9999999999857143,1.0
"Complete the following paragraph: Highly conserved homologs of OGT and OFT are found in numerous bacterial genomes, although studies of their functional roles are essentially nonexistent.","['The OFT was first discovered genetically in plants as Spy, in which it controls transcriptional processes. In the protist pathogen Toxoplasma gondii, OFT modifies numerous proteins involved in transcription, mRNA biogenesis, nuclear transport, and cell signaling. Recently, Greb1, derived from another lineage of enzymes, was shown to O-β-GlcNAcylate estrogen receptor-α and potentially other nuclear proteins, which if verified is an interesting example of convergent evolution. Paralogs of these enzymes have not been described in the well-studied Saccharomyces cerevisiae, but biochemical data suggests that this yeast modifies intracellular proteins with mannose (Man) and even di- and tri-Man. Furthermore, several reports suggest that select intracellular proteins of mammalian cells are modified by N-acetylgalactosamine (GalNAc). The significance of these intriguing latter examples awaits identification of the responsible glycosyltransferases and evidence for their roles in cells. Examples in which the glycosyltransferases are known are represented schematically in Figure 18.1A and summarized in Table 18.1. Cellular topography of nucleocytoplasmic glycosylation. (A) Monoglycosylation (m) in the cytoplasm (e.g., O-GlcNAc and O-Fuc). (B) Complex (c) glycosylation in the cytoplasm by O-GlcNAc transferases (GTs) that extend the first sugar. (C) Cytoplasmic monoglycosylation (more...) Examples of nuclear or cytoplasmic glycosylation events  Highly conserved homologs of OGT and OFT are found in numerous bacterial genomes, although studies of their functional roles are essentially nonexistent. An example of bacterial monoglycosylation that leads to a known function comes from the EF-P protein, the bacterial homolog of eukaryotic elongation initiation factor 5a. In some bacteria, EF-P suppresses translational stalling by a mechanism that involves oxidation of a critical lysyl residue, and its eukaryotic ortholog is regulated by hypusylation.'
 ""In the nucleus and cytoplasm, OGT appears to form multimers, consisting of one or more 110-kDa subunits and 78-kDa subunits. Several useful small molecule inhibitors of OGT have been developed, including OSMI-4b, Ac45SGlcNAc, and 5SGlcNHex, with the latter effective in animal models. However, some off-target effects have been reported for these inhibitors, likely because they impact other enzymes that use UDP-GlcNAc. ncOGT has two distinct domains separated by a putative nuclear localization sequence. The amino terminus of each OGT subunit contains TPRs, which can number up to 13 (species-dependent). The major variation between the three (above) variants is in the number of the TPRs. The crystal structure of the human TPR domain of ncOGT shows that the repeats occur as stacked α-helical domains, forming a “tube-like” structure with a remarkable structural similarity to the armadillo repeat domain of the nuclear transport protein importin-α. The TPR domain mediates multimerization of OGT subunits and acts as a scaffold for protein–protein interactions, including protein substrates (Figure 19.3). OGT's glycosyltransfer reaction occurs by an ordered bi–bi mechanism with UDP-GlcNAc binding first. The TPR domains are required for substrate binding, enzymatic activity, and stability. Recent studies have demonstrated that residues in the TPR domain are critical for interactions with substrates. Such findings likely underpin the observation that there is no strict consensus motif that dictates glycosylation by OGT, although valine and alanine are preferred at the –3 and +2 positions, respectively, and there is a preference for aromatic residues at –4 position. In addition to catalyzing O-GlcNAcylation, OGT also has the remarkable ability to proteolytically cleave HCF-1, a transcription factor regulating the cell cycle. HCF-1 binds to the TPRs positioning the cleavage site at the active site of OGT.""
 'Thus, when O-GlcNAc levels are elevated, OGT abundance is depressed and OGA abundance augmented. In contrast, in response to low levels of O-GlcNAc, OGA abundance is depressed, and OGT levels are augmented. O-GlcNAc transferase (OGT) is regulated by multiple complex mechanisms, including transcriptional regulation of its expression, differential mRNA splicing, proteolytic processing, posttranslational modification, and multimerization with itself and other (more...) OGT (uridine diphospho-N-acetylglucosamine: polypeptide β-N-acetylglucosaminyltransferase; EC 2.4.1.255) catalyzes the addition of N-acetylglucosamine from UDP-GlcNAc to specific serine or threonine residues to form a β-O-glycosidic linkage. The enzyme was first identified and purified from rat liver and subsequently cloned from rat, human, Caenorhabditis elegans, and other organisms. OGT resides on the X chromosome (Xq13 in humans) near the centromere and is among the most highly conserved proteins from worms to man. Mutations in OGT, both in its tetratricopeptide repeats (TPRs) and in its catalytic domain, cause X-linked intellectual disability in humans. To date, three isoforms of OGT have been well characterized: (1) the nucleocytoplasmic or full-length variant (ncOGT), which is 110 kDa; (2) a short isoform of OGT (sOGT), which is 78 kDa; and (3) a variant of OGT that is targeted to the mitochondria (mOGT; ∼90 kDa). In the nucleus and cytoplasm, OGT appears to form multimers, consisting of one or more 110-kDa subunits and 78-kDa subunits. Several useful small molecule inhibitors of OGT have been developed, including OSMI-4b, Ac45SGlcNAc, and 5SGlcNHex, with the latter effective in animal models.'
 'Targeted, inducible deletion of OGT in αCAMKII-positive (excitatory) neurons in brains of adult mice results in morbidly obese mice because of defects in satiety, further supporting the roles of O-GlcNAcylation as a nutrient sensor. The highly homologous and conserved nature of OGT among metazoans allows a transgene encoding the human sequence of OGT to be used to rescue OGT null Drosophila melanogaster. Recently, OGA has been disrupted in both C. elegans and mammalian models. Like the OGT null, the C. elegans OGA null has defective carbohydrate metabolism and abnormalities in dauer formation. In contrast to the OGT null, in C. elegans in which OGA has been disrupted, the worms have an extended life span. In murine models, deletion of OGA leads to perinatal lethality, genomic instability and severe epigenetic and metabolic phenotypes. The OGA heterozygous mouse shows widespread changes in transcription and metabolism, and an enhanced dependence on glucose metabolism. Studies from numerous laboratories have described O-GlcNAcylated proteins from virtually all cellular compartments, representing nearly all functional classes of protein (Figure 19.2; Table 19.1). Indeed, recent databases contain more than 6,000 O-GlcNAcylated proteins with more than 7,000 sites mapped (O-GlcNAcAtlas; The O-GlcNAc Database). O-GlcNAc is particularly abundant within the nucleus, in which it occurs on the transcriptional regulatory machinery, including the carboxy-terminal domain (CTD) of the RNA polymerase II catalytic subunit and basal, as well as other, transcription factors, histones, chromatin-modifying proteins, mRNA biogenesis proteins, and DNA methyltransferases. O-GlcNAcylation also appears to be particularly abundant on proteins involved in signaling, stress responses, and energy metabolism. Nearly 90 proteins within the mitochondria are dynamically O-GlcNAcylated, with the highest concentration found within the electron transport chain.'
 'To date, nucleocytoplasmic O-β-GlcNAc has been found in all multicellular organisms investigated, ranging from filamentous fungi, worms, insects, and plants to humans. However, to date no OGA ortholog has been identified in plants or protozoans. Plants encode two OGT paralogs: SECRET AGENT (SEC) and SPY. Curiously, whereas SEC encodes an O-GlcNAc transferase, SPY encodes a fucosyltransferase. Notably, the SPY paralog in Dictyostelium discoideum, Giardia lamblia, Cryptosporidium parvum, and Toxoplasma gondii also fucosylates proteins. To date, O-GlcNAc and the enzymes that control its cycling do not appear to exist in yeast, such as Saccharomyces cerevisiae or Schizosaccharomyces pombe. However, recently, it was discovered that S. cerevisiae have O-mannose moieties on the same proteins and at the same sites on which O-GlcNAc is found in multicellular organisms. Recent data suggest that the O-GlcNAc modification is also found in a subset of prokaryotes, such as Listeria monocytogenes. It is currently unclear if the enzymes responsible for this modification are related to OGT or EOGT. O-GlcNAc-modified proteins have also been found on many viruses that infect metazoans (e.g., adenovirus, SV40, cytomegalovirus, rotavirus, baculovirus, plum pox, HIV, and others). In viruses, instead of being localized on the outside capsid of the virus in which “classical” N- or O-glycans are found (Chapter 42), O-GlcNAc is found deep within the viruses, on tegument and other regulatory proteins, close to the nucleic acid components.'
 'Similarly, the gene encoding α-1,3-galactosyltransferase (A3GALT2) is functional in the mouse but not in human (Chapter 20). The human and fly genomes include orthologous genes encoding GTs that catalyze the same reaction, but they also have GTs that are unique. Thus, protein O-fucosyltransferase 1 (POFUT1) in mammals and Ofut1 in flies transfer fucose to Notch receptors and are examples of an evolutionarily conserved GT. In contrast, flies do not make complex N-glycans with four branches, which are common in mammalian glycoproteins (Chapters 9 and 20). Additionally, flies make unique glycolipids absent from mammals that are important for conserved signaling pathways mediated by the epidermal growth factor (EGF) receptor or Notch receptors (Chapter 26). The genome encodes all of the enzymes, transporters, and other activities necessary to construct and regulate the glycome of an organism. There were few complete genomes available in 1999 for the first edition of this book, approximately 650 genomes by the second edition (2009), 25,000 by the third edition (2015), and in August 2021 there were 259,000 permanent draft genomes in the Genomes OnLine Database (GOLD) of which more than 22,000 finished genomes are included in the manually curated Carbohydrate-Active enZYmes (CAZy) database. Likewise, the number of GTs with a known three-dimensional structure has grown from one in 1999 to 158 in 2015 and 282 in 2020. The CAZy database is dedicated to (i) coping with the staggering increases in sequences released in GenBank by the NCBI (National Center for Biotechnology Information), (ii) creating new families based on the literature, and (iii) reporting new functions/substrate specificities and 3D structures within existing families.'
 'On transfer of GlcNAc to proteins, UDP is released, which is a potent feedback inhibitor of OGT. Under conditions in which UDP is rapidly removed (as occurs within the cell), OGT activity is dependent on the UDP-GlcNAc level over a remarkable range of concentrations (from the low nm range to >50 mm). Of note, the substrate specificity of OGT appears to change at different UDP-GlcNAc concentrations, suggesting that OGT regulates cellular processes in a manner dependent on nutritional status. Elevating O-GlcNAc blocks insulin signaling at many points. Glucose flux via glucose transporters (e.g., GLUT4 in insulin-sensitive cells) through the hexosamine biosynthetic pathway (HBP; which accounts for 2%–5% of total glucose usage) leads (more...) Nucleocytoplasmic OGA (EC 3.2.1.169) was first identified as a neutral cytosolic hexosaminidase (referred to as “hexosaminidase C”). OGA was purified from rat kidney and bovine brain, and the human gene was cloned using peptide sequence information. The OGA gene was found to be identical to MGEA5, a putative hyaluronidase genetically identified because of its association with meningiomas. There are two well-characterized isoforms of OGA (short and full-length), which appear to arise from alternative splicing. Short OGA is identical to full-length OGA (916 amino acids) for the first 662 amino acids but possesses an alternative carboxy-terminal sequence 15 amino acids in length. Sequence and structural analyses reveal that OGA contains an amino-terminal hexosaminidase domain and a carboxy-terminal domain, with homology to GCN5 histone acetyltransferases (HAT), separated by an intervening sequence. OGA forms an unusual arm-in-arm homodimer that is mediated by a helix within the intervening sequence. Dimerization is critical for activity and the formation of a substrate binding cleft.']","Studies of their functional roles are essentially nonexistent. Highly conserved homologs of OGT and OFT are found in numerous bacterial genomes, although studies of their functional roles are essentially nonexistent.","An example of bacterial monoglycosylation that leads to a known function comes from the EF-P protein, the bacterial homolog of eukaryotic elongation initiation factor 5a. In some bacteria, EF-P suppresses translational stalling by a mechanism that involves oxidation of a critical lysyl residue, and its eukaryotic ortholog is regulated by hypusylation. A recent phylogenetic analysis of EF-P sequences revealed a subset of enzymes with an Arg in place of Lys, and a coevolving gene that was subsequently identified by biochemistry and mass spectrometry as an argininyl rhamnosyltransferase. Assembly of the Rha-Arg linkage activates EF-P and is required for pathogenicity of Pseudomonas, a Gram-negative, opportunistic human pathogen, and a number of other bacteria. The discovery of this linkage by a phylogenetic approach suggests that more noncanonical examples of glycosylation are yet to be discovered.",1.0,0.0,0.46046557994936926,0.012048192771084338,0.9999999999857143,0.4
"Complete the following paragraph: OGA was purified from rat kidney and bovine brain, and the human gene was cloned using peptide sequence information. The OGA gene was found to be identical to MGEA5, a putative hyaluronidase genetically identified because of its association with meningiomas. There are two well-characterized isoforms of OGA (short and full-length), which appear to arise from alternative splicing.","['On transfer of GlcNAc to proteins, UDP is released, which is a potent feedback inhibitor of OGT. Under conditions in which UDP is rapidly removed (as occurs within the cell), OGT activity is dependent on the UDP-GlcNAc level over a remarkable range of concentrations (from the low nm range to >50 mm). Of note, the substrate specificity of OGT appears to change at different UDP-GlcNAc concentrations, suggesting that OGT regulates cellular processes in a manner dependent on nutritional status. Elevating O-GlcNAc blocks insulin signaling at many points. Glucose flux via glucose transporters (e.g., GLUT4 in insulin-sensitive cells) through the hexosamine biosynthetic pathway (HBP; which accounts for 2%–5% of total glucose usage) leads (more...) Nucleocytoplasmic OGA (EC 3.2.1.169) was first identified as a neutral cytosolic hexosaminidase (referred to as “hexosaminidase C”). OGA was purified from rat kidney and bovine brain, and the human gene was cloned using peptide sequence information. The OGA gene was found to be identical to MGEA5, a putative hyaluronidase genetically identified because of its association with meningiomas. There are two well-characterized isoforms of OGA (short and full-length), which appear to arise from alternative splicing. Short OGA is identical to full-length OGA (916 amino acids) for the first 662 amino acids but possesses an alternative carboxy-terminal sequence 15 amino acids in length. Sequence and structural analyses reveal that OGA contains an amino-terminal hexosaminidase domain and a carboxy-terminal domain, with homology to GCN5 histone acetyltransferases (HAT), separated by an intervening sequence. OGA forms an unusual arm-in-arm homodimer that is mediated by a helix within the intervening sequence. Dimerization is critical for activity and the formation of a substrate binding cleft.'
 'Thus, when O-GlcNAc levels are elevated, OGT abundance is depressed and OGA abundance augmented. In contrast, in response to low levels of O-GlcNAc, OGA abundance is depressed, and OGT levels are augmented. O-GlcNAc transferase (OGT) is regulated by multiple complex mechanisms, including transcriptional regulation of its expression, differential mRNA splicing, proteolytic processing, posttranslational modification, and multimerization with itself and other (more...) OGT (uridine diphospho-N-acetylglucosamine: polypeptide β-N-acetylglucosaminyltransferase; EC 2.4.1.255) catalyzes the addition of N-acetylglucosamine from UDP-GlcNAc to specific serine or threonine residues to form a β-O-glycosidic linkage. The enzyme was first identified and purified from rat liver and subsequently cloned from rat, human, Caenorhabditis elegans, and other organisms. OGT resides on the X chromosome (Xq13 in humans) near the centromere and is among the most highly conserved proteins from worms to man. Mutations in OGT, both in its tetratricopeptide repeats (TPRs) and in its catalytic domain, cause X-linked intellectual disability in humans. To date, three isoforms of OGT have been well characterized: (1) the nucleocytoplasmic or full-length variant (ncOGT), which is 110 kDa; (2) a short isoform of OGT (sOGT), which is 78 kDa; and (3) a variant of OGT that is targeted to the mitochondria (mOGT; ∼90 kDa). In the nucleus and cytoplasm, OGT appears to form multimers, consisting of one or more 110-kDa subunits and 78-kDa subunits. Several useful small molecule inhibitors of OGT have been developed, including OSMI-4b, Ac45SGlcNAc, and 5SGlcNHex, with the latter effective in animal models.'
 'OGA forms an unusual arm-in-arm homodimer that is mediated by a helix within the intervening sequence. Dimerization is critical for activity and the formation of a substrate binding cleft. Notably, the HAT domain lacks the motif required for binding acetyl-CoA, indicating it lacks HAT enzymatic activity. Like OGT, OGA is thought to be regulated by its protein interactors, posttranslational modifications, and localization. OGA can be efficiently inhibited in vitro and in vivo by a panel of highly effective inhibitors. Although many inhibitors display some cross-reactivity toward the lysosomal hexosaminidases, GlcNAcstatin B and Thiamet-G are selective for OGA. Unlike the relatively static nature of mature N- and O-glycans on glycoproteins, O-GlcNAc cycles rapidly on and off most substrates. Early studies showed that mitogen or antigen activation of lymphocytes rapidly decreased O-GlcNAcylation of many cytoplasmic proteins, but concomitantly increased O-GlcNAcylation of many nuclear proteins. Likewise, neutrophils were shown to rapidly modulate O-GlcNAcylation of several proteins in response to chemotactic agents. Recently, changes in O-GlcNAc cycling have been shown in response to cellular stress, the cell cycle, developmental stages, neuron depolarization, nutrient sensing, and insulin signaling. Pulse-chase analyses have revealed that O-GlcNAc residues on small heat-shock protein in the lens (α-crystallin) and on intermediate filament proteins (cytokeratins) turn over more rapidly than the polypeptide chains to which they are attached. These observations suggest that O-GlcNAc is a regulatory posttranslational modification analogous to phosphorylation. To date, nucleocytoplasmic O-β-GlcNAc has been found in all multicellular organisms investigated, ranging from filamentous fungi, worms, insects, and plants to humans. However, to date no OGA ortholog has been identified in plants or protozoans.'
 'Targeted, inducible deletion of OGT in αCAMKII-positive (excitatory) neurons in brains of adult mice results in morbidly obese mice because of defects in satiety, further supporting the roles of O-GlcNAcylation as a nutrient sensor. The highly homologous and conserved nature of OGT among metazoans allows a transgene encoding the human sequence of OGT to be used to rescue OGT null Drosophila melanogaster. Recently, OGA has been disrupted in both C. elegans and mammalian models. Like the OGT null, the C. elegans OGA null has defective carbohydrate metabolism and abnormalities in dauer formation. In contrast to the OGT null, in C. elegans in which OGA has been disrupted, the worms have an extended life span. In murine models, deletion of OGA leads to perinatal lethality, genomic instability and severe epigenetic and metabolic phenotypes. The OGA heterozygous mouse shows widespread changes in transcription and metabolism, and an enhanced dependence on glucose metabolism. Studies from numerous laboratories have described O-GlcNAcylated proteins from virtually all cellular compartments, representing nearly all functional classes of protein (Figure 19.2; Table 19.1). Indeed, recent databases contain more than 6,000 O-GlcNAcylated proteins with more than 7,000 sites mapped (O-GlcNAcAtlas; The O-GlcNAc Database). O-GlcNAc is particularly abundant within the nucleus, in which it occurs on the transcriptional regulatory machinery, including the carboxy-terminal domain (CTD) of the RNA polymerase II catalytic subunit and basal, as well as other, transcription factors, histones, chromatin-modifying proteins, mRNA biogenesis proteins, and DNA methyltransferases. O-GlcNAcylation also appears to be particularly abundant on proteins involved in signaling, stress responses, and energy metabolism. Nearly 90 proteins within the mitochondria are dynamically O-GlcNAcylated, with the highest concentration found within the electron transport chain.'
 'In the Golgi, a polymer glycan (matriglycan) is generated, recognized by several diagnostic monoclonal antibodies and necessary for the binding of laminin and other molecules to α-DG. An unusual feature on one subset of O-Man glycans is the existence of a Man-6-P generated by the kinase POMK. The Man-6-P-containing Core M3 glycan consists of Man-6-P, GlcNAc (transferred by POMGNT2), and GalNAc (transferred by B3GALNT2). The trisaccharide core is extended by two units of ribitol-5-phosphate sequentially transferred by FKTN (fukutin) and FKRP (fukutin-related protein) from CDP-ribitol, which is generated by CRPPA. This “core” glycan is elongated by an alternating disaccharide (β1-3Xylα1-3GlcA) to form matriglycan. O-Man glycan biosynthetic pathway. The biosynthetic pathways of representative O-Man glycans are shown. Enzymes whose defects cause a disorder are indicated in red. Three main groups are identified: cores M1–M3. All O-Man glycans are initiated (more...) O-Man glycans can also play a traitorous role, because they are receptor molecules for Lassa virus entry into cells. This feature was cleverly exploited to screen libraries and identify genes required for virus entry. The method correctly identified all previously known WWS-causing genes and predicted new culprits.'
 'Under these conditions, the elongating hyaluronan chains are inserted inappropriately into these compartments, inducing abnormalities in cellular functions (e.g., kidney nephropathy and proteinurea). The activity of the HAS enzymes also can be regulated by phosphorylation and the addition of O-GlcNAc (Chapter 19). Hyaluronan biosynthesis in bacteria involves the expression of multiple enzymes, usually as an operon. For example, in Streptococcus, hasC encodes an enzyme that makes UDP-Glc from UTP and glucose-1-P; hasB encodes the dehydrogenase that converts UDP-Glc to UDP-GlcA; hasD generates UDP-GlcNAc from glucosamine-1-P, acetyl CoA, and UTP; and hasA (spHas) encodes the hyaluronan synthase. The Streptococcus hasA gene encodes a bifunctional protein that contains both transferase activities and assembles the polysaccharide from the reducing end. The synthase spans the membrane multiple times, presumably forming a pore for hyaluronan extrusion during capsule formation. In contrast, Pasteurella synthesizes hyaluronan by an enzyme that is unrelated to hasA and the mammalian Has gene family. In this case, the enzyme has two separable domains with independent glycosyltransferase activities—one for UDP-GlcNAc and the other for UDP-GlcA, and the elongation is on the nonreducing end. Animal cells express a set of catabolic enzymes that degrade hyaluronan. The human hyaluronidase gene (HYAL) family is complex, with two sets of three contiguous genes located on two chromosomes, a pattern that suggests two ancient gene duplications followed by a block duplication. In humans, the cluster on chromosome 3p21.3 (HYAL1, 2, and 3) appears to have major roles in somatic tissues.'
 ""In the nucleus and cytoplasm, OGT appears to form multimers, consisting of one or more 110-kDa subunits and 78-kDa subunits. Several useful small molecule inhibitors of OGT have been developed, including OSMI-4b, Ac45SGlcNAc, and 5SGlcNHex, with the latter effective in animal models. However, some off-target effects have been reported for these inhibitors, likely because they impact other enzymes that use UDP-GlcNAc. ncOGT has two distinct domains separated by a putative nuclear localization sequence. The amino terminus of each OGT subunit contains TPRs, which can number up to 13 (species-dependent). The major variation between the three (above) variants is in the number of the TPRs. The crystal structure of the human TPR domain of ncOGT shows that the repeats occur as stacked α-helical domains, forming a “tube-like” structure with a remarkable structural similarity to the armadillo repeat domain of the nuclear transport protein importin-α. The TPR domain mediates multimerization of OGT subunits and acts as a scaffold for protein–protein interactions, including protein substrates (Figure 19.3). OGT's glycosyltransfer reaction occurs by an ordered bi–bi mechanism with UDP-GlcNAc binding first. The TPR domains are required for substrate binding, enzymatic activity, and stability. Recent studies have demonstrated that residues in the TPR domain are critical for interactions with substrates. Such findings likely underpin the observation that there is no strict consensus motif that dictates glycosylation by OGT, although valine and alanine are preferred at the –3 and +2 positions, respectively, and there is a preference for aromatic residues at –4 position. In addition to catalyzing O-GlcNAcylation, OGT also has the remarkable ability to proteolytically cleave HCF-1, a transcription factor regulating the cell cycle. HCF-1 binds to the TPRs positioning the cleavage site at the active site of OGT.""]","OGA was purified from rat kidney and bovine brain, and the human gene was cloned using peptide sequence information. The OGA gene was found to be identical to MGEA5, a putative hyaluronidase genetically identified because of its association with meningiomas. There are two well-characterized isoforms of OGA (short and full-length), which appear to arise from alternative splicing. Short OGA is identical to full-length OGA (916 amino acids) for the first 662 amino acids but possesses an alternative carboxy-terminal sequence 15 amino acids in length. Sequence and structural analyses reveal that OGA contains an amino-terminal hexosaminidase domain and a carboxy-terminal domain, with homology to GCN5 histone acetyltransferases (HAT), separated by an intervening sequence. OGA forms an unusual arm-in-arm homodimer that is mediated by a helix within the intervening sequence. Dimerization is critical for activity and the formation of a substrate binding cleft.","Short OGA is identical to full-length OGA (916 amino acids) for the first 662 amino acids but possesses an alternative carboxy-terminal sequence 15 amino acids in length. Sequence and structural analyses reveal that OGA contains an amino-terminal hexosaminidase domain and a carboxy-terminal domain, with homology to GCN5 histone acetyltransferases (HAT), separated by an intervening sequence. OGA forms an unusual arm-in-arm homodimer that is mediated by a helix within the intervening sequence. Dimerization is critical for activity and the formation of a substrate binding cleft. Notably, the HAT domain lacks the motif required for binding acetyl-CoA, indicating it lacks HAT enzymatic activity. Like OGT, OGA is thought to be regulated by its protein interactors, posttranslational modifications, and localization.",1.0,0.727980835377622,0.8578057824130879,0.011904761904761904,0.9484126983968916,1.0
"Complete the following paragraph: Giant viruses such as the algae-targeting chlorella virus and members of the amoeba-targeting Mimiviridae family have genomes large enough that they can express their own glycosylation machineries. On a smaller scale, specific viruses express glycosyltransferases as virulence factors.","['Compared to other types of glycans, structural polysaccharides show relatively little variation in evolution, which may indicate a more stringent selection for chemical and mechanical properties required for their functions. Interestingly, some of these structures, such as glycosaminoglycans, can also play nonstructural roles in other biological contexts, including cell signaling, which adds additional selection forces driving their evolution. Viruses typically have minimalist genomes and use host-cell machinery for replication. Thus, glycosylation of enveloped viruses reflects that of the host. However, there are exceptions. Giant viruses such as the algae-targeting chlorella virus and members of the amoeba-targeting Mimiviridae family have genomes large enough that they can express their own glycosylation machineries. On a smaller scale, specific viruses express glycosyltransferases as virulence factors. For instance, a baculovirus-encoded glucosyltransferase glycosylates insect host ecdysteroid hormones to block molting, and bacteriophage-derived glucosyltransferases modify 5-hydroxymethyl cytosine bases in the phage DNA to protect it from bacterial restriction enzymes. Host-derived glycosylation in enveloped viruses is typically extensive and the resulting “glycan shield” protects the virus from immune reactions against the underlying polypeptide. In this regard, it has been suggested that the high frequency of heterozygous states for human congenital disorders of glycosylation (Chapter 44) may reflect selection for genomes that limit glycosylation of invading viruses. Host lectins may also be “hijacked” by glycans on viral surface glycoproteins. For example, Sialoadhesin (Siglec-1; Chapter 15) is used by the heavily sialylated porcine reproductive and respiratory syndrome virus (PRRSV) to gain entry into macrophages.'
 'The baculovirus enzyme ecdysteroid glucosyltransferase (EGT) disrupts the hormonal balance of the insect host by catalyzing the conjugation of ecdysteroid hormones with Glc or galactose (Gal). Expression of the EGT gene allows the virus to block molting and pupation of infected insect larvae. Similarly, Chloroviruses have enzymes in CAZy family GT4 for the glycosylation of their structural proteins. Serotype conversion in Shigella flexneri is mediated by temperate bacteriophages, which encode GTs that mediate O-antigen conversion by the addition of Glc to O-antigen units. Finally, giant viruses such as Acanthamoeba polyphaga mimivirus encode 12 putative GTs for the synthesis of complex O-glycans. Bacterial GTs play a major role in their symbiosis and virulence. Some bacteria such as Campylobacter are able to N-glycosylate their proteins, but the most universal role for bacterial glycosylation is in the synthesis of cell-wall peptidoglycan, simple glycolipids, lipopolysaccharides, and complex exopolysaccharides (Chapter 21). The GTs involved in peptidoglycan biosynthesis are GT28 MurG, which adds N-acetylglucosamine (GlcNAc) to undecaprenyl diphospho-N-MurNAc, and GT51 MtgA, which polymerizes undecaprenyl diphospho-MurNAc-GlcNAc. Mycobacterium tuberculosis produces an extremely complex envelope that includes all of the above. In bacteria, the role of these glycans is to provide a barrier that affords mechanical, chemical, and biological protection to the cell. Some pathogenic or commensal bacteria produce an outer glycan layer that mimics that of their hosts, in order to evade host immune surveillance (Chapters 15 and 42). Pasteurella multocida produces a thick hyaluronan capsule.'
 'Binding is assessed by fluorescent or spectrometric techniques. Glycan microarray data are provided by resources such as the Consortium for Functional Glycomics (http://www.functionalglycomics.org/glycomics/publicdata/primaryscreen.jsp) and the Imperial College Microarray Data Online Portal (https://glycosciences.med.ic.ac.uk/data.html), and several analysis software packages, including GLAD (https://glycotoolkit.com/GLAD/), MotifFinder (https://haablab.vai.org/tools/), MCAW (https://mcawdb.glycoinfo.org/) and CCARL (https://github.com/andrewguy/CCARL). Note that arrays that use different linkers and/or different attachment chemistries can give quite variable results, and the results need to be evaluated in the context of natural binding phenomena. It has long been known that many viruses use host glycans as specific binding receptors for entering the cell (Chapter 37). Similarly, several viruses encode lytic enzymes that break down host cell surface glycans to release viral particles after viral replication. Genome sequencing reveals that many double-stranded DNA viruses also take advantage by adding sugars to host glycoproteins through the use of viral GTs (Chapter 42). Although biological roles of viral GTs are poorly understood, some functions have been identified. For example, the T4 bacteriophage encodes nucleases that degrade host cell DNA. To protect its own genome, the phage modifies its DNA by replacing cytosine with 5-hydroxymethylcytosine and subsequently transferring glucose (Glc) to the 5-hydroxymethylcytosine using a specific UDP-Glc:DNA Glc-transferase. The baculovirus enzyme ecdysteroid glucosyltransferase (EGT) disrupts the hormonal balance of the insect host by catalyzing the conjugation of ecdysteroid hormones with Glc or galactose (Gal). Expression of the EGT gene allows the virus to block molting and pupation of infected insect larvae.'
 'PNAG is common among many oral pathogens and multidrug-resistant bacteria resulting in concerted efforts to target this polymer, especially because antibodies raised against the deacetylated form of PNAG mediate opsonic killing. Interestingly, the periodontal pathogen Aggregatibacter actinomycetemcomitans secretes a PNAG hydrolase known as dispersin B (DspB) that has been shown to effectively disperse biofilms formed by PNAG-producing bacteria and is therefore also being developed as an adjuvant to antibiotic therapy. Viruses bind to host cells as a prerequisite for entry and intracellular replication. The enrichment of glycans on cell surfaces make them an attractive target for viral attachment and entry. Virus–glycan interactions are often responsible for species and tissue tropism (Table 37.1), as illustrated here with examples of three human pathogens: influenza virus, herpes simplex virus 1 (HSV-1), and human immunodeficiency virus (HIV), showing different modes of glycan-mediated viral interactions (Figure 42.5). Influenza viruses use a sialic acid–recognizing protein (hemagglutinin) for binding and entry (Figure 42.5A). HSV-1 has multiple envelope proteins that bind to heparan sulfate (HS) as the first step in recruitment of a multiprotein virus entry complex (Figure 42.5B). HIV expresses surface glycans that co-opt host lectins to enhance cell dissemination, but has also evolved to use specific protein receptors (Figure 42.5C). In contrast to these three examples, coronaviruses seem to be undergoing more rapid evolution, with regard to preferred ligands. Many of these viruses have a hemagglutinin-esterase (HE) that binds to specific O-acetylated sialic acids and they possess an esterase that cleaves the O-acetyl group. Some coronaviruses have eliminated the HE protein entirely and switched to sialic acid-binding via a spike protein.'
 'Some coronaviruses have evolved to adapt the spike “S” proteins to target O-acetylated sialic acid receptors. The severe acute respiratory syndrome coronavirus 2 (SARS-CoV-2), causative agent of the COVID-19 pandemic, has completely lost its hemagglutinin-esterase protein, but encodes an S protein that has evolved further, to bind more robustly to heparan sulfate (HS) proteoglycans, which can also act as a cofactor facilitating binding to a high-affinity protein receptor ACE2. Rotaviruses, the major killer of children worldwide, can also bind to sialic acid residues. These viruses only bind to the intestinal epithelium of newborn infants during a period that appears to correlate with the expression of specific types and arrangements of sialic acids on glycoproteins. Claims regarding “sialic acid–independent” rotaviruses may be explained by internal sialic acids resistant to bacterial sialidases. Many other viruses (e.g., adenovirus, reovirus, Sendai virus, and polyomavirus) also use sialic acids for infection, and crystal structures are now available for several of their sialic acid–binding domains. A number of viruses, including herpes simplex virus (HSV), foot-and-mouth disease virus, human immunodeficiency virus (HIV), and dengue flavivirus, use heparan sulfate proteoglycans as adhesion receptors (Table 37.1). In many cases, the proteoglycans may be part of a coreceptor system in which viruses make initial contact with a cell-surface proteoglycan and later with another receptor. For example, HSV infection is thought to initially involve the binding of viral glycoproteins gB and/or gC to cell-surface heparan sulfate proteoglycans. Glycoprotein gB promotes virus-cell fusion, syncytium formation (cell–cell fusion), and adherence, whereas gC binds to the C3b component of complement and blocks complement-mediated inhibition of the virus.'
 ""By virtue of their glycosyltransferase domains, these impair the host's cytoplasmic or nuclear machinery and disrupt host-cell immune response. For example, small cytoplasmic G-proteins (GTP-binding proteins) of the Rho family are involved in regulating the cytoskeleton. Certain toxins from anaerobic bacteria were found to contain retaining glycosyltransferase activities that inhibit G-proteins by attaching a glycosyl moiety to a threonine residue (Thr-37) in their GTP-binding sites. These secreted toxins show the remarkable ability of translocating across the surface membrane into the cytoplasm of mammalian target cells. The enterotoxins from Clostridium difficile (ToxA) and Clostridium sordellii are α-glucosyltransferases from CAZy family GT44 that use UDP-glucose (UDP-Glc) as the donor. In contrast, a similar toxin from Clostridium novyi is an O-αGlcNAc transferase that uses UDP-GlcNAc as the donor. The C. novyi toxin has no primary sequence relationship to host glycosyltransferases. A distantly related toxin from Legionella pneumophila, also delivered by a type IV secretion system, installs an αGlc residue on elongation factor 1A in a broad range of eukaryotic host cells. The target residue, Ser53, is located in the G domain near the switch-1 region of the GTPase, and glucosylation inhibits its activity in vitro and in vivo. The recent discovery of a new effector glucosyltransferase, LtpM, shows that this is an expanding field of glycosyltransferase discovery. Interestingly, an unrelated toxin from Yersinia, which enters host cells via a phage tail-derived translocation system, was found to be an αGlcNAc-transferase that modifies Tyr-34 of RhoA.""
 'Interestingly, an unrelated toxin from Yersinia, which enters host cells via a phage tail-derived translocation system, was found to be an αGlcNAc-transferase that modifies Tyr-34 of RhoA. Typically, the sugar–amino acid linkage is not recognized by endogenous glycosidases, allowing the pathogen to irreversibly alter the function of the target—typically a GTPase domain. Other Gram-negative bacteria use a type 3 secretion system to inject virulence factors that mediate a different form of monoglycosylation: GlcNAcα-Arg. This novel reaction is catalyzed by NleB-related glycosyltransferases that promote host-cell longevity during infection. NleB and NleB orthologs target arginine side-chains within death domains of death receptors and associated proteins TRADD, FADD, RIPK1, and TNFR1. Importantly, these factors all work to attenuate NF-κB signaling to dampen host-cell antibacterial and inflammatory responses. Furthermore, various components of glucose metabolism such as GAPDH (glyceraldehyde 3-phosphate dehydrogenase) and HIF-1α are also targeted to reduced NF-κB signaling. Although these examples involve monoglycosylation mediated by exogenous glycosyltransferases (see Table 18.1), their existence reinforces the potential impact of glycosylation as a regulatory mechanism, and the diversity of glycosylation events that probably remain to be discovered. Although the focus of this chapter is on nuclear and cytoplasmic glycoproteins, it should be noted that specific bases in DNA have long been known to be a target of bacteriophage-encoded glycosyltransferases. Modification of T4-phage DNA hydroxymethylcytosine residues by βGlcTs or αGlcTs (Table 18.1) aids in the distinction of native and foreign DNA, rendering them resistant to host restriction enzyme digestion and impairing a subset of CRISPR/Cas systems.']","For instance, a baculovirus-encoded glucosyltransferase glycosylates insect host ecdysteroid hormones to block molting, and bacteriophage-derived glucosyltransferases modify 5-hydroxymethyl cytosine bases in the phage DNA to protect it from bacterial restriction enzymes.","For instance, a baculovirus-encoded glucosyltransferase glycosylates insect host ecdysteroid hormones to block molting, and bacteriophage-derived glucosyltransferases modify 5-hydroxymethyl cytosine bases in the phage DNA to protect it from bacterial restriction enzymes. Host-derived glycosylation in enveloped viruses is typically extensive and the resulting “glycan shield” protects the virus from immune reactions against the underlying polypeptide. In this regard, it has been suggested that the high frequency of heterozygous states for human congenital disorders of glycosylation (Chapter 44) may reflect selection for genomes that limit glycosylation of invading viruses.",1.0,0.43055031469029276,0.8327537086136299,0.025974025974025976,0.9999999999857143,1.0
"Complete the following paragraph: Although the focus of this chapter is on the glycobiology of bacterial cell envelopes, there are several additional (and equally important) facets of bacterial glycobiology. Three of these are briefly mentioned here.","['NCBI Bookshelf. A service of the National Library of Medicine, National Institutes of Health. Varki A, Cummings RD, Esko JD, et al., editors. Essentials of Glycobiology [Internet]. 4th edition. Cold Spring Harbor (NY): Cold Spring Harbor Laboratory Press; 2022.  doi: 10.1101/glycobiology.4e.21 Chris Whitfield, Christine M. Szymanski, Amanda L. Lewis, and Markus Aebi. Glycoconjugates are integral components of the cell surfaces of bacteria and are often the immediate point of contact with the environment. Surface glycoconjugates contribute to the essential permeability barrier properties of the cell envelope, influence both the susceptibility and resistance of bacteria to antibiotics and other harmful compounds, participate in the formation and dispersion of biofilms, act as receptors for bacteriophages, and play pivotal roles in pathogenic and symbiotic host–microbe interactions. Reflecting these many functions, surface glycoconjugates are remarkably diverse, enabled by the propensity for bacterial genetic recombination and lateral gene transfer and shaped by environmental interactions that impart niche-specific selective pressures. Surface glycoconjugates drive a variety of important interactions with host innate and adaptive immune defenses. Some are recognized as pathogen-associated molecular patterns (PAMPs), for example, via Toll-like receptor (TLR)-mediated pathways. Others are natural targets of adaptive immunity and have been exploited in successful vaccine strategies. Because of their importance in cell viability, surface glycoconjugates are also frequent targets of antimicrobial strategies. This chapter will provide an overview of the structure and biosynthesis of glycoconjugates, together with some examples of their functions. Bacteria were historically divided into two major groups based on their response in the Gram-staining procedure (i.e., Gram-positive and Gram-negative organisms), reflecting the organization of the cell wall. The amount and location of peptidoglycan in the cell wall is an important contributor to the outcome of Gram staining. Peptidoglycan is essential for the viability of most bacteria.'
 'The amount and location of peptidoglycan in the cell wall is an important contributor to the outcome of Gram staining. Peptidoglycan is essential for the viability of most bacteria. It consists of polysaccharide strands covalently cross-linked by short peptides, creating a three-dimensional structure that confers shape and rigidity to the cell. In Gram-negative bacteria, such as Escherichia coli, the cell wall consists of two membranes separated by a cellular compartment termed the periplasm in which thin layers of peptidoglycan reside (Figure 21.1). In Gram-positive bacteria, substantially thicker layers of peptidoglycan surround a single membrane and provide an attachment point for other glycan structures. Another class of bacteria, the Negativicutes, are related to the Gram-positive Firmicutes but nevertheless have a two-membrane architecture and stain as Gram-negative. Other bacteria produce variable responses in the Gram-staining reaction, largely because of the presence of other glycans and cell wall lipids (see below). Conceptual organization of the cell envelopes of Gram-negative bacteria, Gram-positive bacteria, and mycobacteria. The schematic comparison of the cell walls (or cell envelopes) of Gram-negative bacteria, Gram-positive bacteria, and mycobacteria illustrates (more...) The periplasm of Gram-negative bacteria contains proteins associated with cell-surface assembly and nutrient uptake but may also contain free oligosaccharides (fOS) that protect against osmotic stress. The outer membrane is an asymmetric lipid bilayer, with an outer leaflet composed mainly of a unique glycolipid called lipopolysaccharide (LPS) that is essential for the integrity of the permeability barrier imposed by the outer membrane. Many Gram-negative bacteria are covered in a surface-bound polysaccharide layer known as a capsule, and, in some cases, this capsular polysaccharide (CPS) is released from the cell in large amounts as free exopolysaccharide (EPS). Bacteria producing these products are often readily identified by their highly mucoid colonies.'
 'In Streptococci, this may be catalyzed by an enzyme related to those that link WTAs to the same site in peptidoglycan. Several Gram-negative bacteria assemble CPSs using a conserved phosphatidylglycerol-(Kdo)n acceptor. Although prototypes are found in E. coli and N. meningitidis, the system is conserved across a range of mucosal pathogens. Here, polymerization of the lipid-linked glycan is completed in the cytoplasm, after which it is exported via an ABC transporter. The transporter is linked to additional proteins that span the periplasm and outer membrane in a configuration thought to resemble certain drug efflux pumps in bacteria. The final assembly pathway seems to operate independently of a lipid carrier and requires a processive polymerase called a synthase. Examples are found in Gram-positive and Gram-negative bacteria, but seem to be confined to EPSs. The prototypical hyaluronan and cellulose synthases from Streptococci and Gram-negative bacteria show different architectures, yet both are sufficient for both synthesis and export across the cytoplasmic membrane. The molecular details underlying these processes have been resolved by analysis of the crystal structure of the cellulose synthase. In Gram-negative bacteria, a periplasmic scaffold links the synthase to an outer membrane protein channel. Although the focus of this chapter is on the glycobiology of bacterial cell envelopes, there are several additional (and equally important) facets of bacterial glycobiology. Three of these are briefly mentioned here. First, in addition to synthesizing surface structures, bacteria also produce intracellular glycans and cytoplasmic glycosylated proteins and glycolipids. For example, glycogen and trehalose act as storage compounds within some bacteria. Mycobacteria also contain a growing list of unusual glycosylated molecules, which may be related to their ability to withstand a variety of stresses. Second, bacteria produce a wide range of glycan-binding proteins.'
 'For example, glycogen and trehalose act as storage compounds within some bacteria. Mycobacteria also contain a growing list of unusual glycosylated molecules, which may be related to their ability to withstand a variety of stresses. Second, bacteria produce a wide range of glycan-binding proteins. These include adhesins that facilitate bacterial colonization, exotoxins that bind to host membrane glycans, and single-sugar-binding proteins involved in metabolism (see Chapter 42). Third, bacterial lifestyles are often defined by their capacity to digest and/or metabolize glycans. Complex nanomachines have been described for the degradation of complex carbohydrate structures. Assembling the various enzymes into a highly organized complex affords synergy and efficiency. For example, the roles of glycosyl hydrolases in biomass conversion are well documented (Chapter 59). The cellulose degradation machinery in Clostridioides sp. and other organisms comprises a suite of glycosidases and carbohydrate-binding modules, all assembled into a single surface complex (the cellulosome) via noncatalytic cohesin and dockerin structural modules. Within the gut microbiome, Bacteroidetes encode a remarkable array of carbohydrate-active enzymes in polysaccharide utilization loci, allowing them to adapt to dietary changes by sensing, binding, and degrading different complex substrates, followed by import of the products for catabolism. Indeed, bacteria within the many biomes of the human body derive benefit from foraging, not only on plant polysaccharides, but also on host-derived mucosal glycans. We continue to learn more about the intricate pathways for the digestion, capture, and catabolism of environmental and host carbohydrates. The authors acknowledge contributions to previous versions of this chapter by Jeffrey D. Esko, Tamara L. Doering, and the late Christian Raetz and appreciate helpful comments and suggestions from Graham Heberling and Jerry Eichler.'
 'This process is an essential driver of cell shape determination. Division is particularly complex, with a multiprotein “divisome” that includes regulatory proteins dedicated to fidelity in the timing and placement of the division site. Among the remodeling enzymes are lytic transglycosylases, which cleave glycan chains to create a characteristic terminal 1,6-anhydroMurNAc residue. This reaction may determine the size of the glycan chains (effectively marking the end of biosynthesis) but is also required for the insertion of trans–cell wall structures, signaling in the regulation of some β-lactamases, and the release of PAMPs. Peptidoglycan synthesis has offered a classic target for antibiotics and continues to provide new avenues for drug discovery. Penicillins and other β-lactam antibiotics mimic the D-Ala-D-Ala motif and create a slow-turnover acyl-enzyme complex with TPs (hence, proteins with TP modules are also referred to as penicillin-binding proteins, or PBPs). The action of these drugs requires active bacterial replication. Resistance to these compounds involves their exclusion from the cell, replacement of the target enzyme, or production of β-lactamases. Vancomycin and other glycopeptides also affect the cross-linking step by binding to the terminal D-Ala-D-Ala to prevent its turnover. Members of the moenomycin family of compounds are phosphoglycolipids that are thought to inhibit transglycosylase GTs by mimicking the growing glycan chain and binding the donor substrate site in the enzyme. The points of action of these and other antibacterial compounds are shown in Figure 21.2. Gram-positive cell walls contain large amounts of additional polymers that provide further functionality and structure to the cell wall. The best known examples are WTAs, which often consist of polyribitol or polyglycerol chains (40 to 60 repeats) variably substituted with monosaccharides and/or D-Ala. These chains are linked by a phosphodiester bond to the C6 position of MurNAc through a conserved linkage region (Figure 21.3).'
 'Many Gram-negative bacteria are covered in a surface-bound polysaccharide layer known as a capsule, and, in some cases, this capsular polysaccharide (CPS) is released from the cell in large amounts as free exopolysaccharide (EPS). Bacteria producing these products are often readily identified by their highly mucoid colonies. Structural variations in the LPS and capsules of different bacterial species are diverse and influence many types of interactions between bacteria and their environmental and host niches. Gram-positive bacteria lack the outer membrane (Figure 21.1) and depend on a much thicker multilayered peptidoglycan layer for viability. The Gram-positive cell wall is modified with additional specialized cell wall glycan polymers covalently linked to peptidoglycan (e.g., wall teichoic acids [WTAs]), whereas glycolipids, such as lipoteichoic acids (LTAs), are anchored in the cell membrance. Mycobacteria and related Actinobacteria are not considered to be Gram-positive or Gram-negative, and are instead classified as acid-fast bacteria because they possess distinctive cell walls that confer an aberrant response to the classical Gram-staining procedure. Their complex cell walls have a high content of remarkable glycan and glycolipid structures (Figure 21.1). The unique arabinogalactan (AG) component that characterizes these organisms is covalently attached to peptidoglycan and provides an attachment point for characteristic long-chain (C60–C90) α-alkyl-β-hydroxymycolic acids. The resulting mycolyl-AG-peptidoglycan complex underpins a permeability barrier conferring resistance to antibiotics and other harmful molecules. Mycolic acids help form an envelope layer referred to as an “outer membrane,” although its structure shares no similarity with its namesake in Gram-negative bacteria.'
 'PIMs and PI can account for >50% of the total envelope phospholipid content and are important for cell wall integrity and division. After synthesis and export, these lipids are extended into lipomannans (LMs) by additions from decaprenyl-P-Man donors. As is the case for AG, periplasmic extension of LMs is catalyzed by specific type C GTs that further elaborate into lipoarabinomannans (LAMs) using decaprenyl-P-Araf, creating a covalently linked arabinan resembling the structure in AG, in a LAM molecule containing more than 100 sugars (Figure 21.3). The terminal Araf residues can be further capped by Man residues in ManLAM. These compounds are all potentially recognized by an adaptive immune response, the mannose receptor on macrophages (facilitating phagocytosis), the lectin pathway of complement activation, and by DC-SIGN (dendritic cell–specific intercellular adhesion molecule-3-grabbing nonintegrin). ManLAM and (particularly) LM are potent ligands for TLR2 but differ in their immunomodulatory effects. Indeed, their exact role(s) in the complex pathogenesis process remain unresolved. The outer membrane of Gram-negative bacteria (Figure 21.1) is an asymmetric bilayer, with the outer leaflet that is mostly composed of the unique glycolipid known as LPS (see Figure 21.5). LPS is absent in only a few Gram-negative bacteria, such as the endosymbionts Borrelia and Wolbachia and in Sphingomonas, in which LPS is functionally replaced by sphingolipids. In Salmonella, there are ∼106 molecules of LPS per cell (vs. 107 total phospholipids), covering ∼75% of the cell surface. LPS is usually essential for outer membrane integrity in producing organisms.']","In addition to synthesizing surface structures, bacteria also produce intracellular glycans and cytoplasmic glycosylated proteins and glycolipids. For example, glycogen and trehalose act as storage compounds within some bacteria. Mycobacteria also contain a growing list of unusual glycosylated molecules, which may be related to their ability to withstand a variety of stresses. Second, bacteria produce a wide range of glycan-binding proteins. These include adhesins that facilitate bacterial colonization, exotoxins that bind to host membrane glycans, and single-sugar-binding proteins involved in metabolism. Third, bacterial lifestyles are often defined by their capacity to digest and/or metabolize glycans. Complex nanomachines have been described for the degradation of complex carbohydrate structures, allowing bacteria to adapt to dietary changes and derive benefits from foraging on various substrates.","First, in addition to synthesizing surface structures, bacteria also produce intracellular glycans and cytoplasmic glycosylated proteins and glycolipids. For example, glycogen and trehalose act as storage compounds within some bacteria. Mycobacteria also contain a growing list of unusual glycosylated molecules, which may be related to their ability to withstand a variety of stresses. Second, bacteria produce a wide range of glycan-binding proteins. These include adhesins that facilitate bacterial colonization, exotoxins that bind to host membrane glycans, and single-sugar-binding proteins involved in metabolism (see Chapter 42). Third, bacterial lifestyles are often defined by their capacity to digest and/or metabolize glycans. Complex nanomachines have been described for the degradation of complex carbohydrate structures. Assembling the various enzymes into a highly organized complex affords synergy and efficiency. For example, the roles of glycosyl hydrolases in biomass conversion are well documented (Chapter 59).",1.0,0.4418732564754513,0.9819777480467989,0.010416666666666666,0.9999999999857143,1.0
"Complete the following paragraph: In comparison to N-glycan biosynthesis, relatively little is known of how archaeal O-glycans are assembled. The O-glycans of four archaeal species have been characterized to a limited extent (Figure 22.3). The only published report on archaeal O-glycan biosynthesis revealed that Haloarcula hispanica requires Dol-P-Glc as a sugar donor for the assembly of the N-linked glucose-α-(1,2)-[sulfoquinovosamine-β-(1,6)-]galactose trisaccharide and the O-linked glucose-α-(1,4)-galactose disaccharide.","['This glycan is unusual as it contains the typical eukaryotic chitobiose core and a sulfoquinovose, a sugar generally found only in photosynthetic membranes of plants and phototrophic bacteria. Biosynthesis of the N-linked glycan begins with the transfer of GlcNAc-phosphate, derived from a nucleotide-activated precursor, onto an unusually short and highly saturated Dol-PP lipid carrier by AglH, a UDP-GlcNAc-1-P: Dol-P-GlcNAc-1-P transferase. Information concerning addition of the second and third sugars is lacking. However, Agl3 converts UDP-glucose and sodium sulphite into UDP-sulfoquinovose, which is subsequently added to Dol-PP-bound trisaccharide by an unknown glycosyltransferase. In the final steps of N-linked glycan assembly, the terminal mannose and glucose moieties are added, with Agl16, a soluble glycosyltransferase, adding the final glucose. A so-far unidentified flippase translocates the Dol-PP-bound hexasaccharide across the membrane, where AglB transfers the glycan to target protein Asn residues. In contrast to Hfx. volcanii, M. voltae, and M. maripaludis, aglB is essential in S. acidocaldarius. In comparison to N-glycan biosynthesis, relatively little is known of how archaeal O-glycans are assembled. The O-glycans of four archaeal species have been characterized to a limited extent (Figure 22.3). The only published report on archaeal O-glycan biosynthesis revealed that Haloarcula hispanica requires Dol-P-Glc as a sugar donor for the assembly of the N-linked glucose-α-(1,2)-[sulfoquinovosamine-β-(1,6)-]galactose trisaccharide and the O-linked glucose-α-(1,4)-galactose disaccharide.'
 'Efforts undertaken at the time aimed at deciphering the pathways responsible for the synthesis of these glycans relied solely on biochemical approaches because neither suitable genetic tools nor a genome sequence were available. Despite these biochemical advances, delineation of archaeal N-glycosylation pathways had to wait until the genome age and the development of tools for the genetic manipulation of various species. Through the subsequent identification of homologs of eukaryotic and/or bacterial N-glycosylation pathway components, genome scanning for additional components, the generation of deletion strains, and characterization of reporter glycoproteins, agl (archaeal glycosylation) genes comprising archaeal N-glycosylation pathways have been identified in several Archaea, including halophilic, methanogenic, and thermophilic species. In the last decade, progress in defining pathways of N-glycosylation has relied on Haloferax volcanii as a model organism. In Hfx. volcanii, a series of Agl proteins mediate the assembly and attachment of a pentasaccharide with the structure mannose-1,2-[methyl-O-4-]glucuronic acid-β1-4-galacturonic acid-α1-4-glucuronic acid-β1-4-glucose-β-Asn to the S-layer glycoprotein and archaellins (Figure 22.4). Acting at the cytoplasmic face of the plasma membrane, the glycosyltransferases AglJ, AglG, AglI, and AglE sequentially add the first four pentasaccharide residues onto a common Dol-P carrier, whereas AglD adds the final pentasaccharide residue, mannose, to a distinct Dol-P (Figure 22.3). Assembly of the Dol-P-linked tetrasaccharide also involves AglF, a glucose-1-phosphate uridyltransferase, AglM, a UDP-glucose dehydrogenase, AglP, a methyltransferase, and AglQ, a predicted isomerase.'
 'This cell envelope is further enforced by analogues of halomucin, termed Hmu2 and Hmu3, and most likely by a poly-γ-glutamate capsule. To date, glycoproteins from Archaea isolated from a wide range of habitats have been studied to various degrees of detail. Possibly reflecting the varied niches occupied by these organisms, their S-layer glycoproteins and other glycoproteins, such as archaellins and pilins, bear N-linked glycans that present wider diversity in terms of size; degree of branching; the identity of the linking sugar; modification of sugar components by amino acids, sulfate, and methyl groups; and the presence of unique sugars than reported to date in Bacteria or Eukarya. Currently defined archaeal N-linked glycans are depicted in Figure 22.3. The structural diversity of N- and O-linked glycans in Archaea. The structures of N-linked glycans found in the Euryarchaeota and Crenarchaeota are shown. The OTase (STT3 or AglB) within the endoplasmic reticulum (ER) or cytoplasmic membrane (right), (more...) The first reported archaeal N-glycosylated protein, the Halobacterium salinarum S-layer glycoprotein, was shown to be modified by two different N-linked oligosaccharides, a repeating sulfated pentasaccharide linked via N-glycosylamine to Asn-2 and a sulfated glycan linked by a glucose residue to 10 other Asn residues. The latter glycan is also N-linked to archaellins in this haloarchaeon. Efforts undertaken at the time aimed at deciphering the pathways responsible for the synthesis of these glycans relied solely on biochemical approaches because neither suitable genetic tools nor a genome sequence were available. Despite these biochemical advances, delineation of archaeal N-glycosylation pathways had to wait until the genome age and the development of tools for the genetic manipulation of various species.'
 'Assembly of the Dol-P-linked tetrasaccharide also involves AglF, a glucose-1-phosphate uridyltransferase, AglM, a UDP-glucose dehydrogenase, AglP, a methyltransferase, and AglQ, a predicted isomerase. AglF and AglM have been shown to act in a sequential and coordinated manner in vitro, transforming glucose-1-phosphate into UDP-glucuronic acid. AglB, the archaeal oligosaccharyltransferase, transfers the lipid-linked tetrasaccharide to select Asn residues of target proteins. The final mannose residue is subsequently transferred from its Dol-P carrier to the protein-bound tetrasaccharide in a reaction requiring AglR, a protein that either serves as the Dol-P-mannose flippase or contributes to such activity, and AglS, a Dol-P-mannose mannosyltransferase. Interestingly, N-glycosylation of the S-layer protein is altered in response to a change in environmental conditions. When grown in low-salt medium, Hfx. volcanii alters the N-glycan structure in a site-specific manner. The pathway of N-glycosylation in Haloferax volcanii. The oligosaccharide is assembled on a dolichol phosphate lipid carrier, translocated across the plasma membrane, and transferred to a target protein by the AglB oligosaccharyltransferase. The N-linked (more...) Mass spectrometry studies elucidated the glycan N-linked to archaellins of Methanococcus voltae strain PS.'
 'N-glycosylation has been considered as assisting Archaea to cope with the challenges of the extreme environments they often occupy. For instance, enhanced surface charge in the face of hypersaline conditions and hence increased solubility was offered as an explanation for the high sulfated sugar content of N-linked glycans decorating the Hbt. salinarum S-layer glycoprotein relative to its Hfx. volcanii counterpart, given the higher salinity of the locale in which the former lives. In other instances, it is not clear how a given N-glycosylation profile contributes to life in harsh surroundings. In Hfx. volcanii, however, N-glycosylation may provide cells with the ability to respond to changes in the surrounding salinity. As noted above, the N-glycosylation profile of the S-layer glycoprotein differs in cells grown in 3.4 or 1.75 m NaCl-containing medium (Figure 22.3). Modified glycosylation in response to environmental conditions has also been reported in the case of M. hungatei, in which archaellins are only modified in a low phosphate-containing medium. Furthermore, a fully assembled N-glycan has been shown to be required for a broad range of biological functions, including motility and species-specific cell-cell recognition. Archaeal biofilms have been identified in a large variety of habitats (e.g., at low and high temperatures), as well as under acidic, alkaline, and high-salt conditions. It is proposed that Archaea, especially those that require interaction with other species, synthesize biofilms to support these cell–cell interactions. Detailed analyses of the structure and composition of extracellular polymeric substances (EPSs) of archaeal biofilms are limited. The sugar composition of a few EPSs has been analyzed by lectin binding assays. Such studies revealed that in Sulfolobales species, for instance, the EPS mainly consists of glucose, galactose, mannose, and N-acetyl-D-glucosamine.'
 ""Furthermore, the discoveries of new archaeal lineages in the last decade, predominantly based on metagenomics studies, have led to extensive expansion and reconstruction of the archaeal phylogenetic tree. At present, attempts to cultivate these newly identified Archaea have rarely been successful. Nevertheless, the study of cultivated Archaea has led to many important discoveries. Since Neuberger's discovery of protein glycosylation in the late 1930s (Chapter 1) and his description of the N-acetylglucosamine (GlcNAc)-β-asparagine linkage of a glycan to the modified protein, it became generally accepted that protein glycosylation was a process limited to eukaryotes. This long-held belief was challenged in 1976, when Mescher and Strominger showed that the surface (S)-layer glycoprotein of the archaeon Halobacterium salinarum was subject to both N- and O-glycosylation, thus offering the first example of a noneukaryotic glycoprotein. Today, it is clear that protein glycosylation is an almost universal trait of the Archaea. The discovery that Archaea do not contain murein in their cell wall was one of the main arguments used to distinguish this group of prokaryotes from Bacteria. Indeed, at the time, cell wall composition was considered to be “the only useful phylogenetic criterion, other than direct molecular phylogenetic measurement” to distinguish between the two prokaryotic domains. Some methanogenic Archaea were, however, shown to include a distinct polymer termed pseudomurein (or pseudopeptidoglycan) in their cell wall, whereas other archaeal species were found to assemble cell walls based on different sugar-based polymers. Today, as more and more archaeal species are cultivated, it is becoming clear that Archaea present numerous variations in the composition of the cell surface. For instance, although many species seem to mainly rely on a cell envelope in which the cytoplasmic membrane is enclosed by a two-dimensional crystalline proteinaceous layer called the surface (S)-layer, strains surrounded by two membranes have been identified.""
 'The oligosaccharide is assembled on a dolichol phosphate lipid carrier, translocated across the plasma membrane, and transferred to a target protein by the AglB oligosaccharyltransferase. The N-linked (more...) Mass spectrometry studies elucidated the glycan N-linked to archaellins of Methanococcus voltae strain PS. GlcNAc, the linking sugar, is connected to a diacetylated glucuronic acid, in turn linked to an acetylated mannuronic acid modified by a threonine at the C-6 position (β-ManpNAcA6Thr-(1-4)-β-Glc-pNAc3NAcA-(1-3)-β-GlcpNAc), although archaellins from other versions of M. voltae strain PS presented an N-glycan bearing an additional mass of either 220 or 260 Da at the nonreducing end, likely representing an additional sugar. As with Hfx. volcanii, the identification of M. voltae N-glycosylation pathway components initially relied on gene deletion and subsequent analysis of the N-linked glycans generated in mutant strain. As such, the oligosaccharyltransferase AglB and the glycosyltransferase AglA, responsible for transfer of the third sugar of the glycan, were discovered. The same strategy was later used to identify AglC and AglK, glycosyltransferases proposed to be involved in the biosynthesis or transfer of the second sugar. A genetic approach also assigned AglH responsibility for adding the linking sugar GlcNAc to the lipid carrier on which the N-linked glycan is assembled. Although aglH could not be deleted in M. voltae, it was able to complement a conditional lethal mutation in the alg7 gene of Saccharomyces cerevisiae. Alg7, sharing 25% identity with M. voltae AglH, catalyzes the conversion of UDP-GlcNAc and Dol-P to UMP and Dol-PP-GlcNAc in the eukaryotic N-glycosylation process.']","The O-glycans of four archaeal species have been characterized to a limited extent. The only published report on archaeal O-glycan biosynthesis revealed that Haloarcula hispanica requires Dol-P-Glc as a sugar donor for the assembly of the N-linked glucose-α-(1,2)-[sulfoquinovosamine-β-(1,6)-]galactose trisaccharide and the O-linked glucose-α-(1,4)-galactose disaccharide. Additionally, it is noted that relatively little is known about how archaeal O-glycans are assembled compared to N-glycan biosynthesis.","N-glycosylation has been considered as assisting Archaea to cope with the challenges of the extreme environments they often occupy. For instance, enhanced surface charge in the face of hypersaline conditions and hence increased solubility was offered as an explanation for the high sulfated sugar content of N-linked glycans decorating the Hbt. salinarum S-layer glycoprotein relative to its Hfx. volcanii counterpart, given the higher salinity of the locale in which the former lives. In other instances, it is not clear how a given N-glycosylation profile contributes to life in harsh surroundings. In Hfx. volcanii, however, N-glycosylation may provide cells with the ability to respond to changes in the surrounding salinity.",1.0,0.7260655461985548,0.643509866748292,0.013333333333333334,0.19999999998,0.75
"Complete the following paragraph: A. fumigatus is an environmental mold that spreads by airborne particles. It causes serious invasive disease in immunocompromised people that is difficult to treat, leading to high mortality rates.","['C. albicans mannans are also important in its interactions with host cells, including macrophages and dendritic cells. In particular, these structures are recognized by the mannose receptor and by dectin-2. These are C-type lectins expressed by immune cells that are important in both innate and adaptive immune responses (see Chapter 34). PLM antigens may be shed by C. albicans and, through interactions with Toll-like receptors (TLR-2), they can induce nuclear factor-κB (NF-κB) activation and cytokine responses such as tumor necrosis factor-α (TNF-α) secretion. Galectin-3, a ubiquitous member of the galectin family of lectins that is highly expressed in macrophages, also appears to recognize C. albicans expressing β1-2-linked mannose residues, resulting in opsonization of the yeast. A. fumigatus is an environmental mold that spreads by airborne particles. It causes serious invasive disease in immunocompromised people that is difficult to treat, leading to high mortality rates. As with other fungal pathogens, the surface glycans of A. fumigatus are critical for interactions with the host. The cell wall of infectious forms of this fungus is covered with specific proteins and melanin, presumably to alter surface properties and mask these structures from recognition by host immune receptors. The hyphal wall has a core of branched β1-3-glucan covalently linked to other glucan components, chitin, and galactomannan, which consists of a mannose backbone with short galactofuranose side chains. Interestingly, galactomannan also occurs anchored to the plasma membrane by a GPI. This polysaccharide is assembled in the Golgi apparatus and is probably transferred to the cell wall by transglycosidases, in the same way as GPI-anchored proteins.'
 'Interestingly, galactomannan also occurs anchored to the plasma membrane by a GPI. This polysaccharide is assembled in the Golgi apparatus and is probably transferred to the cell wall by transglycosidases, in the same way as GPI-anchored proteins. A. fumigatus also produces an extracellular matrix composed of monosaccharides, α1-3-glucan, galactomannan, and a galactosaminogalactan composed of variable galactopyranose repeats linked to N-acetylgalactosamine, which are partially de-acetylated. This structure has been implicated in adhesion and fungal virulence. The extracellular matrix also plays an important role in concealing the immunogenic β1-3 glucan layer from the immune system. C. neoformans is a ubiquitous environmental basidiomycete yeast that causes severe disease in immunocompromised individuals, leading to roughly half a million deaths per year worldwide. It is unique among pathogenic fungi in having an extensive polysaccharide capsule that is required for virulence (Figure 23.6). The capsule is a dynamic structure that changes in thickness and composition depending on the environment and growth conditions. It is particularly large in the context of mammalian infection, in which it impedes host immune responses. It is composed of two large (millions of Da) polysaccharides named for their monosaccharide components: glucuronoxylomannan (GXM) and glucuronoxylomannogalactan (GXMGal). GXM is an extended α1-3 mannan substituted with β1-2Xyl, β1-4Xyl, and β1-2GlcA (Figure 23.7); a subset of the mannose residues are 6-O-acetylated (not shown).'
 'These organisms display diverse glycans, which typically differ from those of the host and have been implicated in multiple pathogenic processes and host–pathogen interactions. For example, during plant infections plant glycosylhydrolases may partially digest wall glucans of invading fungi. Some of the released oligosaccharides, termed oligosaccharins, can then act as signals to promote plant antifungal defenses. C. albicans (an ascomycete) is a normal commensal organism that can cause illness ranging from irritations of mucosal surfaces to life-threatening systemic infections. The C. albicans cell wall contains β1-3- and β1-6-linked glucans and chitin, similar to the S. cerevisiae wall, and immunogenic mannans that are termed phosphopeptidomannans. It also produces unusual short β1-2-linked mannose chains (Figure 23.2) that are highly antigenic and are also expressed on phospholipomannan (PLM) antigens. PLM antigens contain phytoceramide derivatives of myo-inositol phosphate. The β1-2 mannosides are linked via an α-mannosylphosphate to the common glycosphingolipid Manα-1,2 inositolphosphoceramide. The abundant GPI-anchored proteins of C. albicans have been implicated in fungal adherence to host tissues. The O-glycans of C. albicans are short chains of α1-2-linked mannose (Figure 23.3A), which lack the α1-3-linked mannose caps found in S. cerevisiae. As in S. cerevisiae, deficiencies of O-mannose addition generated through genetic deletions are lethal, indicating that O-mannosylation is essential in this yeast. C. albicans mannans are also important in its interactions with host cells, including macrophages and dendritic cells. In particular, these structures are recognized by the mannose receptor and by dectin-2.'
 'The unique features of fungal glycans may suggest drug targets to help improve this picture, and decrease the roughly one million deaths each year caused by fungal infections. The major success story using this approach is the development of echinocandin drugs. These antifungal lipopeptides inhibit β1-3-glucan synthesis in fungi including Candida and Aspergillus, leading to cell wall compromise, and are used clinically to treat invasive fungal infections, although they are not effective against all fungal pathogens. GPI-synthesis inhibitors also offer promise for treatment of fungal pathogens; compounds that selectively inhibit yeast inositol acylation are currently in clinical trials. Continued efforts to target novel aspects of fungal glycobiology may advance the ongoing search for new therapies. The authors appreciate helpful comments and suggestions from Anne Imberty and Markus Pauly.'
 'Finally, the xylans of this organism are linear β1-4-linked polymers of xylose, more typical of those found in “higher” plants and algae than in fungi. D. glabratum also synthesizes several unusual short glycolipids, including glycosyldiacylglycerolipids, which are similar to plant glycolipids and contain monosaccharides, disaccharides, and linear trisaccharides of α1-6-linked galactopyranose. This fungus thus highlights the extensive glycan diversity of the fungal kingdom. Another example of glycan diversity is offered by Cryptococcus laurentii, which has the unusual property of producing toxins that kill a pathogenic yeast, C. albicans (see below). The O-glycans of C. laurentii are unusual in that they contain mannose, xylose, and galactose (Figure 23.3C); these glycans are synthesized by a unique set of mannosyl-, xylosyl-, and galactosyltransferases that are not homologous to human enzymes. This diversity would not have been predicted by studies of model yeast alone, emphasizing the importance of examining glycans in a wide range of fungal species. Coprinopsis cinerea is a mushroom species that has gained prominence as a model for studies of diverse topics including mating, sexual development, meiosis, and the evolution of multicellularity. Its N-glycans typically are high mannose type with five to nine mannoses, but may also have a bisecting α1-4GlcNAc at the β-mannose. Pathogenic fungi are a significant cause of plant and animal disease, responsible for devastation of crops, decimation of animal populations (e.g., certain bat, amphibian, and bee species), and serious human diseases that kill an estimated one million people each year. These organisms display diverse glycans, which typically differ from those of the host and have been implicated in multiple pathogenic processes and host–pathogen interactions. For example, during plant infections plant glycosylhydrolases may partially digest wall glucans of invading fungi.'
 'GXM is an extended α1-3 mannan substituted with β1-2Xyl, β1-4Xyl, and β1-2GlcA (Figure 23.7); a subset of the mannose residues are 6-O-acetylated (not shown). The second polymer, GXMGal, is based on α1-6 galactan, with side chains of galactose, glucuronic acid, mannose, and xylose (Figure 23.7); the backbone is also modified with small amounts of β1-2-linked galactofuranose (not shown). Association of the capsule with the cell surface relies on a cell-wall component, α1-3 glucan. Although α1-3 glucan is not present in the cell walls of S. cerevisiae or C. albicans, it is common in other fungi. N-glycans of C. neoformans are generally high mannose with modest outer chain extensions and may include xylose β1-2-linked to the trimannosyl core. Both N- and O-glycans may also be modified with xylose and xylose phosphate. A quick-freeze deep-etch image of the edge of a Cryptococcus neoformans cell. The polysaccharide capsule (open meshwork at right) is linked to the cell wall (central structure dividing the image from upper left to lower right) via α1-3 glucan. (more...) Structures of capsular polysaccharides in Cryptococcus neoformans.  In the context of fungal diseases, the similarity of fungi to their eukaryote hosts becomes a liability, because it is challenging to develop antifungal drugs that are not hampered by toxicity. The unique features of fungal glycans may suggest drug targets to help improve this picture, and decrease the roughly one million deaths each year caused by fungal infections. The major success story using this approach is the development of echinocandin drugs.'
 'Shock, trauma, or sepsis can all cause acute respiratory distress syndrome. Diffuse pulmonary endothelial injury causes pulmonary edema because of increased capillary permeability. Selectins and integrins help arrest neutrophils on the injured endothelium where they release injurious oxidants, proteolytic enzymes, and arachidonic acid metabolites, resulting in endothelial cell dysfunction and destruction. Bronchoalveolar lavage is rich in neutrophils and their secreted products documenting the inflammatory response. Here again, giving small molecule selectin inhibitors and/or heparin before serious lung damage and respiratory failure is a possible therapy. Cystic fibrosis is a common genetic disorder caused by a mutation in the cystic fibrosis transmembrane conductance regulator (CFTR). This causes defective chloride conduction across the apical membrane of involved epithelial cells. Cystic fibrosis is associated with increased accumulation of viscous mucins in the pancreas, gut, and lungs, which leads to many symptoms of the disease. There are known to be widespread increases in sialylation, sulfation, and fucosylation of mucin glycoproteins. One possible explanation is that the primary CFTR defect allows a higher Golgi pH, resulting in abnormalities in glycosylation: however, there is controversy about this conclusion. Curiously, the CFTR is mainly expressed within nonciliated epithelial cells, duct cells, and serous cells of the tubular glands, but not highly expressed in the goblet cells and mucous glands of the acinar cells, which are the cells that synthesize respiratory mucins. Thus, the CFTR mutation may indirectly affect mucin glycosylation through the generation of inflammatory responses and/or changes in pH or chloride secretion. Another major cause of morbidity in the disease is the colonization of respiratory epithelium by an alginate-producing form of Pseudomonas aeruginosa. Certain glycolipids and mucin glycans have been suggested to be the Pseudomonas receptors that help to maintain the colonization.']","The cell wall of infectious forms of A. fumigatus is covered with specific proteins and melanin, presumably to alter surface properties and mask these structures from recognition by host immune receptors. The hyphal wall has a core of branched β1-3-glucan covalently linked to other glucan components, chitin, and galactomannan, which consists of a mannose backbone with short galactofuranose side chains. Additionally, A. fumigatus produces an extracellular matrix composed of monosaccharides, α1-3-glucan, galactomannan, and a galactosaminogalactan composed of variable galactopyranose repeats linked to N-acetylgalactosamine, which are partially de-acetylated. This structure has been implicated in adhesion and fungal virulence.","As with other fungal pathogens, the surface glycans of A. fumigatus are critical for interactions with the host. The cell wall of infectious forms of this fungus is covered with specific proteins and melanin, presumably to alter surface properties and mask these structures from recognition by host immune receptors. The hyphal wall has a core of branched β1-3-glucan covalently linked to other glucan components, chitin, and galactomannan, which consists of a mannose backbone with short galactofuranose side chains. Interestingly, galactomannan also occurs anchored to the plasma membrane by a GPI. This polysaccharide is assembled in the Golgi apparatus and is probably transferred to the cell wall by transglycosidases, in the same way as GPI-anchored proteins.",0.8333333333333334,0.5273505815315492,0.9255877455903863,0.025,0.999999999975,0.8
"Complete the following paragraph: Apiogalacturonans have only been identified in the walls of duckweeds and seagrasses. The substituted galacturonan referred to as RG-II, which accounts for between 2% and 5% of the primary cell wall, is the most structurally complex polysaccharide yet identified in nature.","['Rhamnogalacturonan-I (RG-I) is a family of polysaccharides with a backbone composed of a repeating disaccharide 4-α-D-GalpA-1-2-α-L-Rhap-1. Many of the GalpAs are acetylated at O-2 and/or O-3. Depending on the plant, between 20% and 80% of the Rhap residues may be substituted at O-4 with linear or branched side chains composed predominantly of Araf and Galp, together with smaller amounts of Fucp and GlcpA (Figure 24.2). Little is known about the functions of these side chains and their contribution to the properties of the primary wall. Substituted galacturonans have a backbone composed of 1-4-linked α-D-GalpA acid residues that are substituted to varying degrees with mono-, di-, or oligosaccharides. For example, xylogalacturonans contain single β-D-Xylp residues linked to O-3 of some of the backbone residues (Figure 24.2), whereas apiogalacturonans have β-D-apiose (Apif) and apiobiose linked to O-2 of some of the backbone residues. Apiogalacturonans have only been identified in the walls of duckweeds and seagrasses. The substituted galacturonan referred to as RG-II, which accounts for between 2% and 5% of the primary cell wall, is the most structurally complex polysaccharide yet identified in nature. It is composed of 12 different monosaccharides linked together by up to 21 distinct glycosidic linkages (Figure 24.2). Four structurally different side chains and one or two Araf substituents are attached to the galacturonan backbone. Two structurally conserved disaccharides (side chains C and D) are linked to O-3 of the backbone. The A and B side chains, which contain between 7 and 9 monosaccharides, are linked to O-2 of the backbone.'
 'Two structurally conserved disaccharides (side chains C and D) are linked to O-3 of the backbone. The A and B side chains, which contain between 7 and 9 monosaccharides, are linked to O-2 of the backbone. Several of the monosaccharides in RG-II are O-methylated and/or O-acetylated. Virtually all of the RG-II exists in the primary wall as a dimer cross-linked by a borate ester. The ester is formed between the Apif residue in side chain A of each RG-II monomer (Figure 24.2). The dimer forms rapidly in vitro when the RG-II monomer is reacted with boric acid and a divalent cation. However, the mechanism and site of dimer formation in planta has not been determined. Borate cross-linking of RG-II is likely to have substantial effects on the properties of pectin and the primary wall as RG-II is itself linked to homogalacturonan (Figure 24.2). Indeed, mutations that affect RG-II structure and cross-linking result in plants with abnormal walls and severe growth defects. Swollen primary walls and abnormal growth together with reduced RG-II cross-linking are also a characteristic of boron deficient plants. RG-II was believed to be largely resistant to fragmentation by microbial enzymes. However, recent studies have shown that bacteria present in the human gut produce glycanases capable of hydrolyzing all but one of the glycosidic bonds in RG-II. Pectin is believed to exist in the cell wall as a macromolecular complex comprised of structural domains—homogalacturonan, rhamnogalacturonan, and substituted galacturonan—that are covalently and noncovalently linked to one another. However, there is only a limited understanding of how these structural domains are organized (Figure 24.2).'
 'In the dimer, borate-ester cross-linking and Ca++ interchain pairing further stabilizes the two disks. The apparent resistance of RG-II to wall-modifying enzymes together with the formation of a cation-stabilized RG-II dimer likely results in a structure that resists temporal changes in the plant. In contrast, homogalacturonan is continually modified by the action of wall enzymes and its contribution to wall architecture is therefore time dependent. Increased knowledge of the physical properties of primary wall polysaccharides and proteoglycans is required to understand how modulating the amounts and structural features of a few common polysaccharides and glycan domains lead to primary walls with diverse properties and functionalities. Further research is also needed to determine if wall structure and function results from the noncovalent interactions of polysaccharides and proteoglycans or from the formation of glycan-containing architectural units with specific structural and functional roles. The latter scenario is analogous to the organization of proteoglycans and O-linked mucins in the extracellular matrix of animal cells (Chapters 10, 16, and 17). The secondary walls of woody tissue and grasses are composed predominantly of cellulose, hemicellulose, and the polyphenol lignin. The inclusion of lignin results in a hydrophobic composite that is a major contributor to the structural characteristics of secondary walls. Heteroxylans are the major hemicellulosic polysaccharide present in the secondary (lignified) cell walls of seed-producing plants. These heteroxylans are classified according to the type and abundance of the substituents on the 1-4-linked β-D-Xylp residues of the polysaccharide backbone. Glucuronoxylans, which are major components in the secondary walls of woody and herbaceous eudicots, have an α-D-GlcpA or MeGlcpA substituent at O-2 (Figure 24.1C).'
 'Callose, a polysaccharide composed of 1-3-linked β glucosyl residues, is another β-glucan produced by plants (Figure 24.1G). It is used to form a temporary cell wall at the cell plate during cytokinesis and is involved in regulating the permeability of plasmodesmata. It is often formed in response to abiotic and biotic stresses or damage. Pectins are structurally complex polysaccharides that contain 1-4-linked α-D-GalpA. Three structurally distinct pectins—homogalacturonan, substituted galacturonan, and rhamnogalacturonan—have been identified in plant cell walls (Figure 24.2). Homogalacturonan, which may account for up to 65% of the pectin in a primary wall, is composed of 1-4-linked α-D-GalpA. The carboxyl group may be methyl-esterified, thus neutralizing the negative charge of this glycosyl moiety, and the uronic acid itself may be acetylated at O-2 or O-3. The extent of methyl-esterification is controlled by pectin methylesterases and pectin methylesterase inhibitors present in the wall. The degree of methylesterification affects the ability of homogalacturonan-containing glycans to form ionic calcium cross-links with themselves and with other pectic polymers. Such interactions alter the mechanical properties of the wall and may influence plant growth and development. Rhamnogalacturonan-I (RG-I) is a family of polysaccharides with a backbone composed of a repeating disaccharide 4-α-D-GalpA-1-2-α-L-Rhap-1. Many of the GalpAs are acetylated at O-2 and/or O-3.'
 'However, there is only a limited understanding of how these structural domains are organized (Figure 24.2). Molecular modeling of a pectin (∼50 kDa) containing homogalacturonan (degree of polymerization ∼100) and rhamnogalacturonan with arabinogalactan side chains, together with modeling of RG-II conformation have begun to provide insights into the conformations and relative dimensions of each pectin structural domain. The homogalacturonan region has a persistence length of approximately 20 GalAp residues, which is likely to be sufficient to stabilize junction zones formed with Ca++. In vitro studies suggest that the maximum stability of such junction zones is obtained with oligomers containing approximately 15 nonesterified GalpA residues. Thus, controlling the distribution of methyl-ester groups along the homogalacturonan backbone provides a mechanism to regulate the physical properties of pectin, including its ability to form gels. For a gel to form and not to be brittle, other features including sequences that interrupt interchain associations in the pectin macromolecule may be important. For example, the structural diversity and the conformational flexibility of the oligosaccharide side chains of the rhamnogalacturonan domain will limit or prevent interchain pairing. The presence of 1-2-linked Rhap residues does not introduce kinks into the backbone geometry of rhamnogalacturonan and thereby limit interchain associations. Rather, it is the side chains linked to these residues that are responsible for preventing or limiting interchain associations. The conformations of the four side chains attached to the homogalacturonan backbone may lead RG-II to adopt a “disk-like” shape. Well-defined tertiary structures are predicted for the RG-II monomer and the dimer. In the dimer, borate-ester cross-linking and Ca++ interchain pairing further stabilizes the two disks. The apparent resistance of RG-II to wall-modifying enzymes together with the formation of a cation-stabilized RG-II dimer likely results in a structure that resists temporal changes in the plant.'
 'Glucuronoxylans, which are major components in the secondary walls of woody and herbaceous eudicots, have an α-D-GlcpA or MeGlcpA substituent at O-2 (Figure 24.1C). Gymnosperm secondary walls contain arabinoglucuronoxylans (AGXs), which in addition to MeGlcpA substituents, have Araf residues attached to O-3 of some of the backbone residues. The glucuronoarabinoxylans in the secondary walls of grasses typically contain fewer Araf residues than their primary wall counterpart (Figure 24.1D). Ferulic or coumaric acids are often esterified to the Araf residues of xylan in grass primary and secondary cells walls. There is some evidence that the lignin polymer is covalently linked to the secondary wall hemicelluloses. Eudicot and gymnosperm secondary wall xylans have a well-defined glycosyl sequence 1-4-β-D-Xylp-1-3-α-L-Rhap-1-2-α-D-GalpA-1-4-D-Xylp at their reducing end (Figure 24.1C). This sequence is required for normal xylan synthesis during secondary cell-wall formation and may have a role in regulating the polymers chain length. This sequence is present at the reducing end of heteroxylans of all monocots except the grasses. Genes that encode polysaccharide biosynthetic enzymes, including many of those required for xyloglucan, glucuronoxylan, arabinoxylan, and cellulose synthesis and some of those required for pectin synthesis, have been identified. This information, together with improved methods to demonstrate enzymatic activity of recombinant plant GTs in vitro and wall structural analyses of the corresponding plant mutants is providing a framework for an increased understanding of how plant cell wall polysaccharides are synthesized. Most pectins and hemicellulose are synthesized in the Golgi apparatus and then secreted into the apoplast via vesicles.'
 'In contrast, removing only selected sidechain substituents of xyloglucan is detrimental to plant growth and replacing the sidechains with various glycosyl moieties restores plant growth, independent of the glycosyl moiety added. These results have led to the suggestion that xyloglucan acts as a spacer molecule to keep cellulose microfibrils apart and that pectin has a more important role in controlling wall expansion than previously believed. Arabinoxylan (Figure 24.1D) is the predominant noncellulosic polysaccharide in the type II walls of the grasses, with only small amounts present in dicot primary walls. Its backbone is composed of 1-4-linked β-D-Xylp residues, many of which are substituted at O-3 with α-L-Araf residues. These Araf residues may be further substituted at O-2 with an α-L-Araf or a β-D-Xylp residue. A small number of the backbone residues are substituted at O-2 with α-D-GlcpA and its 4-O-methylated counterpart (MeGlcpA). The presence of 1-3, 1-4-linked β-glucans (also referred to as mixed-linkage glucans) (Figure 24.1F) in the walls of grasses was once considered to be a unique feature of these plants. However, structurally related mixed-linkage β-glucans have also been identified in the walls of Selaginella (lycopod) and Equisetum (horsetails), although the evolutionary relationship between these β-glucans is not known. In grasses, mixed linkage glucan is present mainly in young tissues, which has led to the suggestion that it is a carbohydrate storage molecule as also indicated by its metabolism during plant development. Callose, a polysaccharide composed of 1-3-linked β glucosyl residues, is another β-glucan produced by plants (Figure 24.1G). It is used to form a temporary cell wall at the cell plate during cytokinesis and is involved in regulating the permeability of plasmodesmata.']","Four structurally different side chains and one or two Araf substituents are attached to the galacturonan backbone. Two structurally conserved disaccharides (side chains C and D) are linked to O-3 of the backbone. The A and B side chains, which contain between 7 and 9 monosaccharides, are linked to O-2 of the backbone. Several of the monosaccharides in RG-II are O-methylated and/or O-acetylated. Virtually all of the RG-II exists in the primary wall as a dimer cross-linked by a borate ester. The ester is formed between the Apif residue in side chain A of each RG-II monomer. The dimer forms rapidly in vitro when the RG-II monomer is reacted with boric acid and a divalent cation. However, the mechanism and site of dimer formation in planta has not been determined. Borate cross-linking of RG-II is likely to have substantial effects on the properties of pectin and the primary wall as RG-II is itself linked to homogalacturonan.","It is composed of 12 different monosaccharides linked together by up to 21 distinct glycosidic linkages (Figure 24.2). Four structurally different side chains and one or two Araf substituents are attached to the galacturonan backbone. Two structurally conserved disaccharides (side chains C and D) are linked to O-3 of the backbone. The A and B side chains, which contain between 7 and 9 monosaccharides, are linked to O-2 of the backbone. Several of the monosaccharides in RG-II are O-methylated and/or O-acetylated. Virtually all of the RG-II exists in the primary wall as a dimer cross-linked by a borate ester. The ester is formed between the Apif residue in side chain A of each RG-II monomer (Figure 24.2). The dimer forms rapidly in vitro when the RG-II monomer is reacted with boric acid and a divalent cation. However, the mechanism and site of dimer formation in planta has not been determined. Borate cross-linking of RG-II is likely to have substantial effects on the properties of pectin and the primary wall as RG-II is itself linked to homogalacturonan (Figure 24.2).",1.0,0.0,0.9777976400963584,0.023809523809523808,0.9999999999857143,1.0
"Complete the following paragraph: In terms of glycosaminoglycans (GAGs), chondroitin and heparan sulfate (CS and HS) have been detected in C. elegans, but neither keratan sulfate (KS), dermatan sulfate (DS), nor hyaluronan (Chapter 16); whereas the CS chains contain a low amount of sulfate, the overall structure of HS in C. elegans is similar to the chains elaborated by vertebrates (see Figure 25.5).","['The poly-N-acetyllactosamine chains of KS I are generally longer than those of KS II and may contain up to 50 disaccharide units (20–25 kDa). The chains can be fucosylated and sialylated as well (Chapter 14). Vertebrate chondroitin sulfate consists of repeating sulfate-substituted GalNAcβ4GlcAβ3 disaccharides polymerized into long chains (Figure 17.2). In contrast, invertebrates such as C. elegans and D. melanogaster make either nonsulfated or low sulfated chains. The assembly process for the backbone appears to be highly conserved, based on the presence of homologous genes for all of the reactions (Chapters 25 and 26). As described above, the assembly process is initiated by the transfer of GalNAcβ3 to the linkage tetrasaccharide (Figure 17.4). In both vertebrates and invertebrates, the polymerization step is catalyzed by one or more bifunctional enzymes (chondroitin synthases) that have both β3 glucuronosyltransferase and β4 N-acetylgalactosaminyltransferase activities. Vertebrates also express homologs that can transfer individual sugars to the chain. Chondroitin polymerization also requires the action of the chondroitin polymerizing factor (CHPF), a protein that lacks independent activity but collaborates with the polymerases to enhance the formation of polymers. Sulfation of chondroitin in vertebrates is a complex process, with multiple sulfotransferases involved in 4-O-sulfation and 6-O-sulfation of N-acetylgalactosamine residues (Figure 17.5). Biosynthesis of chondroitin sulfate/dermatan sulfate involves the polymerization of N-acetylgalactosamine and glucuronic acid units and a series of modification reactions including O-sulfation and epimerization of glucuronic acid to iduronic acid.'
 'Notably, in humans and bovine, the large chondroitin sulfate proteoglycan found in cartilage (aggrecan) contains a segment of four to 23 hexapeptide repeats (E-E/L-P-F-P-S) where the keratan sulfate chains are located, whereas aggrecan in rats and other rodents lacks this motif and does not contain keratan sulfate. Keratan sulfates (KS) contain a sulfated poly-N-acetyllactosamine chain, linked to either asparagine or serine/threonine residues. Chst1 and 5 can add sulfate groups at the indicated positions. The actual order of the various sulfated and nonsulfated (more...) Two classes of glycosaminoglycan chains—chondroitin sulfate/dermatan sulfate and heparan sulfate/heparin—are linked to serine residues in proteins by way of xylose (Figure 17.4). Xylosyltransferase initiates the process using UDP-xylose as donor. Two isoforms of the enzyme are known in vertebrates (XYLT1 and XYLT2), but only one isozyme exists in C. elegans and D. melanogaster. A glycine residue invariably lies to the carboxy-terminal side of the serine attachment site, but a perfect consensus sequence for xylosylation does not exist. At least two acidic amino acid residues are usually present, and they can be located on one or both sides of the serine, usually within a few residues. Several proteoglycans contain clustered glycosaminoglycan attachment sites, raising the possibility that xylosyltransferase could act in a processive manner. Xylosylation is an incomplete process in some proteoglycans, which may explain why proteoglycans with multiple potential attachment sites contain different numbers of chains in different cells. The biosynthesis of chondroitin sulfate (left chain) and heparan sulfate (right chain) is initiated by the formation of a linkage region tetrasaccharide (green circles in Fig. 17.1).'
 'Chondroitin proteoglycans (CPGs) of Caenorhabditis elegans.  HS biosynthesis in C. elegans follows the same pattern observed in vertebrate systems (Chapter 17). Mutations in the pathway for HS biosynthesis are lethal in C. elegans. Two of the key genes involved in this pathway are rib-1 and rib-2, homologs of the vertebrate genes Ext2 and Ext1, respectively, which catalyze the polymerization of the backbone of HS chains (GlcAβ1-4GlcNAcα1-4) (Chapter 17). Mutants in rib-2, the worm homolog of Ext1, have defects in development and egg laying. The worm genome also contains a single gene for glucuronic acid C-5 epimerase (hse-5) and five genes for sulfotransferase activities (GlcNAc N-deacetylase/N-sulfotransferase [Ndst], hst-1; uronyl 2-O-sulfotransferase, hst-2; 3-O-sulfotransferases, hst-3.1 and hst-3.2; and 6-O-sulfotransferase, hst-6), all of which are homologs of vertebrate genes involved in HS synthesis. In contrast, vertebrates contain four Ndsts, three 6-O-sulfotransferases, and seven 3-O-sulfotransferases. Although mutations in the epimerase (hse-5) and the sulfotransferases (hst-6, hst-2) do not affect viability, they cause defects in specific cell migration, axonal outgrowth, and/or neurite branching. Consistent with this finding, inactivation of the cell surface HS proteoglycan syndecan (sdn-1) affects neural migration and axonal guidance. C. elegans also produces two GPI-anchored HS proteoglycans.'
 'These include “mucin-type” O-glycans, many of which are based on the core 1 O-glycan structure common to vertebrates (Chapter 10), but which can be extended by β-glucose, glucuronic acid, and α1-2 fucose residues (Figure 25.4). In terms of glycosaminoglycans (GAGs), chondroitin and heparan sulfate (CS and HS) have been detected in C. elegans, but neither keratan sulfate (KS), dermatan sulfate (DS), nor hyaluronan (Chapter 16); whereas the CS chains contain a low amount of sulfate, the overall structure of HS in C. elegans is similar to the chains elaborated by vertebrates (see Figure 25.5). Enzymatic and genomic data indicate that there are various domain-specific forms of glycosylation in C. elegans, including O-fucose (Fucα1-Ser/Thr) on epidermal growth factor (EGF)-like domains and thrombospondin type-1 repeats (TSRs), in the context of precise consensus sequences (Chapter 13), C-mannosylation of TSRs, and TMTC-dependent O-mannosylation of cadherins. However, POMT-mediated O-mannosylation of dystroglycan is absent. Cytoplasmic and nuclear proteins in C. elegans can be modified with O-GlcNAc as in other animals. Biosynthesis of core-1 O-glycans in Caenorhabditis elegans (A) and some O-glycans proposed to occur in adult worms (B).  Biosynthesis of chondroitin in Caenorhabditis elegans. Mutations in individual steps were identified as squashed vulva mutants, as described in the text.'
 'The most widely distributed and evolutionarily ancient class appears to be chondroitin chains, which are not always sulfated (e.g., in C. elegans) (Chapter 25). The more highly sulfated and epimerized forms of heparin and dermatan sulfate tend to be found primarily in more recently evolved animal species of the deuterostome lineage. The same is true of hyaluronan, a secreted free glycosaminoglycan synthesized at the cell membrane and likely evolved from its precursor chitin to facilitate the movement of metazoan cells and shaping of organs during development and normal physiology. Echinoderms such as the sea cucumber make typical chondroitin chains, but some glucuronic acids have branches containing fucose sulfate. Simpler multicellular animals such as sponges can have unusual glycosaminoglycans that include uronic acids but do not have the typical repeat units of chondroitin and heparan sulfate. Plants do not have typical animal glycosaminoglycans. Instead, they have secreted acidic pectin polysaccharides not attached to protein cores (only hyaluronan is unattached among animal glycosaminoglycans), characterized by galacturonic acid and its methyl ester derivative (Chapter 24). Bacteria have mostly completely distinct polysaccharides (Chapter 21), although certain pathogenic strains can mimic mammalian glycosaminoglycan chains (see below). The O-β-GlcNAc modification common on cytoplasmic, mitochondrial, and nuclear proteins (Chapter 19) is widely expressed in “higher” animals and in plants, and its occurrence on histone tails implicates this modification in epigenetic regulation mechanisms. The connections between nutrient state, UDP-GlcNAc levels, and O-GlcNAcylation mean that gene regulation has an important metabolic dimension. Conserved homologs of the responsible O-GlcNAc transferase have been found in many eukaryotic taxa and in a wide range of bacteria.'
 'Thus, GAGs are the most anionic molecules present in the animal kingdom. Commonly found GAGs include chondroitin sulfate, dermatan sulfate, heparan sulfate (HS), hyaluronic acid, and keratan sulfate. These GAGs structurally differ in their disaccharide RUs. For example, chondroitin sulfates consist of disaccharide RUs of [4GlcAβ1-3GalNAcβ1-]n, whereas HS consists of disaccharide RUs of [4GlcAβ1-4GlcNAcα1-]n or [4IdoAα1-4GlcNSα1-]n (Figure 3.3A). Structural diversity of these polymers is primarily a result of additional sulfation of hydroxyl groups and is discussed below for the diverse HS polymers found in mammals. GAGs found in other animals can be distinct from mammalian GAGs by virtue of further modifications. For example, marine invertebrates can carry particularly unique sulfation patterns (i.e., 3-O-sulfation on GlcA residues) and distinct side-chain modifications (i.e., fucosylation on chondroitin sulfate). Structures of (A) disaccharide repeating units of different glycosaminoglycans and (B) the conformations of monosaccharides from heparan sulfate.  GAGs show biological function primarily through their interactions with the hundreds of GAG-binding proteins found on cellular surfaces and in extracellular spaces. The structural factors that affect the strength and specificity of binding are key to the elicitation of a proper biological response. HS, the most studied member of the GAG family, provides a good illustration of the wide range of physiological and pathophysiological functions affected. HS, for example, is involved in trimolecular interactions with growth factors and growth factor receptors, and thereby participates in regulating embryonic development. HS interacts with proteases and protease inhibitors in the blood to control the coagulation process and binds to viral envelope proteins as a receptor for viral infections.'
 'Biosynthesis of chondroitin sulfate/dermatan sulfate involves the polymerization of N-acetylgalactosamine and glucuronic acid units and a series of modification reactions including O-sulfation and epimerization of glucuronic acid to iduronic acid. Heparan (more...) Additional enzymes exist for epimerization of D-glucuronic acid to L-iduronic acid in dermatan sulfate (DSE1-2), sulfation at the C-2 position of the uronic acids, and other patterns of sulfation found in unusual species of chondroitin (Table 17.2). The location of sulfate groups is easily assessed using bacterial chondroitinases (ABC, B, and ACII) that cleave the chains into disaccharides. Many chains are hybrid structures containing more than one type of chondroitin disaccharide unit. For example, dermatan sulfate is defined as having one or more iduronic acid–containing disaccharide units (chondroitin sulfate B) as well as glucuronic acid–containing disaccharides (chondroitin sulfate A and C). Animal cells also degrade chondroitin sulfate in lysosomes using a series of exolytic activities (Chapter 44). Types of chondroitin sulfates  Heparan sulfate assembles as a copolymer of GlcNAcα4GlcAβ4 (Figure 17.5), which then undergoes extensive modification reactions, catalyzed by at least four families of sulfotransferases and one epimerase. N-acetylglucosamine N-deacetylase/N-sulfotransferases (NDST1-4) act on a subset of N-acetylglucosamine residues to generate N-sulfated glucosamine (GlcNSO3) units, many of which occur in clusters along the chain.']","Chondroitin and heparan sulfate (CS and HS) have been detected in C. elegans, but neither keratan sulfate (KS), dermatan sulfate (DS), nor hyaluronan. The CS chains contain a low amount of sulfate, while the overall structure of HS in C. elegans is similar to the chains found in vertebrates.","Enzymatic and genomic data indicate that there are various domain-specific forms of glycosylation in C. elegans, including O-fucose (Fucα1-Ser/Thr) on epidermal growth factor (EGF)-like domains and thrombospondin type-1 repeats (TSRs), in the context of precise consensus sequences (Chapter 13), C-mannosylation of TSRs, and TMTC-dependent O-mannosylation of cadherins. However, POMT-mediated O-mannosylation of dystroglycan is absent. Cytoplasmic and nuclear proteins in C. elegans can be modified with O-GlcNAc as in other animals. Biosynthesis of core-1 O-glycans in Caenorhabditis elegans (A) and some O-glycans proposed to occur in adult worms (B).",1.0,0.7214660478053763,0.5554098188965155,0.013888888888888888,0.3595238095118254,0.75
"Complete the following paragraph: This chapter describes glycosylation in the Arthropoda, focusing primarily on Drosophila melanogaster. The major glycan classes are similar to those described in vertebrates, with interesting differences. The powerful genetic systems available for studying gene function in D. melanogaster have proved to be effective means for understanding glycan function in early development and have provided some of the first examples of how glycans affect growth factor signaling, morphogen gradients, protein secretion, and neural function in vivo.","['NCBI Bookshelf. A service of the National Library of Medicine, National Institutes of Health. Varki A, Cummings RD, Esko JD, et al., editors. Essentials of Glycobiology [Internet]. 4th edition. Cold Spring Harbor (NY): Cold Spring Harbor Laboratory Press; 2022.  doi: 10.1101/glycobiology.4e.26 Kelly G. Ten Hagen, Hiroshi Nakato, Michael Tiemeyer, and Jeffrey D. Esko. This chapter describes glycosylation in the Arthropoda, focusing primarily on Drosophila melanogaster. The major glycan classes are similar to those described in vertebrates, with interesting differences. The powerful genetic systems available for studying gene function in D. melanogaster have proved to be effective means for understanding glycan function in early development and have provided some of the first examples of how glycans affect growth factor signaling, morphogen gradients, protein secretion, and neural function in vivo. Arthropods are among the most successful species on Earth and are found in all types of environments. One of their characteristic features is an exoskeleton composed of chitin, which provides support and physical protection. The best-studied example is the fruit fly, D. melanogaster. In 1910, T.H. Morgan published the first paper about the genetics of D. melanogaster, which showed that white eye color was a sex-linked trait. Since then, this organism has been the predominant model organism for genetic analysis in animals. Its advantages include an easily studied developmental program, a sequenced and actively annotated genome, a relatively complex neural system, and the ability to discern literally thousands of different phenotypes in morphology, development, and behavior. In pursuit of genes that regulate development, many Drosophila geneticists ran head-on into glycans. New analytical techniques have expanded the appreciation for the glycan synthetic capacity of the organism and have helped establish links between interesting phenotypes and altered glycan expression. Some of these associations have proven to be common across species and others are unique to D. melanogaster.'
 'In pursuit of genes that regulate development, many Drosophila geneticists ran head-on into glycans. New analytical techniques have expanded the appreciation for the glycan synthetic capacity of the organism and have helped establish links between interesting phenotypes and altered glycan expression. Some of these associations have proven to be common across species and others are unique to D. melanogaster. Given the complexity of glycosylation in Drosophila, it is impossible to cover all aspects of glycans and glycan-binding proteins in this organism. Instead, we provide an overview of the major classes of arthropod glycans and examples of how studying glycans in Drosophila can lead to new discoveries that impact vertebrate as well as invertebrate biology. Although it was once thought that arthropod glycoproteins were exclusively of the high-mannose or paucimannose type (Chapter 9), annotation of the D. melanogaster genome predicted the existence of the enzymatic machinery needed to generate hybrid and complex glycans. Moreover, improved analytic techniques allowed the detection of very minor glycans. The commercial and experimental demand for eukaryotic expression systems led to the characterization of the glycosylation pathways of cells derived from the moth Spodoptera frugiperda (Sf9 cells) and from D. melanogaster (S2 cells). It is now clear that high-mannose and paucimannose glycans account for >90% of the total N-linked glycan diversity in Drosophila and other insects throughout their life cycles. However, hybrid and complex glycans, including sialylated, sulfated, glucuronylated, and zwitterionic structures, are also present, albeit as minor components (Figure 26.1). N-Linked glycan diversity in Drosophila and other insects. N-Linked glycan processing after endoplasmic reticulum (ER) mannosidase trimming to the Man5GlcNAc2 structure is shown.'
 'N-Linked glycan diversity in Drosophila and other insects. N-Linked glycan processing after endoplasmic reticulum (ER) mannosidase trimming to the Man5GlcNAc2 structure is shown. (Gray boxes) The predominant N-linked glycans, Man5GlcNAc2 and Man3GlcNAc (more...) Drosophila adds fucose (Fuc) in both α1-3 and α1-6–linkages to the reducing terminal N-acetylglucosamine, whereas vertebrates restrict this linkage to α1-6. Fucα1-3GlcNAc is immunogenic in humans and rabbits, resulting in the production of antibodies against the so-called horseradish peroxidase (HRP) epitope. Anti-HRP antibodies show that the Fucα1-3GlcNAc epitope is restricted primarily to neural tissue in a broad range of arthropods. Drosophila does not extend its core fucose residues with additional capping monosaccharides nor modify its N-linked glycans by O-methylation, both of which occur extensively in Caenorhabditis elegans (Chapter 25). The demonstration of fucosylated, sialylated, sulfated, hybrid, biantennary complex, and triantennary complex glycans in all stages of the D. melanogaster life cycle makes the diversity of the arthropod N-glycans generally comparable to that of mammals (Chapter 27), except for the very limited use of sialic acids (Sias). The relative paucity of complex N-linked glycans in Drosophila has been attributed at least partially to the presence of a hexosaminidase in the secretory pathway.'
 'Chitin, a polymer of (GlcNAcβ4)n, is one of the most abundant biopolymers on Earth, second only to cellulose (which is interestingly a (Glcβ4)n polymer synthesized in a similar manner by extrusion at the cell surface). Chitin is a major component of the rigid, cuticular exoskeleton of all Arthropoda, and therefore these animals expend considerable resources toward its assembly. Chitin fibrils also form a more subtle, protective layer at the apical surface of gut epithelial cells (the peritrophic membrane) and in the lumen of the forming tracheal system. Elegant genetic screens have shown that mutations in genes necessary for chitin polymerization, modification, and disassembly affect tracheal morphology (Table 26.1). The potential for chitin or for small chitin-based oligosaccharides to modulate cell signaling and morphogenesis remains unexplored in Drosophila. Insects were once classified as “animals without gangliosides” in reference to sialylated glycosphingolipids (GSLs) found broadly distributed in animal families other than the arthropods (Chapter 11). However, arthropods possess their own family of GSLs, designated as the arthroseries. Sialylated GSLs (gangliosides) have not been found in Drosophila, but the arthroseries glycolipids contain glucuronic acid rather than sialic acid, and like many of the ganglioside sialic acids, the glucuronic acid is linked to a terminal galactose residue (Figure 26.6). Glycosphingolipid glycan diversity. The arthroseries glycosphingolipids (GSLs) are built by extension from a mactosylceramide core (Manβ1-4Glcβ-ceramide).'
 'It remains to be determined whether arthroseries glycans elongated beyond the tetraosylceramide possess structural information that imparts specific function. Annotation of the Drosophila genome indicates the presence of representatives for each of the known classes of animal lectins (Chapter 28). Intracellular carbohydrate-binding proteins, which in vertebrates are associated with protein folding and quality control in the ER or with trafficking through the early compartments of the secretory pathway (calnexin, calreticulin, VIP, ERGIC-53), are also found in Drosophila (Chapter 39). Further downstream, lysosomal targeting is mediated by LERP, a sorting protein functionally similar to the vertebrate mannose-6-phosphate receptor (Chapter 33). Although LERP possesses domain architecture and sequence similarity to the P-type lectin sequences of the mannose-6-phosphate receptor, its binding does not appear to be glycan-dependent, suggesting evolutionary divergence in the mechanisms that control the biogenesis of lysosomes. The binding specificities and functions of insect family members of the Galectin (Chapter 36), C-type (Chapter 34), and I-type lectin families (Chapter 35) are not well-characterized. For example, the protein encoded by the furrowed gene, a putative C-type lectin with significant homology with vertebrate selectins, has been implicated in planar cell polarity dynamics during eye development, but this activity is independent of its carbohydrate recognition domain (CRD). Current classification schemes for animal lectins reflect the long history of studying glycan-binding proteins in vertebrates (Chapter 28). However, a handful of lectin activities, first identified in Drosophila, challenge the comprehensiveness of current animal lectin designations. One of these was identified in a search for secreted proteins that stimulate the proliferation and motility of imaginal disc cells. The imaginal disc growth factor (IDGF) family members are structurally related to chitinases but lack amino acid residues essential for catalytic activity.'
 'In Drosophila tissues, peanut agglutinin lectin and mucin-specific antibodies reveal developmentally regulated and spatially restricted expression of Galβ1-3GalNAcα-O-protein moieties. O-Linked glycan diversity in Drosophila and other insects. Genetic and biochemical analysis of Drosophila mutants were instrumental in defining developmental roles for domain-specific, simple mono-, di- or trisaccharide modifications on serine/threonine (more...) Drosophila possesses a family of 10 polypeptide N-acetylglucosaminyltransferases (ppGalNAcT/PGANTs encoded by pgant genes; Chapter 10). Systematic mutational and RNAi-mediated knockdown analysis of individual pgant genes showed that pgant4, 5, 7, and 35A are essential for viability. Loss of pgant3 impacts extracellular matrix secretion and integrin-mediated cell adhesion during development, and pgant4 modulates proteolytic cleavage of substrates essential for secretory granule formation. Loss of pgant4 also results in loss of the secreted peritrophic membrane of the digestive tract, leading to disruption of the progenitor cell niche. pgant9 affects glycosylation of certain mucins and the morphology of secretory granules. Thus, mucin-type O-glycosylation in Drosophila regulates essential developmental programs and modulates trafficking through the secretory pathway, providing blueprints for studying similar functions in vertebrate systems. Once initiated by ppGalNAcT/PGANT enzymes, the extension of mucin type glycans in Drosophila results in the production of three different core structures. Core 1 structures predominate, but core 2 glycans are also present, as well as an incompletely defined HexNAc-HexNAc core. A family of core 1 galactosyltransferases (C1GalTs) exists in Drosophila and the loss of certain members disrupts the nervous system and neuromuscular junctions (NMJ).'
 'Other arthropod species add galactose to mactosylceramide or to the arthroseries tetraosylceramide with subsequent capping and EthNP modification (Figure 26.6). The expanding diversity of alternative core extensions detected in arthropods provides a larger pool of structural variants from which these organisms can tailor GSL expression for specific developmental or tissue-restricted functions, similar to core switching in vertebrate species (Chapter 11). Mutations that affect the first steps in Drosophila GSL synthesis were originally identified as modulators of cell fate. Biochemical analysis showed that genes called egghead (egh) and brainiac (brn), respectively, encode the mannosyltransferase and N-acetylglucosaminyltransferase that add the second and third monosaccharide residues (Figure 26.6). Phenotypes associated with loss of maternal and zygotic egh and brn include overproliferation of neural cells at the expense of epithelial lineages. These egh/brn phenotypes closely resemble the embryonic phenotype of mutations in the Notch gene (Figure 26.4). An additional phenotype of egh mutants is the formation of enlarged peripheral nerves due to glial cell overproliferation with immune cell infiltration, reminiscent of the human disorder neurofibromatosis type 1. As in this human disorder, overgrowth results from enhanced phosphatidylinositol-3-kinase activity, likely because of reduced Ras signaling. The neurofibromatosis-like phenotypes indicate the importance of the membrane glycolipid environment for propagating appropriate transmembrane signals. Mutations affecting the two partially redundant N-acetylgalactosaminyltransferases that generate the tetraosylceramide of the arthroseries result in subtle behavioral phenotypes in larvae and altered EGF receptor signaling in ovarian follicle cells, but otherwise produce viable, fertile adults. It remains to be determined whether arthroseries glycans elongated beyond the tetraosylceramide possess structural information that imparts specific function.']","The chapter provides insights into glycosylation in Arthropoda, particularly Drosophila melanogaster, highlighting similarities to vertebrates in major glycan classes but with notable distinctions. The genetic tools in D. melanogaster have been instrumental in unraveling the role of glycans in early development, showcasing their impact on growth factor signaling, morphogen gradients, protein secretion, and neural function in vivo.","Arthropods are among the most successful species on Earth and are found in all types of environments. One of their characteristic features is an exoskeleton composed of chitin, which provides support and physical protection. The best-studied example is the fruit fly, D. melanogaster. In 1910, T.H. Morgan published the first paper about the genetics of D. melanogaster, which showed that white eye color was a sex-linked trait. Since then, this organism has been the predominant model organism for genetic analysis in animals. Its advantages include an easily studied developmental program, a sequenced and actively annotated genome, a relatively complex neural system, and the ability to discern literally thousands of different phenotypes in morphology, development, and behavior. In pursuit of genes that regulate development, many Drosophila geneticists ran head-on into glycans.",1.0,0.8107973253983738,0.6898521067866599,0.011904761904761904,0.8734126983981415,1.0
"Complete the following paragraph: When sea urchin sperm undergo the acrosome reaction, a protein named bindin is released from the acrosomal vesicle. Bindin cements the sperm to a large egg surface glycoprotein named egg bindin receptor 1 (EBR1). Bindin can agglutinate mammalian red blood cells much like plant lectins (Chapter 32), and glycopeptide fragments of unfertilized eggs can block bindin-induced red cell agglutination.","[""(Reprinted, with permission, courtesy of Charles Hollahan, Santa Barbara Marine Biologicals.) (Top right) Sperm binding to a sea urchin egg. (Reprinted, with permission, courtesy of M. Tegner (more...) Sea urchin eggs are covered by a hydrated jelly coat. About 80% of the weight of egg jelly is a high-molecular-weight linear fucose (Fuc) sulfate polymer (FSP) with a molecular mass of >106 Da. Receptor proteins on sperm bind to FSP, triggering the opening of two pharmacologically distinct calcium channels that induce the exocytosis of the sperm's acrosome vesicle (the “acrosome reaction”). The ionic mechanisms that trigger the acrosome reaction are conserved in mammals, but the nature of the sperm surface receptors varies. FSP is a species-selective inducer of the sea urchin sperm acrosomal reaction and most FSPs are sulfated α1-3Fuc-based linear polymers made of tri- or tetrasaccharide repeats. The number of fucoses per repeat, the linkage, and sulfation patterns all help ensure species selectivity for induction of the acrosome reaction. About 20% of the egg jelly mass is a large glycoprotein containing a unique polymer of sialic acid (Sia), which can be released from crude sea urchin egg jelly by treatment with mild base (β-elimination). The sialoglycan has a novel structure—[Neu5Gcα2-5-O-glycolylNeu5Gc]n. However, its receptor on the sperm membrane is unknown. When sea urchin sperm undergo the acrosome reaction, a protein named bindin is released from the acrosomal vesicle. Bindin cements the sperm to a large egg surface glycoprotein named egg bindin receptor 1 (EBR1). Bindin can agglutinate mammalian red blood cells much like plant lectins (Chapter 32), and glycopeptide fragments of unfertilized eggs can block bindin-induced red cell agglutination.""
 'Bindin cements the sperm to a large egg surface glycoprotein named egg bindin receptor 1 (EBR1). Bindin can agglutinate mammalian red blood cells much like plant lectins (Chapter 32), and glycopeptide fragments of unfertilized eggs can block bindin-induced red cell agglutination. Bindin is thought to recognize glycans on EBR1. EBR1 itself has lectin-like domains, but its glycan ligands are unknown. Most studies of glycosylation in sea urchins have identified glycosyltransferase activities and the glycans they synthesize (e.g., including N-glycans with antennal β1-3-linked Gal, β1-4GalNAc, Neu5Gc, and sulphate residues as well as traces of the “invertebrate” feature of core α1-3/α1-6-difucosylation) (Figure 27.2). The functions of glycans and glycan-binding proteins (GBPs) can be investigated using genetic strategies in sea urchins, antisense morpholinos or short hairpin RNAs (shRNAs) to knock down gene expression have been the methods of choice, but these will likely be superseded by more precise gene editing techniques such as the clustered regularly interspaced short palindromic repeats/Cas9 (CRISPR/Cas9) strategy or transcription activator–like effector (TALE) nucleases (TALENs). A few echinoderm genomes have been sequenced (Echinobase), but as with most organisms, relating glycosylation activities to genes is not straightforward (Chapter 8). N-glycan diversity in deuterostomes. Example N-glycan antennae from a brittle star and a sea cucumber (both echinoderms), zebrafish, the African clawed frog, and the mouse are shown as well as those shared between mouse and humans. ±S signifies (more...) The African clawed frog, Xenopus laevis, is a well-established model organism for studying fertilization and embryonic development (Figure 27.1).'
 '±S signifies (more...) The African clawed frog, Xenopus laevis, is a well-established model organism for studying fertilization and embryonic development (Figure 27.1). Adults are easy to maintain and can be induced to lay eggs up to three times a year by injection of human chorionic gonadotropin. The very large eggs allow easy microinjection experiments to express exogenous cDNAs encoding RNAs and proteins of interest. Although frog embryos develop quickly, the generation time for adults is long (1–2 yr), and the frog genome is tetraploid, making genetic studies difficult. Nevertheless, as for sea urchins, inhibition of gene expression has been accomplished by injection of antisense morpholinos or shRNAs into early embryos. These techniques suffer from off-target effects and the future will see a shift to newer gene editing strategies including CRISPR/Cas9 and TALENs. In addition, in situ hybridization and overexpression techniques have been used in Xenopus embryos. For example, the functions of two polypeptide N-acetylgalactosaminyltransferases in transforming growth factor-β/bone morphogenic protein signaling were distinguished, showing that this organism is useful for discovering glycan biosynthetic steps and mechanisms by which glycans regulate development. Indeed, developmental changes in the X. laevis N-glycome (Figure 27.2) have been reported, whereas the O-glycans of frog egg mucins can be extremely complicated in a species-dependent manner. X. laevis oocyte cortical granules contain a lectin called XL35, which is released at fertilization and binds to glycoproteins expressing mucin-type O-glycans (Galα1-3GalNAc) in the jelly surrounding the egg. XL35 is an oligomer made up of monomers, each of which has a molecular weight of 35 kDa. Light scattering experiments showed that the oligomer exists primarily as a 12-mer, allowing it to cross-link its glycoprotein ligands in the egg jelly to form a relatively rigid layer on the fertilization envelope.'
 'In protostomes, unlike deuterostomes, cell division during early development occurs in a highly organized manner and cell fate is precisely determined. Examples of well-studied protostome model organisms include the nematode Caenorhabditis elegans (Chapter 25) and the arthropod Drosophila melanogaster (Chapter 26). Deuterostomes have been extensively studied because of their relatedness to humans and because they provide excellent model systems for understanding vertebrate biology. Sea urchins, frogs, zebrafish, and mice have received the most attention and each provides certain advantages for studying functions of glycans in reproduction, early development, or adult physiology. In numerous instances, these models have revealed aspects of glycobiology that were later confirmed in more evolutionarily distant organisms, and they often serve as excellent models for understanding human disease. Challenges exist, however, in describing the glycomes of the more ancient deuterostomes, mainly because of poor genome annotation, ignorance of individual glycosyltransferase substrates, and the presence of glycans with unusual structures. Each of these models is briefly described below with references to other sections of the book for additional details. Sea urchin glycans involved in fertilization have been studied extensively. In fact, much of what we know about the biochemistry of fertilization was first discovered in this organism (Figure 27.1), and the information subsequently applied to mammalian sperm–egg interactions. One of the advantages of studying fertilization in sea urchins is that eggs and sperm are easy to obtain in large quantities. Because fertilization occurs outside the adult body, it is also easy to experimentally manipulate sperm and eggs. (Top left) The purple sea urchin Strongylocentrotus purpuratus. (Reprinted, with permission, courtesy of Charles Hollahan, Santa Barbara Marine Biologicals.) (Top right) Sperm binding to a sea urchin egg. (Reprinted, with permission, courtesy of M. Tegner (more...) Sea urchin eggs are covered by a hydrated jelly coat.'
 'An impressive example of the requirement for a hyaluronan-based matrix occurs during the process of cumulus oophorus expansion in the mammalian preovulatory follicle. At the beginning of this process, the oocyte is surrounded by about 1000 cumulus cells tightly compacted and in gap-junction contact with the oocyte. In response to hormonal stimuli, the cumulus cells up-regulate HAS2 and tumor necrosis factor (TNF)-α-stimulated gene 6 (TSG-6; see the next section). The expression of these proteins initiates production of hyaluronan and its organization into an expanding matrix around the cumulus cells. Concurrently, the follicle becomes permeable to serum, which introduces an unusual molecule called inter-α-trypsin inhibitor (ITI), composed of the trypsin inhibitor bikunin and two heavy chains all covalently bound to a chondroitin sulfate chain. TSG-6 catalyzes the transfer of heavy chains that are covalently linked to chondroitin sulfate onto the newly synthesized hyaluronan. In the absence of either TSG-6 or ITI, the matrix does not form, and the phenotype of mice null for either of these molecules is female infertility. At the time of ovulation, hyaluronan synthesis ceases, and ovulation of the expanded cumulus cell–oocyte complex occurs. Before fertilization, individual sperm undergo capacitation enabling them to penetrate and fertilize an ovum. During this process, SPAM1, a GPI-anchored hyaluronidase, redistributes and accumulates in the sperm head. SPAM1 binds hyaluronan in the cumulus, causing an increase in Ca++ flux and sperm motility. It also helps dissolve the cumulus matrix as the sperm moves through the hyaluronan vestment. A soluble form of SPAM1 is secreted during the acrosome reaction. The release of acrosomal hyaluronidase and proteases renders the sperm capable of fusing with the egg and eventually destroys the entire matrix to allow the fertilized oocyte to implant and develop.'
 'XL35 is an oligomer made up of monomers, each of which has a molecular weight of 35 kDa. Light scattering experiments showed that the oligomer exists primarily as a 12-mer, allowing it to cross-link its glycoprotein ligands in the egg jelly to form a relatively rigid layer on the fertilization envelope. This molecular complex functions to block polyspermy and also serves as a barrier against microbial infection. Homologs of XL35, known as “X-lectins,” exist in some of the most primitive deuterostomes, such as the sea squirt, but also in more complex vertebrates such as zebrafish, mice, and humans. Mice and humans have two orthologs termed intelectins-1 and -2 (Chapter 30) because of their initial discovery in the intestines. It is interesting to note that the sea squirt homolog (Halocynthia roretzi) shows a similar monomeric molecular weight to human intelectin 1 (Hint-1) and is 34% identical at the amino acid level. Hint-1 exists as a trimer when secreted from goblet cells in intestinal and respiratory epithelia. IL-13, a cytokine involved in the type TII innate immune response, induces a remarkable increase in Hint-1 transcripts. Constitutively expressed transcripts for Hint-1 are also found in heart and lung tissue. Hint-2, in contrast, is only expressed in Paneth cells that function in immune surveillance in the crypts of the small intestine. Glycan microarray results show that both Hints bind to the glycans of a unique set of human pathogenic bacteria that have in common the presence of particular cis-diols on their outer surface polysaccharides and include both Gram-positive and Gram-negative bacteria. Crystal structures of Hint-1 and the Xenopus embryonic epidermal lectin show a conserved mechanism of glycan recognition. But clearly, the carbohydrate binding determinants for each intelectin studied are unique. It is becoming clear that the X-lectin family plays key roles in deuterostome innate immune responses against pathogens.'
 'A soluble form of SPAM1 is secreted during the acrosome reaction. The release of acrosomal hyaluronidase and proteases renders the sperm capable of fusing with the egg and eventually destroys the entire matrix to allow the fertilized oocyte to implant and develop. There are several hyaluronan-binding proteins with homologous link modules (Figure 16.3). The four homologous link proteins belong to a subfamily called the “hyaluronan and proteoglycan link proteins” (HAPLNs); these are expressed in many tissues. Four cell-surface receptors have extracellular domains with one link module: CD44, LYVE-1 (lymphatic vessel endothelial hyaluronan receptor), HARE/Stabilin-2 (hepatic hyaluronan clearance receptor), and Stabilin-1, which are expressed on discontinuous endothelial cells and some activated macrophages. Of these, all functionally bind hyaluronan through the link module except Stabilin-1. Other hyaluronan-binding proteins are secreted and include the chondroitin sulfate proteoglycans that comprise the aggrecan superfamily and TSG-6, which has one link module. The three-dimensional structure of the link module fold in TSG-6 has been determined by nuclear magnetic resonance and defines a consensus fold of the two α-helices and two triple-stranded antiparallel β-sheets (Figure 16.5). The fold consists of about 100 amino acids and contains four cysteines disulfide-bonded in the pattern Cys1-Cys4 and Cys2-Cys3. This fold has only been found in vertebrates, consistent with the fact that hyaluronan is a relatively recent evolutionary invention. The link module fold is related to that found in the C-type lectins, but it lacks the Ca++ binding motif (Chapter 34).']","When sea urchin sperm undergo the acrosome reaction, a protein named bindin is released from the acrosomal vesicle. Bindin cements the sperm to a large egg surface glycoprotein named egg bindin receptor 1 (EBR1). Bindin can agglutinate mammalian red blood cells much like plant lectins, and glycopeptide fragments of unfertilized eggs can block bindin-induced red cell agglutination. Bindin is thought to recognize glycans on EBR1. EBR1 itself has lectin-like domains, but its glycan ligands are unknown.","Bindin is thought to recognize glycans on EBR1. EBR1 itself has lectin-like domains, but its glycan ligands are unknown. Most studies of glycosylation in sea urchins have identified glycosyltransferase activities and the glycans they synthesize (e.g., including N-glycans with antennal β1-3-linked Gal, β1-4GalNAc, Neu5Gc, and sulphate residues as well as traces of the “invertebrate” feature of core α1-3/α1-6-difucosylation) (Figure 27.2). The functions of glycans and glycan-binding proteins (GBPs) can be investigated using genetic strategies in sea urchins, antisense morpholinos or short hairpin RNAs (shRNAs) to knock down gene expression have been the methods of choice, but these will likely be superseded by more precise gene editing techniques such as the clustered regularly interspaced short palindromic repeats/Cas9 (CRISPR/Cas9) strategy or transcription activator–like effector (TALE) nucleases (TALENs).",0.8888888888888888,0.6729788387575726,0.664504840126374,0.01098901098901099,0.8261904761739525,1.0
"Complete the following paragraph: A wide variety of methods for coupling monosaccharides and complex glycans to create affinity resins have been developed. As mentioned above, many sulfated-GAG-binding proteins have been discovered by affinity chromatography using immobilized GAG chains.","['However, it does not bind all glycoproteins because it recognizes specific N-glycan structures. ConA-Sepharose has also been used to isolate free oligo- and polymannose-, hybrid-, and complex-type biantennary N-glycans. When combined in a serial format, multiple lectins can be used in affinity chromatography to isolate glycoconjugates containing most of the major glycan structures present in animal cells, with glycoconjugates being separated as classes that share common determinants. An example of serial lectin affinity chromatography is shown in Figure 48.8. Identification of glycoproteins through analysis of released glycopeptides gives important information on proteins carrying specific modifications. Release of glycans coupled with ion-exchange chromatography and high-performance liquid chromatography (HPLC) can yield highly pure glycans with predicted structures that can then be confirmed by mass spectrometry of native and permethylated derivatives (Chapters 50 and 51). An example of the use of different immobilized plant lectins in serial lectin affinity chromatography of complex mixtures of glycopeptides. In this example, a mixture of glycopeptides is applied to a column of immobilized concanavalin A (ConA), and the (more...) Mixed-bed lectin chromatography using a combination of different immobilized lectins is useful for simultaneously separating all types of glycoconjugates from nonglycosylated material (e.g., glycopeptides from peptides). Combinations of affinity chromatography and other chromatographic techniques can be very useful in identifying and separating glycopeptides. Thus, the ability of glycans to be recognized by lectins dependent on specific structural features in the glycans is a powerful tool for glycan identification and isolation. In some approaches, the glycans are tagged at the reducing end by fluorophores and radioisotopes or may be obtained by metabolic radiolabeling from cells or tissues grown in the presence of radiolabeled sugar precursors, such as [2-3H]mannose or [6-3H]glucosamine.'
 'For example, one can measure binding to cells with altered GAG composition (Chapter 49) or after treatment with specific lyases to remove GAG chains from the cell surface (Chapter 17) and then determine whether the same response occurs as observed in the presence of GAG chains. The interaction can then be studied more intensively using the in vitro assays described above. Methods to measure glycosaminoglycan (GAG)–protein interaction  As mentioned above, most GAG-binding proteins interact with HS and/or heparin. The likely basis for this preference is greater sequence heterogeneity and more extensive and variable sulfation compared with other GAGs. The unusual conformational flexibility of iduronic acid, which is found in heparin, HS, and DS, also has a role in their ability to bind proteins. GAGs are linear helical structures, consisting of alternating residues of N-acetylglucosamine (GlcNAc) or N-acetylgalactosamine (GalNAc) with glucuronic acid (GlcA) or IdoA (with the exception of KS, which consists of alternating N-acetylglucosamine and galactose residues; Chapter 17). Inspection of heparin oligosaccharides containing highly modified domains ([GlcNS6S-IdoA2S]n) shows that the N-sulfo and 2-O-sulfo groups of each disaccharide repeat lie on opposite sides of the helix from the 6-O-sulfo and carboxyl groups (Figure 38.1). Analysis of the conformation of individual sugars shows that N-acetylglucosamine and glucuronic acid residues assume a preferred conformation in solution, designated 4C1 (indicating that carbon 4 is above the plane defined by carbons 2, 3, and 5 and the ring oxygen, and that carbon 1 is below the plane; Chapter 2).'
 'In some approaches, the glycans are tagged at the reducing end by fluorophores and radioisotopes or may be obtained by metabolic radiolabeling from cells or tissues grown in the presence of radiolabeled sugar precursors, such as [2-3H]mannose or [6-3H]glucosamine. Glycan fractionation shown on immobilized lectins in Figure 48.8 is currently not possible with antibodies because no antibodies are known that can distinguish such core structural features in glycans. When intact glycoproteins or complex polysaccharides (e.g., those found in plant cell walls [Chapter 24]) are analyzed for their interactions with plant lectins or antibodies, the interpretation of data may be complicated by the multivalency of the glycoprotein/polysaccharide and the density of the immobilized lectin/antibody. For example, glycoproteins containing multiple high-mannose-type N-glycans bind so tightly to immobilized ConA that it is difficult to elute the bound glycoprotein, even with extremely high concentrations of hapten and under harsh conditions. Lower densities of ConA conjugation reduce its avidity for the glycoproteins and promote hapten dissociation of bound ligands with lower concentrations of sugars. When used in combination, multiple lectins, such as ConA, AAL (Aleuria aurantia lectin), LCA, and RCA (Ricinus communis agglutinin), can be used to isolate most glycoproteins containing N-and O-glycans from animal cells. This is a potentially powerful approach for glycoproteomics, or the identification of glycoproteins and their glycosylation status. Another approach to enhance glycoproteomic analyses is to use multiple lectins in mixed-bed or multi-lectin affinity chromatography (M-LAC). In such an approach a number of different lectins are used that recognize different glycan features, such as those shown in earlier figures in this chapter.'
 'The amount of complex formed is easily determined by the known specific activity of the ligand. Because the amount of complex formed is directly proportional to the amount of protein (or ligand) applied, it is easy to calculate a binding curve from several different Hummel–Dreyer column profiles at different concentrations of either protein or ligand. This binding curve allows the calculation of the equilibrium constant of the interaction. The advantages and drawbacks of this technique are generally the same as for equilibrium dialysis, except that Hummel–Dreyer analyses are often quicker to perform and can be used with ligands of many different sizes. Such an approach has been invaluable in defining the equilibrium binding of selectins to their ligands. Affinity chromatography is a technique typically used to identify interacting partners, but under some variations can be used to measure both affinity and specificity. In this affinity chromatography, a GBP is immobilized to an affinity support, such as Affi-Gel, CNBr-activated Sepharose, Ultralink, or some other activated support. If a glycan or a glycosylated macromolecule binds tightly to an immobilized GBP, a buffer containing a known glycan ligand may be added to force dissociation of the complex. For example, oligomannose-type and hybrid-type N-glycans will bind avidly to an agarose column containing the plant lectin concanavalin A (ConA-agarose) and 10–100 mm α-methyl mannoside is required to elute the bound material efficiently. In contrast, many highly branched complex-type N-glycans will not bind. Biantennary complex-type N-glycans bind to ConA-agarose, but they do not bind as tightly as high-mannose-type N-glycans and their elution can be achieved using 10 mm α-methyl glucoside. In this manner, one can assess the binding specificity of a GBP. In practice, this approach is rather crude, and although it gives valuable practical information about the capacity of an immobilized lectin to bind specific glycans, it does not provide quantitative affinity measurements.'
 'The bound lectins/antibodies are visualized by binding streptavidin-alkaline phosphatase and conversion of luminescent substrates. In these approaches, the concentrations of lectins and antibodies used must be low enough both to reduce false-positive, nonspecific binding and to allow for inhibition by appropriate haptens to confirm sugar binding. Removal of N-glycans by PNGaseF, or of sialic acid by neuraminidase, can eliminate binding to specific lectins and antibodies in western blotting, thus indicating the lectin/antibody-bound determinant. Mention should also be made about the approaches to isolate novel lectins from natural sources, or even when made recombinantly or in the form of some type of GRP. Historically, such isolation methods have used affinity chromatography. For example, a high density of lactose linked to agarose in the form of an affinity column can be used to isolate galectins, which can be eluted with lactose as a hapten. The cation-dependent mannose 6-phosphate receptor (CD-MPR) was isolated by affinity chromatography on immobilized yeast mannans containing phosphorylated mannose. There are also other forms of isolation, including salt precipitation, ion exchange chromatography, gel filtration, and the capture of a tagged and recombinant chimeric-lectin by capture of the tag (e.g., His tag). A recent method exploits a “capture and release” approach, in which multivalent ligands recognized by a lectin are assembled, whereby they can capture the lectin of interest, and then filtration or centrifugation may be used to isolate the lectin complexed with ligand. The lectin can then be dissociated and is available for study. Any of these type of methods are also useful when combined with proteomic analyses in identifying novel lectins and protein complexes that bind to glycans.'
 'Commercially available kits allow detection of 5–10 ng of glycoprotein, using the periodate reaction with subsequent amplification by means of biotin-hydrazide/streptavidin-alkaline phosphatase or fluorescence-based detection. Lectin overlay of a blot of a sodium dodecyl sulfate polyacrylamide gel electrophoresis (SDS-PAGE) gel can detect the presence of specific glycans with comparable sensitivity and greater specificity. For example, the agglutinin from Sambucus nigra (SNA) binds to glycans that terminate with α2-6 sialic acid (Sia). Lectins (Chapters 31–36) recognizing terminal fucose (Fuc), galactose (Gal), N-acetylgalactosamine (GalNAc), and N-acetylglucosamine (GlcNAc) are also commercially available. Metabolic labeling of glycoconjugates with radioactive sugars is another powerful tool for determining the composition of glycans. Cells incubated in media containing 3H- or 14C-labeled monosaccharides will incorporate the label into the glycans of glycoconjugates. Radiolabeled glycans can be detected following gel electrophoresis (SDS-PAGE) or thin-layer chromatography (TLC) by autoradiography or fluorography. They can also be released and studied in detail by various methods. The use of fluorescent probes and labels has enabled a reduction in the use of radioisotopes in applications in which the detection and quantitative determination of glycans, as opposed to glycosylation pathway information, is the primary objective. Fluorescent labels for sensitive detection of glycans after liquid chromatography (LC) include readily available 2-amino benzoic acid (2-AA) and 2-aminobenzamide (2-AB), which may be attached by reductive amination to the reducing sugar exposed on release of glycans from an aglycone. Metabolic labeling can also be performed with synthetic monosaccharides that are modified with chemically reactive groups.'
 'Partial degradation (e.g., by loss of O-acetylation) of the glycan may also occur. Glycosidases used for structural analysis. (Left) A biantennary N-glycan is shown with exoglycosidases that remove each monosaccharide sequentially. Exoglycosidases act only on terminal sugars. Also shown are endoglycosidases that digest in the core region (more...) Table of enzymes for glycan analysis  Proteoglycans (Chapter 17) may be separated by agarose gel electrophoresis and by ion-exchange chromatography, which separates on the basis of charge conferred by sulfate groups. Treatment of proteoglycans with GAG lyases (Table 50.1) will produce a shift in mobility on a gel, condensing the proteoglycan smear into discrete bands. After removal of much of the glycan portion, antibodies that recognize the remaining “stub” glycans may be used in western analysis. Typically, the analysis of glycolipid glycans by NMR or MS is preceded by their chromatographic purification. Mixtures of glycolipids can be fractionated by TLC and TLC plates stained with glycan-reactive reagents, allowing detection of many individual glycolipids. Using different reagents, it is possible to recognize gangliosides (e.g., resorcinol-HCl detects Sia) or neutral monosaccharides (e.g., orcinol-sulfuric acid detects all monosaccharides) in TLC bands. Reagents are also available for detection of sulfate and phosphate groups on glycolipids. Some pre-purification of the crude extract is usually required (e.g., Folch partitioning and ion-exchange chromatography). These procedures separate nonpolar or nonionic lipids from polar lipids (e.g., glycosphingolipids; Chapter 11) and those that contain charged groups (i.e., gangliosides, phospholipids, and sulfatides).']","A wide variety of methods for coupling monosaccharides and complex glycans to create affinity resins have been developed. As mentioned above, many sulfated-GAG-binding proteins have been discovered by affinity chromatography using immobilized GAG chains. These methods allow for the isolation and study of proteins that interact specifically with glycosaminoglycans, shedding light on the diverse interactions and functions of GAG-binding proteins in biological systems.",A limitation of these approaches is that binding activity does not directly indicate a biological function and the roles of many well-characterized GBPs have not been fully determined. The observation that many lectins fall into structurally distinct families provides an alternative way to identify novel GBPs through analysis of protein sequences. Sequence motifs characteristic of CRDs are routinely used to screen sequences from whole genome sequencing. These motifs can also be used to screen specific cDNA and gene sequences of interest because of their association with biological functions.,0.0,0.8343361820102561,0.5489929904443946,0.012987012987012988,0.32499999998375,0.0
"Complete the following paragraph: Another variation is generally termed a “pull-down assay,” akin to a type of immunoprecipitation. In this approach a solution containing potential ligands is incubated with a GBP that may be immobilized on a surface (e.g., a bead). Afterward the bead-GBP is subjected to several steps (e.g., magnetic separation or centrifugation) to remove the unbound material.","['Thus, a multiplexed approach is taken where a GBP is mixed with a set of conjugated beads each identifiable by its fluorescent properties. The GBP may be biotinylated, allowing detection by fluorescent streptavidin, or the GBP may be detected by binding to specific antibody or another reagent if the GBP is epitope-tagged. The degree of binding of the GBP is a measure of its affinity and specificity for a particular glycan. The advantages of this approach is that it is high-throughput, allowing thousands of assays to be performed automatically, as well as utilizing small amounts of both glycan and GBP. The collection of data and its analysis are also automated. A limitation of the approach is that each glycan to be derivatized must be activated by having a primary amine or other chemistry for conjugation, and each conjugation of a glycan needs to be independently validated. Multivalent GBPs interacting with multivalent ligands, as expressed on cells, can cause the cells to agglutinate. This can be exploited by allowing one to measure the ability of a soluble glycan to block the agglutination activity of the GBP. The concentration of the soluble glycan that provides 50% inhibition of agglutination is taken as the inhibitory concentration (IC50). Such approaches have been used for many years in studies on lectin-induced agglutination of cells and were useful in elucidating the nature of the human blood group substances. If a sufficiently large panel of soluble glycans is used, then the relative efficacies of each of these can be measured to help define the specificity of the GBP. A major advantage of this technique is that it does not require tagging of the glycans. Furthermore, polystyrene or dextran beads modified with discrete glycans can be used in lieu of cells. In this case, the glycans on the agglutinating particle are better defined. Usually, the IC50 does not relate directly to the binding affinity, because inhibition is being measured. The actual binding affinity must be defined by other techniques described earlier in this chapter.'
 'In this manner, one can assess the binding specificity of a GBP. In practice, this approach is rather crude, and although it gives valuable practical information about the capacity of an immobilized lectin to bind specific glycans, it does not provide quantitative affinity measurements. A variant of this method is to immobilize the glycan ligand through covalent linkage or by capturing a biotinylated glycan on a streptavidin-linked surface and then measuring GBP binding. A more sophisticated version of this approach, termed frontal affinity chromatography, can provide quantitative measurements of the equilibrium binding constants. In this technique, a solution containing a glycan of known concentration is continuously applied to a column of immobilized GBP, and the elution front of the glycan from the column is monitored. Eventually, enough ligand is added through continuous addition that its concentration in the eluant equals that in the starting material. If the glycan has no affinity for the GBP, it will elute in the void volume V0; if, however, the glycan interacts with the GBP, it will elute after the V0 and at a volume Vf (Figure 29.3). Example of frontal affinity chromatography, in which different concentrations of a glycan are applied to a column of immobilized GBP. The profile depicts the elution of one glycan that binds the GBP and the elution of another glycan that does not bind (more...) The advantages of frontal affinity chromatography are similar to those discussed for equilibrium dialysis: (1) the approach is easy and inexpensive; (2) if the affinity is high, then relatively small amounts of protein are needed (typically a few milligrams), and only a single column is required; (3) correspondingly, small amounts of glycan may be used if the Kd is in the range of 10 nm to 10 mm; (4) if the glycans are stable, they may be recovered and reused; (5) radioactive glycans may be used; and (6) reliable equilibrium measurements can be made.'
 'In this case, the glycans on the agglutinating particle are better defined. Usually, the IC50 does not relate directly to the binding affinity, because inhibition is being measured. The actual binding affinity must be defined by other techniques described earlier in this chapter. The interaction of a multivalent GBP or antibody with a multivalent ligand allows formation of cross-linked complexes in solution. In many cases, these complexes become insoluble and precipitate. Precipitation may be highly specific and reflects the affinity constant of the ligand for the receptor. To quantify this interaction a fixed amount of GBP or antibody is titrated against a glycoprotein or a glycan to which it binds and a precipitate will form at a precise ratio of ligand to receptor. The amount of protein or ligand in the precipitate can be measured directly by chemical means, using assays for glycans or proteins. The technique of precipitation is useful for studying potentially multivalent ligands, and it has been used recently to show that each branch of terminally galactosylated complex-type di-, tri-, and tetra-antennary N-glycans is independently recognized by galactose-binding lectins. Another precipitation approach takes advantage of the fact that a complex between a GBP and a glycan can be “salted out” or precipitated by ammonium sulfate. A variation of this approach was used in early studies on the characterization of the hepatocyte asialoglycoprotein receptor (AMR), in which the ligand 125I-labeled asialoorosomucoid was incubated with a preparation of receptor. The sample was treated with sufficient ammonium sulfate to precipitate the complex but not the unbound ligand. The precipitated complex was captured on a filter and the amount of ligand in the complex was determined by γ-counting. In this approach, a glycoprotein (or ligand) is mixed with a GBP or antibody and the mixture is electrophoretically separated in polyacrylamide. For glycosaminoglycans, this technique is termed affinity co-electrophoresis (ACE).'
 'Preparation of covalent glycan microarrays printed on N-hydroxysuccinimide (NHS)- or epoxide-activated glass slides. In this example, the glycans have a free amine at the reducing end and are coupled to the glass slide. After washing to remove unattached (more...) The chief features of the successful microarrays are the variety of glycans they contain. However, the clustered and relatively high amount of glycans densely packed that can bind detectable amounts of GBPs, may also promote binding of even relatively low affinity multivalent GBPs. Thus, the density of the ligand should be taken into account when interpreting the results. The type of linker used and the state of the monosaccharide at the reducing end (i.e., open ring, open or closed ring form attached to the linker) can also affect binding. Binding is visualized or imaged as intensely fluorescent spots against a dark background. The data are visually imaged on a scanner and then graphically represented. In a typical successful analysis a GBP may bind to several glycans that share structural features, often termed glycan-binding determinants or motifs. If desired, the GBP can then be tested for its binding to the identified candidates by other methods such as titration microcalorimetry or fluorescence polarization, to define the Kd as discussed above. The use of microarrays in characterizing GBPs is a central component of functional glycomics (Chapter 51). Publicly available glycan microarray binding data repositories are increasingly used in the field. A variation of glycan microarrays is a bead-based Luminex-type assay. In this high-throughput approach glycans are covalently immobilized on Luminex beads of different fluorophore properties. Thus, a multiplexed approach is taken where a GBP is mixed with a set of conjugated beads each identifiable by its fluorescent properties. The GBP may be biotinylated, allowing detection by fluorescent streptavidin, or the GBP may be detected by binding to specific antibody or another reagent if the GBP is epitope-tagged.'
 'There are some limitations to this approach, including (1) only the Kd can be derived, not kon or koff; (2) the conjugation of the GBP to the matrix must be stable and the protein must retain reasonable activity for many different column runs; (3) the amount of GBP conjugated and active must be defined; (4) many different column runs must be made with a single glycan; and (5) if the Kd is high (>1 mm), this approach is typically not feasible. Overall, frontal affinity chromatography is quite useful and is automated. Another variation is generally termed a “pull-down assay,” akin to a type of immunoprecipitation. In this approach a solution containing potential ligands is incubated with a GBP that may be immobilized on a surface (e.g., a bead). Afterward the bead-GBP is subjected to several steps (e.g., magnetic separation or centrifugation) to remove the unbound material. The material bound to the bead-GBP may then be eluted for measurement and further analyses. Using this pull-down setup, one can perform a concentration-dependent binding assay to obtain an apparent Ka of the ligand for the immobilized GBP. Isothermal titration calorimetry (ITC) is one of the most rigorous means of defining the equilibrium binding constant between a glycan and a GBP or indeed any protein and its ligand. The binding of a glycan to the GBP is measured as a change in enthalpy using a commercial microcalorimeter. In this technique, a solution containing a glycan of interest is added in increments into a solution containing a fixed concentration of GBP. The glycan is added at many intervals and the heat evolved from binding is measured relative to a reference cell. Over the course of the experiment, the concentration of glycan is increased in the mixing cell over a glycan-to-GBP molar ratio of 0–10. The heat absorbed or evolved during binding is determined and the data are replotted as kcal/mole of injectant versus the molar ratio (Figure 29.4). These data are then analyzed by replotting data to obtain the Kd.'
 'In this approach, a glycoprotein (or ligand) is mixed with a GBP or antibody and the mixture is electrophoretically separated in polyacrylamide. For glycosaminoglycans, this technique is termed affinity co-electrophoresis (ACE). This method is particularly useful in defining the apparent Kd of the interaction and allows identification of subpopulations of glycosaminoglycans that differentially interact with the GBP. In another method, termed crossed affinity immunoelectrophoresis, a second step of electrophoresis is conducted in the second perpendicular dimension across an agarose gel that contains precipitating monospecific antibody to the glycoprotein or ligand. The gel is then stained with Coomassie Brilliant Blue and an immunoelectrophoretogram is obtained. Glycoproteins not interacting with the GBP or antibody have faster mobility than the complex. The amount of glycoprotein or ligand is determined by the area under the curves obtained in the second dimensional analysis. This method is useful for studying glycoforms of proteins and has been particularly valuable in analyzing glycoforms of α1-acid glycoprotein (an acute-phase glycoprotein) in serum and changes in its α1-3 fucosylation. An indirect approach to studying protein–glycan interactions is to express a copy DNA (cDNA) encoding a glycosyltransferase in an animal or bacterial cell (Chapter 56). The adhesion of the modified cell (either transiently or stably transfected) to a GBP or antibody is then measured and taken to reflect the binding of the GBP or antibody to the new glycans (neoglycans) on the cell surface. Conversely, a cDNA encoding a GBP is expressed in cells and their ability to bind glycan ligands is tested. The expression of selectins, Siglecs, and other GBPs on the cell surface of transfected cells has been helpful in evaluating the roles of GBPs in cell adhesion under physiological flow conditions.'
 'The drawbacks of this approach are that (1) analytes must have sufficient mass to cause a significant change in SPR on binding (thus, the glycan is usually immobilized instead of the protein); (2) coupling of free glycans to the chip surface may be inefficient, and thus neoglycoproteins or some other type of large conjugate may be needed; and (3) there may be inhomogeneity in conditions on the SPR instrument because of mass transport effects, which could affect the dissociation rate and thus provide an inaccurate Kd measurement. A related technology is biolayer interferometry (BLI), in which an optical biosensor analyzes the interference pattern of white light reflected from two surface. One surface carries the GBP immobilized in a biosensor tip, and the other surface is used as a reference. Binding of molecules to the biosensor tip changes the interference pattern in real time, thus allowing measurement of the kinetics of binding and dissociation. A clear advantage of this technique is that it does not require labels, such as fluorescent tags for detection (i.e., it is label-free). Additionally, BLI is generally performed in a 96- or 384-well format enabling it to be high-throughput. It is not quite as sensitive, however, as SPR, and thus small ligands, such as small oligosaccharides, may not provide robust signals. Like SPR, one of the interacting partners (e.g., the GBP) must be immobilized; with multiple tips it is difficult to ensure equal levels of immobilization. Nevertheless, this technique is easy to use and less costly compared to SPR, and when employed with the Cheng–Prusoff model in assays to determine oligosaccharide inhibition, BLI has been shown to generate solution Kd values that agree with those from NMR assays. Fluorescence polarization is an established technique but only relatively recently has it been applied to measure the binding constants of glycans to GBPs. This approach is based on the reduced rotational motion of a relatively small glycan when it is bound to a relatively large protein compared with the rotation of the free glycan in solution.']","The material bound to the bead-GBP may then be eluted for measurement and further analyses. Using this pull-down setup, one can perform a concentration-dependent binding assay to obtain an apparent Ka of the ligand for the immobilized GBP.","The material bound to the bead-GBP may then be eluted for measurement and further analyses. Using this pull-down setup, one can perform a concentration-dependent binding assay to obtain an apparent Ka of the ligand for the immobilized GBP. Isothermal titration calorimetry (ITC) is one of the most rigorous means of defining the equilibrium binding constant between a glycan and a GBP or indeed any protein and its ligand. The binding of a glycan to the GBP is measured as a change in enthalpy using a commercial microcalorimeter. In this technique, a solution containing a glycan of interest is added in increments into a solution containing a fixed concentration of GBP. The glycan is added at many intervals and the heat evolved from binding is measured relative to a reference cell. Over the course of the experiment, the concentration of glycan is increased in the mixing cell over a glycan-to-GBP molar ratio of 0–10. The heat absorbed or evolved during binding is determined and the data are replotted as kcal/mole of injectant versus the molar ratio (Figure 29.4).",0.25,0.6110758625503154,0.8156044915266678,0.03225806451612903,0.9999999999857143,1.0
"Complete the following paragraph: It is important to note that structural methodology is continually evolving, with additional information coming from techniques like small-angle X-ray scattering (SAXS) and cryo-electron microscopy (cryo-EM). Recent advances in cryo-EM provide many exciting opportunities to study protein–glycan interactions, which will also be discussed.","['Cryo-EM single-particle methods are approaching resolutions previously confined to X-ray crystallography. Single-particle and tomography EM approaches are continuing to undergo rapid development in terms of EM infrastructure, sample preparation, and data acquisition. Several user-friendly pipeline data processing packages exist, making this technology attractive to an increasing scientific audience. Hyperpolarization methods are reducing the sensitivity limitations of NMR, and solid-state NMR methods are allowing application to amorphous materials, including fibrils, cell-wall structures, and membrane fragments. Advances in computational technology are enabling simulation of ever larger systems and timescales. At the same time, structural targets are shifting from detailed characterization of single proteins and protein–glycan complexes to large-scale assemblies that cooperate to elicit a functional response. This is a promising situation for improved understanding of glycan function in biological systems. The authors appreciate helpful comments and suggestions from Barbara Mulloy, Dillon Chen, and Sean Stowell.'
 'Information about these is available in Further Reading. With the development of direct electron detectors, cryo-electron microscopy (cryo-EM) has become one of the most powerful techniques to obtain high-resolution structural information on biological macromolecules. With reported resolutions exceeding 2 Å, many molecular details are revealed under native-like conditions. By eliminating the need for growing well-ordered three-dimensional (3D) crystals and operating at fairly low sample concentrations, cryo-EM can provide atomic level insights into many biological samples, from soluble and membrane-integrated protein complexes to filamentous polymers and entire viruses. Cryo-EM can be roughly divided into two main directions: one working with single (usually purified) particles, single-particle analysis (SPA), and the other using a tomography approach to analyze species in larger assemblies, such as in vitro–assembled scaffolds or even native cells and tissues. For SPA, samples are generally analyzed in a thin layer of vitreous ice containing the particles in random orientations. Data is collected in the form of movies, which allows correction for beam-induced drift, followed by estimation of the contrast transfer function for each micrograph; both are necessary to obtain near-atomic resolutions. The individual particles are then computationally extracted from the micrographs, sorted, and ultimately aligned in three dimensions to reconstruct the molecular structure. For cryo-electron tomography of, for example, a vitrified cell or virus particle, a tilt series of images is acquired to obtain different “specimen views” necessary for 3D reconstruction. This technique continues to face technical challenges, in part because of limitations on the tilt angles that can be achieved. However, it is a powerful tool to image, for example, the glycocalyx of various tissues, plant and fungal cells walls, or microbial cell envelopes and capsules. A major advantage of cryo-EM is that sample heterogeneity and/or conformational flexibility does not preclude analyses. To obtain well-diffracting crystals of a glycosylated protein, for example, the conformationally heterogenous glycans are often removed enzymatically to facilitate crystallization.'
 'A major advantage of cryo-EM is that sample heterogeneity and/or conformational flexibility does not preclude analyses. To obtain well-diffracting crystals of a glycosylated protein, for example, the conformationally heterogenous glycans are often removed enzymatically to facilitate crystallization. For cryo-EM, these pretreatments are generally unnecessary, thereby providing molecular details of proteins in the context of posttranslational modifications. Analyses of fully glycosylated viral envelope proteins are fascinating examples that document the potential of cryo-EM for studying protein–carbohydrate interactions (Figure 30.5). Other examples include polysaccharide-synthesizing enzymes bound to their polymeric products as well as integral membrane transporters associated with lipopolysaccharide substrates. Cryo-electron microscopy structure of the native fully glycosylated HIV-1 envelope trimer. Protein subunits are shown as gray surfaces and glycans are shown as ball and sticks (PDB entry 5FUU). Carbohydrates are colored green and pale green (β- (more...) We can thus look forward to correlating unprecedented structural insights on protein glycosylation and complex carbohydrate interactions with biochemical, functional, spectroscopic, and in silico approaches in the coming years. Experimental structural information obtained by crystallographic, NMR, and cryo-EM methods have clearly been of value in building an understanding of the molecular interactions that lead to glycan recognition by proteins. However, systems in which interactions are of interest far outnumber the cases in which these methods can be applied. Most crystal structures contain either small ligands or yield useful electron densities for only parts of larger ligands. The same is true to a certain extent for cryo-EM structures. NMR methods, although giving detailed information on bound ligand geometries, frequently give only qualitative information on parts of ligands or protein that are in intimate contact with each other. All three methods require substantial effort, particularly in preparing samples for investigation.'
 'Nevertheless, there are a significant number of crystal structures for glycan–protein complexes, and these have contributed greatly to our understanding of the types of interactions that make glycan recognition possible. Structural information on bound glycan ligands that is complementary to that from X-ray crystallography is increasingly coming from NMR methods. This is particularly valuable in that it is applicable to ligands with a broader range of affinities, including many that have the lower affinities amplified in multivalent interactions. It is also applicable in solution under near-physiological conditions in which concerns about the effects of crystal lattice contacts and occlusion of some interaction sites are absent. It is even possible to conduct some experiments on assemblies that mimic a membrane surface environment, an environment in which many protein–glycan interactions occur. It is important to note that structural methodology is continually evolving, with additional information coming from techniques like small-angle X-ray scattering (SAXS) and cryo-electron microscopy (cryo-EM). Recent advances in cryo-EM provide many exciting opportunities to study protein–glycan interactions, which will also be discussed. The fundamental understanding of glycan–protein interactions, as enriched by experimental studies of all types, has now been encoded in powerful molecular simulation programs that provide a computational approach to generating three dimensional pictures of glycan–protein complexes. These are important because it is difficult to produce complex glycan ligands in the amounts and purity required for most experimental approaches. These methods, although still evolving toward increased confidence in outcomes, provide models for experimentally inaccessible systems that can be tested with a variety of nonstructural approaches. They can also be leveraged with sparse structural data that alone could not provide detailed structural information. X-ray crystallography is a very powerful method for obtaining details of protein–ligand interactions. It excels in terms of the size range of molecules that can be studied (from small compounds to large multiprotein complexes) and in efficiency of data collection when high-energy X-ray beams at synchrotron sources are used. One of the limitations is still the crystallization step.'
 'The same is true to a certain extent for cryo-EM structures. NMR methods, although giving detailed information on bound ligand geometries, frequently give only qualitative information on parts of ligands or protein that are in intimate contact with each other. All three methods require substantial effort, particularly in preparing samples for investigation. A particular problem for glycans of interest is that they are often complex molecules that are difficult to prepare in highly pure forms or in the quantities needed for experimental investigation. There are also functionally important dynamic processes (e.g., enzymatic conversions of glycan substrates to products and transport of glycans) that are not well-represented by static, thermodynamically stable structures. Computational methods can extend analyses into these less accessible regions of structural investigation. Computational contributions to our understanding of glycan properties have a long history, beginning with a very fundamental understanding of factors influencing anomeric configuration and glycosidic torsion angles. These glycan-specific factors, such as the anomeric effect and the exo-anomeric effect, are described more thoroughly in Chapters 2, 3, and 50. When protein–glycan interactions are of interest, the situation becomes more complex with hydrogen bonding, van der Waals interactions, and electrostatic interactions between glycan and various amino acids becoming important. For very limited sets of atoms, it is possible to pursue an understanding of interactions using advanced quantum mechanical (QM) methods, but for larger systems other approaches based on semiempirical “force fields” are used, as in molecular mechanics (MM) and molecular dynamics (MD) simulations. Empirical “force fields” used in MM and MD modules of packages such as Amber, CHARMM, and GROMOS are typically represented in terms of bond, bond angle, torsion angle, van der Waals, and electrostatic contributions to a molecular energy. Parameters in functions representing each of these terms have been optimized to reproduce QM as well as a selection of thermodynamic and spectroscopic data. Initially, these force fields were developed for proteins alone, so they did not include contributions such as the anomeric and exo-anomeric effects found in glycans.'
 'Interaction energies were then generated by applying MM/GBSA routines from Amber12 to 100-nsec MD production runs. Although the positions of donor and amino acid residues near the donor were modeled to be quite similar to those seen in other transferases, the docking/MD procedure provides a unique view of a possible acceptor position and its interactions. Most of the interaction energy holding the acceptor in place comes from interactions with the galactose ring, which is well-positioned to allow nucleophilic attack on the anomeric carbon of the nucleotide-activated Neu5Ac. This energy results from hydrophobic stacking of Tyr-366 with the nonpolar face of the pyranose ring and a network of hydrogen bonds between Asp-271, Asn-230, His-367, and Gln-232 of the protein and O2, O3, O4, and O6 hydroxyl groups of Gal. The position of the GlcNAc is more variable but does contribute to binding energy. The position and interactions among protein, donor, and acceptor are depicted in Figure 30.7. Stereo view of interactions between the donor (CMP-Neu5Ac), acceptor (GlcNAcβ1-4Gal), and protein residues in the active site of ST6Gal1. (Reproduced, with permission, from Meng L, et al. 2013. J Biol Chem 288: 34680−34698.)  Structural biology is an evolving area of science both in terms of methodology and questions to be answered. The principle methodologies discussed here are each evolving: crystallographic methods using new X-ray sources (e.g., X-ray lasers) are allowing the analysis of microcrystals at room temperature and femtosecond timescales, thereby eliminating temperature- and beam-induced artifacts. Cryo-EM single-particle methods are approaching resolutions previously confined to X-ray crystallography. Single-particle and tomography EM approaches are continuing to undergo rapid development in terms of EM infrastructure, sample preparation, and data acquisition. Several user-friendly pipeline data processing packages exist, making this technology attractive to an increasing scientific audience.'
 'Recent advances in solution NMR spectroscopy that allows measurements of NOEs between OH groups have increased the number of distance restraints and improve the quality of glycan three-dimensional structures (Chapter 50). Bio-orthogonal labeling methods continue to be developed that will allow the study of changes in glycans in living cells in real time. Currently, for atomic structural analyses of glycoproteins, including X-ray crystallography, it is usually necessary to remove glycans to allow for crystallization. As electron imaging methods, such as cryo-electron microscopy (cryo-EM), continue to reach higher resolution approaching that achieved by crystallographic analyses, we will be able to obtain images of glycoconjugates at atomic resolution, without the need to remove the glycans. In fact, recent cryo-EM structures of the oligosaccharyltransferases have significantly impacted our molecular understanding of N-linked glycosylation. As NMR becomes more sensitive and can handle larger molecules, one will also be able to visualize glycoconjugates in physiologically relevant solvents and at appropriate temperatures. These developments will allow a much more accurate view of the 3D structures of glycoconjugates. Eventually, one will need to define the population of molecular species (glycoforms of glycoproteins and glycolipids) at an organismal and cellular level to fully understand structure/function relationships of glycoconjugates in response to extracellular stimuli. Existing technologies that show great promise include top-down glycoproteomics and high-throughput, high-resolution imaging methods. In the past few years, there have also been major advances in glycoproteomics. In contrast to glycomics, glycoproteomic approaches do not lose the context of where on a polypeptide glycans are attached (Chapter 51). In theory, if these methods live up to their promise, one day it may be possible to define the complete set of molecular species of glycoconjugates in a population and thus elucidate how they collectively contribute to the many individual functions of a gene product.']","Experimental structural information obtained by crystallographic, NMR, and cryo-EM methods have clearly been of value in building an understanding of the molecular interactions that lead to glycan recognition by proteins. However, systems in which interactions are of interest far outnumber the cases in which these methods can be applied. Most crystal structures contain either small ligands or yield useful electron densities for only parts of larger ligands. The same is true to a certain extent for cryo-EM structures. NMR methods, although giving detailed information on bound ligand geometries, frequently give only qualitative information on parts of ligands or protein that are in intimate contact with each other. All three methods require substantial effort, particularly in preparing samples for investigation. A particular problem for glycans of interest is that they are often complex molecules that are difficult to prepare in highly pure forms or in the quantities needed for experimental investigation. There are also functionally important dynamic processes (e.g., enzymatic conversions of glycan substrates to products and transport of glycans) that are not well-represented by static, thermodynamically stable structures. Computational methods can extend analyses into these less accessible regions of structural investigation. Computational contributions to our understanding of glycan properties have a long history, beginning with a very fundamental understanding of factors influencing anomeric configuration and glycosidic torsion angles. These glycan-specific factors, such as the anomeric effect and the exo-anomeric effect, are described more thoroughly in Chapters 2, 3, and 50. When protein–glycan interactions are of interest, the situation becomes more complex with hydrogen bonding, van der Waals interactions, and electrostatic interactions between glycan and various amino acids becoming important. For very limited sets of atoms, it is possible to pursue an understanding of interactions using advanced quantum mechanical (QM) methods, but for larger systems other approaches based on semiempirical “force fields” are used, as in molecular mechanics (MM) and molecular dynamics (MD) simulations. Empirical “force fields” used in MM and MD modules of packages such as Amber, CHARMM, and GROMOS are typically represented in terms of bond, bond angle, torsion angle, van der Waals, and electrostatic contributions to a molecular energy. Parameters in functions representing each of these terms have been optimized to reproduce QM as well as a selection of thermodynamic and spectroscopic data. Initially, these force fields were developed for proteins alone, so they did not include contributions such as the anomeric and exo-anomeric effects found in glycans.","The fundamental understanding of glycan–protein interactions, as enriched by experimental studies of all types, has now been encoded in powerful molecular simulation programs that provide a computational approach to generating three dimensional pictures of glycan–protein complexes. These are important because it is difficult to produce complex glycan ligands in the amounts and purity required for most experimental approaches. These methods, although still evolving toward increased confidence in outcomes, provide models for experimentally inaccessible systems that can be tested with a variety of nonstructural approaches. They can also be leveraged with sparse structural data that alone could not provide detailed structural information.",0.7916666666666666,0.5019385874016309,0.805929748284399,0.011627906976744186,0.9761904761742063,1.0
"Complete the following paragraph: Ricinus communis is native to Africa and India and has been used for millennia, by many cultural groups, for numerous medical and industrial purposes. Two lectins, originally termed RCA-I and RCA-II, can be purified from the seeds.","['This domain structure defines the R(icin)-type lectins, a superfamily also classified as carbohydrate-binding molecule (CBM) 13 (http://www.cazy.org/CBM13.html) in the Carbohydrate-Active Enzymes (CAZy) database (Chapter 6). These lectins are widely present in all three biological domains (and their viruses) as glycan-binding proteins, including enzymes and toxins (Figure 31.1). The R-type lectin superfamily. Different groups within the superfamily are characterized by the domain structures shown.  Ricinus communis is native to Africa and India and has been used for millennia, by many cultural groups, for numerous medical and industrial purposes. Two lectins, originally termed RCA-I and RCA-II, can be purified from the seeds. RCA-I (molecular mass ∼120 kDa) is a hemagglutinin and a very weak toxin. RCA-II (∼60 kDa), better known as ricin, is an agglutinin and a very potent toxin. Ricin is easily extractable from castor beans and can kill humans at very small doses. RCA-II (ricin; Figure 31.2) is synthesized as a single prepropolypeptide of 576 amino acid (aa) residues containing a secretion signal peptide (residues 1–35), an A chain (residues 36–302), a 12-aa linker region (residues 303–314), and a B chain (residues 315–576). The A-chain toxin is an N-glycoside hydrolase (EC 3.2.2.22) that inactivates the 60S ribosome. The B-chain lectin domain binds to galactose (Gal) and β-galactosides. The amino-terminal signal sequence brings the propolypeptide to the endoplasmic reticulum (ER), where the signal is cleaved off, and the polypeptide is glycosylated.'
 'RCA-I binds preferentially to terminal β-linked Gal, whereas RCA-II binds to either terminal β-linked Gal or GalNAc. These lectins are often purified and separated by differential elution from Gal-based affinity resins; RCA-II is eluted with GalNAc, and RCA-I is then eluted with Gal. These lectins have very low binding affinities for monosaccharides (Kd in the range 10−3 to 10−4 m), but very high affinities (10−7 to 10−8 m) for cells, because of their multivalency and enhanced binding to multiple surface glycans having nonreducing terminal Galβ1-4GlcNAc-R (type-2 LacNAc) sequences. Both lectins also bind strongly to glycans with GalNAcβ1-4GlcNAc-R (LacdiNAc), and weakly to the isomer Galβ1-3GlcNAc-R (type-1 LacNAc). Neither lectin binds appreciably to glycoconjugates having nonreducing terminal α-linked Gal residues. Ricin is highly toxic and the effects of ingestion are severe, with symptoms appearing after a 2- to 24-h latent period. The lethal dose (LD50) of ricin is extremely low (3–5 µg/kg body weight). Ricin is classified as a type II ribosome-inactivating protein (RIP-II). RCA-I (agglutinin) is less toxic than ricin, because of the weaker enzymatic activity of its A-chain. Type I ribosome-inactivating proteins (RIP-I), which lack a B chain with R-type lectin domains, are much less toxic than ricin because toxin entry into target cells is facilitated by B-chain carbohydrate-binding activity. RIP-I expressed in tissues of various types of plants affects disease resistance. Horizontal transmission of RIP-I gene to the genome of whitefly (Hemiptera, Insecta) feeding on such plants was recently demonstrated.'
 'The B-chain lectin domain binds to galactose (Gal) and β-galactosides. The amino-terminal signal sequence brings the propolypeptide to the endoplasmic reticulum (ER), where the signal is cleaved off, and the polypeptide is glycosylated. The A chain is linked to the B chain by a disulfide bond between cysteine residues 294 and 318 (Cys4 in the free B chain), and four intrachain disulfide bonds are formed. After glycosylation, ricin is transported to protein storage bodies in castor beans, where the mature ricin protein is generated by removal of the linker peptide by an endopeptidase. Structure of ricin. (A) Ricinus communis (beans and plants). (B) Crystal structure of ricin (RCA-II); resolution 2.5 Å. (Rutenber E, et al. 1991. Proteins 10: 240–250. Image from PDB entry 2AAI.)  RCA-I (agglutinin) is a tetramer consisting of two noncovalently associated ricin-like heterodimers. Each heterodimer contains an A chain disulfide-linked to a Gal-binding B chain. The A-chain sequences of RCA-I and RCA-II differ in 18 residues and are 93% similar, whereas the B-chain sequences differ in 41 of 262 residues and are 84% similar. The subunits are all N-glycosylated and usually display oligomannose-type N-glycans. Several other lectins having high homology with ricin are also encoded by the R. communis genome; some of these are termed ricin-A, -B, -C, -D (ricin), and -E. The B chain of both RCA-I (agglutinin) and RCA-II (ricin) contains two CRDs in the polypeptide. RCA-I binds preferentially to terminal β-linked Gal, whereas RCA-II binds to either terminal β-linked Gal or GalNAc.'
 'RIP-I expressed in tissues of various types of plants affects disease resistance. Horizontal transmission of RIP-I gene to the genome of whitefly (Hemiptera, Insecta) feeding on such plants was recently demonstrated. Ricin bound to a β-linked cell-surface Gal/GalNAc containing glycans is transported into endosomes (Figure 31.3), and then migrates by retrograde trafficking to ER via the trans-Golgi network and Golgi apparatus. In the ER, A and B chains separate following reduction of the disulfide bond, perhaps catalyzed by the enzyme protein disulfide isomerase. A portion of the free A chain, which may be partially denatured in the ER, escapes by retrotranslocation through the Sec61 translocon and enters the cytoplasm. Pathway of ricin uptake by cells and mechanism whereby toxic activity of A chain in cytoplasm results in cell death.  Just a few molecules of ricin A-chain in the cytoplasm are sufficient to kill cells. The catalytic subunit of A-chain is an rRNA N-glycosylase having eight α-helices and eight β-strands, which cleaves one purine base (adenine 4324) in the exposed GAGA tetraloop of the 28S RNA of the eukaryotic 60S ribosomal subunit. This deletion results in loss of binding of elongation factor-2, inability of ribosomes to perform protein synthesis, and consequent cell death. Sequence analysis of RCA-I and RCA-II revealed that their B-chains contain two similar, characteristic regions in the polypeptide (i.e., the tandem-repeat R-type lectin). Each of the domains is approximately 120 aa long, with three tandem repeats of a 40-residue subdomain. Each subdomain contains a Q-x-W motif (x represents any aa). This tandem repeat is present in other toxins from plants of various phyla and is evidently characteristic of plant lectins. In the late 1990s, similar sequences were discovered in lectins from nonplant organisms, indicating that the ricin-B-like pattern is universal.'
 'Nontoxic lectins isolated from elderberry (genus Sambucus) bark include SSA (Sambucus sieboldiana agglutinin) and SNA (Sambucus nigra agglutinin UniProt Q41358). These are useful because it is the rare R-type lectin that binds strongly to α2-6-linked sialic acid–modified glycans, but not to α2-3-linked sialylated ligands. Both are heterotetramers (∼140 kDa) composed of two heterodimers, each containing an A chain (resembling ricin A chain) disulfide-bonded to a B chain (R-type lectin). Expression of R-type lectins in roots and shoots of rice (Oryza sativa) was shown to be up-regulated in response to changing environmental conditions, based on genome informatics of Man and Gal-binding β-trefoil fold group EUL (UniProt B3SV73) found in Euonymus europaeus. Analysis of the promoter region of rice EUL genes revealed diverse stress-responsive elements. Analysis of expression profiles revealed that the genes were regulated in response to various types of stress (drought, osmotic, hormonal). Thus, β-trefoil fold lectins are involved in plant stress signaling and defense. Molecular structures of plant proteins having R-type lectin or β-trefoil fold domains vary extensively. Amaranth (Amaranthus caudatus) is an ancient South American crop plant with high nutritional value. Amaranthin (PDB 1JLX), purified from amaranth seeds, is a homodimeric lectin (Mr 66,000) consisting of two identical tandem-repeat β-trefoil fold domains. The primary structure of the lectin is ∼20% similar to that of ricin B-chain. Amaranthin specifically recognizes Thomsen–Fredenreich (TF or T antigen) (Galβ1-3GalNAcα1-) and sialyl-T (Siaα2-3Galβ1-3GalNAcα1-) antigens.'
 'NCBI Bookshelf. A service of the National Library of Medicine, National Institutes of Health. Varki A, Cummings RD, Esko JD, et al., editors. Essentials of Glycobiology [Internet]. 4th edition. Cold Spring Harbor (NY): Cold Spring Harbor Laboratory Press; 2022.  doi: 10.1101/glycobiology.4e.31 Richard D. Cummings, Ronald L. Schnaar, and Yasuhiro Ozeki. The R-type lectin superfamily is characterized by a carbohydrate-recognition domain (CRD) originally reported in a polypeptide of ricin, a plant toxin. Ricin was the first lectin discovered, and the R-type lectins are named after it. Through evolution, the R-type lectin domain has given rise to various protein forms, some containing this domain alone and others containing additional functional domains (e.g., enzyme or toxin). We will discuss the diversity of this superfamily in terms of molecular tinkering and “bricolage,” based on structure–function relationships. In 1888, Peter Hermann Stillmark at the University of Dorpat (now University of Tartu, Estonia) reported that protein extracts from seeds of Ricinus communis (commonly called “castor oil plant”; seeds are called “castor beans”) contained a factor (which he termed “ricin”) capable of agglutinating erythrocytes. Ricin was already well known as a toxin, but its carbohydrate-binding specificity was not analyzed in detail until the mid-20th century, when it was classified as a lectin. Structural analysis of ricin, performed around a century after its discovery, showed that the CRD had a “β-trefoil” (three-leaved) fold with a common Q-x-W motif in each subdomain. This domain structure defines the R(icin)-type lectins, a superfamily also classified as carbohydrate-binding molecule (CBM) 13 (http://www.cazy.org/CBM13.html) in the Carbohydrate-Active Enzymes (CAZy) database (Chapter 6).'
 ""β-trefoil fold is maintained by the characteristic Q-x-W motif in each subdomain of ricin B-chain and common R-type lectins. More than 10% of lectins use this fold for glycan recognition (Chapter 30). Structures of β-trefoil folds of R-type lectin domains in various proteins. (Top) Structures derived from bacteria, fungi, and slime molds: AH (actinohivin in actinobacteria; PDB 4DEN), CNL (nematocidal lectin from conifer-loving mushroom Clitocybe (more...) In view of the conserved structures consisting of variable loops and a short β-barrel, in combination with low sequence homology based on β-strands connected by loops, the ability of β-trefoil proteins to flexibly select a variety of carbohydrate partners is not surprising. β-Trefoil proteins have been divided into several groups on the basis of biological function; these include lectins, basic fibroblast growth factor (FGF) (PDB 2AXM; Chapter 38), interleukin-1 (PDB 1ILT), Kunitz-type protease inhibitors (PDB 4IHZ), and the actin cross-linking protein hisactophilin (PDB 1HCE), although they have no Q-x-W motif. Each subdomain could conceivably have a carbohydrate-binding site; however, in most R-type lectins only one or two subdomains bind a carbohydrate ligand. Carbohydrate-binding of RCA-I and RCA-II arises from aromatic amino acids stacking against Gal/GalNAc residues and from hydrogen bonding between aa's and hydroxyl groups of carbohydrate ligands. A wide variety of R-type lectins with diverse configurations, including RIP-IIs and heterotetramers such as RCA-II, have been purified from various plant tissues. Nontoxic lectins isolated from elderberry (genus Sambucus) bark include SSA (Sambucus sieboldiana agglutinin) and SNA (Sambucus nigra agglutinin UniProt Q41358).""]","RCA-I and RCA-II are two lectins that can be purified from the seeds of Ricinus communis. RCA-I is a hemagglutinin and a very weak toxin, while RCA-II, also known as ricin, is an agglutinin and a highly potent toxin. Ricin, easily extractable from castor beans, can be lethal to humans at very small doses.","RCA-I (molecular mass ∼120 kDa) is a hemagglutinin and a very weak toxin. RCA-II (∼60 kDa), better known as ricin, is an agglutinin and a very potent toxin. Ricin is easily extractable from castor beans and can kill humans at very small doses. RCA-II (ricin; Figure 31.2) is synthesized as a single prepropolypeptide of 576 amino acid (aa) residues containing a secretion signal peptide (residues 1–35), an A chain (residues 36–302), a 12-aa linker region (residues 303–314), and a B chain (residues 315–576). The A-chain toxin is an N-glycoside hydrolase (EC 3.2.2.22) that inactivates the 60S ribosome. The B-chain lectin domain binds to galactose (Gal) and β-galactosides. The amino-terminal signal sequence brings the propolypeptide to the endoplasmic reticulum (ER), where the signal is cleaved off, and the polypeptide is glycosylated.",1.0,0.39785464889454286,0.8377121632512322,0.02197802197802198,0.9999999999857143,1.0
"Complete the following paragraph: A common feature of the legume L-type lectins is their monomeric structure. The structures of the monomers consist of three antiparallel β-sandwich: a flat six-stranded “back” sheet, a concave seven-stranded “front” sheet, and a short “top” sheet that keeps the two major sheets together (Figure 32.1A,B). All of these lectins require Ca++ and a transition metal ion (usually Mn++) for their carbohydrate-binding activity.","['In some cases, these latter lectins are encoded by separate but very similar genes. More than 100 of the seed legume L-type lectins have been characterized and are the most extensively studied proteins of this class. It also should be noted that the L-type fold has been observed in noncarbohydrate binding proteins, such as lectin-like receptor kinases in plants that are important in development and stress responses. A common feature of the legume L-type lectins is their monomeric structure. The structures of the monomers consist of three antiparallel β-sandwich: a flat six-stranded “back” sheet, a concave seven-stranded “front” sheet, and a short “top” sheet that keeps the two major sheets together (Figure 32.1A,B). All of these lectins require Ca++ and a transition metal ion (usually Mn++) for their carbohydrate-binding activity. The glycan-binding and metal-binding sites are localized in close proximity to each other at the top of the “front” sheet. The glycan-binding site is composed of four loops: A, B, C, and D (Figure 32.3, top). These loops contain four invariant amino acids that are essential for carbohydrate binding (Figure 32.3, bottom). Loop A contains an invariant aspartate, which forms hydrogen bonds between its side chain and the glycan ligand. This amino acid is linked to its preceding amino acid (usually alanine) by a rare cis-peptide bond, which is stabilized by the metal ions and is necessary for the proper orientation of the aspartate in the combining site. Loop B contains an invariant glycine, which also forms hydrogen bonds with the ligand. An exception to this case is found in two lectins (ConA and the closely related Dioclea grandiflora lectin) in which the glycine is replaced with an arginine. Both the glycine and arginine form hydrogen bonds with the ligand via their main-chain amides. Loop C contains an invariant asparagine, which forms a hydrogen bond with the ligand via its side chain, and an invariant hydrophobic amino acid.'
 'Both the glycine and arginine form hydrogen bonds with the ligand via their main-chain amides. Loop C contains an invariant asparagine, which forms a hydrogen bond with the ligand via its side chain, and an invariant hydrophobic amino acid. Besides these invariant amino acids, backbone atoms of the residues of loop D also contribute to monosaccharide recognition. (Top) Three-dimensional structure of a peanut agglutinin (PNA) monomer showing the four loops involved in sugar binding: loops A, B, C, and D. The bound sugar (lactose) is shown as a “ball-and-stick” model. Calcium and manganese ions are (more...) The legume L-type lectins are generally classified into groups based on their carbohydrate specificities as often identified by the ability of monosaccharides to inhibit their agglutinating activity. These differences in specificities are brought about by variability in the conformation and size of the D loop and to some extent by the C loop. Although the main specificity regions of the legume lectins are determined by the loops, there are sites other than these that contribute to lectin specificity. There are several additional modes of refining these specificities, such as interaction with water, posttranslational modifications, and state of oligomerization. Legume L-type lectins are oligomeric—mostly dimeric or tetrameric in nature—and adopt a variety of quaternary structures. The back β-sheet in the monomeric unit is involved in oligomerization. Small differences in the monomeric structure of the different legume lectins result in different modes of association of the β-sheet during oligomerization. For instance, although both ConA and PNA are tetrameric—being dimers of dimers—the quaternary association in ConA involves the association of the two six-stranded back β-sheets to form an extended 12-stranded β-sheet in each dimer, whereas the quaternary association in PNA involves a back-to-back arrangement of the back β-sheets. The tetrameric structure of ConA is shown in Figure 32.1C,D.'
 'The tetrameric structure of ConA is shown in Figure 32.1C,D. Although some of the other lectins occur as dimeric and tetrameric structures, several other different orientations of the β-sheets account for the variability in dimeric and tetrameric structures of other lectins in this class. Interestingly, some legume lectins have a hydrophobic binding site that binds adenine and adenine-derived plant hormones with micromolar affinity; this is two to three orders of magnitude higher than their affinity for monosaccharides. Three of these lectins (the soybean agglutinin, phytohemagglutinin L [PHAL], and Dolichos biflorus lectin) have been crystallized and found to have a unique tetrameric structure, in that the dimer–dimer interface creates a channel running through the center of the tetramer. Two identical adenine-binding sites are found at opposite ends of this channel. Another common feature of the legume lectins is that they are secretory proteins and undergo cotranslational signal peptide removal, which accompanies their entry into the secretory system. All but peanut agglutinin (PNA) are N-glycosylated as precursors; the N-glycans undergo normal posttranslational modification as they transit the Golgi apparatus. The lectins vary from one another as to whether the mature proteins contain oligomannose-type, complex-type, or a mixture of both types of N-glycans. The lectins may also undergo a variety of proteolytic modifications as they transit through the secretory system. Some of the lectins are cleaved to generate a β-chain, corresponding to the amino terminus and an α-chain corresponding to the carboxyl terminus. For example, the pea lectin and favin (the lectin from Vicia faba) are tetrameric glycoproteins that contain two types of subunits, α and β, which are ∼5 kDa and ∼21 kDa, respectively.'
 'The legume lectins were also found to have hemagglutinating properties because of their ability to bind glycans on the cell surface. The abundance of these proteins in the soluble extracts of legume seeds (up to ∼5%–10% total protein) enabled many lectins to be isolated and characterized. Such seed lectins have considerable amino acid sequence homology, and the variety of carbohydrate-binding specificities found among these lectins made them useful tools in a wide variety of analytical and biomedical procedures. The crystal structures of a number of legume seed lectins allowed the identification of the carbohydrate-binding sites. Structural similarities in the tertiary structures were identified among these lectins and several other lectins, including the galectins (see Chapter 36), as will be discussed in this chapter. For this reason, the term “L-type lectins” has recently been designated as a classification for all proteins with this legume seed lectin-like protein structure. The L-type lectins are distinguished from other lectins primarily based on tertiary structure and not the primary structure. In general, either the entire lectin monomer or the carbohydrate-recognition domains (CRDs) of the more complex lectins is composed of antiparallel β-sheets connected by short loops and β-bends, and they usually lack any α-helices. These sheets form a dome-like structure related to the “jelly-roll fold,” which is often called a “lectin fold.” The carbohydrate-binding site is generally localized toward the apex of this dome. The tertiary structure of the monomer of ConA, the lectin from the seeds of the legume Canavalia ensiformis, is shown in Figure 32.1. The crystal structures of at least 20 other legume L-type lectin monomers have been determined by high-resolution X-ray crystallography and are almost superimposable on this structure. Thus, it is not surprising that the amino acid sequences of legume lectins show remarkable homology with one another and of the sequences of many other legume seed lectins sequenced but not yet crystallized.'
 'Thus, it is not surprising that the amino acid sequences of legume lectins show remarkable homology with one another and of the sequences of many other legume seed lectins sequenced but not yet crystallized. Fewer, but significant, homologies in primary structure have been found between legume L-type lectins compared with some L-type lectins from far distant sources, such as ERGIC-53 and VIP36, found in vertebrates. Yet, in other L-type lectins, no homology is found with the seed lectins, although they contain similar lectin folds. For example, a comparison of the tertiary structure of the legume soybean lectin with the structure of human galectin-3 shows that both proteins contain the typical L-type lectin fold, but no amino acid sequence homology exists between the two lectins (Figure 32.2). Structure of concanavalin A (ConA), a legume seed lectin in complex with a branched pentasaccharide GlcNAcβ1-2Manα1-3(GlcNAcαβ1-2Manα1-6)Man to 2.7 Å. The pentasaccharide is depicted in the center. The tetrameric (more...) Comparison of the subunit structures of soybean agglutinin (A) complexed with a pentasaccharide containing Galβ1-4GlcNAc-R and human galectin-3 at 1.4 Å (B) complexed with Galβ1-4GlcNAc. Both lectins display a related β-barrel (more...) Relationships between sequences of L-type lectins from legumes compared with the phylogeny of the various species within the Fabaceae family of plants suggest that these lectins most probably arose from divergent evolution. It remains an open possibility that the tertiary structures of some of the other members of the “L-type lectin family” arose by convergent evolution. It must also be noted that for a protein to be firmly placed in the L-type lectin category it must have the lectin fold and glycan-binding activity.'
 'It remains an open possibility that the tertiary structures of some of the other members of the “L-type lectin family” arose by convergent evolution. It must also be noted that for a protein to be firmly placed in the L-type lectin category it must have the lectin fold and glycan-binding activity. All soluble L-type lectins found to date are multimeric proteins, although all do not have the same quaternary structure. Thus, these lectins are multivalent with more than one glycan-binding site per lectin molecule. The same multivalent principle applies to the membrane bound L-type lectins because the presence of two or more molecules on a membrane surface essentially presents a multivalent situation. In addition to increasing the avidity of the lectins for branched and/or cell-surface glycans, this multivalence can have great biological significance. Binding of the lectins to the cell surface can lead to aggregation of specific glycan receptors, promoting a variety of biological responses such as mitogenesis and various signal transduction processes. Plant L-type lectins are primarily found in the seeds of leguminous plants and are synthesized during seed development several weeks after flowering; they are transported to the vacuole where they become condensed into specialized vesicles called protein bodies. They are stable during desiccation of the seeds and can remain in that state indefinitely until the seeds germinate. They represent one of several classes of proteins stored in high concentrations in the seeds and are often called storage proteins. During seed germination, the storage bodies become the vacuoles of the cotyledons, which appear as the first leafy appendages of the plant. During the first week of development, these cotyledons provide food for the plant and eventually shrivel up and disappear. L-type lectins have also been found in the bark of some leguminous trees, and very low amounts of these lectins are also found in other vegetative tissues of legumes. In some cases, these latter lectins are encoded by separate but very similar genes. More than 100 of the seed legume L-type lectins have been characterized and are the most extensively studied proteins of this class.'
 'NCBI Bookshelf. A service of the National Library of Medicine, National Institutes of Health. Varki A, Cummings RD, Esko JD, et al., editors. Essentials of Glycobiology [Internet]. 4th edition. Cold Spring Harbor (NY): Cold Spring Harbor Laboratory Press; 2022.  doi: 10.1101/glycobiology.4e.32 Richard D. Cummings, Marilynn E. Etzler, T.N.C. Ramya, Koichi Kato, Gabriel A. Rabinovich, and Avadhesha Surolia. The L-type lectins occur in the seeds of leguminous plants. They have structural motifs present in a variety of glycan-binding proteins (GBPs) from other eukaryotic organisms. The structures of many of these lectins have been characterized, and many L-type lectins are used in a wide range of biomedical and analytical procedures and implicated in biomedical processes. This chapter discusses the structure–function relationships of these lectins and the various biological roles they have in different organisms. The L-type lectins have a rich history going back to the end of the 19th century when it was found that extracts from the seeds of leguminous plants (Fabaceae family but also called the Leguminosae family) could agglutinate red blood cells. These agglutinins (later named lectins) were found to be soluble proteins abundant in the seeds of leguminous plants. Different species of legumes were found to differ in hemagglutination specificity. Much work on these proteins was performed in the early part of the 20th century, including the crystallization of concanavalin A (ConA; the hemagglutinin [HA] from jack beans), which was first isolated by James Sumner in 1919 and crystallized in 1936 and was the first commercially available lectin. The legume lectins were also found to have hemagglutinating properties because of their ability to bind glycans on the cell surface.']","Loop A contains an invariant aspartate, which forms hydrogen bonds between its side chain and the glycan ligand. This amino acid is linked to its preceding amino acid (usually alanine) by a rare cis-peptide bond, which is stabilized by the metal ions and is necessary for the proper orientation of the aspartate in the combining site. Loop B contains an invariant glycine, which also forms hydrogen bonds with the ligand. An exception to this case is found in two lectins (ConA and the closely related Dioclea grandiflora lectin) in which the glycine is replaced with an arginine. Both the glycine and arginine form hydrogen bonds with the ligand via their main-chain amides. Loop C contains an invariant asparagine, which forms a hydrogen bond with the ligand via its side chain, and an invariant hydrophobic amino acid.","The glycan-binding and metal-binding sites are localized in close proximity to each other at the top of the “front” sheet. The glycan-binding site is composed of four loops: A, B, C, and D (Figure 32.3, top). These loops contain four invariant amino acids that are essential for carbohydrate binding (Figure 32.3, bottom). Loop A contains an invariant aspartate, which forms hydrogen bonds between its side chain and the glycan ligand. This amino acid is linked to its preceding amino acid (usually alanine) by a rare cis-peptide bond, which is stabilized by the metal ions and is necessary for the proper orientation of the aspartate in the combining site. Loop B contains an invariant glycine, which also forms hydrogen bonds with the ligand.",1.0,0.4125136496318768,0.817365075287784,0.010526315789473684,0.9999999999857143,1.0
"Complete the following paragraph: The original experiments of Neufeld showed that a portion of newly synthesized lysosomal enzymes are secreted into the medium, but may be recaptured by the same cell or by adjacent cells expressing cell-surface CI-MPRs (Figure 33.1). Enzymes that bind to such cell-surface MPRs are endocytosed via clathrin-coated pits and vesicles, eventually reaching the same late endosomal compartments in which newly synthesized molecules arrive from the Golgi.","['At steady state, MPRs are concentrated in the TGN and late endosomes, but they cycle constitutively between these organelles, early (sorting) endosomes, recycling endosomes, and the plasma membrane (Figure 33.5). MPRs avoid delivery to lysosomes, in which they would be degraded. This trafficking is governed by a number of short amino acid sorting signals in the cytoplasmic tails of the receptors. The TGN is the site in which newly synthesized lysosomal enzymes bind to MPRs that are then collected into clathrin-coated pits and packaged into clathrin-coated vesicles for delivery to the early endosome. This process involves interaction of the MPRs with two types of coat proteins: the GGAs (Golgi-localized, γ-ear–containing, ADP-ribosylation factor binding) and AP1 (adapter protein 1). In addition to binding MPRs, the coat proteins recruit clathrin for the assembly of clathrin-coated vesicles. Following delivery to early endosomes, lysosomal enzymes are released from MPRs as the endosomes mature to late endosomes and the pH decreases. Late endosomes then undergo dynamic fusion/fission with lysosomes, allowing selective transfer of lysosomal enzymes to the lysosomes and leaving the MPRs behind in subdomains of the late endosomes. These MPRs may then either return to the TGN mediated by a multiprotein retromer complex or move to the plasma membrane, in which internalization via clathrin-coated pits occurs, mediated by the coat protein AP2. There are several pathways for the MPRs to be returned to the TGN from the various endosomal compartments, although the relative importance of the different pathways is unclear. Subcellular trafficking pathways of glycoproteins, lysosomal enzymes, and M6P receptors (MPRs). Newly synthesized glycoproteins originating from the rough endoplasmic reticulum (ER) pass through the Golgi stacks and are then sorted to various destinations.'
 'Subcellular trafficking pathways of glycoproteins, lysosomal enzymes, and M6P receptors (MPRs). Newly synthesized glycoproteins originating from the rough endoplasmic reticulum (ER) pass through the Golgi stacks and are then sorted to various destinations. (more...) The original experiments of Neufeld showed that a portion of newly synthesized lysosomal enzymes are secreted into the medium, but may be recaptured by the same cell or by adjacent cells expressing cell-surface CI-MPRs (Figure 33.1). Enzymes that bind to such cell-surface MPRs are endocytosed via clathrin-coated pits and vesicles, eventually reaching the same late endosomal compartments in which newly synthesized molecules arrive from the Golgi. This secretion–recapture pathway is a minor one in most cells, but plays a critical role in enzyme replacement therapy. As described in Chapter 44, there are many genetic disorders in glycan degradation that result from decreased activity of a given lysosomal enzyme. Some of these enzymes that are targeted to lysosomes via the M6P pathway have been prepared in large quantities as recombinant soluble proteins and used in enzyme replacement therapy. To date, the benefits have been variable but less than optimal. There are a number of potential reasons for this. First, some of the preparations may not contain the physiologic complement of the phosphomannosyl recognition marker. It is reasonable to suggest that a greater M6P content may improve the efficacy of enzyme replacement in these patients. This has been shown to be the case in mouse and dog model systems. However, even with fully phosphorylated enzymes there may be obstacles that are difficult to overcome. For example, some cell types in the body may not express adequate levels of the CI-MPR on their surfaces to endocytose sufficient enzyme to restore normal lysosomal function. Also, the organ that is most seriously affected in many of these diseases (the brain) is inaccessible because of the blood–brain barrier.'
 'The CI-MPR adopts a more compact structure under acidic conditions that may facilitate unloading of lysosomal enzymes in the acidic environment of endosomal compartments. Targeted disruption of the CD-MPR gene in mice is associated with normal or only slightly elevated levels of lysosomal enzymes in the circulation and an otherwise grossly normal phenotype. However, thymocytes or primary cultured fibroblasts from such mice show an increase in the amount of phosphorylated lysosomal enzymes secreted into the medium. This indicates that mechanisms exist, which can compensate for the deficiency in vivo. Intravenous injection of inhibitors of other glycan-specific receptors capable of mediating endocytosis (e.g., the mannose receptor of macrophages and the asialoglycoprotein receptor of hepatocytes; see Chapter 34) gives rise to a marked increase in lysosomal enzymes in the serum of the deficient mice. Thus, such receptors are likely part of the compensatory mechanisms in vivo. Like fibroblasts that lack only CD-MPR, fibroblasts that lack only CI-MPR have a partial impairment in sorting. Fibroblasts from embryos that lack both receptors show a massive missorting of multiple lysosomal enzymes. Thus, both receptors are required for efficient intracellular targeting of lysosomal enzymes. Comparison of lysosomal enzymes secreted by the different cell types indicates that the two receptors may interact preferentially with different subgroups of enzymes. Thus, the structural heterogeneity of the M6P recognition marker within a single lysosomal enzyme and between different enzymes is one explanation for the evolution of two MPRs with complementary binding properties: that is, to provide an efficient but varied targeting of lysosomal proteins in different cell types or tissues. What initially appeared to be a precise lock-and-key mechanism turned out to be a far more complex and flexible system, with functionally useful biological flexibility. At steady state, MPRs are concentrated in the TGN and late endosomes, but they cycle constitutively between these organelles, early (sorting) endosomes, recycling endosomes, and the plasma membrane (Figure 33.5). MPRs avoid delivery to lysosomes, in which they would be degraded.'
 'For example, some cell types in the body may not express adequate levels of the CI-MPR on their surfaces to endocytose sufficient enzyme to restore normal lysosomal function. Also, the organ that is most seriously affected in many of these diseases (the brain) is inaccessible because of the blood–brain barrier. Although the first intraventricular M6P-dependent enzyme replacement therapy for children deficient for the lysosomal tripeptidyl peptidase 1 are very promising, further studies are needed. Although the MPR pathway has a major role in vertebrate lysosomal enzyme trafficking, its contribution in invertebrate systems is not prominent. Lysosomal enzymes are targeted in organisms such as Saccharomyces, Trypanosoma, and Dictyostelium, without the aid of identifiable MPRs. The slime mold Dictyostelium discoideum produces a novel methylphosphomannose structure on some of its lysosomal enzymes that can be recognized in vitro by the mammalian CI-MPR (not the CD-MPR). However, despite the presence of a GlcNAc-P-T that recognizes α1-2-linked mannose residues, the enzyme does not specifically recognize lysosomal enzymes, and no receptor for M6P has been found in this organism. Additionally, the Dictyostelium GlcNAc-P-T appears to differ from its mammalian hexameric counterpart because sequences related to the γ subunit have not been found in the Dictyostelium genome. The protozoan Acanthamoeba produces a GlcNAc-P-T that specifically recognizes lysosomal enzymes. However, this organism lacks a gene that could encode an “uncovering” enzyme, and so would not be expected to form M6P available to an MPR. Although some additional “lower” organisms do show evidence for an uncovering enzyme, no MPR activity has yet been found. The evolutionary divergence point at which the complete MPR system became established remains to be defined. Although originally discovered as a receptor for lysosomal enzyme trafficking, the CI-MPR turns out to be a remarkably multifunctional molecule (Figure 33.4A).'
 'Early studies of human genetic “storage disorders” by Elizabeth Neufeld indicated a failure to degrade cellular components, which therefore accumulated in lysosomes (Chapter 44). Soluble corrective factors from normal cells could reverse these defects when added to the culture media. These factors were later identified as lysosomal enzymes that were found to be deficient in patients with storage disorders. These enzymes, secreted in small quantities by normal cells in culture, or by cells from patients with a different “complementary” defect (Figure 33.1), existed in two forms: a “high-uptake” form, recognized by saturable, high-affinity receptors that could correct the defect in deficient cells, and an inactive “low-uptake” form that could not correct. Cross-correction of lysosomal enzyme deficiencies in cultured cells. Small amounts of high-uptake lysosomal enzymes secreted by normal fibroblasts (thin arrows) were taken up by fibroblasts from a patient with a genetic lack of a single lysosomal enzyme, (more...) Fibroblasts from patients with a rare genetic disease showing prominent inclusion bodies in cultured cells (therefore termed “I-cell” disease) were found to be deficient in almost all lysosomal enzymes. Interestingly, all these enzymes are actually synthesized by I-cells, but are mostly secreted into the medium, instead of being retained in lysosomes. Neufeld showed that although I-cells incorporated the high-uptake enzymes secreted by normal cells, enzymes secreted by I-cells were not taken up by other cells (Figure 33.1). She therefore proposed that I-cell disease results from a failure to add a common recognition marker to lysosomal enzymes. This marker was assumed to be responsible for the proper trafficking of newly synthesized enzymes to lysosomes in normal cells. The “high-uptake” property was destroyed by strong periodate treatment, which oxidizes vicinal hydroxyl groups in glycans, predicting that the recognition marker was a glycan. High uptake of lysosomal enzymes was next found, by William Sly, to be blocked by M6P and its stereoisomer fructose 1-phosphate, but not by other sugar phosphates.'
 'A sizable fraction of nascent proteins fail quality control of folding and assembly in the rER (Chapter 39) and are retrotranslocated to the cytoplasm as a part of ERAD (ER-associated degradation), as depicted in Figure 18.1H. Most of these are N-glycosylated and normally processed by a cytoplasmic N-glycanase (NGLY1) or an endo-β-N-acetylglucosaminidase (ENGase) to remove their N-glycans before their degradation by the 26S-proteasome or an autophagic vacuole. There are also N-glycan-dependent E3 ubiquitin ligases that assemble polyubiquitin chains that serve as a signal for proteasomal degradation. Interestingly, NGLY1 is essential for mitochondrial turnover via mitophagy, although evidence suggests it functions via a role other than deglycosylating mitochondrial proteins. If these processes do not operate on a given protein, because the N-glycan is modified in such a way that it is not recognized or is sequestered in a protein complex or the nucleus, then it may accumulate in the cytoplasm and potentially execute a novel function that might depend on its ER-derived glycan. In addition, there is evidence that endocytosed proteins, such as cholera toxin, can access the rER via retrograde transport and then enter the cytoplasm via retrotranslocation or a related process. Other studies suggest that glycoproteins conventionally secreted or transported to the plasma membrane have the potential to later move to the nucleus (Figure 18.1I). This includes cytokines, growth factors, and sometimes their transmembrane receptors, some of which have been reported to exert direct effects on transcription. For example, fragments of the neural cell adhesion molecule (NCAM), which is modified by polysialic acid, appear to be internalized into cells in which they differentially impact transcriptional programs according to their polysialic acid content. These findings have been considered controversial because the mechanism of such translocation remains mysterious. Different approaches support the occurrence of nucleus-associated glycoproteins.'
 ""Crystal structures of recombinant forms of the CI-MPR have also been solved that encompass all but two of the 15 contiguous domains in its extracellular region (i.e., domains 1–5, domains 7–11, and domains 11–14). Each domain shows a topology similar to that of the CD-MPR. Cryo-electron microscopy (cryo-EM) of the CI-MPR isolated from bovine liver has been carried out under conditions: (1) not conducive to ligand binding (pH 4.5), and (2) found at the cell surface (pH 7.4) and bound to the non-glycosylated ligand, insulin-like growth factor II (IGF-II) via CI-MPR's domain 11. Although the cryo-EM structure at pH 7.4 is unable to visualize the N- (domains 1–3) and C- (domain 15) termini with sufficient resolution, it does provide insight into the arrangement of the entire extracellular region of the CI-MPR. The proposed cryo-EM model does not position the two M6P-binding domains (3 and 9) sufficiently close to bind a single, diphosphorylated N-glycan. This suggests that the high-affinity binding of this N-glycan is due to the spanning of binding sites located on different monomers of the CI-MPR. An alternative possibility is that the receptor is dynamic, with the spacing between the two M6P-binding sites being flexible, to enhance interactions with lysosomal enzymes containing phosphorylated glycans at various positions on their protein backbones. The dynamic nature of the receptor is supported by structural and biophysical studies which show that the conformation of the CI-MPR is affected by pH. The CI-MPR adopts a more compact structure under acidic conditions that may facilitate unloading of lysosomal enzymes in the acidic environment of endosomal compartments. Targeted disruption of the CD-MPR gene in mice is associated with normal or only slightly elevated levels of lysosomal enzymes in the circulation and an otherwise grossly normal phenotype.""]","This secretion-recapture pathway, as demonstrated by Neufeld's experiments, involves the endocytosis of lysosomal enzymes that bind to cell-surface CI-MPRs via clathrin-coated pits and vesicles. These enzymes are then transported to late endosomal compartments, where they can interact with newly synthesized molecules arriving from the Golgi.","This secretion–recapture pathway is a minor one in most cells, but plays a critical role in enzyme replacement therapy. As described in Chapter 44, there are many genetic disorders in glycan degradation that result from decreased activity of a given lysosomal enzyme. Some of these enzymes that are targeted to lysosomes via the M6P pathway have been prepared in large quantities as recombinant soluble proteins and used in enzyme replacement therapy. To date, the benefits have been variable but less than optimal. There are a number of potential reasons for this. First, some of the preparations may not contain the physiologic complement of the phosphomannosyl recognition marker. It is reasonable to suggest that a greater M6P content may improve the efficacy of enzyme replacement in these patients. This has been shown to be the case in mouse and dog model systems. However, even with fully phosphorylated enzymes there may be obstacles that are difficult to overcome. For example, some cell types in the body may not express adequate levels of the CI-MPR on their surfaces to endocytose sufficient enzyme to restore normal lysosomal function. Also, the organ that is most seriously affected in many of these diseases (the brain) is inaccessible because of the blood–brain barrier. Although the first intraventricular M6P-dependent enzyme replacement therapy for children deficient for the lysosomal tripeptidyl peptidase 1 are very promising, further studies are needed.",0.75,0.7437117649903816,0.6095475616681427,0.022988505747126436,0.9999999999857143,0.8333333333333334
"Complete the following paragraph: C-type lectins (CTLs) are Ca++-dependent glycan-binding proteins (GBPs) that share primary and secondary structural homology in their carbohydrate-recognition domains (CRDs). The CRD of CTLs is more generally defined as the CTL domain (CTLD), because not all proteins with this domain bind either glycans or Ca++.","['NCBI Bookshelf. A service of the National Library of Medicine, National Institutes of Health. Varki A, Cummings RD, Esko JD, et al., editors. Essentials of Glycobiology [Internet]. 4th edition. Cold Spring Harbor (NY): Cold Spring Harbor Laboratory Press; 2022.  doi: 10.1101/glycobiology.4e.34 Richard D. Cummings, Elise Chiffoleau, Yvette van Kooyk, and Rodger P. McEver. C-type lectins (CTLs) are Ca++-dependent glycan-binding proteins (GBPs) that share primary and secondary structural homology in their carbohydrate-recognition domains (CRDs). The CRD of CTLs is more generally defined as the CTL domain (CTLD), because not all proteins with this domain bind either glycans or Ca++. CTLs include collectins, selectins, endocytic receptors, and proteoglycans, some of which are secreted and others are transmembrane proteins. They often oligomerize, which increases their avidity for multivalent ligands and enhance recognition of pattern recognition receptor (PRRs). CTLs differ significantly in the types of ligands that they recognize with high affinity (e.g., glycans, proteins, lipids, and inorganic compounds). These proteins that recognize pathogens or self-expressed ligands function as adhesion, phagocytic, and signaling receptors in many pathways, including homeostasis and innate and adaptive immunity, and are crucial in inflammatory responses, leukocyte and platelet trafficking, and tissue remodeling. The CTL family is remarkably diverse and is the largest family of known GBPs. The first CTL identified in animals was the hepatic asialoglycoprotein receptor (ASGPR), also termed the hepatic Gal/GalNAc receptor or Ashwell–Morell receptor (AMR). The sequences of the AMR and other CTLs revealed a CRD unique to this family of proteins.'
 'The first CTL identified in animals was the hepatic asialoglycoprotein receptor (ASGPR), also termed the hepatic Gal/GalNAc receptor or Ashwell–Morell receptor (AMR). The sequences of the AMR and other CTLs revealed a CRD unique to this family of proteins. Glycan binding by CTLs is typically Ca++-dependent because of specific amino acid residues that coordinate Ca++ and bind the hydroxyl groups of sugars, but some CTLDs bind glycans without coordinating Ca++. The CTLD is defined by the sequence of amino acids and Cys positions, as well as the folded structure. Interestingly, comparisons of the folded structure of the CTLD to that in other proteins revealed a common folded structure, termed the CTL fold (CTLF), which is a structurally rigid scaffold that comprises a remarkable number of sequence variations, yet may have no sequence in common with CTLs, such as the major tropism determinant (Mtd), which is a receptor-binding protein of Bordetella bacteriophage. The evolutionarily ancient CTLF may occur in at least 1013 different sequences, a diversity that rivals the immunoglobulin fold in its conservation of structure using millions of different primary amino acid sequences. The CRD of CTLs is a compact region of 110–130 amino acid residues with a double-looped, two-stranded antiparallel β-sheet formed by the amino- and carboxy-terminal residues connected by two α-helices and a three-stranded antiparallel β-sheet (Figure 34.1). The CRD has two conserved disulfide bonds and up to four sites for binding Ca++, with site occupancy depending on the lectin. Amino acid residues with carbonyl side chains are often coordinated to Ca++ in the CRD, and these residues directly bind to sugars when Ca++ is bound in site 2. A ternary complex may form between a sugar, the Ca++ ion in site 2, and amino acids within the CRD, whereas the specific residues within the CRD determine sugar specificity.'
 '(Light green spheres) Ca++-binding sites, where 1 is the auxiliary binding site and 2 is the principal binding (more...) CTLs occur as both monomers and oligomers, such as the trimeric rat mannose-binding protein (MBP)-A (Figure 34.2). The rat MBP was the first CTL structurally characterized with ligand by crystallography. The CRD of trimeric lectins is angled to the side of the stalk domain through which the protein associates to form the trimer. The CRDs are at the top of the trimer and enhance multivalent interactions with glycan ligands. Crystal structure of trimeric rat mannose-binding protein-A complexed with α-methylmannoside. (Created from PDB deposited structure 1kwu and with permission of the American Society for Biochemistry and Biology from Ng KK, et al. 2002. J Biol Chem (more...) CTLDs have been categorized into 16 groups that are distinguished by their domain architecture. There are 86 proteins encoded in the human genome that contain a CTLD (mice have 123) (Figure 34.3). Most of these groups have a single CTLD, but the macrophage mannose receptor (group 6) is an example of a multi-CTLD protein and has eight of these domains. Several groups have CTLDs that lack critical Ca++ residues, but can bind glycans (e.g., dectin-1 and layilin in group 5); the REG group 7 lacks Ca++ binding but it is unclear whether they bind glycans, whereas tetranectin in group 9 binds Ca++ and again it is unclear if it binds glycans. From a functional perspective, we know most about collectins, endocytic receptors, myeloid lectins, and selectins, as discussed below. Different groups of C-type lectins (CTLs) and their domain structures. (A) Sixteen groups are shown, defined by their phylogenetic relationships and domain structures. Some of the groups are soluble proteins and others are transmembrane proteins.'
