question,contexts,answer,ground_truth,faithfulness,answer_relevancy,answer_similarity,context_relevancy,context_precision,context_recall
"Complete the following paragraph: A more complete paradigm of molecular biology must therefore include glycans, often in covalent combination with other macromolecules (i.e., glycoconjugates, such as glycoproteins and glycolipids). In analogy to the current situation in Cosmology, glycans can be considered as the “dark matter” of the biological universe: a major and critical component that has yet to be fully incorporated into the “standard model” of biology.","['In addition, simple, rapidly turning over, protein-bound glycans are abundant within the nucleus and cytoplasm, in which they can serve as regulatory switches. A more complete paradigm of molecular biology must therefore include glycans, often in covalent combination with other macromolecules (i.e., glycoconjugates, such as glycoproteins and glycolipids). In analogy to the current situation in Cosmology, glycans can be considered as the “dark matter” of the biological universe: a major and critical component that has yet to be fully incorporated into the “standard model” of biology. However, unlike the situation with dark matter in the Universe, there is already a lot known about glycans. The chemistry and metabolism of carbohydrates were prominent matters of interest in the first part of the 20th century. Although engendering much attention, they were primarily considered as a source of energy or as structural materials, apparently lacking other biological activities.'
 'With ongoing sequencing of numerous genomes, spectacular gains in understanding the biology of nucleic acids and proteins have occurred. Thus, many scientists assume that studying just these molecules will explain the makeup of cells, tissues, organs, physiological systems, and intact organisms. In fact, making a cell requires many small molecule metabolites as well as two other major classes of macromolecules—lipids and carbohydrates—which serve as intermediates in generating energy and as signaling effectors, recognition markers, and structural components. Taken together with the fact that they encompass some of the major posttranslational modifications of proteins, lipids, and carbohydrates help explain how the relatively small number of genes in the typical genome can generate the enormous biological complexities inherent in the development, growth, and functioning of diverse organisms. The biological roles of carbohydrates are particularly prominent in the assembly of complex multicellular organs and organisms, which requires interactions between cells and the surrounding matrix.'
 'The major glycan classes discussed in the book are described, and an overview of the general pathways for their biosynthesis is provided. Topological issues relevant to biosynthesis and functions of glycoconjugates are also considered, and the growing role of these molecules in medicine, biotechnology, nanotechnology, bioenergy, and materials science is mentioned. Defined in the broadest sense, glycobiology is the study of the structure, biosynthesis, biology, and evolution of saccharides (also called carbohydrates, sugar chains, or glycans) that are widely distributed in nature and of the proteins that recognize them. How does glycobiology fit into the modern concepts of molecular biology? The central paradigm driving research in molecular biology has been that biological information flows from DNA to RNA to protein. The power of this concept lies in its template-based precision, the ability to manipulate one class of molecules based on knowledge of another, and the patterns of sequence homology and relatedness that predict function and reveal evolutionary relationships.'
 'Mixtures of glycans need to be studied next, to mimic “clustered saccharide patches” that more closely mimic natural states. Significant progress has also been made in Systems Glycobiology by better integration of glycomics with genomics, transcriptomics, and proteomics. Our understanding as to how miRNAs and transcription factors regulate glycan expression has also improved in the last few years (Chapters 51 and 52). At the present time, the study of glycan structure/function relationships requires highly specialized expertise in synthetic and analytical chemistry. The inherent difficulty in studying glycans remains a major challenge preventing glycobiology—the study of glycan function—from entering mainstream conceptual frameworks of biology. In response to this challenge, strong emphasis has recently been placed on the development of facile technologies that will allow nonglycobiologists without specialized analytical chemistry skills to study glycans in a meaningful way.'
 'Although engendering much attention, they were primarily considered as a source of energy or as structural materials, apparently lacking other biological activities. Furthermore, during the molecular biology revolution of the 1970s, studies of glycans lagged far behind those of other major classes of molecules. This was in part because of their inherent structural complexity, the difficulty in determining their sequences, and the fact that their biosynthesis could not be directly predicted from a DNA template. The development of many new technologies for exploring the structures and functions of glycans has since opened a new frontier of molecular biology called “glycobiology”—a word first coined in the late 1980s to recognize the coming together of the traditional disciplines of carbohydrate chemistry and biochemistry with a modern understanding of the cell and molecular biology of glycans and, in particular, their conjugates with proteins and lipids. Glycobiology is now one of the more rapidly growing fields in the natural sciences, with broad relevance to many areas of basic research, biomedicine, and biotechnology.'
 'Given all these major advances in basic and applied research on glycans, there is no reason why this major class of biomolecules should continue to be the “dark matter of the biological universe.” However, since the 1980s an entire generation of scientists have been largely trained without much exposure to, or knowledge of, glycans. Thus, it will still be awhile before these molecules return to their rightful place in the mainstream of thinking in conventional molecular and cellular biology and medicine. Continued advances in basic and applied research on glycans will occur, but this needs to be coupled with the training of a new generation of scientists, engineers, and physicians for whom these molecules will be an obvious aspect of their understanding of living systems in health and disease.'
 '), remain the most prominent entities in molecular biology databases and repositories. Scientists gather sequence-centered information in the course of elucidating a cellular process or a pathological behavior, simply because a gene/protein sequence is usually the common element shared across -omics domains. The problem here is that glycans are only linked to the gene via their biosynthetic enzymes and substrates. The advancement of glycoscience as a discipline depends on expanding the integration of data describing glycoproteins, glycolipids, glycosaminoglycans, lipopolysaccharides, and the genome-coded enzymatic machinery that generates or breaks down these glycans, together with the ever-increasing information about the interactions of these glycoconjugates with other components of the cell. It is the ultimate goal of glycoscience research to be able to link glycan structures with their function.']","The study of glycobiology, which encompasses the structure, biosynthesis, biology, and evolution of saccharides, plays a crucial role in understanding the complexity of biological systems. Glycans, including glycoproteins and glycolipids, serve as regulatory switches within cells and are essential for various biological activities. Despite their importance, glycans have historically been overlooked in molecular biology, similar to how dark matter is a significant yet not fully understood component of the universe. As advancements continue in glycoscience research and the training of scientists in this field, glycans are gradually gaining recognition and integration into mainstream biological frameworks.","However, unlike the situation with dark matter in the Universe, there is already a lot known about glycans. The chemistry and metabolism of carbohydrates were prominent matters of interest in the first part of the 20th century. Although engendering much attention, they were primarily considered as a source of energy or as structural materials, apparently lacking other biological activities. Furthermore, during the molecular biology revolution of the 1970s, studies of glycans lagged far behind those of other major classes of molecules. This was in part because of their inherent structural complexity, the difficulty in determining their sequences, and the fact that their biosynthesis could not be directly predicted from a DNA template.",1.0,0.6275600375565363,0.7531580598476999,0.05405405405405406,0.9999999999857143,1.0
"Complete the following paragraph: Monosaccharide names are frequently abbreviated; most common are three-letter abbreviations for simple monosaccharides (e.g., Gal, Glc, Man, Xyl, Fuc). There are nine common monosaccharides found in vertebrate glycoconjugates (Figure 2.4). Once incorporated into a glycan, these nine monosaccharide building blocks can be further modified to generate additional sugar structures.","['There are nine common monosaccharides found in vertebrate glycoconjugates (Figure 2.4). Once incorporated into a glycan, these nine monosaccharide building blocks can be further modified to generate additional sugar structures. For example, glucuronic acid (GlcA) can be epimerized at C-5 to generate IdoA. Many more monosaccharides exist in glycoconjugates from other species and as intermediates in metabolism. We use a symbolic notation for the monosaccharides that are most abundant in vertebrate glycoconjugates (see Chapter 1). Common monosaccharides found in vertebrates. N-Acetylneuraminic acid is the most common form of sialic acid.  Monosaccharides exist in solution as an equilibrium mixture of acyclic and cyclic forms. The percentage of each form depends on the sugar structure.'
 'Of course, the great majority of glycans in most species have yet to be discovered and structurally defined. Thus, much of the possible diversity may yet exist in nature. Although several hundred distinct monosaccharides are known in nature, only a minority of these are commonly found in well-studied glycans. Examples of common monosaccharides in vertebrate cells are listed below, along with their standard abbreviations (for details regarding their structures, see Chapter 2, and embedded links from the symbols in Online Appendix 1B). Pentoses: five-carbon neutral sugars—D-xylose (Xyl)Hexoses: six-carbon neutral sugars—for example, D-glucose (Glc)Hexosamines: hexoses with an amino group at the 2-position, which can be either free or, more commonly, N-acetylated—for example, N-acetyl-D-glucosamine (GlcNAc)6-Deoxyhexoses: for example,'
 'Most vertebrate monosaccharides have the D configuration with the exception of fucose and iduronic acid (IdoA) L sugars. The Fischer projections shown in Figure 2.3 illustrate the acyclic structures of all D-aldoses through the aldohexose group. D- and L-glucopyranose in Fischer projection and chair conformation.  Fischer projections for the acyclic forms of the D series of aldoses, ranging from triose to hexose.  Any two sugars that differ only in the configuration around a single chiral carbon atom are called epimers. For example, D-mannose is the C-2 epimer of D-glucose, whereas D-galactose is the C-4 epimer of D-glucose (Figure 2.4). Monosaccharide names are frequently abbreviated; most common are three-letter abbreviations for simple monosaccharides (e.g., Gal, Glc, Man, Xyl, Fuc).'
 'the symbols D- and L- are omitted from the full names of common monosaccharides from here on unless a less common variant occurs. This limited set of monosaccharides dominates the glycobiology of more recently evolved (so-called “higher”) animals, but several others have been found in “lower” animals (e.g., tyvelose [Chapters 25 and 26], bacteria and Archaea [e.g., keto-deoxyoctulosonic acid, rhamnose, L-arabinose, and muramic acid; Chapters 21 and 22], and plants [e.g., arabinose, apiose, and galacturonic acid; Chapter 24]). A variety of modifications of glycans further enhance their diversity in nature and often serve to mediate specific biological functions. Thus, the hydroxyl groups of different monosaccharides can be subject to modifications such as phosphorylation, sulfation, methylation, O-acetylation, or fatty acylation.'
 'more commonly, N-acetylated—for example, N-acetyl-D-glucosamine (GlcNAc)6-Deoxyhexoses: for example, L-fucose (Fuc)Uronic acids: hexoses with a carboxylate at the 6-position—for example, D-glucuronic acid (GlcA)Nonulosonic acids: family of nine-carbon acidic sugars, of which the most common in animals is the sialic acid N-acetylneuraminic acid (Neu5Ac, also sometimes called NeuAc or, historically, NANA) (see Chapter 15) For simplicity, the symbols D- and L- are omitted from the full names of common monosaccharides from here on unless a less common variant occurs.'
 'A monosaccharide is a carbohydrate that usually cannot be hydrolyzed into a simpler form. It has a potential carbonyl group at the end of the carbon chain (an aldehyde group) or at an inner carbon (a ketone group). These two types of monosaccharides are therefore named aldoses and ketoses, respectively (for examples, see below, and for more details, see Chapter 2). Free monosaccharides can exist in open-chain or ring forms (Figure 1.2). Ring forms of the monosaccharides are the general rule in oligosaccharides, which are linear or branched chains of monosaccharides attached to one another via glycosidic linkages (the term “polysaccharide” is typically used for large glycans composed of repeating oligosaccharide motifs; for examples, see Chapter 3).'
 'The classification of monosaccharide structures began in the late 19th century with the pioneering work of Emil Fischer. All simple monosaccharides have the general empirical formula Cx(H2O)n, where n is an integer ranging from 3 to 9. As mentioned briefly in Chapter 1, all monosaccharides consist of a chain of chiral hydroxymethylene units, which terminates at one end with a hydroxymethyl group and at the other with either an aldehyde group (aldoses) or an α-hydroxy ketone group (ketoses). Glyceraldehyde is the simplest aldose and dihydroxyacetone is the simplest ketose (Figure 2.1). The structures of glyceraldehyde and dihydroxyacetone are distinct in that glyceraldehyde contains an asymmetric (chiral) carbon atom (Figure 2.1), whereas dihydroxyacetone does not.']",N-Acetylneuraminic acid is the most common form of sialic acid. Monosaccharides exist in solution as an equilibrium mixture of acyclic and cyclic forms. The percentage of each form depends on the sugar structure.,"For example, glucuronic acid (GlcA) can be epimerized at C-5 to generate IdoA. Many more monosaccharides exist in glycoconjugates from other species and as intermediates in metabolism. We use a symbolic notation for the monosaccharides that are most abundant in vertebrate glycoconjugates (see Chapter 1). Common monosaccharides found in vertebrates. N-Acetylneuraminic acid is the most common form of sialic acid.  Monosaccharides exist in solution as an equilibrium mixture of acyclic and cyclic forms. The percentage of each form depends on the sugar structure. The cyclic form of a monosaccharide is characterized by a hemiacetal group formed by the reaction of one of the hydroxyl groups with the C-1 aldehyde or ketone. For reasons of chemical stability, five- and six-membered rings are most commonly formed from acyclic monosaccharides. Hexoses (six-carbon aldoses) and hexuloses (six-carbon ketoses) form six-membered rings via a C-1—O—C-5 ring closure; they form five-membered rings through a C-1—O—C-4 ring closure (Figure 2.5). A five-membered cyclic hemiacetal is labeled a “furanose” and a six-membered cyclic hemiacetal is called a “pyranose.” Pentoses can form both pyranose and furanose forms. Cyclization of acyclic D-glucose to form pyranose and furanose structures. The cyclization reaction produces both the α and β anomers (i.e., C-1 epimers).",0.5,0.4835658633236606,0.754552276678264,0.027777777777777776,0.759523809508619,0.4166666666666667
"Complete the following paragraph: In solution, NMR studies show IdoA2S and IdoA residues to be present in a mixture of 1C4 and 2S0 conformations. The conformational flexibility in IdoA residues likely allows orientation of the sulfate groups in HS to maximize the binding affinity to proteins.","['Until now, only the 4C1 chair conformation has been verified experimentally for GlcA and GlcN in HS, but both the 1C4 chair and the 2S0 conformations have been found for IdoA2S residues in crystal structures containing HS. In solution, NMR studies show IdoA2S and IdoA residues to be present in a mixture of 1C4 and 2S0 conformations. The conformational flexibility in IdoA residues likely allows orientation of the sulfate groups in HS to maximize the binding affinity to proteins. Structural elements that dictate preferences for one form over the other, including the possible effects from the sulfated monosaccharide sequences around the IdoA/IdoA2S residue, are subject to further investigation. A second factor contributing to structural diversity and selective interactions with certain HS-binding proteins is the size of the sulfated saccharide domains.'
 'In many cases when a protein binds to an HS chain, it induces a change in conformation of the IdoA2S residue resulting in a better fit and enhanced binding. IdoA2S residues have always been found in domains rich in N-sulfo and O-sulfo groups (for biosynthetic reasons; Chapter 17), which is also where proteins usually bind. Thus, the greater degree of conformational flexibility in these modified regions may explain why so many more proteins bind with high affinity to heparin, HS, and DS than to other GAGs. The presence of an N-acetyl group in an N-acetylglucosamine residue changes the preferred conformation of the neighboring IdoA residue, showing that even minor modifications can influence conformation and chain flexibility. Binding to GAGs that have a low degree of sulfation may require larger domains in the protein to interact with longer stretches of an oligosaccharide.'
 'Inspection of heparin oligosaccharides containing highly modified domains ([GlcNS6S-IdoA2S]n) shows that the N-sulfo and 2-O-sulfo groups of each disaccharide repeat lie on opposite sides of the helix from the 6-O-sulfo and carboxyl groups (Figure 38.1). Analysis of the conformation of individual sugars shows that N-acetylglucosamine and glucuronic acid residues assume a preferred conformation in solution, designated 4C1 (indicating that carbon 4 is above the plane defined by carbons 2, 3, and 5 and the ring oxygen, and that carbon 1 is below the plane; Chapter 2). In contrast, IdoA2S assumes the 1C4 or the 2S0 conformation (Figure 38.1), which reorients the position of the sulfo substituents, thereby creating a different orientation of charged groups.'
 'Also, heparin, a highly sulfated form of HS, is a commonly used anticoagulant drug in the clinic. A more complete discussion of the biological function of HS can be found in Chapters 17 and Chapter 38. This section uses the interaction between HS and proteins to illustrate how structural factors affect binding between GAGs and proteins in general. One factor that contributes to the structural diversity of HS-protein interactions is the conformational flexibility of L-IdoA and its derivative, L-IdoA2S (2-O-sulfo iduronic acid). Present in the pyranose form, the six-membered ring structure of IdoA or IdoA2S can adopt either chair or skew-boat conformations (Figure 3.3B).'
 'A second factor contributing to structural diversity and selective interactions with certain HS-binding proteins is the size of the sulfated saccharide domains. HS isolated from natural sources shows domain-like structures, with clusters of six to eight saccharides forming the highly sulfated domains known as S-domains. These regions are separated by nonsulfated saccharide residues, consisting of GlcA-GlcNAc RUs, known as NAc-domains. The S-domains contain primarily IdoA residues that likely contribute the flexibility needed to optimize binding to proteins and elicit desired biological activities. The contribution of NAc-domains to the functions of HS has not been fully established. However, a possible role may be to appropriately position S-domains in a single polysaccharide chain for interaction with multiple proteins. One example is the interaction of heparin with antithrombin and thrombin.'
 'Despite the interest in the roles of these interactions in cell migration and differentiation, there are relatively few experimental structures depicting interactions with large HS fragments. The fact that suitable crystals are less apt to form in the presence of HS oligomers contributes to the lack of structures of complexes. Also, it is difficult to obtain homogeneous preparations of large oligomers, because of the variable sulfation patterns and variable conversion of GlcA to IdoA. Computational modeling offers an alternative route to structures for many of these complexes. Specific patterns of sulfation and IdoA substitution are generated with ease. Yet, there are some challenges related to the flexibility of the HS chains and the ionic character of interactions that dominate their energetics; glycosidic angles in HS chains are variable, and IdoA rings sample several conformations, including a chair, 1C4, and a skew-boat conformer, 2S0.'
 'Binding to GAGs that have a low degree of sulfation may require larger domains in the protein to interact with longer stretches of an oligosaccharide. Molecular dynamic simulations on large heparin oligosaccharides, even in the presence of proteins, are possible with recent advances in computer performance (Online Appendix 38A). Such simulations can be used to predict the conformational flexibility of different domains within the chain and, when combined with recent advances in protein–GAG docking, can provide additional insights into GAG–protein interactions. Conformation of heparin oligosaccharides. (A) Glucosamine (GlcN) and glucuronic acid (GlcA) exist in the 4C1 conformation, whereas iduronic acid (IdoA) exists in equally energetic conformations designated 1C4 and 2S0.']","The conformational flexibility in IdoA residues likely allows orientation of the sulfate groups in HS to maximize the binding affinity to proteins. This flexibility enables the IdoA residues to adopt a mixture of 1C4 and 2S0 conformations, which may play a crucial role in optimizing the interactions between HS and proteins.","Structural elements that dictate preferences for one form over the other, including the possible effects from the sulfated monosaccharide sequences around the IdoA/IdoA2S residue, are subject to further investigation. A second factor contributing to structural diversity and selective interactions with certain HS-binding proteins is the size of the sulfated saccharide domains. HS isolated from natural sources shows domain-like structures, with clusters of six to eight saccharides forming the highly sulfated domains known as S-domains. These regions are separated by nonsulfated saccharide residues, consisting of GlcA-GlcNAc RUs, known as NAc-domains. The S-domains contain primarily IdoA residues that likely contribute the flexibility needed to optimize binding to proteins and elicit desired biological activities.",1.0,0.756378285524229,0.7508382670318363,0.05555555555555555,0.9999999999857143,1.0
"Complete the following paragraph: After more than three billion years of evolution, every free-living cell and every cell type within eukaryotic organisms remains covered with a dense and complex layer of glycans (Chapter 20). Even enveloped viruses that bud from infected cells carry with them the glycosylation patterns of the host. Additionally, most secreted molecules are glycosylated and extracellular matrices of multicellular organisms are rich in glycans and glycoconjugates. Matrices secreted by unicellular organisms when they congregate (e.g., bacterial biofilms [Chapter 21]) also contain glycans. Thus, evolution has repeatedly and consistently selected glycans as being the most diverse and flexible molecules to position at the interface between cells and the extracellular milieu.","['The focus is mostly on the organization of glycosylation in eukaryotic cells. Chapters 21 and 22 further address prokaryotic glycosylation mechanisms. After more than three billion years of evolution, every free-living cell and every cell type within eukaryotic organisms remains covered with a dense and complex layer of glycans (Chapter 20). Even enveloped viruses that bud from infected cells carry with them the glycosylation patterns of the host. Additionally, most secreted molecules are glycosylated and extracellular matrices of multicellular organisms are rich in glycans and glycoconjugates. Matrices secreted by unicellular organisms when they congregate (e.g., bacterial biofilms [Chapter 21]) also contain glycans. Thus, evolution has repeatedly and consistently selected glycans as being the most diverse and flexible molecules to position at the interface between cells and the extracellular milieu.'
 'Thus, evolution has repeatedly and consistently selected glycans as being the most diverse and flexible molecules to position at the interface between cells and the extracellular milieu. Possible reasons include their relative hydrophilicity, flexibility, and mobility in aqueous environments and their extreme diversity, allowing facile short-term and long-term adaptations to changing environments and pathogen regimes. In bacteria, Archaea, and fungi, glycans serve critical structural roles in the cell wall and in resisting large differences in osmolarity between cytoplasm and environment. In eukaryotes, both secretory proteins and membrane proteins typically pass through an endoplasmic reticulum (ER)–Golgi pathway, the cellular system in which many major glycosylation reactions occur (see below).'
 'The most abundant biopolymers in nature include secreted polysaccharides such as cellulose, hemicellulose, chitin, and glycosaminoglycans. These large, chemically stable molecules provide crucial structural support for capsules, cell walls, exoskeletons, and extracellular matrices of countless organisms. The repeated β1-4 glycosidic linkages of cellulose and chitin also represent chemically extremely resistant sequestrations of accumulated glycans, given the inability of most organisms to hydrolyze these robust linkages. Compared to other types of glycans, structural polysaccharides show relatively little variation in evolution, which may indicate a more stringent selection for chemical and mechanical properties required for their functions. Interestingly, some of these structures, such as glycosaminoglycans, can also play nonstructural roles in other biological contexts, including cell signaling, which adds additional selection forces driving their evolution. Viruses typically have minimalist genomes and use host-cell machinery for replication.'
 'At the same time, each of these microorganisms is itself host to its own suite of parasites (phages), known to exploit the cell surface glycans of microbes in order to infect these. Host populations (multicellular organisms infected by microbes or microbes infected by phages) may evolve new modifications of the structures targeted by their parasites, especially if the latter had meanwhile evolved a vital function elsewhere within the organism. This would constrain the preservation of the underlying scaffolding on which the latest modification was placed, while adding yet another layer of complexity to host glycans. Such cycles of evolutionary interaction between (nested sets of) microbes and hosts might explain some of the complex and extended sugar chains found in multicellular organisms, especially in areas of frequent microbial contact, such as in secreted mucins on mucosal surfaces. In this manner, “junk” glycans (i.e., glycans without current adaptive value) could accumulate, akin to “junk” DNA.'
 'The challenge then is to predict and sort out which distinct roles can be assigned to a given glycan structure in a given cell type and organism. In the coevolutionary arms race between pathogens and hosts, pathogens will tend to exploit glycans that are difficult for the host to change (those constrained by their intrinsic host function), and because hosts are unable to alter their glycans easily owing to their slower evolutionary rates and functional constraints of existing glycans, the extrinsic and intrinsic functions of these glycans are bound to overlap. Hosts can, however, to the degree possible, be expected to evolve glycans that are difficult for microbes to mimic, such as the vertebrate-specific sialic acid Neu5Gc (Chapter 15) and sulfated GAGs, prokaryotes do not seem to have reinvented (Chapter 17). Because microorganisms and parasites that bind glycans evolve in parallel with their multicellular hosts, they must adapt their glycan-binding “repertoire” to any change in glycan structure presented by the host.'
 'Arthropods evolved resistant chitin-rich exoskeletons. Cellulose and chitin represent the two most abundant biopolymers on the planet. In multicellular organisms, glycan constituents of matrix molecules, such as proteoglycans, are important for maintenance of tissue structure, porosity, and integrity. Such molecules can also contain binding sites for other specific glycans, which, in turn, aid overall matrix organization. The external location of glycans on most glycoproteins can provide a general shield, protecting the underlying polypeptide from recognition by proteases (mucins), blocking antibody binding (viral glycoproteins), and even (as in the case of mucins) protecting entire tissue surfaces from microbial attachment. Another structural role of glycans is their involvement in folding of newly synthesized polypeptides in the endoplasmic reticulum (ER) and/or in the subsequent maintenance of protein solubility and conformation (Chapter 39).'
 'These organisms also have short generation times and can exchange genetic material across vast phylogenetic distances via plasmid-mediated horizontal gene flow. Glycosylation in Bacteria and Archaea is far more diverse, both in terms of the range of monosaccharides used or synthesized, and in the types of linkages and modifications (Chapters 21 and 22). In addition, prokaryotic cell–cell interactions both within and between species are often mediated by glycans. However, most work to date has focused on the glycans of pathogens, and we may have barely scratched the surface of prokaryotic glycan diversity. Despite great differences between pathways generating glycan structures of bacteria and those of vertebrates, occasional microbial surface structures are strikingly similar to those of mammalian cells. Interestingly, most such examples of “molecular mimicry” occur in pathogenic/symbiotic microorganisms, apparently adapting them for better survival in the host by avoiding, reducing, or manipulating host immunity.']","Evolution has repeatedly and consistently selected glycans as the most diverse and flexible molecules to position at the interface between cells and the extracellular milieu. Glycans play crucial roles in various organisms, covering cells with complex layers, being carried by enveloped viruses, glycosylating secreted molecules, and enriching extracellular matrices in multicellular organisms. Even matrices secreted by unicellular organisms in bacterial biofilms contain glycans, highlighting the significance of glycans in cellular interactions and environmental interfaces.","Possible reasons include their relative hydrophilicity, flexibility, and mobility in aqueous environments and their extreme diversity, allowing facile short-term and long-term adaptations to changing environments and pathogen regimes. In bacteria, Archaea, and fungi, glycans serve critical structural roles in the cell wall and in resisting large differences in osmolarity between cytoplasm and environment. In eukaryotes, both secretory proteins and membrane proteins typically pass through an endoplasmic reticulum (ER)–Golgi pathway, the cellular system in which many major glycosylation reactions occur (see below). Most proteins in the blood plasma of animals (with the exception of albumin) are also heavily glycosylated, and the glycosylation of these and other secreted proteins may provide solubility, hydrophilicity, and negative charge, thus reducing unwanted intermolecular interactions and protecting against proteolysis. Cell-surface membrane proteins like receptors, adhesion molecules, and channels are typically glycosylated, and this modification can promote their proper folding, ensure their stability, and impact function.",1.0,0.6667210053099458,0.7538276037018122,0.02631578947368421,0.9761904761742063,0.6
"Complete the following paragraph: In eukaryotic cells, glycosylation occurs mostly in the endoplasmic reticulum (ER) and Golgi apparatus, whereas monosaccharide activation and interconversions occur mostly in the cytoplasm. Nucleotide sugar–specific transporters carry activated sugar donors into the Golgi and to a lesser extent into the ER. In some cases, nucleotide sugars are used to synthesize activated lipid-linked intermediates before glycan transfer. This chapter describes how cells accomplish these tasks, with an emphasis on animal cells.","['Monosaccharide precursors are imported into the cell, salvaged from degraded glycans, or created enzymatically from other sugars within the cell. In eukaryotic cells, glycosylation occurs mostly in the endoplasmic reticulum (ER) and Golgi apparatus, whereas monosaccharide activation and interconversions occur mostly in the cytoplasm. Nucleotide sugar–specific transporters carry activated sugar donors into the Golgi and to a lesser extent into the ER. In some cases, nucleotide sugars are used to synthesize activated lipid-linked intermediates before glycan transfer. This chapter describes how cells accomplish these tasks, with an emphasis on animal cells. Glucose and fructose are the major carbon and energy sources for organisms as diverse as yeast and humans. Most organisms can synthesize the other monosaccharides needed for glycan biosynthesis from these sources. Not all of these biosynthetic pathways are equally active in all types of cells. However, there are some general principles.'
 'The nucleotide sugar donors are synthesized within the cytosolic or nuclear compartment from monosaccharide precursors of endogenous or exogenous origin and then actively transported across a membrane bilayer into the lumen of the ER and Golgi compartments (Chapter 5). Notably, the portion of the glycoconjugate that faces the inside of these compartments will ultimately face the outside of the cell or the inside of a secretory granule or lysosome and will be topologically unexposed to the cytosol. The biosynthetic enzymes (glycosyltransferases, sulfotransferases, etc.) responsible for catalyzing these reactions are well studied (Chapter 6), and their location has helped to define various functional compartments of the ER–Golgi pathway. A classical model envisioned that these enzymes are physically lined up along this pathway in the precise sequence in which they actually work.'
 'Almost all donors for glycosylation reactions and glycan modifications are synthesized within the cytosolic compartment, from precursors of endogenous origin. In eukaryotes, most of these donors are actively transported across a membrane bilayer by specific multipass transporter proteins, becoming available for reactions within the lumen of the ER–Golgi pathway. For many years, the nucleus and cytosol (which are topologically semicontinuous via nuclear pores) were assumed to be devoid of glycosylation capacity. It is now established that distinct glycoconjugates are synthesized and reside within these compartments. Indeed, one of them (O-linked GlcNAc; Chapter 19) may well be quantitatively the most common type of glycoconjugate in many cells.'
 'Iduronic acid does not have a nucleotide sugar parent because it is formed by epimerization of glucuronic acid after it is incorporated into glycosaminoglycan (GAG) chains. In some instances, one nucleotide sugar can be formed from another either by direct epimerization (reaction 2 above) or by a nucleotide exchange reaction (reaction 3 above). For example, UDP-Gal is made from UDP-Glc by exchange of Gal-1-P for Glc-1-P. Activated sugar donors in animal cells  Three types of sugar transporters carry sugars across the plasma membrane into cells. First are energy-independent facilitated diffusion transporters, such as the glucose transporter (GLUT) family of hexose transporters found in yeast and most mammalian cells. The genes encoding these proteins are named SLC2A (solute carriers 2A).'
 'This is usually sufficient to reach or exceed the calculated Km of glycosyltransferases that use these donors. Some known transporters for nucleotide sugars, PAPS (3′-phosphoadenosine-5′-phosphosulfate), and ATP are located in the Golgi membranes of mammals, yeast, protozoa, and plants. These proteins are antiporters and return the corresponding (more...) Most of these antiporters are found in the Golgi, but some are also found in the ER. They are organelle-specific and their location usually corresponds to the location of the relevant glycosyltransferases (Table 5.2; Figure 5.4). Nucleotide sugar import into the Golgi is not energy-dependent nor affected by ionophores. However, the import is competitively inhibited by the corresponding nucleoside monophosphates and diphosphates in the cytosol but not by the monosaccharides.'
 'Thus, extracellular soluble forms of many glycosyltransferases exist in tissues and sera and may function as transferases if nucleotide sugars are present extracellularly. Nucleotide sugars are synthesized in the cytoplasm, except for CMP-sialic acids, which are synthesized in the nucleus (Chapter 5). They are subsequently concentrated in the appropriate compartment following transport across the membrane by specialized nucleotide sugar transporters that translocate CMP-Sia, UDP-Gal, UDP-Glc, UDP-GlcNAc, GDP-Fuc, and other nucleotide sugars. A few of these transporters can transport more than one nucleotide sugar. Each transporter is a multitransmembrane protein that usually contains 10 membrane-spanning domains. Some CMP-sialic acids can be further modified within the lumen of the Golgi by O-acetyl groups before transfer to a glycan acceptor (Chapter 15).'
 'Interestingly, many of these proteins have glycan binding properties, which would presumably cause problems if they instead traversed the glycan rich ER–Golgi pathway. Regardless of location, most glycosylation reactions use activated forms of monosaccharides (often nucleotide sugars and in some cases lipid-phosphate-linked sugars, such as dolichol phosphate mannose) as donors for glycosyltransferases (see Chapter 5 for a listing of some enzymes, their donors and corresponding transporters, and details about their biochemistry). A variety of glycan modifications also occur in nature (Chapter 6). Of these, the most common are generated by sulfotransferases, acetyltransferases, and methyltransferases, which use activated forms of sulfate (3′-phosphoadenyl-5′-phosphosulfate; PAPS), acetate (acetyl-CoA), and methyl groups (S-adenosylmethionine; AdoMet), respectively.']","Cells in eukaryotic organisms primarily carry out glycosylation processes in the endoplasmic reticulum (ER) and Golgi apparatus. Meanwhile, the activation and interconversion of monosaccharides predominantly take place in the cytoplasm. Specific transporters for nucleotide sugars facilitate the transfer of activated sugar donors into the Golgi, with some transport also occurring in the ER. Additionally, in certain instances, nucleotide sugars are utilized to produce activated lipid-linked intermediates prior to glycan transfer. This chapter provides insights into the mechanisms by which cells achieve these functions, focusing particularly on animal cells.","Glucose and fructose are the major carbon and energy sources for organisms as diverse as yeast and humans. Most organisms can synthesize the other monosaccharides needed for glycan biosynthesis from these sources. Not all of these biosynthetic pathways are equally active in all types of cells. However, there are some general principles. Monosaccharides must be activated to a high-energy donor for use in glycan synthesis. This process requires nucleoside triphosphates (typically UTP or GTP) and a glycosyl-1-P (monosaccharide with a phosphate at the anomeric carbon). They can be activated by a kinase (reaction 1) or generated from a previously synthesized activated nucleotide sugar (reactions 2 and 3)",0.875,0.6905356573002233,0.6679294074916319,0.125,0.9999999999833333,0.5714285714285714
"Complete the following paragraph: The biosynthesis of glycans is primarily determined by glycosyltransferases that assemble monosaccharide moieties into linear and branched glycan chains. As might be expected from the complex array of glycan structures found in nature, glycosyltransferases constitute a very large family of enzymes.","['Glycosyltransferases that use monosaccharides, oligosaccharides, proteins, lipids, small organic molecules, and DNA as acceptor substrates have been characterized (activity to RNA has also been suggested), but only glycosyltransferases involved in the biosynthesis of glycoproteins, proteoglycans, and glycolipids are discussed in this chapter. Among these enzymes, the vast majority is responsible for elongating the glycan moieties of these glycoconjugates; the remainder is responsible for the transfer of either a mono- or oligosaccharide directly to the polypeptide or lipid. Generally speaking, the enzymes that elongate glycans act sequentially so that the product of one enzyme yields a preferred acceptor substrate for the subsequent action of another. The end result is a linear and/or branched structure composed of monosaccharides linked to one another.'
 'This chapter covers the general characteristics of enzymes involved in glycan initiation, assembly, and processing, including aspects of substrate specificity, primary sequence relationships, structures, and enzyme mechanisms. The biosynthesis of glycans is primarily determined by glycosyltransferases that assemble monosaccharide moieties into linear and branched glycan chains. As might be expected from the complex array of glycan structures found in nature, glycosyltransferases constitute a very large family of enzymes. In many cases, they catalyze a group-transfer reaction in which the monosaccharide moiety of a simple nucleotide sugar donor (electrophile) substrate (e.g., UDP-Gal, GDP-Fuc, or CMP-Sia; Chapter 5) is transferred to the acceptor (nucleophile) substrate. In some instances, the donor substrates contain a lipid moiety, such as dolichol-phosphate, linked to mannose or glucose.'
 'The end result is a linear and/or branched structure composed of monosaccharides linked to one another. Acceptor recognition by these glycan-elongating glycosyltransferases does not typically involve the polypeptide or lipid moiety of the acceptor substrate when it exists, although there are several notable exceptions as discussed below. Glycosidases that remove monosaccharides to form intermediates that are then acted on by glycosyltransferases also play a role in the biosynthesis of some glycan types. These are to be contrasted with glycosidases that are involved in the degradation of glycans (e.g., in lysosomes [Chapter 44]). In addition, glycans can be modified by many other enzyme types, including sulfotransferases, phosphotransferases, O-acetyltransferases, O-methyltransferases, pyruvyltransferases, and phosphoethanolamine transferases.'
 'The glycosyltransferases that transfer sugar directly to the polypeptide chain of a protein or glycoprotein recognize their acceptor substrates in a number of different ways. All eukaryotic N-glycans are initiated by oligosaccharyltransferase (OST), generally an ER-resident multisubunit enzyme that transfers en bloc Glc3Man9GlcNAc2 to the side chain of asparagine residues in the sequence motif Asn-X-Ser/Thr (where X can be any amino acid except proline; Chapter 9). In contrast, the polypeptide GalNAc transferases, responsible for the initiation of mucin-type O-glycans, act after the protein has been folded and transported to the Golgi (Chapter 10).'
 'Certain genes may need to be removed and others inserted to create biosynthetic pathways that produce the glycans of interest. Four decades of glycogene discoveries have resulted in the identification of many genes encoding glycosyltransferases, hydrolases, and other enzymes involved in synthesizing and metabolizing the glycans of eukaryotic cells and the biosynthetic pathways involved (Chapters 8–19). Different glycosylation pathways may function independently using different sets of enzymes or, in some cases, may share enzymes. Enzymes working in consecutive order to assemble mature glycans generally work independently, although there may also be cooperative effects. In principle, there is sufficient knowledge to predict the role of individual enzymes and assign them to specific pathways, allowing prediction of the enzyme repertoire required to generate a particular glycan on a particular glycoconjugate. An excellent resource in this regard is the classification of homologous gene families from diverse species in the “Carbohydrate-Active enZYmes” (CAZy) database (Chapter 8).'
 'In this case, the enzyme adds a glucose moiety to the N-glycans of misfolded glycoproteins rendering them substrates for the ER-resident lectins calnexin and calreticulin. These lectins in turn recruit folding catalysts that promote correct disulfide bond formation and the cis–trans isomerization of proline residues. Approximately 1% of genes in the mammalian genome are involved in the production or modification of glycans. More than 750,000 glycosyltransferase sequences are known across all kingdoms, and the numbers are growing rapidly. Based on sequence analysis, they have been categorized into more than 110 glycosyltransferase families as described in the Carbohydrate-Active Enzymes (CAZy) database (Chapter 8). Although the absence of significant sequence similarity between members of one family and another constitutes the basis for this classification, short sequence motifs common to the members of more than one family have been identified.'
 'Glycosyltransferases that initiate the synthesis of glycosphingolipids transfer a monosaccharide moiety to what was originally a serine residue in the ceramide lipid precursor of sphingolipids (see Chapter 11). Because different glycolipids have different ceramide moieties, it appears that some glycosyltransferases, such as the sialyltransferases, differentially recognize their substrates based on the nature of the ceramide moiety. The glycosyltransferases that transfer sugar directly to the polypeptide chain of a protein or glycoprotein recognize their acceptor substrates in a number of different ways.']","In many cases, glycosyltransferases catalyze a group-transfer reaction in which the monosaccharide moiety of a simple nucleotide sugar donor substrate is transferred to the acceptor substrate. These enzymes act sequentially to elongate glycans, with the product of one enzyme serving as the preferred acceptor substrate for the subsequent enzyme. The end result is a linear and/or branched structure composed of monosaccharides linked to one another. Glycosyltransferases that initiate glycan synthesis transfer monosaccharide moieties to specific substrates, such as proteins, lipids, or other molecules, depending on the type of glycan being synthesized. Additionally, glycosidases play a role in glycan biosynthesis by removing monosaccharides to form intermediates that can be further modified by glycosyltransferases. Other enzymes, such as sulfotransferases, phosphotransferases, and acetyltransferases, can also modify glycans to generate diverse glycan structures.","In many cases, they catalyze a group-transfer reaction in which the monosaccharide moiety of a simple nucleotide sugar donor (electrophile) substrate (e.g., UDP-Gal, GDP-Fuc, or CMP-Sia; Chapter 5) is transferred to the acceptor (nucleophile) substrate. In some instances, the donor substrates contain a lipid moiety, such as dolichol-phosphate, linked to mannose or glucose. For other glycosyltransferases, the donor substrate is dolichol-pyrophosphate, linked to an oligosaccharide, and in these cases the entire oligosaccharide is transferred en bloc to the acceptor substrate (Chapter 9). Similarly, other lipid-linked sugars serve as donor substrates for bacterial glycosyltransferases involved in the assembly of peptidoglycan (e.g., GlcNAc-MurNAc(pentapeptide)-undecaprenyl pyrophosphate), lipopolysaccharide, and capsules (Chapters 21 and 22). Glycosyltransferases that use monosaccharides, oligosaccharides, proteins, lipids, small organic molecules, and DNA as acceptor substrates have been characterized (activity to RNA has also been suggested), but only glycosyltransferases involved in the biosynthesis of glycoproteins, proteoglycans, and glycolipids are discussed in this chapter.",1.0,0.6871217113230854,0.8556873606285451,0.0625,0.9999999999833333,0.6
"Complete the following paragraph: Over the years, many theories have been advanced regarding biological roles of glycans. Although there is evidence to support all the theories, exceptions to each one can also be found. This should not be surprising, given the abundance and enormous diversity of glycans in nature. Complexities also arise because glycans are frequently bound by microbes and microbial toxins, making them a liability to the organism that synthesizes them. Biological functions of glycans can be divided into three broad categories:","['The chapter then presents some general principles for understanding and further exploring biological functions of glycans. For details, see the sources cited and other chapters in this book. As with other major classes of macromolecules, the biological functions of glycans span the spectrum from relatively subtle to crucial for development, growth, maintenance, or survival of the organism that synthesizes them. For many glycans, specific functions are not yet evident. The same glycan may also have different functions depending on which aglycone (protein or lipid) it is attached to. Over the years, many theories have been advanced regarding biological roles of glycans. Although there is evidence to support all the theories, exceptions to each one can also be found. This should not be surprising, given the abundance and enormous diversity of glycans in nature. Complexities also arise because glycans are frequently bound by microbes and microbial toxins, making them a liability to the organism that synthesizes them.'
 'Like any biological system, the optimal approach carefully considers the relationship of structure and biosynthesis to function (Chapter 7). As might be imagined from their ubiquitous and complex nature, the biological roles of glycans are remarkably varied. Indeed, asking what these roles are is akin to asking the same question about proteins. Thus, all of the proposed theories regarding glycan function turn out to be partly correct, and exceptions to each can also be found. Not surprisingly for such a diverse group of molecules, the biological roles of glycans also span the spectrum from those that are subtle to those that are crucial for the development, growth, function, or survival of an organism (Chapter 7). The diverse functions ascribed to glycans can be simply divided into two general categories: (i) structural and modulatory functions (involving the glycans themselves or their modulation of the molecules to which they are attached) and (ii) specific recognition of glycans by glycan-binding proteins. Of course, any given glycan can mediate one or both types of functions.'
 'Complexities also arise because glycans are frequently bound by microbes and microbial toxins, making them a liability to the organism that synthesizes them. Biological functions of glycans can be divided into three broad categories: (1) structural contributions (e.g., extracellular scaffolds: cell walls and extracellular matrices, protein folding and function); (2) energy metabolism (e.g., carbohydrates as carbon sources for storage and manipulation of animal behavior: pollination and seed dispersal); and (3) information carriers (e.g., molecular patterns recognized by glycan binding proteins [GBPs]) (Figure 7.1). The GBPs can be subdivided into two groups: (1) intrinsic GBPs, which recognize glycans from the same organism and (2) extrinsic GBPs, which recognize glycans from another organism. Intrinsic GBPs typically mediate cell–cell interactions or recognize extracellular molecules, but they can also recognize glycans on the glycocalyx of same cell.'
 'However, such glycans or their modifications are also more likely to be targets for pathogens and toxins. Perhaps as a consequence, intra- and interspecies variations in glycosylation are relatively common, and at least some of the diversity of glycans in nature may represent signatures of past or current host–pathogen or symbiotic interactions (Chapter 20). Finally, genetic defects in glycosylation are easily obtained in cultured cells, but often have limited biological consequences in vitro. In contrast, the same defects often have major and even catastrophic consequences in whole organisms. This generalization indicates that many major functions of glycans are operative mainly within an intact, multicellular organism. Some of these principles are briefly discussed below.'
 'General classification of the biological functions of glycans. A simplified and broad classification is presented, emphasizing the roles of organism-intrinsic and -extrinsic glycan-binding proteins in recognizing glycans. There is some overlap between (more...) Other general principles emerge based on existing literature. The biological consequences of experimentally altering glycosylation in various systems seem to be highly variable and unpredictable. Also, a given glycan can have different roles in different tissues, at different times in development (organism-intrinsic functions) or in different environmental contexts (organism-extrinsic functions). As a broad generalization, it can be stated that terminal sequences, unusual structures, and modifications of glycans are more likely to mediate specific biological functions within the organism. However, such glycans or their modifications are also more likely to be targets for pathogens and toxins.'
 'This generalization indicates that many major functions of glycans are operative mainly within an intact, multicellular organism. Some of these principles are briefly discussed below. Experimental approaches to elucidating biological roles of glycans include prevention of initial glycosylation, prevention of glycan chain elongation, alteration of glycan processing, enzymatic or chemical deglycosylation of completed chains, genetic elimination of glycosylation sites, addition of unnatural monosaccharides, and studies of mutant and naturally occurring genetic variants in glycosylation enzymes. The consequences of such manipulations can range from being essentially undetectable, to the complete loss of particular functions, or even to loss of the entire glycoconjugate bearing the altered glycan. Even within a particular class of molecules (e.g., cell-surface receptors), the effects of altering glycosylation are variable and unpredictable. Moreover, the same glycosylation change can have markedly different effects in different cell types or when studied in vivo or in vitro.'
 'The challenge then is to predict and sort out which distinct roles can be assigned to a given glycan structure in a given cell type and organism. In the coevolutionary arms race between pathogens and hosts, pathogens will tend to exploit glycans that are difficult for the host to change (those constrained by their intrinsic host function), and because hosts are unable to alter their glycans easily owing to their slower evolutionary rates and functional constraints of existing glycans, the extrinsic and intrinsic functions of these glycans are bound to overlap. Hosts can, however, to the degree possible, be expected to evolve glycans that are difficult for microbes to mimic, such as the vertebrate-specific sialic acid Neu5Gc (Chapter 15) and sulfated GAGs, prokaryotes do not seem to have reinvented (Chapter 17). Because microorganisms and parasites that bind glycans evolve in parallel with their multicellular hosts, they must adapt their glycan-binding “repertoire” to any change in glycan structure presented by the host.']","structural contributions (e.g., extracellular scaffolds: cell walls and extracellular matrices, protein folding and function); energy metabolism (e.g., carbohydrates as carbon sources for storage and manipulation of animal behavior: pollination and seed dispersal); and information carriers (e.g., molecular patterns recognized by glycan binding proteins [GBPs]).","(1) structural contributions (e.g., extracellular scaffolds: cell walls and extracellular matrices, protein folding and function); (2) energy metabolism (e.g., carbohydrates as carbon sources for storage and manipulation of animal behavior: pollination and seed dispersal); and (3) information carriers (e.g., molecular patterns recognized by glycan binding proteins [GBPs])",1.0,0.7343414012671102,0.9578190492671215,0.022222222222222223,0.9999999999857143,1.0
"Complete the following paragraph: The glycome comprises all the glycan structures synthesized by an organism. It is analogous to the genome, the transcriptome, and/or the proteome but even more dynamic, and it has higher structural complexity that has yet to be fully defined. Cells of different types synthesize a subset of the glycome based on their differentiation state and physiological environment.","['Thus, the glycan complement of a cell depends on which genes are actively transcribed and which transcripts are translated and stably expressed. Transcription, splicing, translation, and posttranslational processing may vary depending on the state of differentiation and the physiological environment of a cell. Therefore, during development and differentiation, and under different environmental conditions, the glycan repertoire of a cell represents a subset of all the glycans that an organism is capable of making. To describe this variation, it is common to qualify the term glycome when referring to the glycans made by a particular tissue or cell type (e.g., T-cell glycome, hepatocyte glycome, or serum glycome), and to note the particular stage of development (e.g., fetal liver glycome, breast cancer serum glycome). The glycome of a given cell in an organism can undergo substantial changes in response to environmental stimuli ranging from pH and ionic strength to hormonal stimulation or inflammation.'
 'Furthermore, unlike the genome, the glycome is sensitive to exogenous nutrient levels and metabolic fluxes including salvage pathways. Thus, variations in dietary monosaccharides, such as glucose, galactose, glucosamine, fucose, mannose, and N-glycolylneuraminic acid (Chapter 15), may change the composition of the glycome. The numerous factors that influence the glycome (the transcriptome, the proteome, environmental nutrients, the secretory machinery, pH, and many other determinants) create a glycome that is highly diverse, adaptable, and dynamic. Thus, the glycome of a cell can change dramatically over time. It is this enormous structural plasticity in response to cellular and environmental states that underlies the essential roles of glycans in development, communication, and disease processes.'
 'Vertebrates synthesize N-linked and O-linked glycoproteins, glycolipids (Chapters 11 and 12), proteoglycans, glycosaminoglycans (GAGs), and glycosylphosphatidylinositol (GPI) anchors covalently attached to proteins, as well as free oligosaccharides (Chapter 3). As with the proteome, each cell type has its own distinct glycome that is governed by local cues and the metabolic state of the cell. Other organisms have distinct glycomes; those of plants (Chapter 24) and prokaryotes (Chapter 21) are distinctly different from the vertebrate and invertebrate glycomes (Chapters 25–27). The size of any particular cellular glycome has not yet been established, but the combinatorial possibilities that can occur with numerous glycan structures on multiple glycoconjugates means that determining a “complete” glycome is not straightforward.'
 'This chapter provides a genomic perspective of the genes that code for GTs, GHs, and GBPs. The glycome comprises all the glycan structures synthesized by an organism. It is analogous to the genome, the transcriptome, and/or the proteome but even more dynamic, and it has higher structural complexity that has yet to be fully defined. Cells of different types synthesize a subset of the glycome based on their differentiation state and physiological environment. The human and mouse glycomes have many glycan structures in common, but a few are unique or have divergent functional properties. For example, unlike humans, rodents synthesize cytidine monophospho-N-glycolylneuraminic acid (CMP-Neu5Gc), for the transfer of Neu5Gc to N- and O-glycans (Chapter 15). Similarly, the gene encoding α-1,3-galactosyltransferase (A3GALT2) is functional in the mouse but not in human (Chapter 20).'
 'The generation of complex glycan libraries by a variety of routes has further enhanced this interface of chemistry and biology (Chapters 53 and 54), including the generation of glycan microarrays. Analogous to genomics and proteomics, glycomics represents the systematic methodological elucidation of the “glycome” (the totality of glycan structures) of a given cell type or organism (Chapters 51 and 52). In reality, the glycome is far more complex than the genome or proteome. In addition to the vastly greater structural diversity in glycans, one is faced with the complexities of glycosylation microheterogeneity (see above) and the dynamic changes that occur in the course of development, differentiation, metabolic changes, aging, malignancy, inflammation, or infection. Added diversity arises from intraspecies and interspecies variations in glycosylation. Thus, a given cell type in a given species can manifest a large number of possible glycome states.'
 'Clues regarding the composition and complexity of the glycome are found in the genome, transcriptome, and proteome of a cell. Thus, if a gene encoding a glycosyltransferase is not expressed (absent from the transcriptome), no glycans in that cell can carry the sugar transferred by that glycosyltransferase at that particular time. The action of many glycosyltransferases and glycoside hydrolases competing for the same substrates in the biosynthetic pathway renders the complete glycome impossible to predict with current tools and knowledge. As an example, the reduced expression of a single glycosyltransferase can perturb the biosynthesis of dozens of glycans. Furthermore, unlike the genome, the glycome is sensitive to exogenous nutrient levels and metabolic fluxes including salvage pathways.'
 ""Likewise, the glycomes and glycan-binding proteins of microbes and their vertebrate hosts appear to have coevolved in some instances (Chapter 42). The glycome can be determined at different levels of granularity. First, “glycomics” constructs an inventory of glycans separated from their protein or lipid scaffolds from the cell, organ, or organism of interest. This is an important starting point for any comprehensive glycome analysis. The second level of analysis defines specific glycans associated with individual proteins or lipids. Analysis of the complete repertoire of a cell's glycoconjugates, including the microheterogeneity of glycans present at individual sites of attachment, lies, for example, at the intersection of glycomics and proteomics (“glycoproteomics”) and of glycomics and lipidomics (“glycolipidomics”). A third level of complexity involves determining which glycans and/or glycoconjugates are expressed in specific cells, tissues, or secretions at specific times or conditions.""]","The glycome comprises all the glycan structures synthesized by an organism. It is analogous to the genome, the transcriptome, and/or the proteome but even more dynamic, and it has higher structural complexity that has yet to be fully defined. Cells of different types synthesize a subset of the glycome based on their differentiation state and physiological environment. The glycome is highly diverse, adaptable, and dynamic, influenced by various factors such as exogenous nutrient levels, metabolic fluxes, environmental stimuli, and cellular and environmental states.","The human and mouse glycomes have many glycan structures in common, but a few are unique or have divergent functional properties. For example, unlike humans, rodents synthesize cytidine monophospho-N-glycolylneuraminic acid (CMP-Neu5Gc), for the transfer of Neu5Gc to N- and O-glycans (Chapter 15). Similarly, the gene encoding α-1,3-galactosyltransferase (A3GALT2) is functional in the mouse but not in human (Chapter 20). The human and fly genomes include orthologous genes encoding GTs that catalyze the same reaction, but they also have GTs that are unique. Thus, protein O-fucosyltransferase 1 (POFUT1) in mammals and Ofut1 in flies transfer fucose to Notch receptors and are examples of an evolutionarily conserved GT. In contrast, flies do not make complex N-glycans with four branches, which are common in mammalian glycoproteins (Chapters 9 and 20). Additionally, flies make unique glycolipids absent from mammals that are important for conserved signaling pathways mediated by the epidermal growth factor (EGF) receptor or Notch receptors (Chapter 26).",1.0,0.722098176940513,0.5827134581666511,0.05128205128205128,0.9999999999833333,0.42857142857142855
"Complete the following paragraph: In mammals, there are two different catalytic STT3 subunits that both associate with ribophorins I and II, OST48, OST4, and DAD1 proteins (homologs of the yeast Ost1p, Swp1p, Wbp1p, Ost4p, and Ost2p, respectively).","['The OST complex cleaves the high-energy GlcNAc-P bond, releasing Dol-P-P in the process (Figure 9.3). Yeast OST is comprised of eight different subunits Stt3p, Ost1p, Wbp1p, Swp1p, Ost2p, Ost4p, Ost5p, and Ost3p or Ost6p. Stt3p is the catalytic subunit of the enzyme. The two OST complexes (containing either of the thioredoxin-subunit Ost3p or Ost6p) have a different protein–substrate specificity. The complexity of OST increases in multicellular organisms. In mammals, there are two different catalytic STT3 subunits that both associate with ribophorins I and II, OST48, OST4, and DAD1 proteins (homologs of the yeast Ost1p, Swp1p, Wbp1p, Ost4p, and Ost2p, respectively).'
 'The OST is a complex of multiple subunits of which STT3 is the catalytic subunit that contains OST activity. Two different genes encode STT3—namely, STT3A and STT3B. They are part of two different OST complexes, one with STT3A for cotranslational glycosylation and one with STT3B for glycosylation of proteins that escape glycosylation via the STT3A complex. Patients with defects in either subunit present with the typical multisystem phenotype. Interestingly, transferrin glycosylation is dependent on the STT3A-containing OST complex and thus abnormal in STT3A-CDG, but normal in STT3B-CDG. STT3B dependent protein substrates, such as sex hormone binding globulin, show reduced glycosylation in STT3B-CDG specifically.'
 'The STT3A complex (OSTA), closely associated with the translocon, contains the KCP2 and DC2 subunits, whereas the STT3B complex (OSTB) that has either MAGT1 or TUSC3 (homologs of yeast Ost3p/Ost6p) glycosylates polypeptides posttranslationally after their translocation into the ER. On binding to the catalytic STT3 subunit, the client peptide adopts a 180° turn, making polypeptide folding a competing reaction for N-glycosylation. Indeed, the thioredoxin subunits of the OST complex (Ost3p/Ost6p; MAGT1/TUSC1) modulate the oxidative folding of the client polypeptide, thereby extending the polypeptide substrate range of OST. As of February 2021, the UniProt database reports 1911 N-glycosylation sites in yeast and 13,648 in murine glycoproteins.'
 'OST is a multisubunit protein complex in the ER membrane, except in the case of the kinetoplastids (Chapter 43). OST catalyzes the transfer of the oligosaccharide from Dol-P-P to Asn-X-Ser/Thr in newly synthesized regions of proteins during passage through the translocon into the ER. OST has a high specificity for the completely assembled oligosaccharide, which is Glc3Man9GlcNAc2 in most eukaryotes. When incomplete oligosaccharides are assembled, transfer efficiency is reduced, resulting in hypoglycosylation of glycoproteins that mature with empty N-glycan sites. All OST subunits are transmembrane proteins with between one and 13 transmembrane domains. The OST complex cleaves the high-energy GlcNAc-P bond, releasing Dol-P-P in the process (Figure 9.3).'
 'The OST of C. jejuni, PglB, is a single polypeptide related to the catalytic STT3 subunits of the multiprotein OST complex of eukaryotes (Chapter 9). PglB shows a more restricted acceptor sequence motif than the eukaryotic N-X-S/T, with requirement of an acidic residue (D/EXNXS/T, in which X cannot be P) (Chapter 21). This places some restrictions on the usefulness of engineering human-like N-glycans, because most N-glycan sites in mammalian proteins do not conform to this extended consensus sequence. PglBs from other species, or mutants evolved by adaptive evolution, have been identified to address this problem, but further improvements are needed. Importantly, PglB has rather relaxed donor substrate specificity. Although bacterial lipid-linked oligosaccharides are distinct from those in eukaryotes, PglB can use mammalian-type lipid-linked oligosaccharides as donors.'
 'The α- and β-subunits are encoded by the GNPTAB gene, whose 1256 amino acid type-III transmembrane product undergoes proteolysis in the Golgi by site-1-protease (S1P) to give rise to the two subunits, whereas the 305 amino acid γ-subunit is encoded by the GNPTG gene (Figure 33.3). The α/β subunits contain the catalytic function of the enzyme (Stealth domains) as well as elements (Notch1, Notch2, and DMAP [DNA-methylase-associated protein]) that mediate binding to protein determinants present on the lysosomal enzymes. The γ-subunit facilitates the phosphorylation of a subset of the lysosomal enzymes. It contains an M6P receptor homology (MRH) domain that is thought to bind oligomannosyl N-glycans on the lysosomal enzymes and present them to the catalytic site for phosphorylation, and a DMAP recognition domain.'
 'Indeed, O-fucosylation appears to stabilize folded TSRs. The case of Ofut1/POFUT1 is a bit more ambiguous. Studies performed in Drosophila on the efficiency of cell-surface expression of the Ofut1 substrate Notch showed that Ofut1 is required as a chaperone for Notch folding and cell-surface expression, and that chaperone activity is largely independent of the O-fucosyltransferase activity. In contrast, POFUT1 does not appear to be absolutely required for cell-surface expression of Notch receptors in all mammalian cells, suggesting that cell-specific chaperones may be able to compensate for loss of POFUT1 in certain contexts. It has been reported recently that O-mannosylation in S. cerevisiae ER might be responsible for terminating futile cycles of association–dissociation between proteins unable to attain their native conformation and Kar2p (the budding yeast homolog of mammalian BiP/Grp78 chaperone).']","These two different catalytic STT3 subunits in mammals, which associate with ribophorins I and II, OST48, OST4, and DAD1 proteins, are homologs of the yeast Ost1p, Swp1p, Wbp1p, Ost4p, and Ost2p, respectively.","The STT3A complex (OSTA), closely associated with the translocon, contains the KCP2 and DC2 subunits, whereas the STT3B complex (OSTB) that has either MAGT1 or TUSC3 (homologs of yeast Ost3p/Ost6p) glycosylates polypeptides posttranslationally after their translocation into the ER. On binding to the catalytic STT3 subunit, the client peptide adopts a 180° turn, making polypeptide folding a competing reaction for N-glycosylation. Indeed, the thioredoxin subunits of the OST complex (Ost3p/Ost6p; MAGT1/TUSC1) modulate the oxidative folding of the client polypeptide, thereby extending the polypeptide substrate range of OST. As of February 2021, the UniProt database reports 1911 N-glycosylation sites in yeast and 13,648 in murine glycoproteins.",0.6666666666666666,0.8697318492337586,0.7302117224182076,0.02702702702702703,0.99999999998,1.0
"Complete the following paragraph: Sialic acids may be modified by O-acetylation, and Gal and GlcNAc by sulfation. The length of O-GalNAc glycans may vary from a single GalNAc to more than 20 sugar residues and can include blood group and other glycan epitopes. This chapter describes the structures, biosynthesis, and functions of O-GalNAc glycans in mammals.","['The sugars found in O-GalNAc glycans include GalNAc, Gal, GlcNAc, Fuc, and Sia, whereas Man, Glc, or Xyl residues are not represented. Sialic acids may be modified by O-acetylation, and Gal and GlcNAc by sulfation. The length of O-GalNAc glycans may vary from a single GalNAc to more than 20 sugar residues and can include blood group and other glycan epitopes. This chapter describes the structures, biosynthesis, and functions of O-GalNAc glycans in mammals. About 150 years ago, E. Eichwald and E. Hoppe-Seyler noted that highly glycosylated proteins that contain hundreds of O-GalNAc glycans, which they termed mucins, are found throughout the body (Figure 10.1).'
 'The termini of O-GalNAc glycans may contain Fuc and Sia in α-linkages, and Gal, GalNAc, and GlcNAc in both α- and β-linkages, and sulfate. Many of these terminal sugars are antigenic or recognized by lectins. In particular, the sialylated and sulfated Lewis antigens are ligands for selectins (Chapter 34), and Gal-terminating structures are ligands for galectins (Chapter 36). Some sugar residues, or their modifications, may mask underlying antigens or receptors. For example, O-acetyl groups on the Sia of the sialyl-Tn antigen prevent recognition by anti-sialyl-Tn antibodies. Gut bacteria may actively remove this mask. Dense O-glycosylation of mucin domains provides almost complete protection from protease degradation. The O-linkage between GalNAc and Ser/Thr residues is labile under alkaline conditions.'
 'Sialylation blocks the further linear extension of O-glycan chains. Sulfotransferases are localized in the Golgi and cap O-GalNAc glycans with a sulfate ester linked to the 3-position of Gal or the 6-position of GlcNAc. The sulfate group is transferred from 3′-phosphoadenosine-5′-phosphosulfate (PAPS). This adds a negative charge to O-GalNAc glycans of lung, intestinal, and other mucins that has a considerable effect on the chemical and metal ion binding properties of these glycans. GAL3ST4 is the major sulfotransferase acting on the Gal residue of core 1 O-glycans. Skeletal type keratan sulfate (KS) is also an O-GalNAc-linked highly sulfated polysaccharide (Chapter 17). O-acetyltransferases that add O-acetyl esters to one or more hydroxyl groups of Sia residues remain poorly characterized.'
 'O-acetyltransferases that add O-acetyl esters to one or more hydroxyl groups of Sia residues remain poorly characterized. Some evidence suggests that the esters can be added to CMP-Sias before transfer. The α1-2 fucosyltransferases FUT1 and FUT2 synthesize the blood group H determinant of O-GalNAc glycans which can be converted by an α1-3 Gal-transferase to blood group B or by an α1-3 GalNAc-transferase to blood group A (Table 10.1). In addition, α1-3 and α1-3/4 fucosyltransferases synthesize the Lewis antigens (Table 10.1). A number of uncommon and antigenic sugars are also found on O-GalNAc glycans.'
 'Other sugars are not known to be added to this O-glycan, but it can be O-acetylated by Sia O-acetyltransferase, which prevents detection by anti-sialyl-Tn antibodies. The addition of one or two neutral sugars to O-GalNAc generates one of the different cores of O-GalNAc glycans (Table 10.1; Figure 10.2). Core 1 (Galβ1-3GalNAc-O-Ser/Thr) is generated by C1GALT1. This activity is present in most cell types but absolutely requires the molecular chaperone C1GALT1C1 (COSMC) during synthesis in the endoplasmic reticulum (ER) in mammalian cells to ensure proper folding and activity in the Golgi.'
 'The addition of GalNAc to Gal already substituted with α2-3Sia may also occur on glycoproteins and glycolipids (Figure 14.10). On glycoproteins, this structure forms the human Sda blood group, which is expressed by most individuals. In mice, the Sda antigen was first described on cytotoxic T lymphocytes (CTLs) and was termed the CT antigen. On glycolipids, the same trisaccharide terminus is shared by the ganglioside GM2 (Chapter 11). A related structure to the Sda antigen GalNAcβ1-4(Neu5Acα2-3)Galβ1-3(Neu5Acα2-6)GalNAc is found in O-glycans and glycolipids. The human Sda antigen was first sequenced in N-glycans of Tamm–Horsfall glycoprotein from human urine.'
 'The GlcNAc linked (more...) Terminal GlcNAc residues are usually galactosylated. Modification by β1-4Gal (top) occurs in all mammalian tissues. This reaction is catalyzed by β1-4 galactosyltransferases (B4GALT1 to B4GALT6) and yields the Galβ1-4GlcNAc (N-acetyllactosamine) (more...) Terminal GlcNAc residues in N-glycans, O-glycans, and glycolipids may alternatively be modified by β1-3Gal (Figure 14.2) to generate a Type-1 unit composed of Galβ1-3GlcNAc. In humans, expression of Type-1 units is relatively high in O-glycans of glycoproteins and glycolipids in the epithelia of the gastrointestinal or reproductive tracts.']","The chapter explores the diversity and ubiquity of O-GalNAc glycans in mammals, detailing the structures, biosynthesis, and functions of these glycans. It discusses the variability in the length of O-GalNAc glycans, ranging from a single GalNAc to over 20 sugar residues, which can encompass blood group and other glycan epitopes. Additionally, it highlights the potential modifications of sialic acids through O-acetylation and the sulfation of Gal and GlcNAc within O-GalNAc glycans.","About 150 years ago, E. Eichwald and E. Hoppe-Seyler noted that highly glycosylated proteins that contain hundreds of O-GalNAc glycans, which they termed mucins, are found throughout the body (Figure 10.1). Since then we have learned that O-GalNAc glycans are not only found as dense clusters on mucins, but also at single sites on most secreted and membrane-bound proteins. O-GalNAc glycans are involved in almost every aspect of biology, including cell–cell communication, cell adhesion, signal transduction, immune surveillance, epithelial cell protection, and host–pathogen interactions.",0.8333333333333334,0.729818449098266,0.7516324100111827,0.02564102564102564,0.7928571428373213,0.3333333333333333
"Complete the following paragraph: Nearly all glycolipids in vertebrates are GSLs, which, in turn, are part of the larger family of sphingolipids (lipids built on sphingoid bases) that includes the major membrane phospholipid, sphingomyelin, and the second messenger sphingosine 1-phosphate that regulates angiogenesis and immune cell trafficking.","['The structure of the lipid, a long-chain amino alcohol in amide linkage to a fatty acid, was so difficult to determine that the amino alcohol was dubbed “sphingosine” after the enigmatic Egyptian Sphinx. Animal cells synthesize various sphingosines and related long-chain amino alcohols, together referred to as sphingoid bases. Nearly all glycolipids in vertebrates are GSLs, which, in turn, are part of the larger family of sphingolipids (lipids built on sphingoid bases) that includes the major membrane phospholipid, sphingomyelin, and the second messenger sphingosine 1-phosphate that regulates angiogenesis and immune cell trafficking. Other GSLs were later identified because they accumulate to pathological levels in tissues of patients with lysosomal storage diseases, genetic disorders in which glycan degrading enzymes are faulty or missing (Chapter 44).'
 'In comparison, glycoglycerolipids, (more...) Glycoglycerolipids are distinguished from GSLs by their lipid, having glycans linked to the C-3 hydroxyl of diacylglycerol or alkyl(acyl)glycerol (Figure 11.1). Very minor constituents of most animal tissues (other than the testes), glycoglycerolipids are widely distributed in microbes and plants. Glycolipids of fungi, plants, and invertebrates are covered in Chapters 20 and 23–26. Glycosylphosphatidylinositols (GPIs), a different family of glycolipids, are often attached to proteins as membrane, and may also exist as free glycolipids (discussed in Chapter 12). The lipopolysaccharides of Gram-negative bacteria are discussed in Chapter 21. The ceramide lipid of GSLs consists of a sphingoid base with a fatty acid amide at the C-2 amine.'
 'The emphasis of this chapter is on vertebrate glycosphingolipids. Information on glycolipids of fungi, plants, and invertebrates is covered elsewhere (Chapters 20 and 23–26), as are glycosylphosphatidylinositols (GPIs), glycolipids attached to proteins as membrane anchors (Chapter 12). This chapter describes the characteristic features of GSLs, pathways for their biosynthesis, and insights into their biological roles in membrane structure, host–pathogen interactions, cell–cell recognition, and modulation of membrane protein function. The first GSL to be characterized was galactosylceramide (GalCer). Among the simplest of glycolipids, it is also one of the most abundant molecules in the vertebrate brain. It consists of a single galactose residue in β-glycosidic linkage to the C-1 hydroxyl group of a lipid moiety called ceramide (Figure 11.1).'
 'The ceramide lipid of GSLs consists of a sphingoid base with a fatty acid amide at the C-2 amine. Sphingosine is the most common sphingoid base in mammals, with hydroxyls at the C-1 and C-3 carbons and a trans double bond between C-4 and C-5 (Figure 11.1). Sphinganine is the same structure without the double bond, and phytosphingosine lacks the double bond and has an additional hydroxyl on C-4. Ceramides containing sphinganine and phytosphingosine are less abundant in animals, whereas phytosphingosine is prominent in the glycosphingolipids of plants and fungi. The fatty acid components of ceramides vary widely, with lengths ranging from C14 to C30 or greater. Although often saturated, they may be variably unsaturated or have α-hydroxyl groups.'
 'Sialylated GalCer (Neu5Acα2-3GalβCer; GM4) is also found in myelin. These galactolipids are seldom extended with larger saccharide chains; rather, most other members of the large and diverse family of GSLs in animals are built on GlcCer (Figure 11.2). GlcCer itself is abundant in certain tissues. In skin, it is a precursor of special ceramides that are required for creating the essential surface water barrier when embedded into the stratum corneum of the epidermis (see below). Glycosphingolipid (GSL) neutral cores and their designation based on IUPAC (International Union of Pure and Applied Chemistry) Nomenclature.'
 'In contrast, lacto-series glycolipids are prominent in secretory organs and globo-series glycolipids are the most abundant in erythrocytes. This diversity presumably reflects important differences in GSL functions. GSLs are further subclassified as neutral (no charged sugars or ionic groups), sialylated (having one or more sialic acid residues), or sulfated. Traditionally, all sialylated GSLs are known as “gangliosides” regardless of whether they are based on the ganglio-series neutral sugar core. In the official nomenclature, saccharide and other substituents that extend or branch from the neutral core structures are indicated by a roman numeral designating which of the neutral core sugars carries the substituent (counting the sugar closest to the ceramide as “I”), and a superscript designating which hydroxyl on that sugar is modified (Figure 11.2).'
 'In certain lysosomal storage diseases (Chapter 44), mutations in activator proteins result in pathological accumulation of glycolipids, even though there is an abundance of the hydrolase responsible for degradation, thus demonstrating the essential role of activator proteins in GSL catabolism in vivo. The final breakdown products of GSL catabolism—monosaccharides, fatty acids, and free sphingoid bases—are then available for reuse by salvage pathways. GSLs comprise from <5% (erythrocytes) to >20% (myelin) of the total membrane lipids in the plasma membranes of vertebrate cells. However, they are not uniformly distributed in the plane of the membrane but cluster in “lipid rafts,” small lateral microdomains of self-associating membrane molecules.']","Glycosphingolipids (GSLs) are a major type of glycolipids found in vertebrates, which are part of the broader family of sphingolipids. This group of lipids, built on sphingoid bases, includes sphingomyelin, a major membrane phospholipid, and sphingosine 1-phosphate, a second messenger that plays a role in regulating processes such as angiogenesis and immune cell trafficking.","Other GSLs were later identified because they accumulate to pathological levels in tissues of patients with lysosomal storage diseases, genetic disorders in which glycan degrading enzymes are faulty or missing (Chapter 44). For example, a sialic acid–containing GSL (GM2) was first isolated from the brain of a victim of Tay–Sachs disease, in which it accumulates, and was named “ganglioside” based on its location in nerve clusters or “ganglia” in the brain. Likewise, glucosylceramide (GlcCer) was first isolated from the spleen of a Gaucher disease patient, where it accumulates. As purification, separation, and analytical techniques improved, GSLs were found in all vertebrate tissues. Hundreds of unique GSL structures were found that vary in glycan structures alone, each of which are presented on several distinct ceramides. Structures of representative glycosphingolipids (GSLs) and glycoglycerolipids. GSLs, such as GalCer, are built on a ceramide lipid moiety that consists of a long-chain amino alcohol (sphingosine) in amide linkage to a fatty acid. In comparison, glycoglycerolipids, (more...) Glycoglycerolipids are distinguished from GSLs by their lipid, having glycans linked to the C-3 hydroxyl of diacylglycerol or alkyl(acyl)glycerol (Figure 11.1).",1.0,0.6978457133872147,0.7447526464979031,0.027777777777777776,0.9999999999857143,0.2
"Complete the following paragraph: Proteins attached to glycosylphosphatidylinositol (GPI) via their carboxyl termini are generally found in the outer leaflet of the lipid bilayer facing the extracellular environment. The GPI membrane anchor may be conveniently thought of as an alternative to the single transmembrane domain of type-I integral membrane proteins. This chapter reviews the discovery, distribution, structure, biosynthesis, properties, and suggested functions of GPI anchors and related molecules, as well as their roles in diseases.","['The GPI membrane anchor may be conveniently thought of as an alternative to the single transmembrane domain of type-I integral membrane proteins. This chapter reviews the discovery, distribution, structure, biosynthesis, properties, and suggested functions of GPI anchors and related molecules, as well as their roles in diseases. The first tentative evidence for the existence of protein-phospholipid anchors appeared in 1963 with the finding that crude bacterial phospholipase C (PLC) selectively releases alkaline phosphatase from mammalian cells. Phosphatidylinositol (PI)-protein anchors were first postulated in the mid-1970s when highly purified bacterial PI-specific PLCs were observed to release proteins, such as alkaline phosphatase and 5′-nucleotidase, from mammalian plasma membranes.'
 'GPIs are one of the rare instances in which GlcN is found without either an N-acetyl or N-sulfate (as in proteoglycans) moiety (Chapter 17). General structure of glycosylphosphatidylinositol (GPI) anchors attached to proteins. All characterized GPI anchors share a common core consisting of ethanolamine-PO4-6Manα1-2Manα1-6Manα1-4GlcNα1-6myo-inositol-1-PO4-lipid. (more...) Beyond the common core, the structures of mature GPI anchors are quite diverse, depending on both the protein to which they are attached and the organism in which they are synthesized (Figure 12.1; Online Appendix 12B). Modifications to the core include additional EtNP and a wide variety of linear and branched glycosyl substituents of largely unknown function. There is considerable variation in the PI moiety.'
 'The substructure Manα1-4GlcNα1-6myo-inositol-1-P-lipid is a universal hallmark of GPI anchors and related structures. All but one protein-linked GPI anchor share a larger common core structure (Figure 12.1; Online Appendix 12B, panels I–IV). The protein–carbohydrate association in GPI-APs is unique in that the reducing terminus of the GPI oligosaccharide is not attached to the protein but to the D-myo-inositol head group of a PI moiety by an α1-6 linkage. A distal, nonreducing mannose (Man) is attached to the protein via an ethanolamine phosphate (EtNP) bridge between its C-6 hydroxyl and the α-carboxyl group of the carboxy-terminal amino acid.'
 'Similarly, GPI-anchored CD14 (the LPS/LPS-binding protein receptor) requires to partner transmembrane Toll-like receptor-4, and can function equally well with a GPI anchor or with a spliced transmembrane domain. The replacement of carboxy-terminal transmembrane domains of type-I integral membrane proteins by GPIsps allows their expression as GPI-APs on the plasma membrane of transfected mammalian cells. This offers a useful method for producing soluble forms of membrane proteins. For example, the T-cell receptor was rendered soluble after it was expressed in the GPI-anchored form (by the action of bacterial PI-PLC), and not by simply expressing the transmembrane-deleted domain. In addition, purified GPI-APs can be used to coat hydrophobic surface plasmon resonance chips, thus providing a convenient method for orienting and presenting proteins for binding studies. It is clear that purified GPI-APs will spontaneously insert into lipid bilayers.'
 'The range of described GPI-APs and the distribution of putative GPI biosynthesis genes suggests that (1) GPI anchors are almost ubiquitous among eukaryotes; (2) GPI-APs are functionally diverse and include hydrolytic enzymes, adhesion molecules, complement regulatory proteins, receptors, protozoan coat proteins, and prion proteins; and (3) in mammals, alternative messenger RNA (mRNA) splicing may lead to the expression of transmembrane and/or soluble and GPI-anchored forms of the same gene product. These variants may be developmentally regulated. For example, neural cell adhesion molecule (NCAM) exists in GPI-anchored and soluble forms when expressed in muscle and in GPI-anchored and two transmembrane forms when expressed in brain. The substructure Manα1-4GlcNα1-6myo-inositol-1-P-lipid is a universal hallmark of GPI anchors and related structures.'
 'It is clear that purified GPI-APs will spontaneously insert into lipid bilayers. The physiological significance of direct GPI-protein exchange between membranes is still uncertain, particularly because all mammals express potent GPI-PLD activity in serum that can remove the lipid (phosphatidic acid) component of the anchor and, thus, prevent GPI-protein re-insertion. However, the re-insertion property of GPI-APs has been exploited experimentally to “paint” exogenous proteins onto cell surfaces. GPI anchors are essential for life in some, but not all, eukaryotic microbes. In S. cerevisiae, and probably most fungi, the presence of a GPI anchor targets certain mannoproteins for covalent incorporation into the β-glucan layer of the cell wall via a transglycosylation reaction, whereby Man-1 within the GPI-anchor core is transferred to the β-glucan polymer, probably by the actions of Dfg5 and Dcw1.'
 'It follows that inositol-acylated GPI proteins with three fatty-acid chains should be more stably associated. On the other hand, Leishmania LPG, with a single C24:0 alkyl chain, has a half-life of only minutes at the cell surface and is secreted intact into the medium. The thermodynamics of bilayer interactions also depend on the length and degree of saturation of the fatty-acid chains. In this regard, the saturated nature of most (but not all) mammalian GPI anchors (Online Appendix 12B, panels III and IV) is thought to explain why GPI-APs associate with “lipid rafts.” The current model for mammalian lipid rafts is that of transient liquid-ordered nanoclusters of membrane components. These are dependent on dynamic cortical actin asters that, through adaptor proteins, cluster phosphatidylserine (PS) on the inner face of the plasma membrane bilayer.']","Proteins attached to glycosylphosphatidylinositol (GPI) via their carboxyl termini are generally found in the outer leaflet of the lipid bilayer facing the extracellular environment. The GPI membrane anchor may be conveniently thought of as an alternative to the single transmembrane domain of type-I integral membrane proteins. This chapter reviews the discovery, distribution, structure, biosynthesis, properties, and suggested functions of GPI anchors and related molecules, as well as their roles in diseases. GPI anchors are one of the rare instances in which GlcN is found without either an N-acetyl or N-sulfate moiety, and they share a common core structure consisting of ethanolamine-PO4-6Manα1-2Manα1-6Manα1-4GlcNα1-6myo-inositol-1-PO4-lipid. The structures of mature GPI anchors are diverse, depending on the protein and organism, with modifications including additional EtNP and various glycosyl substituents.","The first tentative evidence for the existence of protein-phospholipid anchors appeared in 1963 with the finding that crude bacterial phospholipase C (PLC) selectively releases alkaline phosphatase from mammalian cells. Phosphatidylinositol (PI)-protein anchors were first postulated in the mid-1970s when highly purified bacterial PI-specific PLCs were observed to release proteins, such as alkaline phosphatase and 5′-nucleotidase, from mammalian plasma membranes. By 1985, these predictions were confirmed by compositional and structural data from studies on Torpedo acetylcholinesterase, human and bovine erythrocyte acetylcholinesterase, rat Thy-1, and the sleeping sickness parasite Trypanosoma brucei variant surface glycoprotein (VSG). The first complete GPI structures, which were for T. brucei VSG and rat Thy-1, were solved in 1988 (Chapter 1, Figure 1.3). To date, hundreds of GPI-anchored proteins (GPI-APs) have been identified in many eukaryotes, ranging from protozoa and fungi to plants and humans (Online Appendix 12A).",0.7777777777777778,0.721226987709065,0.7712618494143495,0.027777777777777776,0.9999999999857143,0.4
"Complete the following paragraph: Other classes of eukaryotic glycoprotein glycosylation  EGF repeats, also known as EGF domains, are small protein domains (∼40 amino acids) defined by six conserved Cys residues, which form three disulfide bonds (Figure 13.1A). They are found in a few hundred cell-surface and secreted proteins in metazoans and, depending on their sequence, may be modified with O-glycans as described in Table 13.1.","['Monoclonal antibodies that detect glycans on specific proteins such as α-dystroglycan provided tools to identify other novel glycans. In addition, mass spectrometry revealed unusual protein modifications, such as mannose linked to protein as a C-glycoside. Table 13.1 describes many of the less common linkages synthesized in the endoplasmic reticulum (ER)–Golgi secretory pathway. Chapters 18 and 19 describe the very few known glycosylation linkages synthesized in the nucleus and cytoplasm. Other classes of eukaryotic glycoprotein glycosylation  EGF repeats, also known as EGF domains, are small protein domains (∼40 amino acids) defined by six conserved Cys residues, which form three disulfide bonds (Figure 13.1A).'
 'They are found in a few hundred cell-surface and secreted proteins in metazoans and, depending on their sequence, may be modified with O-glycans as described in Table 13.1. Proteins with EGF repeats harboring these O-glycans include several involved in blood clot formation and dissolution, and the Notch family of receptors and canonical Notch ligands (Delta and Serrate/Jagged) involved in cell fate decisions. These glycan modifications are important because they regulate signal transduction during embryonic development and adult organ maintenance, cell differentiation, and the growth of several cancers. Moreover, mutations in several enzymes involved in the addition or elongation of these glycans have been found in human diseases (Chapter 45). Modifications of epidermal growth factor (EGF) repeats. (A) EGF repeats can be modified by O-fucose, O-glucose, and O-GlcNAc.'
 'Modifications of epidermal growth factor (EGF) repeats. (A) EGF repeats can be modified by O-fucose, O-glucose, and O-GlcNAc. A schematic representation of an EGF repeat is shown: (yellow) conserved Cys residues; (gray lines between the cysteines) disulfide-bonding (more...) The signaling pathway best known to be regulated by O-glycans on EGF repeats is the Notch signaling pathway. Notch was originally identified in Drosophila, and homologs have been found in all metazoans, with four Notch receptors in mammals. Activation of Notch signal transduction is controlled at numerous levels, and dysregulation of Notch signaling results in a number of human diseases, including several types of cancer and a variety of developmental disorders. Two classes of canonical ligands bind to and activate Notch signaling in Drosophila: Delta and Serrate.'
 'Some ER glycosylation enzymes are synthesized as soluble proteins. These include the UDP-glucose glycoprotein glucosyltransferase (UGGT) involved in ER quality control (Chapter 39), and enzymes involved in epidermal growth factor (EGF) repeat or thrombospondin type 1 repeat (TSR) glycosylation such as the two protein O-fucosyltransferases, POFUT1 (EGF-like repeats) and 2 (TSR), protein O-glucosyltransferases 1, 2, and 3 (POGLUT1-3; EGF-like repeats), EGF-specific O-GlcNAc transferase (EOGT; EGF-like repeats), and β1-3-glucosyltransferase (B3GLCT; TSR) (Chapter 13). In addition, one of the sulfotransferases involved in heparan sulfate synthesis, GlcNAc 3-O-sulfotransferase 1, is a soluble enzyme in the Golgi.'
 'Consistently, EOGT in mice regulates vascular development and integrity by potentiating Delta-like ligand-mediated Notch signaling. O-Fucose is also found on TSRs. Similar to EGF repeats, TSRs are small protein domains (50–60 amino acids) with six conserved Cys that form three disulfide bonds (Figure 13.4). Like EGF repeats, TSRs are found in a subset of cell-surface and secreted proteins in metazoans, and they appear to function in protein–protein interactions. The O-fucose site occurs between the first and second conserved Cys residues at the putative consensus sequence C1X2(S/T)C2 in TSRs in about 50 proteins (Table 13.1). The O-fucose on TSRs can be elongated to form the disaccharide Glcβ1-3Fucα-O-Ser/Thr, first observed in 1975 in glycosides from human urine.'
 'Homologs of POGLUT1, termed POGLUT2 and POGLUT3, are responsible for modifying this site. The O-glucose at this site has not been reported to be elongated past the monosaccharide. Although β-linked O-GlcNAc is very common on proteins in the nuclear and cytosolic compartments (Chapter 19), the same modification can be found in comparatively few membrane and secreted proteins. Addition of O-GlcNAc occurs between the fifth and sixth conserved Cys of an EGF repeat at the putative consensus C5XXXX(S/T)GX2-3C6 (Figure 13.1A) in mouse and Drosophila Notch. However, sites have been mapped on only a few proteins. The O-GlcNAc can be elongated by β1,4Gal followed by a sialic acid to form Siaα2-3/6Galβ1-4GlcNAc.'
 'Most proteins in the blood plasma of animals (with the exception of albumin) are also heavily glycosylated, and the glycosylation of these and other secreted proteins may provide solubility, hydrophilicity, and negative charge, thus reducing unwanted intermolecular interactions and protecting against proteolysis. Cell-surface membrane proteins like receptors, adhesion molecules, and channels are typically glycosylated, and this modification can promote their proper folding, ensure their stability, and impact function. The classic work of George Palade indicated that most cell-surface and secreted proteins in eukaryotic cells are cotranslationally translocated into the ER where they are folded, modified, and subjected to quality control mechanisms. They then make their way via an intermediate compartment (IC) through multiple stacks of the Golgi apparatus, finally being distributed to various destinations from the trans-Golgi network (TGN).']","Proteins with EGF repeats harboring O-glycans include several involved in blood clot formation and dissolution, and the Notch family of receptors and canonical Notch ligands (Delta and Serrate/Jagged) involved in cell fate decisions. These glycan modifications are important because they regulate signal transduction during embryonic development and adult organ maintenance, cell differentiation, and the growth of several cancers. Moreover, mutations in several enzymes involved in the addition or elongation of these glycans have been found in human diseases.","Proteins with EGF repeats harboring these O-glycans include several involved in blood clot formation and dissolution, and the Notch family of receptors and canonical Notch ligands (Delta and Serrate/Jagged) involved in cell fate decisions. These glycan modifications are important because they regulate signal transduction during embryonic development and adult organ maintenance, cell differentiation, and the growth of several cancers. Moreover, mutations in several enzymes involved in the addition or elongation of these glycans have been found in human diseases (Chapter 45).",1.0,0.7057680378235254,0.9924523901275124,0.05555555555555555,0.9999999999857143,1.0
"Complete the following paragraph: Blood banks perform typing and cross-matching assays. First, units of erythrocyte products typed for the A and B antigens are chosen to match the patient's ABO type. To ensure that these are truly “compatible,” the patient's serum is cross-matched by mixing with a small aliquot of each prospective erythrocyte unit. Erythrocytes of compatible units do not agglutinate (form an erythrocyte clump), whereas incompatibility is indicated by agglutinated erythrocytes formed by antibodies in the patient's serum.","[""Blood banks perform typing and cross-matching assays. First, units of erythrocyte products typed for the A and B antigens are chosen to match the patient's ABO type. To ensure that these are truly “compatible,” the patient's serum is cross-matched by mixing with a small aliquot of each prospective erythrocyte unit. Erythrocytes of compatible units do not agglutinate (form an erythrocyte clump), whereas incompatibility is indicated by agglutinated erythrocytes formed by antibodies in the patient's serum. Blood typing is used to ensure compatibility not only for red blood cell transfusions but also for transfusion with platelets and plasma. Similar ABO compatibility concerns are important in heart, kidney, liver, and bone marrow transplantation procedures. The “type and cross” procedures have virtually eliminated ABO blood group transfusion reactions in the developed world.""
 ""Anti-H(O) antibodies are not made in most people because a substantial fraction are converted to A or B determinants or they are a “self” antigen. IgM isoagglutinins efficiently trigger the complement cascade and circulate in human plasma at titers sufficient to cause complement-dependent lysis of transfused erythrocytes that display the corresponding blood group antigens. Such rapid erythrocyte lysis causes an immediate, acute transfusion reaction, which can lead to hypotension, shock, acute renal failure, and death from circulatory collapse. This problem is avoided by ensuring that the ABO type of transfused erythrocytes is compatible with the recipient's ABO type. Thus, an A recipient may receive erythrocytes from A or O persons but not from a person of type B or AB. Blood banks perform typing and cross-matching assays. First, units of erythrocyte products typed for the A and B antigens are chosen to match the patient's ABO type.""
 'The “type and cross” procedures have virtually eliminated ABO blood group transfusion reactions in the developed world. Attempts are being made to enzymatically modify A or B erythrocytes using glycosidases to remove GalNAc (A) and/or Gal (B), in order to convert them to “O”, the “universal donor” type. The few individuals with AB type are “universal acceptors.” In addition to accurately typing AB blood types, A1 and A2 blood group distinctions are important clinically as A2 individuals can generate anti-A1 antibodies, although these antibodies are often not clinically meaningful. Furthermore, when crossing ABO(H) barriers during solid organ transplantation, A2 donor organs have better overall survival when compared to A1 following transplantation into a blood group O or B recipient; this is presumably because of the lower expression of the A antigen in A2 individuals. In addition to transfusion and transplantation, ABO(H) alloantigens are some of the most frequent allogeneic barriers crossed during fetal development.'
 'These and other less prominent glycan antigens can cause hemolytic transfusion and rejection reactions, mostly because of errors in blood typing. Although anti-A and anti-B titers likely influence transfusion and transplantation outcomes, simple assessment of antibody levels fails to fully account for the clinical impact(s) of an ABO(H) incompatible transfusion. Efforts to generate “universal donor” red blood cells, via enzymatic conversion of blood group A and B antigens to the O state using bacterial enzymes, are underway. Occasionally, patients with diseases such as cirrhosis and hepatocellular carcinoma spontaneously secrete a circulating anticoagulant and have an unusual coagulation test profile that makes it appear as if the patient has been treated with heparin. The anticoagulant activity can be purified from the plasma and has been identified as an HS glycosaminoglycan. Its source is unknown and therapy is difficult without correcting the underlying disease or transplanting the liver.'
 'Interestingly, plant lectins were used historically to aid in typing blood. For example, the lectin from Dolichos biflorus agglutinates erythrocytes from most blood group A individuals (termed A1 individuals), but it does not agglutinate erythrocytes from individuals of the A2 subgroup, and it is still used currently to distinguish individuals with these two different blood types. The A1 and A2 subgroup antigens are distinct (Figure 14.5) reflecting the different A transferases encoded by the A1 versus A2 allele at the ABO locus. Heritable erythrocyte antigenic polymorphisms determined by the ABO locus have important medical implications. Early in the postnatal period, the immune system generates IgM antibodies against ABO antigen(s), even though they are absent from erythrocytes. This is because glycan antigens similar or identical to the A and B blood group determinants are carried by colonizing bacteria and fungi.'
 'This was the first example of antibody-mediated immunosuppression clinically and formed the basis of highly successful anti-RhD formularies designed to prevent Rh alloimmunization and therefore hemolytic disease of the fetus and newborn. Cross-matching procedures helped to identify a rare ABO blood group phenotype termed the Bombay phenotype, so named because the first identified individual lived in that city (now Mumbai). Affected persons have erythrocytes and tissue cells lacking A, B, and H determinants because they have inactive FUT1 and FUT2 genes, and therefore no α1-2FucT enzyme. Bombay sera contain IgM antibodies that react with erythrocytes from virtually all donors, including O erythrocytes (H antigen-positive, A and B antigen-negative). They show robust titers of anti-H, anti-A, and anti-B IgM antibodies and cannot receive erythrocytes from any donor except those of the same Bombay blood type.'
 'In addition to transfusion and transplantation, ABO(H) alloantigens are some of the most frequent allogeneic barriers crossed during fetal development. IgG anti-A,B antibodies present in blood group O mothers, which react with the A and B antigen, can cross the placenta and engage A or B antigens on the surface of fetal red blood cells (RBCs). However, unlike IgG antibodies against other alloantigens, such as RhD, IgG anti-A,B antibodies rarely cause life-threatening anemia in a fetus or neonate, presumably because of the relatively low level of A and B antigen expression present on fetal RBCs. However, despite the lower level of A and B expression on fetal RBCs, anti-A and anti-B antibodies present in maternal circulation can rapidly remove A or B positive fetal RBCs following exposure during parturition, reducing the probability of alloimmunization to other alloantigens.']","Erythrocytes of compatible units do not agglutinate, whereas incompatibility is indicated by agglutinated erythrocytes formed by antibodies in the patient's serum. Blood typing is used to ensure compatibility not only for red blood cell transfusions but also for transfusion with platelets and plasma. Similar ABO compatibility concerns are important in heart, kidney, liver, and bone marrow transplantation procedures. The “type and cross” procedures have virtually eliminated ABO blood group transfusion reactions in the developed world.","Blood typing is used to ensure compatibility not only for red blood cell transfusions but also for transfusion with platelets and plasma. Similar ABO compatibility concerns are important in heart, kidney, liver, and bone marrow transplantation procedures. The “type and cross” procedures have virtually eliminated ABO blood group transfusion reactions in the developed world. Attempts are being made to enzymatically modify A or B erythrocytes using glycosidases to remove GalNAc (A) and/or Gal (B), in order to convert them to “O”, the “universal donor” type. The few individuals with AB type are “universal acceptors.” In addition to accurately typing AB blood types, A1 and A2 blood group distinctions are important clinically as A2 individuals can generate anti-A1 antibodies, although these antibodies are often not clinically meaningful. Furthermore, when crossing ABO(H) barriers during solid organ transplantation, A2 donor organs have better overall survival when compared to A1 following transplantation into a blood group O or B recipient; this is presumably because of the lower expression of the A antigen in A2 individuals.",1.0,0.6579822588378116,0.8446739612679575,0.0975609756097561,0.9999999999857143,1.0
"Complete the following paragraph: Given their high density and widespread location on vertebrate cells, Sias also exert many functions via electronegative charge, such as repulsion of cell–cell interactions, protein stabilization, ion binding, and ion transport. Early nomenclature of these molecules was tied to their discovery, being first isolated by Gunnar Blix from salivary mucins in 1936 and independently by Ernst Klenk from brain glycolipids in 1941. Blix named his substance “sialic acid” after the Greek word for saliva (σíαλoν), and Klenk named his “neuraminic acid” for neurons in the brain. By the time the relationship of these substances became evident, both names were already in use and have persisted.","['NulOs are among the most rapidly evolving classes of monosaccharides in nature and exist in tremendous variety, particularly in the microbial world. Given their high density and widespread location on vertebrate cells, Sias also exert many functions via electronegative charge, such as repulsion of cell–cell interactions, protein stabilization, ion binding, and ion transport. Early nomenclature of these molecules was tied to their discovery, being first isolated by Gunnar Blix from salivary mucins in 1936 and independently by Ernst Klenk from brain glycolipids in 1941. Blix named his substance “sialic acid” after the Greek word for saliva (σíαλoν), and Klenk named his “neuraminic acid” for neurons in the brain. By the time the relationship of these substances became evident, both names were already in use and have persisted.'
 'As with the glycome, each cell type in each species expresses its own distinct sialome. For example, although mammalian liver sialoglycans are most abundant on glycoproteins, brain sialoglycans are much more abundant as sialoglycolipids (Chapter 11), so much so that they are termed “gangliosides” for the nerve ganglia on which they were discovered. The sialome also varies markedly in response to environmental cues. Sias can also exist as internally linked structures rather than on termini of glycans. In vertebrates, the terminal Sia of a glycan chain is rarely extended further, except with another Sia (Figure 15.3). Among bacteria, Sias and the related NulOs can also be found in diverse cellular structures, including capsular polysaccharides, lipopolysaccharide O-antigens or as part of flagella, pili, or structures such as the cell wall or S-layer (Chapter 21).'
 'Similar 9-carbon backbone 2-keto acid monosaccharides were later discovered in some bacterial lipopolysaccharides and initially called “bacterial sialic acids.” The resulting confusion was resolved by suggesting that the term “sialic acid” (Sia) be limited to its original use in describing neuraminic acid (Neu), Kdn, and their derivatives in deuterostomes and their pathogens, and that the term “nonulosonic acid” (NulO) be used to encompass the entire group of 9-carbon backbone non-2-ulosonic acids (Figure 15.1). Base structures representing the larger family of NulO molecules are shown in Figure 15.1 for comparison. This chapter will largely deal with the biology, metabolism, and functions of Sias in mammals. The evolution, distribution, and functions of the larger family of NulOs are briefly described toward the end of this chapter.'
 'Clustered sialoglycans along the polypeptide chain can also protect the underlying protein from proteases. Membrane-bound sialoglycans on glycoproteins and glycolipids, which are often quite dense, provide cell surface anionic charge that acts as a barrier and regulates cell surface functions. An extreme example of these biophysical effects is polySia, whose functional impacts are detailed above. Given Sia abundance on cell surfaces (see Figure 15.3), it is not surprising that numerous animal pathogens evolved to target these molecules. Indeed, highly specific Sia-binding proteins were first discovered on human pathogens and their toxins. In the search for host cell receptors for influenza viruses, it was discovered that isolated viruses cross-linked red blood cells, resulting in hemagglutination. Over time, the red cells dispersed and could no longer be agglutinated by fresh viruses.'
 'Such modifications can determine or modify recognition by Sia-binding proteins and direct Sia function. Despite this complexity, it may be sufficient in some biological studies to simply know that a generic Sia residue is present at the terminal position of a glycan under study (a red diamond in the symbol nomenclature system) (Figure 15.2). Dehydro-Sias also exist in nature. For example, Neu2en5Ac (2,3-dehydro-2-deoxy-N-acetylneuraminic acid, sometimes called DANA) has natural inhibitory properties toward sialidases and was the starting point for the design of more potent inhibitors such as the anti-influenza drug Relenza (Chapter 57). Hierarchical levels of sialome complexity.'
 'Sias liberated by sialidases at mucosal sites also provide nutrients for some bacteria or provide access to underlying carbohydrates. Viral neuraminidases facilitate release and spreading of newly formed viruses, and specific viral neuraminidase inhibitors are widely used as the antiviral drugs such as anti-influenza A virus drugs Relenza and Tamiflu (Chapter 42). Once a free Sia molecule is released in the lysosome of a vertebrate cell, it is returned to the cytosol by a specific exporter (SLC17A5, also called Sialin), in which it is either reused or degraded. Human mutations in Sialin cause Salla disease and infantile sialic acid storage disease, resulting in accumulation of Sia in lysosomes and excretion of excess Sia in the urine. Some pathogens scavenge Sias from the extracellular space, using high-efficiency transporters to concentrate them from trace levels.'
 'They are also essential components of recognition molecules, with roles that vary according to cell type, tissue type, and species. The first mammalian Sia-binding protein found was the complement regulatory molecule factor H, a soluble serum factor that binds cell-surface Sias and protects cells from autoimmune attack, providing recognition of “self-associated molecular patterns” (SAMPs), which are also recognized by CD33-related Siglecs (Chapter 35). Human mutations in the Sia-binding site of factor H result in atypical hemolytic uremic syndrome in humans, a disease caused by excessive complement activation, because of the failure of factor H function. Other variations of the factor H polyanion binding region increase the risk of age-dependent macular degeneration, a common cause of blindness resulting from inflammation in the eye retina. Sias are also involved in interactions of white blood cells with the endothelial lining of blood vessels. Circulating neutrophils must bind to and move across the blood vessel wall to clear bacterial infections in tissues.']","Sias, also known as sialic acids, play crucial roles in various cellular functions due to their presence on vertebrate cells. They contribute to functions such as repulsion of cell-cell interactions, protein stabilization, ion binding, and ion transport. The early nomenclature of these molecules stems from their discovery by Gunnar Blix and Ernst Klenk in the 1930s and 1940s, with Blix naming his discovery ""sialic acid"" and Klenk naming his ""neuraminic acid.""","Although 5-N-acetylneuraminic acid (Neu5Ac, sometimes called “NANA”) is the most common sialic acid (Sia) in humans, the Sia family is comprised of related structures (Figure 15.1) that vary at the C-5 carbon, including 5-N-glycolylneuraminic acid (Neu5Gc) and 3-deoxy-D-glycero-D-galacto-non-2-ulosonic acid (also known as 3-deoxy-nonulosonic acid, 2-keto-3-deoxy-nononic acid, or Kdn) with a hydroxyl group at C-5. Similar 9-carbon backbone 2-keto acid monosaccharides were later discovered in some bacterial lipopolysaccharides and initially called “bacterial sialic acids.” The resulting confusion was resolved by suggesting that the term “sialic acid” (Sia) be limited to its original use in describing neuraminic acid (Neu), Kdn, and their derivatives in deuterostomes and their pathogens, and that the term “nonulosonic acid” (NulO) be used to encompass the entire group of 9-carbon backbone non-2-ulosonic acids (Figure 15.1).",1.0,0.6810412654359734,0.6494543780604736,0.02564102564102564,0.9999999999857143,1.0
"Complete the following paragraph: Large hyaluronan polymers in the extracellular space can be internalized following interaction with cell-surface receptors that trigger endocytosis, which may be facilitated by the membrane-associated hyaluronidases, HYAL2 and/or TMEM2, or through association with CEMIP.","['The current understanding of this catabolic process is that hyaluronidases at the cell surface and in the lysosome cooperate to degrade the chains. Large hyaluronan polymers in the extracellular space can be internalized following interaction with cell-surface receptors that trigger endocytosis, which may be facilitated by the membrane-associated hyaluronidases, HYAL2 and/or TMEM2, or through association with CEMIP. The hyaluronan fragments may be returned to the extracellular space via recycling endosomes or enter a pathway to lysosomes for complete degradation to monosaccharides, probably involving HYAL1 and the two exoglycosidases β-glucuronidase and β-N-acetylglucosaminidase. The importance of the turnover process for growth and survival is demonstrated by the respective embryonic lethal phenotypes in animal models. Hyal2-null mice and Tmem2-deficient zebrafish both suffer embryonic lethality as a result of cardiac developmental defects.'
 'Hyal2-null mice and Tmem2-deficient zebrafish both suffer embryonic lethality as a result of cardiac developmental defects. CEMIP is important for clearing hyaluronan accumulation during bacterial infection in mice. In humans, a lysosomal storage disorder was found to result from mutation of HYAL1 (Chapter 44). Hyaluronan fragments have been suggested to act as an endogenous signal of injury, or during infection by Group A Streptococcus, which contains a hyaluronan capsule. The signaling activity of hyaluronan fragments is mediated through binding of cell-surface receptors, such as CD44, which in turn modulates response through Toll-like receptors. Signaling through these and other receptors is affected by the size of the hyaluronan fragments, but the mechanism underlying the dependence of activity on the size of the fragments remains an area of active research. Hyaluronan has multiple roles in early development, tissue organization, and cell proliferation.'
 'Cytochemical studies using naturally occurring proteins with high-affinity binding to hyaluronic acid have been used to document accumulation of hyaluronic acid in the nuclei of cultured cells. In response to inflammatory conditions, such as hypoglycemia, cells appear to synthesize hyaluronan in intracellular compartments. After cell division, the intracellular hyaluronan is extruded outside cells in cables that recruit inflammatory cells initiating a stress response. Mechanistically, this is likely caused by a redistribution of the hyaluronan synthases to intracellular membranes from the plasma membrane, across which hyaluronic acid is normally extruded (Figure 18.1N). Notably, hyaluronic acid–binding proteins naturally occur within the nucleus raising the possibility of a physiological role for nuclear hyaluronan via interaction with these hyaluronic acid–binding proteins.'
 'The AMR internalizes its ligands captured at the cell surface at physiological pH; via coated pits, the AMR in complex with its ligand is internalized into coated vesicles (Figure 34.4), and changes in pH in late endosomes lead to dissociation of Ca++ from the AMR and release of ligand. The uncomplexed AMR then recycles to the plasma membrane, whereas the ligand is delivered to lysosomes where it is degraded. For some nonrecycling receptors (e.g., dendritic cell [DC]-specific intercellular adhesion molecule-3-grabbing nonintegrin [DC-SIGN]), both the ligand and receptor are targeted to lysosomes and degraded. Internalization of ligands by the AMR in hepatocytes is rapid, occurring in 2–3 minutes, and the receptor recycles to the surface within 4–5 minutes. The efficiency of the AMR in endocytosis has led it to be a target for gene therapy and delivery of molecules to hepatocytes.'
 'Hyaluronan signaling in health and disease. CD44, cluster of differentiation antigen, a type I transmembrane receptor; FAK, focal adhesion kinase; FGF, fibroblast growth factor; HARE, hyaluronan receptor for endocytosis; LYVE-1, lymphatic vessel endothelial (more...) Toll-like receptors TLR2 and TLR4, which are components of the innate immune system responsive to bacterial pro-inflammatory stimuli such as lipopolysaccharide (LPS), have been found to signal differentially in response to the generation of hyaluronan oligosaccharides by hyaluronidase. Depending on cell type, this may occur through direct binding of the hyaluronan oligosaccharides by TLR2/4. Alternatively, because hyaluronan encapsulation can obstruct access of TLR2/4 by other known ligands, hyaluronidase-mediated capsule degradation can also facilitate TLR2/4 activation by allowing other ligands to bind.'
 'Thus, RHAMM is also a nonmotor spindle assembly factor. Hyaluronan binding to RHAMM activates SRC, FAK, ERK (extracellular mitogen-regulated protein kinase), and PKC (protein tyrosine kinase C) (Chapter 40). These pathways are relevant to tumor cell survival and invasion; their inhibition by hyaluronan oligomers and soluble hyaluronan-binding proteins suggests novel therapeutic approaches for treating cancer (Chapter 47). Some pathogenic bacteria (e.g., certain strains of Streptococcus and Pasteurella) produce hyaluronan as an extracellular capsule; also see Chapter 21). Capsular hyaluronan, like other capsular polysaccharides, increases virulence by helping to shield the microbe from host defenses. For example, the capsule blocks phagocytosis and protects against complement-mediated killing. Because bacterial hyaluronan is identical in structure to host hyaluronan, the capsule can also prevent the formation of protective antibodies.'
 'HARE is expressed on the cell surface of a variety of sinusoidal endothelial cell types, where it is capable of binding hyaluronan and other glycosaminoglycan ligands, subsequently triggering receptor-mediated endocytosis and thereby clearing these components from circulation. Signaling occurs optimally during uptake of 50- to 250-kDa hyaluronan; smaller or larger hyaluronan does not activate signaling and blocks signaling by 50- to 250-kDa hyaluronan. Signaling through both TLR2/4 and HARE activate NF-κB and promote the secretion of pro-inflammatory and pro-apoptotic cytokines. CD44 is a transmembrane receptor expressed by many cell types, and it varies markedly in glycosylation, oligomerization, and protein sequence because of differential mRNA splicing. CD44 contains a cytoplasmic domain, a transmembrane segment, and an ectodomain with a single link module that can bind hyaluronan.']","The hyaluronan fragments may be returned to the extracellular space via recycling endosomes or enter a pathway to lysosomes for complete degradation to monosaccharides, probably involving HYAL1 and the two exoglycosidases β-glucuronidase and β-N-acetylglucosaminidase.","The hyaluronan fragments may be returned to the extracellular space via recycling endosomes or enter a pathway to lysosomes for complete degradation to monosaccharides, probably involving HYAL1 and the two exoglycosidases β-glucuronidase and β-N-acetylglucosaminidase.",1.0,0.6451614244891031,1.0000000000000004,0.02631578947368421,0.8095238094968253,1.0
"Complete the following paragraph: Genetic evidence from studies of C. elegans suggests that N-acetylgalactosamine addition during chondroitin assembly is mediated by the same enzyme that is involved in chain polymerization (Sqv5), but biochemical evidence suggests that more than one enzyme may exist in vertebrates. In heparin/heparan sulfate formation, the addition of the first N-acetylglucosamine residue is catalyzed by an enzyme called EXTL3, which differs from the transferases involved in heparan polymerization (called EXT1 and EXT2).","['The function of galactose sulfation in chondroitin sulfate remains unclear. The linkage tetrasaccharide lies at a bifurcation in the biosynthetic pathway: addition of β4-linked N-acetylgalactosamine, which initiates chondroitin sulfate assembly, or addition of α4-linked N-acetylglucosamine, which initiates heparan sulfate assembly (Figure 17.4). Genetic evidence from studies of C. elegans suggests that N-acetylgalactosamine addition during chondroitin assembly is mediated by the same enzyme that is involved in chain polymerization (Sqv5), but biochemical evidence suggests that more than one enzyme may exist in vertebrates. In heparin/heparan sulfate formation, the addition of the first N-acetylglucosamine residue is catalyzed by an enzyme called EXTL3, which differs from the transferases involved in heparan polymerization (called EXT1 and EXT2).'
 '17.1). Addition of the first hexosamine commits the intermediate to either (more...) After xylose addition, a linkage tetrasaccharide assembles by the transfer of two galactose residues catalyzed by unique members of the β4 galactosyl-, β3 galactosyl-, and β3 glucuronosyltransferase families of enzymes (Figure 17.4). This intermediate can undergo phosphorylation at the C-2 position of xylose and in the case of chondroitin sulfate, sulfation of the galactose residues. In general, phosphorylation and sulfation occur substoichiometrically, but phosphorylation may be transient. Phosphorylation occurs early in the assembly process and creates the preferred substrate for B4GALT7; a phosphatase removes the phosphate at a later stage of biosynthesis. The function of galactose sulfation in chondroitin sulfate remains unclear.'
 'Vertebrates also express homologs that can transfer individual sugars to the chain. Chondroitin polymerization also requires the action of the chondroitin polymerizing factor (CHPF), a protein that lacks independent activity but collaborates with the polymerases to enhance the formation of polymers. Sulfation of chondroitin in vertebrates is a complex process, with multiple sulfotransferases involved in 4-O-sulfation and 6-O-sulfation of N-acetylgalactosamine residues (Figure 17.5). Biosynthesis of chondroitin sulfate/dermatan sulfate involves the polymerization of N-acetylgalactosamine and glucuronic acid units and a series of modification reactions including O-sulfation and epimerization of glucuronic acid to iduronic acid.'
 'Chst1 and 5 can add sulfate groups at the indicated positions. The actual order of the various sulfated and nonsulfated (more...) Two classes of glycosaminoglycan chains—chondroitin sulfate/dermatan sulfate and heparan sulfate/heparin—are linked to serine residues in proteins by way of xylose (Figure 17.4). Xylosyltransferase initiates the process using UDP-xylose as donor. Two isoforms of the enzyme are known in vertebrates (XYLT1 and XYLT2), but only one isozyme exists in C. elegans and D. melanogaster. A glycine residue invariably lies to the carboxy-terminal side of the serine attachment site, but a perfect consensus sequence for xylosylation does not exist. At least two acidic amino acid residues are usually present, and they can be located on one or both sides of the serine, usually within a few residues.'
 'In contrast, invertebrates such as C. elegans and D. melanogaster make either nonsulfated or low sulfated chains. The assembly process for the backbone appears to be highly conserved, based on the presence of homologous genes for all of the reactions (Chapters 25 and 26). As described above, the assembly process is initiated by the transfer of GalNAcβ3 to the linkage tetrasaccharide (Figure 17.4). In both vertebrates and invertebrates, the polymerization step is catalyzed by one or more bifunctional enzymes (chondroitin synthases) that have both β3 glucuronosyltransferase and β4 N-acetylgalactosaminyltransferase activities. Vertebrates also express homologs that can transfer individual sugars to the chain.'
 '6-O-Sulfation of N-acetylglucosamine occurs on the nonreducing terminal residue, encouraging further chain elongation, whereas sulfation of galactose residues takes place on nonreducing terminal and internal galactose residues, with a preference for galactose units adjacent to a sulfated N-acetylglucosamine residue. Sulfation of a nonreducing terminal galactose residue blocks further elongation of the chain, providing a potential mechanism for controlling chain length. The poly-N-acetyllactosamine chains of KS I are generally longer than those of KS II and may contain up to 50 disaccharide units (20–25 kDa). The chains can be fucosylated and sialylated as well (Chapter 14). Vertebrate chondroitin sulfate consists of repeating sulfate-substituted GalNAcβ4GlcAβ3 disaccharides polymerized into long chains (Figure 17.2).'
 'The enzyme transfers the acetyl group from acetyl-CoA to CMP-Neu5Ac. As such, it is the sialytransferase-mediated delivery of 9-O-acetylated sialic to acceptor substrates that leads to the 9-O-acetylated glycoconjugates observed. 9-O-acetylated sialic acid plays a role in CD22 signaling, a process regulated by the opposing action of a sialate 9-O-acetylesterase (SIAE). It also serves as receptor or coreceptor for influenza C and a number of coronaviruses. N-Deacetylation of N-acetylglucosamine residues to glucosamine occurs during heparin/heparan sulfate formation (Chapter 17), lipopolysaccharide assembly (Chapters 21 and 22), and GPI-anchor synthesis (Chapter 12). The bacterial enzyme is zinc-dependent, but in-depth studies of the vertebrate N-deacetylases have not been performed.']","In chondroitin assembly, genetic evidence from studies of C. elegans indicates that N-acetylgalactosamine addition is mediated by the same enzyme involved in chain polymerization (Sqv5). However, biochemical evidence suggests that more than one enzyme may exist in vertebrates. On the other hand, in heparin/heparan sulfate formation, the addition of the first N-acetylglucosamine residue is catalyzed by an enzyme called EXTL3, which is distinct from the transferases involved in heparan polymerization (EXT1 and EXT2).","These enzymes are important control points because they ultimately regulate the type of glycosaminoglycan chain that will assemble. Control of the addition of β4GalNAc or α4GlcNAc appears to be manifested at the level of enzyme recognition of the polypeptide substrate. Keratan sulfate chains contain a mixture of nonsulfated (Galβ4GlcNAcβ3), monosulfated (Galβ4GlcNAc6Sβ3), and disulfated (Gal6Sβ4GlcNAc6Sβ3) disaccharide units (Figure 17.2).",1.0,0.8206511467092318,0.6810157086409743,0.05555555555555555,0.9999999999857143,0.0
"Complete the following paragraph: Highly conserved homologs of OGT and OFT are found in numerous bacterial genomes, although studies of their functional roles are essentially nonexistent.","['The enzyme was first identified and purified from rat liver and subsequently cloned from rat, human, Caenorhabditis elegans, and other organisms. OGT resides on the X chromosome (Xq13 in humans) near the centromere and is among the most highly conserved proteins from worms to man. Mutations in OGT, both in its tetratricopeptide repeats (TPRs) and in its catalytic domain, cause X-linked intellectual disability in humans. To date, three isoforms of OGT have been well characterized: (1) the nucleocytoplasmic or full-length variant (ncOGT), which is 110 kDa; (2) a short isoform of OGT (sOGT), which is 78 kDa; and (3) a variant of OGT that is targeted to the mitochondria (mOGT; ∼90 kDa).'
 '(B) Complex (c) glycosylation in the cytoplasm by O-GlcNAc transferases (GTs) that extend the first sugar. (C) Cytoplasmic monoglycosylation (more...) Examples of nuclear or cytoplasmic glycosylation events  Highly conserved homologs of OGT and OFT are found in numerous bacterial genomes, although studies of their functional roles are essentially nonexistent. An example of bacterial monoglycosylation that leads to a known function comes from the EF-P protein, the bacterial homolog of eukaryotic elongation initiation factor 5a. In some bacteria, EF-P suppresses translational stalling by a mechanism that involves oxidation of a critical lysyl residue, and its eukaryotic ortholog is regulated by hypusylation.'
 'In the nucleus and cytoplasm, OGT appears to form multimers, consisting of one or more 110-kDa subunits and 78-kDa subunits. Several useful small molecule inhibitors of OGT have been developed, including OSMI-4b, Ac45SGlcNAc, and 5SGlcNHex, with the latter effective in animal models. However, some off-target effects have been reported for these inhibitors, likely because they impact other enzymes that use UDP-GlcNAc. ncOGT has two distinct domains separated by a putative nuclear localization sequence. The amino terminus of each OGT subunit contains TPRs, which can number up to 13 (species-dependent). The major variation between the three (above) variants is in the number of the TPRs.'
 'The highly homologous and conserved nature of OGT among metazoans allows a transgene encoding the human sequence of OGT to be used to rescue OGT null Drosophila melanogaster. Recently, OGA has been disrupted in both C. elegans and mammalian models. Like the OGT null, the C. elegans OGA null has defective carbohydrate metabolism and abnormalities in dauer formation. In contrast to the OGT null, in C. elegans in which OGA has been disrupted, the worms have an extended life span. In murine models, deletion of OGA leads to perinatal lethality, genomic instability and severe epigenetic and metabolic phenotypes. The OGA heterozygous mouse shows widespread changes in transcription and metabolism, and an enhanced dependence on glucose metabolism. Studies from numerous laboratories have described O-GlcNAcylated proteins from virtually all cellular compartments, representing nearly all functional classes of protein (Figure 19.2; Table 19.1).'
 'Similarly, the gene encoding α-1,3-galactosyltransferase (A3GALT2) is functional in the mouse but not in human (Chapter 20). The human and fly genomes include orthologous genes encoding GTs that catalyze the same reaction, but they also have GTs that are unique. Thus, protein O-fucosyltransferase 1 (POFUT1) in mammals and Ofut1 in flies transfer fucose to Notch receptors and are examples of an evolutionarily conserved GT. In contrast, flies do not make complex N-glycans with four branches, which are common in mammalian glycoproteins (Chapters 9 and 20). Additionally, flies make unique glycolipids absent from mammals that are important for conserved signaling pathways mediated by the epidermal growth factor (EGF) receptor or Notch receptors (Chapter 26).'
 'A splicing variant is also found in animal mitochondria in which O-GlcNAcylation is found on respiratory enzymes. A highly related enzyme lineage, termed O-fucosyltransferase (OFT), mediates the addition of O-fucose (O-Fuc) to dozens of nucleocytoplasmic proteins in plants, numerous protists, and possibly bacteria. The OFT was first discovered genetically in plants as Spy, in which it controls transcriptional processes. In the protist pathogen Toxoplasma gondii, OFT modifies numerous proteins involved in transcription, mRNA biogenesis, nuclear transport, and cell signaling. Recently, Greb1, derived from another lineage of enzymes, was shown to O-β-GlcNAcylate estrogen receptor-α and potentially other nuclear proteins, which if verified is an interesting example of convergent evolution.'
 'However, to date no OGA ortholog has been identified in plants or protozoans. Plants encode two OGT paralogs: SECRET AGENT (SEC) and SPY. Curiously, whereas SEC encodes an O-GlcNAc transferase, SPY encodes a fucosyltransferase. Notably, the SPY paralog in Dictyostelium discoideum, Giardia lamblia, Cryptosporidium parvum, and Toxoplasma gondii also fucosylates proteins. To date, O-GlcNAc and the enzymes that control its cycling do not appear to exist in yeast, such as Saccharomyces cerevisiae or Schizosaccharomyces pombe. However, recently, it was discovered that S. cerevisiae have O-mannose moieties on the same proteins and at the same sites on which O-GlcNAc is found in multicellular organisms.']","Highly conserved homologs of OGT and OFT are found in numerous bacterial genomes, although studies of their functional roles are essentially nonexistent. An example of bacterial monoglycosylation that leads to a known function comes from the EF-P protein, the bacterial homolog of eukaryotic elongation initiation factor 5a. In some bacteria, EF-P suppresses translational stalling by a mechanism that involves oxidation of a critical lysyl residue, and its eukaryotic ortholog is regulated by hypusylation.","An example of bacterial monoglycosylation that leads to a known function comes from the EF-P protein, the bacterial homolog of eukaryotic elongation initiation factor 5a. In some bacteria, EF-P suppresses translational stalling by a mechanism that involves oxidation of a critical lysyl residue, and its eukaryotic ortholog is regulated by hypusylation. A recent phylogenetic analysis of EF-P sequences revealed a subset of enzymes with an Arg in place of Lys, and a coevolving gene that was subsequently identified by biochemistry and mass spectrometry as an argininyl rhamnosyltransferase. Assembly of the Rha-Arg linkage activates EF-P and is required for pathogenicity of Pseudomonas, a Gram-negative, opportunistic human pathogen, and a number of other bacteria. The discovery of this linkage by a phylogenetic approach suggests that more noncanonical examples of glycosylation are yet to be discovered.",0.8,0.48885619998062396,0.7382208883802788,0.02702702702702703,0.49285714284482146,0.25
"Complete the following paragraph: OGA was purified from rat kidney and bovine brain, and the human gene was cloned using peptide sequence information. The OGA gene was found to be identical to MGEA5, a putative hyaluronidase genetically identified because of its association with meningiomas. There are two well-characterized isoforms of OGA (short and full-length), which appear to arise from alternative splicing.","['Elevating O-GlcNAc blocks insulin signaling at many points. Glucose flux via glucose transporters (e.g., GLUT4 in insulin-sensitive cells) through the hexosamine biosynthetic pathway (HBP; which accounts for 2%–5% of total glucose usage) leads (more...) Nucleocytoplasmic OGA (EC 3.2.1.169) was first identified as a neutral cytosolic hexosaminidase (referred to as “hexosaminidase C”). OGA was purified from rat kidney and bovine brain, and the human gene was cloned using peptide sequence information. The OGA gene was found to be identical to MGEA5, a putative hyaluronidase genetically identified because of its association with meningiomas. There are two well-characterized isoforms of OGA (short and full-length), which appear to arise from alternative splicing.'
 'There are two well-characterized isoforms of OGA (short and full-length), which appear to arise from alternative splicing. Short OGA is identical to full-length OGA (916 amino acids) for the first 662 amino acids but possesses an alternative carboxy-terminal sequence 15 amino acids in length. Sequence and structural analyses reveal that OGA contains an amino-terminal hexosaminidase domain and a carboxy-terminal domain, with homology to GCN5 histone acetyltransferases (HAT), separated by an intervening sequence. OGA forms an unusual arm-in-arm homodimer that is mediated by a helix within the intervening sequence. Dimerization is critical for activity and the formation of a substrate binding cleft. Notably, the HAT domain lacks the motif required for binding acetyl-CoA, indicating it lacks HAT enzymatic activity. Like OGT, OGA is thought to be regulated by its protein interactors, posttranslational modifications, and localization.'
 'The highly homologous and conserved nature of OGT among metazoans allows a transgene encoding the human sequence of OGT to be used to rescue OGT null Drosophila melanogaster. Recently, OGA has been disrupted in both C. elegans and mammalian models. Like the OGT null, the C. elegans OGA null has defective carbohydrate metabolism and abnormalities in dauer formation. In contrast to the OGT null, in C. elegans in which OGA has been disrupted, the worms have an extended life span. In murine models, deletion of OGA leads to perinatal lethality, genomic instability and severe epigenetic and metabolic phenotypes. The OGA heterozygous mouse shows widespread changes in transcription and metabolism, and an enhanced dependence on glucose metabolism. Studies from numerous laboratories have described O-GlcNAcylated proteins from virtually all cellular compartments, representing nearly all functional classes of protein (Figure 19.2; Table 19.1).'
 'The enzyme was first identified and purified from rat liver and subsequently cloned from rat, human, Caenorhabditis elegans, and other organisms. OGT resides on the X chromosome (Xq13 in humans) near the centromere and is among the most highly conserved proteins from worms to man. Mutations in OGT, both in its tetratricopeptide repeats (TPRs) and in its catalytic domain, cause X-linked intellectual disability in humans. To date, three isoforms of OGT have been well characterized: (1) the nucleocytoplasmic or full-length variant (ncOGT), which is 110 kDa; (2) a short isoform of OGT (sOGT), which is 78 kDa; and (3) a variant of OGT that is targeted to the mitochondria (mOGT; ∼90 kDa).'
 'Like OGT, OGA is thought to be regulated by its protein interactors, posttranslational modifications, and localization. OGA can be efficiently inhibited in vitro and in vivo by a panel of highly effective inhibitors. Although many inhibitors display some cross-reactivity toward the lysosomal hexosaminidases, GlcNAcstatin B and Thiamet-G are selective for OGA. Unlike the relatively static nature of mature N- and O-glycans on glycoproteins, O-GlcNAc cycles rapidly on and off most substrates. Early studies showed that mitogen or antigen activation of lymphocytes rapidly decreased O-GlcNAcylation of many cytoplasmic proteins, but concomitantly increased O-GlcNAcylation of many nuclear proteins. Likewise, neutrophils were shown to rapidly modulate O-GlcNAcylation of several proteins in response to chemotactic agents.'
 'In contrast, Pasteurella synthesizes hyaluronan by an enzyme that is unrelated to hasA and the mammalian Has gene family. In this case, the enzyme has two separable domains with independent glycosyltransferase activities—one for UDP-GlcNAc and the other for UDP-GlcA, and the elongation is on the nonreducing end. Animal cells express a set of catabolic enzymes that degrade hyaluronan. The human hyaluronidase gene (HYAL) family is complex, with two sets of three contiguous genes located on two chromosomes, a pattern that suggests two ancient gene duplications followed by a block duplication. In humans, the cluster on chromosome 3p21.3 (HYAL1, 2, and 3) appears to have major roles in somatic tissues.'
 'In the nucleus and cytoplasm, OGT appears to form multimers, consisting of one or more 110-kDa subunits and 78-kDa subunits. Several useful small molecule inhibitors of OGT have been developed, including OSMI-4b, Ac45SGlcNAc, and 5SGlcNHex, with the latter effective in animal models. However, some off-target effects have been reported for these inhibitors, likely because they impact other enzymes that use UDP-GlcNAc. ncOGT has two distinct domains separated by a putative nuclear localization sequence. The amino terminus of each OGT subunit contains TPRs, which can number up to 13 (species-dependent). The major variation between the three (above) variants is in the number of the TPRs.']","The OGA enzyme was purified from rat kidney and bovine brain, and the human gene was cloned using peptide sequence information. The OGA gene was discovered to be identical to MGEA5, a putative hyaluronidase that was genetically identified due to its association with meningiomas. Two well-characterized isoforms of OGA, short and full-length, are known to originate from alternative splicing.","Short OGA is identical to full-length OGA (916 amino acids) for the first 662 amino acids but possesses an alternative carboxy-terminal sequence 15 amino acids in length. Sequence and structural analyses reveal that OGA contains an amino-terminal hexosaminidase domain and a carboxy-terminal domain, with homology to GCN5 histone acetyltransferases (HAT), separated by an intervening sequence. OGA forms an unusual arm-in-arm homodimer that is mediated by a helix within the intervening sequence. Dimerization is critical for activity and the formation of a substrate binding cleft. Notably, the HAT domain lacks the motif required for binding acetyl-CoA, indicating it lacks HAT enzymatic activity. Like OGT, OGA is thought to be regulated by its protein interactors, posttranslational modifications, and localization.",1.0,0.6343481658585503,0.717072590797567,0.025,0.94999999997625,0.6666666666666666
"Complete the following paragraph: Giant viruses such as the algae-targeting chlorella virus and members of the amoeba-targeting Mimiviridae family have genomes large enough that they can express their own glycosylation machineries. On a smaller scale, specific viruses express glycosyltransferases as virulence factors.","['Viruses typically have minimalist genomes and use host-cell machinery for replication. Thus, glycosylation of enveloped viruses reflects that of the host. However, there are exceptions. Giant viruses such as the algae-targeting chlorella virus and members of the amoeba-targeting Mimiviridae family have genomes large enough that they can express their own glycosylation machineries. On a smaller scale, specific viruses express glycosyltransferases as virulence factors. For instance, a baculovirus-encoded glucosyltransferase glycosylates insect host ecdysteroid hormones to block molting, and bacteriophage-derived glucosyltransferases modify 5-hydroxymethyl cytosine bases in the phage DNA to protect it from bacterial restriction enzymes. Host-derived glycosylation in enveloped viruses is typically extensive and the resulting “glycan shield” protects the virus from immune reactions against the underlying polypeptide.'
 'It has long been known that many viruses use host glycans as specific binding receptors for entering the cell (Chapter 37). Similarly, several viruses encode lytic enzymes that break down host cell surface glycans to release viral particles after viral replication. Genome sequencing reveals that many double-stranded DNA viruses also take advantage by adding sugars to host glycoproteins through the use of viral GTs (Chapter 42). Although biological roles of viral GTs are poorly understood, some functions have been identified. For example, the T4 bacteriophage encodes nucleases that degrade host cell DNA. To protect its own genome, the phage modifies its DNA by replacing cytosine with 5-hydroxymethylcytosine and subsequently transferring glucose (Glc) to the 5-hydroxymethylcytosine using a specific UDP-Glc:DNA Glc-transferase.'
 'The baculovirus enzyme ecdysteroid glucosyltransferase (EGT) disrupts the hormonal balance of the insect host by catalyzing the conjugation of ecdysteroid hormones with Glc or galactose (Gal). Expression of the EGT gene allows the virus to block molting and pupation of infected insect larvae. Similarly, Chloroviruses have enzymes in CAZy family GT4 for the glycosylation of their structural proteins. Serotype conversion in Shigella flexneri is mediated by temperate bacteriophages, which encode GTs that mediate O-antigen conversion by the addition of Glc to O-antigen units. Finally, giant viruses such as Acanthamoeba polyphaga mimivirus encode 12 putative GTs for the synthesis of complex O-glycans. Bacterial GTs play a major role in their symbiosis and virulence.'
 'It has been shown that the archaeon Methanococcus voltae uses this strategy to transfer N-glycans to flagellin and S-layer proteins. Like bacteria and eukaryotes, evolution toward an obligate symbiont lifestyle was also accompanied by gene loss in Archaea. For example, the tiny genome of Nanoarchaeum equitans appears to encode only three GTs and no GH. With their large genomes and complex body plans that require regulated gene expression in different tissues and/or at different developmental stages, genomes of eukaryotes encode many more GTs and GHs than those of individual bacteria and Archaeal species. But, overall, prokaryotes appear to use a greater diversity of the monosaccharides that exist in nature (Chapters 20–23). Several eukaryotes have also undergone genome reduction and lost most of their GT genes. Thus, Plasmodium falciparum and Encephalitozoon cuniculi have only nine and eight GTs, respectively.'
 'Claims regarding “sialic acid–independent” rotaviruses may be explained by internal sialic acids resistant to bacterial sialidases. Many other viruses (e.g., adenovirus, reovirus, Sendai virus, and polyomavirus) also use sialic acids for infection, and crystal structures are now available for several of their sialic acid–binding domains. A number of viruses, including herpes simplex virus (HSV), foot-and-mouth disease virus, human immunodeficiency virus (HIV), and dengue flavivirus, use heparan sulfate proteoglycans as adhesion receptors (Table 37.1). In many cases, the proteoglycans may be part of a coreceptor system in which viruses make initial contact with a cell-surface proteoglycan and later with another receptor. For example, HSV infection is thought to initially involve the binding of viral glycoproteins gB and/or gC to cell-surface heparan sulfate proteoglycans.'
 'Interestingly, the periodontal pathogen Aggregatibacter actinomycetemcomitans secretes a PNAG hydrolase known as dispersin B (DspB) that has been shown to effectively disperse biofilms formed by PNAG-producing bacteria and is therefore also being developed as an adjuvant to antibiotic therapy. Viruses bind to host cells as a prerequisite for entry and intracellular replication. The enrichment of glycans on cell surfaces make them an attractive target for viral attachment and entry. Virus–glycan interactions are often responsible for species and tissue tropism (Table 37.1), as illustrated here with examples of three human pathogens: influenza virus, herpes simplex virus 1 (HSV-1), and human immunodeficiency virus (HIV), showing different modes of glycan-mediated viral interactions (Figure 42.5). Influenza viruses use a sialic acid–recognizing protein (hemagglutinin) for binding and entry (Figure 42.5A).'
 'Host-derived glycosylation in enveloped viruses is typically extensive and the resulting “glycan shield” protects the virus from immune reactions against the underlying polypeptide. In this regard, it has been suggested that the high frequency of heterozygous states for human congenital disorders of glycosylation (Chapter 44) may reflect selection for genomes that limit glycosylation of invading viruses. Host lectins may also be “hijacked” by glycans on viral surface glycoproteins. For example, Sialoadhesin (Siglec-1; Chapter 15) is used by the heavily sialylated porcine reproductive and respiratory syndrome virus (PRRSV) to gain entry into macrophages. Viral protein sequence can also influence host glycosylation (e.g., by structural constraints on access for glycosyltransferases or hydrolases), in a manner that favors viral antigenicity, such as the high-mannose N-glycans on HIV-1 envelope gp120 trimers.']","For instance, a baculovirus-encoded glucosyltransferase glycosylates insect host ecdysteroid hormones to block molting, and bacteriophage-derived glucosyltransferases modify 5-hydroxymethyl cytosine bases in the phage DNA to protect it from bacterial restriction enzymes.","For instance, a baculovirus-encoded glucosyltransferase glycosylates insect host ecdysteroid hormones to block molting, and bacteriophage-derived glucosyltransferases modify 5-hydroxymethyl cytosine bases in the phage DNA to protect it from bacterial restriction enzymes. Host-derived glycosylation in enveloped viruses is typically extensive and the resulting “glycan shield” protects the virus from immune reactions against the underlying polypeptide. In this regard, it has been suggested that the high frequency of heterozygous states for human congenital disorders of glycosylation (Chapter 44) may reflect selection for genomes that limit glycosylation of invading viruses.",1.0,0.5289694677652806,0.8327327655665915,0.024390243902439025,0.9484126983968916,1.0
"Complete the following paragraph: Although the focus of this chapter is on the glycobiology of bacterial cell envelopes, there are several additional (and equally important) facets of bacterial glycobiology. Three of these are briefly mentioned here.","['Examples are found in Gram-positive and Gram-negative bacteria, but seem to be confined to EPSs. The prototypical hyaluronan and cellulose synthases from Streptococci and Gram-negative bacteria show different architectures, yet both are sufficient for both synthesis and export across the cytoplasmic membrane. The molecular details underlying these processes have been resolved by analysis of the crystal structure of the cellulose synthase. In Gram-negative bacteria, a periplasmic scaffold links the synthase to an outer membrane protein channel. Although the focus of this chapter is on the glycobiology of bacterial cell envelopes, there are several additional (and equally important) facets of bacterial glycobiology. Three of these are briefly mentioned here. First, in addition to synthesizing surface structures, bacteria also produce intracellular glycans and cytoplasmic glycosylated proteins and glycolipids. For example, glycogen and trehalose act as storage compounds within some bacteria.'
 'In Gram-positive bacteria, substantially thicker layers of peptidoglycan surround a single membrane and provide an attachment point for other glycan structures. Another class of bacteria, the Negativicutes, are related to the Gram-positive Firmicutes but nevertheless have a two-membrane architecture and stain as Gram-negative. Other bacteria produce variable responses in the Gram-staining reaction, largely because of the presence of other glycans and cell wall lipids (see below). Conceptual organization of the cell envelopes of Gram-negative bacteria, Gram-positive bacteria, and mycobacteria. The schematic comparison of the cell walls (or cell envelopes) of Gram-negative bacteria, Gram-positive bacteria, and mycobacteria illustrates (more...) The periplasm of Gram-negative bacteria contains proteins associated with cell-surface assembly and nutrient uptake but may also contain free oligosaccharides (fOS) that protect against osmotic stress.'
 'Reflecting these many functions, surface glycoconjugates are remarkably diverse, enabled by the propensity for bacterial genetic recombination and lateral gene transfer and shaped by environmental interactions that impart niche-specific selective pressures. Surface glycoconjugates drive a variety of important interactions with host innate and adaptive immune defenses. Some are recognized as pathogen-associated molecular patterns (PAMPs), for example, via Toll-like receptor (TLR)-mediated pathways. Others are natural targets of adaptive immunity and have been exploited in successful vaccine strategies. Because of their importance in cell viability, surface glycoconjugates are also frequent targets of antimicrobial strategies. This chapter will provide an overview of the structure and biosynthesis of glycoconjugates, together with some examples of their functions. Bacteria were historically divided into two major groups based on their response in the Gram-staining procedure (i.e., Gram-positive and Gram-negative organisms), reflecting the organization of the cell wall.'
 'Bacteria were historically divided into two major groups based on their response in the Gram-staining procedure (i.e., Gram-positive and Gram-negative organisms), reflecting the organization of the cell wall. The amount and location of peptidoglycan in the cell wall is an important contributor to the outcome of Gram staining. Peptidoglycan is essential for the viability of most bacteria. It consists of polysaccharide strands covalently cross-linked by short peptides, creating a three-dimensional structure that confers shape and rigidity to the cell. In Gram-negative bacteria, such as Escherichia coli, the cell wall consists of two membranes separated by a cellular compartment termed the periplasm in which thin layers of peptidoglycan reside (Figure 21.1). In Gram-positive bacteria, substantially thicker layers of peptidoglycan surround a single membrane and provide an attachment point for other glycan structures.'
 'The outer membrane is an asymmetric lipid bilayer, with an outer leaflet composed mainly of a unique glycolipid called lipopolysaccharide (LPS) that is essential for the integrity of the permeability barrier imposed by the outer membrane. Many Gram-negative bacteria are covered in a surface-bound polysaccharide layer known as a capsule, and, in some cases, this capsular polysaccharide (CPS) is released from the cell in large amounts as free exopolysaccharide (EPS). Bacteria producing these products are often readily identified by their highly mucoid colonies. Structural variations in the LPS and capsules of different bacterial species are diverse and influence many types of interactions between bacteria and their environmental and host niches. Gram-positive bacteria lack the outer membrane (Figure 21.1) and depend on a much thicker multilayered peptidoglycan layer for viability.'
 'Their complex cell walls have a high content of remarkable glycan and glycolipid structures (Figure 21.1). The unique arabinogalactan (AG) component that characterizes these organisms is covalently attached to peptidoglycan and provides an attachment point for characteristic long-chain (C60–C90) α-alkyl-β-hydroxymycolic acids. The resulting mycolyl-AG-peptidoglycan complex underpins a permeability barrier conferring resistance to antibiotics and other harmful molecules. Mycolic acids help form an envelope layer referred to as an “outer membrane,” although its structure shares no similarity with its namesake in Gram-negative bacteria. Peptidoglycan (also known as murein) forms a rigid sacculus enveloping the cytoplasmic membrane, conferring cell shape, and contributing to the ability of bacteria to resist the effects of internal osmotic (turgor) pressure.'
 'NCBI Bookshelf. A service of the National Library of Medicine, National Institutes of Health. Varki A, Cummings RD, Esko JD, et al., editors. Essentials of Glycobiology [Internet]. 4th edition. Cold Spring Harbor (NY): Cold Spring Harbor Laboratory Press; 2022.  doi: 10.1101/glycobiology.4e.21 Chris Whitfield, Christine M. Szymanski, Amanda L. Lewis, and Markus Aebi. Glycoconjugates are integral components of the cell surfaces of bacteria and are often the immediate point of contact with the environment. Surface glycoconjugates contribute to the essential permeability barrier properties of the cell envelope, influence both the susceptibility and resistance of bacteria to antibiotics and other harmful compounds, participate in the formation and dispersion of biofilms, act as receptors for bacteriophages, and play pivotal roles in pathogenic and symbiotic host–microbe interactions.']","In addition to synthesizing surface structures, bacteria also produce intracellular glycans and cytoplasmic glycosylated proteins and glycolipids. For example, glycogen and trehalose act as storage compounds within some bacteria. Reflecting these many functions, surface glycoconjugates are remarkably diverse, enabled by the propensity for bacterial genetic recombination and lateral gene transfer and shaped by environmental interactions that impart niche-specific selective pressures.","First, in addition to synthesizing surface structures, bacteria also produce intracellular glycans and cytoplasmic glycosylated proteins and glycolipids. For example, glycogen and trehalose act as storage compounds within some bacteria. Mycobacteria also contain a growing list of unusual glycosylated molecules, which may be related to their ability to withstand a variety of stresses. Second, bacteria produce a wide range of glycan-binding proteins. These include adhesins that facilitate bacterial colonization, exotoxins that bind to host membrane glycans, and single-sugar-binding proteins involved in metabolism (see Chapter 42). Third, bacterial lifestyles are often defined by their capacity to digest and/or metabolize glycans. Complex nanomachines have been described for the degradation of complex carbohydrate structures. Assembling the various enzymes into a highly organized complex affords synergy and efficiency. For example, the roles of glycosyl hydrolases in biomass conversion are well documented (Chapter 59).",1.0,0.4418732564754513,0.8867918754503599,0.021739130434782608,0.9999999999857143,0.5
"Complete the following paragraph: In comparison to N-glycan biosynthesis, relatively little is known of how archaeal O-glycans are assembled. The O-glycans of four archaeal species have been characterized to a limited extent (Figure 22.3). The only published report on archaeal O-glycan biosynthesis revealed that Haloarcula hispanica requires Dol-P-Glc as a sugar donor for the assembly of the N-linked glucose-α-(1,2)-[sulfoquinovosamine-β-(1,6)-]galactose trisaccharide and the O-linked glucose-α-(1,4)-galactose disaccharide.","['In contrast to Hfx. volcanii, M. voltae, and M. maripaludis, aglB is essential in S. acidocaldarius. In comparison to N-glycan biosynthesis, relatively little is known of how archaeal O-glycans are assembled. The O-glycans of four archaeal species have been characterized to a limited extent (Figure 22.3). The only published report on archaeal O-glycan biosynthesis revealed that Haloarcula hispanica requires Dol-P-Glc as a sugar donor for the assembly of the N-linked glucose-α-(1,2)-[sulfoquinovosamine-β-(1,6)-]galactose trisaccharide and the O-linked glucose-α-(1,4)-galactose disaccharide. N-glycosylation has been considered as assisting Archaea to cope with the challenges of the extreme environments they often occupy.'
 'The structures of N-linked glycans found in the Euryarchaeota and Crenarchaeota are shown. The OTase (STT3 or AglB) within the endoplasmic reticulum (ER) or cytoplasmic membrane (right), (more...) The first reported archaeal N-glycosylated protein, the Halobacterium salinarum S-layer glycoprotein, was shown to be modified by two different N-linked oligosaccharides, a repeating sulfated pentasaccharide linked via N-glycosylamine to Asn-2 and a sulfated glycan linked by a glucose residue to 10 other Asn residues. The latter glycan is also N-linked to archaellins in this haloarchaeon. Efforts undertaken at the time aimed at deciphering the pathways responsible for the synthesis of these glycans relied solely on biochemical approaches because neither suitable genetic tools nor a genome sequence were available.'
 'In the last decade, progress in defining pathways of N-glycosylation has relied on Haloferax volcanii as a model organism. In Hfx. volcanii, a series of Agl proteins mediate the assembly and attachment of a pentasaccharide with the structure mannose-1,2-[methyl-O-4-]glucuronic acid-β1-4-galacturonic acid-α1-4-glucuronic acid-β1-4-glucose-β-Asn to the S-layer glycoprotein and archaellins (Figure 22.4). Acting at the cytoplasmic face of the plasma membrane, the glycosyltransferases AglJ, AglG, AglI, and AglE sequentially add the first four pentasaccharide residues onto a common Dol-P carrier, whereas AglD adds the final pentasaccharide residue, mannose, to a distinct Dol-P (Figure 22.3).'
 'Efforts undertaken at the time aimed at deciphering the pathways responsible for the synthesis of these glycans relied solely on biochemical approaches because neither suitable genetic tools nor a genome sequence were available. Despite these biochemical advances, delineation of archaeal N-glycosylation pathways had to wait until the genome age and the development of tools for the genetic manipulation of various species. Through the subsequent identification of homologs of eukaryotic and/or bacterial N-glycosylation pathway components, genome scanning for additional components, the generation of deletion strains, and characterization of reporter glycoproteins, agl (archaeal glycosylation) genes comprising archaeal N-glycosylation pathways have been identified in several Archaea, including halophilic, methanogenic, and thermophilic species. In the last decade, progress in defining pathways of N-glycosylation has relied on Haloferax volcanii as a model organism. In Hfx.'
 ""Furthermore, the discoveries of new archaeal lineages in the last decade, predominantly based on metagenomics studies, have led to extensive expansion and reconstruction of the archaeal phylogenetic tree. At present, attempts to cultivate these newly identified Archaea have rarely been successful. Nevertheless, the study of cultivated Archaea has led to many important discoveries. Since Neuberger's discovery of protein glycosylation in the late 1930s (Chapter 1) and his description of the N-acetylglucosamine (GlcNAc)-β-asparagine linkage of a glycan to the modified protein, it became generally accepted that protein glycosylation was a process limited to eukaryotes. This long-held belief was challenged in 1976, when Mescher and Strominger showed that the surface (S)-layer glycoprotein of the archaeon Halobacterium salinarum was subject to both N- and O-glycosylation, thus offering the first example of a noneukaryotic glycoprotein.""
 'Like Hfx. volcanii Dol-P, M. mariplaudis Dol-P includes two saturated isoprenes, likely at the α and ω positions. The AglO, AglA, and AglL glycosyltransferases add the next three nucleotide-activated sugars, respectively. AglU adds the threonine moiety to sugar three, apparently only following the addition of the fourth sugar by the glycosyltransferase AglL. AglV then methylates sugar four. The Dol-P-bound tetrasaccharide is then flipped across the membrane by an unidentified flippase, where AglB transfers the lipid-linked glycan to target Asn residues. Studies on the N-glycosylation process in Crenarchaeota have focused on the thermoacidophilic archaeon Sulfolobus acidocaldarius.'
 'Studies on the N-glycosylation process in Crenarchaeota have focused on the thermoacidophilic archaeon Sulfolobus acidocaldarius. In S. acidocaldarius, the S-layer glycoprotein, archaellin, and cytochrome b558/566 are modified by an N-linked hexasaccharide with the structure (Man-α1-6)(Man-α1-4)(Glc-β1-4-Qui6S-β1-3)GlcNAcβ1-4GlcNAc-β-Asn. This glycan is unusual as it contains the typical eukaryotic chitobiose core and a sulfoquinovose, a sugar generally found only in photosynthetic membranes of plants and phototrophic bacteria.']","Haloarcula hispanica requires Dol-P-Glc as a sugar donor for the assembly of the N-linked glucose-α-(1,2)-[sulfoquinovosamine-β-(1,6)-]galactose trisaccharide and the O-linked glucose-α-(1,4)-galactose disaccharide in archaeal O-glycan biosynthesis.","N-glycosylation has been considered as assisting Archaea to cope with the challenges of the extreme environments they often occupy. For instance, enhanced surface charge in the face of hypersaline conditions and hence increased solubility was offered as an explanation for the high sulfated sugar content of N-linked glycans decorating the Hbt. salinarum S-layer glycoprotein relative to its Hfx. volcanii counterpart, given the higher salinity of the locale in which the former lives. In other instances, it is not clear how a given N-glycosylation profile contributes to life in harsh surroundings. In Hfx. volcanii, however, N-glycosylation may provide cells with the ability to respond to changes in the surrounding salinity.",0.5,0.701408432737555,0.6065354669759477,0.029411764705882353,0.4499999999775,0.25
"Complete the following paragraph: A. fumigatus is an environmental mold that spreads by airborne particles. It causes serious invasive disease in immunocompromised people that is difficult to treat, leading to high mortality rates.","['A. fumigatus is an environmental mold that spreads by airborne particles. It causes serious invasive disease in immunocompromised people that is difficult to treat, leading to high mortality rates. As with other fungal pathogens, the surface glycans of A. fumigatus are critical for interactions with the host. The cell wall of infectious forms of this fungus is covered with specific proteins and melanin, presumably to alter surface properties and mask these structures from recognition by host immune receptors. The hyphal wall has a core of branched β1-3-glucan covalently linked to other glucan components, chitin, and galactomannan, which consists of a mannose backbone with short galactofuranose side chains. Interestingly, galactomannan also occurs anchored to the plasma membrane by a GPI. This polysaccharide is assembled in the Golgi apparatus and is probably transferred to the cell wall by transglycosidases, in the same way as GPI-anchored proteins.'
 'This polysaccharide is assembled in the Golgi apparatus and is probably transferred to the cell wall by transglycosidases, in the same way as GPI-anchored proteins. A. fumigatus also produces an extracellular matrix composed of monosaccharides, α1-3-glucan, galactomannan, and a galactosaminogalactan composed of variable galactopyranose repeats linked to N-acetylgalactosamine, which are partially de-acetylated. This structure has been implicated in adhesion and fungal virulence. The extracellular matrix also plays an important role in concealing the immunogenic β1-3 glucan layer from the immune system. C. neoformans is a ubiquitous environmental basidiomycete yeast that causes severe disease in immunocompromised individuals, leading to roughly half a million deaths per year worldwide.'
 'C. albicans mannans are also important in its interactions with host cells, including macrophages and dendritic cells. In particular, these structures are recognized by the mannose receptor and by dectin-2. These are C-type lectins expressed by immune cells that are important in both innate and adaptive immune responses (see Chapter 34). PLM antigens may be shed by C. albicans and, through interactions with Toll-like receptors (TLR-2), they can induce nuclear factor-κB (NF-κB) activation and cytokine responses such as tumor necrosis factor-α (TNF-α) secretion. Galectin-3, a ubiquitous member of the galectin family of lectins that is highly expressed in macrophages, also appears to recognize C. albicans expressing β1-2-linked mannose residues, resulting in opsonization of the yeast. A. fumigatus is an environmental mold that spreads by airborne particles.'
 'C. neoformans is a ubiquitous environmental basidiomycete yeast that causes severe disease in immunocompromised individuals, leading to roughly half a million deaths per year worldwide. It is unique among pathogenic fungi in having an extensive polysaccharide capsule that is required for virulence (Figure 23.6). The capsule is a dynamic structure that changes in thickness and composition depending on the environment and growth conditions. It is particularly large in the context of mammalian infection, in which it impedes host immune responses. It is composed of two large (millions of Da) polysaccharides named for their monosaccharide components: glucuronoxylomannan (GXM) and glucuronoxylomannogalactan (GXMGal).'
 'For example, during plant infections plant glycosylhydrolases may partially digest wall glucans of invading fungi. Some of the released oligosaccharides, termed oligosaccharins, can then act as signals to promote plant antifungal defenses. C. albicans (an ascomycete) is a normal commensal organism that can cause illness ranging from irritations of mucosal surfaces to life-threatening systemic infections. The C. albicans cell wall contains β1-3- and β1-6-linked glucans and chitin, similar to the S. cerevisiae wall, and immunogenic mannans that are termed phosphopeptidomannans. It also produces unusual short β1-2-linked mannose chains (Figure 23.2) that are highly antigenic and are also expressed on phospholipomannan (PLM) antigens. PLM antigens contain phytoceramide derivatives of myo-inositol phosphate.'
 'APX001A/ E1210, by the action of alkaline phosphatase in the host) Aminopyrifen (2-aminonicotinate) Gepinacin (monocarboxylic amide) Antimalarial Antifungal: Fungistatic • Effective against Candida spp. as well as invasive mold infections caused by Aspergillus spp. Scedosporium spp. Fusarium spp. or other rare molds Antifungal: fungicidal • Inhibits growth of Neospora crassa. Useful against several plant fungal pathogens. Antifungal: fungistatic • Acts against Candida spp., Aspergillus spp.'
 'Coprinopsis cinerea is a mushroom species that has gained prominence as a model for studies of diverse topics including mating, sexual development, meiosis, and the evolution of multicellularity. Its N-glycans typically are high mannose type with five to nine mannoses, but may also have a bisecting α1-4GlcNAc at the β-mannose. Pathogenic fungi are a significant cause of plant and animal disease, responsible for devastation of crops, decimation of animal populations (e.g., certain bat, amphibian, and bee species), and serious human diseases that kill an estimated one million people each year. These organisms display diverse glycans, which typically differ from those of the host and have been implicated in multiple pathogenic processes and host–pathogen interactions. For example, during plant infections plant glycosylhydrolases may partially digest wall glucans of invading fungi.']","The cell wall of infectious forms of A. fumigatus is covered with specific proteins and melanin, presumably to alter surface properties and mask these structures from recognition by host immune receptors. The hyphal wall has a core of branched β1-3-glucan covalently linked to other glucan components, chitin, and galactomannan, which consists of a mannose backbone with short galactofuranose side chains. Interestingly, galactomannan also occurs anchored to the plasma membrane by a GPI. This polysaccharide is assembled in the Golgi apparatus and is probably transferred to the cell wall by transglycosidases, in the same way as GPI-anchored proteins.","As with other fungal pathogens, the surface glycans of A. fumigatus are critical for interactions with the host. The cell wall of infectious forms of this fungus is covered with specific proteins and melanin, presumably to alter surface properties and mask these structures from recognition by host immune receptors. The hyphal wall has a core of branched β1-3-glucan covalently linked to other glucan components, chitin, and galactomannan, which consists of a mannose backbone with short galactofuranose side chains. Interestingly, galactomannan also occurs anchored to the plasma membrane by a GPI. This polysaccharide is assembled in the Golgi apparatus and is probably transferred to the cell wall by transglycosidases, in the same way as GPI-anchored proteins.",1.0,0.5863292585394762,0.9404956153728038,0.023809523809523808,0.8928571428348213,1.0
"Complete the following paragraph: Apiogalacturonans have only been identified in the walls of duckweeds and seagrasses. The substituted galacturonan referred to as RG-II, which accounts for between 2% and 5% of the primary cell wall, is the most structurally complex polysaccharide yet identified in nature.","['For example, xylogalacturonans contain single β-D-Xylp residues linked to O-3 of some of the backbone residues (Figure 24.2), whereas apiogalacturonans have β-D-apiose (Apif) and apiobiose linked to O-2 of some of the backbone residues. Apiogalacturonans have only been identified in the walls of duckweeds and seagrasses. The substituted galacturonan referred to as RG-II, which accounts for between 2% and 5% of the primary cell wall, is the most structurally complex polysaccharide yet identified in nature. It is composed of 12 different monosaccharides linked together by up to 21 distinct glycosidic linkages (Figure 24.2). Four structurally different side chains and one or two Araf substituents are attached to the galacturonan backbone.'
 'Such interactions alter the mechanical properties of the wall and may influence plant growth and development. Rhamnogalacturonan-I (RG-I) is a family of polysaccharides with a backbone composed of a repeating disaccharide 4-α-D-GalpA-1-2-α-L-Rhap-1. Many of the GalpAs are acetylated at O-2 and/or O-3. Depending on the plant, between 20% and 80% of the Rhap residues may be substituted at O-4 with linear or branched side chains composed predominantly of Araf and Galp, together with smaller amounts of Fucp and GlcpA (Figure 24.2). Little is known about the functions of these side chains and their contribution to the properties of the primary wall. Substituted galacturonans have a backbone composed of 1-4-linked α-D-GalpA acid residues that are substituted to varying degrees with mono-, di-, or oligosaccharides.'
 'Four structurally different side chains and one or two Araf substituents are attached to the galacturonan backbone. Two structurally conserved disaccharides (side chains C and D) are linked to O-3 of the backbone. The A and B side chains, which contain between 7 and 9 monosaccharides, are linked to O-2 of the backbone. Several of the monosaccharides in RG-II are O-methylated and/or O-acetylated. Virtually all of the RG-II exists in the primary wall as a dimer cross-linked by a borate ester. The ester is formed between the Apif residue in side chain A of each RG-II monomer (Figure 24.2). The dimer forms rapidly in vitro when the RG-II monomer is reacted with boric acid and a divalent cation. However, the mechanism and site of dimer formation in planta has not been determined.'
 'The presence of 1-2-linked Rhap residues does not introduce kinks into the backbone geometry of rhamnogalacturonan and thereby limit interchain associations. Rather, it is the side chains linked to these residues that are responsible for preventing or limiting interchain associations. The conformations of the four side chains attached to the homogalacturonan backbone may lead RG-II to adopt a “disk-like” shape. Well-defined tertiary structures are predicted for the RG-II monomer and the dimer. In the dimer, borate-ester cross-linking and Ca++ interchain pairing further stabilizes the two disks. The apparent resistance of RG-II to wall-modifying enzymes together with the formation of a cation-stabilized RG-II dimer likely results in a structure that resists temporal changes in the plant. In contrast, homogalacturonan is continually modified by the action of wall enzymes and its contribution to wall architecture is therefore time dependent.'
 'However, recent studies have shown that bacteria present in the human gut produce glycanases capable of hydrolyzing all but one of the glycosidic bonds in RG-II. Pectin is believed to exist in the cell wall as a macromolecular complex comprised of structural domains—homogalacturonan, rhamnogalacturonan, and substituted galacturonan—that are covalently and noncovalently linked to one another. However, there is only a limited understanding of how these structural domains are organized (Figure 24.2). Molecular modeling of a pectin (∼50 kDa) containing homogalacturonan (degree of polymerization ∼100) and rhamnogalacturonan with arabinogalactan side chains, together with modeling of RG-II conformation have begun to provide insights into the conformations and relative dimensions of each pectin structural domain.'
 'However, the mechanism and site of dimer formation in planta has not been determined. Borate cross-linking of RG-II is likely to have substantial effects on the properties of pectin and the primary wall as RG-II is itself linked to homogalacturonan (Figure 24.2). Indeed, mutations that affect RG-II structure and cross-linking result in plants with abnormal walls and severe growth defects. Swollen primary walls and abnormal growth together with reduced RG-II cross-linking are also a characteristic of boron deficient plants. RG-II was believed to be largely resistant to fragmentation by microbial enzymes. However, recent studies have shown that bacteria present in the human gut produce glycanases capable of hydrolyzing all but one of the glycosidic bonds in RG-II.'
 'They are also used in paints, in cosmetics, in paper, and as reagents for scientific research. These polysaccharides include agarose (agar) and carrageenan, which are sulfated galactans obtained from red seaweeds. These polysaccharides are composed of the repeating disaccharide 3-β-D-Galp-1-4-3,6-anhydro-α-L-Galp-1 unit. Some of the d-Galp and l-Galp units are O-methylated. Pyruvate and sulfate groups may also be present in small quantities. Alginate, a linear polysaccharide composed of 1-4-linked β-D-ManpA and its C-5 epimer 1-4-linked α-L-GulpA, produced by various species of brown seaweed is another example of a commercially important polysaccharide.']",It is composed of 12 different monosaccharides linked together by up to 21 distinct glycosidic linkages. Four structurally different side chains and one or two Araf substituents are attached to the galacturonan backbone.,"It is composed of 12 different monosaccharides linked together by up to 21 distinct glycosidic linkages (Figure 24.2). Four structurally different side chains and one or two Araf substituents are attached to the galacturonan backbone. Two structurally conserved disaccharides (side chains C and D) are linked to O-3 of the backbone. The A and B side chains, which contain between 7 and 9 monosaccharides, are linked to O-2 of the backbone. Several of the monosaccharides in RG-II are O-methylated and/or O-acetylated. Virtually all of the RG-II exists in the primary wall as a dimer cross-linked by a borate ester. The ester is formed between the Apif residue in side chain A of each RG-II monomer (Figure 24.2). The dimer forms rapidly in vitro when the RG-II monomer is reacted with boric acid and a divalent cation. However, the mechanism and site of dimer formation in planta has not been determined. Borate cross-linking of RG-II is likely to have substantial effects on the properties of pectin and the primary wall as RG-II is itself linked to homogalacturonan (Figure 24.2).",1.0,0.5769322473942178,0.7846609907190419,0.023809523809523808,0.9999999999857143,1.0
"Complete the following paragraph: In terms of glycosaminoglycans (GAGs), chondroitin and heparan sulfate (CS and HS) have been detected in C. elegans, but neither keratan sulfate (KS), dermatan sulfate (DS), nor hyaluronan (Chapter 16); whereas the CS chains contain a low amount of sulfate, the overall structure of HS in C. elegans is similar to the chains elaborated by vertebrates (see Figure 25.5).","['Many forms of O-glycans familiar from mammals and insects are either structurally defined or genetically predicted in C. elegans. These include “mucin-type” O-glycans, many of which are based on the core 1 O-glycan structure common to vertebrates (Chapter 10), but which can be extended by β-glucose, glucuronic acid, and α1-2 fucose residues (Figure 25.4). In terms of glycosaminoglycans (GAGs), chondroitin and heparan sulfate (CS and HS) have been detected in C. elegans, but neither keratan sulfate (KS), dermatan sulfate (DS), nor hyaluronan (Chapter 16); whereas the CS chains contain a low amount of sulfate, the overall structure of HS in C. elegans is similar to the chains elaborated by vertebrates (see Figure 25.5).'
 'Heparan and chondroitin sulfate are found in many animal taxa, including insects (Chapter 26) and in mollusks. The most widely distributed and evolutionarily ancient class appears to be chondroitin chains, which are not always sulfated (e.g., in C. elegans) (Chapter 25). The more highly sulfated and epimerized forms of heparin and dermatan sulfate tend to be found primarily in more recently evolved animal species of the deuterostome lineage. The same is true of hyaluronan, a secreted free glycosaminoglycan synthesized at the cell membrane and likely evolved from its precursor chitin to facilitate the movement of metazoan cells and shaping of organs during development and normal physiology. Echinoderms such as the sea cucumber make typical chondroitin chains, but some glucuronic acids have branches containing fucose sulfate.'
 'Chst1 and 5 can add sulfate groups at the indicated positions. The actual order of the various sulfated and nonsulfated (more...) Two classes of glycosaminoglycan chains—chondroitin sulfate/dermatan sulfate and heparan sulfate/heparin—are linked to serine residues in proteins by way of xylose (Figure 17.4). Xylosyltransferase initiates the process using UDP-xylose as donor. Two isoforms of the enzyme are known in vertebrates (XYLT1 and XYLT2), but only one isozyme exists in C. elegans and D. melanogaster. A glycine residue invariably lies to the carboxy-terminal side of the serine attachment site, but a perfect consensus sequence for xylosylation does not exist. At least two acidic amino acid residues are usually present, and they can be located on one or both sides of the serine, usually within a few residues.'
 'Heparan (more...) Additional enzymes exist for epimerization of D-glucuronic acid to L-iduronic acid in dermatan sulfate (DSE1-2), sulfation at the C-2 position of the uronic acids, and other patterns of sulfation found in unusual species of chondroitin (Table 17.2). The location of sulfate groups is easily assessed using bacterial chondroitinases (ABC, B, and ACII) that cleave the chains into disaccharides. Many chains are hybrid structures containing more than one type of chondroitin disaccharide unit. For example, dermatan sulfate is defined as having one or more iduronic acid–containing disaccharide units (chondroitin sulfate B) as well as glucuronic acid–containing disaccharides (chondroitin sulfate A and C). Animal cells also degrade chondroitin sulfate in lysosomes using a series of exolytic activities (Chapter 44).'
 'Echinoderms such as the sea cucumber make typical chondroitin chains, but some glucuronic acids have branches containing fucose sulfate. Simpler multicellular animals such as sponges can have unusual glycosaminoglycans that include uronic acids but do not have the typical repeat units of chondroitin and heparan sulfate. Plants do not have typical animal glycosaminoglycans. Instead, they have secreted acidic pectin polysaccharides not attached to protein cores (only hyaluronan is unattached among animal glycosaminoglycans), characterized by galacturonic acid and its methyl ester derivative (Chapter 24). Bacteria have mostly completely distinct polysaccharides (Chapter 21), although certain pathogenic strains can mimic mammalian glycosaminoglycan chains (see below).'
 'The structural features in control of keratan sulfate substitution remain unclear, as the underlying poly-N-acetyllactosamine backbone can be found on many other glycoproteins. Notably, in humans and bovine, the large chondroitin sulfate proteoglycan found in cartilage (aggrecan) contains a segment of four to 23 hexapeptide repeats (E-E/L-P-F-P-S) where the keratan sulfate chains are located, whereas aggrecan in rats and other rodents lacks this motif and does not contain keratan sulfate. Keratan sulfates (KS) contain a sulfated poly-N-acetyllactosamine chain, linked to either asparagine or serine/threonine residues. Chst1 and 5 can add sulfate groups at the indicated positions.'
 'The function of galactose sulfation in chondroitin sulfate remains unclear. The linkage tetrasaccharide lies at a bifurcation in the biosynthetic pathway: addition of β4-linked N-acetylgalactosamine, which initiates chondroitin sulfate assembly, or addition of α4-linked N-acetylglucosamine, which initiates heparan sulfate assembly (Figure 17.4). Genetic evidence from studies of C. elegans suggests that N-acetylgalactosamine addition during chondroitin assembly is mediated by the same enzyme that is involved in chain polymerization (Sqv5), but biochemical evidence suggests that more than one enzyme may exist in vertebrates. In heparin/heparan sulfate formation, the addition of the first N-acetylglucosamine residue is catalyzed by an enzyme called EXTL3, which differs from the transferases involved in heparan polymerization (called EXT1 and EXT2).']","Chondroitin and heparan sulfate have been detected in C. elegans, but keratan sulfate, dermatan sulfate, and hyaluronan have not been found. The chondroitin sulfate chains in C. elegans contain a low amount of sulfate, while the overall structure of heparan sulfate in C. elegans is similar to the chains seen in vertebrates.","Enzymatic and genomic data indicate that there are various domain-specific forms of glycosylation in C. elegans, including O-fucose (Fucα1-Ser/Thr) on epidermal growth factor (EGF)-like domains and thrombospondin type-1 repeats (TSRs), in the context of precise consensus sequences (Chapter 13), C-mannosylation of TSRs, and TMTC-dependent O-mannosylation of cadherins. However, POMT-mediated O-mannosylation of dystroglycan is absent. Cytoplasmic and nuclear proteins in C. elegans can be modified with O-GlcNAc as in other animals. Biosynthesis of core-1 O-glycans in Caenorhabditis elegans (A) and some O-glycans proposed to occur in adult worms (B).",1.0,0.7235271711853217,0.5758909310578095,0.03125,0.8333333332916666,0.0
"Complete the following paragraph: This chapter describes glycosylation in the Arthropoda, focusing primarily on Drosophila melanogaster. The major glycan classes are similar to those described in vertebrates, with interesting differences. The powerful genetic systems available for studying gene function in D. melanogaster have proved to be effective means for understanding glycan function in early development and have provided some of the first examples of how glycans affect growth factor signaling, morphogen gradients, protein secretion, and neural function in vivo.","['New analytical techniques have expanded the appreciation for the glycan synthetic capacity of the organism and have helped establish links between interesting phenotypes and altered glycan expression. Some of these associations have proven to be common across species and others are unique to D. melanogaster. Given the complexity of glycosylation in Drosophila, it is impossible to cover all aspects of glycans and glycan-binding proteins in this organism. Instead, we provide an overview of the major classes of arthropod glycans and examples of how studying glycans in Drosophila can lead to new discoveries that impact vertebrate as well as invertebrate biology. Although it was once thought that arthropod glycoproteins were exclusively of the high-mannose or paucimannose type (Chapter 9), annotation of the D. melanogaster genome predicted the existence of the enzymatic machinery needed to generate hybrid and complex glycans. Moreover, improved analytic techniques allowed the detection of very minor glycans.'
 'NCBI Bookshelf. A service of the National Library of Medicine, National Institutes of Health. Varki A, Cummings RD, Esko JD, et al., editors. Essentials of Glycobiology [Internet]. 4th edition. Cold Spring Harbor (NY): Cold Spring Harbor Laboratory Press; 2022.  doi: 10.1101/glycobiology.4e.26 Kelly G. Ten Hagen, Hiroshi Nakato, Michael Tiemeyer, and Jeffrey D. Esko. This chapter describes glycosylation in the Arthropoda, focusing primarily on Drosophila melanogaster. The major glycan classes are similar to those described in vertebrates, with interesting differences. The powerful genetic systems available for studying gene function in D. melanogaster have proved to be effective means for understanding glycan function in early development and have provided some of the first examples of how glycans affect growth factor signaling, morphogen gradients, protein secretion, and neural function in vivo.'
 'Arthropods are among the most successful species on Earth and are found in all types of environments. One of their characteristic features is an exoskeleton composed of chitin, which provides support and physical protection. The best-studied example is the fruit fly, D. melanogaster. In 1910, T.H. Morgan published the first paper about the genetics of D. melanogaster, which showed that white eye color was a sex-linked trait. Since then, this organism has been the predominant model organism for genetic analysis in animals. Its advantages include an easily studied developmental program, a sequenced and actively annotated genome, a relatively complex neural system, and the ability to discern literally thousands of different phenotypes in morphology, development, and behavior. In pursuit of genes that regulate development, many Drosophila geneticists ran head-on into glycans. New analytical techniques have expanded the appreciation for the glycan synthetic capacity of the organism and have helped establish links between interesting phenotypes and altered glycan expression.'
 'Moreover, improved analytic techniques allowed the detection of very minor glycans. The commercial and experimental demand for eukaryotic expression systems led to the characterization of the glycosylation pathways of cells derived from the moth Spodoptera frugiperda (Sf9 cells) and from D. melanogaster (S2 cells). It is now clear that high-mannose and paucimannose glycans account for >90% of the total N-linked glycan diversity in Drosophila and other insects throughout their life cycles. However, hybrid and complex glycans, including sialylated, sulfated, glucuronylated, and zwitterionic structures, are also present, albeit as minor components (Figure 26.1). N-Linked glycan diversity in Drosophila and other insects. N-Linked glycan processing after endoplasmic reticulum (ER) mannosidase trimming to the Man5GlcNAc2 structure is shown.'
 'Anti-HRP antibodies show that the Fucα1-3GlcNAc epitope is restricted primarily to neural tissue in a broad range of arthropods. Drosophila does not extend its core fucose residues with additional capping monosaccharides nor modify its N-linked glycans by O-methylation, both of which occur extensively in Caenorhabditis elegans (Chapter 25). The demonstration of fucosylated, sialylated, sulfated, hybrid, biantennary complex, and triantennary complex glycans in all stages of the D. melanogaster life cycle makes the diversity of the arthropod N-glycans generally comparable to that of mammals (Chapter 27), except for the very limited use of sialic acids (Sias). The relative paucity of complex N-linked glycans in Drosophila has been attributed at least partially to the presence of a hexosaminidase in the secretory pathway.'
 'As much as 40% of the total mass of these proteins is contributed by glycans. In Drosophila tissues, peanut agglutinin lectin and mucin-specific antibodies reveal developmentally regulated and spatially restricted expression of Galβ1-3GalNAcα-O-protein moieties. O-Linked glycan diversity in Drosophila and other insects. Genetic and biochemical analysis of Drosophila mutants were instrumental in defining developmental roles for domain-specific, simple mono-, di- or trisaccharide modifications on serine/threonine (more...) Drosophila possesses a family of 10 polypeptide N-acetylglucosaminyltransferases (ppGalNAcT/PGANTs encoded by pgant genes; Chapter 10). Systematic mutational and RNAi-mediated knockdown analysis of individual pgant genes showed that pgant4, 5, 7, and 35A are essential for viability.'
 'Chitin is a major component of the rigid, cuticular exoskeleton of all Arthropoda, and therefore these animals expend considerable resources toward its assembly. Chitin fibrils also form a more subtle, protective layer at the apical surface of gut epithelial cells (the peritrophic membrane) and in the lumen of the forming tracheal system. Elegant genetic screens have shown that mutations in genes necessary for chitin polymerization, modification, and disassembly affect tracheal morphology (Table 26.1). The potential for chitin or for small chitin-based oligosaccharides to modulate cell signaling and morphogenesis remains unexplored in Drosophila. Insects were once classified as “animals without gangliosides” in reference to sialylated glycosphingolipids (GSLs) found broadly distributed in animal families other than the arthropods (Chapter 11). However, arthropods possess their own family of GSLs, designated as the arthroseries.']","The chapter provides insights into glycosylation in Arthropoda, particularly focusing on Drosophila melanogaster. It highlights the similarity of major glycan classes to those in vertebrates, while also noting intriguing differences. The genetic systems in D. melanogaster have been instrumental in studying gene function and understanding glycan roles in early development. Notably, these systems have shed light on how glycans impact growth factor signaling, morphogen gradients, protein secretion, and neural function in vivo.","Arthropods are among the most successful species on Earth and are found in all types of environments. One of their characteristic features is an exoskeleton composed of chitin, which provides support and physical protection. The best-studied example is the fruit fly, D. melanogaster. In 1910, T.H. Morgan published the first paper about the genetics of D. melanogaster, which showed that white eye color was a sex-linked trait. Since then, this organism has been the predominant model organism for genetic analysis in animals. Its advantages include an easily studied developmental program, a sequenced and actively annotated genome, a relatively complex neural system, and the ability to discern literally thousands of different phenotypes in morphology, development, and behavior. In pursuit of genes that regulate development, many Drosophila geneticists ran head-on into glycans.",1.0,0.820005618062858,0.6866289447723093,0.021739130434782608,0.7345238095115675,1.0
"Complete the following paragraph: When sea urchin sperm undergo the acrosome reaction, a protein named bindin is released from the acrosomal vesicle. Bindin cements the sperm to a large egg surface glycoprotein named egg bindin receptor 1 (EBR1). Bindin can agglutinate mammalian red blood cells much like plant lectins (Chapter 32), and glycopeptide fragments of unfertilized eggs can block bindin-induced red cell agglutination.","['Bindin cements the sperm to a large egg surface glycoprotein named egg bindin receptor 1 (EBR1). Bindin can agglutinate mammalian red blood cells much like plant lectins (Chapter 32), and glycopeptide fragments of unfertilized eggs can block bindin-induced red cell agglutination. Bindin is thought to recognize glycans on EBR1. EBR1 itself has lectin-like domains, but its glycan ligands are unknown. Most studies of glycosylation in sea urchins have identified glycosyltransferase activities and the glycans they synthesize (e.g., including N-glycans with antennal β1-3-linked Gal, β1-4GalNAc, Neu5Gc, and sulphate residues as well as traces of the “invertebrate” feature of core α1-3/α1-6-difucosylation) (Figure 27.2).'
 'The number of fucoses per repeat, the linkage, and sulfation patterns all help ensure species selectivity for induction of the acrosome reaction. About 20% of the egg jelly mass is a large glycoprotein containing a unique polymer of sialic acid (Sia), which can be released from crude sea urchin egg jelly by treatment with mild base (β-elimination). The sialoglycan has a novel structure—[Neu5Gcα2-5-O-glycolylNeu5Gc]n. However, its receptor on the sperm membrane is unknown. When sea urchin sperm undergo the acrosome reaction, a protein named bindin is released from the acrosomal vesicle. Bindin cements the sperm to a large egg surface glycoprotein named egg bindin receptor 1 (EBR1).'
 'Each of these models is briefly described below with references to other sections of the book for additional details. Sea urchin glycans involved in fertilization have been studied extensively. In fact, much of what we know about the biochemistry of fertilization was first discovered in this organism (Figure 27.1), and the information subsequently applied to mammalian sperm–egg interactions. One of the advantages of studying fertilization in sea urchins is that eggs and sperm are easy to obtain in large quantities. Because fertilization occurs outside the adult body, it is also easy to experimentally manipulate sperm and eggs. (Top left) The purple sea urchin Strongylocentrotus purpuratus. (Reprinted, with permission, courtesy of Charles Hollahan, Santa Barbara Marine Biologicals.) (Top right) Sperm binding to a sea urchin egg. (Reprinted, with permission, courtesy of M. Tegner (more...) Sea urchin eggs are covered by a hydrated jelly coat.'
 ""(Reprinted, with permission, courtesy of M. Tegner (more...) Sea urchin eggs are covered by a hydrated jelly coat. About 80% of the weight of egg jelly is a high-molecular-weight linear fucose (Fuc) sulfate polymer (FSP) with a molecular mass of >106 Da. Receptor proteins on sperm bind to FSP, triggering the opening of two pharmacologically distinct calcium channels that induce the exocytosis of the sperm's acrosome vesicle (the “acrosome reaction”). The ionic mechanisms that trigger the acrosome reaction are conserved in mammals, but the nature of the sperm surface receptors varies. FSP is a species-selective inducer of the sea urchin sperm acrosomal reaction and most FSPs are sulfated α1-3Fuc-based linear polymers made of tri- or tetrasaccharide repeats.""
 'Before fertilization, individual sperm undergo capacitation enabling them to penetrate and fertilize an ovum. During this process, SPAM1, a GPI-anchored hyaluronidase, redistributes and accumulates in the sperm head. SPAM1 binds hyaluronan in the cumulus, causing an increase in Ca++ flux and sperm motility. It also helps dissolve the cumulus matrix as the sperm moves through the hyaluronan vestment. A soluble form of SPAM1 is secreted during the acrosome reaction. The release of acrosomal hyaluronidase and proteases renders the sperm capable of fusing with the egg and eventually destroys the entire matrix to allow the fertilized oocyte to implant and develop. There are several hyaluronan-binding proteins with homologous link modules (Figure 16.3).'
 'Hint-2, in contrast, is only expressed in Paneth cells that function in immune surveillance in the crypts of the small intestine. Glycan microarray results show that both Hints bind to the glycans of a unique set of human pathogenic bacteria that have in common the presence of particular cis-diols on their outer surface polysaccharides and include both Gram-positive and Gram-negative bacteria. Crystal structures of Hint-1 and the Xenopus embryonic epidermal lectin show a conserved mechanism of glycan recognition. But clearly, the carbohydrate binding determinants for each intelectin studied are unique. It is becoming clear that the X-lectin family plays key roles in deuterostome innate immune responses against pathogens. Zebrafish (Danio rerio) provides an excellent model organism for understanding the functions of genes in early vertebrate development (Figure 27.3). Females lay several hundred eggs weekly, which undergo external fertilization.'
 'The availability of GPI-deficient mammalian cell lines shows that GPI-APs are not essential at the cellular level. However, mouse knockouts and tissue-specific conditional knockouts of the PIGA gene clearly show that GPI-APs are essential for early embryo and tissue development. GPI anchors impart to their attached proteins the ability to be shed from the cell surface in soluble form through the action of cellular or serum GPI-cleaving enzymes. Mammalian sperms acquire the ability to fuse with oocytes after GPI-anchored TEX101 and LY6K are released by a sperm-associated GPI-cleaving enzyme tACE (testis form angiotensin converting enzyme). The cleavage of GPI-APs is required for maturation of ADAM3, a metalloprotease on the sperm surface. Certain proliferating motor neurons initiate differentiation after the GPI-anchored proteinase inhibitor, RECK, is released by the GPI-cleaving enzyme, GDE2.']","Bindin, released from the acrosomal vesicle during the sea urchin sperm acrosome reaction, plays a crucial role in binding the sperm to the egg surface glycoprotein EBR1. Additionally, bindin exhibits agglutination properties similar to plant lectins and can be blocked by glycopeptide fragments from unfertilized eggs.","Bindin is thought to recognize glycans on EBR1. EBR1 itself has lectin-like domains, but its glycan ligands are unknown. Most studies of glycosylation in sea urchins have identified glycosyltransferase activities and the glycans they synthesize (e.g., including N-glycans with antennal β1-3-linked Gal, β1-4GalNAc, Neu5Gc, and sulphate residues as well as traces of the “invertebrate” feature of core α1-3/α1-6-difucosylation) (Figure 27.2). The functions of glycans and glycan-binding proteins (GBPs) can be investigated using genetic strategies in sea urchins, antisense morpholinos or short hairpin RNAs (shRNAs) to knock down gene expression have been the methods of choice, but these will likely be superseded by more precise gene editing techniques such as the clustered regularly interspaced short palindromic repeats/Cas9 (CRISPR/Cas9) strategy or transcription activator–like effector (TALE) nucleases (TALENs).",1.0,0.7344257848254484,0.6391825797854793,0.0425531914893617,0.999999999975,0.75
"Complete the following paragraph: A wide variety of methods for coupling monosaccharides and complex glycans to create affinity resins have been developed. As mentioned above, many sulfated-GAG-binding proteins have been discovered by affinity chromatography using immobilized GAG chains.","['The ability to bind specific glycans, assessed in various biochemical assays, has often been the basis for direct identification of novel GBPs without reference to a particular biological function. For example, most galectins (Chapter 36) share a binding preference for β-galactosides and F-type lectins for fucosyl residues. In addition to forming a basis for binding and competition assays, the binding activity is commonly used as a means of isolating these proteins by using affinity chromatography with appropriate immobilized glycan ligands. A wide variety of methods for coupling monosaccharides and complex glycans to create affinity resins have been developed. As mentioned above, many sulfated-GAG-binding proteins have been discovered by affinity chromatography using immobilized GAG chains. A limitation of these approaches is that binding activity does not directly indicate a biological function and the roles of many well-characterized GBPs have not been fully determined.'
 'A main technical challenge to understand GAG–protein interactions is to dissect the essential structural elements of GAGs that contribute to the binding. Unlike researchers studying DNA-binding proteins who have access to all possible DNA sequences, researchers studying GAG-binding proteins traditionally do not have access to GAG oligosaccharides with defined structures. Fortunately, this situation has begun to change in the last 5 years. With the rapid progress of chemoenzymatic and chemical synthesis (or a combination of both) of HS/CS oligosaccharides, a growing number of structural defined oligosaccharides (dp4-dp20) have become available. Many of the oligosaccharides have been used to generate microarrays for rapid determination of structural preference of GAG-binding proteins. Although we have not yet reached a stage at which we can freely design any GAG structures that we wish, the current technology can already provide a surprisingly large array of structures for structure–function studies of GAG-binding proteins.'
 'These bound antibodies and lectins can then be used to isolate glycoconjugates expressing specific glycan determinants. ConA-Sepharose is commonly used to isolate glycoproteins as it shows little binding to nonglycosylated proteins. However, it does not bind all glycoproteins because it recognizes specific N-glycan structures. ConA-Sepharose has also been used to isolate free oligo- and polymannose-, hybrid-, and complex-type biantennary N-glycans. When combined in a serial format, multiple lectins can be used in affinity chromatography to isolate glycoconjugates containing most of the major glycan structures present in animal cells, with glycoconjugates being separated as classes that share common determinants. An example of serial lectin affinity chromatography is shown in Figure 48.8. Identification of glycoproteins through analysis of released glycopeptides gives important information on proteins carrying specific modifications.'
 'For example, the agglutinin from Sambucus nigra (SNA) binds to glycans that terminate with α2-6 sialic acid (Sia). Lectins (Chapters 31–36) recognizing terminal fucose (Fuc), galactose (Gal), N-acetylgalactosamine (GalNAc), and N-acetylglucosamine (GlcNAc) are also commercially available. Metabolic labeling of glycoconjugates with radioactive sugars is another powerful tool for determining the composition of glycans. Cells incubated in media containing 3H- or 14C-labeled monosaccharides will incorporate the label into the glycans of glycoconjugates. Radiolabeled glycans can be detected following gel electrophoresis (SDS-PAGE) or thin-layer chromatography (TLC) by autoradiography or fluorography. They can also be released and studied in detail by various methods.'
 'Combinations of affinity chromatography and other chromatographic techniques can be very useful in identifying and separating glycopeptides. Thus, the ability of glycans to be recognized by lectins dependent on specific structural features in the glycans is a powerful tool for glycan identification and isolation. In some approaches, the glycans are tagged at the reducing end by fluorophores and radioisotopes or may be obtained by metabolic radiolabeling from cells or tissues grown in the presence of radiolabeled sugar precursors, such as [2-3H]mannose or [6-3H]glucosamine. Glycan fractionation shown on immobilized lectins in Figure 48.8 is currently not possible with antibodies because no antibodies are known that can distinguish such core structural features in glycans.'
 'Of course, any given glycan can mediate one or both types of functions. The binding proteins in turn fall into two broad groups: lectins and sulfated GAG-binding proteins (Chapters 27, 28, and 38). Such molecules can be either intrinsic to the organism that synthesized the cognate glycans (e.g., see Chapters 31–36, 38, and 39) or extrinsic (see Chapters 37 and 42 for information concerning microbial proteins that bind to specific glycans on host cells). The atomic details of these glycan–protein interactions have been elucidated in many instances (Chapters 29 and 30). Although there are exceptions to this notion, the following general theme has emerged regarding lectins: monovalent binding tends to be of relatively low affinity, and such systems typically achieve their specificity and function by achieving high avidity, via interactions of multivalent arrays of glycans with cognate lectin-binding sites.'
 'Important added value of AGA is the ability to rapidly generate libraries of related but distinct glycans, and the ability to prepare polysaccharides of a size not easily accessible with other methods. The synthesis of a 100-mer polymannoside commences with placing a polystyrene Merrifield resin equipped with a photo-cleavable linker 11 in the reaction vessel of an automated synthesizer. Mannose thioglycoside building block 12 is employed for AGA using a four-step cycle (Figure 53.4A). The incorporation of each monomer relies on an acidic washing step to prevent quenching by any remaining base, followed by the coupling step using 5-6.5 equivalents of building block 12. Next, a capping step prevents any unreacted nucleophiles from engaging in subsequent couplings to produce (n-1)-polysaccharides that are difficult to separate from the desired product.']",These methods include using immobilized GAG chains in affinity chromatography to isolate sulfated-GAG-binding proteins.,A limitation of these approaches is that binding activity does not directly indicate a biological function and the roles of many well-characterized GBPs have not been fully determined. The observation that many lectins fall into structurally distinct families provides an alternative way to identify novel GBPs through analysis of protein sequences. Sequence motifs characteristic of CRDs are routinely used to screen sequences from whole genome sequencing. These motifs can also be used to screen specific cDNA and gene sequences of interest because of their association with biological functions.,1.0,0.7520626468885682,0.478150414754959,0.05128205128205128,0.9999999999857143,0.25
"Complete the following paragraph: Another variation is generally termed a “pull-down assay,” akin to a type of immunoprecipitation. In this approach a solution containing potential ligands is incubated with a GBP that may be immobilized on a surface (e.g., a bead). Afterward the bead-GBP is subjected to several steps (e.g., magnetic separation or centrifugation) to remove the unbound material.","['There are some limitations to this approach, including (1) only the Kd can be derived, not kon or koff; (2) the conjugation of the GBP to the matrix must be stable and the protein must retain reasonable activity for many different column runs; (3) the amount of GBP conjugated and active must be defined; (4) many different column runs must be made with a single glycan; and (5) if the Kd is high (>1 mm), this approach is typically not feasible. Overall, frontal affinity chromatography is quite useful and is automated. Another variation is generally termed a “pull-down assay,” akin to a type of immunoprecipitation. In this approach a solution containing potential ligands is incubated with a GBP that may be immobilized on a surface (e.g., a bead). Afterward the bead-GBP is subjected to several steps (e.g., magnetic separation or centrifugation) to remove the unbound material.'
 'The sample was treated with sufficient ammonium sulfate to precipitate the complex but not the unbound ligand. The precipitated complex was captured on a filter and the amount of ligand in the complex was determined by γ-counting. In this approach, a glycoprotein (or ligand) is mixed with a GBP or antibody and the mixture is electrophoretically separated in polyacrylamide. For glycosaminoglycans, this technique is termed affinity co-electrophoresis (ACE). This method is particularly useful in defining the apparent Kd of the interaction and allows identification of subpopulations of glycosaminoglycans that differentially interact with the GBP. In another method, termed crossed affinity immunoelectrophoresis, a second step of electrophoresis is conducted in the second perpendicular dimension across an agarose gel that contains precipitating monospecific antibody to the glycoprotein or ligand.'
 'Thus, a multiplexed approach is taken where a GBP is mixed with a set of conjugated beads each identifiable by its fluorescent properties. The GBP may be biotinylated, allowing detection by fluorescent streptavidin, or the GBP may be detected by binding to specific antibody or another reagent if the GBP is epitope-tagged. The degree of binding of the GBP is a measure of its affinity and specificity for a particular glycan. The advantages of this approach is that it is high-throughput, allowing thousands of assays to be performed automatically, as well as utilizing small amounts of both glycan and GBP. The collection of data and its analysis are also automated. A limitation of the approach is that each glycan to be derivatized must be activated by having a primary amine or other chemistry for conjugation, and each conjugation of a glycan needs to be independently validated. Multivalent GBPs interacting with multivalent ligands, as expressed on cells, can cause the cells to agglutinate.'
 '(A) In SPR, the reflected light is measured and is altered in response to binding of the analyte in the flow cell to the immobilized GBP. (B) An example of a sensorgram showing the binding of the analyte to (more...) A variety of chemistries are available for coupling ligand or receptor to the surface of the chip, including reaction with amines, thiols, or aldehydes and noncovalent biotin capture. In some approaches, a glycoprotein ligand for a GBP is immobilized and binding of the GBP is measured directly. It is also possible to degrade the immobilized glycoprotein ligand on the chip sequentially by passing over solutions containing exoglycosidases and reexamining at each step the binding to different GBPs, thereby obtaining structural information about the ligand. The immobilized ligand is usually quite stable and can be used repeatedly for hundreds of runs during a period of months.'
 'Afterward the bead-GBP is subjected to several steps (e.g., magnetic separation or centrifugation) to remove the unbound material. The material bound to the bead-GBP may then be eluted for measurement and further analyses. Using this pull-down setup, one can perform a concentration-dependent binding assay to obtain an apparent Ka of the ligand for the immobilized GBP. Isothermal titration calorimetry (ITC) is one of the most rigorous means of defining the equilibrium binding constant between a glycan and a GBP or indeed any protein and its ligand. The binding of a glycan to the GBP is measured as a change in enthalpy using a commercial microcalorimeter. In this technique, a solution containing a glycan of interest is added in increments into a solution containing a fixed concentration of GBP. The glycan is added at many intervals and the heat evolved from binding is measured relative to a reference cell.'
 'The amount of protein or ligand in the precipitate can be measured directly by chemical means, using assays for glycans or proteins. The technique of precipitation is useful for studying potentially multivalent ligands, and it has been used recently to show that each branch of terminally galactosylated complex-type di-, tri-, and tetra-antennary N-glycans is independently recognized by galactose-binding lectins. Another precipitation approach takes advantage of the fact that a complex between a GBP and a glycan can be “salted out” or precipitated by ammonium sulfate. A variation of this approach was used in early studies on the characterization of the hepatocyte asialoglycoprotein receptor (AMR), in which the ligand 125I-labeled asialoorosomucoid was incubated with a preparation of receptor. The sample was treated with sufficient ammonium sulfate to precipitate the complex but not the unbound ligand.'
 'In a typical successful analysis a GBP may bind to several glycans that share structural features, often termed glycan-binding determinants or motifs. If desired, the GBP can then be tested for its binding to the identified candidates by other methods such as titration microcalorimetry or fluorescence polarization, to define the Kd as discussed above. The use of microarrays in characterizing GBPs is a central component of functional glycomics (Chapter 51). Publicly available glycan microarray binding data repositories are increasingly used in the field. A variation of glycan microarrays is a bead-based Luminex-type assay. In this high-throughput approach glycans are covalently immobilized on Luminex beads of different fluorophore properties. Thus, a multiplexed approach is taken where a GBP is mixed with a set of conjugated beads each identifiable by its fluorescent properties.']","The material bound to the bead-GBP may then be eluted for measurement and further analyses. Using this pull-down setup, one can perform a concentration-dependent binding assay to obtain an apparent Ka of the ligand for the immobilized GBP. Isothermal titration calorimetry (ITC) is one of the most rigorous means of defining the equilibrium binding constant between a glycan and a GBP or indeed any protein and its ligand. The binding of a glycan to the GBP is measured as a change in enthalpy using a commercial microcalorimeter. In this technique, a solution containing a glycan of interest is added in increments into a solution containing a fixed concentration of GBP. The glycan is added at many intervals and the heat evolved from binding is measured relative to a reference cell.","The material bound to the bead-GBP may then be eluted for measurement and further analyses. Using this pull-down setup, one can perform a concentration-dependent binding assay to obtain an apparent Ka of the ligand for the immobilized GBP. Isothermal titration calorimetry (ITC) is one of the most rigorous means of defining the equilibrium binding constant between a glycan and a GBP or indeed any protein and its ligand. The binding of a glycan to the GBP is measured as a change in enthalpy using a commercial microcalorimeter. In this technique, a solution containing a glycan of interest is added in increments into a solution containing a fixed concentration of GBP. The glycan is added at many intervals and the heat evolved from binding is measured relative to a reference cell. Over the course of the experiment, the concentration of glycan is increased in the mixing cell over a glycan-to-GBP molar ratio of 0–10. The heat absorbed or evolved during binding is determined and the data are replotted as kcal/mole of injectant versus the molar ratio (Figure 29.4).",0.75,0.25819104518776625,0.9895271513730501,0.023809523809523808,0.9999999999857143,0.75
"Complete the following paragraph: It is important to note that structural methodology is continually evolving, with additional information coming from techniques like small-angle X-ray scattering (SAXS) and cryo-electron microscopy (cryo-EM). Recent advances in cryo-EM provide many exciting opportunities to study protein–glycan interactions, which will also be discussed.","['2013. J Biol Chem 288: 34680−34698.)  Structural biology is an evolving area of science both in terms of methodology and questions to be answered. The principle methodologies discussed here are each evolving: crystallographic methods using new X-ray sources (e.g., X-ray lasers) are allowing the analysis of microcrystals at room temperature and femtosecond timescales, thereby eliminating temperature- and beam-induced artifacts. Cryo-EM single-particle methods are approaching resolutions previously confined to X-ray crystallography. Single-particle and tomography EM approaches are continuing to undergo rapid development in terms of EM infrastructure, sample preparation, and data acquisition. Several user-friendly pipeline data processing packages exist, making this technology attractive to an increasing scientific audience. Hyperpolarization methods are reducing the sensitivity limitations of NMR, and solid-state NMR methods are allowing application to amorphous materials, including fibrils, cell-wall structures, and membrane fragments.'
 'Structural information on bound glycan ligands that is complementary to that from X-ray crystallography is increasingly coming from NMR methods. This is particularly valuable in that it is applicable to ligands with a broader range of affinities, including many that have the lower affinities amplified in multivalent interactions. It is also applicable in solution under near-physiological conditions in which concerns about the effects of crystal lattice contacts and occlusion of some interaction sites are absent. It is even possible to conduct some experiments on assemblies that mimic a membrane surface environment, an environment in which many protein–glycan interactions occur. It is important to note that structural methodology is continually evolving, with additional information coming from techniques like small-angle X-ray scattering (SAXS) and cryo-electron microscopy (cryo-EM). Recent advances in cryo-EM provide many exciting opportunities to study protein–glycan interactions, which will also be discussed.'
 'Recent advances in cryo-EM provide many exciting opportunities to study protein–glycan interactions, which will also be discussed. The fundamental understanding of glycan–protein interactions, as enriched by experimental studies of all types, has now been encoded in powerful molecular simulation programs that provide a computational approach to generating three dimensional pictures of glycan–protein complexes. These are important because it is difficult to produce complex glycan ligands in the amounts and purity required for most experimental approaches. These methods, although still evolving toward increased confidence in outcomes, provide models for experimentally inaccessible systems that can be tested with a variety of nonstructural approaches. They can also be leveraged with sparse structural data that alone could not provide detailed structural information. X-ray crystallography is a very powerful method for obtaining details of protein–ligand interactions. It excels in terms of the size range of molecules that can be studied (from small compounds to large multiprotein complexes) and in efficiency of data collection when high-energy X-ray beams at synchrotron sources are used.'
 'With reported resolutions exceeding 2 Å, many molecular details are revealed under native-like conditions. By eliminating the need for growing well-ordered three-dimensional (3D) crystals and operating at fairly low sample concentrations, cryo-EM can provide atomic level insights into many biological samples, from soluble and membrane-integrated protein complexes to filamentous polymers and entire viruses. Cryo-EM can be roughly divided into two main directions: one working with single (usually purified) particles, single-particle analysis (SPA), and the other using a tomography approach to analyze species in larger assemblies, such as in vitro–assembled scaffolds or even native cells and tissues. For SPA, samples are generally analyzed in a thin layer of vitreous ice containing the particles in random orientations. Data is collected in the form of movies, which allows correction for beam-induced drift, followed by estimation of the contrast transfer function for each micrograph; both are necessary to obtain near-atomic resolutions.'
 'The individual particles are then computationally extracted from the micrographs, sorted, and ultimately aligned in three dimensions to reconstruct the molecular structure. For cryo-electron tomography of, for example, a vitrified cell or virus particle, a tilt series of images is acquired to obtain different “specimen views” necessary for 3D reconstruction. This technique continues to face technical challenges, in part because of limitations on the tilt angles that can be achieved. However, it is a powerful tool to image, for example, the glycocalyx of various tissues, plant and fungal cells walls, or microbial cell envelopes and capsules. A major advantage of cryo-EM is that sample heterogeneity and/or conformational flexibility does not preclude analyses. To obtain well-diffracting crystals of a glycosylated protein, for example, the conformationally heterogenous glycans are often removed enzymatically to facilitate crystallization.'
 'To obtain well-diffracting crystals of a glycosylated protein, for example, the conformationally heterogenous glycans are often removed enzymatically to facilitate crystallization. For cryo-EM, these pretreatments are generally unnecessary, thereby providing molecular details of proteins in the context of posttranslational modifications. Analyses of fully glycosylated viral envelope proteins are fascinating examples that document the potential of cryo-EM for studying protein–carbohydrate interactions (Figure 30.5). Other examples include polysaccharide-synthesizing enzymes bound to their polymeric products as well as integral membrane transporters associated with lipopolysaccharide substrates. Cryo-electron microscopy structure of the native fully glycosylated HIV-1 envelope trimer. Protein subunits are shown as gray surfaces and glycans are shown as ball and sticks (PDB entry 5FUU).'
 'Protein subunits are shown as gray surfaces and glycans are shown as ball and sticks (PDB entry 5FUU). Carbohydrates are colored green and pale green (β- (more...) We can thus look forward to correlating unprecedented structural insights on protein glycosylation and complex carbohydrate interactions with biochemical, functional, spectroscopic, and in silico approaches in the coming years. Experimental structural information obtained by crystallographic, NMR, and cryo-EM methods have clearly been of value in building an understanding of the molecular interactions that lead to glycan recognition by proteins. However, systems in which interactions are of interest far outnumber the cases in which these methods can be applied. Most crystal structures contain either small ligands or yield useful electron densities for only parts of larger ligands. The same is true to a certain extent for cryo-EM structures. NMR methods, although giving detailed information on bound ligand geometries, frequently give only qualitative information on parts of ligands or protein that are in intimate contact with each other.']","Recent advances in cryo-EM provide exciting opportunities to study protein-glycan interactions in detail, offering atomic-level insights into various biological samples, from soluble and membrane-integrated protein complexes to filamentous polymers and entire viruses. Cryo-EM can be divided into single-particle analysis (SPA) and tomography approaches, allowing for the reconstruction of molecular structures in three dimensions. This technique is particularly valuable for imaging complex structures like the glycocalyx of tissues, plant and fungal cell walls, and microbial cell envelopes and capsules. Additionally, cryo-EM enables the study of fully glycosylated proteins in their native state, providing molecular details of proteins in the context of posttranslational modifications.","The fundamental understanding of glycan–protein interactions, as enriched by experimental studies of all types, has now been encoded in powerful molecular simulation programs that provide a computational approach to generating three dimensional pictures of glycan–protein complexes. These are important because it is difficult to produce complex glycan ligands in the amounts and purity required for most experimental approaches. These methods, although still evolving toward increased confidence in outcomes, provide models for experimentally inaccessible systems that can be tested with a variety of nonstructural approaches. They can also be leveraged with sparse structural data that alone could not provide detailed structural information.",1.0,0.6859729322896704,0.6220905094756478,0.022727272727272728,0.9999999999857143,1.0
"Complete the following paragraph: Ricinus communis is native to Africa and India and has been used for millennia, by many cultural groups, for numerous medical and industrial purposes. Two lectins, originally termed RCA-I and RCA-II, can be purified from the seeds.","['The R-type lectin superfamily. Different groups within the superfamily are characterized by the domain structures shown.  Ricinus communis is native to Africa and India and has been used for millennia, by many cultural groups, for numerous medical and industrial purposes. Two lectins, originally termed RCA-I and RCA-II, can be purified from the seeds. RCA-I (molecular mass ∼120 kDa) is a hemagglutinin and a very weak toxin. RCA-II (∼60 kDa), better known as ricin, is an agglutinin and a very potent toxin. Ricin is easily extractable from castor beans and can kill humans at very small doses.'
 'Ricin is easily extractable from castor beans and can kill humans at very small doses. RCA-II (ricin; Figure 31.2) is synthesized as a single prepropolypeptide of 576 amino acid (aa) residues containing a secretion signal peptide (residues 1–35), an A chain (residues 36–302), a 12-aa linker region (residues 303–314), and a B chain (residues 315–576). The A-chain toxin is an N-glycoside hydrolase (EC 3.2.2.22) that inactivates the 60S ribosome. The B-chain lectin domain binds to galactose (Gal) and β-galactosides. The amino-terminal signal sequence brings the propolypeptide to the endoplasmic reticulum (ER), where the signal is cleaved off, and the polypeptide is glycosylated.'
 'Through evolution, the R-type lectin domain has given rise to various protein forms, some containing this domain alone and others containing additional functional domains (e.g., enzyme or toxin). We will discuss the diversity of this superfamily in terms of molecular tinkering and “bricolage,” based on structure–function relationships. In 1888, Peter Hermann Stillmark at the University of Dorpat (now University of Tartu, Estonia) reported that protein extracts from seeds of Ricinus communis (commonly called “castor oil plant”; seeds are called “castor beans”) contained a factor (which he termed “ricin”) capable of agglutinating erythrocytes. Ricin was already well known as a toxin, but its carbohydrate-binding specificity was not analyzed in detail until the mid-20th century, when it was classified as a lectin.'
 'Each heterodimer contains an A chain disulfide-linked to a Gal-binding B chain. The A-chain sequences of RCA-I and RCA-II differ in 18 residues and are 93% similar, whereas the B-chain sequences differ in 41 of 262 residues and are 84% similar. The subunits are all N-glycosylated and usually display oligomannose-type N-glycans. Several other lectins having high homology with ricin are also encoded by the R. communis genome; some of these are termed ricin-A, -B, -C, -D (ricin), and -E. The B chain of both RCA-I (agglutinin) and RCA-II (ricin) contains two CRDs in the polypeptide. RCA-I binds preferentially to terminal β-linked Gal, whereas RCA-II binds to either terminal β-linked Gal or GalNAc.'
 'A wide variety of R-type lectins with diverse configurations, including RIP-IIs and heterotetramers such as RCA-II, have been purified from various plant tissues. Nontoxic lectins isolated from elderberry (genus Sambucus) bark include SSA (Sambucus sieboldiana agglutinin) and SNA (Sambucus nigra agglutinin UniProt Q41358). These are useful because it is the rare R-type lectin that binds strongly to α2-6-linked sialic acid–modified glycans, but not to α2-3-linked sialylated ligands. Both are heterotetramers (∼140 kDa) composed of two heterodimers, each containing an A chain (resembling ricin A chain) disulfide-bonded to a B chain (R-type lectin).'
 'RCA-I binds preferentially to terminal β-linked Gal, whereas RCA-II binds to either terminal β-linked Gal or GalNAc. These lectins are often purified and separated by differential elution from Gal-based affinity resins; RCA-II is eluted with GalNAc, and RCA-I is then eluted with Gal. These lectins have very low binding affinities for monosaccharides (Kd in the range 10−3 to 10−4 m), but very high affinities (10−7 to 10−8 m) for cells, because of their multivalency and enhanced binding to multiple surface glycans having nonreducing terminal Galβ1-4GlcNAc-R (type-2 LacNAc) sequences. Both lectins also bind strongly to glycans with GalNAcβ1-4GlcNAc-R (LacdiNAc), and weakly to the isomer Galβ1-3GlcNAc-R (type-1 LacNAc).'
 'Neither lectin binds appreciably to glycoconjugates having nonreducing terminal α-linked Gal residues. Ricin is highly toxic and the effects of ingestion are severe, with symptoms appearing after a 2- to 24-h latent period. The lethal dose (LD50) of ricin is extremely low (3–5 µg/kg body weight). Ricin is classified as a type II ribosome-inactivating protein (RIP-II). RCA-I (agglutinin) is less toxic than ricin, because of the weaker enzymatic activity of its A-chain. Type I ribosome-inactivating proteins (RIP-I), which lack a B chain with R-type lectin domains, are much less toxic than ricin because toxin entry into target cells is facilitated by B-chain carbohydrate-binding activity. RIP-I expressed in tissues of various types of plants affects disease resistance.']","Ricinus communis is native to Africa and India and has been used for millennia, by many cultural groups, for numerous medical and industrial purposes. Two lectins, originally termed RCA-I and RCA-II, can be purified from the seeds. RCA-I (molecular mass ∼120 kDa) is a hemagglutinin and a very weak toxin. RCA-II (∼60 kDa), better known as ricin, is an agglutinin and a very potent toxin. Ricin is easily extractable from castor beans and can kill humans at very small doses.","RCA-I (molecular mass ∼120 kDa) is a hemagglutinin and a very weak toxin. RCA-II (∼60 kDa), better known as ricin, is an agglutinin and a very potent toxin. Ricin is easily extractable from castor beans and can kill humans at very small doses. RCA-II (ricin; Figure 31.2) is synthesized as a single prepropolypeptide of 576 amino acid (aa) residues containing a secretion signal peptide (residues 1–35), an A chain (residues 36–302), a 12-aa linker region (residues 303–314), and a B chain (residues 315–576). The A-chain toxin is an N-glycoside hydrolase (EC 3.2.2.22) that inactivates the 60S ribosome. The B-chain lectin domain binds to galactose (Gal) and β-galactosides. The amino-terminal signal sequence brings the propolypeptide to the endoplasmic reticulum (ER), where the signal is cleaved off, and the polypeptide is glycosylated.",0.9375,0.5888747529168843,0.7482906833351366,0.05405405405405406,0.9999999999857143,1.0
"Complete the following paragraph: A common feature of the legume L-type lectins is their monomeric structure. The structures of the monomers consist of three antiparallel β-sandwich: a flat six-stranded “back” sheet, a concave seven-stranded “front” sheet, and a short “top” sheet that keeps the two major sheets together (Figure 32.1A,B). All of these lectins require Ca++ and a transition metal ion (usually Mn++) for their carbohydrate-binding activity.","['More than 100 of the seed legume L-type lectins have been characterized and are the most extensively studied proteins of this class. It also should be noted that the L-type fold has been observed in noncarbohydrate binding proteins, such as lectin-like receptor kinases in plants that are important in development and stress responses. A common feature of the legume L-type lectins is their monomeric structure. The structures of the monomers consist of three antiparallel β-sandwich: a flat six-stranded “back” sheet, a concave seven-stranded “front” sheet, and a short “top” sheet that keeps the two major sheets together (Figure 32.1A,B). All of these lectins require Ca++ and a transition metal ion (usually Mn++) for their carbohydrate-binding activity. The glycan-binding and metal-binding sites are localized in close proximity to each other at the top of the “front” sheet.'
 'The crystal structures of a number of legume seed lectins allowed the identification of the carbohydrate-binding sites. Structural similarities in the tertiary structures were identified among these lectins and several other lectins, including the galectins (see Chapter 36), as will be discussed in this chapter. For this reason, the term “L-type lectins” has recently been designated as a classification for all proteins with this legume seed lectin-like protein structure. The L-type lectins are distinguished from other lectins primarily based on tertiary structure and not the primary structure. In general, either the entire lectin monomer or the carbohydrate-recognition domains (CRDs) of the more complex lectins is composed of antiparallel β-sheets connected by short loops and β-bends, and they usually lack any α-helices. These sheets form a dome-like structure related to the “jelly-roll fold,” which is often called a “lectin fold.” The carbohydrate-binding site is generally localized toward the apex of this dome.'
 'Small differences in the monomeric structure of the different legume lectins result in different modes of association of the β-sheet during oligomerization. For instance, although both ConA and PNA are tetrameric—being dimers of dimers—the quaternary association in ConA involves the association of the two six-stranded back β-sheets to form an extended 12-stranded β-sheet in each dimer, whereas the quaternary association in PNA involves a back-to-back arrangement of the back β-sheets. The tetrameric structure of ConA is shown in Figure 32.1C,D. Although some of the other lectins occur as dimeric and tetrameric structures, several other different orientations of the β-sheets account for the variability in dimeric and tetrameric structures of other lectins in this class.'
 'The tetrameric (more...) Comparison of the subunit structures of soybean agglutinin (A) complexed with a pentasaccharide containing Galβ1-4GlcNAc-R and human galectin-3 at 1.4 Å (B) complexed with Galβ1-4GlcNAc. Both lectins display a related β-barrel (more...) Relationships between sequences of L-type lectins from legumes compared with the phylogeny of the various species within the Fabaceae family of plants suggest that these lectins most probably arose from divergent evolution. It remains an open possibility that the tertiary structures of some of the other members of the “L-type lectin family” arose by convergent evolution. It must also be noted that for a protein to be firmly placed in the L-type lectin category it must have the lectin fold and glycan-binding activity. All soluble L-type lectins found to date are multimeric proteins, although all do not have the same quaternary structure.'
 'Both the glycine and arginine form hydrogen bonds with the ligand via their main-chain amides. Loop C contains an invariant asparagine, which forms a hydrogen bond with the ligand via its side chain, and an invariant hydrophobic amino acid. Besides these invariant amino acids, backbone atoms of the residues of loop D also contribute to monosaccharide recognition. (Top) Three-dimensional structure of a peanut agglutinin (PNA) monomer showing the four loops involved in sugar binding: loops A, B, C, and D. The bound sugar (lactose) is shown as a “ball-and-stick” model. Calcium and manganese ions are (more...) The legume L-type lectins are generally classified into groups based on their carbohydrate specificities as often identified by the ability of monosaccharides to inhibit their agglutinating activity. These differences in specificities are brought about by variability in the conformation and size of the D loop and to some extent by the C loop.'
 'The tertiary structure of the monomer of ConA, the lectin from the seeds of the legume Canavalia ensiformis, is shown in Figure 32.1. The crystal structures of at least 20 other legume L-type lectin monomers have been determined by high-resolution X-ray crystallography and are almost superimposable on this structure. Thus, it is not surprising that the amino acid sequences of legume lectins show remarkable homology with one another and of the sequences of many other legume seed lectins sequenced but not yet crystallized. Fewer, but significant, homologies in primary structure have been found between legume L-type lectins compared with some L-type lectins from far distant sources, such as ERGIC-53 and VIP36, found in vertebrates. Yet, in other L-type lectins, no homology is found with the seed lectins, although they contain similar lectin folds.'
 'The lectins vary from one another as to whether the mature proteins contain oligomannose-type, complex-type, or a mixture of both types of N-glycans. The lectins may also undergo a variety of proteolytic modifications as they transit through the secretory system. Some of the lectins are cleaved to generate a β-chain, corresponding to the amino terminus and an α-chain corresponding to the carboxyl terminus. For example, the pea lectin and favin (the lectin from Vicia faba) are tetrameric glycoproteins that contain two types of subunits, α and β, which are ∼5 kDa and ∼21 kDa, respectively. These two lectins are each synthesized as single polypeptide precursors that contain the sequences of both chains in the following orientation: β-chain–α-chain. The chains associate to form dimers; they are then proteolytically processed in the protein bodies to form tetramers containing two separate α- and β-chains.']",All of these lectins require Ca++ and a transition metal ion (usually Mn++) for their carbohydrate-binding activity. The glycan-binding and metal-binding sites are localized in close proximity to each other at the top of the “front” sheet.,"The glycan-binding and metal-binding sites are localized in close proximity to each other at the top of the “front” sheet. The glycan-binding site is composed of four loops: A, B, C, and D (Figure 32.3, top). These loops contain four invariant amino acids that are essential for carbohydrate binding (Figure 32.3, bottom). Loop A contains an invariant aspartate, which forms hydrogen bonds between its side chain and the glycan ligand. This amino acid is linked to its preceding amino acid (usually alanine) by a rare cis-peptide bond, which is stabilized by the metal ions and is necessary for the proper orientation of the aspartate in the combining site. Loop B contains an invariant glycine, which also forms hydrogen bonds with the ligand.",1.0,0.6342754378436501,0.6825800330697658,0.05,0.9999999999857143,0.3333333333333333
"Complete the following paragraph: The original experiments of Neufeld showed that a portion of newly synthesized lysosomal enzymes are secreted into the medium, but may be recaptured by the same cell or by adjacent cells expressing cell-surface CI-MPRs (Figure 33.1). Enzymes that bind to such cell-surface MPRs are endocytosed via clathrin-coated pits and vesicles, eventually reaching the same late endosomal compartments in which newly synthesized molecules arrive from the Golgi.","['Newly synthesized glycoproteins originating from the rough endoplasmic reticulum (ER) pass through the Golgi stacks and are then sorted to various destinations. (more...) The original experiments of Neufeld showed that a portion of newly synthesized lysosomal enzymes are secreted into the medium, but may be recaptured by the same cell or by adjacent cells expressing cell-surface CI-MPRs (Figure 33.1). Enzymes that bind to such cell-surface MPRs are endocytosed via clathrin-coated pits and vesicles, eventually reaching the same late endosomal compartments in which newly synthesized molecules arrive from the Golgi. This secretion–recapture pathway is a minor one in most cells, but plays a critical role in enzyme replacement therapy. As described in Chapter 44, there are many genetic disorders in glycan degradation that result from decreased activity of a given lysosomal enzyme.'
 'Following delivery to early endosomes, lysosomal enzymes are released from MPRs as the endosomes mature to late endosomes and the pH decreases. Late endosomes then undergo dynamic fusion/fission with lysosomes, allowing selective transfer of lysosomal enzymes to the lysosomes and leaving the MPRs behind in subdomains of the late endosomes. These MPRs may then either return to the TGN mediated by a multiprotein retromer complex or move to the plasma membrane, in which internalization via clathrin-coated pits occurs, mediated by the coat protein AP2. There are several pathways for the MPRs to be returned to the TGN from the various endosomal compartments, although the relative importance of the different pathways is unclear. Subcellular trafficking pathways of glycoproteins, lysosomal enzymes, and M6P receptors (MPRs). Newly synthesized glycoproteins originating from the rough endoplasmic reticulum (ER) pass through the Golgi stacks and are then sorted to various destinations.'
 'MPRs avoid delivery to lysosomes, in which they would be degraded. This trafficking is governed by a number of short amino acid sorting signals in the cytoplasmic tails of the receptors. The TGN is the site in which newly synthesized lysosomal enzymes bind to MPRs that are then collected into clathrin-coated pits and packaged into clathrin-coated vesicles for delivery to the early endosome. This process involves interaction of the MPRs with two types of coat proteins: the GGAs (Golgi-localized, γ-ear–containing, ADP-ribosylation factor binding) and AP1 (adapter protein 1). In addition to binding MPRs, the coat proteins recruit clathrin for the assembly of clathrin-coated vesicles. Following delivery to early endosomes, lysosomal enzymes are released from MPRs as the endosomes mature to late endosomes and the pH decreases.'
 'Interestingly, all these enzymes are actually synthesized by I-cells, but are mostly secreted into the medium, instead of being retained in lysosomes. Neufeld showed that although I-cells incorporated the high-uptake enzymes secreted by normal cells, enzymes secreted by I-cells were not taken up by other cells (Figure 33.1). She therefore proposed that I-cell disease results from a failure to add a common recognition marker to lysosomal enzymes. This marker was assumed to be responsible for the proper trafficking of newly synthesized enzymes to lysosomes in normal cells. The “high-uptake” property was destroyed by strong periodate treatment, which oxidizes vicinal hydroxyl groups in glycans, predicting that the recognition marker was a glycan. High uptake of lysosomal enzymes was next found, by William Sly, to be blocked by M6P and its stereoisomer fructose 1-phosphate, but not by other sugar phosphates.'
 'With ACP2, the enzyme is synthesized initially as a membrane-bound protein, and once in the lysosome, it is proteolytically cleaved to generate the mature soluble form. Glucocerebrosidase is targeted to lysosomes independently of the MPR pathway by forming a complex with LIMP-2, a lysosomal membrane protein that contains a targeting signal in its cytoplasmic tail. Likewise, other integral membrane proteins of the lysosome use similar targeting motifs in their cytoplasmic tails to traffic to the lysosome. Furthermore, several M6P-independent cargo receptors for the transport of lysosomal enzymes have been identified such as the LDL receptor-related protein 1 (LRP1), LRP2 (megalin), sortilin, and mannose receptors. A small number of proteins have now been identified that are related to the P-type lectins because of the presence of MRH domains. These MRH domains contain the residues that bind mannose, but lack the residues that bind phosphate.'
 'Fibroblasts from embryos that lack both receptors show a massive missorting of multiple lysosomal enzymes. Thus, both receptors are required for efficient intracellular targeting of lysosomal enzymes. Comparison of lysosomal enzymes secreted by the different cell types indicates that the two receptors may interact preferentially with different subgroups of enzymes. Thus, the structural heterogeneity of the M6P recognition marker within a single lysosomal enzyme and between different enzymes is one explanation for the evolution of two MPRs with complementary binding properties: that is, to provide an efficient but varied targeting of lysosomal proteins in different cell types or tissues. What initially appeared to be a precise lock-and-key mechanism turned out to be a far more complex and flexible system, with functionally useful biological flexibility. At steady state, MPRs are concentrated in the TGN and late endosomes, but they cycle constitutively between these organelles, early (sorting) endosomes, recycling endosomes, and the plasma membrane (Figure 33.5).'
 'For example, some cell types in the body may not express adequate levels of the CI-MPR on their surfaces to endocytose sufficient enzyme to restore normal lysosomal function. Also, the organ that is most seriously affected in many of these diseases (the brain) is inaccessible because of the blood–brain barrier. Although the first intraventricular M6P-dependent enzyme replacement therapy for children deficient for the lysosomal tripeptidyl peptidase 1 are very promising, further studies are needed. Although the MPR pathway has a major role in vertebrate lysosomal enzyme trafficking, its contribution in invertebrate systems is not prominent. Lysosomal enzymes are targeted in organisms such as Saccharomyces, Trypanosoma, and Dictyostelium, without the aid of identifiable MPRs.']","This secretion–recapture pathway, although a minor one in most cells, plays a critical role in enzyme replacement therapy. It involves the endocytosis of enzymes that bind to cell-surface MPRs via clathrin-coated pits and vesicles, ultimately leading them to the same late endosomal compartments where newly synthesized molecules from the Golgi are also directed.","This secretion–recapture pathway is a minor one in most cells, but plays a critical role in enzyme replacement therapy. As described in Chapter 44, there are many genetic disorders in glycan degradation that result from decreased activity of a given lysosomal enzyme. Some of these enzymes that are targeted to lysosomes via the M6P pathway have been prepared in large quantities as recombinant soluble proteins and used in enzyme replacement therapy. To date, the benefits have been variable but less than optimal. There are a number of potential reasons for this. First, some of the preparations may not contain the physiologic complement of the phosphomannosyl recognition marker. It is reasonable to suggest that a greater M6P content may improve the efficacy of enzyme replacement in these patients. This has been shown to be the case in mouse and dog model systems. However, even with fully phosphorylated enzymes there may be obstacles that are difficult to overcome. For example, some cell types in the body may not express adequate levels of the CI-MPR on their surfaces to endocytose sufficient enzyme to restore normal lysosomal function. Also, the organ that is most seriously affected in many of these diseases (the brain) is inaccessible because of the blood–brain barrier. Although the first intraventricular M6P-dependent enzyme replacement therapy for children deficient for the lysosomal tripeptidyl peptidase 1 are very promising, further studies are needed.",1.0,0.4863578260289141,0.7421915661451253,0.04878048780487805,0.9999999999857143,0.2
"Complete the following paragraph: C-type lectins (CTLs) are Ca++-dependent glycan-binding proteins (GBPs) that share primary and secondary structural homology in their carbohydrate-recognition domains (CRDs). The CRD of CTLs is more generally defined as the CTL domain (CTLD), because not all proteins with this domain bind either glycans or Ca++.","['The CRD of CTLs is more generally defined as the CTL domain (CTLD), because not all proteins with this domain bind either glycans or Ca++. CTLs include collectins, selectins, endocytic receptors, and proteoglycans, some of which are secreted and others are transmembrane proteins. They often oligomerize, which increases their avidity for multivalent ligands and enhance recognition of pattern recognition receptor (PRRs). CTLs differ significantly in the types of ligands that they recognize with high affinity (e.g., glycans, proteins, lipids, and inorganic compounds). These proteins that recognize pathogens or self-expressed ligands function as adhesion, phagocytic, and signaling receptors in many pathways, including homeostasis and innate and adaptive immunity, and are crucial in inflammatory responses, leukocyte and platelet trafficking, and tissue remodeling. The CTL family is remarkably diverse and is the largest family of known GBPs.'
 'NCBI Bookshelf. A service of the National Library of Medicine, National Institutes of Health. Varki A, Cummings RD, Esko JD, et al., editors. Essentials of Glycobiology [Internet]. 4th edition. Cold Spring Harbor (NY): Cold Spring Harbor Laboratory Press; 2022.  doi: 10.1101/glycobiology.4e.34 Richard D. Cummings, Elise Chiffoleau, Yvette van Kooyk, and Rodger P. McEver. C-type lectins (CTLs) are Ca++-dependent glycan-binding proteins (GBPs) that share primary and secondary structural homology in their carbohydrate-recognition domains (CRDs). The CRD of CTLs is more generally defined as the CTL domain (CTLD), because not all proteins with this domain bind either glycans or Ca++.'
 'The CTL family is remarkably diverse and is the largest family of known GBPs. The first CTL identified in animals was the hepatic asialoglycoprotein receptor (ASGPR), also termed the hepatic Gal/GalNAc receptor or Ashwell–Morell receptor (AMR). The sequences of the AMR and other CTLs revealed a CRD unique to this family of proteins. Glycan binding by CTLs is typically Ca++-dependent because of specific amino acid residues that coordinate Ca++ and bind the hydroxyl groups of sugars, but some CTLDs bind glycans without coordinating Ca++. The CTLD is defined by the sequence of amino acids and Cys positions, as well as the folded structure.'
 'Structure of C-type lectins (CTLs). (A) Ribbon diagram of the carbohydrate-recognition domain (CRD) of rat mannose-binding protein A (MBP-A). (Light green spheres) Ca++-binding sites, where 1 is the auxiliary binding site and 2 is the principal binding (more...) CTLs occur as both monomers and oligomers, such as the trimeric rat mannose-binding protein (MBP)-A (Figure 34.2). The rat MBP was the first CTL structurally characterized with ligand by crystallography. The CRD of trimeric lectins is angled to the side of the stalk domain through which the protein associates to form the trimer. The CRDs are at the top of the trimer and enhance multivalent interactions with glycan ligands. Crystal structure of trimeric rat mannose-binding protein-A complexed with α-methylmannoside.'
 'Several groups have CTLDs that lack critical Ca++ residues, but can bind glycans (e.g., dectin-1 and layilin in group 5); the REG group 7 lacks Ca++ binding but it is unclear whether they bind glycans, whereas tetranectin in group 9 binds Ca++ and again it is unclear if it binds glycans. From a functional perspective, we know most about collectins, endocytic receptors, myeloid lectins, and selectins, as discussed below. Different groups of C-type lectins (CTLs) and their domain structures. (A) Sixteen groups are shown, defined by their phylogenetic relationships and domain structures. Some of the groups are soluble proteins and others are transmembrane proteins. (B) (more...) CTLF-containing proteins are found in all metazoans and many nonmetazoans.'
 'However, because the CTLD is relatively shallow with few contacts to sugars, it is not possible to predict the glycan structures that bind to a particular CTL. In several CTLs, such as P-selectin and the AMR, Ca++ binding induces structural changes in the CRD that stabilize the double-loop region. Loss of Ca++ can lead to destabilization of these loops and loss of ligand binding, even when Ca++ is not directly involved in complexing the ligand, as seen in the macrophage mannose receptor. This destabilization is also important in pH-induced changes that lead to loss of ligand-binding affinity, because of the pH-induced loss of Ca++. In CTLD-containing proteins such as human tetranectin, which is not known to bind glycans, the CTLD can bind Ca++, but in the absence of Ca++ the CTLD is important for interactions with kringle-domain-containing proteins, such as plasminogen. Structure of C-type lectins (CTLs).'
 'The CRD has two conserved disulfide bonds and up to four sites for binding Ca++, with site occupancy depending on the lectin. Amino acid residues with carbonyl side chains are often coordinated to Ca++ in the CRD, and these residues directly bind to sugars when Ca++ is bound in site 2. A ternary complex may form between a sugar, the Ca++ ion in site 2, and amino acids within the CRD, whereas the specific residues within the CRD determine sugar specificity. Key conserved residues that bind sugars include the “EPN” motif (which promotes binding to Man, GlcNAc, Fuc, and Glc) and “WND” motif (which promotes binding to Gal and GalNAc), as seen in mouse L-selectin and rat mannose-binding protein C (Figure 34.1). However, because the CTLD is relatively shallow with few contacts to sugars, it is not possible to predict the glycan structures that bind to a particular CTL.']","The CRD of CTLs is more generally defined as the CTL domain (CTLD), because not all proteins with this domain bind either glycans or Ca++. CTLs include collectins, selectins, endocytic receptors, and proteoglycans, some of which are secreted and others are transmembrane proteins. They often oligomerize, which increases their avidity for multivalent ligands and enhance recognition of pattern recognition receptor (PRRs). CTLs differ significantly in the types of ligands that they recognize with high affinity (e.g., glycans, proteins, lipids, and inorganic compounds). These proteins that recognize pathogens or self-expressed ligands function as adhesion, phagocytic, and signaling receptors in many pathways, including homeostasis and innate and adaptive immunity, and are crucial in inflammatory responses, leukocyte and platelet trafficking, and tissue remodeling. The CTL family is remarkably diverse and is the largest family of known GBPs.","CTLs include collectins, selectins, endocytic receptors, and proteoglycans, some of which are secreted and others are transmembrane proteins. They often oligomerize, which increases their avidity for multivalent ligands and enhance recognition of pattern recognition receptor (PRRs). CTLs differ significantly in the types of ligands that they recognize with high affinity (e.g., glycans, proteins, lipids, and inorganic compounds). These proteins that recognize pathogens or self-expressed ligands function as adhesion, phagocytic, and signaling receptors in many pathways, including homeostasis and innate and adaptive immunity, and are crucial in inflammatory responses, leukocyte and platelet trafficking, and tissue remodeling. The CTL family is remarkably diverse and is the largest family of known GBPs.",1.0,0.6253096846056603,0.9124235001278647,0.021739130434782608,0.9761904761742063,1.0
"Complete the following paragraph: Of all the Siglecs, CD22 has the most conserved specificity for sialylated ligands, binding primarily to α2-6-linked Sias of the type Neu5Ac(or Neu5Gc)α2-6Galβ1-4GlcNAc, which are common capping structures of many complex-type N-glycans. Additional specificity can be conferred by the nature of the Sia moiety as well as sulfation of the underlying glycan. Neither human nor mouse CD22 binds 9-O-acetylated Sias; mouse CD22 has a strong preference for Neu5Gc over Neu5Ac, whereas human CD22 binds both of the latter forms.","['Of all the Siglecs, CD22 has the most conserved specificity for sialylated ligands, binding primarily to α2-6-linked Sias of the type Neu5Ac(or Neu5Gc)α2-6Galβ1-4GlcNAc, which are common capping structures of many complex-type N-glycans. Additional specificity can be conferred by the nature of the Sia moiety as well as sulfation of the underlying glycan. Neither human nor mouse CD22 binds 9-O-acetylated Sias; mouse CD22 has a strong preference for Neu5Gc over Neu5Ac, whereas human CD22 binds both of the latter forms. Recombinant soluble CD22 can precipitate a subset of glycoproteins from B-cell lysates including CD45, a major sialoprotein of T and B cells.'
 'Likewise, Cmah-null mice deficient in Neu5Gc have reduced ligands for mouse CD22 and Siglec-G (see below) and show B cell hyperactivity. Proposed biological functions mediated by CD22. CD22 glycan-dependent homotypic interactions in equilibrium with CD22–BCR interactions. CD22 is clustered together by Sia-dependent homotypic interaction and kept away from BCR on wild-type B cells, (more...) Besides regulating B-cell functions via cis-interactions, CD22 can also mediate trans-interactions with sialylated ligands on other cells that sequester CD22 away from the BCR. This could be important for raising B-cell activation thresholds to “self”-antigens and may help to ensure that signaling through the BCR can only occur in lymphoid tissues in which CD22 α2-6-sialylated ligands are abundant.'
 'Recombinant soluble CD22 can precipitate a subset of glycoproteins from B-cell lysates including CD45, a major sialoprotein of T and B cells. However, on B cells, CD22 appears to mainly be either cis-associated with other CD22 molecules in a glycan-dependent manner, or with the BCR, which it inhibits in a glycan-independent manner. These interactions are consistent with studies of mouse mutants that either lack CD22 glycan ligands or express mutated forms of CD22 unable to bind glycans. B cells from ST6Gal-I-deficient mice that lack CD22 ligands show an anergic phenotype, essentially the opposite of the phenotype observed in CD22-deficient mice. Mice expressing a lectin-inactive version of CD22 with a mutated binding site arginine also show reduced BCR signaling (anergy) and, similar to ST6Gal-I-deficient mice, they show increased CD22-BCR association and stronger CD22 phosphorylation (Figure 35.3).'
 'Siglecs (Sia-binding immunoglobulin-like lectins) constitute a Sia-binding family within the I-type lectins (Chapter 35). In humans, there are 14 Siglecs with sialic acid–dependent functions (13 and 17 are missing in humans and 12 does not bind sialic acid), all but one of which are found on the surface of different blood cell types. In several cases, binding of Siglecs to their sialoglycan targets on other cells or their own cell surface modulates ongoing immune responses, either damping them to protect from hyperimmune reactions or activating them. The one Siglec not found in the immune system, Siglec-4 (myelin-associated glycoprotein), is in the nervous system, where it aids cell–cell interactions between nerve cells and myelin, the protective and insulating membrane sheath essential to rapid nerve conduction.'
 'These counteract activating signals triggered by receptors containing ITAMs. Some Siglecs, notably Siglecs-14, -15, -16, and -H and mouse CD33, have a positively charged residue within the transmembrane region, which can associate with the DAP12 ITAM-containing adaptor, thereby mediating activating functions. Sn (CD169) was identified as a Sia-dependent sheep erythrocyte receptor expressed by mouse stromal macrophages. Sn has an unusually large number of Ig domains (seventeen), which are conserved among mammals and reptiles. These may be important for extending the Sia-binding site away from the plasma membrane to promote intercellular interactions. Sn prefers α2-3-linked Sias more than α2-6- and α2-8-linked Sias, and does not bind Sias modified by hydroxylation (Neu5Gc) or side-chain O-acetylation (e.g., Neu5,9Ac2).'
 'Siglecs also contain conserved hydrophobic amino acids on the A and G β-strands that interact with the N-acetyl group and glycerol side chain of Sia, respectively. Although all Siglecs appear to use a common template for recognizing Sias, their binding preferences for extended glycan chains vary greatly. The peptide loop between the C and C′ β-strands is highly variable among Siglecs and has a key role in determining their fine sugar specificity. For example, molecular grafting of the C–C′ loop between Siglec-7 and Siglec-9 resulted in switched sugar-binding specificities. Structural studies have shown that this loop appears to be highly flexible, being able to make specific and varied interactions with long glycan chains. In addition, V-set domain sequences are the most rapidly evolving regions in these molecules, likely explaining species differences in binding specificity. Structural basis of Siglec binding to ligands.'
 'Although the significance of this bond for ligand recognition is unclear, optimal Sia-binding activity of many Siglecs requires the adjacent C-set domain, probably for correct folding and stability. Three-dimensional structures for the mouse Sn, human Siglec-7, and human CD33 V-set domains, the V-set and adjacent C-set domain of Siglec-5, first three Ig-like domains of human CD22, and all five Ig-like domains of mouse MAG have been determined by X-ray crystallography, in the presence and absence of Sia ligands (Figure 35.2). Along with the nuclear magnetic resonance (NMR) structure of Siglec-8, structural templates for Sia recognition by Siglecs appear to be shared among Siglecs. In all instances, an “essential” arginine residue is located in the middle of the F β-strand, making a bidentate salt bridge with the carboxylate of Sia.']","Recombinant soluble CD22 can precipitate a subset of glycoproteins from B-cell lysates including CD45, a major sialoprotein of T and B cells. On B cells, CD22 appears to mainly be either cis-associated with other CD22 molecules in a glycan-dependent manner, or with the BCR, which it inhibits in a glycan-independent manner. These interactions are consistent with studies of mouse mutants that either lack CD22 glycan ligands or express mutated forms of CD22 unable to bind glycans. B cells from ST6Gal-I-deficient mice that lack CD22 ligands show an anergic phenotype, essentially the opposite of the phenotype observed in CD22-deficient mice. Mice expressing a lectin-inactive version of CD22 with a mutated binding site arginine also show reduced BCR signaling (anergy) and, similar to ST6Gal-I-deficient mice, they show increased CD22-BCR association and stronger CD22 phosphorylation.","Recombinant soluble CD22 can precipitate a subset of glycoproteins from B-cell lysates including CD45, a major sialoprotein of T and B cells. However, on B cells, CD22 appears to mainly be either cis-associated with other CD22 molecules in a glycan-dependent manner, or with the BCR, which it inhibits in a glycan-independent manner. These interactions are consistent with studies of mouse mutants that either lack CD22 glycan ligands or express mutated forms of CD22 unable to bind glycans. B cells from ST6Gal-I-deficient mice that lack CD22 ligands show an anergic phenotype, essentially the opposite of the phenotype observed in CD22-deficient mice. Mice expressing a lectin-inactive version of CD22 with a mutated binding site arginine also show reduced BCR signaling (anergy) and, similar to ST6Gal-I-deficient mice, they show increased CD22-BCR association and stronger CD22 phosphorylation (Figure 35.3). Likewise, Cmah-null mice deficient in Neu5Gc have reduced ligands for mouse CD22 and Siglec-G (see below) and show B cell hyperactivity.",1.0,0.5889395042811075,0.9890950138524695,0.08571428571428572,0.9999999999857143,1.0
"Complete the following paragraph: Following the discovery of the Ashwell–Morell asialoglycoprotein receptor (AMR) in the liver, many investigators sought other such receptors by affinity chromatography with immobilized asialoglycoproteins. In 1975, a novel lectin of ∼15 kDa was isolated from electric organs of the electric eel, and named “electrolectin.” This noncovalently linked homodimer displayed hemagglutinating activity toward trypsinized rabbit erythrocytes that was inhibitable by β-galactosides; inclusion of β-mercaptoethanol in the isolation buffers was required to maintain the binding activity.","['Galectins have many biological functions, including roles in development, regulation of immune cell activities, and microbial recognition as part of the innate immune system. This chapter describes the diversity of the galectin family and presents an overview of what is known about their biosynthesis, secretion, and biological roles. Following the discovery of the Ashwell–Morell asialoglycoprotein receptor (AMR) in the liver, many investigators sought other such receptors by affinity chromatography with immobilized asialoglycoproteins. In 1975, a novel lectin of ∼15 kDa was isolated from electric organs of the electric eel, and named “electrolectin.” This noncovalently linked homodimer displayed hemagglutinating activity toward trypsinized rabbit erythrocytes that was inhibitable by β-galactosides; inclusion of β-mercaptoethanol in the isolation buffers was required to maintain the binding activity.'
 'The purified rabbit AMR agglutinated desialylated human and rabbit erythrocytes and induced mitogenesis in desialylated peripheral lymphocytes, which represented the first demonstration that an animal GBP could profoundly affect cellular metabolism. Interestingly, hepatic AMR can also recognize some sialylated ligands (Siaα2-6Galβ1-4GlcNAc-R). A homologous GBP identified in chicken hepatocytes recognizes glycoproteins containing terminal GlcNAc, rather than Gal, residues. Interestingly, circulating glycoproteins in birds constitutively lack sialic acid (Sia) compared with their mammalian counterparts. The AMR was one of the first proteins shown to participate in receptor-mediated endocytosis (RME) and, along with the low-density lipoprotein (LDL) receptor, transferrin receptor, and mannose 6-phosphate receptor (M6PR), represents some of the best characterized receptors.'
 'Although their specific glycan-binding activities make such plant lectins extremely useful scientific tools, their biological functions in plants remain mostly unknown. The first animal lectin discovered was the asialoglycoprotein receptor (ASGPR) identified by Anatol Morell and Gilbert Ashwell in the late 1960s during investigations of the turnover of a serum glycoprotein, ceruloplasmin. Like most glycoproteins circulating in blood, ceruloplasmin has complex N-glycans with sialic acid termini. To prepare radiolabeled ceruloplasmin, the terminal sialic acids were removed, leaving an exposed galactose. Surprisingly, asialoceruloplasmin had a circulation half-life (in rabbits) of minutes, whereas intact ceruloplasmin remained in the blood for hours. Glycoproteins with exposed Gal residues were rapidly cleared into liver cells via an endocytic cell-surface receptor that specifically bound to terminal β-linked Gal or GalNAc.'
 'Glycosylation of ceruloplasmin was found to regulate its lifetime in the rabbit circulation; enzymatic desialylation of radiolabeled ceruloplasmin exposed penultimate β-linked Gal residues and caused rapid accumulation of asialoceruloplasmin into hepatocytes. Removal or modification of the exposed Gal residues lessened the rate of clearance. In 1974, the Ca++-dependent AMR was purified from rabbit liver by affinity chromatography on asialoorosomucoid-Sepharose. The rabbit AMR is a heterooligomer containing two subunits of 48 kDa and 40 kDa, whereas the human AMR contains two subunits of 50 kDa (H1) and 46 kDa (H2) that occur as a heterooligomeric type I transmembrane protein (trimers and high-order oligomers) comprised of small and large subunits.'
 'The efficiency of the AMR in endocytosis has led it to be a target for gene therapy and delivery of molecules to hepatocytes. Some C-type lectins (CTLs) are endocytic receptors. Ligands are internalized by clathrin-dependent pathways and delivered to early and then late endosomes. Receptors may be recycled or degraded, depending on the receptor and the type of ligand it endocytoses. (more...) The precise orientation of the trimers within the AMR can dictate its affinity to specific glycans that have multivalent presentations. The AMR binds glycans with terminal β-linked Gal or GalNAc residues; however, tri- and tetra-antennary N-glycans, with appropriate branching and presentation of nonreducing terminal Gal/GalNAc, bind to the rat AMR with >100,000× higher affinity (∼nm range) than ligands with a single terminal Gal/GalNAc residue.'
 'Glycoproteins with exposed Gal residues were rapidly cleared into liver cells via an endocytic cell-surface receptor that specifically bound to terminal β-linked Gal or GalNAc. ASGPR was purified by affinity chromatography using a column of immobilized asialoglycoprotein. Other glycan-specific receptors involved in glycoprotein clearance and targeting were subsequently discovered, including mannose 6-phosphate receptors for targeting lysosomal enzymes to the lysosomes (Chapter 33) and mannose receptors that clear glycoproteins with terminal mannose or GlcNAc residues from the blood. Small soluble lectins specific for β-linked galactose (now called “galectins”; Chapter 36) were isolated by affinity chromatography of extracts from many biological sources ranging from the slime mold Dictyostelium discoideum to mammalian tissues. By the 1980s, the concept of vertebrate lectins that recognize specific glycans was well established.'
 'The AMR internalizes its ligands captured at the cell surface at physiological pH; via coated pits, the AMR in complex with its ligand is internalized into coated vesicles (Figure 34.4), and changes in pH in late endosomes lead to dissociation of Ca++ from the AMR and release of ligand. The uncomplexed AMR then recycles to the plasma membrane, whereas the ligand is delivered to lysosomes where it is degraded. For some nonrecycling receptors (e.g., dendritic cell [DC]-specific intercellular adhesion molecule-3-grabbing nonintegrin [DC-SIGN]), both the ligand and receptor are targeted to lysosomes and degraded. Internalization of ligands by the AMR in hepatocytes is rapid, occurring in 2–3 minutes, and the receptor recycles to the surface within 4–5 minutes. The efficiency of the AMR in endocytosis has led it to be a target for gene therapy and delivery of molecules to hepatocytes.']","In addition to the discovery of the Ashwell–Morell asialoglycoprotein receptor (AMR) in the liver, researchers identified a novel lectin called ""electrolectin"" in 1975. This lectin, isolated from electric eel organs, is a noncovalently linked homodimer with a molecular weight of approximately 15 kDa. It exhibited hemagglutinating activity towards trypsinized rabbit erythrocytes, which could be inhibited by β-galactosides. The inclusion of β-mercaptoethanol in the isolation buffers was necessary to maintain the binding activity of electrolectin.","Soon thereafter, in 1976, similar β-galactoside-binding lectins were isolated from chicken muscle and from extracts of calf heart and lung (∼15 kDa; now designated as galectin-1). These proteins were initially referred to as S-type lectins to denote their sulfhydryl dependency, presence of free cysteine residues, and solubility, along with shared primary sequence. In the early 1980s, a 35-kDa protein termed CBP35 that also bound to β-galactosides was identified in mouse fibroblasts. The same protein was studied by other groups under the names IgE-binding protein, L-29, and L-31 and is currently known as galectin-3. The nomenclature for galectins was systematized in 1994 and the first galectin type found (∼15 kDa, discussed above) retained the name galectin-1. All other members of this family were numbered consecutively by order of discovery.",1.0,0.6976804977035754,0.5440862253026262,0.02702702702702703,0.9150793650641138,0.0
"Complete the following paragraph: Examination of a high-resolution, three-dimensional structure of FimH bound to mannose revealed that, although mannose exists as a mixture of α and β anomers in solution, only the former was found in the complex. Mannose binds FimH at a deep and negatively charged site of FimH (Figure 37.4). FimH has “catch-bond” properties, such that the binding strength of individual FimH adhesins is augmented by increasing the shear forces on surface-bound E. coli cells.","['(Reprinted, with permission of Elsevier, from Sharon N. 2006. Biochim Biophys Acta 1760: 527–537; courtesy of David L. Hasty, University (more...) Examination of a high-resolution, three-dimensional structure of FimH bound to mannose revealed that, although mannose exists as a mixture of α and β anomers in solution, only the former was found in the complex. Mannose binds FimH at a deep and negatively charged site of FimH (Figure 37.4). FimH has “catch-bond” properties, such that the binding strength of individual FimH adhesins is augmented by increasing the shear forces on surface-bound E. coli cells. This is relevant for urinary tract infections, in which type-1 fimbriae mediate binding of the bacteria to the glycoprotein uroplakin Ia on the surface of bladder epithelial cells.'
 'Uroplakin Ia presents high levels of terminally exposed mannose residues that are capable of specifically interacting with FimH. Alternatively, type-1 fimbriae can bind to high mannose glycans on the soluble urinary Tamm–Horsfall glycoprotein/uromodulin, that forms long fibers. The resulting bacterial aggregates are flushed out of the urinary tract. Mice lacking the gene encoding the Tamm–Horsfall glycoprotein are considerably more susceptible to bladder colonization by type-1-fimbriated E. coli than normal mice. The α anomer of mannose in the binding site of FimH. The mannose residue is buried in a unique site at the tip of the carbohydrate-recognition domain (left) in a deep and negatively charged pocket (right). FimH prefers to bind D-mannose in the (more...) Most bacteria (and possibly other microorganisms) have multiple adhesins with diverse carbohydrate specificities.'
 ""FimH prefers to bind D-mannose in the (more...) Most bacteria (and possibly other microorganisms) have multiple adhesins with diverse carbohydrate specificities. Many of these have been described (examples in Table 37.2), wherein the specificity of lectin binding can help define the range of susceptible tissues in the host (i.e., the microbe's ecological niche). The columnar epithelium that lines the large intestine expresses receptors with Galα1–4Gal-Cer residues, whereas cells lining the small intestine do not. Thus, Bacterioides, Clostridium, E. coli, and Lactobacillus only colonize the large intestine under normal conditions. P-fimbriated E. coli and some toxins bind specifically to galabiose (Galα1–4Gal) and galabiose-containing oligosaccharides, most commonly as constituents of glycolipids.""
 'An analogy for adhesin–receptor binding is the interaction of the two faces of Velcro strips. The most well-characterized bacterial lectins include the mannose-specific type-1 fimbriae, the galabiose-specific P fimbriae, and the N-acetylglucosamine-binding F-17 fimbriae, which are produced by different strains of Escherichia coli. Fimbriated bacteria express 100 to 400 of these appendages, which typically have a diameter of 5–7 nm and can extend hundreds of nanometers in length (Figure 37.3) Thus, pili extend well beyond the bacterial glycocalyx comprised of lipopolysaccharide and capsular polysaccharides (see Chapter 21). Escherichia coli express hundreds of pili, as indicated by the fine filaments extending from the bacterium. (Reprinted, with permission of Elsevier, from Sharon N. 2006.'
 'Binding can occur to either internal (i.e., when the disaccharide is capped by other sugars) or terminal nonreducing galabiose units. P-fimbriated E. coli adhere mainly to the upper part of the kidney, where galabiose is abundant. The fine specificity of bacterial surface lectins and their relationship to the animal tropism of the bacteria can be further illustrated by E. coli K99. The K99 strain binds to glycolipids that contain N-glycolylneuraminic acid (Neu5Gc), in the form of Neu5Gcα2–3Galβ1–4Glc, but not to those that contain N-acetylneuraminic acid (Neu5Ac). These two sugars differ by a single hydroxyl group that is present only on Neu5Gc. Interestingly, Neu5Gc-containing receptors are expressed on the intestinal cells of newborn piglets, but disappear as the animals grow and develop.'
 'The envelope protein monomer is shown in ribbon form, displayed along its longitudinal axis and as an external side view. Note the alignment of positively (more...) Bacterial lectins occur commonly in the form of elongated multisubunit protein appendages, known as fimbriae (hairs) or pili (threads), which interact with glycoprotein and glycolipid receptors on host cells. Similar to viral glycan-binding proteins, adhesin-receptor binding is generally of low affinity. Because the adhesins and the receptors often cluster in the plane of the membrane, the resulting combinatorial avidity can be great. An analogy for adhesin–receptor binding is the interaction of the two faces of Velcro strips.'
 'In fact, the predicted binding sites for heparin in fibroblast growth factor 2 (FGF2) turned out to be incorrect once the crystal structure was determined. It is likely that binding involves multiple protein segments that juxtapose positively charged residues into a three-dimensional turn-rich recognition site. In many cases the binding involves loops which make the positioning more variable. An example of this phenomenon is observed in the chemokine CCL5, which contains a XBBXBX motif in a loop. The specific arrangement of residues should vary according to the type and fine structure of those oligosaccharides involved in binding. In lectins, and in antibodies that recognize glycans, the glycan recognition domains are typically shallow pockets that engage the terminal sugars of the oligosaccharide chain (Chapters 29, 30, and 37). In GAG-binding proteins, the protein usually binds to sugar residues that lie within the chain or near the terminus.']","This is relevant for urinary tract infections, in which type-1 fimbriae mediate binding of the bacteria to the glycoprotein uroplakin Ia on the surface of bladder epithelial cells. Uroplakin Ia presents high levels of terminally exposed mannose residues that are capable of specifically interacting with FimH. Alternatively, type-1 fimbriae can bind to high mannose glycans on the soluble urinary Tamm–Horsfall glycoprotein/uromodulin, that forms long fibers. The resulting bacterial aggregates are flushed out of the urinary tract. Mice lacking the gene encoding the Tamm–Horsfall glycoprotein are considerably more susceptible to bladder colonization by type-1-fimbriated E. coli than normal mice.","This is relevant for urinary tract infections, in which type-1 fimbriae mediate binding of the bacteria to the glycoprotein uroplakin Ia on the surface of bladder epithelial cells. Uroplakin Ia presents high levels of terminally exposed mannose residues that are capable of specifically interacting with FimH. Alternatively, type-1 fimbriae can bind to high mannose glycans on the soluble urinary Tamm–Horsfall glycoprotein/uromodulin, that forms long fibers. The resulting bacterial aggregates are flushed out of the urinary tract. Mice lacking the gene encoding the Tamm–Horsfall glycoprotein are considerably more susceptible to bladder colonization by type-1-fimbriated E. coli than normal mice.",1.0,0.4338967962669766,1.0000000000000002,0.075,0.9999999999857143,1.0
"Complete the following paragraph: In contrast to lectins, which tend to fall into evolutionarily conserved families (Chapters 28–37), GAG-binding proteins do not have common folds and instead appear to have evolved by convergent evolution. Several hundred GAG-binding proteins have been discovered, which make up the GAG-interactome and fall into the broad classes presented in Table 38.1.","['This chapter focuses on examples of glycosaminoglycan (GAG)-binding proteins, methods for measuring GAG–protein interaction, and information about three-dimensional structures of the complexes. In contrast to lectins, which tend to fall into evolutionarily conserved families (Chapters 28–37), GAG-binding proteins do not have common folds and instead appear to have evolved by convergent evolution. Several hundred GAG-binding proteins have been discovered, which make up the GAG-interactome and fall into the broad classes presented in Table 38.1. To a large extent, studies of the GAG-interactome have focused on protein interactions with heparin, a more highly sulfated, iduronic acid (IdoA)-rich form of heparan sulfate (HS; Chapter 17).'
 'They typically recognize terminal groups on glycans, which fit into shallow but well-defined binding pockets (Chapters 29 and 30). In contrast, proteins that bind to sulfated GAGs (heparan, chondroitin, dermatan, and keratan sulfates; Chapter 17) do so via clusters of positively charged amino acids that bind specific arrangements of carboxylic acid and sulfate groups along GAG chains. Most of these proteins are evolutionarily unrelated. GBPs that bind to the nonsulfated GAG hyaluronic acid (hyaladherins) share an evolutionarily conserved fold that facilitates recognition of short segments of the invariant hyaluronan repeating disaccharide (Chapter 16), so they are best classified as lectins rather than grouped with sulfated GAG-binding proteins. The rest of this chapter emphasizes lectins, different families of which are detailed in Chapters 31–37. Sulfated GAG-binding proteins are also discussed, and are detailed further in Chapter 38.'
 'The chapters that follow describe the analysis of glycan–protein interactions (Chapter 29), the physical principles involved (Chapter 30), and the structures and biological functions of important subclasses of GBPs (Chapters 31–38). GBPs (which exclude glycan-specific antibodies) are found in all living organisms and fall into two overarching groups—lectins and sulfated glycosaminoglycan (GAG)-binding proteins (compared in Online Appendix 28A). Lectins are further classified into evolutionarily related families identified by carbohydrate-recognition domains (CRDs) based on primary and/or three-dimensional structural similarities (Figure 28.1). CRDs can exist as stand-alone proteins or as domains within larger multidomain proteins. They typically recognize terminal groups on glycans, which fit into shallow but well-defined binding pockets (Chapters 29 and 30).'
 'Sulfated GAG-binding proteins are also discussed, and are detailed further in Chapter 38. Representative structures from four common animal lectin families. The emphasis is on the extracellular domain structure and topology. The following are the defined carbohydrate-binding domains (CRDs) shown: (CL) C-type lectin; (GL) galectin; (MP) P-type (more...) Lectins were discovered in plants in 1888 when extracts of castor bean seeds were found to agglutinate animal red blood cells. Subsequently, seeds of many plants were found to contain such “agglutinins,” later renamed lectins (Latin for “select”) when they were found to distinguish human ABO blood groups (Chapter 14), important for blood transfusions. Lectins are particularly common in the seeds of leguminous plants and these “L-type” lectins, including concanavalin A and phytohemagglutinin, have been extensively studied.'
 'Many other sulfated GAG-binding proteins were later discovered by affinity chromatography using columns of immobilized heparin. Growth factors and cytokines bearing clusters of positively charged amino acids along their protein surface interact with sulfated GAGs in a looser fashion—that is, they do not always show the high specificity seen with antithrombin. However, in some cases, specific GAG sequences mediate the formation of higher-order complexes, acting as a template for oligomerization or positioning of proteins such as fibroblast growth factor (FGF) and its cell-surface receptor. GBPs function in communication between cells in multicellular organisms and in interactions between microbes and hosts and can also be involved in binding growth factors, chemokines and cytokines. These interactions can take various forms, resulting in movement of molecules, cells, and information. Directing movement of glycoproteins within and between cells is a common function for lectins in many organisms.'
 'The pattern of evolution of animal-specific lectins varies. Galectins seem to be similar in organization in vertebrates and invertebrates, and it may be possible to identify orthologs in quite diverse species (Chapter 36). In contrast, C-type CRDs have undergone independent radiation in vertebrates and invertebrates, and identifying orthologs even between mouse and human proteins in some cases is difficult (Chapter 34). Of the 12 different protein folds found in plant lectins, six appear to be unique to plants. It is also noteworthy that viruses seem to have developed their own approaches to binding glycans rather than borrowing from hosts (Chapter 37). In addition to families of proteins that share evolutionarily related CRDs, there are individual proteins that bind glycans through domains that are not related to CRDs in other proteins.'
 'In GAG-binding proteins, the protein usually binds to sugar residues that lie within the chain or near the terminus. Therefore, the binding sites in GAG-binding proteins consist of clefts or sets of juxtaposed surface residues rather than pockets. These GAG-binding sites on the protein surface give rise to more rapid GAG–protein binding kinetics than are typically observed for protein–protein interactions. Given that GAG chains generally exist in a helical conformation, only those residues on the face toward the protein interact with amino acid residues; the ones on the other side of the helix are potentially free to interact with a second ligand (e.g., as observed in FGF dimers). Alternatively, residues in a binding cleft could interact with both sides of the helix (e.g., in dengue envelope protein). Finally, one should keep in mind that binding occurs to only a small segment of the GAG chain.']","GAG-binding proteins do not have common folds like lectins, and instead, they seem to have evolved through convergent evolution. There have been hundreds of GAG-binding proteins identified, collectively forming the GAG-interactome and categorized into various classes as outlined in Table 38.1.","To a large extent, studies of the GAG-interactome have focused on protein interactions with heparin, a more highly sulfated, iduronic acid (IdoA)-rich form of heparan sulfate (HS; Chapter 17). This bias reflects, in part, the commercial availability of heparin and heparin-Sepharose, which are frequently used for fractionation studies, and the partially incorrect assumption that binding to heparin mimics binding to HS present on cell surfaces and in the extracellular matrix. There are also a large number of proteins known to interact with chondroitin sulfate (CS) and dermatan sulfate (DS) with comparable avidity and affinity; there are fewer examples of specific interactions with keratan sulfate (KS), but this may reflect fewer studies of KS. In some cases, CS may be the physiologically relevant ligand because CS predominates in many tissues. Determining the physiological relevance of these interactions is a major area of research.",1.0,0.7773680161578436,0.5918961332747426,0.02564102564102564,0.8734126983981415,0.2
"Complete the following paragraph: NGLY1 recognizes only misfolded or denatured glycoproteins. The enzyme is bound to the proteasome by subunits S4 and HR23B as a complex with Cdc48, a component of ERAD complexes. Degradation of the released N-glycan occurs in two stages.","['NGLY1 recognizes only misfolded or denatured glycoproteins. The enzyme is bound to the proteasome by subunits S4 and HR23B as a complex with Cdc48, a component of ERAD complexes. Degradation of the released N-glycan occurs in two stages. First, cleavage occurs between the two GlcNAcs (chitobiose) in the core of the N-glycan via a cytoplasmic endo-β-N-acetylglucosaminidase. A cytoplasmic α-mannosidase cleaves up to four Man residues to generate Man5GlcNAc (Man c, d, e, f, and g in Figure 39.1). This glycan is then taken into the lysosome via an ATP-dependent lysosomal membrane transporter for final degradation to monosaccharides. Whether these free glycans have any function in the cytosolic/nuclear compartment before they are degraded has not been investigated.'
 'Finally, proteins common to both complexes such as yeast Cdc48 (p97 in mammals) are responsible for membrane extraction of misfolded proteins in an ATP-dependent manner. Although the pore by which ERAD-L substrates are actually transported to the cytosol has not been identified, it is known that the substrates must be unfolded in the ER lumen. Although studies on ERAD complexes have been mainly performed in S. cerevisiae, mammalian cells have homologs of nearly all proteins described in the yeast complexes. N-Glycans are removed from unfolded glycoproteins during proteasomal degradation. A cytoplasmic peptide:N-glycanase (PNGase, N-glycanase, NGLY1) plays an important role in both removing the glycan and constructing an efficient predegradation complex (Figure 39.3). NGLY1 recognizes only misfolded or denatured glycoproteins.'
 'A sizable fraction of nascent proteins fail quality control of folding and assembly in the rER (Chapter 39) and are retrotranslocated to the cytoplasm as a part of ERAD (ER-associated degradation), as depicted in Figure 18.1H. Most of these are N-glycosylated and normally processed by a cytoplasmic N-glycanase (NGLY1) or an endo-β-N-acetylglucosaminidase (ENGase) to remove their N-glycans before their degradation by the 26S-proteasome or an autophagic vacuole. There are also N-glycan-dependent E3 ubiquitin ligases that assemble polyubiquitin chains that serve as a signal for proteasomal degradation. Interestingly, NGLY1 is essential for mitochondrial turnover via mitophagy, although evidence suggests it functions via a role other than deglycosylating mitochondrial proteins.'
 'ER membrane proteins with folding defects in the cytosolic domain are extracted from the ER membrane by the Doa10 complex via ERAD-C, whereas those in which the folding defect is present in the luminal (ERAD-L) or membrane (ERAD-M) domains use the Hrd1 complex. Both Doa10p and Hrd1p are integral membrane proteins with E3 ligase activity in their cytosolic portion. Other proteins in these complexes include chaperones, proteins with E2 ubiquitin-conjugating activity or proteins that recognize misfolded proteins. For instance, glycoproteins with N-glycans containing a terminal α1–6Man are bound by Yos9p and undergo ERAD only if the N-glycans are in unstructured protein, a feature recognized by Hrd3p in the Hrd1 complex. Finally, proteins common to both complexes such as yeast Cdc48 (p97 in mammals) are responsible for membrane extraction of misfolded proteins in an ATP-dependent manner.'
 'These specialized chaperones require Ca++ for activity and bind to monoglucosylated forms of N-glycans, thus retaining the protein in the ER until proper folding occurs. The ER also contains three enzymes central to the process: α-glucosidases I and II (GI and GII), which trim glucose (Glc) from the Glc3Man9GlcNAc2 initially transferred to the protein and release the glycoprotein from CNX/CRT. The enzyme UDP-glucose glycoprotein glucosyltransferase (UGGT) reglucosylates the N-glycan if proper folding has not occurred. Glycoproteins that fail to fold, or to oligomerize properly, are marked with specific truncated N-glycans, and eventually retrotranslocated into the cytoplasm in which they are destroyed by N-deglycosylation and proteasomal degradation, a process called ER-associated degradation (ERAD). There are several ERAD pathways, which are described in the following sections.'
 'How are terminally misfolded glycoproteins driven to the proteasome for degradation? The key discriminating factor appears to be the structure of the truncated N-glycans that result from the relatively long stay of a misfolded glycoprotein in the ER lumen. Mammalian cells have, in addition to Man1B1, three additional homologs called EDEMs (ER degradation-enhancing α-mannosidase-like) proteins, which initially were thought to be devoid of activity. However, when either Man1B1 or the EDEMs were individually knocked out in human or chicken cells, conversion of M9 to M8B (Figure 39.2) was mainly performed by EDEM2, and the contribution of Man1B1 to that particular demannosylation step was minimal. On the other hand, conversion of M8B to M7 lacking residues i and k (M7BC; Figure 39.1) was performed by EDEMs 1 and 3.'
 'On the contrary, complexes formed with high-affinity peptides are poor UGGT substrates and are able to be presented on the cell surface. Many congenital diseases such as lysosomal storage diseases also result in the accumulation of misfolded glycoproteins in the ER, thus overloading the folding machinery. An estimated 20%–30% of normal proteins misfold, so it is not surprising that small differences in the kinetics of conformational maturation and degradation can tip the balance to ERAD for lack of sufficient chaperones and other factors that facilitate folding. Although most glycoproteins transiently associate with CNX/CRT during their maturation in the ER in vivo, other ER folding and quality-control mechanisms do the job quite efficiently in cultured cells. However, viral glycoproteins such as vesicular stomatitis virus G protein, HIV glycoprotein gp120, and M protein from hepatitis B virus, absolutely require CNX/CRT for proper folding and exit from the ER.']","First, cleavage occurs between the two GlcNAcs (chitobiose) in the core of the N-glycan via a cytoplasmic endo-β-N-acetylglucosaminidase. A cytoplasmic α-mannosidase cleaves up to four Man residues to generate Man5GlcNAc. This glycan is then taken into the lysosome via an ATP-dependent lysosomal membrane transporter for final degradation to monosaccharides.","First, cleavage occurs between the two GlcNAcs (chitobiose) in the core of the N-glycan via a cytoplasmic endo-β-N-acetylglucosaminidase. A cytoplasmic α-mannosidase cleaves up to four Man residues to generate Man5GlcNAc (Man c, d, e, f, and g in Figure 39.1). This glycan is then taken into the lysosome via an ATP-dependent lysosomal membrane transporter for final degradation to monosaccharides. Whether these free glycans have any function in the cytosolic/nuclear compartment before they are degraded has not been investigated.",1.0,0.6003081150886511,0.9577557753118373,0.02702702702702703,0.817857142843512,1.0
"Complete the following paragraph: The ER-localized carboxyl terminus of TREX1 has been proposed to interact with, and stabilize, the catalytic activity of the ER oligosaccharyltransferase (OST) complex and thereby suppress immune activation.","['The presence of abnormal glycans or the accumulation of glycans in the wrong place may negatively impact signaling pathways in animal cells. Three prime repair exonuclease 1 (TREX1) is an ER-associated negative regulator of innate immunity. Mutations that affect TREX1 function are associated with numerous autoimmune and autoinflammatory diseases (Chapter 45). The ER-localized carboxyl terminus of TREX1 has been proposed to interact with, and stabilize, the catalytic activity of the ER oligosaccharyltransferase (OST) complex and thereby suppress immune activation. The OST complex becomes dysfunctional in the presence of carboxy-terminal truncated TREX1. This leads to the release of free glycans from dolichol-linked oligosaccharides, which has been hypothesized to lead to the activation of genes with immune system-related functions and the production of autoantibodies.'
 'Thus, TREX1 may safeguard the cell against free glycan buildup in the ER and thereby prevent glycan and glycosylation defects that can lead to immune disorders. N-linked glycans have a role in the correct folding of glycoproteins in the ER. Misfolded glycoproteins are targeted for degradation by an ER-associated degradation (ERAD) process in which they are retrotranslocated into the cytosol (Chapter 39). The glycans are then released from the glycoprotein by the N-glycanase NGLY1. The protein is degraded by the proteasome, whereas the released glycans are likely partially de-mannosylated in the cytosol and then transported to the lysosomes by an as yet unidentified oligosaccharide transporter. It is not known if these free glycans have any signaling functions in the cytosolic/nuclear compartment. In the lysosome, glycosidases hydrolyze the glycans into monomeric sugars that can then be reused by the cell.'
 'For instance, the most common mutation in cystic fibrosis patients, CFTR-ΔF508, leads to improper folding of this chloride channel and its retention in the ER. Importantly, the mutation affects CFTR transit to the plasma membrane but not its transport activity. Similarly, UGGT recognition of a brassinosteroid receptor mutant triggers retention in the ER of Arabidopsis thaliana cells. Thus, certain diseases caused by ER retention of defective glycoproteins might be ameliorated by inhibitors of UGGT activity. One beautiful example of how the fine sensitivity of UGGT allows modulation of basic physiological processes is its role during antigen presentation by the major histocompatibility complex I (MHC I). Here, MHC I complexes loaded with suboptimal peptides are recognized by UGGT, thus triggering their retention in the ER. On the contrary, complexes formed with high-affinity peptides are poor UGGT substrates and are able to be presented on the cell surface.'
 'UGGT also glucosylates incompletely assembled multimeric complexes of fully mature monomers because it recognizes hydrophobic surfaces exposed in the absence of the appropriate subunits. UGGT is a relatively large, soluble, ER protein (150- to 170-kDa) that uses UDP-Glc as sugar donor and requires millimolar Ca++ concentrations, typically found within the ER lumen. UGGT has at least two domains. The amino-terminal one, comprising ∼80% of the molecule, recognizes abnormal protein conformers. This domain contains three tandemly repeated, thioredoxin-like domains that are frequently found in ER proteins involved in protein folding and quality-control processes. A crystal structure of the third domain showed that it contains a large hydrophobic patch hidden by a flexible carboxy-terminal helix. The carboxy-terminal domain has homology with other glycosyltransferases and is responsible for the catalytic activity.'
 'Like POFUT1, POFUT2 is an ER-localized enzyme that only fucosylates properly folded TSRs. POFUT2 and B3GLCT appear to function in a novel ER quality control pathway required for proper folding of TSRs. In thrombospondin-1, the region of the TSR modified with O-fucose mediates interactions between TSRs and several cell-surface receptors. Thus, the presence of O-fucose in this region could influence interactions between TSRs and adjacent cells, much as O-fucose on EGF repeats regulates Notch ligand binding. TSRs allow proteins like the thrombospondins to bind to cells and/or to other components in the ECM, an essential step in the antiangiogenic functions of these proteins. Modifications of thrombospondin type-1 repeats (TSRs). These repeats have six conserved Cys (yellow), three disulfide bonds (gray lines), and consensus sites for O-fucose (red) and C-mannose (pink) addition.'
 'TSRs are also often frequently modified with C-mannose (Figure 13.4), although the relationship between the two modifications is not yet clear. A number of biologically interesting proteins are known or predicted to contain this modification, including thrombospondin-1 and -2, all ADAMTS (a disintegrin and metalloproteinase with thrombospondin motifs; ADAMTS 1–20) and ADAMTS-like proteins, properdin, and F-spondin (Table 13.1). O-Fucosylation of TSRs in several proteins including ADAMTS 13 and ADAMTS-like 1 is needed for their secretion, suggesting that O-fucosylation of TSRs may be involved in quality control or folding, similar to the predicted role of O-fucose on EGF repeats in Drosophila. Like POFUT1, POFUT2 is an ER-localized enzyme that only fucosylates properly folded TSRs.'
 'The observation that reglycosylation of misfolded glycoproteins occurs in the ER (Chapter 39) explains the need for an ER UDP-Glc transporter. Under stressful conditions, synthesis of lumenal uridine diphosphatase increases to accommodate increased transport of UDP-Glc needed for reglycosylation of misfolded glycoproteins. The existence of UDP-GlcNAc, UDP-GalNAc, and UDP-Xyl transporters in the ER may mean that some reactions thought to occur exclusively in the Golgi may also occur in the ER. A good example is the synthesis of O-fucosylated proteins, such as Notch, in the ER versus fucosylation of N- and O-linked chains in the Golgi (Chapter 13). Other, as-yet-undiscovered, glycosylation reactions may also occur in the ER.']","This interaction between the ER-localized carboxyl terminus of TREX1 and the ER oligosaccharyltransferase (OST) complex is suggested to play a role in stabilizing the catalytic activity of the OST complex, ultimately leading to the suppression of immune activation.","The OST complex becomes dysfunctional in the presence of carboxy-terminal truncated TREX1. This leads to the release of free glycans from dolichol-linked oligosaccharides, which has been hypothesized to lead to the activation of genes with immune system-related functions and the production of autoantibodies. Thus, TREX1 may safeguard the cell against free glycan buildup in the ER and thereby prevent glycan and glycosylation defects that can lead to immune disorders. N-linked glycans have a role in the correct folding of glycoproteins in the ER. Misfolded glycoproteins are targeted for degradation by an ER-associated degradation (ERAD) process in which they are retrotranslocated into the cytosol (Chapter 39). The glycans are then released from the glycoprotein by the N-glycanase NGLY1. The protein is degraded by the proteasome, whereas the released glycans are likely partially de-mannosylated in the cytosol and then transported to the lysosomes by an as yet unidentified oligosaccharide transporter. It is not known if these free glycans have any signaling functions in the cytosolic/nuclear compartment.",1.0,0.8577063628396191,0.7775093857817709,0.023255813953488372,0.9484126983968916,0.625
"Complete the following paragraph: In animals with internal fertilization, glycan-dependent recognition events occur during sperm interactions with reproductive tract mucins, in sperm–fallopian tube interactions, in sperm–ova binding within the fallopian tubes, and during implantation of the early embryo. Glycosylation-deficient male mice are sometimes infertile or subfertile. Following birth, mammals produce milk containing an array of glycoproteins and a complex mixture of species-specific milk oligosaccharides (Chapter 14).","['Given the breadth of physiologic functions of glycans, the individual sections highlight just a few representative examples, and listings are necessarily incomplete. Glycans and glycan-binding proteins are important for both male and female reproduction. Studies in fish, frogs, and mammals indicate that glycans are involved in multiple steps in the process of fertilization (Chapter 27). In animals with internal fertilization, glycan-dependent recognition events occur during sperm interactions with reproductive tract mucins, in sperm–fallopian tube interactions, in sperm–ova binding within the fallopian tubes, and during implantation of the early embryo. Glycosylation-deficient male mice are sometimes infertile or subfertile. Following birth, mammals produce milk containing an array of glycoproteins and a complex mixture of species-specific milk oligosaccharides (Chapter 14).'
 'Following birth, mammals produce milk containing an array of glycoproteins and a complex mixture of species-specific milk oligosaccharides (Chapter 14). Genetic modifications that eliminate initial steps of major glycan synthetic pathways and of some monosaccharide biosynthetic pathways generally result in embryonic lethality, with one exception being deletion of individual genes needed for initiation of mucin O-GalNAc pathway, likely because of functional redundancy among the 20 different polypeptide:O-GalNAc transferases (Chapter 10). The causes of these lethal outcomes usually cannot be linked to specific glycoconjugates, but sometimes can be ascribed to a single mechanism such as the disruption of protein O-fucosylation, which impacts global Notch receptor signaling (Chapter 13). Conversely, loss of terminal glycan modifications are usually not embryonic-lethal, instead they have specific defects in some cell types.'
 'It is also associated with transient aplastic crisis in patients with hemolytic anemia and with cases of pure erythrocyte aplasia and chronic anemia in immunocompromised individuals. Parvovirus B19 replication is restricted to erythroid progenitor cells owing to an interaction between the virion and glycolipids with P antigen. Mammals make a series of oligosaccharides with a core of lactose (Galβ1-4Glc) and secrete them into the milk. Human milk comprises many hundreds of different glycans with small amounts of glycans containing more than 15 sugars. The distribution of structures and amount of each oligosaccharide vary between individuals and during the lactation cycle. There is a relatively high concentration of complex, sialylated, and fucosylated oligosaccharides in milk, and these glycans appear to protect infants against enteric pathogens.'
 'The number of fucoses per repeat, the linkage, and sulfation patterns all help ensure species selectivity for induction of the acrosome reaction. About 20% of the egg jelly mass is a large glycoprotein containing a unique polymer of sialic acid (Sia), which can be released from crude sea urchin egg jelly by treatment with mild base (β-elimination). The sialoglycan has a novel structure—[Neu5Gcα2-5-O-glycolylNeu5Gc]n. However, its receptor on the sperm membrane is unknown. When sea urchin sperm undergo the acrosome reaction, a protein named bindin is released from the acrosomal vesicle. Bindin cements the sperm to a large egg surface glycoprotein named egg bindin receptor 1 (EBR1).'
 ""(Reprinted, with permission, courtesy of M. Tegner (more...) Sea urchin eggs are covered by a hydrated jelly coat. About 80% of the weight of egg jelly is a high-molecular-weight linear fucose (Fuc) sulfate polymer (FSP) with a molecular mass of >106 Da. Receptor proteins on sperm bind to FSP, triggering the opening of two pharmacologically distinct calcium channels that induce the exocytosis of the sperm's acrosome vesicle (the “acrosome reaction”). The ionic mechanisms that trigger the acrosome reaction are conserved in mammals, but the nature of the sperm surface receptors varies. FSP is a species-selective inducer of the sea urchin sperm acrosomal reaction and most FSPs are sulfated α1-3Fuc-based linear polymers made of tri- or tetrasaccharide repeats.""
 'This may give some indication of the extent to which branching plays a role in recognition processes. Unique among mammals are free oligosaccharides present in milk. Human milk oligosaccharides (HMOs) are highly abundant in breast milk. Unlike most glycans that are conjugated to either proteins or lipids, HMOs are unconjugated in their native states. Thus, they contain a reactive aldehyde on the reducing end. HMOs decrease during lactation but are often even more abundant than proteins. Although the precise details of their synthesis are still not well known, HMO structures are more similar to glycans on glycolipids and O-glycans on proteins. The structures are based on a lactose core (Galβ1-4Glc) and extend either in branched or linear forms. Extensions are composed primarily of glucose, galactose, N-acetylglucosamine, fucose, and sialic acids.'
 'Human milk contains ∼70 g/L of lactose and 5–10 g/L of free oligosaccharides. More than 130 different glycan species have been identified with lactose at the reducing end, including poly-N-acetyllactosamine units. Some glycans are α2-3- and/or α2-6-sialylated and/or fucosylated in α1-2, α1-3, and/or α1-4 linkages. In contrast, bovine milk, the typical mainstay in human infant formulas, contains much smaller amounts of fucose oligosaccharides. These differences may account for some of the physiological advantages seen for breastfed versus formula-fed infants. The glycans may also favor growth of a nonpathogenic bifidogenic microflora and/or block pathogen adhesion that causes infections and diarrhea.']","Genetic modifications that eliminate initial steps of major glycan synthetic pathways and of some monosaccharide biosynthetic pathways generally result in embryonic lethality, with one exception being deletion of individual genes needed for initiation of mucin O-GalNAc pathway, likely because of functional redundancy among the 20 different polypeptide:O-GalNAc transferases. The causes of these lethal outcomes usually cannot be linked to specific glycoconjugates, but sometimes can be ascribed to a single mechanism such as the disruption of protein O-fucosylation, which impacts global Notch receptor signaling. Conversely, loss of terminal glycan modifications are usually not embryonic-lethal, instead they have specific defects in some cell types.","Genetic modifications that eliminate initial steps of major glycan synthetic pathways and of some monosaccharide biosynthetic pathways generally result in embryonic lethality, with one exception being deletion of individual genes needed for initiation of mucin O-GalNAc pathway, likely because of functional redundancy among the 20 different polypeptide:O-GalNAc transferases (Chapter 10). The causes of these lethal outcomes usually cannot be linked to specific glycoconjugates, but sometimes can be ascribed to a single mechanism such as the disruption of protein O-fucosylation, which impacts global Notch receptor signaling (Chapter 13). Conversely, loss of terminal glycan modifications are usually not embryonic-lethal, instead they have specific defects in some cell types.",1.0,0.4729182764881665,0.9951163553255713,0.023255813953488372,0.9999999999833333,1.0
"Complete the following paragraph: Certain strains of E. coli express pili that bind avidly to P-blood group–related glycosphingolipids in the bladder epithelium, leading to urinary tract infection. Pathogenic strains of Salmonella produce pili that facilitate adherence to human intestinal cell mucosa, thereby causing food poisoning and infectious diarrhea. In other cases, a surface-anchored protein (afimbrial adhesin) expressed by the bacteria represents a critical colonization factor (Figure 42.3B).","['respiratory tract vs. gastrointestinal tract) is determined by specific combinations of adhesin–receptor pairs. Pili or fimbriae are assemblies of protein subunits that project from the bacterial surface in hair-like threads whose tips often adhere to host glycans (Figure 42.3A). Such pili are usually composed of a repeating structural subunit providing extension and a different “tip adhesin” responsible for binding. The structural proteins for pilus assembly are often encoded in a bacterial operon. Lateral mobility of pili structures in the bacterial membrane provides a Velcro-like binding effect to epithelial surfaces. Certain strains of E. coli express pili that bind avidly to P-blood group–related glycosphingolipids in the bladder epithelium, leading to urinary tract infection. Pathogenic strains of Salmonella produce pili that facilitate adherence to human intestinal cell mucosa, thereby causing food poisoning and infectious diarrhea.'
 'Pathogenic strains of Salmonella produce pili that facilitate adherence to human intestinal cell mucosa, thereby causing food poisoning and infectious diarrhea. In other cases, a surface-anchored protein (afimbrial adhesin) expressed by the bacteria represents a critical colonization factor (Figure 42.3B). For example, the filamentous hemagglutinin (FHA) of Bordetella pertussis promotes strong attachment of the bacteria to the ciliated epithelial cells of the bronchi and trachea, triggering local inflammation and tissue injury that results in the “whooping cough” disease. FHA is a component of modern pertussis vaccines given in infancy and early childhood to block infection. Examples of mechanisms of bacterial adherence to host cell surfaces. (A) Pili or fimbriae are organelles that project from the cell surface. They are made up of a repeating structural subunit and a protein at their tip that mediates recognition of a specific (more...) Adhesins can be glycoproteins as well.'
 'The P1 determinant is expressed on the urothelium and probably facilitates infection by mediating attachment of bacteria. P1 individuals have a higher relative risk for urinary tract infections and pyelonephritis. The adhesion of a pyelonephritic strain of E. coli to renal tissue is mediated by a bacterial adhesin specific for the Galα1-4Gal epitope, and deficiency of the adhesin severely attenuates the pyelonephritic activity of the organism. The P blood group antigens may also have a role as receptors for human parvovirus B19. This virus causes erythema infectiosum and leads to congenital anemia and hydrops fetalis following infection in utero. It is also associated with transient aplastic crisis in patients with hemolytic anemia and with cases of pure erythrocyte aplasia and chronic anemia in immunocompromised individuals.'
 'An analogy for adhesin–receptor binding is the interaction of the two faces of Velcro strips. The most well-characterized bacterial lectins include the mannose-specific type-1 fimbriae, the galabiose-specific P fimbriae, and the N-acetylglucosamine-binding F-17 fimbriae, which are produced by different strains of Escherichia coli. Fimbriated bacteria express 100 to 400 of these appendages, which typically have a diameter of 5–7 nm and can extend hundreds of nanometers in length (Figure 37.3) Thus, pili extend well beyond the bacterial glycocalyx comprised of lipopolysaccharide and capsular polysaccharides (see Chapter 21). Escherichia coli express hundreds of pili, as indicated by the fine filaments extending from the bacterium. (Reprinted, with permission of Elsevier, from Sharon N. 2006.'
 'Samonella Typhi causes typhoid fever in humans, a process that begins with intracellular invasion of intestinal epithelial cells. The outer core oligosaccharide structure of the LPS is required for internalization into epithelial cells. Removal of a key terminal sugar residue on the outer core markedly reduces the efficiency of bacterial uptake. Once invasion has occurred, the secreted A2B5 typhoid toxin mediates illness by first binding preferentially to the sialic acid Neu5Ac, which is enriched in humans. Streptococcus pyogenes (GAS), the cause of strep throat, as well as serious invasive infections, attaches to human pharyngeal and skin epithelial cells via interaction of its hyaluronan capsular polysaccharide with the host hyaluronan-binding protein CD44 (Chapter 16). This binding induces marked cytoskeletal rearrangements manifested by membrane ruffling and opening of intercellular junctions that allow tissue penetration by GAS through a paracellular route.'
 '(Redrawn, with permission, from Merritt EA, et al. 1994. Protein Sci 3: 166–175.) (C) Crystal structure of the (more...) Examples of glycan receptors for bacterial toxins  Shiga toxin, produced by Shigella dysenteriae, will bind to Galα1-4Gal determinants on both glycolipids and glycoproteins. However, only binding to the glycosphingolipid receptor Gb3 results in cell death. Similar to cholera toxin, the AB5 complex is endocytosed and transported to the ER of the target cells, and then the A1 subunit is retrotranslocated to the cytosol. There, the catalytic A1 chain of Shiga toxin inactivates ribosomes, and thus the essential process of cytoplasmic protein synthesis, by an N-glycosidic cleavage event that depurinates 28S rRNA.'
 ""FimH prefers to bind D-mannose in the (more...) Most bacteria (and possibly other microorganisms) have multiple adhesins with diverse carbohydrate specificities. Many of these have been described (examples in Table 37.2), wherein the specificity of lectin binding can help define the range of susceptible tissues in the host (i.e., the microbe's ecological niche). The columnar epithelium that lines the large intestine expresses receptors with Galα1–4Gal-Cer residues, whereas cells lining the small intestine do not. Thus, Bacterioides, Clostridium, E. coli, and Lactobacillus only colonize the large intestine under normal conditions. P-fimbriated E. coli and some toxins bind specifically to galabiose (Galα1–4Gal) and galabiose-containing oligosaccharides, most commonly as constituents of glycolipids.""]","The surface-anchored protein (afimbrial adhesin) expressed by the bacteria represents a critical colonization factor. For example, the filamentous hemagglutinin (FHA) of Bordetella pertussis promotes strong attachment of the bacteria to the ciliated epithelial cells of the bronchi and trachea, triggering local inflammation and tissue injury that results in the “whooping cough” disease. FHA is a component of modern pertussis vaccines given in infancy and early childhood to block infection.","For example, the filamentous hemagglutinin (FHA) of Bordetella pertussis promotes strong attachment of the bacteria to the ciliated epithelial cells of the bronchi and trachea, triggering local inflammation and tissue injury that results in the “whooping cough” disease. FHA is a component of modern pertussis vaccines given in infancy and early childhood to block infection. Examples of mechanisms of bacterial adherence to host cell surfaces. (A) Pili or fimbriae are organelles that project from the cell surface. They are made up of a repeating structural subunit and a protein at their tip that mediates recognition of a specific (more...) Adhesins can be glycoproteins as well. In Pasteurellaceae and some H. influenzae strains adhesins are N-glucosylated by a cytoplasmic N-glucosylation system that is homologous to the cytoplasmic O-GlcNAc transferase of eukaryotes. Similarly, transfer of heptose residues by the dodecameric bacterial autotransporter heptosyltransferase (BAHT) family of enzymes to autotransporter adhesins in several different Gram-negative pathogens is essential for the adhesion process.",1.0,0.4978607169819379,0.8737282240785462,0.05,0.49999999995,1.0
"Complete the following paragraph: African trypanosomes (Trypanosoma brucei) transmitted by blood-sucking tsetse flies are the etiologic agents of nagana disease in cattle and sleeping sickness in humans. A remarkable feature of these organisms is their ability to survive extracellularly in the host bloodstream, where they are constantly exposed to the immune system. Evasion of the host immune response depends on “antigenic variation,” a highly evolved survival strategy that relies on structural variance of GPI-anchored glycoproteins (VSGs) on the trypanosome surface (Figure 43.2).","['A remarkable feature of these organisms is their ability to survive extracellularly in the host bloodstream, where they are constantly exposed to the immune system. Evasion of the host immune response depends on “antigenic variation,” a highly evolved survival strategy that relies on structural variance of GPI-anchored glycoproteins (VSGs) on the trypanosome surface (Figure 43.2). VSGs are dimeric proteins, consisting of two 55-kDa monomers that each carry N-linked oligomannose-type glycans, which make up a large component of the dense glycocalyx. As parasites multiply in the host bloodstream, the host mounts an immune response that is effective against only the population of trypanosomes expressing a particular VSG. Trypanosomes that have switched to an alternative VSG coat (encoded among 1000 distinct VSG genes) escape immunological destruction. Schematic representation of the major surface glycoconjugates of procyclic and metacyclic Trypanosoma brucei.'
 'Antibodies to these GPIs can neutralize their effects and mitigate the pathology of the disease independently of direct infection. In addition, the P. falciparum genome encodes a number of enzymes involved in N-glycosylation and O-glycosylation (O-fucosylation) and C-mannosylation. Whereas N-glycans are truncated and typically contain only a chitobiosyl core, GlcNAcβ1-4GlcNAcβ-Asn, mannose is abundantly present in GPI anchors. There is also evidence suggesting that Plasmodia may express a number of unusual glycoconjugates, such as galactose- and glucose-containing glycoproteins and glucose-containing glycolipids. African trypanosomes (Trypanosoma brucei) transmitted by blood-sucking tsetse flies are the etiologic agents of nagana disease in cattle and sleeping sickness in humans.'
 'Schematic representation of the major surface glycoconjugates of procyclic and metacyclic Trypanosoma brucei. VSG (variant surface glycoprotein) is the major component of the metacyclic form, and each molecule consists of two GPI-anchored N-glycosylated (more...) Within the gut of the tsetse fly, the trypanosome replaces its entire VSG coat with acidic glycoproteins called procyclins (Figure 43.2). These GPI-anchored proteins form a dense glycocalyx and are composed of polyanionic polypeptide repeat domains projecting from the membrane. Unusual features are the presence of a single type of N-glycan (Man5GlcNAc2) and GPI anchors that are modified with branched poly-N-acetyllactosamine [Galβ1-4GlcNAc]n glycans.'
 'The terminal β-galactose can be substituted with α2-3-linked sialic acid by a parasitic trans-sialidase that transfers sialic acid from host glycoconjugates to the parasite surface. This sialylation protects the parasite in the insect intestine and can compromise the human immune system. Among parasites, genes encoding trans-sialidases have only been found in the protozoan genus Trypanosoma and occur in both T. brucei and Trypanosoma cruzi. Interestingly, there is also evidence for trans-sialidase activities in some bacteria and in human serum, but these are far less well studied. T. cruzi, transmitted by reduviid bugs, is the etiologic agent of Chagas disease, or South American trypanosomiasis.'
 ""The parasite expresses the VAR2CSA protein, which mediates adherence of the infected erythrocytes to placental chondroitin sulfate A (CSA) with very high specificity and affinity (Kd∼15 nm), promoting parasite infection and invasion. Eruption of the merozoites from infected erythrocytes releases free glycosylphosphatidylinositols (GPIs), which are prominent virulence factors contributing to malaria pathogenesis (Chapter 12). P. falciparum GPIs mimic host GPIs and activate host GPI-associated signaling pathways. The GPIs can activate host's macrophages, mainly through Toll-like receptor-2 signaling, leading to the production of inflammatory cytokines and up-regulation of cell-adhesion molecules, such as E-selectin in endothelial cells. Antibodies to these GPIs can neutralize their effects and mitigate the pathology of the disease independently of direct infection.""
 'T. cruzi, transmitted by reduviid bugs, is the etiologic agent of Chagas disease, or South American trypanosomiasis. T. cruzi has a dense coat of glycosylinositolphospholipids (GIPLs) (Chapter 12) and mucins (Chapter 10) that project above the GIPL layer (Figure 43.3). The GIPLs contain the same basic structure as other GPI anchors, except that they are heavily substituted with Gal, GlcNAc, and host-derived sialic acid. The mucins contain large amounts of O-glycans composed of a serine- or threonine-linked αGlcNAc extended with one to five Gal residues (including Galf) that can be substituted with sialic acid by a trans-sialidase. For T. cruzi sialylation is believed to reduce the susceptibility of the parasite to anti-α-Gal antibodies that are normally present in the mammalian bloodstream.'
 'For T. cruzi sialylation is believed to reduce the susceptibility of the parasite to anti-α-Gal antibodies that are normally present in the mammalian bloodstream. Schematic representation of the major surface glycoconjugates of Trypanosoma cruzi. The cell surface of T. cruzi is covered with a dense layer of mucins, with extensive O-glycosylation, glycosylinositolphospholipids (GIPLs), and lipopeptidophosphoglycan (more...) T. cruzi also express lipopeptidophosphoglycan (LPPG), the major surface glycan of the insect stage of the parasite (Figure 43.3).']","As parasites multiply in the host bloodstream, the host mounts an immune response that is effective against only the population of trypanosomes expressing a particular VSG. Trypanosomes that have switched to an alternative VSG coat (encoded among 1000 distinct VSG genes) escape immunological destruction.","VSGs are dimeric proteins, consisting of two 55-kDa monomers that each carry N-linked oligomannose-type glycans, which make up a large component of the dense glycocalyx. As parasites multiply in the host bloodstream, the host mounts an immune response that is effective against only the population of trypanosomes expressing a particular VSG. Trypanosomes that have switched to an alternative VSG coat (encoded among 1000 distinct VSG genes) escape immunological destruction.",1.0,0.6208292514681972,0.8124160402479208,0.06060606060606061,0.9999999999833333,1.0
"Complete the following paragraph: The internal surface of the lysosomal membrane has a thick, degradation-resistant glycocalyx of integral and peripheral membrane proteins decorated with poly-N-acetyllactosamines, which protect the lysosomal membrane against destruction. However, these proteins would also shield incoming membranes from degradation if vesicle fusion simply occurred.","['How do “vesicles within vesicles” form and what is their function? The internal surface of the lysosomal membrane has a thick, degradation-resistant glycocalyx of integral and peripheral membrane proteins decorated with poly-N-acetyllactosamines, which protect the lysosomal membrane against destruction. However, these proteins would also shield incoming membranes from degradation if vesicle fusion simply occurred. By creating multiple internal membranes seen in typical MVBs, the target molecules are exposed to the soluble lysosomal enzymes, and digestion proceeds efficiently on the membrane surfaces of these internal vesicles. MVB formation starts with inward budding of the limiting endosomal membrane. Lipids and proteins are sorted to either the internal or the limiting membrane. Ubiquitination of cargo proteins targets them to internal vesicles of MVBs, but ubiquitin-independent routes also exist. Intra-endosomal membranes and limiting endosomal membrane have different lipid and protein compositions. Membrane segregation and lipid sorting prepare the internal membranes for lysosomal degradation.'
 'Intra-endosomal membranes and limiting endosomal membrane have different lipid and protein compositions. Membrane segregation and lipid sorting prepare the internal membranes for lysosomal degradation. During maturation of the internal membranes, cholesterol is continually stripped away (to <1%) and a negatively charged lipid bis(monoacylglycero)phosphate (BMP) increases up to 45%. This molecule is highly resistant to phospholipases. BMP also stimulates sphingolipid degradation on the inner membranes of acidic compartments. Because BMP is not present in the lysosomal outer membrane, the unique lipid profile ensures that degradation by hydrolases and membrane-disrupting SAPs occurs without digesting the lysosomal outer membrane. Degradation of glycans is not always complete. Partially degraded or incomplete glycans on glycoproteins, glycopeptides, and glycosphingolipids can be internalized within a functional Golgi compartment containing sugar nucleotides and glycosyltransferases and then elongated.'
 'In fact, as few as two lysines in the correct orientation to each other and to an N-glycan can serve as minimal elements of the recognition domain. However, additional amino acid residues enhance the interaction with GlcNAc-P-T. In some instances (e.g., cathepsin D), the enzyme may contain a very extended determinant, or perhaps, more than one recognition domain. The GlcNAc phosphodiester glycosidase that catalyzes the exposure of the M6P recognition marker is found primarily in the trans-Golgi network (TGN), and it cycles between this compartment and the plasma membrane. Thus, “uncovering” the recognition marker is a late event in the Golgi apparatus, occurring just before loading of the enzymes onto the M6P receptors (MPRs). Fibroblasts from patients with I-cell disease (also called mucolipidosis-II; ML-II) revealed a complete deficiency in GlcNAc-P-T enzyme activity.'
 'Thus, specific recognition by GlcNAc-P-T is crucial to achieve selective trafficking. This recognition is not explained by any similarities in the primary polypeptide sequences of lysosomal enzymes. Indeed, denatured lysosomal enzymes lose their specialized GlcNAc-P-T acceptor activity, indicating that features of secondary or tertiary structure are critical for recognition. Two complementary approaches were used to define elements of this recognition marker. In loss-of-function studies, various amino acids of the lysosomal enzyme were replaced with alanine, and the effect on phosphorylation determined. In gain-of-function experiments, residues of the lysosomal protease cathepsin D were substituted into the homologous secretory protease glycopepsinogen. These studies revealed that select lysine residues have a critical role in the interaction with GlcNAc-P-T. In fact, as few as two lysines in the correct orientation to each other and to an N-glycan can serve as minimal elements of the recognition domain.'
 'Interestingly, all these enzymes are actually synthesized by I-cells, but are mostly secreted into the medium, instead of being retained in lysosomes. Neufeld showed that although I-cells incorporated the high-uptake enzymes secreted by normal cells, enzymes secreted by I-cells were not taken up by other cells (Figure 33.1). She therefore proposed that I-cell disease results from a failure to add a common recognition marker to lysosomal enzymes. This marker was assumed to be responsible for the proper trafficking of newly synthesized enzymes to lysosomes in normal cells. The “high-uptake” property was destroyed by strong periodate treatment, which oxidizes vicinal hydroxyl groups in glycans, predicting that the recognition marker was a glycan. High uptake of lysosomal enzymes was next found, by William Sly, to be blocked by M6P and its stereoisomer fructose 1-phosphate, but not by other sugar phosphates.'
 'With ACP2, the enzyme is synthesized initially as a membrane-bound protein, and once in the lysosome, it is proteolytically cleaved to generate the mature soluble form. Glucocerebrosidase is targeted to lysosomes independently of the MPR pathway by forming a complex with LIMP-2, a lysosomal membrane protein that contains a targeting signal in its cytoplasmic tail. Likewise, other integral membrane proteins of the lysosome use similar targeting motifs in their cytoplasmic tails to traffic to the lysosome. Furthermore, several M6P-independent cargo receptors for the transport of lysosomal enzymes have been identified such as the LDL receptor-related protein 1 (LRP1), LRP2 (megalin), sortilin, and mannose receptors. A small number of proteins have now been identified that are related to the P-type lectins because of the presence of MRH domains. These MRH domains contain the residues that bind mannose, but lack the residues that bind phosphate.'
 'Lysosomal sialidase (neuraminidase), β-galactosidase, and a serine carboxypeptidase called protective protein/cathepsin A form a complex in the lysosome that is required for efficient degradation of sialylated glycoconjugates.']","By creating multiple internal membranes seen in typical multivesicular bodies (MVBs), the target molecules are exposed to the soluble lysosomal enzymes, and digestion proceeds efficiently on the membrane surfaces of these internal vesicles. MVB formation starts with inward budding of the limiting endosomal membrane. Lipids and proteins are sorted to either the internal or the limiting membrane. Ubiquitination of cargo proteins targets them to internal vesicles of MVBs, but ubiquitin-independent routes also exist.","By creating multiple internal membranes seen in typical MVBs, the target molecules are exposed to the soluble lysosomal enzymes, and digestion proceeds efficiently on the membrane surfaces of these internal vesicles. MVB formation starts with inward budding of the limiting endosomal membrane. Lipids and proteins are sorted to either the internal or the limiting membrane. Ubiquitination of cargo proteins targets them to internal vesicles of MVBs, but ubiquitin-independent routes also exist. Intra-endosomal membranes and limiting endosomal membrane have different lipid and protein compositions. Membrane segregation and lipid sorting prepare the internal membranes for lysosomal degradation. During maturation of the internal membranes, cholesterol is continually stripped away (to <1%) and a negatively charged lipid bis(monoacylglycero)phosphate (BMP) increases up to 45%. This molecule is highly resistant to phospholipases. BMP also stimulates sphingolipid degradation on the inner membranes of acidic compartments. Because BMP is not present in the lysosomal outer membrane, the unique lipid profile ensures that degradation by hydrolases and membrane-disrupting SAPs occurs without digesting the lysosomal outer membrane. Degradation of glycans is not always complete.",1.0,0.4988489649758744,0.9221246467533968,0.022727272727272728,0.9484126983968916,1.0
"Complete the following paragraph: Although the term “congenital disorders” by definition include those caused by nongenetic, unfavorable in utero conditions, the term “congenital disorders of glycosylation (CDG)” is now widely used as an equivalent of inherited disorders of glycosylation. Following the discovery of the genetic defect in human I-cell disease in 1980 (Chapter 33) it was anticipated that many more human defects in glycan biosynthesis would be found, but more than a decade went by before the next example was found.","['Among genetic disorders of glycosylation, those caused by somatic mutations are described in Chapter 46. Disorders affecting the lysosomal degradation of glycans are described in Chapter 44. Although the term “congenital disorders” by definition include those caused by nongenetic, unfavorable in utero conditions, the term “congenital disorders of glycosylation (CDG)” is now widely used as an equivalent of inherited disorders of glycosylation. Following the discovery of the genetic defect in human I-cell disease in 1980 (Chapter 33) it was anticipated that many more human defects in glycan biosynthesis would be found, but more than a decade went by before the next example was found. In retrospect, the difficulty arose from the pleiotropic multisystem nature of the clinical presentations. Meanwhile Belgian pediatrician Jaak Jaeken noted unusual profiles of serum proteins in some children with multisystem disorders and decided to apply a previously established test to separate transferrin isoforms.'
 'Nearly all inherited disorders in glycan biosynthesis were discovered in the last 20 years. They are rare, biochemically and clinically heterogeneous, and usually affect multiple organ systems. CDGs are rare primarily because embryos with complete defects in a step of glycosylation do not usually survive to be born, documenting the critical biological roles of glycans in humans. CDG patients that survive are usually hypomorphic, retaining at least some activity of the pathways involved. Although rare, research on this group of genetically defined glycosylation disorders reveals important novel insights into the biology of the glycosylation process. Some defects strike only a single glycosylation pathway, whereas others impact several. Defects occur in (1) the activation, presentation, and transport of sugar precursors; (2) glycosidases and glycosyltransferases; and (3) proteins that traffic glycosylation machinery or maintain Golgi homeostasis. A few disorders can be treated by the consumption of monosaccharides.'
 'Glycosylation-related disorders. The graph shows the cumulative number of human glycosylation disorders in various biosynthetic pathways and the year of their identification. (For simplicity, disorders affecting multiple pathways are included in disorders (more...) Selected congenital disorders of glycosylation in humans  The broad clinical features of disorders in which N-glycan biosynthesis is defective involve many organ systems, but are especially common in the central and peripheral nervous systems and hepatic, visual, and immune systems. The generality and variability of clinical features makes it difficult for physicians to recognize CDG patients with defective N-glycosylation. The first were identified in the early 1980s based primarily on deficiencies in multiple plasma glycoproteins. The patients were also delayed in reaching growth and developmental milestones and had low muscle tone, incomplete brain development, visual problems, coagulation defects, and endocrine abnormalities. However, many of these symptoms are also seen in patients with other multisystemic genetic syndromes.'
 'A few disorders can be treated by the consumption of monosaccharides. The rapid growth in the number of discovered disorders, shown in Figure 45.1, has resulted in an evolution of disease nomenclature. Since 1999, CDGs were defined as genetic defects in N-glycosylation, but now the term is applied to any glycosylation defect. Nowadays, CDGs are categorized in four groups, comprising defects in N-glycosylation, O-glycosylation, and lipid and GPI-anchor glycosylation and defects that impact multiple glycosylation pathways. CDGs are named by the mutated gene followed by “-CDG” suffix (e.g., PMM2-CDG). Selected disorders are listed in Table 45.1 and all known disorders in Online Appendix 45A. Glycosylation-related disorders. The graph shows the cumulative number of human glycosylation disorders in various biosynthetic pathways and the year of their identification.'
 'Meanwhile Belgian pediatrician Jaak Jaeken noted unusual profiles of serum proteins in some children with multisystem disorders and decided to apply a previously established test to separate transferrin isoforms. The test was positive in these children, thereby, for the first time, indicating a generic defect in protein N-glycosylation. Lacking further details about glycan structures and the underlying genetic variants, Jaeken decided to call these cases “carbohydrate-deficient glycoprotein syndromes” (CDGS). Several years later, many people defined primary inherited genetic defects in glycosylation pathways in many such cases. To keep the acronym “CDG,” those involved also decided to call them “congenital disorders of glycosylation,” rather than inherited genetic defects in glycosylation. Nearly all inherited disorders in glycan biosynthesis were discovered in the last 20 years. They are rare, biochemically and clinically heterogeneous, and usually affect multiple organ systems.'
 'N-glycosylation defects may be divided into two types based on transferrin glycoforms. Type I (CDG-I) patients lack one or both N-glycans because of defects in the biosynthesis of the lipid-linked oligosaccharide (LLO) or its transfer to proteins. Type II (CDG-II) patients have incomplete protein-bound glycans because of abnormal processing. The biosynthetic pathways and locations of N-glycan defects are shown in Figure 45.2. Congenital disorders of glycosylation in the N-glycosylation pathway. The figure shows individual steps in lipid-linked oligosaccharide (LLO) biosynthesis, glycan transfer to protein, and N-glycan processing similar to Figure 9.3 and Figure 9.4. The shuttling (more...) A complete absence of N-glycans is lethal. Therefore, known mutations mostly generate hypomorphic alleles encoding proteins with diminished activity.'
 'The discovery of CDG defects associated with trafficking proteins showed that the abnormal glycosylation linked to these disorders could arise from alterations in Golgi homeostasis and not only from impairment of the enzymes and transporters needed for glycosylation (Figure 45.5). Among the first of these trafficking proteins identified are subunits of the conserved oligomeric Golgi (COG) complex. This complex has multiple roles in trafficking within the Golgi, including the tethering of COPI-coated vesicles and recycling of Golgi-localized glycosyltransferases. COG7-CDG (Table 45.1) was discovered first. Trafficking of multiple glycosyltransferases and nucleotide sugar transporters were disrupted in COG7-CDG. The mutation affects the synthesis of both N- and O-glycans and glycosaminoglycan (GAG) chains. Mutations have now been found in all COG subunits except COG3.']","It was anticipated that many more human defects in glycan biosynthesis would be found, but more than a decade went by before the next example was found after the discovery of the genetic defect in human I-cell disease in 1980.","In retrospect, the difficulty arose from the pleiotropic multisystem nature of the clinical presentations. Meanwhile Belgian pediatrician Jaak Jaeken noted unusual profiles of serum proteins in some children with multisystem disorders and decided to apply a previously established test to separate transferrin isoforms. The test was positive in these children, thereby, for the first time, indicating a generic defect in protein N-glycosylation. Lacking further details about glycan structures and the underlying genetic variants, Jaeken decided to call these cases “carbohydrate-deficient glycoprotein syndromes” (CDGS). Several years later, many people defined primary inherited genetic defects in glycosylation pathways in many such cases. To keep the acronym “CDG,” those involved also decided to call them “congenital disorders of glycosylation,” rather than inherited genetic defects in glycosylation. Nearly all inherited disorders in glycan biosynthesis were discovered in the last 20 years.",1.0,0.7170811741583122,0.6229212520219816,0.019230769230769232,0.9999999999857143,0.8571428571428571
"Complete the following paragraph: Another alternative is optimized synthetic α-mannosides, which could treat and prevent UTIs. Many pathogens initiate infection by binding to host cell-surface glycans (Chapter 37). Variable expression of these glycans may explain an individual's susceptibility to infection.","[""Another alternative is optimized synthetic α-mannosides, which could treat and prevent UTIs. Many pathogens initiate infection by binding to host cell-surface glycans (Chapter 37). Variable expression of these glycans may explain an individual's susceptibility to infection. For example, some pathogenic strains of E. coli infect the urinary tract using a lectin that binds the P blood group antigens (Chapter 14), with P negative individuals being immune. The E. coli P fimbriae lectins are also involved in spreading bacterial infections from the kidney to the bloodstream. Binding of the spike glycoprotein of SARS-CoV-2, the virus causing COVID-19, to its ACE2 receptor on host epithelial cells first involves its initial binding to neighboring HS glycosaminoglycan chains, which induces a conformational change to enhance binding to ACE2. Importantly, mutations that alter spike glycosylation sites (e.g., variant B.1.1.7 (N501Y)) impact infectivity.""
 'However, the epitopes involved do not seem to be glycan-related. Another likely possibility is that the altered glycosylation changes interactions with Fc receptors. Glycans and their binding proteins are key to the pathogenicity of essentially all infectious diseases, and this topic is covered in greater detail in Chapters 37, 42, and 43. Some key physiologic effects of glycan–host interactions are briefly covered here. Many urinary tract infections (UTIs) are caused by Escherichia coli, which adhere to bladder epithelial cells via a mannose-binding lectin, FimH, located on the F-pilus of the bacterium. A simple and effective antibiotic-independent treatment and prevention for this very common infection is drinking D-mannose because it competes bacterial glycan binding to the urinary tract when it is excreted in the urine. Another alternative is optimized synthetic α-mannosides, which could treat and prevent UTIs.'
 'This can be accomplished by several distinct mechanisms and often confers properties of immune evasive and enhanced virulence. For example, the human-specific pathogen N. gonorrhoeae uses a surface sialyltransferase and scavenges the activated form of sialic acid (CMP-Neu5Ac) from the host. Such incorporation thwarts multiple arms of the host complement system and confers resistance to the cationic antimicrobial peptides (CAMPS). An Achilles’ heel of this increasingly drug-resistant pathogen may be the promiscuity of its sialyltransferase toward related nonulosonic acids. Unnatural incorporation of legionaminic acid (CMP-Leg5,7Ac2) in N. gonorrhoeae prevents the immune evasion benefits typically afforded by Neu5Ac; moreover, vaginal administration of CMP-Leg5,7Ac2 leads to more rapid bacterial clearance of genital infections in mice.'
 'For example, coadministration of methyl α-mannoside with type-1-fimbriated E. coli into the bladder of mice can reduce microbial burden in a mouse model of urinary tract infection, whereas methyl α-glucoside, which does not bind to FimH, has no effect. Furthermore, lacto-N-neotetraose (LNnT) and its α2-3- and α2-6-sialylated derivatives block the adherence of Streptococcus pneumoniae to respiratory epithelial cells in vitro. In addition, these glycans prevent colonization of the nasopharynx and attenuate the course of pneumonia in rodent models of pneumococcal infection. Naturally occurring host glycans can also serve protective roles. For example, secreted mucins and human milk oligosaccharides (HMOs) act as natural receptor decoys, protecting the host from pathogens and shaping the microbiota composition.'
 'Uroplakin Ia presents high levels of terminally exposed mannose residues that are capable of specifically interacting with FimH. Alternatively, type-1 fimbriae can bind to high mannose glycans on the soluble urinary Tamm–Horsfall glycoprotein/uromodulin, that forms long fibers. The resulting bacterial aggregates are flushed out of the urinary tract. Mice lacking the gene encoding the Tamm–Horsfall glycoprotein are considerably more susceptible to bladder colonization by type-1-fimbriated E. coli than normal mice. The α anomer of mannose in the binding site of FimH. The mannose residue is buried in a unique site at the tip of the carbohydrate-recognition domain (left) in a deep and negatively charged pocket (right). FimH prefers to bind D-mannose in the (more...) Most bacteria (and possibly other microorganisms) have multiple adhesins with diverse carbohydrate specificities.'
 'In bacteria, the role of these glycans is to provide a barrier that affords mechanical, chemical, and biological protection to the cell. Some pathogenic or commensal bacteria produce an outer glycan layer that mimics that of their hosts, in order to evade host immune surveillance (Chapters 15 and 42). Pasteurella multocida produces a thick hyaluronan capsule. Oral streptococci produce two GTs for adhesion and virulence, and the EPax GT enables colonization of the gut by Enterococcus faecalis. Other pathogens such as Escherichia coli K1 and Neisseria meningitidis produce a poly α2–8 sialic acid capsule. Mammalian gut bacteria produce capsular polysaccharides thought to help the maturation of the host immune system.'
 'Poverty, poor access to health care, human migration, emerging disease agents, and antibiotic resistance all contribute to the expanding impact of these illnesses. Prevention and treatment strategies for infectious diseases are derived from a thorough understanding of the complex interactions between specific viral or bacterial pathogens and the human (or animal) host. Just as glycans are major components of the outermost surface of all animal and plant cells, so too are oligosaccharides and polysaccharides found on the surfaces of all bacteria and viruses of eukaryotes. Thus, most (if not all) interactions of microbial pathogens with their hosts are influenced to an important degree by the pattern of glycans and glycan-binding receptors that each expresses. This holds true at all stages of infection, from initial colonization of host cell surfaces, to tissue spread, to the induction of inflammation or host cell injury that results in clinical symptoms. The microbial molecules most responsible for disease manifestations are known as virulence factors.']","Some key physiologic effects of glycan–host interactions are briefly covered here. Many urinary tract infections (UTIs) are caused by Escherichia coli, which adhere to bladder epithelial cells via a mannose-binding lectin, FimH, located on the F-pilus of the bacterium. A simple and effective antibiotic-independent treatment and prevention for this very common infection is drinking D-mannose because it competes bacterial glycan binding to the urinary tract when it is excreted in the urine.","For example, some pathogenic strains of E. coli infect the urinary tract using a lectin that binds the P blood group antigens (Chapter 14), with P negative individuals being immune. The E. coli P fimbriae lectins are also involved in spreading bacterial infections from the kidney to the bloodstream. Binding of the spike glycoprotein of SARS-CoV-2, the virus causing COVID-19, to its ACE2 receptor on host epithelial cells first involves its initial binding to neighboring HS glycosaminoglycan chains, which induces a conformational change to enhance binding to ACE2. Importantly, mutations that alter spike glycosylation sites (e.g., variant B.1.1.7 (N501Y)) impact infectivity. Some pathogenic microorganisms secrete sialidases (neuraminidases), which usually remain at the site of infection.",1.0,0.4327325924259195,0.609778279585178,0.023255813953488372,0.642857142825,0.8
"Complete the following paragraph: Many years ago, cancer patients were reported to express “Hanganutziu–Deicher” antibodies, which were later shown to recognize gangliosides carrying the nonhuman sialic acid N-glycolylneuraminic acid (Neu5Gc), which was also found in human tumors. This unusual phenomenon has now been explained by the metabolic incorporation of diet-derived Neu5Gc into human glycans (Chapter 15). This Sia differs from the common human Sia, Neu5Ac, by addition of a single oxygen atom (Figure 47.3).","['This unusual phenomenon has now been explained by the metabolic incorporation of diet-derived Neu5Gc into human glycans (Chapter 15). This Sia differs from the common human Sia, Neu5Ac, by addition of a single oxygen atom (Figure 47.3). Humans show variable levels of circulating antibodies against Neu5Gc-containing epitopes. The resulting weak immune response (termed “xenosialitis”) can promote tumor growth by enhancing chronic inflammation and angiogenesis. Given this selective advantage, it is not surprising that tumors are better at accumulating Neu5Gc in the face of an increased immune response. Because the primary dietary source of Neu5Gc is red meat, this may help explain the increased cancer risk associated with its consumption. SLex and SLea epitopes (Chapter 14) were first identified as tumor antigens on glycosphingolipids.'
 ""The α2-9-polySia in N. meningitidis serogroup C can also be O-acetylated at Sia C-7 or C-8. A bacteriophage that attacks polySia-expressing bacteria produces a highly specific endosialidase that only clips chains that are ≥8 residues long. This enzyme (Endo-N) and its inactivated form (which binds polySia) are powerful tools to study polySia functions. Neu5Gc is common in mammals including human's closest evolutionary relatives (bonobos and chimpanzees). However, it is not synthesized by humans, because of a fixed single-exon deletion mutation in the CMAH gene encoding a hydroxylase that converts CMP-Neu5Ac to CMP-Neu5Gc. Why did the human lineage lose Neu5Gc? Many pathogens use Sias to bind and infect vertebrates (Chapter 42), and some specifically target Neu5Gc.""
 'Some tumor cells express small amounts of de-N-acetyl (deNAc) gangliosides (Figure 47.3). O-Acetylation of gangliosides appears to protect tumor cells from apoptosis, and de-N-acetylgangliosides may activate epidermal growth factor receptor (EGFR). Gangliosides expressed in human neuroectodermal tumors. Heavy arrows indicate up-regulated reactions; dashed arrow indicates a potential reaction. O-Acetylation of Sia can occur at the 7- or 9-position. An O-acetyl group at position 7 will migrate to (more...) Many years ago, cancer patients were reported to express “Hanganutziu–Deicher” antibodies, which were later shown to recognize gangliosides carrying the nonhuman sialic acid N-glycolylneuraminic acid (Neu5Gc), which was also found in human tumors.'
 'However, at the whole-body level, free Sias in the bloodstream derived from cellular sources or digestive processes are rapidly excreted in the urine. Thus, uptake of sialoglycoproteins (followed by lysosomal release by NEU1 and export by Sialin) may better account for the incorporation of dietary Neu5Gc in human tissues. In vertebrates, O-acetylated Sias are de-O-acetylated by Sia-specific O-acetylesterases, including the human enzyme coded by the SIAE gene, which may regulate B-cell development and immune tolerance by modulating recognition by Siglecs (Chapter 35). Enzymes with Sia 9-O-acetylesterase activity are also found in some bacteria and viruses. Influenza C virus and some coronavirus hemagglutinins bind specifically to 9-O-acetyl Sia for host infection, and their O-acetylesterases help in their further dissemination after newly budded virions are released from host cells.'
 'Why did the human lineage lose Neu5Gc? Many pathogens use Sias to bind and infect vertebrates (Chapter 42), and some specifically target Neu5Gc. An organism recognizing Neu5Gc may have been the cause of initial selection of the CMAH null state. Subsequent development of anti-Neu5Gc antibodies in CMAH-null females may have then reduced fertility with CMAH-positive males by killing their sperm, possibly serving to speciate the null population. Other lineage-specific losses of Neu5Gc expression may have occurred in a similar fashion. This is part of a broader consideration of Sias as both a pathogen target and a physiological regulator, a combination that apparently contributed to rapid evolution of both Sia expression patterns and Sia-binding proteins, especially of the Siglecs (Chapter 35). Despite CMAH inactivation in humans, traces of Neu5Gc are found in normal human tissues.'
 'Although trans-sialidases tend to be specific regarding the sialyl linkage they generate, they can be promiscuous toward the donor and acceptor glycans. Once CMP-Neu5Ac is converted to CMP-Neu5Gc in the cytosol, there is no known way to reverse the reaction, perhaps explaining the accumulation of diet-derived Neu5Gc in human tissues. Further structural diversity in Sias is generated by enzymatic modification of Neu5Ac, Neu5Gc, and Kdn via reactions that occur in the lumen of the Golgi and related organelles, and on mature sialoglycoconjugates, as well as at the CMP-Sia level. Different enzymes may O-acetylate Sia at C-7/9 (most common) and C-4 (less common).'
 'By the time the relationship of these substances became evident, both names were already in use and have persisted. Although 5-N-acetylneuraminic acid (Neu5Ac, sometimes called “NANA”) is the most common sialic acid (Sia) in humans, the Sia family is comprised of related structures (Figure 15.1) that vary at the C-5 carbon, including 5-N-glycolylneuraminic acid (Neu5Gc) and 3-deoxy-D-glycero-D-galacto-non-2-ulosonic acid (also known as 3-deoxy-nonulosonic acid, 2-keto-3-deoxy-nononic acid, or Kdn) with a hydroxyl group at C-5.']","The unusual phenomenon of cancer patients expressing ""Hanganutziu-Deicher"" antibodies, which were later found to recognize gangliosides carrying the nonhuman sialic acid N-glycolylneuraminic acid (Neu5Gc) present in human tumors, has been explained by the metabolic incorporation of diet-derived Neu5Gc into human glycans. This Neu5Gc differs from the common human sialic acid, Neu5Ac, by the addition of a single oxygen atom.","Humans show variable levels of circulating antibodies against Neu5Gc-containing epitopes. The resulting weak immune response (termed “xenosialitis”) can promote tumor growth by enhancing chronic inflammation and angiogenesis. Given this selective advantage, it is not surprising that tumors are better at accumulating Neu5Gc in the face of an increased immune response. Because the primary dietary source of Neu5Gc is red meat, this may help explain the increased cancer risk associated with its consumption. SLex and SLea epitopes (Chapter 14) were first identified as tumor antigens on glycosphingolipids. Expression of these antigens by epithelial carcinomas correlates with metastatic potential in mice and with tumor progression, metastatic spread, and poor prognosis in humans. SLex and SLea epitopes on glycoprotein ligands are key recognition determinants of the selectins (Chapter 34).",0.6,0.5762474586039565,0.7456627952412322,0.15789473684210525,0.9999999999857143,0.8333333333333334
"Complete the following paragraph: Mention should also be made about the approaches to isolate novel lectins from natural sources, or even when made recombinantly or in the form of some type of GRP. Historically, such isolation methods have used affinity chromatography. For example, a high density of lactose linked to agarose in the form of an affinity column can be used to isolate galectins, which can be eluted with lactose as a hapten. The cation-dependent mannose 6-phosphate receptor (CD-MPR) was isolated by affinity chromatography on immobilized yeast mannans containing phosphorylated mannose.","['The cation-dependent mannose 6-phosphate receptor (CD-MPR) was isolated by affinity chromatography on immobilized yeast mannans containing phosphorylated mannose. There are also other forms of isolation, including salt precipitation, ion exchange chromatography, gel filtration, and the capture of a tagged and recombinant chimeric-lectin by capture of the tag (e.g., His tag). A recent method exploits a “capture and release” approach, in which multivalent ligands recognized by a lectin are assembled, whereby they can capture the lectin of interest, and then filtration or centrifugation may be used to isolate the lectin complexed with ligand. The lectin can then be dissociated and is available for study. Any of these type of methods are also useful when combined with proteomic analyses in identifying novel lectins and protein complexes that bind to glycans.'
 'The bound lectins/antibodies are visualized by binding streptavidin-alkaline phosphatase and conversion of luminescent substrates. In these approaches, the concentrations of lectins and antibodies used must be low enough both to reduce false-positive, nonspecific binding and to allow for inhibition by appropriate haptens to confirm sugar binding. Removal of N-glycans by PNGaseF, or of sialic acid by neuraminidase, can eliminate binding to specific lectins and antibodies in western blotting, thus indicating the lectin/antibody-bound determinant. Mention should also be made about the approaches to isolate novel lectins from natural sources, or even when made recombinantly or in the form of some type of GRP. Historically, such isolation methods have used affinity chromatography. For example, a high density of lactose linked to agarose in the form of an affinity column can be used to isolate galectins, which can be eluted with lactose as a hapten.'
 'These bound antibodies and lectins can then be used to isolate glycoconjugates expressing specific glycan determinants. ConA-Sepharose is commonly used to isolate glycoproteins as it shows little binding to nonglycosylated proteins. However, it does not bind all glycoproteins because it recognizes specific N-glycan structures. ConA-Sepharose has also been used to isolate free oligo- and polymannose-, hybrid-, and complex-type biantennary N-glycans. When combined in a serial format, multiple lectins can be used in affinity chromatography to isolate glycoconjugates containing most of the major glycan structures present in animal cells, with glycoconjugates being separated as classes that share common determinants. An example of serial lectin affinity chromatography is shown in Figure 48.8. Identification of glycoproteins through analysis of released glycopeptides gives important information on proteins carrying specific modifications.'
 'Combinations of affinity chromatography and other chromatographic techniques can be very useful in identifying and separating glycopeptides. Thus, the ability of glycans to be recognized by lectins dependent on specific structural features in the glycans is a powerful tool for glycan identification and isolation. In some approaches, the glycans are tagged at the reducing end by fluorophores and radioisotopes or may be obtained by metabolic radiolabeling from cells or tissues grown in the presence of radiolabeled sugar precursors, such as [2-3H]mannose or [6-3H]glucosamine. Glycan fractionation shown on immobilized lectins in Figure 48.8 is currently not possible with antibodies because no antibodies are known that can distinguish such core structural features in glycans.'
 'Lower densities of ConA conjugation reduce its avidity for the glycoproteins and promote hapten dissociation of bound ligands with lower concentrations of sugars. When used in combination, multiple lectins, such as ConA, AAL (Aleuria aurantia lectin), LCA, and RCA (Ricinus communis agglutinin), can be used to isolate most glycoproteins containing N-and O-glycans from animal cells. This is a potentially powerful approach for glycoproteomics, or the identification of glycoproteins and their glycosylation status. Another approach to enhance glycoproteomic analyses is to use multiple lectins in mixed-bed or multi-lectin affinity chromatography (M-LAC). In such an approach a number of different lectins are used that recognize different glycan features, such as those shown in earlier figures in this chapter.'
 'Identification of glycoproteins through analysis of released glycopeptides gives important information on proteins carrying specific modifications. Release of glycans coupled with ion-exchange chromatography and high-performance liquid chromatography (HPLC) can yield highly pure glycans with predicted structures that can then be confirmed by mass spectrometry of native and permethylated derivatives (Chapters 50 and 51). An example of the use of different immobilized plant lectins in serial lectin affinity chromatography of complex mixtures of glycopeptides. In this example, a mixture of glycopeptides is applied to a column of immobilized concanavalin A (ConA), and the (more...) Mixed-bed lectin chromatography using a combination of different immobilized lectins is useful for simultaneously separating all types of glycoconjugates from nonglycosylated material (e.g., glycopeptides from peptides). Combinations of affinity chromatography and other chromatographic techniques can be very useful in identifying and separating glycopeptides.'
 'Glycan fractionation shown on immobilized lectins in Figure 48.8 is currently not possible with antibodies because no antibodies are known that can distinguish such core structural features in glycans. When intact glycoproteins or complex polysaccharides (e.g., those found in plant cell walls [Chapter 24]) are analyzed for their interactions with plant lectins or antibodies, the interpretation of data may be complicated by the multivalency of the glycoprotein/polysaccharide and the density of the immobilized lectin/antibody. For example, glycoproteins containing multiple high-mannose-type N-glycans bind so tightly to immobilized ConA that it is difficult to elute the bound glycoprotein, even with extremely high concentrations of hapten and under harsh conditions. Lower densities of ConA conjugation reduce its avidity for the glycoproteins and promote hapten dissociation of bound ligands with lower concentrations of sugars.']","The cation-dependent mannose 6-phosphate receptor (CD-MPR) was isolated by affinity chromatography on immobilized yeast mannans containing phosphorylated mannose. Historically, such isolation methods have used affinity chromatography. For example, a high density of lactose linked to agarose in the form of an affinity column can be used to isolate galectins, which can be eluted with lactose as a hapten.","There are also other forms of isolation, including salt precipitation, ion exchange chromatography, gel filtration, and the capture of a tagged and recombinant chimeric-lectin by capture of the tag (e.g., His tag). A recent method exploits a “capture and release” approach, in which multivalent ligands recognized by a lectin are assembled, whereby they can capture the lectin of interest, and then filtration or centrifugation may be used to isolate the lectin complexed with ligand. The lectin can then be dissociated and is available for study. Any of these type of methods are also useful when combined with proteomic analyses in identifying novel lectins and protein complexes that bind to glycans. The classic approaches for using antibodies, CBMs, and lectins to characterize cell-surface glycoconjugates are histochemistry (lectins) and immunohistochemistry (antibodies), flow cytometry with cell sorting, and cell agglutination. In histochemistry and immunohistochemistry, tissues are prepared and fixed as usual for histological staining, and then incubated with appropriate biotinylated or peroxidase-labeled lectins or antibodies (glycolipids are extracted during standard paraffin embedding procedures and require frozen sections for sensitive detection). The bound lectins, CBMs, or antibodies are then visualized by means of secondary reagents, such as streptavidin-peroxidase or labeled secondary antibody.",1.0,0.6002095458957071,0.5537861224955698,0.027777777777777776,0.9999999999857143,0.8
"Complete the following paragraph: Cells in culture mutate at a low rate (<10−6 mutations per locus per generation). In CHO cells, some loci are functionally haploid (single copy), and in HAP1 human cells, essentially all loci are haploid, which means that a single hit may generate a recessive mutant. However, typical mammalian cells are diploid and immortalized cells are often hyperploid, so the frequency of finding recessive mutants is low. To greatly increase the probability of finding desirable mutants, mutations may be induced by treating cells with chemical (e.g., alkylating agents), physical (e.g., ionizing radiation), or biological (e.g., a virus) mutagens or, perhaps more likely, by lentiviral transduction with CRIPSR/Cas9 genome-wide or focused libraries.","['Colonies on plastic are transferred to discs and screened for defects in (more...) Cells in culture mutate at a low rate (<10−6 mutations per locus per generation). In CHO cells, some loci are functionally haploid (single copy), and in HAP1 human cells, essentially all loci are haploid, which means that a single hit may generate a recessive mutant. However, typical mammalian cells are diploid and immortalized cells are often hyperploid, so the frequency of finding recessive mutants is low. To greatly increase the probability of finding desirable mutants, mutations may be induced by treating cells with chemical (e.g., alkylating agents), physical (e.g., ionizing radiation), or biological (e.g., a virus) mutagens or, perhaps more likely, by lentiviral transduction with CRIPSR/Cas9 genome-wide or focused libraries.'
 'Subsequently, genetic screens were performed using HAP1 (haploid) human cells mutagenized by retroviral gene trap. Such unbiased screens led to the identification of multiple, previously unknown, glycosylation genes. Lately, however, the evolvement of CRISPR tools and the generation of genome-wide libraries have made it possible to conduct both loss-of-function and gain-of-function screens in nonhaploid cell lines, providing an unbiased strategy to discover new genes that influence cellular glycosylation (Figure 49.2). Alteration of cell-surface glycans by recessive and dominant glycosylation mutations.  Selections for glycosylation mutants. Cytotoxic lectins or agents that bind to specific sugar residues select for resistant cells (left). Screen for mutants using replica plating. Colonies on plastic are transferred to discs and screened for defects in (more...) Cells in culture mutate at a low rate (<10−6 mutations per locus per generation).'
 'Animal cells can also be replica-plated, much like microbial colonies, using porous cloth made of polyester or nylon as the replica (Figure 49.2). Colonies of cells on the disc can be used to identify mutants with reduced incorporation of radioactive precursors or to identify mutants that fail to bind to a lectin, an antibody, or a growth factor. An adaptation of this technique allows detection of mutants affecting a specific enzyme by direct assay for activity in colony lysates generated on a disc. Although this technique has great specificity, its limited capacity makes detection of rare mutants difficult, and mutagenesis before screening is usually a requirement. The resulting strains must be cloned and carefully characterized for stability and the biochemical and molecular basis of mutation. Additional genetic analyses include somatic cell hybridization for dominance/recessive testing and assigning mutants to different genetic complementation groups. Specifically, when mutations are introduced by CRISPR/Cas9 and single-guide RNAs (sgRNAs), the affected genes can be identified through deep sequencing analysis of enriched sgRNA populations.'
 'CHO cells thus became a focus for experiments to decipher glycosylation pathways and, importantly, provided mutant host cells for the production of viruses and glycoproteins with modified glycans. This proved to be extremely beneficial to the biotechnology industry because most recombinant therapeutics are glycoproteins. CHO cells and CHO glycosylation mutants are now the workhorse of the biotechnology industry. They are particularly useful because they produce only minor, if any, quantities of nonhuman glycans or glycan modifications that give rise to undesirable antibodies. Conserved glycosylation pathways in yeast were delineated by similar approaches (Chapter 23). Mutants in any cell type often accumulate the precursor immediately upstream of the block in a pathway and thereby reveal the structure of their substrate(s). Sequencing of mutant alleles reveals specific mutations that may give rise to a glycosylation phenotype.'
 'Fibroblasts or lymphoblasts can be obtained readily from humans with a disorder of glycosylation (Chapter 45). Cells may be grown as primary cultures or immortalized by viral transformation. By crossing mutant mice with the Immortomouse, which carries a temperature-sensitive SV40 T antigen in every cell, immortalized mutant cell lines can be derived from essentially any cell type. For mutations that cause embryos to die during gestation, mutant embryonic stem (ES) cells can be derived from blastocysts, provided the mutation does not result in cell-autonomous lethality. The resulting mutant ES cell lines can be used to investigate functions for specific glycans during differentiation in embryoid cell culture, or in vivo in mouse chimeras. A chimera is obtained by injecting wild-type or mutant ES cells into the inner cell mass of a mouse blastocyst. If the ES cells survive, the resulting mouse is a mixture of cells derived from the ES cells and cells derived from the blastocyst and is termed a chimera.'
 'Many of the cell lines described in this chapter are available through the American Type Culture Collection. The success of bacterial and yeast genetics in isolating mutants and using them to define biochemical pathways led in the late 1960s to the development of somatic cell genetics using mammalian cells. Chinese hamster ovary (CHO) cells were selected by two independent groups for initial experiments to isolate stable mutants. Somatic cell genetic strategies were applied early to glycobiology, yielding numerous mutants in glycoprotein biosynthesis and later in proteoglycan, glycosylphosphatidylinositol (GPI) anchor, and glycolipid biosynthesis. The ability to isolate glycosylation mutants in mammalian cells made it possible to unravel pathways of glycan synthesis and degradation and to identify, isolate, and map structural and regulatory genes. CHO cells thus became a focus for experiments to decipher glycosylation pathways and, importantly, provided mutant host cells for the production of viruses and glycoproteins with modified glycans.'
 'This conclusion has been driven home by gene ablation studies in mice and further evidenced by the discovery of human genetic diseases which arise from mutations in genes involved in glycosylation (Chapter 45). CHO cells have become the cells of choice for the biotechnology industry in the production of recombinant therapeutic glycoproteins and in glycosylation engineering (see Chapter 56). For example, CHO cells lacking FUT8, which adds fucose to the core GlcNAc of complex N-glycans, are used to produce cytotoxic therapeutic antibodies that have a greatly enhanced ability to kill their target cells. In another example, CHO cells with multiple mutations that simplify N- and O-glycans are being used by X-ray crystallographers to produce homogeneous preparations of membrane glycoproteins with highly truncated N- and O-glycans, greatly facilitating their crystallization. Somatic cell genetics arose from the desire to manipulate the genome of cultured cells in vitro.']","To greatly increase the probability of finding desirable mutants, mutations may be induced by treating cells with chemical (e.g., alkylating agents), physical (e.g., ionizing radiation), or biological (e.g., a virus) mutagens or, perhaps more likely, by lentiviral transduction with CRISPR/Cas9 genome-wide or focused libraries. This approach is particularly important in mammalian cells where the frequency of finding recessive mutants is low due to their diploid nature, and immortalized cells being often hyperploid. By inducing mutations using various methods, researchers can enhance the chances of identifying valuable mutants for further study and applications in glycosylation engineering.","Regardless of the method used to induce mutations, selection or enrichment is usually needed to find rare recessive or dominant mutants bearing a desired glycosylation phenotype (Figure 49.1). For example, direct selection for resistance to cytotoxic plant lectins (Chapters 31 and 32) that bind to cell-surface glycans gives a range of glycosylation mutants. Importantly, many mutants resistant to one or more lectins because of the loss of specific sugars become supersensitive to a different group of lectins that recognize sugar residues exposed by the mutation (Figure 49.2). The latter may be used to select for revertants in the original mutant population. Nontoxic lectins are also useful for enriching lectin-binding mutants (e.g., by flow cytometry). Mutations that affect all stages of glycosylation reactions, including the generation and transport of nucleotide sugars, have been identified using lectins as selective agents.",,0.6602845448009254,0.6849677355921584,0.09090909090909091,0.9150793650641138,1.0
Complete the following paragraph: Linkage analysis is a well-established and ingenious approach for determining linkage positions. The principle of this method is to introduce a stable substituent (an ether-linked methyl group) onto each free hydroxyl group of the native glycan.,"['This is referred to as fluorophore-assisted carbohydrate electrophoresis (FACE). Linkage analysis is a well-established and ingenious approach for determining linkage positions. The principle of this method is to introduce a stable substituent (an ether-linked methyl group) onto each free hydroxyl group of the native glycan. Glycosidic linkages are then cleaved by acid hydrolysis, producing partially methylated monosaccharides with free hydroxyl groups at the positions that were previously involved in a linkage. The partially methylated monosaccharides are ring-opened with a reducing agent (normally borodeuteride) to introduce a new hydroxyl group and, more importantly, a deuterium atom at C-1, which helps identify the reducing end of each monosaccharide.'
 'This type of analysis identifies terminal residues (they are methylated at every position except the hydroxyl group at C-1 and the ring oxygen), indicates how each monosaccharide is substituted, including the occurrence of linkage and branching points, and allows the determination of the ring size (pyranose [p] or furanose [f]) for each monosaccharide. However, linkage analysis provides no information on the nature of substituents or sequence information and cannot reveal α- or β-anomeric configuration. (See following page.) An example of linkage analysis showing a bacterial O-linked branched hexasaccharide with a sequence of Rha1-3Glc1-(Glc1-3GlcNAc1-)2,6Glc1-6GlcNAc. The O-glycan is reductively eliminated from protein before successive steps of permethylation, (more...) EI-MS in monosaccharide composition and linkage analyses is covered above.'
 'A wealth of information exists on the chemical generation of glycans and various protecting group manipulations used in the context of glycan synthesis. A glycosidic linkage is generally formed through the activation of a glycosylating agent (glycosyl donor) to create an electrophilic species that reacts with the nucleophile, for example, a hydroxyl group present on the glycosyl acceptor. Other possible acceptors include serine/threonine in the case of glycopeptides or a sphingoid in the case of glycosphingolipids. The glycosylation reaction results in the formation of either an α- or β-glycosidic linkage (see Chapter 2). A major challenge in glycan synthesis is the stereoselective formation of glycosidic bonds (Figure 53.1A; Chapter 2). A variety of methods are available to stereoselectively generate glycosidic linkages.'
 'This 1H is frequently across the glycosidic bond at the linkage site, providing a way to assemble residues into a complete structure. However, caution must be exercised. The identification of linkage sites is not as definitive as with 13C-based experiments, because the distance for the trans-glycosidic pair is dependent on glycosidic torsion angles, and these NOE crosspeaks can be weak. Also, other nonlinkage site protons can come within NOE distance and give false identification. The same NOE crosspeaks that assist in identifying linkages between residues can, in principle, be used to define the tertiary (3D) structure of a glycan. However, the interpretation is complicated by the presence of internal molecular motion, resulting in many different conformations in solution. This motion is nicely illustrated in ϕ–ψ energy plots much like the Ramachandran plots used to describe the energetics of torsional angles in the polypeptide backbone of a protein.'
 'A variety of methods are available to stereoselectively generate glycosidic linkages. The yield and the stereochemical outcome of these reactions depend on the steric and electronic nature of the glycosylating agent (the glycosyl donor), the nature of the nucleophile, and the reaction conditions. One common method to control the stereochemistry at the anomeric center involves the use of certain protecting groups, such as esters or amides/carbamates, on the C2-hydroxyl or C2-amino group (Figure 53.1B). These “participating neighboring” protecting groups can form a cyclic oxonium ion intermediate during the glycosylation reaction that shields one face of the molecule, leading exclusively to the formation of a “trans”-glycosidic linkage (i.e., where the anomeric substituent and the C2 group are on opposite sides of the ring, as in β-glucosides).'
 'An overview of glycan synthesis strategies is provided in Chapters 53 and 54. The hydroxyl groups present in both monosaccharides and oligosaccharides can be chemically modified without affecting the glycosidic linkages. Methylation is used in the structural analysis of glycans (see Chapter 50). Natural products containing partially methylated glycans are known and a number of methyltransferases have been identified. A variety of different enzymes can esterify the hydroxyl groups of glycans to transiently vary glycan structure. Esterification is sometimes required for interactions with other biomolecules. The most important types of sugar esters in nature are phosphate esters (including diphosphate esters), acyl esters (with acetic acid or fatty acids), and sulfate esters. Acyl esters can sometime migrate to other hydroxyl groups on the same monosaccharide. The replacement of monosaccharide hydroxyl groups with hydrogen atoms forms deoxysugars.'
 'These modified proteins are thought to underlie some of the pathologies associated with diabetes. Two monosaccharide units can be joined together by a glycosidic bond—this is the fundamental linkage among the monosaccharide building blocks found in all oligosaccharides. The glycosidic bond is formed between the anomeric carbon of one monosaccharide and a hydroxyl group of another. In chemical terms, a hemiacetal group reacts with an alcohol group to form an acetal. Glycosidic bonds can be formed with virtually any hydroxylated compound, including simple alcohols such as methanol (Figure 2.13) or hydroxy amino acids such as serine, threonine, and tyrosine. Indeed, glycosidic linkages are formed between sugars and these amino acids within proteins to form glycoproteins (see Chapters 9 and 10).']","This type of analysis identifies terminal residues (they are methylated at every position except the hydroxyl group at C-1 and the ring oxygen), indicates how each monosaccharide is substituted, including the occurrence of linkage and branching points, and allows the determination of the ring size (pyranose [p] or furanose [f]) for each monosaccharide.","Glycosidic linkages are then cleaved by acid hydrolysis, producing partially methylated monosaccharides with free hydroxyl groups at the positions that were previously involved in a linkage. The partially methylated monosaccharides are ring-opened with a reducing agent (normally borodeuteride) to introduce a new hydroxyl group and, more importantly, a deuterium atom at C-1, which helps identify the reducing end of each monosaccharide. All the free hydroxyl groups are then acetylated resulting in partially methylated alditol acetates (PMAAs) that can be identified by a combination of GC retention times and electron impact (EI)-MS (Figure 50.2). The masses of fragments produced by impact of high-energy electrons on PMAAs identify substitution sites in some cases, but fragmentation patterns of similarly substituted isomeric monosaccharides (e.g., Glc and Gal) can be nearly identical. Thus, definitive identification of monosaccharides requires, in addition to the analysis of the MS pattern, a comparison of GC retention times with those of known standards (e.g., all peracetylated 2,3,4-tri-O-methyl-hexoses produce the same EI-MS spectrum, but peracetylated 2,3,4-tri-O-methyl-galactitol elutes later than peracetylated 2,3,4-tri-O-methyl-glucitol). This type of analysis identifies terminal residues (they are methylated at every position except the hydroxyl group at C-1 and the ring oxygen), indicates how each monosaccharide is substituted, including the occurrence of linkage and branching points, and allows the determination of the ring size (pyranose [p] or furanose [f]) for each monosaccharide.",1.0,0.5252863000513978,0.780115077589447,0.023809523809523808,0.9999999999857143,0.5
"Complete the following paragraph: The term genomics arose from the availability of complete genome sequence data as well as computational methods for their analysis. However, <2% of genes in the human genome encode proteins. These genes are transcribed into messenger RNAs (mRNAs) that make up the “transcriptome,” of which ∼30% are assigned to protein coding. The total complement of proteins expressed by the cell is collectively termed the “proteome.” Most eukaryotic proteins are post translationally modified (e.g., by phosphorylation, sulfation, oxidation, ubiquitination, acetylation, methylation, lipidation, or glycosylation).","['These genes are transcribed into messenger RNAs (mRNAs) that make up the “transcriptome,” of which ∼30% are assigned to protein coding. The total complement of proteins expressed by the cell is collectively termed the “proteome.” Most eukaryotic proteins are post translationally modified (e.g., by phosphorylation, sulfation, oxidation, ubiquitination, acetylation, methylation, lipidation, or glycosylation). These modifications, combined with alternative RNA splicing in eukaryotes, render the proteome considerably more complex than the transcriptome. Although it has been estimated that approximately 120,000 different protein splice forms are expressed by human cells, the total number of modified proteoforms is likely to be at least an order of magnitude higher. The systems-level analysis of all proteins expressed by cells, tissues, or organisms is known as “proteomics.” The proteome, like the transcriptome, but unlike the DNA sequence of the genome, is fundamentally dynamic.'
 'The repertoire of proteins expressed by a cell is highly dependent on tissue type, microenvironment, and stage within the life cycle. As cells receive external and internal cues in the form of growth factors, hormones, metabolites, or cell–cell interactions, the expression of various genes is modulated and may be transcribed at levels ranging from silence to more than 104 mRNA copies per cell and 107 protein molecules per cell. Thus, proteomes and their modifications vary during cell differentiation, activation, trafficking, and malignant transformation. However, no systems-level analysis of a biological process is complete without interrogating the glycome, defined as the entire complement of glycan structures (be it protein-/lipid-bound or -free) produced by cells, in addition to the genome, transcriptome, proteome, lipidome and metabolome.'
 'NCBI Bookshelf. A service of the National Library of Medicine, National Institutes of Health. Varki A, Cummings RD, Esko JD, et al., editors. Essentials of Glycobiology [Internet]. 4th edition. Cold Spring Harbor (NY): Cold Spring Harbor Laboratory Press; 2022.  doi: 10.1101/glycobiology.4e.51 Pauline M. Rudd, Niclas G. Karlsson, Kay-Hooi Khoo, Morten Thaysen-Andersen, Lance Wells, and Nicolle H. Packer. The term genomics arose from the availability of complete genome sequence data as well as computational methods for their analysis. However, <2% of genes in the human genome encode proteins. These genes are transcribed into messenger RNAs (mRNAs) that make up the “transcriptome,” of which ∼30% are assigned to protein coding.'
 'Clues regarding the composition and complexity of the glycome are found in the genome, transcriptome, and proteome of a cell. Thus, if a gene encoding a glycosyltransferase is not expressed (absent from the transcriptome), no glycans in that cell can carry the sugar transferred by that glycosyltransferase at that particular time. The action of many glycosyltransferases and glycoside hydrolases competing for the same substrates in the biosynthetic pathway renders the complete glycome impossible to predict with current tools and knowledge. As an example, the reduced expression of a single glycosyltransferase can perturb the biosynthesis of dozens of glycans. Furthermore, unlike the genome, the glycome is sensitive to exogenous nutrient levels and metabolic fluxes including salvage pathways.'
 'Different approaches and techniques are required to characterize, for example, the structures of glycoproteins versus glycolipids, N-glycans versus O-glycans, and sulfated GAGs versus neutral glycans (Chapter 50). In contrast, a single technique such as RNA sequencing (RNA-seq) can be used to identify and quantitate all mRNA transcripts at once, a much easier task. Glycomic methods and analyses have been mostly directed toward protein glycosylation because of the current proteomics focus, although considerable effort is being directed toward methods that encompass all glycan conjugates. As an example of a typical experiment, a glycoprotein-enriched sample is prepared from a cell lysate and their released glycans analyzed by liquid chromatography (LC) and/or mass spectrometry (MS).'
 'The term “glycomics” thus describes studies designed to define the complete repertoire of glycans that a cell, tissue, or organism produces under specified conditions of time, location, and environment. “Glycoproteomics” describes this glycome as it appears on the cellular proteome. Glycoproteomics determines which sites on each glycoprotein of a cell are glycosylated and ideally includes the identification and quantitation of the heterogeneous glycan structures at each site. The molecular complexity of the glycoproteome makes glycomics and glycoproteomics both exciting and daunting. Because neither the genome, transcriptome, nor the proteome can accurately predict the dynamically expressed protein-linked glycans, the glycome and glycoproteome must be analyzed directly. Techniques used to characterize a single glycoprotein after isolation (Figure 51.1) or a complex mixture of glycoproteins (the glycoproteome) (Figure 51.2) are described in this chapter. Analysis of a purified single glycoprotein.'
 'Vertebrates synthesize N-linked and O-linked glycoproteins, glycolipids (Chapters 11 and 12), proteoglycans, glycosaminoglycans (GAGs), and glycosylphosphatidylinositol (GPI) anchors covalently attached to proteins, as well as free oligosaccharides (Chapter 3). As with the proteome, each cell type has its own distinct glycome that is governed by local cues and the metabolic state of the cell. Other organisms have distinct glycomes; those of plants (Chapter 24) and prokaryotes (Chapter 21) are distinctly different from the vertebrate and invertebrate glycomes (Chapters 25–27). The size of any particular cellular glycome has not yet been established, but the combinatorial possibilities that can occur with numerous glycan structures on multiple glycoconjugates means that determining a “complete” glycome is not straightforward.']","Most eukaryotic proteins are post translationally modified, which adds complexity to the proteome. These modifications, such as phosphorylation, sulfation, oxidation, ubiquitination, acetylation, methylation, lipidation, and glycosylation, contribute to the diversity and functionality of proteins within the cell.","These modifications, combined with alternative RNA splicing in eukaryotes, render the proteome considerably more complex than the transcriptome. Although it has been estimated that approximately 120,000 different protein splice forms are expressed by human cells, the total number of modified proteoforms is likely to be at least an order of magnitude higher. The systems-level analysis of all proteins expressed by cells, tissues, or organisms is known as “proteomics.” The proteome, like the transcriptome, but unlike the DNA sequence of the genome, is fundamentally dynamic. The repertoire of proteins expressed by a cell is highly dependent on tissue type, microenvironment, and stage within the life cycle. As cells receive external and internal cues in the form of growth factors, hormones, metabolites, or cell–cell interactions, the expression of various genes is modulated and may be transcribed at levels ranging from silence to more than 104 mRNA copies per cell and 107 protein molecules per cell. Thus, proteomes and their modifications vary during cell differentiation, activation, trafficking, and malignant transformation. However, no systems-level analysis of a biological process is complete without interrogating the glycome, defined as the entire complement of glycan structures (be it protein-/lipid-bound or -free) produced by cells, in addition to the genome, transcriptome, proteome, lipidome and metabolome.",1.0,0.5300115585296141,0.6538495300337805,0.023809523809523808,0.9999999999857143,1.0
"Complete the following paragraph: A critical component of glycoinformatics is the availability of standardized approaches to share data and tools. To address this problem a number of international efforts are underway to establish standards for the presentation of glycomics data to facilitate data comparison, exchange, and verification. The Glycomics Ontology (GlycO) was the first ontology developed to provide standard terminologies for representing experimentally verified glycan structures as collections of chemically and contextually defined constituents, facilitating the association of these structural elements with biosynthetic and functional processes.","['Glycoscience databases, repositories and web portals  A critical component of glycoinformatics is the availability of standardized approaches to share data and tools. To address this problem a number of international efforts are underway to establish standards for the presentation of glycomics data to facilitate data comparison, exchange, and verification. The Glycomics Ontology (GlycO) was the first ontology developed to provide standard terminologies for representing experimentally verified glycan structures as collections of chemically and contextually defined constituents, facilitating the association of these structural elements with biosynthetic and functional processes. Another effort, GlycoRDF, is a proposed standard ontology for glycan and related metadata using Resource Description Framework (RDF) to provide consistent terminologies for representing glycan sequences, related biological sources, publications, and experimental data on the Semantic Web. GlycoRDF is now being used by several glycomics database providers, to enable large-scale integration of diverse data collections in the glycosciences.'
 'Glycoinformatics enables the development of streamlined data reporting and sharing standards. For glycoproteins, the structures of both the glycan and the protein must be represented along with the relationship between these two entities (e.g., the identity of the glycosylation site and the fraction of the protein molecules that bear the glycan in each physiological state). To make this information relevant, the scientist often requires explicit information about the biological context (e.g., tissue and disease state) corresponding to the specified glycosylation or describing how the glycosylation changes when the tissue or cell is perturbed. The glycoscience community is building on the efforts of the Human Proteome Organization-Proteomics Standards Initiative (HUPO-PSI) to develop similar resources that describe the information that should be included when reporting experimental data, with digital data exchange formats to facilitate communication of structural and biological information and controlled vocabularies that allow the data that is exchanged to be unambiguously interpreted.'
 'The future of current endeavors in glyco-related informatics lies in the consolidation of international consortia. The small size of the glycoscience community has prompted several cooperative initiatives across all continents for representing and collecting glycomics data (as described above). To favor interactions between these complementary initiatives, the international Glycome Informatics Consortium (GLIC) was founded in 2015 to provide and maintain a centralized software resource for developers, thus enabling cooperative database and tool development. Also in 2015, a Glycomics section was established on the Swiss Institute For Bioinformatics (SIB) Expasy proteomics resource portal, and glycoprotein entries in UniProtKB have been also linked to glycan structural information, when known, in GlyGen and GlyConnect. In addition, the U.S. National Institutes of Health (NIH) as part of the Common Fund Glycoscience Program is now focused on creating new methodologies and resources to study glycans that include the development of data integration and analysis tools.'
 'Because a common vocabulary, or ontology, would be used across different publications in different websites (i.e., journals), the terminology used to encapsulate the semantics is preserved. Therefore, the Semantic Web becomes a virtual online database in which all linked data can be queried directly, without any need to transfer large amounts of data. Moreover, with such data available on the Semantic Web, machine learning technologies allow computers to make inferences based on the data available, just as a researcher would think of new hypotheses. The essential accurate interpretation of glycoanalytical data for glycan structure determination requires well-documented metadata, including the parameters used to acquire and process the raw data along with supporting biological source information for the sample being analyzed. The MIRAGE initiative was formed to develop guidelines for researchers to report the qualitative and quantitative results obtained by diverse types of glycomics analyses (e.g., chromatography, mass spectrometry, and glycan/lectin arrays).'
 'These unique identifiers, however, provide the semantic foundation required for individuals or databases to effectively communicate by recording the identifier of the structures they have characterized. Many advances in glyco-related databases and informatics tools development have focused on the interpretation and storage of analytical data, including liquid chromatography (LC), capillary electrophoresis (CE), interaction arrays, mass spectrometry (MS), and three-dimensional (3D)/modeling/nuclear magnetic resonance (NMR) (Table 52.2). Glycoinformatics data analysis software tools  Most efforts so far have focused on tools that assist the interpretation of MS data. A number of commercial and publicly accessible software are now available. Introduced in 1999, the widely used GlycoMod was the first glycoinformatics Web-based tool to be released in this context, and its function is to suggest possible glycan compositions from experimental mass values of either free or derivatized glycans or glycopeptides.'
 'For example, the Minimum Information Required for A Glycomics Experiment (MIRAGE) initiative is modeled after the well-established Minimum Information for A Proteomics Experiment (MIAPE) initiative of HUPO-PSI. These standards are required for the emergence of glycobiology as a mature discipline that is accessible to the scientific community as a whole. A major component of databases is the standardized depiction of the glycan structures. The Symbol Nomenclature for Glycans (SNFG) (see Online Appendix 1B) universal symbol nomenclature for the graphical representation of glycan structures has been developed to facilitate such standardization and is used throughout this book. Online Appendix 52A lists current databases and journal publishers that have thus far accepted or strongly recommend the use of this nomenclature. A variety of drawing software has been developed to simplify the usage of the SNFG (Online Appendix 1B).'
 'When linked to other relational databases, glycoscience data may then be integrated with related genomic, transcriptomic, proteomic, lipidomic, and metabolomic information. This chapter describes the current status of glycoinformatics databases and software development, with focus on efforts to bridge the gap between glycan structure and function. Informatics plays a critical role in virtually every aspect of modern biology. Our ability to compile the genomes of diverse organisms made it possible to predict the protein sequences. These sequences are widely used as the basis to predict protein function and to enable proteomic analyses. Proteomic studies in turn advance biological research by providing experimental evidence that supports the expression of specific proteins, in particular tissues or cell types (Figure 52.1). The informatics resources that support these endeavors are facilitated by the fact that genes and the translated polypeptides (i.e., proteins) are typically linear molecules whose sequences are readily specified as a series of characters.']","Another effort, GlycoRDF, is a proposed standard ontology for glycan and related metadata using Resource Description Framework (RDF) to provide consistent terminologies for representing glycan sequences, related biological sources, publications, and experimental data on the Semantic Web. GlycoRDF is now being used by several glycomics database providers, to enable large-scale integration of diverse data collections in the glycosciences.","Another effort, GlycoRDF, is a proposed standard ontology for glycan and related metadata using Resource Description Framework (RDF) to provide consistent terminologies for representing glycan sequences, related biological sources, publications, and experimental data on the Semantic Web. GlycoRDF is now being used by several glycomics database providers, to enable large-scale integration of diverse data collections in the glycosciences. For example, GlyTouCan uses the GlycoRDF ontology to represent the registered data such that other data resources also using this ontology can be integrated and queried by glycan structure. Different information resources (e.g., databases and publications) can reference these identifiers, thus facilitating identification and interpretation of diverse but complementary data sets that embody information about specific glycan structures. The Semantic Web is a new technology that provides a framework for making data available directly on the Internet, provided with semantics, such that inferences can be made automatically based on the data. For example, a researcher often refers to various publications to derive a new hypothesis to test. Using the Semantic Web, the data in the publications would be formatted in such a way (using predefined vocabulary, or ontologies) that the meaning behind the data is preserved in a computable form, on the Web. Because a common vocabulary, or ontology, would be used across different publications in different websites (i.e., journals), the terminology used to encapsulate the semantics is preserved.",1.0,0.4964178989015261,0.8920235322676233,0.02702702702702703,0.6961904761765524,0.8333333333333334
"Complete the following paragraph: Pure glycans of defined structure are essential research tools in glycobiology. Unlike proteins and nucleic acids, which can be obtained in homogeneous forms by recombinant expression and polymerase chain reaction (PCR), respectively, glycans produced in biological systems are heterogeneous. Furthermore, the quantities that can be obtained from biological systems are often small. Chemical synthesis can be used to obtain homogeneous glycans in larger quantities than are available from most cellular production systems. Chemical synthesis can be further employed to incorporate glycans into homogeneous glycoproteins. This chapter summarizes the current state of the art in chemical methods to produce glycans.","['Chemical synthesis can be further employed to incorporate glycans into homogeneous glycoproteins. This chapter summarizes the current state of the art in chemical methods to produce glycans. Enzymes can be used together with chemical methods to prepare diverse glycans (Chapter 54). The structure of oligosaccharides render their synthesis more complicated than the synthesis of the other major classes of biomolecules: oligonucleotides and oligopeptides. Fundamental challenges of glycan synthesis are the requirement for modifying one specific hydroxyl group in the presence of many others, and control over the stereochemical outcome in the creation of a glycosidic linkage. Commonly, glycan synthesis is characterized by the manipulation of various protecting groups, chemical moieties that mask the hydroxyl groups and prevent them from reacting with other chemical reagents. Hydroxyl-protecting groups are selectively added and removed from glycan structures, allowing for chemical alteration of the exposed hydroxyl groups.'
 'NCBI Bookshelf. A service of the National Library of Medicine, National Institutes of Health. Varki A, Cummings RD, Esko JD, et al., editors. Essentials of Glycobiology [Internet]. 4th edition. Cold Spring Harbor (NY): Cold Spring Harbor Laboratory Press; 2022.  doi: 10.1101/glycobiology.4e.53 Peter H. Seeberger and Hermen S. Overkleeft. Pure glycans of defined structure are essential research tools in glycobiology. Unlike proteins and nucleic acids, which can be obtained in homogeneous forms by recombinant expression and polymerase chain reaction (PCR), respectively, glycans produced in biological systems are heterogeneous. Furthermore, the quantities that can be obtained from biological systems are often small. Chemical synthesis can be used to obtain homogeneous glycans in larger quantities than are available from most cellular production systems. Chemical synthesis can be further employed to incorporate glycans into homogeneous glycoproteins.'
 'Because of their stereochemistry and water solubility, organic synthesis of glycans has proven to be one of the most challenging areas of synthetic organic chemistry (Chapter 53). The combined use of purified glycosyltransferases with chemically synthesized glycan precursors has proven to be invaluable in the stereoselective synthesis of complex glycans (Chapter 54). Automated synthesis of glycans is rapidly becoming a reality, and even the synthesis of the most complex glycans, such as glycosaminoglycans, is becoming possible. In the past five years, major advances have been reported in both the automated chemical and the automated chemico-enzymatic synthesis of complex glycans. In the future, it seems likely that the synthesis of glycans will become nearly as facile and widely available as the synthesis of nucleic acids and proteins. It should be possible for biologists to easily obtain glycoconjugates that have homogeneously uniform glycans to further explore the structural and functional roles of the glycans.'
 'With the commercialization of AGA in which a set of common building blocks is combined on a solid phase resin, the synthesis process can be greatly accelerated. AGA has become an important part of carbohydrate synthesis as polysaccharides as long as 100-mers as well as glycosaminoglycans are now rapidly accessible in multimilligram quantities. The production of highly branched structures will become routine in the coming years. Still, for challenging targets, containing rare monosaccharides and 2-deoxy and 1,2-cis-linkages, improved methods for solution phase synthesis will have to be developed. These methods will greatly benefit from the advances in fundamental knowledge on the glycosylation reaction and will be aided by knowledge gathered in databases. In addition, enzymatic synthesis and combinations of chemical and enzymatic synthesis are important assets to procure large quantities of glycans. The authors acknowledge contributions to previous versions of this chapter by Nathaniel Finney and David Rabuka and appreciate helpful comments and suggestions from Martina Delbianco.'
 'The combination of organic synthesis and chemoenzymatic synthesis will allow the production of well-defined glycan arrays that contain the various binding epitopes for glycan-binding proteins. Recombinant glycosyltransferases will become common tools to generate specific glycans on glycoproteins and living cells, and these enzymes will greatly enhance the many studies that now rely on the use of lectins (Chapter 48), whose specificity is often not well-defined. Finally, the rapidly expanding analytical toolkit will be instrumental to decipher the regulatory mechanisms that mediate homeostasis of glycoconjugates at a cellular level. As with analytical methods, it is also important to “democratize” the approaches by developing simple methods for the average biologist working at the bench. In recent years, great advancements in the glycomic profiling of glycans from cells, tissues, or organisms have occurred.'
 'Mixtures of glycans need to be studied next, to mimic “clustered saccharide patches” that more closely mimic natural states. Significant progress has also been made in Systems Glycobiology by better integration of glycomics with genomics, transcriptomics, and proteomics. Our understanding as to how miRNAs and transcription factors regulate glycan expression has also improved in the last few years (Chapters 51 and 52). At the present time, the study of glycan structure/function relationships requires highly specialized expertise in synthetic and analytical chemistry. The inherent difficulty in studying glycans remains a major challenge preventing glycobiology—the study of glycan function—from entering mainstream conceptual frameworks of biology. In response to this challenge, strong emphasis has recently been placed on the development of facile technologies that will allow nonglycobiologists without specialized analytical chemistry skills to study glycans in a meaningful way.'
 'Less detailed information on structure may be sufficient to explore the biology of some glycans and can be obtained by simple techniques, such as the use of enzymes (endoglycosidases and exoglycosidases), lectins, and other glycan-binding proteins (Chapters 48 and 50), chemical modification or cleavage, metabolic radioactive labeling, antibodies, or cloned glycosyltransferases (Chapters 53 and 54). Glycosylation can also be perturbed in various ways, for example, by glycosylation inhibitors and primers (Chapters 55 and 56) and by genetic manipulation of glycosylation in intact cells and organisms (Chapter 49). Directed in vitro synthesis of glycans by chemical and enzymatic methods has also made great strides in recent years, providing many new tools for exploring glycobiology (Chapters 53, 54, and 57).']","The chapter provides an overview of the current state of the art in chemical methods for producing glycans. Chemical synthesis is crucial for obtaining homogeneous glycans in larger quantities compared to those produced in biological systems, which are often heterogeneous and limited in quantity. Additionally, chemical synthesis can be utilized to incorporate glycans into homogeneous glycoproteins, further advancing research in glycobiology.","Enzymes can be used together with chemical methods to prepare diverse glycans (Chapter 54). The structure of oligosaccharides render their synthesis more complicated than the synthesis of the other major classes of biomolecules: oligonucleotides and oligopeptides. Fundamental challenges of glycan synthesis are the requirement for modifying one specific hydroxyl group in the presence of many others, and control over the stereochemical outcome in the creation of a glycosidic linkage. Commonly, glycan synthesis is characterized by the manipulation of various protecting groups, chemical moieties that mask the hydroxyl groups and prevent them from reacting with other chemical reagents. Hydroxyl-protecting groups are selectively added and removed from glycan structures, allowing for chemical alteration of the exposed hydroxyl groups. Subsequently, in a typical glycan synthesis scheme, the exposed hydroxyl group serves as a point for further elaboration. The selective exposure of one hydroxyl group allows for regioselective addition of another saccharide unit. Synthetic schemes of this type are commonly applied to the generation of O- and N-linked glycans (see Chapters 9 and 10) as well as proteoglycans (see Chapter 17) and glycosphingolipids (see Chapter 11). The choice of protecting groups and the order of protecting group installation are essential for a successful synthetic route.",0.8,0.21530115324418922,0.7392610253610981,0.02127659574468085,0.9999999999833333,0.5555555555555556
Complete the following paragraph: A demonstration of an endo-hexosaminidase-derived glycosynthase in action is given by the synthesis of Man9GlcNAc2-glycopeptide 28 from a glycoprotein from HIV-1. The sequence of steps commences with homogeneous Man9GlcNAc2Asn 24 that can be prepared by exhaustive proteolytic digestion of soybean glycoproteins by pronase.,"['As a result, an intermediate oxazolinium ion intermediate is produced that after nucleophilic attack of water yields the hemiacetal with retention of configuration. Endo-hexosaminidases can be employed in transglycosylation reactions and, in mutant form, as glycosynthases. Glycosynthase mediated synthesis of homogeneous peptide N-glycans.  A demonstration of an endo-hexosaminidase-derived glycosynthase in action is given by the synthesis of Man9GlcNAc2-glycopeptide 28 from a glycoprotein from HIV-1. The sequence of steps commences with homogeneous Man9GlcNAc2Asn 24 that can be prepared by exhaustive proteolytic digestion of soybean glycoproteins by pronase.'
 'Wild-type endohexosaminidase, Endo-A, recognizes this high-mannose N-glycan and hydrolyses the GlcNAc-GlcNAc glycosidic linkage, to yield Man9GlcNAc 25. After peracetylation, treatment with trimethylsilyl bromide and borontrifluoride etherate, and global deprotection provided oxazolidinium ion 27. This compound is a good substrate for mutant (N175A) endohexosaminidase, endo-M, which was identified by site-directed mutagenesis as a putative glycosynthase activity. In the final step, the efficacy of the endo-M glycosynthase was demonstrated by the construction of high-mannose N-glycan 28 from 26 and 27. Enzymatic synthesis has proven to be a powerful methodology for the construction of complex glycans.'
 'The free amine in 23 can be condensed with a fatty acid or alternatively with a fluorescent reporter group. A combined glycosyltransferase/glycosynthase/chemical synthesis of a lysosphingolipid.  Glycosynthases derived from endoglycosidases have been used for the construction of structurally well-defined N-glycoproteins (Figure 54.8). Hexosaminidases, both exo- and endo-types, hydrolyze N-acetylglucosamine-containing glycosidic linkages with retention of the anomeric configuration. In contrast to most other retaining glycosidases, some retaining hexosaminidases do not employ an enzyme active site nucleophile in the nucleophilic displacement of the aglycon, but rather utilize the N-acetyl group in the substrate for this purpose (Figure 54.8, insert).'
 'Glycosyltransferase-mediated synthesis of ganglio-oligosaccharides.  The synthesis of GalNAc-GD1a heptasaccharide 7 equipped with a biotin at the reducing end (replacing the sphingolipids present in the natural product) was accomplished by submitting synthetic lactoside 6 to the consecutive action of four glycosyltransferases, one of which (α-2,3-SiaT) was employed twice (Figure 54.3). By using this method with various donor sugar nucleotides and glycosyltransferases, a comprehensive series of glycosphingolipid glycans and their analogs have been obtained. The methodology, especially with respect to enzymatic sialic acid introduction, is competitive when compared to chemical gangliosides synthesis. Chemoenzymatic synthesis of a library of mammalian N-glycans.'
 'Chemoenzymatic synthesis of a library of mammalian N-glycans.  The synthesis of complex, asymmetrically branched mammalian N-glycans was accomplished using combined chemical and glycosyltransferase-mediated enzymatic synthesis. As an example, decasaccharide 8 was prepared via contemporary solution phase chemical oligosaccharide synthesis (see Chapter 53). The asymmetrically branched decasaccharide features two nonreducing galactopyranose moieties, one of which is introduced as the tetra-acetate (in bold) whereas the other is unprotected. Decasaccharide 8 is thus designed to allow for specific enzymatic sialylation of the unprotected galactose residue (Figure 54.4).'
 'Introduction of GlcNAcT-I (MGAT1) in the Golgi initiates complex N-glycan synthesis, and further addition of α3/6-mannosidase II (MAN2A1) and GlcNAcT-II (MGAT2) results in the biantennary GlcNAc2Man3GlcNAc2 N-glycan suitable for appending galactose and sialic acid by further engineering. Some yeast species, including Pichia pastoris, do not contain UDP-Gal, and all yeast lack the native ability to synthesize CMP-Neu5Ac, so considerable engineering with introduction of multiple genes is required to obtain mature complex N-glycans. Although the engineering appears simple in silico, considerable efforts have been devoted to identifying optimal chimeric gene constructs with respect to both catalytic efficiency and ER/Golgi targeting.'
 'Upon completion of the glycan assembly, the fully protected oligosaccharide is removed from the solid support by cross metathesis and subsequent removal of all protecting groups by treatment with strong base and hydrogenolysis. More complex polysaccharides are accessible by block couplings of polysaccharides prepared by AGA. Two polysaccharide blocks, linear 30-mer α-(1-6) polymannoside 21 prepared by AGA from mannose building block 12 and branched 31-mer polymannoside 23 prepared by AGA using 12 and differentially protected mannose building block 22 for the branching positions were unified in a 31+30+30+30+30 coupling to create branched 151-mer 24 that was deprotected to furnish 25 (Figure 53.5). Synthesis of a 151-mer polymannoside by block coupling of polymannosides prepared by automated glycan assembly (AGA).']","The sequence of steps commences with homogeneous Man9GlcNAc2Asn 24 that can be prepared by exhaustive proteolytic digestion of soybean glycoproteins by pronase. This is followed by the hydrolysis of the GlcNAc-GlcNAc glycosidic linkage by wild-type endohexosaminidase, Endo-A, to yield Man9GlcNAc 25. After peracetylation, treatment with trimethylsilyl bromide and borontrifluoride etherate, and global deprotection provided oxazolidinium ion 27. This compound is a good substrate for mutant (N175A) endohexosaminidase, endo-M, which was identified by site-directed mutagenesis as a putative glycosynthase activity. In the final step, the efficacy of the endo-M glycosynthase was demonstrated by the construction of high-mannose N-glycan 28 from 26 and 27.","Wild-type endohexosaminidase, Endo-A, recognizes this high-mannose N-glycan and hydrolyses the GlcNAc-GlcNAc glycosidic linkage, to yield Man9GlcNAc 25. After peracetylation, treatment with trimethylsilyl bromide and borontrifluoride etherate, and global deprotection provided oxazolidinium ion 27. This compound is a good substrate for mutant (N175A) endohexosaminidase, endo-M, which was identified by site-directed mutagenesis as a putative glycosynthase activity. In the final step, the efficacy of the endo-M glycosynthase was demonstrated by the construction of high-mannose N-glycan 28 from 26 and 27. Enzymatic synthesis has proven to be a powerful methodology for the construction of complex glycans.",1.0,0.6452166902107109,0.9263109937453318,0.03125,0.9999999999857143,1.0
"Complete the following paragraph: Crystal structures for other sialidases have allowed the design of species-specific analogs. This rational approach to inhibitor design holds great potential, not only for neuraminidase inhibitors, but also, as described above, for O-GlcNAcase and OGT inhibitors. These examples illustrate how structure can guide design of carbohydrate-based inhibitors as well as heterocyclic inhibitors that have been more commonly advanced as drugs.","['This rational approach to inhibitor design holds great potential, not only for neuraminidase inhibitors, but also, as described above, for O-GlcNAcase and OGT inhibitors. These examples illustrate how structure can guide design of carbohydrate-based inhibitors as well as heterocyclic inhibitors that have been more commonly advanced as drugs. These advances have stimulated greater interest into influenza neuraminidase as well as the four human neuraminidases, which have poorly understood physiological roles. A major challenge associated with viral neuraminidase inhibitors—most strikingly, Tamiflu—is the rapid development of mutations that confer resistance. An alternative approach to circumvent this problem has been to develop mechanism-based inhibitors that covalently inhibit the enzyme. One example, FaxGuDFSA, has a fluoride leaving group, the displacement of which by the neuraminidase forms a glycosyl–enzyme intermediate. This intermediate has an appreciable half-life because the electronegative fluorine destabilizes the oxocarbenium ion-like transition state that leads to its breakdown.'
 'The crystal structure for influenza neuraminidase was obtained in 1983, and many other enzymes have since been characterized from other sources. Even before the crystal structure had been obtained, a neuraminidase inhibitor was designed by assuming that the hydrolysis reaction involved an oxocarbenium ion–like transition state with significant positive charge accumulation at the anomeric center. This would result in C-2 and C-3 adopting a planar configuration, and therefore compounds that mimicked this geometry were hoped to have inhibitory activity. Indeed, Neu5Ac-2-ene (DANA; Figure 55.6) has a micromolar Ki value. Interestingly, this compound inhibits most sialidases, but does not inhibit the trypanosome trans-sialidase and only weakly bacterial sialidases. Structure of neuraminidase inhibitors.'
 'Next-generation analogs of Relenza including the close derivative laninamivir as well as the guanidinium-containing peramivir have also been developed. The presence of the guanidinium group requires these drugs to be either inhaled or injected. Subsequent studies focused on dispensing this functionality. Replacement of the pyranose ring with a cyclohexene to mimic the planar ring of the proposed intermediate in hydrolysis, protecting the carboxylate as an ester that is hydrolyzed after ingestion, and replacing the guanidinium with an amine led to an orally active, widely used analog, the anti-influenza drug Tamiflu (Figure 55.6; Chapter 57). Crystal structures for other sialidases have allowed the design of species-specific analogs. This rational approach to inhibitor design holds great potential, not only for neuraminidase inhibitors, but also, as described above, for O-GlcNAcase and OGT inhibitors.'
 'These enzymes provide excellent examples of successful rational design and medicinal chemistry efforts directed to the development of glycoside hydrolase and glycosyltransferase inhibitors. Alloxan and streptozotocin affect O-GlcNAc addition, but these compounds lack specificity. The first potentially useful OGT inhibitor (OSMI-1; Figure 55.3) was obtained by screening chemical libraries for compounds that displaced a fluorescent derivative of the donor sugar, UDP-GlcNAc. Structure-guided medicinal chemistry led to quinoline-containing ester (OSMI-4), which is a high-quality OGT inhibitor that is effective in cells. The active compounds do not block other N-acetylglucosamine addition reactions—for example, one involved in formation of the polysaccharide backbone of bacterial peptidoglycan (Chapter 21). In addition, 5SGlcNAc is another inhibitor of OGT that acts as a metabolic precursor leading to formation of UDP-5SGlcNAc.'
 'A rationally designed glucoimidazole, GlcNAcstatin, also potently inhibits O-GlcNAcase with good selectivity over HexA and HexB. These compounds inhibit the enzyme in cells and tissues, and Thiamet-G, in particular, has been used in animal models, providing new tools to study the function of O-GlcNAc. Use of these compounds has uncovered the potential of O-GlcNAcase inhibitors in various neurodegenerative diseases, which has spurred industrial pharmaceutical interest that has led to OGA inhibitors, such as the Thiamet-G analog MK-8719 (Figure 55.3), advancing into Phase I clinical trials. Noncarbohydrate O-GlcNAcase inhibitors have also been uncovered, and highly potent brain permeable analogs have been used as positron emission tomography agents to examine the inhibition and distribution of O-GlcNAcase in human brain.'
 'Structure of neuraminidase inhibitors. Chemical structure of sialic acid (Neu5Ac, 2-deoxy-2,3-dehydro-N-acetyl neuraminic acid), DANA; 4-amino-DANA; 4-guanidino-DANA (Relenza, zanamivir); (3R, 4R, 5S)-4-acetamido-5-amino-3-(1-ethylpropoxyl)-1-cyclohexane-1-carboxylic (more...) A visual inspection of the X-ray structure of influenza neuraminidase with DANA bound showed that two glutamate residues lined a pocket near carbon 4 of the sialic acid analog. The pocket is fairly open, suggesting that a bulkier substituent at this position might be tolerated.'
 'Such reagents are drug candidates for treating trypanosomiasis, which is endemic in sub-Saharan regions of Africa. Additional examples of chain terminators have been reported. For example, fluorinated sugar nucleotides (Figure 55.1) are incorporated into growing oligosaccharides by carbohydrate polymerases, but the resulting products lack the hydroxyl group to enable further polymerization. The increasing number of X-ray crystallographic and cryo-EM investigations of carbohydrate processing enzymes has provided structural information that has facilitated the rational design of new inhibitors, often with very high potency. These compounds have been used as research tools and some have also advanced to clinically used drugs. Studies of influenza neuraminidase exemplify the power of rationally designed drugs that have successfully been marketed as drugs. The crystal structure for influenza neuraminidase was obtained in 1983, and many other enzymes have since been characterized from other sources.']","The rational approach to inhibitor design, guided by crystal structures for other sialidases, has shown great potential in developing species-specific analogs. This strategy is not limited to neuraminidase inhibitors but also extends to O-GlcNAcase and OGT inhibitors. The design process demonstrates how the structure of enzymes can inform the development of carbohydrate-based inhibitors and heterocyclic inhibitors, which are frequently utilized in drug development.","These advances have stimulated greater interest into influenza neuraminidase as well as the four human neuraminidases, which have poorly understood physiological roles. A major challenge associated with viral neuraminidase inhibitors—most strikingly, Tamiflu—is the rapid development of mutations that confer resistance. An alternative approach to circumvent this problem has been to develop mechanism-based inhibitors that covalently inhibit the enzyme. One example, FaxGuDFSA, has a fluoride leaving group, the displacement of which by the neuraminidase forms a glycosyl–enzyme intermediate. This intermediate has an appreciable half-life because the electronegative fluorine destabilizes the oxocarbenium ion-like transition state that leads to its breakdown.",1.0,0.6024804276268604,0.6099179694508036,0.05128205128205128,0.8761904761729524,1.0
"Complete the following paragraph: Another type of N-glycosylation found in γ-proteobacteria involves a cytosolic N-glycosyltransferase (NGT) that targets the N-X-S/T acceptor sequence motif recognized by mammalian OST (Chapter 9). NGT transfers a single monosaccharide (e.g., Glc) from an activated sugar nucleotide donor, with loose donor substrate specificity that includes both UDP and GDP sugar nucleotides. This provides an entirely new approach to engineering alternate types of N-glycosylation.","['Bacterial N-linked glycosylation is being exploited as an alternative method for glycoconjugate vaccine production, and vaccines against both Gram-negative and Gram-positive bacteria have been developed. Another type of N-glycosylation found in γ-proteobacteria involves a cytosolic N-glycosyltransferase (NGT) that targets the N-X-S/T acceptor sequence motif recognized by mammalian OST (Chapter 9). NGT transfers a single monosaccharide (e.g., Glc) from an activated sugar nucleotide donor, with loose donor substrate specificity that includes both UDP and GDP sugar nucleotides. This provides an entirely new approach to engineering alternate types of N-glycosylation.'
 'The soluble GTs (NGTs) required for N-glycosylation in these organisms are also completely unrelated to the conventional STT3-orthologous OTases, yet prefer the eukaryotic sequon, N-X-S/T. H. influenzae N-glycosylates its autotransporter adhesion HMW1 with single glucose and galactose residues. In contrast, Shewanella oneidensis, Pseudomonas aeruginosa, and N. meningitidis add rhamnose to Arg32 of their polyproline specific elongation factor to rescue stalled ribosomes. In addition to N-glycosylation, bacteria possess both canonical and noncanonical pathways for O-glycosylation.'
 '(B) Complex (c) glycosylation in the cytoplasm by O-GlcNAc transferases (GTs) that extend the first sugar. (C) Cytoplasmic monoglycosylation (more...) Examples of nuclear or cytoplasmic glycosylation events  Highly conserved homologs of OGT and OFT are found in numerous bacterial genomes, although studies of their functional roles are essentially nonexistent. An example of bacterial monoglycosylation that leads to a known function comes from the EF-P protein, the bacterial homolog of eukaryotic elongation initiation factor 5a. In some bacteria, EF-P suppresses translational stalling by a mechanism that involves oxidation of a critical lysyl residue, and its eukaryotic ortholog is regulated by hypusylation.'
 'Introduction of GalNAc residues has been used for postexpression enzymatic addition of polyethylene glycol (PEG)-derivatized sialic acids to enhance the therapeutic properties of protein drugs. Other bacteria possess a protein O-glycosylation mechanism that is unlike the stepwise biosynthesis of O-glycans in eukaryotes (Chapter 10), in that preassembled undecaprenol-PP-linked oligosaccharides are transferred en bloc to proteins by several OSTs with relaxed donor substrate specificities and poorly understood acceptor substrate specificities. Engineering of this endogenous glycosylation machinery has been used for en bloc transfer of human O-GalNAc glycans (Tn, T, sialyl-Tn, and sialyl-T antigens) onto acceptor proteins (Table 56.1). Yeast natively produce N-glycans and O-mannosyl glycans on diverse glycoproteins.'
 'The glycosyltransferases that transfer sugar directly to the polypeptide chain of a protein or glycoprotein recognize their acceptor substrates in a number of different ways. All eukaryotic N-glycans are initiated by oligosaccharyltransferase (OST), generally an ER-resident multisubunit enzyme that transfers en bloc Glc3Man9GlcNAc2 to the side chain of asparagine residues in the sequence motif Asn-X-Ser/Thr (where X can be any amino acid except proline; Chapter 9). In contrast, the polypeptide GalNAc transferases, responsible for the initiation of mucin-type O-glycans, act after the protein has been folded and transported to the Golgi (Chapter 10).'
 'The STT3A complex (OSTA), closely associated with the translocon, contains the KCP2 and DC2 subunits, whereas the STT3B complex (OSTB) that has either MAGT1 or TUSC3 (homologs of yeast Ost3p/Ost6p) glycosylates polypeptides posttranslationally after their translocation into the ER. On binding to the catalytic STT3 subunit, the client peptide adopts a 180° turn, making polypeptide folding a competing reaction for N-glycosylation. Indeed, the thioredoxin subunits of the OST complex (Ost3p/Ost6p; MAGT1/TUSC1) modulate the oxidative folding of the client polypeptide, thereby extending the polypeptide substrate range of OST. As of February 2021, the UniProt database reports 1911 N-glycosylation sites in yeast and 13,648 in murine glycoproteins.'
 'The OST of C. jejuni, PglB, is a single polypeptide related to the catalytic STT3 subunits of the multiprotein OST complex of eukaryotes (Chapter 9). PglB shows a more restricted acceptor sequence motif than the eukaryotic N-X-S/T, with requirement of an acidic residue (D/EXNXS/T, in which X cannot be P) (Chapter 21). This places some restrictions on the usefulness of engineering human-like N-glycans, because most N-glycan sites in mammalian proteins do not conform to this extended consensus sequence. PglBs from other species, or mutants evolved by adaptive evolution, have been identified to address this problem, but further improvements are needed. Importantly, PglB has rather relaxed donor substrate specificity. Although bacterial lipid-linked oligosaccharides are distinct from those in eukaryotes, PglB can use mammalian-type lipid-linked oligosaccharides as donors.']","This type of N-glycosylation in γ-proteobacteria, facilitated by the cytosolic N-glycosyltransferase (NGT), utilizes the N-X-S/T acceptor sequence motif recognized by mammalian OST. NGT transfers a single monosaccharide, such as Glc, from an activated sugar nucleotide donor. Notably, NGT exhibits loose donor substrate specificity, accommodating both UDP and GDP sugar nucleotides. This unique mechanism offers a novel avenue for engineering diverse forms of N-glycosylation.","Engineering this pathway in bacteria resulted in the assembly of glycan motifs including α1-3-galactose epitopes as well as fucosylated and sialylated lactose or poly-N-acetyllactosamine (LacNAc) units primed by Glc residues on glycoproteins (Table 56.1). Although most bacteria do not have the capacity for sialylation, there are exceptions (Chapters 15 and 21). Bacterial genes for CMP-sialic acid synthesis and for sialyltransferases with specificities similar to those in mammals have been introduced with plasmids or integrated into the genome of host bacteria cells, enabling the production of sialylated N- and O-glycoproteins. Some bacteria have processive O-glycosylation pathways controlled by glycosyltransferases using activated sugar donors. These pathways inspired the engineering of human O-glycosylation reactions in E. coli. By introducing mammalian polypeptide GalNAc-transferase genes and a UDP-Glc/GlcNAc 4-epimerase, O-GalNAc protein glycosylation (Chapter 10) has been achieved. Further introduction of a β1-3-galactosyltransferase enabled biosynthesis of core 1 O-glycans (T antigen) on cytoplasmic acceptor proteins. Introduction of GalNAc residues has been used for postexpression enzymatic addition of polyethylene glycol (PEG)-derivatized sialic acids to enhance the therapeutic properties of protein drugs.",1.0,0.8266397039179704,0.674151543484174,0.06896551724137931,0.6961904761765524,0.0
"Complete the following paragraph: The challenge for enzyme replacement therapy is to get the enzymes targeted properly to lysosomes, where they can degrade accumulated substrate. Enzyme replacement therapy for Gaucher's disease targets the lysosomes of macrophages via the cell-surface mannose receptor (see Chapter 31). The four recombinant enzyme products imiglucerase (approved in 1995), velaglucerase (approved in 2010), taliglucerase alfa (Elelyso, approved in 2012), and eliglustat (Cerdelga, approved in 2014) are marketed to treat Gaucher's disease.","[""Enzyme replacement therapy for Gaucher's disease targets the lysosomes of macrophages via the cell-surface mannose receptor (see Chapter 31). The four recombinant enzyme products imiglucerase (approved in 1995), velaglucerase (approved in 2010), taliglucerase alfa (Elelyso, approved in 2012), and eliglustat (Cerdelga, approved in 2014) are marketed to treat Gaucher's disease. The success of glucocerebrosidase treatment stimulated the development of lysosomal enzymes for treatment of other lysosomal storage diseases such as Fabry's disease, mucopolysaccharidoses type I, II, and VI, and Pompe's disease. The replacement therapies clearly have beneficial effects and prolong life but are extremely expensive. A third approach for treating lysosomal storage disorders takes advantage of the fact that some genetic defects lead to misfolding of the encoded enzyme in the endoplasmic reticulum (ER).""
 ""In use now for many years, the added enzyme consistently improves patients’ clinical features with minimal side effects. The cost of treatment is high, and high doses are no more effective than lower doses for improving visceral and hematological pathologies. The proven effectiveness makes glucocerebrosidase the favorite therapy for these patients, but terminal mannose residues cannot be used to target the enzyme to other cells or organs or to enable treatment of other lysosomal storage disorders. Insufficient infused enzyme crosses the blood–brain barrier thus, the enzyme (Cerezyme) works very well for type I disease without neurological involvement but not for the less common Gaucher's with neurological involvement. In addition, patients sometimes develop antibodies against the injected human protein. ERT trials with other recombinant lysosomal enzymes have progressed. Enzyme replacement therapy is available for Fabry disease, Pompe disease, and mucopolysaccharidosis types I, II, IVA, and VI and is under development for others.""
 ""Another approach for treating lysosomal storage disorders is enzyme replacement therapy. Unlike most therapeutic glycoproteins that interact with target receptors on the surface of cells, lysosomal enzymes developed for replacement therapy must be delivered intracellularly to lysosomes, their site of action. During the normal biosynthesis of lysosomal enzymes, their N-glycans become modified with mannose 6-phosphate (Man-6-P) residues, which target them to lysosomes using Man-6-P receptors (see Chapter 30). The challenge for enzyme replacement therapy is to get the enzymes targeted properly to lysosomes, where they can degrade accumulated substrate. Enzyme replacement therapy for Gaucher's disease targets the lysosomes of macrophages via the cell-surface mannose receptor (see Chapter 31).""
 'Combination therapy using ERT and a pharmacological chaperone to stabilize the therapeutic enzyme in the bloodstream is being considered. Recombinant α-galactosidase for Fabry disease works well and recombinant α-L-iduronidase for MPS I works very well with the intermediate severity form (Hurler–Scheie), but its effect is unclear for patients with the more common neurological form (Hurler syndrome). HSCT, presumably providing α-L-iduronidase in CNS from the donor-derived microglia, is effective to MPS I. Recombinant N-acetylgalactosamine-4-sulfatase (arylsulfatase B; Naglazyme) was approved for MPS VI, as was α-glucosidase (Myozyme) for treating Pompe disease patients. Iduronic acid-2-sulfatase (Elaprase) is approved for treating Hunter syndrome. These results clearly validate this approach.'
 ""The overall increase in activity is small, but it can have significant clinical benefits. Clinical trials are in progress for treating Fabry disease, Gaucher type I, and Pompe disease, whereas preclinical trials are being performed for GM1 and GM2 gangliosidosis. A potential problem is that some inhibitors may not cross the blood–brain barrier, limiting their effectiveness in the central nervous system (CNS). The advent of high-throughput screening methods and large chemical libraries increase the potential of this approach. In addition, allosteric site binders can be selected that remain bound to the enzyme, and any successful compound could be used in combination with ERT to further enhance activity. ERT has been quite successful for treating Gaucher's disease. Injection of glucocerebrosidase carrying mannose-terminated N-glycans targets the enzyme to the macrophage/monocytes, which are the primary sites of substrate accumulation. In use now for many years, the added enzyme consistently improves patients’ clinical features with minimal side effects.""
 'Enzyme replacement therapy has been successful in treating Gaucher disease, and drugs to block GlcCer synthesis (“substrate reduction therapy”) are in clinical use (Chapter 55). Another example, Tay–Sachs disease, is caused by mutations in a β-hexosaminidase and results in the buildup of GM2, culminating in irreversible fatal deterioration of brain function. Unfortunately, enzyme replacement delivery to the brain has not yet been successfully developed, which is also a problem for long-term treatment of Gaucher disease. Glycosphingolipid storage and related diseases are considered more extensively in Chapter 44. Anti-GSL antibodies are involved in certain autoimmune diseases (Chapter 46). Some forms of Guillain–Barré syndrome, the most common form of paralytic disease worldwide, clearly involve autoantibodies against gangliosides. One form of Guillain–Barré syndrome occurs subsequent to infection with particular strains of the common diarrheal bacterial agent Campylobacter jejuni.'
 'As described in Chapter 44, there are many genetic disorders in glycan degradation that result from decreased activity of a given lysosomal enzyme. Some of these enzymes that are targeted to lysosomes via the M6P pathway have been prepared in large quantities as recombinant soluble proteins and used in enzyme replacement therapy. To date, the benefits have been variable but less than optimal. There are a number of potential reasons for this. First, some of the preparations may not contain the physiologic complement of the phosphomannosyl recognition marker. It is reasonable to suggest that a greater M6P content may improve the efficacy of enzyme replacement in these patients. This has been shown to be the case in mouse and dog model systems. However, even with fully phosphorylated enzymes there may be obstacles that are difficult to overcome. For example, some cell types in the body may not express adequate levels of the CI-MPR on their surfaces to endocytose sufficient enzyme to restore normal lysosomal function.']","The challenge for enzyme replacement therapy is to get the enzymes targeted properly to lysosomes, where they can degrade accumulated substrate. Enzyme replacement therapy for Gaucher's disease targets the lysosomes of macrophages via the cell-surface mannose receptor (see Chapter 31). The four recombinant enzyme products imiglucerase (approved in 1995), velaglucerase (approved in 2010), taliglucerase alfa (Elelyso, approved in 2012), and eliglustat (Cerdelga, approved in 2014) are marketed to treat Gaucher's disease. The success of glucocerebrosidase treatment stimulated the development of lysosomal enzymes for treatment of other lysosomal storage diseases such as Fabry's disease, mucopolysaccharidoses type I, II, and VI, and Pompe's disease.","The success of glucocerebrosidase treatment stimulated the development of lysosomal enzymes for treatment of other lysosomal storage diseases such as Fabry's disease, mucopolysaccharidoses type I, II, and VI, and Pompe's disease. The replacement therapies clearly have beneficial effects and prolong life but are extremely expensive. A third approach for treating lysosomal storage disorders takes advantage of the fact that some genetic defects lead to misfolding of the encoded enzyme in the endoplasmic reticulum (ER). Low-molecular-weight competitive inhibitors of some of these enzymes can act as “chaperones,” which stabilize the folded enzyme in the ER and effectively rescue the mutation and increase the steady state concentration of active enzyme in the lysosome. The dose of the inhibitor must be carefully adjusted to ensure that the inhibitory effects on enzyme function do not overshadow beneficial effects on folding. Only a low level of enzyme restoration is needed to significantly reduce the accumulation of undigested glycan substrates, indicating that lysosomal hydrolases are normally present in large catalytic excess.",1.0,0.630163168628794,0.7745320213848574,0.06521739130434782,0.733333333315,0.75
"Complete the following paragraph: The elucidation of molecular mechanisms requires tools that mimic the presentation of glycans on the cell surface. Individual protein–carbohydrate interactions are often of low affinity and broad specificity, complicating the description of glycan function. Nature enhances specificity by utilizing multivalent interactions.","['Individual protein–carbohydrate interactions are often of low affinity and broad specificity, complicating the description of glycan function. Nature enhances specificity by utilizing multivalent interactions. The number and the presentation of carbohydrate residues on a biomolecule are major determinants of binding avidity of ligands to cell-surface receptors. The transition from monovalent to multivalent is often associated with a larger variation in affinity/avidity, suggesting a “thresholding” effect, and in some cases cooperativity. To elucidate those mechanisms, glycans have to be displayed in a scenario closer to that found on the cellular scale. “Nanotechnology” moves from the angstrom to the nanometer range (from ∼10−10 to ∼10−7 m), offering the tools to create, manipulate, and characterize structures on those scales. Large glycoconjugates bearing multiple copies of a carbohydrate on various scaffolds, such as glycodendrimers or glycopolymers, have been generated to probe carbohydrate–protein interactions.'
 'Given the central role of multivalency in glycobiology, glycosylated nanomaterials are interesting probes to study cellular, tissue, and organismal interactions. Nanomaterials purely composed of glycans, such as polysaccharide nanoparticles or nanocrystals, are interesting imaging agents, drug delivery systems, and tissue scaffolds that illustrate the potential of glycans in nanotechnology. Glycoproteins and glycolipids are natural glycoconjugates that take part in cellular communication, inflammation, and immune response using carbohydrate–protein or carbohydrate–carbohydrate interactions. Certain glycan sequences are characteristic markers of diseases such as cancer, asthma, and diabetes. The elucidation of molecular mechanisms requires tools that mimic the presentation of glycans on the cell surface. Individual protein–carbohydrate interactions are often of low affinity and broad specificity, complicating the description of glycan function. Nature enhances specificity by utilizing multivalent interactions.'
 'Carbohydrate–carbohydrate interactions can also have specific biological roles. A classic example is the species-specific interaction between marine sponges, mediated via homotypic binding of glycans on a large cell-surface glycoprotein, perhaps indicating the critical importance of glycosylation for the evolution of multicellularity. Another example is the compaction of the mouse embryo at the morula stage, which seems to be facilitated by a Lewis x–Lewis x interaction. The single-site affinities of such interactions are often weak and thus difficult to measure. However, if the molecules are present in very high copy numbers, a large number of relatively low-affinity interactions can collaborate to produce a high-avidity “Velcro” effect that is sufficient to mediate biologically relevant interactions. Glycosylation can also modulate interactions of proteins with one another. Some growth factor receptors acquire their binding abilities in a glycosylation-dependent manner while in transit through the Golgi apparatus.'
 'Protein subunits are shown as gray surfaces and glycans are shown as ball and sticks (PDB entry 5FUU). Carbohydrates are colored green and pale green (β- (more...) We can thus look forward to correlating unprecedented structural insights on protein glycosylation and complex carbohydrate interactions with biochemical, functional, spectroscopic, and in silico approaches in the coming years. Experimental structural information obtained by crystallographic, NMR, and cryo-EM methods have clearly been of value in building an understanding of the molecular interactions that lead to glycan recognition by proteins. However, systems in which interactions are of interest far outnumber the cases in which these methods can be applied. Most crystal structures contain either small ligands or yield useful electron densities for only parts of larger ligands. The same is true to a certain extent for cryo-EM structures. NMR methods, although giving detailed information on bound ligand geometries, frequently give only qualitative information on parts of ligands or protein that are in intimate contact with each other.'
 'Intrinsically low site affinity can sometimes be overcome using a multivalent form of the cognate glycan. Finally, especially when studying complex multicellular systems, introduced glycans could be cross-recognized by other known or unknown binding proteins, giving a confusing phenotypic readout. A powerful approach is the use of degradative enzymes known to be highly specific for a particular glycan sequence. Many such specific enzymes can be obtained from microbial pathogens. The advantage of this approach lies in eliminating certain structures selectively after normal synthesis has been completed rather than interfering with the biosynthetic cellular machinery. Thus, for example, sialidase treatment abolished lymphocyte binding to the high endothelial venules of lymph nodes and provided the first indication of endogenous ligands for L-selectin (Chapter 32); injection of endoneuraminidase into the developing retina suggested specific roles for polySias (Chapter 15); and injection of heparanase into developing embryos gave randomization of left–right axis formation (Chapter 17).'
 'Their relative activities, combined with cellular location, are essential to the proper balance of these processes and any alteration, including genetic mutation, can lead to disease in humans. Pathogens also depend on similar processes, and understanding such mechanisms can facilitate the design of selective inhibitors of pathogen enzymes. This is another area in which molecular docking can play a role. Structural studies of glycan–protein complexes usually require a stable system—not one that would continually convert substrates to products. Molecular docking can provide useful depictions of these reactive systems. A good example involves the glycosyltranferase, ST6Gal1. This is the enzyme that adds a sialic acid (typically Neu5Ac) to the galactose terminated branches of N-glycans by transferring Neu5Ac from its nucleotide-sugar donor, CMP-Neu5Ac, to an acceptor terminated with a Galβ1-4GlcNAc moiety (Chapter 6).'
 'As emphasized in previous chapters, the numbers of distinct glycans produced by various organisms are enormous, but at the same time, glycans lack the diversity in functional groups displayed by other molecules. To achieve specificity in glycan recognition, proteins rely as much on the stereospecific placement of glycan hydroxyl groups at chiral centers, use of different linkage sites, and extensive branching as they rely on specific modifications of hydroxyl groups by processes such as sulfation, phosphorylation, and esterification. This puts placement of various residues and functional groups in three dimensions at a premium. Building a three-dimensional picture of how recognition of glycans by proteins occurs is therefore essential if we are to understand how glycans are synthesized and recognized in the many physiological and pathological processes they control. It is also essential if we are to use knowledge of glycan recognition as a basis for the production of therapeutic agents that can control these processes in the event of disease. Building a structure depicting glycan recognition is not without its challenges.']","To address the challenges posed by the low affinity and broad specificity of individual protein-carbohydrate interactions, nature employs multivalent interactions to enhance specificity. This transition from monovalent to multivalent interactions can lead to a larger variation in affinity/avidity, indicating a ""thresholding"" effect and potential cooperativity. By displaying glycans in a scenario closer to their presentation on the cellular scale, researchers can better elucidate the molecular mechanisms underlying glycan function and interactions with proteins. Multivalency plays a central role in glycobiology, offering insights into cellular, tissue, and organismal interactions, and highlighting the importance of studying glycan-decorated nanomaterials to understand biological processes.","The number and the presentation of carbohydrate residues on a biomolecule are major determinants of binding avidity of ligands to cell-surface receptors. The transition from monovalent to multivalent is often associated with a larger variation in affinity/avidity, suggesting a “thresholding” effect, and in some cases cooperativity. To elucidate those mechanisms, glycans have to be displayed in a scenario closer to that found on the cellular scale. “Nanotechnology” moves from the angstrom to the nanometer range (from ∼10−10 to ∼10−7 m), offering the tools to create, manipulate, and characterize structures on those scales. Large glycoconjugates bearing multiple copies of a carbohydrate on various scaffolds, such as glycodendrimers or glycopolymers, have been generated to probe carbohydrate–protein interactions.",1.0,0.6080415762747867,0.8536632952125882,0.06382978723404255,0.9999999999857143,1.0
Complete the following paragraph: Synthetic or naturally derived oligosaccharides can also be covalently appended to polymer chains built from petroleum-based monomers. This gives rise to glycopolymers with architectures resembling those of glycoproteins or proteoglycans.,"['To this end, current research aims to further understand and use new reaction pathways that target chemical or enzymatic modifications to functionalize and/or alter specific locations on the polysaccharide and thereby generate regioselective functionalization. Synthetic or naturally derived oligosaccharides can also be covalently appended to polymer chains built from petroleum-based monomers. This gives rise to glycopolymers with architectures resembling those of glycoproteins or proteoglycans. Such materials have found increasing use as research tools to study the biological functions of glycans and are currently explored as biomaterials for drug delivery or as antifouling and antifreeze agents. Nanomaterials from plants and crustacean shells offer new materials for the development of biorenewable and biocompatible products. These nano-sized particles, consisting of bundled polymer chains, have properties and function that are different from the isolated polymer chains from which they are made.'
 'Structural polymers also exist; for example, the repeating polymer of N-acetylglucosamine, -[4GlcNAcβ1-]n, is the primary component of chitin, the material that forms the exoskeletons of arachnids, crustaceans, and insects (Chapter 26). Modifications of glucose residues by replacing the hydroxyl group at 2-position with an amine group and subsequent N-acetylation change the structural properties significantly. These changes allow for the formation of composites with proteins and minerals that lead to additional variation in structure and function. Most cell-surface polysaccharides found in animals belong to a class of glycans known as glycosaminoglycans (GAGs) (Chapter 17). Abundantly present on the cell surface as well as in the extracellular matrix, GAGs are linear macromolecules with molecular mass of >15,000 Da.'
 'The polysaccharide may also be decorated by substituents such as amino acids, O-acyl, or phosphodiester groups. It is not uncommon to find O-acetyl groups at the branch-point sugar residue, thereby leading to a highly crowded substitution pattern in which all positions on the sugar residue are either part of a glycosidic linkage or carry a nonsugar substituent. Examples of diversity by substituent addition are the O-antigens of Shigella flexneri in which glucosyl, O-acetyl, or phosphoethanolamine groups are added to the backbone (Figure 3.4E). Branching and substituent addition affect the properties of polysaccharide solutions, such as gelling and high viscosity. Some polymers are known under their commercial names gellan, welan, and rhamsan (S-194) (Figure 3.4F).'
 ""With society's ongoing need for polymers with new properties and functions, there is increased effort to develop chemical or biocatalytic reaction pathways to modify the structure of a polysaccharide backbone or side chains to enable the production of polysaccharide derivatives with enhanced or new properties. Cellulose is one example of a plant polysaccharide that has been extensively modified to develop new biosourced polymers. Reaction pathways have been developed to generate specific cellulose derivatives by substituting accessible hydroxyl groups with other chemical groups. Such derivatives include cellulose acetate, cellulose acetate propionate, cellulose acetate butyrates, carboxymethyl cellulose, and cellulose butyrate succinate. These products are used in many industrial applications as coatings, inks, binders, and thickening/gelling agents. They are also used in the pharmaceutical industries to produce controlled-release drug tablets and in the cosmetics and food industries as thickening and gelling agents.""
 'Pectins are some of the most complex polymers in nature. They are based on polymers of α(1-4)-linked galacturonic acid (GalA) or the RU, -2)-α-L-Rha-(1-4)-α-D-GalA-(1-, and may contain additional sugar and nonsugar substituents, including methyl and acetyl esters. The negatively charged carboxyl group at the 6-position of the GalA residues contributes to the water solubility of these polymers and the long-range interactions that give them gelling properties useful in the food industry. Oligo- and polysaccharides of plant origin are discussed in detail in Chapter 24. Animals also use polysaccharides for various purposes. Glycogen is a storage polymer related to starch in that it is a glucose polymer with primarily α(1-4)-linkages connecting glucose residues, but it is highly branched having additional α(1-6)-linkages to some of the glucose residues.'
 'When two sugar residues alternate, branched structures can be formed, as one sugar may give rise to the polymer backbone and one a side chain. Polysaccharides are not always built from the nonreducing end, and preformed subunits can be used in the assembly. For example, synthesis of the E. coli antigens O5ab and O5ac relies on a preformed linear oligosaccharide, with five sugar residues constituting the RU. The oligosaccharide is built on an undecaprenyl pyrophosphoryl glycoside anchor molecule. This oligosaccharide is then added onto another oligosaccharide–lipid anchor to grow the polymer from the “reducing end.” When polymerization is taking place at the penultimate sugar of the oligosaccharide a branched RU results (cf. O-antigen of E. coli O168 [Figure 3.4C]). Branching can be introduced by the addition of sugars following polymer backbone formation.'
 'The variation in biosynthetic pathways among bacterial species is ultimately responsible for the diversity in bacterial polysaccharides. The biosynthesis of bacterial polysaccharides is discussed further in Chapter 21. Here the authors present a few examples to illustrate how synthesis of backbone structures, branching, and postpolymerization modification lead to a diverse set of polymer structures. In one of the biosynthetic pathways, sugar residues are added sequentially onto an anchor molecule; thus, the polymer is growing from the terminal, nonreducing end until a termination entity/substituent is added that precludes further chain elongation—for example, in the O-antigen polysaccharide of the LPS from Escherichia coli O8 (Figure 3.4A). The polymer is linear, and although sugar residues are added step-by-step to form the polysaccharide, RUs can be identified.']",This process of covalently appending synthetic or naturally derived oligosaccharides to polymer chains built from petroleum-based monomers results in the formation of glycopolymers with architectures that mimic those of glycoproteins or proteoglycans.,"Such materials have found increasing use as research tools to study the biological functions of glycans and are currently explored as biomaterials for drug delivery or as antifouling and antifreeze agents. Nanomaterials from plants and crustacean shells offer new materials for the development of biorenewable and biocompatible products. These nano-sized particles, consisting of bundled polymer chains, have properties and function that are different from the isolated polymer chains from which they are made. Such nanomaterials can be produced from cellulose, hemicellulose, pectin, chitin and chitosan. A more focused description is given below on nanomaterials from cellulose. Polysaccharides that have little or no branching of their backbone can self-assemble to form ordered structures in which the individual polymer chains stack along the chain axis, thus forming a crystalline structure. Cellulose is one example of a plant polysaccharide that has this type of crystalline structure. During cellulose biosynthesis individual glucan chains assemble to form microfibril structures that contain both crystalline and disordered arrangements (see Figure 59.1A). The high mechanical stiffness and tensile strength along the length of the cellulose microfibrils provide high mechanical strength, high strength-to-weight ratio, and toughness to plant tissues and organs.",1.0,0.6729551467314776,0.5920363017088195,0.05,0.16666666665,0.5
"Complete the following paragraph: A strong basic knowledge base regarding the genomics, chemistry, biochemistry, biosynthesis, and biological roles of these ubiquitous and diverse molecules is now well-established (Chapters 2–19). The broad outlines of their natural occurrence and evolution (Chapters 20–27) and their recognition by glycan-binding proteins (Chapters 28–38) are becoming clear, as is their important role in normal and abnormal physiology and disease (Chapters 39–47). Facile methods for their analysis, manipulation, and synthesis of glycans have also been established (Chapters 48–56), and their significance in the biotechnology and pharmaceutical industries, nanotechnology, and bioenergy and materials science is obvious (Chapters 57–59).","['Every living cell in nature generates a complex and diverse array of glycans that is critical for the evolution, development, functioning, and survival of all natural biological systems (Chapter 1). A strong basic knowledge base regarding the genomics, chemistry, biochemistry, biosynthesis, and biological roles of these ubiquitous and diverse molecules is now well-established (Chapters 2–19). The broad outlines of their natural occurrence and evolution (Chapters 20–27) and their recognition by glycan-binding proteins (Chapters 28–38) are becoming clear, as is their important role in normal and abnormal physiology and disease (Chapters 39–47). Facile methods for their analysis, manipulation, and synthesis of glycans have also been established (Chapters 48–56), and their significance in the biotechnology and pharmaceutical industries, nanotechnology, and bioenergy and materials science is obvious (Chapters 57–59).'
 'In addition, simple, rapidly turning over, protein-bound glycans are abundant within the nucleus and cytoplasm, in which they can serve as regulatory switches. A more complete paradigm of molecular biology must therefore include glycans, often in covalent combination with other macromolecules (i.e., glycoconjugates, such as glycoproteins and glycolipids). In analogy to the current situation in Cosmology, glycans can be considered as the “dark matter” of the biological universe: a major and critical component that has yet to be fully incorporated into the “standard model” of biology. However, unlike the situation with dark matter in the Universe, there is already a lot known about glycans. The chemistry and metabolism of carbohydrates were prominent matters of interest in the first part of the 20th century. Although engendering much attention, they were primarily considered as a source of energy or as structural materials, apparently lacking other biological activities.'
 'Mixtures of glycans need to be studied next, to mimic “clustered saccharide patches” that more closely mimic natural states. Significant progress has also been made in Systems Glycobiology by better integration of glycomics with genomics, transcriptomics, and proteomics. Our understanding as to how miRNAs and transcription factors regulate glycan expression has also improved in the last few years (Chapters 51 and 52). At the present time, the study of glycan structure/function relationships requires highly specialized expertise in synthetic and analytical chemistry. The inherent difficulty in studying glycans remains a major challenge preventing glycobiology—the study of glycan function—from entering mainstream conceptual frameworks of biology. In response to this challenge, strong emphasis has recently been placed on the development of facile technologies that will allow nonglycobiologists without specialized analytical chemistry skills to study glycans in a meaningful way.'
 'The major glycan classes discussed in the book are described, and an overview of the general pathways for their biosynthesis is provided. Topological issues relevant to biosynthesis and functions of glycoconjugates are also considered, and the growing role of these molecules in medicine, biotechnology, nanotechnology, bioenergy, and materials science is mentioned. Defined in the broadest sense, glycobiology is the study of the structure, biosynthesis, biology, and evolution of saccharides (also called carbohydrates, sugar chains, or glycans) that are widely distributed in nature and of the proteins that recognize them. How does glycobiology fit into the modern concepts of molecular biology? The central paradigm driving research in molecular biology has been that biological information flows from DNA to RNA to protein. The power of this concept lies in its template-based precision, the ability to manipulate one class of molecules based on knowledge of another, and the patterns of sequence homology and relatedness that predict function and reveal evolutionary relationships.'
 'Although not traditionally considered part of “Glycobiology,” many natural and synthetic glycans are key components of Nanotechnology, Bioenergy, and Material Science. Glyconanomaterials (Chapter 58) have tunable chemical and physical properties and can be built on different scaffolds to probe cellular, tissue, and organismal interactions. Attached glycans can change nanomaterial properties, optimizing solubility and biocompatibility and lowering cytotoxicity. Glyconanomaterials have been used as imaging agents, spectroscopic tools, monitors of cellular systems, and vehicles for vaccination and drug delivery. Plant glycans are used for many purposes: energy sources, building materials, clothes, paper products, animal feed, and food and beverage additives (Chapter 59). Concerns about detrimental environmental effects and diminishing reserves of petroleum and its by-products have greatly renewed interest in using plant glycans for energy production, generation of polymers with improved or new functionalities, and as sources of high-value chemosynthetic precursors (Chapter 59).'
 '), remain the most prominent entities in molecular biology databases and repositories. Scientists gather sequence-centered information in the course of elucidating a cellular process or a pathological behavior, simply because a gene/protein sequence is usually the common element shared across -omics domains. The problem here is that glycans are only linked to the gene via their biosynthetic enzymes and substrates. The advancement of glycoscience as a discipline depends on expanding the integration of data describing glycoproteins, glycolipids, glycosaminoglycans, lipopolysaccharides, and the genome-coded enzymatic machinery that generates or breaks down these glycans, together with the ever-increasing information about the interactions of these glycoconjugates with other components of the cell. It is the ultimate goal of glycoscience research to be able to link glycan structures with their function.'
 'The specialized glycans expressed by parasites and microbes that are of great interest from the biomedical point of view (Chapters 21, 22, 23, and 43) may themselves be subject to evolutionary selection pressures. These issues are further considered in Chapter 20, which also discusses the limited information concerning how various glycan biosynthetic pathways appear to have evolved and diverged in different life-forms. Numerous natural bioactive molecules are glycoconjugates, and the attached glycans can have dramatic effects on the biosynthesis, stability, action, and turnover of these molecules in intact organisms. For example, the sulfated glycosaminoglycan heparin and its derivatives are among the most commonly used drugs in the world. The aminoglycoside antibiotics all have carbohydrate components essential for activity. For this and many other reasons, glycobiology and carbohydrate chemistry have become increasingly important in modern biotechnology.']","Mixtures of glycans need to be studied next, to mimic “clustered saccharide patches” that more closely mimic natural states. Significant progress has also been made in Systems Glycobiology by better integration of glycomics with genomics, transcriptomics, and proteomics. Our understanding as to how miRNAs and transcription factors regulate glycan expression has also improved in the last few years (Chapters 51 and 52). At the present time, the study of glycan structure/function relationships requires highly specialized expertise in synthetic and analytical chemistry. The inherent difficulty in studying glycans remains a major challenge preventing glycobiology—the study of glycan function—from entering mainstream conceptual frameworks of biology. In response to this challenge, strong emphasis has recently been placed on the development of facile technologies that will allow nonglycobiologists without specialized analytical chemistry skills to study glycans in a meaningful way.","Given all these major advances in basic and applied research on glycans, there is no reason why this major class of biomolecules should continue to be the “dark matter of the biological universe.” However, since the 1980s an entire generation of scientists have been largely trained without much exposure to, or knowledge of, glycans. Thus, it will still be awhile before these molecules return to their rightful place in the mainstream of thinking in conventional molecular and cellular biology and medicine. Continued advances in basic and applied research on glycans will occur, but this needs to be coupled with the training of a new generation of scientists, engineers, and physicians for whom these molecules will be an obvious aspect of their understanding of living systems in health and disease. The National Institutes of Health (NIH) National Heart, Lung, and Blood Institute (NHLBI) of the United States has recognized the importance of training scientists and clinicians in glycosciences by establishing a National Career Development Consortium for Excellence in Glycosciences (K12), which focuses on immersive training of medical and research professionals in all aspects of glycosciences. In addition, the National Institute of General Medical Sciences (NIGMS) has funded the first graduate student training grant (T32) in glycosciences. Clearly, the teaching of glycosciences in all training programs for graduate and medical professionals will be essential if we are to continue to make medical advances in nearly all areas. As emphasized in a report from the National Research Council of the National Academy of Sciences, nearly every disease process that affects humans and other animals involves glycans (Chapters 39–47). In past decades, it has been realized that most functions of complex glycans are required at the multicellular (organismic) level. In contrast, cycling monosaccharides (e.g., O-GlcNAc in the nucleus and cytoplasm) serve regulatory functions at the single-cell level. The significance of nucleocytoplasmic O-glycosylation was broadened by the discoveries that an evolutionary branch of O-GlcNAc transferase is in fact an O-fucosyltransferase (OFT) that modifies many proteins in plants, protists, and protist pathogens like Toxoplasma and Cryptosporidium, with O-Fuc instead of O-GlcNAc (Chapters 18 and 19). The critical roles of complex glycans in the biology of intact organisms have been dramatically illustrated by the contrast between the viability of glycosyltransferase mutant cell lines in culture (Chapter 49) with the often lethal outcome caused by inactivation of the same enzymes in living organisms (Chapter 41). Transgenic mouse studies and the severe phenotypes of human congenital disorders of glycosylation (Chapter 45) have dramatically revealed the critical importance of glycans in development, physiology, and disease. Most major diseases also involve disordered inflammation and immunity, in which the glycan-binding selectins, Siglecs, galectins, and other glycan-binding proteins (Chapters 34–36) play critical roles. Most pathogens, viruses, bacteria, and parasites gain entry to cells by binding to glycans on the cell surface (Chapters 42 and 43). Recently, many studies have shown an essential role for complex glycans in SARS-CoV-2 infections and a role for O-GlcNAcylation in viral-induced cytokine storms (Chapter 19). In addition, many vaccines against infectious agents are directed against microbial glycans. Proteoglycans play critical roles in development, tissue morphogenesis, and cardiovascular disease and in regulating the actions of cytokines and growth factors. The glycosaminoglycan heparin is one of the oldest and most commonly used “drugs” in the clinic. Notch signaling, which plays a major role in controlling morphogenesis in development and cell fate decisions, is controlled by glycans (Chapter 13), and glycans on the surface of tumor cells play critical roles in tumor progression and metastasis (Chapter 47). Many of the current therapeutics in use or under development are glycoproteins, like monoclonal antibodies, which often require particular types of N-glycans for functional efficacy. Defects in the synthesis of glycan chains on dystroglycan underlie many types of congenital muscular dystrophy (Chapter 45). Dysregulated O-GlcNAcylation contributes to the etiologies of diabetes, neurodegeneration, cardiovascular disease, and cancer (Chapter 19). Although the few scientists and physicians well-educated in glycobiology are acutely aware of the importance of glycans in disease, most others have not learned much about this major class of molecules. However, it is now clear that studies of glycans will be essential for understanding the pathophysiology of most diseases and the development of effective therapies.",1.0,0.5846767352529204,0.7776236217868271,0.02564102564102564,0.9999999999857143,0.75
How were CD33 Siglecs identified?,"['CD33 is a marker of early human myeloid progenitors and leukemic cells and is also expressed on monocytes and tissue macrophages, including brain microglia. It has two Ig domains and was the first of the CD33rSiglecs to be characterized as an inhibitory receptor, suppressing activation of FcγRI and recruiting SHP-1 and SHP-2 (Figure 35.5). CD33 has some preference for α2-6- rather than α2-3-sialylated glycans and binds strongly to sialylated ligands on myeloid leukemia cell lines. The restricted expression of CD33 has been exploited in the treatment of acute myeloid leukemia using gemtuzumab ozogamicin, a humanized anti-CD33 monoclonal antibody coupled to the toxic antibiotic calicheamicin. Binding of anti-CD33 mAbs to CD33 triggers endocytosis of the bound antibody.'
 ""Binding of anti-CD33 mAbs to CD33 triggers endocytosis of the bound antibody. This depends on ITIM phosphorylation, recruitment of the E3 ligase Cbl, and ubiquitylation of the CD33 cytoplasmic tail. Selective expression of CD33 on leukemic progenitor cells also makes it an attractive target for therapy using chimeric antigen receptors expressed on cytotoxic T cells. Proposed biological functions mediated by CD33-related Siglecs. A generic CD33-related Siglec is represented, showing the location of the immunoreceptor tyrosine-based inhibitory motif (ITIM) and the potential for inhibitory signaling.  Recently, two coinherited single-nucleotide polymorphisms (SNPs) have been associated with protection of humans against late-onset Alzheimer's disease. These SNPs result in increased exon 2 skipping, leading to raised levels of CD33 lacking the V-set domain and reduced levels of full-length CD33.""
 'Overall, it appears that this class of SIGLEC genes is subject to multiple “Red Queen” effects in evolution, in which evolutionary changes of sialyltransferases in response to the emergence of Sia-binding pathogens may lead to subsequent evolutionary changes of Siglec specificities (Figure 35.4). Probable evolutionary chain of Red Queen effects involving Sias and CD33rSiglecs. See text for discussion. (Redrawn, with permission, from Padler-Karavani V, et al. 2014. FASEB J 28: 1280–1293.) To limit further complexity, two additional Red (more...) Below, we provide a brief summary of the main features of the human CD33rSiglecs and, where relevant, their murine counterparts. CD33 is a marker of early human myeloid progenitors and leukemic cells and is also expressed on monocytes and tissue macrophages, including brain microglia.'
 'Furthermore, mouse CD33 has a lysine residue in the transmembrane sequence and couples to the DAP12 transmembrane adaptor, as shown for mouse Siglec-H and human Siglecs-14, -15, and -16. In contrast to human CD33, mouse CD33 in the blood is expressed mainly on neutrophils rather than monocytes, and at low levels in microglia, which also suggests a nonconserved function of this receptor. The SIGLEC5 and SIGLEC14 genes are adjacent to each other on chromosome 19 and encode proteins containing four and three Ig-like domains, respectively. Because of ongoing gene conversions within most taxa, the first two Ig domains of Siglec-5 and Siglec-14 share >99% sequence identity but then diverge, with Siglec-5 being an inhibitory receptor with typical ITIMs, whereas Siglec-14 can complex with DAP12 and activate signaling.'
 'The term Siglec (sialic acid–binding immunoglobulin-like lectin) was therefore proposed in 1998. Subsequently, most of the CD33-related Siglecs (CD33rSiglecs) were discovered as a result of genomic and transcriptomic sequencing projects, which allowed in silico identification of novel Siglec-related genes and cDNAs. Siglecs are divided into two major subgroups based on sequence similarity (Figure 35.1) and on conservation among mammalian species. The first group comprises Sn (Siglec-1), CD22 (Siglec-2), MAG (Siglec-4), and Siglec-15, for which there are clear-cut orthologs in all mammalian species examined and which share only ∼25%–30% sequence identity among each other.'
 'A second reason is that the Sia-binding V-set domains of the CD33rSiglecs are rapidly evolving, presumably to adjust their binding specificity to the rapid evolution of the endogenous host sialome, as well as evasion of binding by pathogens via molecular mimicry (Chapter 15) or specific protein-mediated interactions (see below). There are also multiple gene conversion events between adjacent genes and pseudogenes within this cluster. Of interest is the finding that humans show many CD33rSiglec differences compared with our closest evolutionary cousins (the chimpanzees), more than the differences between mice and rats, which shared a common ancestor much earlier (see below). As mentioned earlier, an “essential” arginine residue in all known Siglecs is required for binding Sia-containing ligands. This residue is often mutated in nature, resulting in loss of binding ability.'
 'Siglec-15 therefore provides a novel target for diseases, such as menopause-related osteoporosis and cancer. Genes encoding most of the CD33rSiglec subfamily are clustered on human chromosome 19q13.3-13.4 or the syntenic region of mouse chromosome 7. They include CD33 (Siglec-3), Siglecs-5 through -12, Siglec-14, and Siglec-16 in humans and CD33 and Siglecs-E, -F, -G, and -H in mice. Similar clusters are found in other mammals. It is difficult to assign all definitive orthologs between primates and rodents, resulting in different nomenclatures. One reason is that most IgSF domains are encoded by exons with phase-1 splice junctions, allowing exon shuffling without disrupting open reading frames, resulting in hybrid genes that are difficult to distinguish from similarly organized genes in other species.']","CD33 Siglecs were identified as a result of genomic and transcriptomic sequencing projects, which allowed for the in silico identification of novel Siglec-related genes and cDNAs.","Before the 1990s, it was thought that antibodies were the only IgSF members capable of recognizing glycans. The first direct evidence for nonantibody IgSF glycan-binding proteins came from independent studies on sialoadhesin (Sn), a sialic acid (Sia)–dependent binding receptor on mouse macrophage subsets, and on CD22, a molecule previously cloned as a B-cell marker. Various techniques showed that Sn functions as a lectin, including loss of binding following sialidase treatment of ligands, inhibition assays with sialylated compounds, and Sia-dependent binding of the purified receptor to glycoproteins and to red blood cells derivatized to carry Sias in different linkages. With recombinant CD22, abrogation of cell adhesive interactions by sialidase treatment led to the discovery that it was a Sia-binding lectin, with a high degree of specificity for α2-6-linked Sias. Cloning of Sn then showed that it was an IgSF member sharing homology with CD22 and with two other previously cloned proteins, CD33 and myelin-associated glycoprotein (MAG). Demonstration of Sia recognition by CD33 and MAG resulted in the definition of a new family of Sia-binding molecules, which were initially called “sialoadhesins.” Meanwhile, preliminary evidence for glycan binding by additional IgSF members emerged, and a suggestion was made to classify all these molecules as “I-type” lectins. However, it became clear that these four Sia-binding molecules were a distinct subgroup sharing both sequence homology and Ig-domain organization, and that they were not all involved in adhesion. The term Siglec (sialic acid–binding immunoglobulin-like lectin) was therefore proposed in 1998. Subsequently, most of the CD33-related Siglecs (CD33rSiglecs) were discovered as a result of genomic and transcriptomic sequencing projects, which allowed in silico identification of novel Siglec-related genes and cDNAs.",1.0,0.999999497965182,0.5933059019858599,0.05405405405405406,0.9999999999857143,0.75
What degree of polymerization is necessary for oligosaccharins to trigger plant defense?,"['Oligosaccharins that are active in plants. Examples of oligosaccharides derived from fungal, oomycete, and plant cell walls are shown. The degree of polymerization (DP) of the minimally active oligosaccharide structures triggering some responses in plants (more...) The composition (monosaccharide units), degree of polymerization (DP), and branching of the oligosaccharins determine their biological activity in triggering plant defense. For example, oligogalacturonides that are biologically active typically require a DP of 10–14 for activity, whereas DPs of >7 and >4 are necessary for the oligochitosans and oligochitins, respectively (Figure 40.2). A single active hepta-glucoside from oomycete walls was isolated from a mixture of approximately 300 inactive structural isomers and found to trigger defense responses in soybean.'
 'A single active hepta-glucoside from oomycete walls was isolated from a mixture of approximately 300 inactive structural isomers and found to trigger defense responses in soybean. Both the DP and location of the β-1-3 branches in this oligosaccharide are important for its biological activity (Figure 40.2). Elongating the oligosaccharide at the reducing end had no discernible effect on bioactivity and activity was also largely retained by removal of a single glucose from the reducing end. However, the hexa-glucoside was the minimal structure of this oligosaccharide that had appreciable activity in inducing defense responses in soybean. The low quantities and different types of glycan signal molecules that elicit defense responses suggest that these glycans are recognized by specific plasma membrane-localized receptors. A 75-kDa plasma membrane protein with high-binding affinity for chitin elicitors was identified in rice cell plasma membranes and proposed to be involved in oligosaccharide perception and signal transduction.'
 'Other pathogen-derived oligosaccharins are the PAMPs derived from linear homo-oligomers from fungal/oomycete cell walls that include chitin [1,4-β-D-(GlcNAc)n], and its deacetylated form (chitosan), and β-1,3-glucan oligosaccharides (Figure 40.2). More recently, additional plant cell wall–derived oligosaccharins have been shown to trigger defense responses, including cellulose-derived oligomers (β-1,4-glucans), mixed-linkage glucans (MLGs: β-1,4/β-1,3 glucans), and oligosaccharides derived from xyloglucans, mannans, xylans, or callose, which trigger signaling cascades in Arabidopsis and other plant species, including crops (Figure 40.2).'
 ""Oligogalacturonides composed of 1-4-linked α-GalA residues are one example of oligosaccharins released from plant cell wall polysaccharides, in this specific case from homogalacturonans by endopolygalacturonases (EPGs) secreted by the pathogen. The activities of such pathogen-derived EPGs are frequently inhibited or modulated by polygalacturonase-inhibiting proteins (PGIP) produced by plants. Similarly, oligoglucosides composed of 1-6- and 1-3-linked β-Glc residues released from the mycelial walls of the soybean pathogen Phytophthora sojae by plant endo-glucanases were an early example of oligosaccharins generated from a pathogen's cell wall.""
