question,contexts,answer,ground_truth,faithfulness,answer_relevancy,answer_similarity,context_relevancy,context_precision,context_recall
"Complete the following paragraph: A more complete paradigm of molecular biology must therefore include glycans, often in covalent combination with other macromolecules (i.e., glycoconjugates, such as glycoproteins and glycolipids). In analogy to the current situation in Cosmology, glycans can be considered as the “dark matter” of the biological universe: a major and critical component that has yet to be fully incorporated into the “standard model” of biology.","['NCBI Bookshelf. A service of the National Library of Medicine, National Institutes of Health. Varki A, Cummings RD, Esko JD, et al., editors. Essentials of Glycobiology [Internet]. 4th edition. Cold Spring Harbor (NY): Cold Spring Harbor Laboratory Press; 2022.  doi: 10.1101/glycobiology.4e.1 Ajit Varki and Stuart Kornfeld. This chapter provides a historical background to the field of glycobiology and an overview of this book. General terms found in the volume are considered, common monosaccharide units of glycoconjugates mentioned, and a uniform symbol nomenclature used for structural depictions presented. The major glycan classes discussed in the book are described, and an overview of the general pathways for their biosynthesis is provided. Topological issues relevant to biosynthesis and functions of glycoconjugates are also considered, and the growing role of these molecules in medicine, biotechnology, nanotechnology, bioenergy, and materials science is mentioned. Defined in the broadest sense, glycobiology is the study of the structure, biosynthesis, biology, and evolution of saccharides (also called carbohydrates, sugar chains, or glycans) that are widely distributed in nature and of the proteins that recognize them. How does glycobiology fit into the modern concepts of molecular biology? The central paradigm driving research in molecular biology has been that biological information flows from DNA to RNA to protein. The power of this concept lies in its template-based precision, the ability to manipulate one class of molecules based on knowledge of another, and the patterns of sequence homology and relatedness that predict function and reveal evolutionary relationships. With ongoing sequencing of numerous genomes, spectacular gains in understanding the biology of nucleic acids and proteins have occurred. Thus, many scientists assume that studying just these molecules will explain the makeup of cells, tissues, organs, physiological systems, and intact organisms. In fact, making a cell requires many small molecule metabolites as well as two other major classes of macromolecules—lipids and carbohydrates—which serve as intermediates in generating energy and as signaling effectors, recognition markers, and structural components. Taken together with the fact that they encompass some of the major posttranslational modifications of proteins, lipids, and carbohydrates help explain how the relatively small number of genes in the typical genome can generate the enormous biological complexities inherent in the development, growth, and functioning of diverse organisms. The biological roles of carbohydrates are particularly prominent in the assembly of complex multicellular organs and organisms, which requires interactions between cells and the surrounding matrix. However, without any known exception, all cells and numerous macromolecules in nature carry an array of covalently attached sugars (monosaccharides) or sugar chains (oligosaccharides), which are generically referred to in this book as “glycans.” Sometimes glycans can also be freestanding entities. Being on the outer surface of cellular and secreted macromolecules, many glycans are in a position to modulate or mediate a variety of events in cell–cell, cell–matrix, and cell–molecule interactions critical to the development and function of a complex multicellular organism. They can also mediate interactions between organisms (e.g., between host and a parasite, pathogen, or a symbiont). In addition, simple, rapidly turning over, protein-bound glycans are abundant within the nucleus and cytoplasm, in which they can serve as regulatory switches. A more complete paradigm of molecular biology must therefore include glycans, often in covalent combination with other macromolecules (i.e., glycoconjugates, such as glycoproteins and glycolipids). In analogy to the current situation in Cosmology, glycans can be considered as the “dark matter” of the biological universe: a major and critical component that has yet to be fully incorporated into the “standard model” of biology. However, unlike the situation with dark matter in the Universe, there is already a lot known about glycans. The chemistry and metabolism of carbohydrates were prominent matters of interest in the first part of the 20th century. Although engendering much attention, they were primarily considered as a source of energy or as structural materials, apparently lacking other biological activities.'
 'However, unlike the situation with dark matter in the Universe, there is already a lot known about glycans. The chemistry and metabolism of carbohydrates were prominent matters of interest in the first part of the 20th century. Although engendering much attention, they were primarily considered as a source of energy or as structural materials, apparently lacking other biological activities. Furthermore, during the molecular biology revolution of the 1970s, studies of glycans lagged far behind those of other major classes of molecules. This was in part because of their inherent structural complexity, the difficulty in determining their sequences, and the fact that their biosynthesis could not be directly predicted from a DNA template. The development of many new technologies for exploring the structures and functions of glycans has since opened a new frontier of molecular biology called “glycobiology”—a word first coined in the late 1980s to recognize the coming together of the traditional disciplines of carbohydrate chemistry and biochemistry with a modern understanding of the cell and molecular biology of glycans and, in particular, their conjugates with proteins and lipids. Glycobiology is now one of the more rapidly growing fields in the natural sciences, with broad relevance to many areas of basic research, biomedicine, and biotechnology. The field includes the chemistry of carbohydrates, the enzymology of glycan formation and degradation, the recognition of glycans by specific proteins, roles of glycans in complex biological systems, and their analysis or manipulation by various techniques. Research in glycobiology thus requires a foundation not only in the nomenclature, biosynthesis, structure, chemical synthesis, and functions of glycans, but also in the general disciplines of molecular genetics, protein chemistry, cell biology, developmental biology, physiology, and medicine. This book provides an overview of the field, with relative emphasis on the glycans of animal systems. It is assumed that the reader has a basic background in advanced undergraduate-level chemistry, biochemistry, and cell biology. Some of the major investigators who influenced the early development of Glycobiology are shown in Figure 1.1, and more are listed in Online Appendix 1A. Many others have made major contributions as well, and a summary of the general principles gained from all this research is presented in Table 1.1. Nobel laureates in fields related to the history of glycobiology. Listed are the Laureates and their original Nobel citations: Hermann Emil Fischer (Chemistry, 1902), “in recognition of the extraordinary services he has rendered by his work on (more...) General principles of glycobiology  Carbohydrates are defined as polyhydroxyaldehydes, polyhydroxyketones and their simple derivatives, or larger compounds that can be hydrolyzed into such units. A monosaccharide is a carbohydrate that usually cannot be hydrolyzed into a simpler form. It has a potential carbonyl group at the end of the carbon chain (an aldehyde group) or at an inner carbon (a ketone group). These two types of monosaccharides are therefore named aldoses and ketoses, respectively (for examples, see below, and for more details, see Chapter 2). Free monosaccharides can exist in open-chain or ring forms (Figure 1.2). Ring forms of the monosaccharides are the general rule in oligosaccharides, which are linear or branched chains of monosaccharides attached to one another via glycosidic linkages (the term “polysaccharide” is typically used for large glycans composed of repeating oligosaccharide motifs; for examples, see Chapter 3). The ring form of a monosaccharide generates a chiral anomeric center at C-1 for aldo sugars or at C-2 for keto sugars (for details, see Chapter 2). A glycosidic linkage involves the attachment of a monosaccharide to another residue, typically via the hydroxyl group of this anomeric center, generating α-linkages or β-linkages that are defined based on the relationship of the glycosidic oxygen to the anomeric carbon and ring (Chapter 2).'
 'NCBI Bookshelf. A service of the National Library of Medicine, National Institutes of Health. Varki A, Cummings RD, Esko JD, et al., editors. Essentials of Glycobiology [Internet]. 4th edition. Cold Spring Harbor (NY): Cold Spring Harbor Laboratory Press; 2022.  doi: 10.1101/glycobiology.4e.51 Pauline M. Rudd, Niclas G. Karlsson, Kay-Hooi Khoo, Morten Thaysen-Andersen, Lance Wells, and Nicolle H. Packer. The term genomics arose from the availability of complete genome sequence data as well as computational methods for their analysis. However, <2% of genes in the human genome encode proteins. These genes are transcribed into messenger RNAs (mRNAs) that make up the “transcriptome,” of which ∼30% are assigned to protein coding. The total complement of proteins expressed by the cell is collectively termed the “proteome.” Most eukaryotic proteins are post translationally modified (e.g., by phosphorylation, sulfation, oxidation, ubiquitination, acetylation, methylation, lipidation, or glycosylation). These modifications, combined with alternative RNA splicing in eukaryotes, render the proteome considerably more complex than the transcriptome. Although it has been estimated that approximately 120,000 different protein splice forms are expressed by human cells, the total number of modified proteoforms is likely to be at least an order of magnitude higher. The systems-level analysis of all proteins expressed by cells, tissues, or organisms is known as “proteomics.” The proteome, like the transcriptome, but unlike the DNA sequence of the genome, is fundamentally dynamic. The repertoire of proteins expressed by a cell is highly dependent on tissue type, microenvironment, and stage within the life cycle. As cells receive external and internal cues in the form of growth factors, hormones, metabolites, or cell–cell interactions, the expression of various genes is modulated and may be transcribed at levels ranging from silence to more than 104 mRNA copies per cell and 107 protein molecules per cell. Thus, proteomes and their modifications vary during cell differentiation, activation, trafficking, and malignant transformation. However, no systems-level analysis of a biological process is complete without interrogating the glycome, defined as the entire complement of glycan structures (be it protein-/lipid-bound or -free) produced by cells, in addition to the genome, transcriptome, proteome, lipidome and metabolome. Vertebrates synthesize N-linked and O-linked glycoproteins, glycolipids (Chapters 11 and 12), proteoglycans, glycosaminoglycans (GAGs), and glycosylphosphatidylinositol (GPI) anchors covalently attached to proteins, as well as free oligosaccharides (Chapter 3). As with the proteome, each cell type has its own distinct glycome that is governed by local cues and the metabolic state of the cell. Other organisms have distinct glycomes; those of plants (Chapter 24) and prokaryotes (Chapter 21) are distinctly different from the vertebrate and invertebrate glycomes (Chapters 25–27). The size of any particular cellular glycome has not yet been established, but the combinatorial possibilities that can occur with numerous glycan structures on multiple glycoconjugates means that determining a “complete” glycome is not straightforward. The notion that glycans should be studied as a totality (glycomics), as well as simply one glycan or glycoconjugate at a time, developed when it became apparent that glycans form patterns on cells that change during development (Chapter 41), cancer progression (Chapter 47), infection (Chapters 42 and 43), and many other diseases (Chapters 44–46). Many glycan-binding proteins, such as lectins, are oligomerized on the cell surface and interact with multivalent arrays of glycans on the same or opposing cells (Chapters 28–38). Sometimes, multiple discrete glycans and their matching glycan-binding proteins work together to engage two cells or to deliver signals between cells.']","Carbohydrates, specifically glycans, play a crucial role in the biological universe, akin to dark matter in Cosmology. They are essential components that are intricately involved in various biological processes, serving as covalently attached entities to other macromolecules like glycoproteins and glycolipids. Despite their significance, glycans are still not fully integrated into the standard model of biology, highlighting the need for a more comprehensive understanding and inclusion of these molecules in the study of molecular biology.","However, unlike the situation with dark matter in the Universe, there is already a lot known about glycans. The chemistry and metabolism of carbohydrates were prominent matters of interest in the first part of the 20th century. Although engendering much attention, they were primarily considered as a source of energy or as structural materials, apparently lacking other biological activities. Furthermore, during the molecular biology revolution of the 1970s, studies of glycans lagged far behind those of other major classes of molecules. This was in part because of their inherent structural complexity, the difficulty in determining their sequences, and the fact that their biosynthesis could not be directly predicted from a DNA template.",1.0,0.627558726210647,0.77236775821304,0.02631578947368421,0.9999999999666667,1.0
"Complete the following paragraph: Monosaccharide names are frequently abbreviated; most common are three-letter abbreviations for simple monosaccharides (e.g., Gal, Glc, Man, Xyl, Fuc). There are nine common monosaccharides found in vertebrate glycoconjugates (Figure 2.4). Once incorporated into a glycan, these nine monosaccharide building blocks can be further modified to generate additional sugar structures.","['As mentioned briefly in Chapter 1, all monosaccharides consist of a chain of chiral hydroxymethylene units, which terminates at one end with a hydroxymethyl group and at the other with either an aldehyde group (aldoses) or an α-hydroxy ketone group (ketoses). Glyceraldehyde is the simplest aldose and dihydroxyacetone is the simplest ketose (Figure 2.1). The structures of glyceraldehyde and dihydroxyacetone are distinct in that glyceraldehyde contains an asymmetric (chiral) carbon atom (Figure 2.1), whereas dihydroxyacetone does not. With the exception of dihydroxyacetone, all monosaccharides have at least one asymmetric carbon atom, the total number being equal to the number of internal (CHOH) groups (n–2 for aldoses and n–3 for ketoses with n carbon atoms). The number of stereoisomers corresponds to 2k, where k equals the number of asymmetric carbon atoms. For example, an aldohexose with the general formula C6H12O6 and four asymmetric carbon atoms (i.e., four (CHOH) groups) can be described in 16 possible isomeric forms (Figure 2.1). Structures of glyceraldehyde and dihydroxyacetone. (A) Fischer projection. (B) D- and L-glyceraldehyde. The chiral central carbon in glyceraldehyde gives rise to two possible configurations of the molecule, termed D and L.  The numbering of carbon atoms follows the rules of organic chemistry nomenclature. The aldehyde carbon is referred to as C-1 and the carbonyl group in ketoses is referred to as C-2. The overall configuration (D or L) of each sugar is determined by the absolute configuration of the stereogenic center furthest from the carbonyl group (i.e., with the highest numbered asymmetric carbon atom; this is C-5 in hexoses and C-4 in pentoses). The configuration of a monosaccharide is most easily determined by representing the structure in a Fischer projection. If the OH (or other non-H group) is on the right in the Fischer projection, the overall configuration is D. If the OH (or other non-H group) is on the left, the overall configuration is L (Figure 2.2). This figure also shows D- and L-glucose in the cyclic form (chair conformation) found in solution. Most vertebrate monosaccharides have the D configuration with the exception of fucose and iduronic acid (IdoA) L sugars. The Fischer projections shown in Figure 2.3 illustrate the acyclic structures of all D-aldoses through the aldohexose group. D- and L-glucopyranose in Fischer projection and chair conformation.  Fischer projections for the acyclic forms of the D series of aldoses, ranging from triose to hexose.  Any two sugars that differ only in the configuration around a single chiral carbon atom are called epimers. For example, D-mannose is the C-2 epimer of D-glucose, whereas D-galactose is the C-4 epimer of D-glucose (Figure 2.4). Monosaccharide names are frequently abbreviated; most common are three-letter abbreviations for simple monosaccharides (e.g., Gal, Glc, Man, Xyl, Fuc). There are nine common monosaccharides found in vertebrate glycoconjugates (Figure 2.4). Once incorporated into a glycan, these nine monosaccharide building blocks can be further modified to generate additional sugar structures. For example, glucuronic acid (GlcA) can be epimerized at C-5 to generate IdoA. Many more monosaccharides exist in glycoconjugates from other species and as intermediates in metabolism. We use a symbolic notation for the monosaccharides that are most abundant in vertebrate glycoconjugates (see Chapter 1). Common monosaccharides found in vertebrates. N-Acetylneuraminic acid is the most common form of sialic acid.  Monosaccharides exist in solution as an equilibrium mixture of acyclic and cyclic forms.'
 'Note that the polypeptide (more...) (Upper left) Historical electron micrograph of endothelial cells from a blood capillary in the rat diaphragm muscle, showing the lumenal cell membrane of the cells (facing the blood) decorated with particles of cationized ferritin (arrowheads). These (more...) Nucleotides and proteins are linear polymers that can each contain only one basic type of linkage between monomers. In contrast, each monosaccharide can theoretically generate either an α- or a β-linkage to any one of several positions on another monosaccharide in a chain or to another type of molecule. Thus, whereas three different nucleotides or amino acids can only generate six trimers, three different hexoses could theoretically produce (depending on which of their forms are considered) anywhere from 1056 to 27,648 unique trisaccharides. This difference in complexity becomes even greater as the number of monosaccharide units found in natural glycan increases (now numbering in the hundreds). Fortunately for the student of glycobiology, naturally occurring biological macromolecules in a given species tend to contain relatively few of the possible monosaccharide units, and they are in a limited number of combinations. Of course, the great majority of glycans in most species have yet to be discovered and structurally defined. Thus, much of the possible diversity may yet exist in nature. Although several hundred distinct monosaccharides are known in nature, only a minority of these are commonly found in well-studied glycans. Examples of common monosaccharides in vertebrate cells are listed below, along with their standard abbreviations (for details regarding their structures, see Chapter 2, and embedded links from the symbols in Online Appendix 1B). Pentoses: five-carbon neutral sugars—D-xylose (Xyl)Hexoses: six-carbon neutral sugars—for example, D-glucose (Glc)Hexosamines: hexoses with an amino group at the 2-position, which can be either free or, more commonly, N-acetylated—for example, N-acetyl-D-glucosamine (GlcNAc)6-Deoxyhexoses: for example, L-fucose (Fuc)Uronic acids: hexoses with a carboxylate at the 6-position—for example, D-glucuronic acid (GlcA)Nonulosonic acids: family of nine-carbon acidic sugars, of which the most common in animals is the sialic acid N-acetylneuraminic acid (Neu5Ac, also sometimes called NeuAc or, historically, NANA) (see Chapter 15) For simplicity, the symbols D- and L- are omitted from the full names of common monosaccharides from here on unless a less common variant occurs. This limited set of monosaccharides dominates the glycobiology of more recently evolved (so-called “higher”) animals, but several others have been found in “lower” animals (e.g., tyvelose [Chapters 25 and 26], bacteria and Archaea [e.g., keto-deoxyoctulosonic acid, rhamnose, L-arabinose, and muramic acid; Chapters 21 and 22], and plants [e.g., arabinose, apiose, and galacturonic acid; Chapter 24]). A variety of modifications of glycans further enhance their diversity in nature and often serve to mediate specific biological functions. Thus, the hydroxyl groups of different monosaccharides can be subject to modifications such as phosphorylation, sulfation, methylation, O-acetylation, or fatty acylation. Although amino groups are commonly N-acetylated, they can be N-sulfated or remain unsubstituted. Carboxyl groups are occasionally subject to lactonization to nearby hydroxyl groups or even lactamization to nearby amino groups. Details regarding the structural depiction of monosaccharides, linkages, and oligosaccharides are discussed in Chapter 2. Many figures in this volume use a symbolic depiction of sugar chains (see Online Appendix 1B and examples in Figure 1.5). This Symbol Nomenclature for Glycans (SNFG) is expanded from the Second Edition and has been vetted and adopted by many investigators.'
 'NCBI Bookshelf. A service of the National Library of Medicine, National Institutes of Health. Varki A, Cummings RD, Esko JD, et al., editors. Essentials of Glycobiology [Internet]. 4th edition. Cold Spring Harbor (NY): Cold Spring Harbor Laboratory Press; 2022.  doi: 10.1101/glycobiology.4e.2 Peter H. Seeberger. This chapter covers the basic building blocks of glycans and fundamental considerations regarding glycan structure by introducing chemical concepts. Modes of linking glycans and structural depiction of the same are discussed to provide the groundwork for understanding longer glycans (Chapter 3). In this book, as well as in the earlier editions, the term glycan is used. Still, a host of names are commonly used to refer to sugar polymers in other textbooks and the literature. In the 19th century, sugar-based substances were referred to as carbohydrates, or “hydrates of carbon,” that are based on the general formula C x(H2O)n that also possess a carbonyl group, either an aldehyde or a ketone. Monosaccharides are the simplest of these polyhydroxylated carbonyl compounds (saccharide is derived from the Greek word for sugar or sweetness). Monosaccharides are joined together to give rise to oligosaccharides or polysaccharides. Typically, the term “oligosaccharide” refers to any glycan that contains less than 20 monosaccharide residues connected by glycosidic linkages. The term “polysaccharide” is typically used to denote any linear or branched polymer consisting of monosaccharide residues, such as cellulose (Chapters 14 and 24). Thus, the relationship of monosaccharides to oligosaccharides or polysaccharides is analogous to that of amino acids and proteins or nucleotides and nucleic acids (polynucleotides). The term “glycoconjugate” is often used to describe a macromolecule that contains monosaccharides covalently linked to proteins or lipids. The prefix “glyco” and the suffixes “saccharide” and “glycan” indicate the presence of carbohydrate constituents (e.g., glycoproteins, glycolipids, and proteoglycans). Just as is observed with proteins in nature, additional structural diversity can be imparted to glycans by modifying their hydroxyl groups with phosphate, sulfate, or acetyl esters, and/or their amino groups with acetyl or sulfate groups. A carbohydrate may be termed “complex” if it contains more than one type of monosaccharide building unit. The glucose-based polymer cellulose is an example of a “simple” carbohydrate, whereas a galactomannan polysaccharide, composed of both galactose and mannose, is an example of a complex carbohydrate. However, even so-called simple glycans, such as cellulose and starch, often have very complex molecular structures in three dimensions. The term complex carbohydrates includes glycoconjugates, whereas the term carbohydrates per se would not. Additional nomenclature issues are covered in this chapter and Chapter 3. A more detailed and comprehensive listing of carbohydrate nomenclature rules has been published (see McNaught 1997 and Varki et al. 2015 in Further Reading at the end of this chapter, and Online Appendix 1B). The classification of monosaccharide structures began in the late 19th century with the pioneering work of Emil Fischer. All simple monosaccharides have the general empirical formula Cx(H2O)n, where n is an integer ranging from 3 to 9. As mentioned briefly in Chapter 1, all monosaccharides consist of a chain of chiral hydroxymethylene units, which terminates at one end with a hydroxymethyl group and at the other with either an aldehyde group (aldoses) or an α-hydroxy ketone group (ketoses). Glyceraldehyde is the simplest aldose and dihydroxyacetone is the simplest ketose (Figure 2.1).']","Once incorporated into a glycan, these nine monosaccharide building blocks can be further modified to generate additional sugar structures. For example, glucuronic acid (GlcA) can be epimerized at C-5 to generate IdoA. Many more monosaccharides exist in glycoconjugates from other species and as intermediates in metabolism.","For example, glucuronic acid (GlcA) can be epimerized at C-5 to generate IdoA. Many more monosaccharides exist in glycoconjugates from other species and as intermediates in metabolism. We use a symbolic notation for the monosaccharides that are most abundant in vertebrate glycoconjugates (see Chapter 1). Common monosaccharides found in vertebrates. N-Acetylneuraminic acid is the most common form of sialic acid.  Monosaccharides exist in solution as an equilibrium mixture of acyclic and cyclic forms. The percentage of each form depends on the sugar structure. The cyclic form of a monosaccharide is characterized by a hemiacetal group formed by the reaction of one of the hydroxyl groups with the C-1 aldehyde or ketone. For reasons of chemical stability, five- and six-membered rings are most commonly formed from acyclic monosaccharides. Hexoses (six-carbon aldoses) and hexuloses (six-carbon ketoses) form six-membered rings via a C-1—O—C-5 ring closure; they form five-membered rings through a C-1—O—C-4 ring closure (Figure 2.5). A five-membered cyclic hemiacetal is labeled a “furanose” and a six-membered cyclic hemiacetal is called a “pyranose.” Pentoses can form both pyranose and furanose forms. Cyclization of acyclic D-glucose to form pyranose and furanose structures. The cyclization reaction produces both the α and β anomers (i.e., C-1 epimers).",1.0,0.5169070989248794,0.773690649114406,0.038461538461538464,0.9999999999666667,0.4
"Complete the following paragraph: In solution, NMR studies show IdoA2S and IdoA residues to be present in a mixture of 1C4 and 2S0 conformations. The conformational flexibility in IdoA residues likely allows orientation of the sulfate groups in HS to maximize the binding affinity to proteins.","['A common method involves affinity fractionation of proteins on Sepharose columns containing covalently linked GAG chains, usually heparin. The bound proteins are eluted with different concentrations of sodium chloride, and the concentration required for elution is generally proportional to the Kd. High-affinity interactions require 0.5–2 m NaCl to displace bound ligand, which usually translates into Kd values of 10−7–10−9 m (determined under physiological salt concentrations by equilibrium binding). Proteins with lower affinity (10−5–10−7 m) often require only 0.2–0.5 m NaCl to elute. This method assumes that GAG–protein interactions are entirely ionic, which is not entirely correct. Nevertheless, it can provide an assessment of relative affinity, when comparing different GAG-binding proteins. A number of more sophisticated methods are now in use that provide detailed thermodynamic data (ΔH [change in enthalpy], ΔS [change in entropy], ΔCp [change in molar heat capacity], etc.), kinetic data (association and dissociation rates), and high-resolution data on atomic contacts in GAG–protein interactions (Table 38.2). Regardless of the technique one uses, it must be kept in mind that in vitro binding measurements are not likely to be the same as those when the protein binds to proteoglycans on the cell surface or in the extracellular matrix, where the density and variety of GAG-binding proteins, proteoglycans, and other interacting factors varies greatly. To determine the physiological relevance of the interaction, one should consider measuring binding under conditions that can lead to a biological response. For example, one can measure binding to cells with altered GAG composition (Chapter 49) or after treatment with specific lyases to remove GAG chains from the cell surface (Chapter 17) and then determine whether the same response occurs as observed in the presence of GAG chains. The interaction can then be studied more intensively using the in vitro assays described above. Methods to measure glycosaminoglycan (GAG)–protein interaction  As mentioned above, most GAG-binding proteins interact with HS and/or heparin. The likely basis for this preference is greater sequence heterogeneity and more extensive and variable sulfation compared with other GAGs. The unusual conformational flexibility of iduronic acid, which is found in heparin, HS, and DS, also has a role in their ability to bind proteins. GAGs are linear helical structures, consisting of alternating residues of N-acetylglucosamine (GlcNAc) or N-acetylgalactosamine (GalNAc) with glucuronic acid (GlcA) or IdoA (with the exception of KS, which consists of alternating N-acetylglucosamine and galactose residues; Chapter 17). Inspection of heparin oligosaccharides containing highly modified domains ([GlcNS6S-IdoA2S]n) shows that the N-sulfo and 2-O-sulfo groups of each disaccharide repeat lie on opposite sides of the helix from the 6-O-sulfo and carboxyl groups (Figure 38.1). Analysis of the conformation of individual sugars shows that N-acetylglucosamine and glucuronic acid residues assume a preferred conformation in solution, designated 4C1 (indicating that carbon 4 is above the plane defined by carbons 2, 3, and 5 and the ring oxygen, and that carbon 1 is below the plane; Chapter 2). In contrast, IdoA2S assumes the 1C4 or the 2S0 conformation (Figure 38.1), which reorients the position of the sulfo substituents, thereby creating a different orientation of charged groups. In many cases when a protein binds to an HS chain, it induces a change in conformation of the IdoA2S residue resulting in a better fit and enhanced binding. IdoA2S residues have always been found in domains rich in N-sulfo and O-sulfo groups (for biosynthetic reasons; Chapter 17), which is also where proteins usually bind.'
 'Structural diversity of these polymers is primarily a result of additional sulfation of hydroxyl groups and is discussed below for the diverse HS polymers found in mammals. GAGs found in other animals can be distinct from mammalian GAGs by virtue of further modifications. For example, marine invertebrates can carry particularly unique sulfation patterns (i.e., 3-O-sulfation on GlcA residues) and distinct side-chain modifications (i.e., fucosylation on chondroitin sulfate). Structures of (A) disaccharide repeating units of different glycosaminoglycans and (B) the conformations of monosaccharides from heparan sulfate.  GAGs show biological function primarily through their interactions with the hundreds of GAG-binding proteins found on cellular surfaces and in extracellular spaces. The structural factors that affect the strength and specificity of binding are key to the elicitation of a proper biological response. HS, the most studied member of the GAG family, provides a good illustration of the wide range of physiological and pathophysiological functions affected. HS, for example, is involved in trimolecular interactions with growth factors and growth factor receptors, and thereby participates in regulating embryonic development. HS interacts with proteases and protease inhibitors in the blood to control the coagulation process and binds to viral envelope proteins as a receptor for viral infections. Also, heparin, a highly sulfated form of HS, is a commonly used anticoagulant drug in the clinic. A more complete discussion of the biological function of HS can be found in Chapters 17 and Chapter 38. This section uses the interaction between HS and proteins to illustrate how structural factors affect binding between GAGs and proteins in general. One factor that contributes to the structural diversity of HS-protein interactions is the conformational flexibility of L-IdoA and its derivative, L-IdoA2S (2-O-sulfo iduronic acid). Present in the pyranose form, the six-membered ring structure of IdoA or IdoA2S can adopt either chair or skew-boat conformations (Figure 3.3B). Until now, only the 4C1 chair conformation has been verified experimentally for GlcA and GlcN in HS, but both the 1C4 chair and the 2S0 conformations have been found for IdoA2S residues in crystal structures containing HS. In solution, NMR studies show IdoA2S and IdoA residues to be present in a mixture of 1C4 and 2S0 conformations. The conformational flexibility in IdoA residues likely allows orientation of the sulfate groups in HS to maximize the binding affinity to proteins. Structural elements that dictate preferences for one form over the other, including the possible effects from the sulfated monosaccharide sequences around the IdoA/IdoA2S residue, are subject to further investigation. A second factor contributing to structural diversity and selective interactions with certain HS-binding proteins is the size of the sulfated saccharide domains. HS isolated from natural sources shows domain-like structures, with clusters of six to eight saccharides forming the highly sulfated domains known as S-domains. These regions are separated by nonsulfated saccharide residues, consisting of GlcA-GlcNAc RUs, known as NAc-domains. The S-domains contain primarily IdoA residues that likely contribute the flexibility needed to optimize binding to proteins and elicit desired biological activities. The contribution of NAc-domains to the functions of HS has not been fully established. However, a possible role may be to appropriately position S-domains in a single polysaccharide chain for interaction with multiple proteins. One example is the interaction of heparin with antithrombin and thrombin. In this complex, one part of the heparin chain interacts with antithrombin, and another part of the heparin chain interacts with thrombin. Between the antithrombin-binding domain and thrombin-binding domain, a linker of six to seven saccharide residues exists. Unlike proteins and nucleic acids, the biosynthesis of GAGs is not regulated by a well-defined template. Instead, each member of the GAG family is synthesized by a unique pathway (Chapter 17).'
 'In many cases when a protein binds to an HS chain, it induces a change in conformation of the IdoA2S residue resulting in a better fit and enhanced binding. IdoA2S residues have always been found in domains rich in N-sulfo and O-sulfo groups (for biosynthetic reasons; Chapter 17), which is also where proteins usually bind. Thus, the greater degree of conformational flexibility in these modified regions may explain why so many more proteins bind with high affinity to heparin, HS, and DS than to other GAGs. The presence of an N-acetyl group in an N-acetylglucosamine residue changes the preferred conformation of the neighboring IdoA residue, showing that even minor modifications can influence conformation and chain flexibility. Binding to GAGs that have a low degree of sulfation may require larger domains in the protein to interact with longer stretches of an oligosaccharide. Molecular dynamic simulations on large heparin oligosaccharides, even in the presence of proteins, are possible with recent advances in computer performance (Online Appendix 38A). Such simulations can be used to predict the conformational flexibility of different domains within the chain and, when combined with recent advances in protein–GAG docking, can provide additional insights into GAG–protein interactions. Conformation of heparin oligosaccharides. (A) Glucosamine (GlcN) and glucuronic acid (GlcA) exist in the 4C1 conformation, whereas iduronic acid (IdoA) exists in equally energetic conformations designated 1C4 and 2S0. (B) Space-filling model of a heparin (more...) The discovery of multiple GAG-binding proteins led a number of investigators to examine whether there is a consensus amino acid sequence for GAG binding. In retrospect, this strategy was overly simplistic because it assumed that all GAG-binding proteins have a common evolutionary origin and would recognize the same oligosaccharide sequence within heparin or, at least, sequences that would share many common features. It is now known that the convergently evolved GAG-binding proteins interact with different oligosaccharide sequences. The binding sites in the protein always contain basic amino acids (lysine and arginine), whose positive charges presumably interact with the negatively charged sulfates and carboxylates of the GAG chains. However, the arrangement of these basic amino acids can be quite variable, consistent with the variable positioning of sulfo groups in the GAG partner. Selectivity is also a function of H-bonding and van der Waal interactions of amino acid residues with the oligosaccharide. Most proteins are formed from α-helices, β-strands, and loops. Therefore, to engage a linear GAG chain electrostatically, the positively charged amino acid residues must align along the same side of the protein segment. α-Helices have periodicities of 3.4 residues per turn, which would require the basic residues to occur every third or fourth position along the helix to align with an oligosaccharide. In β-strands, the amino acid side chains alternate sides every other residue. Thus, to bind a GAG chain, the positively charged residues in a β-strand would be located quite differently than in an α-helix. On the basis of the structure of several heparin-binding proteins that were available in 1991, Alan Cardin and Herschel Weintraub proposed that typical heparin-binding sites had the sequence XBBXBX or XBBBXXBX, where B is lysine or arginine and X is any other amino acid. From the structural arguments provided above, it should be obvious that only some of the basic residues in these sequences could participate in GAG binding, the actual number being determined by whether the peptide sequence exists as an α-helix or a β-sheet. It is now known that the presence of these sequences in a protein merely suggests a possible interaction with heparin (or another GAG chain), but it does not prove that the interaction occurs under physiological conditions. In fact, the predicted binding sites for heparin in fibroblast growth factor 2 (FGF2) turned out to be incorrect once the crystal structure was determined.']","This conformational flexibility in IdoA residues likely allows orientation of the sulfate groups in HS to maximize the binding affinity to proteins. The presence of an N-acetyl group in an N-acetylglucosamine residue changes the preferred conformation of the neighboring IdoA residue, showing that even minor modifications can influence conformation and chain flexibility. Binding to GAGs that have a low degree of sulfation may require larger domains in the protein to interact with longer stretches of an oligosaccharide.","Structural elements that dictate preferences for one form over the other, including the possible effects from the sulfated monosaccharide sequences around the IdoA/IdoA2S residue, are subject to further investigation. A second factor contributing to structural diversity and selective interactions with certain HS-binding proteins is the size of the sulfated saccharide domains. HS isolated from natural sources shows domain-like structures, with clusters of six to eight saccharides forming the highly sulfated domains known as S-domains. These regions are separated by nonsulfated saccharide residues, consisting of GlcA-GlcNAc RUs, known as NAc-domains. The S-domains contain primarily IdoA residues that likely contribute the flexibility needed to optimize binding to proteins and elicit desired biological activities.",0.75,0.6664041397336429,0.7945675044046618,0.0136986301369863,0.9999999999666667,1.0
"Complete the following paragraph: After more than three billion years of evolution, every free-living cell and every cell type within eukaryotic organisms remains covered with a dense and complex layer of glycans (Chapter 20). Even enveloped viruses that bud from infected cells carry with them the glycosylation patterns of the host. Additionally, most secreted molecules are glycosylated and extracellular matrices of multicellular organisms are rich in glycans and glycoconjugates. Matrices secreted by unicellular organisms when they congregate (e.g., bacterial biofilms [Chapter 21]) also contain glycans. Thus, evolution has repeatedly and consistently selected glycans as being the most diverse and flexible molecules to position at the interface between cells and the extracellular milieu.","['NCBI Bookshelf. A service of the National Library of Medicine, National Institutes of Health. Varki A, Cummings RD, Esko JD, et al., editors. Essentials of Glycobiology [Internet]. 4th edition. Cold Spring Harbor (NY): Cold Spring Harbor Laboratory Press; 2022.  doi: 10.1101/glycobiology.4e.4 Karen J. Colley, Ajit Varki, Robert S. Haltiwanger, and Taroh Kinoshita. This chapter provides an overview of glycosylation from the perspective of a single cell, taking into account the patterns of expression, topology, and other features of the biosynthetic and degradative enzymes that are common to most cell types. The focus is mostly on the organization of glycosylation in eukaryotic cells. Chapters 21 and 22 further address prokaryotic glycosylation mechanisms. After more than three billion years of evolution, every free-living cell and every cell type within eukaryotic organisms remains covered with a dense and complex layer of glycans (Chapter 20). Even enveloped viruses that bud from infected cells carry with them the glycosylation patterns of the host. Additionally, most secreted molecules are glycosylated and extracellular matrices of multicellular organisms are rich in glycans and glycoconjugates. Matrices secreted by unicellular organisms when they congregate (e.g., bacterial biofilms [Chapter 21]) also contain glycans. Thus, evolution has repeatedly and consistently selected glycans as being the most diverse and flexible molecules to position at the interface between cells and the extracellular milieu. Possible reasons include their relative hydrophilicity, flexibility, and mobility in aqueous environments and their extreme diversity, allowing facile short-term and long-term adaptations to changing environments and pathogen regimes. In bacteria, Archaea, and fungi, glycans serve critical structural roles in the cell wall and in resisting large differences in osmolarity between cytoplasm and environment. In eukaryotes, both secretory proteins and membrane proteins typically pass through an endoplasmic reticulum (ER)–Golgi pathway, the cellular system in which many major glycosylation reactions occur (see below). Most proteins in the blood plasma of animals (with the exception of albumin) are also heavily glycosylated, and the glycosylation of these and other secreted proteins may provide solubility, hydrophilicity, and negative charge, thus reducing unwanted intermolecular interactions and protecting against proteolysis. Cell-surface membrane proteins like receptors, adhesion molecules, and channels are typically glycosylated, and this modification can promote their proper folding, ensure their stability, and impact function. The classic work of George Palade indicated that most cell-surface and secreted proteins in eukaryotic cells are cotranslationally translocated into the ER where they are folded, modified, and subjected to quality control mechanisms. They then make their way via an intermediate compartment (IC) through multiple stacks of the Golgi apparatus, finally being distributed to various destinations from the trans-Golgi network (TGN). Secretory pathway proteins can be N-glycosylated, O-glycosylated, and/or modified with glycosylphosphatidylinositol (GPI) anchors, and some called proteoglycans are modified with attached glycosaminoglycan chains. The enzymes involved in each of these modification pathways are distinct. N-linked glycans and GPI anchors are preassembled before being transferred to proteins and then further modified in the ER–Golgi pathway. The stepwise assembly of O-linked glycans and glycosaminoglycans, as well as the glycosylation of lipids, involve reactions in both the ER and Golgi (Chapters 9–13 and 17). Figure 4.1 superficially depicts some steps in the synthesis of the major glycan classes in the ER–Golgi pathway of animal cells. Initiation and maturation of the major types of eukaryotic glycoconjugates in relation to subcellular trafficking in the ER–Golgi–plasma membrane pathway.'
 'NCBI Bookshelf. A service of the National Library of Medicine, National Institutes of Health. Varki A, Cummings RD, Esko JD, et al., editors. Essentials of Glycobiology [Internet]. 4th edition. Cold Spring Harbor (NY): Cold Spring Harbor Laboratory Press; 2022.  doi: 10.1101/glycobiology.4e.20 Pascal Gagneux, Vladislav Panin, Thierry Hennet, Markus Aebi, and Ajit Varki. This chapter provides an overview of glycosylation patterns across biological taxa and discusses glycan complexity and diversity from an evolutionary perspective. As much of the currently available information concerns vertebrates, this chapter emphasizes comparisons between vertebrate glycans and those of other taxa. Evolutionary processes that likely determine generation of glycan diversity are briefly considered, including intrinsic host glycan-binding protein functions and interactions of hosts with extrinsic pathogens or symbionts. The genetic code is shared by all known organisms, and core functions such as gene transcription and energy generation are conserved across taxa. Complex glycans are found in all organisms in nature, and some have argued that polysaccharides were the original macromolecules contributing to the origin of life itself. Regardless of their origins, they vary immensely in structure and expression (abundance and patterns of distribution in and on cells, secretions, and extracellular matrices) both within and between evolutionary lineages. Partly because of inherent difficulties in elucidating their structures, our knowledge about this diversity remains limited, and there are few comprehensive data sets. For many taxa, there is a lack of any information on glycan profiles. Sufficient data are available to indicate that even though all living cells require a glycocalyx (a dense and complex array of cell-surface glycans), there is no evidence for a universal “glycan code,” akin to the genetic code. Importantly, glycan structures are not directly encoded in the genome. They are synthesized and modified by a network of enzymes in a template-independent manner, and glycophenotypes represent the outcome of co-expressed gene networks and nutrients. Glycans expressed by most free-living Bacteria (Eubacteria) and Archaea have relatively little in common with those of eukaryotes. They contain a much larger number of monosaccharide types and include many glycans exclusive to such microbes. In contrast, most major glycan classes in animal cells seem to be represented in some related form among other eukaryotes, and sometimes in Archaea. Figure 20.1 shows a circular depiction of the phylogeny of cellular life on earth. The rich glycan diversity encountered in the best-studied vertebrate species suggests similar diversity in other groups of organisms, and existing information points to complicated patterns. On the one hand, glycan patterns can form “trends” and characterize entire phylogenetic lineages, wherein one encounters further biochemical variation with subsets unique to certain sublineages. Conversely, many glycans show discontinuous distribution across phyla and distantly related organisms can produce surprisingly similar glycans, using either shared, ancient pathways or convergently (independently) evolved mechanisms. Circular depiction of phylogeny of cellular forms of life on earth. The lines inside the circle represent all 2.3 million species that have been named. However, biologists have genomic sequences for only ∼5% of them; as more sequences become available, (more...) The broadest base of evolutionary information concerns asparagine–N-linked glycans, a “general” glycosylation system found in all domains of life (Chapter 9). In prokaryotes, protein N-glycosylation takes place in the periplasm at the plasma membrane, whereas in eukaryotes, covalent attachment of an oligosaccharide takes place intracellularly at the endoplasmic reticulum (ER) membrane, with the protein-bound glycan being further processed in the ER and Golgi.'
 'The diverse functions ascribed to glycans can be simply divided into two general categories: (i) structural and modulatory functions (involving the glycans themselves or their modulation of the molecules to which they are attached) and (ii) specific recognition of glycans by glycan-binding proteins. Of course, any given glycan can mediate one or both types of functions. The binding proteins in turn fall into two broad groups: lectins and sulfated GAG-binding proteins (Chapters 27, 28, and 38). Such molecules can be either intrinsic to the organism that synthesized the cognate glycans (e.g., see Chapters 31–36, 38, and 39) or extrinsic (see Chapters 37 and 42 for information concerning microbial proteins that bind to specific glycans on host cells). The atomic details of these glycan–protein interactions have been elucidated in many instances (Chapters 29 and 30). Although there are exceptions to this notion, the following general theme has emerged regarding lectins: monovalent binding tends to be of relatively low affinity, and such systems typically achieve their specificity and function by achieving high avidity, via interactions of multivalent arrays of glycans with cognate lectin-binding sites. Whenever a new tool (e.g., an antibody or lectin) specific for detecting a particular glycan is developed and used to probe its expression in intact organisms, it is common to find exquisitely specific temporal and spatial patterns of expression of that glycan in relation to cellular activation, embryonic development, organogenesis, and differentiation (see Chapter 41 for examples). Certain relatively specific changes in expression of glycans are also often found in the course of transformation and progression to malignancy (Chapter 47), as well as other pathological situations such as inflammation (Chapter 46). These spatially and temporally controlled patterns of glycan expression imply the involvement of glycans in many normal and pathological processes, the precise mechanisms of which are understood in only some cases. Remarkably little is still known about the evolution of glycosylation. There are clearly shared and unique features of glycosylation in different kingdoms and taxa. Among animals, there may be a trend toward increasing complexity of N- and O-glycans in more recently evolved (“higher”) taxa. Intraspecies and interspecies variations in glycosylation are also relatively common. It has been suggested that the more specific biological roles of glycans are often mediated by uncommon structures, unusual presentations of common structures, or further modifications of the commonly occurring saccharides themselves. Such unusual structures likely result from unique expression patterns of the relevant glycosyltransferases or other glycan-modifying enzymes. On the other hand, such uncommon glycans can be targets for specific recognition by infectious microorganisms and various toxins. Thus, at least some of the diversity in glycan expression in nature must be related to the evolutionary selection pressures generated by interspecies interactions (e.g., of host with pathogen or symbiont). In other words, the two different classes of glycan recognition mentioned above (mediated by intrinsic and extrinsic glycan-binding proteins) are in competition with each other with regard to a particular glycan target. The specialized glycans expressed by parasites and microbes that are of great interest from the biomedical point of view (Chapters 21, 22, 23, and 43) may themselves be subject to evolutionary selection pressures. These issues are further considered in Chapter 20, which also discusses the limited information concerning how various glycan biosynthetic pathways appear to have evolved and diverged in different life-forms. Numerous natural bioactive molecules are glycoconjugates, and the attached glycans can have dramatic effects on the biosynthesis, stability, action, and turnover of these molecules in intact organisms. For example, the sulfated glycosaminoglycan heparin and its derivatives are among the most commonly used drugs in the world. The aminoglycoside antibiotics all have carbohydrate components essential for activity. For this and many other reasons, glycobiology and carbohydrate chemistry have become increasingly important in modern biotechnology. Patenting a glycoprotein drug, obtaining FDA approval for its use, and monitoring its production all require knowledge of the structure of its glycans.']",Evolution has repeatedly and consistently selected glycans as being the most diverse and flexible molecules to position at the interface between cells and the extracellular milieu.,"Possible reasons include their relative hydrophilicity, flexibility, and mobility in aqueous environments and their extreme diversity, allowing facile short-term and long-term adaptations to changing environments and pathogen regimes. In bacteria, Archaea, and fungi, glycans serve critical structural roles in the cell wall and in resisting large differences in osmolarity between cytoplasm and environment. In eukaryotes, both secretory proteins and membrane proteins typically pass through an endoplasmic reticulum (ER)–Golgi pathway, the cellular system in which many major glycosylation reactions occur (see below). Most proteins in the blood plasma of animals (with the exception of albumin) are also heavily glycosylated, and the glycosylation of these and other secreted proteins may provide solubility, hydrophilicity, and negative charge, thus reducing unwanted intermolecular interactions and protecting against proteolysis. Cell-surface membrane proteins like receptors, adhesion molecules, and channels are typically glycosylated, and this modification can promote their proper folding, ensure their stability, and impact function.",1.0,0.6667210053099458,0.6475738647775793,0.05813953488372093,0.9999999999666667,1.0
"Complete the following paragraph: In eukaryotic cells, glycosylation occurs mostly in the endoplasmic reticulum (ER) and Golgi apparatus, whereas monosaccharide activation and interconversions occur mostly in the cytoplasm. Nucleotide sugar–specific transporters carry activated sugar donors into the Golgi and to a lesser extent into the ER. In some cases, nucleotide sugars are used to synthesize activated lipid-linked intermediates before glycan transfer. This chapter describes how cells accomplish these tasks, with an emphasis on animal cells.","['NCBI Bookshelf. A service of the National Library of Medicine, National Institutes of Health. Varki A, Cummings RD, Esko JD, et al., editors. Essentials of Glycobiology [Internet]. 4th edition. Cold Spring Harbor (NY): Cold Spring Harbor Laboratory Press; 2022.  doi: 10.1101/glycobiology.4e.5 Hudson H. Freeze, Michael Boyce, Natasha E. Zachara, Gerald W. Hart, and Ronald L. Schnaar. In nature, most glycans are synthesized by glycosyltransferases, enzymes that transfer activated forms of monosaccharides from nucleotide sugars and lipid-linked sugar intermediates to acceptors, including proteins, lipids, and growing glycan chains. Monosaccharide precursors are imported into the cell, salvaged from degraded glycans, or created enzymatically from other sugars within the cell. In eukaryotic cells, glycosylation occurs mostly in the endoplasmic reticulum (ER) and Golgi apparatus, whereas monosaccharide activation and interconversions occur mostly in the cytoplasm. Nucleotide sugar–specific transporters carry activated sugar donors into the Golgi and to a lesser extent into the ER. In some cases, nucleotide sugars are used to synthesize activated lipid-linked intermediates before glycan transfer. This chapter describes how cells accomplish these tasks, with an emphasis on animal cells. Glucose and fructose are the major carbon and energy sources for organisms as diverse as yeast and humans. Most organisms can synthesize the other monosaccharides needed for glycan biosynthesis from these sources. Not all of these biosynthetic pathways are equally active in all types of cells. However, there are some general principles. Monosaccharides must be activated to a high-energy donor for use in glycan synthesis. This process requires nucleoside triphosphates (typically UTP or GTP) and a glycosyl-1-P (monosaccharide with a phosphate at the anomeric carbon). They can be activated by a kinase (reaction 1) or generated from a previously synthesized activated nucleotide sugar (reactions 2 and 3):    The most common nucleotide sugar donors in animal cells are shown in Table 5.1. Sialic acids and their evolutionary ancestors (prokaryotic nonulosonic acids and Kdo) are the only monosaccharides in animals activated as CMP-mononucleotides. Iduronic acid does not have a nucleotide sugar parent because it is formed by epimerization of glucuronic acid after it is incorporated into glycosaminoglycan (GAG) chains. In some instances, one nucleotide sugar can be formed from another either by direct epimerization (reaction 2 above) or by a nucleotide exchange reaction (reaction 3 above). For example, UDP-Gal is made from UDP-Glc by exchange of Gal-1-P for Glc-1-P. Activated sugar donors in animal cells  Three types of sugar transporters carry sugars across the plasma membrane into cells. First are energy-independent facilitated diffusion transporters, such as the glucose transporter (GLUT) family of hexose transporters found in yeast and most mammalian cells. The genes encoding these proteins are named SLC2A (solute carriers 2A). Second are energy-dependent transporters—for example, the sodium-dependent glucose transporters (SGLT; gene names SLC5A) in intestinal and kidney epithelial cells. The third type includes transporters that couple ATP-dependent phosphorylation with sugar import. These are found in bacteria (Chapter 21) and are not covered in this chapter. GLUT family transporters were first described in yeast, where at least 18 genes are known. Humans have 14 GLUT homologs. GLUT transporters range in size from ∼40 to 70 kDa and have a similar structure, containing 12 membrane-spanning domains, which is typical of many eukaryotic transporters. The transmembrane domains form a barrel with a small pore for sugar passage. Compared with GLUT1, the other family members have a modest (28%–65%) amino acid identity.'
 'Figure 4.1 superficially depicts some steps in the synthesis of the major glycan classes in the ER–Golgi pathway of animal cells. Initiation and maturation of the major types of eukaryotic glycoconjugates in relation to subcellular trafficking in the ER–Golgi–plasma membrane pathway. This illustration outlines the different mechanisms and topology for initiation, (more...) In the ER–Golgi pathway, some glycan chains are made on the cytoplasmic face of intracellular membranes and flipped across to the other side, but most are added to the growing chain on the inside of the ER or the Golgi (Figure 4.1). Regardless, the portion of a molecule that faces the inside of the lumen of the ER or Golgi will ultimately face the outside of the cell or the inside of a secretory granule or lysosome. To date, there are no well-documented exceptions to this topological rule. Of course, these topological considerations are reversed for nuclear and cytoplasmic glycosylation (see below), because the active sites of the relevant glycosyltransferases for these reactions face the cytoplasm. Not surprisingly then, the types of glycans found on the two sides of the cell membrane so far appear to be distinct from each other. Some “leaderless secretory proteins” destined for the extracellular space never enter the ER lumen, but are instead transferred directly through the plasma membrane, by as yet poorly defined mechanisms, including cytokines such as IL-1β and IL-18, growth factors such as fibroblast growth factor 2 (FGF2), and galectins. Interestingly, many of these proteins have glycan binding properties, which would presumably cause problems if they instead traversed the glycan rich ER–Golgi pathway. Regardless of location, most glycosylation reactions use activated forms of monosaccharides (often nucleotide sugars and in some cases lipid-phosphate-linked sugars, such as dolichol phosphate mannose) as donors for glycosyltransferases (see Chapter 5 for a listing of some enzymes, their donors and corresponding transporters, and details about their biochemistry). A variety of glycan modifications also occur in nature (Chapter 6). Of these, the most common are generated by sulfotransferases, acetyltransferases, and methyltransferases, which use activated forms of sulfate (3′-phosphoadenyl-5′-phosphosulfate; PAPS), acetate (acetyl-CoA), and methyl groups (S-adenosylmethionine; AdoMet), respectively. Almost all donors for glycosylation reactions and glycan modifications are synthesized within the cytosolic compartment, from precursors of endogenous origin. In eukaryotes, most of these donors are actively transported across a membrane bilayer by specific multipass transporter proteins, becoming available for reactions within the lumen of the ER–Golgi pathway. For many years, the nucleus and cytosol (which are topologically semicontinuous via nuclear pores) were assumed to be devoid of glycosylation capacity. It is now established that distinct glycoconjugates are synthesized and reside within these compartments. Indeed, one of them (O-linked GlcNAc; Chapter 19) may well be quantitatively the most common type of glycoconjugate in many cells. Both the O-GlcNAc transferase (OGT) responsible for synthesizing O-linked GlcNAc on nuclear and cytosolic proteins and the O-GlcNAcase (OGA) that removes this monosaccharide are soluble proteins in these compartments. In addition, select cytosolic proteins can be modified with O-Glc, O-Fuc, or O-Man (Chapters 18 and 19). Because prokaryotic cells do not have an ER–Golgi pathway, they typically generate their cell-surface glycans at the interface of the cytoplasmic membrane and the cytoplasm or in the periplasm (see below). Other glycoconjugates like hyaluronan in vertebrate cells, chitin in invertebrate cells, and cellulose in plant cells are synthesized on the cytoplasmic face of the plasma membrane and simultaneously extruded across the membrane to the outside (Chapters 16, 24, and 26).'
 'This transport mechanism was determined biochemically in isolated vesicles and genetically in various mutant cell lines. The Km of the transporters ranges from 1 to 10 µm. Using in vitro systems, the transporters have been shown to increase the concentration of the nucleotide sugars within the Golgi lumen by 10- to 50-fold. This is usually sufficient to reach or exceed the calculated Km of glycosyltransferases that use these donors. Some known transporters for nucleotide sugars, PAPS (3′-phosphoadenosine-5′-phosphosulfate), and ATP are located in the Golgi membranes of mammals, yeast, protozoa, and plants. These proteins are antiporters and return the corresponding (more...) Most of these antiporters are found in the Golgi, but some are also found in the ER. They are organelle-specific and their location usually corresponds to the location of the relevant glycosyltransferases (Table 5.2; Figure 5.4). Nucleotide sugar import into the Golgi is not energy-dependent nor affected by ionophores. However, the import is competitively inhibited by the corresponding nucleoside monophosphates and diphosphates in the cytosol but not by the monosaccharides. There are also transporters for ATP and PAPS (3′-phosphoadenosine-5′-phosphosulfate), which are used for carbohydrate and protein sulfation. Nucleotide transport in Golgi and ER  The glucuronidation of bile and xenobiotic compounds in the ER explains the need for UDP-GlcA transporter in the ER of liver cells. The presence of a Golgi transporter is consistent with the location of the glycosyltransferases that use UDP-GlcA for the formation of GAG chains and other classes of glycans. The observation that reglycosylation of misfolded glycoproteins occurs in the ER (Chapter 39) explains the need for an ER UDP-Glc transporter. Under stressful conditions, synthesis of lumenal uridine diphosphatase increases to accommodate increased transport of UDP-Glc needed for reglycosylation of misfolded glycoproteins. The existence of UDP-GlcNAc, UDP-GalNAc, and UDP-Xyl transporters in the ER may mean that some reactions thought to occur exclusively in the Golgi may also occur in the ER. A good example is the synthesis of O-fucosylated proteins, such as Notch, in the ER versus fucosylation of N- and O-linked chains in the Golgi (Chapter 13). Other, as-yet-undiscovered, glycosylation reactions may also occur in the ER. Mutations in several nucleotide sugar transporters, UDP-Gal, CMP-Sia, GDP-Fuc, UDP-GlcA/UDP-GalNAc, and UDP-GlcNAc cause human glycosylation disorders (Chapter 45), generating incomplete sugar chains. Mutant mammalian cell lines also lack specific nucleotide sugar transporters (e.g., for UDP-Gal or CMP-Sia; Chapter 49). However, there is some “leakiness” in such mutants. For instance, loss of the UDP-Gal transporter in the Golgi of mutant MDCK (Madin–Darby canine kidney) cells decreases the synthesis of keratan sulfate and galactosylated glycoproteins and glycolipids, but leaves heparan and chondroitin sulfate unaffected. This is probably because the galactosyltransferases that synthesize the core region tetrasaccharide common to GAG chains have lower Km values for their donors (Chapter 17). Many putative transporters were identified by homology in the genomes of mammals, Drosophila melanogaster, C. elegans, plants, and yeast. Like the plasma membrane GLUT transporters discussed above, all are multimembrane-spanning (type III) proteins, but the level of amino acid identity does not give any clue to the substrate specificity. The UDP-GlcNAc transporters from mammalian cells and yeast are 22% identical, whereas mammalian CMP-Sia, UDP-Gal, and UDP-GlcNAc transporters have 40%–50% identity.']","Cells accomplish glycosylation tasks by utilizing nucleotide sugar-specific transporters to carry activated sugar donors into the Golgi and, to a lesser extent, into the ER. In certain instances, nucleotide sugars are utilized to produce activated lipid-linked intermediates before glycan transfer. This process predominantly occurs in the endoplasmic reticulum (ER) and Golgi apparatus in eukaryotic cells, while monosaccharide activation and interconversions primarily take place in the cytoplasm.","Glucose and fructose are the major carbon and energy sources for organisms as diverse as yeast and humans. Most organisms can synthesize the other monosaccharides needed for glycan biosynthesis from these sources. Not all of these biosynthetic pathways are equally active in all types of cells. However, there are some general principles. Monosaccharides must be activated to a high-energy donor for use in glycan synthesis. This process requires nucleoside triphosphates (typically UTP or GTP) and a glycosyl-1-P (monosaccharide with a phosphate at the anomeric carbon). They can be activated by a kinase (reaction 1) or generated from a previously synthesized activated nucleotide sugar (reactions 2 and 3)",1.0,0.6705427669041165,0.6744534354780249,0.024390243902439025,0.9999999999666667,0.8333333333333334
"Complete the following paragraph: The biosynthesis of glycans is primarily determined by glycosyltransferases that assemble monosaccharide moieties into linear and branched glycan chains. As might be expected from the complex array of glycan structures found in nature, glycosyltransferases constitute a very large family of enzymes.","['NCBI Bookshelf. A service of the National Library of Medicine, National Institutes of Health. Varki A, Cummings RD, Esko JD, et al., editors. Essentials of Glycobiology [Internet]. 4th edition. Cold Spring Harbor (NY): Cold Spring Harbor Laboratory Press; 2022.  doi: 10.1101/glycobiology.4e.6 James M. Rini, Kelley W. Moremen, Benjamin G. Davis, and Jeffrey D. Esko. Glycosyltransferases and glycosidases are responsible for the assembly, processing, and turnover of glycans. In addition, there are a number of transferases that modify glycans by the addition of acetyl, methyl, phosphate, sulfate, and other groups. This chapter covers the general characteristics of enzymes involved in glycan initiation, assembly, and processing, including aspects of substrate specificity, primary sequence relationships, structures, and enzyme mechanisms. The biosynthesis of glycans is primarily determined by glycosyltransferases that assemble monosaccharide moieties into linear and branched glycan chains. As might be expected from the complex array of glycan structures found in nature, glycosyltransferases constitute a very large family of enzymes. In many cases, they catalyze a group-transfer reaction in which the monosaccharide moiety of a simple nucleotide sugar donor (electrophile) substrate (e.g., UDP-Gal, GDP-Fuc, or CMP-Sia; Chapter 5) is transferred to the acceptor (nucleophile) substrate. In some instances, the donor substrates contain a lipid moiety, such as dolichol-phosphate, linked to mannose or glucose. For other glycosyltransferases, the donor substrate is dolichol-pyrophosphate, linked to an oligosaccharide, and in these cases the entire oligosaccharide is transferred en bloc to the acceptor substrate (Chapter 9). Similarly, other lipid-linked sugars serve as donor substrates for bacterial glycosyltransferases involved in the assembly of peptidoglycan (e.g., GlcNAc-MurNAc(pentapeptide)-undecaprenyl pyrophosphate), lipopolysaccharide, and capsules (Chapters 21 and 22). Glycosyltransferases that use monosaccharides, oligosaccharides, proteins, lipids, small organic molecules, and DNA as acceptor substrates have been characterized (activity to RNA has also been suggested), but only glycosyltransferases involved in the biosynthesis of glycoproteins, proteoglycans, and glycolipids are discussed in this chapter. Among these enzymes, the vast majority is responsible for elongating the glycan moieties of these glycoconjugates; the remainder is responsible for the transfer of either a mono- or oligosaccharide directly to the polypeptide or lipid. Generally speaking, the enzymes that elongate glycans act sequentially so that the product of one enzyme yields a preferred acceptor substrate for the subsequent action of another. The end result is a linear and/or branched structure composed of monosaccharides linked to one another. Acceptor recognition by these glycan-elongating glycosyltransferases does not typically involve the polypeptide or lipid moiety of the acceptor substrate when it exists, although there are several notable exceptions as discussed below. Glycosidases that remove monosaccharides to form intermediates that are then acted on by glycosyltransferases also play a role in the biosynthesis of some glycan types. These are to be contrasted with glycosidases that are involved in the degradation of glycans (e.g., in lysosomes [Chapter 44]). In addition, glycans can be modified by many other enzyme types, including sulfotransferases, phosphotransferases, O-acetyltransferases, O-methyltransferases, pyruvyltransferases, and phosphoethanolamine transferases. Most glycosyltransferases show a high degree of specificity for both their donor and acceptor substrates, and this led Saul Roseman and coworkers to advance the “one enzyme–one linkage” hypothesis. The human B blood group α1-3 galactosyltransferase exemplifies this concept.'
 'Glycosyltransferases that add O-Glc and O-GlcNAc to other serine and threonine residues in the EGF-like domain also exist and these enzymes also recognize a specific sequence motif and require a folded EGF-like domain. A number of the glycan-elongating glycosyltransferases that act on glycoproteins also recognize the polypeptide moiety of their acceptor substrates. The glycoprotein hormone GalNAc transferase (a member of the family of β1-4GalNAcTs) provides an interesting example in which modification of an N-glycan is dependent on the presence of the protein sequence motif Pro-X-Arg/Lys positioned several amino acids amino-terminally to the N-glycan being modified. The motif is typically followed closely by additional positively charged residues. The X-ray crystal structure of its acceptor substrate, human chorionic gonadotropin, shows that the Pro-X-Arg/Lys motif is at the beginning of a short surface-exposed helix that also contains the additional positively charged residues (Figure 6.2). The N-acetylgalactosamine residue transferred by this enzyme subsequently undergoes a biologically important 4-O-sulfation reaction that, in the case of luteinizing hormone and follicle-stimulating hormone, generates a determinant recognized by specific liver clearance receptors that remove them from the blood (Chapter 34). Glycosyltransferases that only elongate the fucose moiety added by POFUT1 or POFUT2 also exist (Chapter 13). The specificity shown by these enzymes stems from their ability to recognize both the fucose moiety and the EGF-like and TSR components of their acceptor substrates. Additional examples of enzymes that elongate glycans on specific glycoprotein substrates include the polysialyltransferases that act on neural cell adhesion molecule (NCAM) and neuropilin-2 (Chapter 15), and the N-acetylglucosaminyltransferase, EXTL3, that adds N-acetylglucosamine in α1-4-linkage to glucuronic acid in the first committed step to heparan sulfate biosynthesis on proteoglycans (Chapter 17). Human chorionic gonadotropin showing the determinants of recognition used by glycoprotein hormone N-acetylgalactosaminyl (GalNAc) transferase. Ribbon diagram of a fragment (residues 34–58) of human chorionic gonadotropin (PDB [protein data bank] (more...) In a variation on this theme, GlcNAc-1-phosphotransferase selectively modifies the N-glycans found on a large family of lysosomal enzymes that differ in three-dimensional structure and that lack any obvious and common protein sequence motif. In this case, modification by this enzyme has been shown to be dependent on lysine residues appropriately spaced and positioned relative to the N-glycan site (Chapter 33). The ER-resident glucosyltransferase, UGGT, is also able to transfer sugar to the N-glycans on a large but unique subset of glycoprotein substrates (Chapter 39). In this case, the enzyme adds a glucose moiety to the N-glycans of misfolded glycoproteins rendering them substrates for the ER-resident lectins calnexin and calreticulin. These lectins in turn recruit folding catalysts that promote correct disulfide bond formation and the cis–trans isomerization of proline residues. Approximately 1% of genes in the mammalian genome are involved in the production or modification of glycans. More than 750,000 glycosyltransferase sequences are known across all kingdoms, and the numbers are growing rapidly. Based on sequence analysis, they have been categorized into more than 110 glycosyltransferase families as described in the Carbohydrate-Active Enzymes (CAZy) database (Chapter 8). Although the absence of significant sequence similarity between members of one family and another constitutes the basis for this classification, short sequence motifs common to the members of more than one family have been identified.'
 'Upon entry of water in the enzyme active site, the formed glycosyl linkage is hydrolyzed in another SN2-like process to release glucose from the enzyme active site. Next to retention of configuration, the hydrolysis of interglycosidic bonds can also take place with “inversion of configuration” and is normally the result of an SN2 displacement–like process of a protonated aglycon by water. Although not necessarily relevant for the product formation in nature (sugar hemiacetals being prone to mutarotation at physiological pH), the different mechanisms employed by “retaining glycosidases” (involvement of a covalent intermediate) and “inverting glycosidases” (no covalent intermediate involved) bears consequences for their use in glycan synthesis. The use of Leloir-type glycosyltransferases in glycan synthesis requires access to the natural donor glycosides, which are sugar nucleotides. Thus, the intrinsic advantage of glycosyltransferase-mediated synthesis (excellent regio- and stereoselectivity) can be offset by the limitation on the access to the required donor glycosides. However, this challenge may be overcome by in situ biosynthesis/regeneration of the consumed sugar nucleotides. The power of glycosyltransferase-mediated glycan synthesis was demonstrated in 1992 by the synthesis of sialyl-Lewis x derivative 5 (Figure 54.2). Allyl lactoside 2, derived by chemical synthesis (see Chapter 53), is reacted with CMP-sialic acid 1 using a recombinant α-2,3-sialyltransferase (α-2,3-SiaT) as the catalyst. The resulting trisaccharide 3 is further extended with GDP-fucose 4 as the donor and recombinant fucosyltransferase (FucT) as the catalyst to deliver allyl sialyl-Lewis x. Glycosyltransferase-mediated synthesis of sialyl-Lewis x. (CMP) Cytidine monophosphate, (CDP) cytidine diphosphate, (CTP) cytidine triphosphate.  In the first step of the assembly line, the expensive sugar nucleotide, CMP-sialic acid, is consumed, and on transfer of the sialic acid, cytosine monophosphate (CMP) is produced. With the aid of two consecutive kinases (nucleoside monophosphate kinase and pyruvate kinase), CMP can be transformed in situ into the corresponding triphosphate (CTP), which is then condensed by the enzyme CMP-sialic acid synthetase with sialic acid to regenerate CMP-Neu5Ac 2. Glycosyltransferase-mediated synthesis of ganglio-oligosaccharides.  The synthesis of GalNAc-GD1a heptasaccharide 7 equipped with a biotin at the reducing end (replacing the sphingolipids present in the natural product) was accomplished by submitting synthetic lactoside 6 to the consecutive action of four glycosyltransferases, one of which (α-2,3-SiaT) was employed twice (Figure 54.3). By using this method with various donor sugar nucleotides and glycosyltransferases, a comprehensive series of glycosphingolipid glycans and their analogs have been obtained. The methodology, especially with respect to enzymatic sialic acid introduction, is competitive when compared to chemical gangliosides synthesis. Chemoenzymatic synthesis of a library of mammalian N-glycans.  The synthesis of complex, asymmetrically branched mammalian N-glycans was accomplished using combined chemical and glycosyltransferase-mediated enzymatic synthesis. As an example, decasaccharide 8 was prepared via contemporary solution phase chemical oligosaccharide synthesis (see Chapter 53). The asymmetrically branched decasaccharide features two nonreducing galactopyranose moieties, one of which is introduced as the tetra-acetate (in bold) whereas the other is unprotected. Decasaccharide 8 is thus designed to allow for specific enzymatic sialylation of the unprotected galactose residue (Figure 54.4).']","In many cases, glycosyltransferases catalyze a group-transfer reaction in which the monosaccharide moiety of a simple nucleotide sugar donor substrate is transferred to the acceptor substrate. Some glycosyltransferases use lipid-linked sugars as donor substrates, while others use monosaccharides, oligosaccharides, proteins, lipids, small organic molecules, and DNA as acceptor substrates. Most glycosyltransferases exhibit high specificity for both their donor and acceptor substrates, supporting the concept of the ""one enzyme–one linkage"" hypothesis.","In many cases, they catalyze a group-transfer reaction in which the monosaccharide moiety of a simple nucleotide sugar donor (electrophile) substrate (e.g., UDP-Gal, GDP-Fuc, or CMP-Sia; Chapter 5) is transferred to the acceptor (nucleophile) substrate. In some instances, the donor substrates contain a lipid moiety, such as dolichol-phosphate, linked to mannose or glucose. For other glycosyltransferases, the donor substrate is dolichol-pyrophosphate, linked to an oligosaccharide, and in these cases the entire oligosaccharide is transferred en bloc to the acceptor substrate (Chapter 9). Similarly, other lipid-linked sugars serve as donor substrates for bacterial glycosyltransferases involved in the assembly of peptidoglycan (e.g., GlcNAc-MurNAc(pentapeptide)-undecaprenyl pyrophosphate), lipopolysaccharide, and capsules (Chapters 21 and 22). Glycosyltransferases that use monosaccharides, oligosaccharides, proteins, lipids, small organic molecules, and DNA as acceptor substrates have been characterized (activity to RNA has also been suggested), but only glycosyltransferases involved in the biosynthesis of glycoproteins, proteoglycans, and glycolipids are discussed in this chapter.",1.0,0.6129485092884095,0.8999905629742772,0.028985507246376812,0.9999999999666667,1.0
"Complete the following paragraph: Over the years, many theories have been advanced regarding biological roles of glycans. Although there is evidence to support all the theories, exceptions to each one can also be found. This should not be surprising, given the abundance and enormous diversity of glycans in nature. Complexities also arise because glycans are frequently bound by microbes and microbial toxins, making them a liability to the organism that synthesizes them. Biological functions of glycans can be divided into three broad categories:","['NCBI Bookshelf. A service of the National Library of Medicine, National Institutes of Health. Varki A, Cummings RD, Esko JD, et al., editors. Essentials of Glycobiology [Internet]. 4th edition. Cold Spring Harbor (NY): Cold Spring Harbor Laboratory Press; 2022.  doi: 10.1101/glycobiology.4e.7 Pascal Gagneux, Thierry Hennet, and Ajit Varki. This chapter provides an overview of the biological functions of glycans in three broad categories: structural roles in, on, and outside cells; energy metabolism, including nutrient storage and sequestration; and information carriers, that is, specific recognition—most commonly by glycan-binding proteins of intrinsic or extrinsic origin. The chapter then presents some general principles for understanding and further exploring biological functions of glycans. For details, see the sources cited and other chapters in this book. As with other major classes of macromolecules, the biological functions of glycans span the spectrum from relatively subtle to crucial for development, growth, maintenance, or survival of the organism that synthesizes them. For many glycans, specific functions are not yet evident. The same glycan may also have different functions depending on which aglycone (protein or lipid) it is attached to. Over the years, many theories have been advanced regarding biological roles of glycans. Although there is evidence to support all the theories, exceptions to each one can also be found. This should not be surprising, given the abundance and enormous diversity of glycans in nature. Complexities also arise because glycans are frequently bound by microbes and microbial toxins, making them a liability to the organism that synthesizes them. Biological functions of glycans can be divided into three broad categories: (1) structural contributions (e.g., extracellular scaffolds: cell walls and extracellular matrices, protein folding and function); (2) energy metabolism (e.g., carbohydrates as carbon sources for storage and manipulation of animal behavior: pollination and seed dispersal); and (3) information carriers (e.g., molecular patterns recognized by glycan binding proteins [GBPs]) (Figure 7.1). The GBPs can be subdivided into two groups: (1) intrinsic GBPs, which recognize glycans from the same organism and (2) extrinsic GBPs, which recognize glycans from another organism. Intrinsic GBPs typically mediate cell–cell interactions or recognize extracellular molecules, but they can also recognize glycans on the glycocalyx of same cell. Extrinsic GBPs comprise pathogenic microbial adhesins, agglutinins, or toxins, which evolved for host colonization or invasion, but also include proteins that mediate symbiotic relationships or host defense directed at microbial glycans. Intrinsic and extrinsic glycan recognition can also act as opposing selective forces, simultaneously constraining and driving evolutionary change respectively (Chapter 20), likely accounting for the enormous diversity of glycans in nature. Further diversity arises because microbial pathogens also engage in “molecular mimicry,” evading immune reactions by decorating themselves with glycans typical of their hosts, and even in “glycan gimmickry,” modulating host immunity toward increased tolerance. Finally, most microbes are also themselves targets of pathogens that use microbial glycans for attachment and infection (e.g., bacteriophages that invade bacteria). General classification of the biological functions of glycans. A simplified and broad classification is presented, emphasizing the roles of organism-intrinsic and -extrinsic glycan-binding proteins in recognizing glycans. There is some overlap between (more...) Other general principles emerge based on existing literature. The biological consequences of experimentally altering glycosylation in various systems seem to be highly variable and unpredictable. Also, a given glycan can have different roles in different tissues, at different times in development (organism-intrinsic functions) or in different environmental contexts (organism-extrinsic functions). As a broad generalization, it can be stated that terminal sequences, unusual structures, and modifications of glycans are more likely to mediate specific biological functions within the organism. However, such glycans or their modifications are also more likely to be targets for pathogens and toxins.'
 'The biological consequences of experimentally altering glycosylation in various systems seem to be highly variable and unpredictable. Also, a given glycan can have different roles in different tissues, at different times in development (organism-intrinsic functions) or in different environmental contexts (organism-extrinsic functions). As a broad generalization, it can be stated that terminal sequences, unusual structures, and modifications of glycans are more likely to mediate specific biological functions within the organism. However, such glycans or their modifications are also more likely to be targets for pathogens and toxins. Perhaps as a consequence, intra- and interspecies variations in glycosylation are relatively common, and at least some of the diversity of glycans in nature may represent signatures of past or current host–pathogen or symbiotic interactions (Chapter 20). Finally, genetic defects in glycosylation are easily obtained in cultured cells, but often have limited biological consequences in vitro. In contrast, the same defects often have major and even catastrophic consequences in whole organisms. This generalization indicates that many major functions of glycans are operative mainly within an intact, multicellular organism. Some of these principles are briefly discussed below. Experimental approaches to elucidating biological roles of glycans include prevention of initial glycosylation, prevention of glycan chain elongation, alteration of glycan processing, enzymatic or chemical deglycosylation of completed chains, genetic elimination of glycosylation sites, addition of unnatural monosaccharides, and studies of mutant and naturally occurring genetic variants in glycosylation enzymes. The consequences of such manipulations can range from being essentially undetectable, to the complete loss of particular functions, or even to loss of the entire glycoconjugate bearing the altered glycan. Even within a particular class of molecules (e.g., cell-surface receptors), the effects of altering glycosylation are variable and unpredictable. Moreover, the same glycosylation change can have markedly different effects in different cell types or when studied in vivo or in vitro. The effect may depend on the structure of the glycan, the biological context (including interactions with cognate glycan receptors), GBPs, and the specific biological function. Given all of the above considerations, it is difficult to predict the functions that a given glycan on a given glycoconjugate might mediate and its relative importance to the organism. Glycans have many protective, stabilizing, organizational, and barrier functions. The glycocalyx that covers all eukaryotic cells and the polysaccharide coats of various prokaryotes represent a substantial physical barrier. Cellulose provides the material for cell walls in plants, and chitin fulfills this role in fungi. Arthropods evolved resistant chitin-rich exoskeletons. Cellulose and chitin represent the two most abundant biopolymers on the planet. In multicellular organisms, glycan constituents of matrix molecules, such as proteoglycans, are important for maintenance of tissue structure, porosity, and integrity. Such molecules can also contain binding sites for other specific glycans, which, in turn, aid overall matrix organization. The external location of glycans on most glycoproteins can provide a general shield, protecting the underlying polypeptide from recognition by proteases (mucins), blocking antibody binding (viral glycoproteins), and even (as in the case of mucins) protecting entire tissue surfaces from microbial attachment. Another structural role of glycans is their involvement in folding of newly synthesized polypeptides in the endoplasmic reticulum (ER) and/or in the subsequent maintenance of protein solubility and conformation (Chapter 39). Indeed, when some proteins are incorrectly glycosylated, they can fail to fold properly and/or to exit the ER. Such misfolded glycoproteins are translocated to the cytoplasm for degradation in proteasomes. Conversely, there are examples of glycoproteins whose synthesis, folding, trafficking, sensitivity to proteolysis, or immune recognition seem unaffected by altering their glycosylation. Moreover, inhibitors (Chapter 55) or genetic mutations (Chapter 45) that only affect later steps of glycan processing often do not interfere with basic structural functions. Although structural functions of glycans are obviously of great importance to the intact organism, they do not explain the evolution of such a diverse and complex range of molecules.'
 'Glycomic analysis thus needs to be complemented by classical methods such as tissue-section staining or flow cytometry, using lectins or glycan-specific antibodies that aid in understanding the glycome by taking into account the heterogeneity of glycosylation at the level of the different cell types and subcellular domains in the tissue under study. This is even more important because of the common observation that removing cells from their normal milieu and placing them into tissue culture can result in major changes in the glycosylation machinery of the cell. However, such classical approaches suffer from poor quantitation and relative insensitivity to structural details. A combination of the two approaches is now potentially feasible via laser-capture microdissection of specific cell types directly from tissue sections, with the resulting samples being studied by mass spectrometry. New methods for in situ imaging and characterization of glycans in the intact “forest” are clearly needed. Because most of the genes involved in glycan biosynthetic pathways have been cloned from multiple organisms, it is possible today to obtain an indirect genomic and transcriptomic view of the glycome in a specific cell type (Chapter 8). However, given the relatively poor correlation between mRNA and protein levels, and the complex assembly line and competitive nature of the cellular Golgi glycosylation pathways, even complete knowledge of the mRNA expression patterns of all relevant genes in a given cell cannot allow accurate prediction of the distribution and structures of glycans in that cell type. Thus, there is as yet no reliable indirect route toward elucidating the glycome, other than by actual analysis using an array of methods. Many mutant variants of cultured cell lines with altered glycan structures and specific glycan biosynthetic defects have been described, the most common of which are lectin-resistant (Chapter 49). Indeed, with few exceptions, mutants with specific defects at most steps of the major pathways of glycan biosynthesis have been found in cultured animal cells. The use of such cell lines has been of great value in elucidating the details of glycan biosynthetic pathways. Their existence implies that many types of glycans are not crucial to the optimal growth of single cells growing in the sheltered and relatively unchanging environment of the culture dish. Rather, most glycan structures must be more important in mediating cell–cell and cell–matrix interactions in intact multicellular organisms and/or interactions between organisms. In keeping with this supposition, genetic defects completely eliminating major glycan classes in intact animals all cause embryonic lethality (Chapter 45). As might be expected, naturally occurring viable animal mutants of this type tend to have disease phenotypes of intermediate severity and show complex phenotypes involving multiple systems. Less severe genetic alterations of outer chain components of glycans tend to give viable organisms with more specific phenotypes (Chapter 45). Overall, there is much to be learned by studying the consequences of natural or induced genetic defects in intact multicellular organisms, including humans (Chapter 45). A major theme of this volume is the exploration and elucidation of the biological roles of glycans. It is interesting to note that, in the short time since the first edition, we have gone from asking “what is it that glycans do anyway?” to having to explain a large number of complex and sometimes nonviable glycosylation-modified phenotypes in humans, mice, flies, and other organisms. Like any biological system, the optimal approach carefully considers the relationship of structure and biosynthesis to function (Chapter 7). As might be imagined from their ubiquitous and complex nature, the biological roles of glycans are remarkably varied. Indeed, asking what these roles are is akin to asking the same question about proteins. Thus, all of the proposed theories regarding glycan function turn out to be partly correct, and exceptions to each can also be found. Not surprisingly for such a diverse group of molecules, the biological roles of glycans also span the spectrum from those that are subtle to those that are crucial for the development, growth, function, or survival of an organism (Chapter 7). The diverse functions ascribed to glycans can be simply divided into two general categories: (i) structural and modulatory functions (involving the glycans themselves or their modulation of the molecules to which they are attached) and (ii) specific recognition of glycans by glycan-binding proteins. Of course, any given glycan can mediate one or both types of functions.']","structural contributions, energy metabolism, and information carriers.","(1) structural contributions (e.g., extracellular scaffolds: cell walls and extracellular matrices, protein folding and function); (2) energy metabolism (e.g., carbohydrates as carbon sources for storage and manipulation of animal behavior: pollination and seed dispersal); and (3) information carriers (e.g., molecular patterns recognized by glycan binding proteins [GBPs])",1.0,0.7415597662901934,0.6760083818803211,0.011235955056179775,0.9999999999666667,1.0
"Complete the following paragraph: The glycome comprises all the glycan structures synthesized by an organism. It is analogous to the genome, the transcriptome, and/or the proteome but even more dynamic, and it has higher structural complexity that has yet to be fully defined. Cells of different types synthesize a subset of the glycome based on their differentiation state and physiological environment.","['NCBI Bookshelf. A service of the National Library of Medicine, National Institutes of Health. Varki A, Cummings RD, Esko JD, et al., editors. Essentials of Glycobiology [Internet]. 4th edition. Cold Spring Harbor (NY): Cold Spring Harbor Laboratory Press; 2022.  doi: 10.1101/glycobiology.4e.51 Pauline M. Rudd, Niclas G. Karlsson, Kay-Hooi Khoo, Morten Thaysen-Andersen, Lance Wells, and Nicolle H. Packer. The term genomics arose from the availability of complete genome sequence data as well as computational methods for their analysis. However, <2% of genes in the human genome encode proteins. These genes are transcribed into messenger RNAs (mRNAs) that make up the “transcriptome,” of which ∼30% are assigned to protein coding. The total complement of proteins expressed by the cell is collectively termed the “proteome.” Most eukaryotic proteins are post translationally modified (e.g., by phosphorylation, sulfation, oxidation, ubiquitination, acetylation, methylation, lipidation, or glycosylation). These modifications, combined with alternative RNA splicing in eukaryotes, render the proteome considerably more complex than the transcriptome. Although it has been estimated that approximately 120,000 different protein splice forms are expressed by human cells, the total number of modified proteoforms is likely to be at least an order of magnitude higher. The systems-level analysis of all proteins expressed by cells, tissues, or organisms is known as “proteomics.” The proteome, like the transcriptome, but unlike the DNA sequence of the genome, is fundamentally dynamic. The repertoire of proteins expressed by a cell is highly dependent on tissue type, microenvironment, and stage within the life cycle. As cells receive external and internal cues in the form of growth factors, hormones, metabolites, or cell–cell interactions, the expression of various genes is modulated and may be transcribed at levels ranging from silence to more than 104 mRNA copies per cell and 107 protein molecules per cell. Thus, proteomes and their modifications vary during cell differentiation, activation, trafficking, and malignant transformation. However, no systems-level analysis of a biological process is complete without interrogating the glycome, defined as the entire complement of glycan structures (be it protein-/lipid-bound or -free) produced by cells, in addition to the genome, transcriptome, proteome, lipidome and metabolome. Vertebrates synthesize N-linked and O-linked glycoproteins, glycolipids (Chapters 11 and 12), proteoglycans, glycosaminoglycans (GAGs), and glycosylphosphatidylinositol (GPI) anchors covalently attached to proteins, as well as free oligosaccharides (Chapter 3). As with the proteome, each cell type has its own distinct glycome that is governed by local cues and the metabolic state of the cell. Other organisms have distinct glycomes; those of plants (Chapter 24) and prokaryotes (Chapter 21) are distinctly different from the vertebrate and invertebrate glycomes (Chapters 25–27). The size of any particular cellular glycome has not yet been established, but the combinatorial possibilities that can occur with numerous glycan structures on multiple glycoconjugates means that determining a “complete” glycome is not straightforward. The notion that glycans should be studied as a totality (glycomics), as well as simply one glycan or glycoconjugate at a time, developed when it became apparent that glycans form patterns on cells that change during development (Chapter 41), cancer progression (Chapter 47), infection (Chapters 42 and 43), and many other diseases (Chapters 44–46). Many glycan-binding proteins, such as lectins, are oligomerized on the cell surface and interact with multivalent arrays of glycans on the same or opposing cells (Chapters 28–38). Sometimes, multiple discrete glycans and their matching glycan-binding proteins work together to engage two cells or to deliver signals between cells.'
 ""Many glycan-binding proteins, such as lectins, are oligomerized on the cell surface and interact with multivalent arrays of glycans on the same or opposing cells (Chapters 28–38). Sometimes, multiple discrete glycans and their matching glycan-binding proteins work together to engage two cells or to deliver signals between cells. Thus, the term “glycomics” was coined to describe the many aspects of glycobiology that can be understood only with a systems-level analysis of the glycome. Clues regarding the composition and complexity of the glycome are found in the genome, transcriptome, and proteome of a cell. Thus, if a gene encoding a glycosyltransferase is not expressed (absent from the transcriptome), no glycans in that cell can carry the sugar transferred by that glycosyltransferase at that particular time. The action of many glycosyltransferases and glycoside hydrolases competing for the same substrates in the biosynthetic pathway renders the complete glycome impossible to predict with current tools and knowledge. As an example, the reduced expression of a single glycosyltransferase can perturb the biosynthesis of dozens of glycans. Furthermore, unlike the genome, the glycome is sensitive to exogenous nutrient levels and metabolic fluxes including salvage pathways. Thus, variations in dietary monosaccharides, such as glucose, galactose, glucosamine, fucose, mannose, and N-glycolylneuraminic acid (Chapter 15), may change the composition of the glycome. The numerous factors that influence the glycome (the transcriptome, the proteome, environmental nutrients, the secretory machinery, pH, and many other determinants) create a glycome that is highly diverse, adaptable, and dynamic. Thus, the glycome of a cell can change dramatically over time. It is this enormous structural plasticity in response to cellular and environmental states that underlies the essential roles of glycans in development, communication, and disease processes. Because the glycome is influenced by both genetic and environmental factors, the information contained therein sheds light on intra- and interspecies variations, including providing indicators of disease that can be used for diagnosis and for monitoring the efficacy of drugs. Comparative glycomics, the comparison of glycome profiles obtained from two or more individuals, tissues, or conditions of interest, is therefore an exciting frontier in biology and medicine. For example, as discussed in detail in Chapter 47, numerous changes in the glycome have been associated with malignancy and metastasis, including altered N- and O- linked protein glycosylation, up-regulation of conjugated sialylated and fucosylated glycans, and altered GAGs. Regardless of functional consequence, a change in the glycome that is highly correlated with malignancy (or any disease) may serve as a diagnostic marker candidate. Notably, glycans altered in a disease may reflect downstream consequences of the disease on remote organs, changes in the patient's immune system, or other effects of the disease. One major caveat is the currently unknown extent of natural variation among individual human glycomes. The glycome is known to respond to dietary and environmental changes and vary in elusive ways with age, gender, and acquired disease susceptibility (Chapter 46). Studies of evolutionary biology also have much to gain from comparative glycomics. Evolution of the vertebrate immune system, for example, was accompanied by the acquisition of new classes of glycan-binding proteins, including Siglecs (Chapter 35) and selectins (Chapter 34). Likewise, the glycomes and glycan-binding proteins of microbes and their vertebrate hosts appear to have coevolved in some instances (Chapter 42). The glycome can be determined at different levels of granularity. First, “glycomics” constructs an inventory of glycans separated from their protein or lipid scaffolds from the cell, organ, or organism of interest. This is an important starting point for any comprehensive glycome analysis. The second level of analysis defines specific glycans associated with individual proteins or lipids. Analysis of the complete repertoire of a cell's glycoconjugates, including the microheterogeneity of glycans present at individual sites of attachment, lies, for example, at the intersection of glycomics and proteomics (“glycoproteomics”) and of glycomics and lipidomics (“glycolipidomics”).""
 'The final complete degradation of most eukaryotic glycans is generally performed by multiple glycosidases in the lysosome. Once degraded, their individual unit monosaccharides are then typically exported from the lysosome into the cytosol for reuse (Figure 1.8). In contrast to the relatively slow turnover of glycans derived from the ER–Golgi pathway, the O-GlcNAc monosaccharide modifications of the nucleus and cytoplasm appear more dynamic (Chapter 19). In some instances, extracellular or intracellular free glycans can also serve as signaling molecules (Chapter 40). Biosynthesis, use, and turnover of a common monosaccharide. This schematic shows the biosynthesis, fate, and turnover of galactose, a common monosaccharide constituent of animal glycans. Although small amounts of galactose can be taken up from the outside (more...) Unlike oligonucleotides and proteins, glycans are not commonly found in a linear, unbranched fashion. Even when linear (e.g., GAGs), they often contain a variety of substituents, such as sulfate groups, which are not uniformly distributed. Thus, complete sequencing of glycans is usually impossible by a single method and requires iterative combinations of physical, chemical, and enzymatic approaches that together yield the details of structure (for a discussion of low- and high-resolution separation and analysis, including mass spectrometry and nuclear magnetic resonance [NMR], see Chapter 50). Less detailed information on structure may be sufficient to explore the biology of some glycans and can be obtained by simple techniques, such as the use of enzymes (endoglycosidases and exoglycosidases), lectins, and other glycan-binding proteins (Chapters 48 and 50), chemical modification or cleavage, metabolic radioactive labeling, antibodies, or cloned glycosyltransferases (Chapters 53 and 54). Glycosylation can also be perturbed in various ways, for example, by glycosylation inhibitors and primers (Chapters 55 and 56) and by genetic manipulation of glycosylation in intact cells and organisms (Chapter 49). Directed in vitro synthesis of glycans by chemical and enzymatic methods has also made great strides in recent years, providing many new tools for exploring glycobiology (Chapters 53, 54, and 57). The generation of complex glycan libraries by a variety of routes has further enhanced this interface of chemistry and biology (Chapters 53 and 54), including the generation of glycan microarrays. Analogous to genomics and proteomics, glycomics represents the systematic methodological elucidation of the “glycome” (the totality of glycan structures) of a given cell type or organism (Chapters 51 and 52). In reality, the glycome is far more complex than the genome or proteome. In addition to the vastly greater structural diversity in glycans, one is faced with the complexities of glycosylation microheterogeneity (see above) and the dynamic changes that occur in the course of development, differentiation, metabolic changes, aging, malignancy, inflammation, or infection. Added diversity arises from intraspecies and interspecies variations in glycosylation. Thus, a given cell type in a given species can manifest a large number of possible glycome states. Glycomic analysis today generally consists of extracting entire cell types, organs, or organisms; releasing all the glycan chains from their linkages; and cataloging them via approaches such as mass spectrometry. In a variation called glycoproteomics, the glycans are analyzed while still attached to protease-generated fragments of glycoproteins. The results obtained represent a spectacular improvement over what was possible a few decades ago, but they are still analogous to cutting down all the trees in a forest and cataloging them, without attention to the layout of the forest and the landscape (Chapter 15 discusses this complex issue from the perspective of just one monosaccharide class, sialic acids; see Figure 15.3). Glycomic analysis thus needs to be complemented by classical methods such as tissue-section staining or flow cytometry, using lectins or glycan-specific antibodies that aid in understanding the glycome by taking into account the heterogeneity of glycosylation at the level of the different cell types and subcellular domains in the tissue under study.']","The glycome comprises all the glycan structures synthesized by an organism. It is analogous to the genome, the transcriptome, and the proteome but even more dynamic, and it has higher structural complexity that has yet to be fully defined. Cells of different types synthesize a subset of the glycome based on their differentiation state and physiological environment.","The human and mouse glycomes have many glycan structures in common, but a few are unique or have divergent functional properties. For example, unlike humans, rodents synthesize cytidine monophospho-N-glycolylneuraminic acid (CMP-Neu5Gc), for the transfer of Neu5Gc to N- and O-glycans (Chapter 15). Similarly, the gene encoding α-1,3-galactosyltransferase (A3GALT2) is functional in the mouse but not in human (Chapter 20). The human and fly genomes include orthologous genes encoding GTs that catalyze the same reaction, but they also have GTs that are unique. Thus, protein O-fucosyltransferase 1 (POFUT1) in mammals and Ofut1 in flies transfer fucose to Notch receptors and are examples of an evolutionarily conserved GT. In contrast, flies do not make complex N-glycans with four branches, which are common in mammalian glycoproteins (Chapters 9 and 20). Additionally, flies make unique glycolipids absent from mammals that are important for conserved signaling pathways mediated by the epidermal growth factor (EGF) receptor or Notch receptors (Chapter 26).",1.0,0.7345134373060105,0.5873307426522445,0.025974025974025976,0.9999999999666667,1.0
"Complete the following paragraph: In mammals, there are two different catalytic STT3 subunits that both associate with ribophorins I and II, OST48, OST4, and DAD1 proteins (homologs of the yeast Ost1p, Swp1p, Wbp1p, Ost4p, and Ost2p, respectively).","['The Man5GlcNAc2-P-P-Dol precursor translocates across the ER membrane bilayer via a “flippase” encoded by the RFT1 locus in yeast. Man5GlcNAc2-P-P-Dol is extended by the addition of four Man and three Glc residues transferred from Dol-P-Man and Dol-P-Glc, respectively. Dol-P-Man and Dol-P-Glc donors are formed on the cytoplasmic side of the ER membrane from GDP-Man and UDP-Glc. Dol-P-Man and Dol-P-Glc must also be flipped across the ER membrane. Mammalian MPDU1 is an ER membrane protein necessary for the utilization of Dol-P-Man and Dol-P-Glc in the ER lumen in the synthesis of the mature N-glycan precursor Glc3Man9GlcNAc2-P-P-Dol (Figure 9.3). This 14-sugar glycan is transferred by oligosaccharyltransferase (OST) to Asn in receptive Asn-X-Ser/Thr sequons in protein regions that have translocated across the ER membrane. OST is a multisubunit protein complex in the ER membrane, except in the case of the kinetoplastids (Chapter 43). OST catalyzes the transfer of the oligosaccharide from Dol-P-P to Asn-X-Ser/Thr in newly synthesized regions of proteins during passage through the translocon into the ER. OST has a high specificity for the completely assembled oligosaccharide, which is Glc3Man9GlcNAc2 in most eukaryotes. When incomplete oligosaccharides are assembled, transfer efficiency is reduced, resulting in hypoglycosylation of glycoproteins that mature with empty N-glycan sites. All OST subunits are transmembrane proteins with between one and 13 transmembrane domains. The OST complex cleaves the high-energy GlcNAc-P bond, releasing Dol-P-P in the process (Figure 9.3). Yeast OST is comprised of eight different subunits Stt3p, Ost1p, Wbp1p, Swp1p, Ost2p, Ost4p, Ost5p, and Ost3p or Ost6p. Stt3p is the catalytic subunit of the enzyme. The two OST complexes (containing either of the thioredoxin-subunit Ost3p or Ost6p) have a different protein–substrate specificity. The complexity of OST increases in multicellular organisms. In mammals, there are two different catalytic STT3 subunits that both associate with ribophorins I and II, OST48, OST4, and DAD1 proteins (homologs of the yeast Ost1p, Swp1p, Wbp1p, Ost4p, and Ost2p, respectively). The STT3A complex (OSTA), closely associated with the translocon, contains the KCP2 and DC2 subunits, whereas the STT3B complex (OSTB) that has either MAGT1 or TUSC3 (homologs of yeast Ost3p/Ost6p) glycosylates polypeptides posttranslationally after their translocation into the ER. On binding to the catalytic STT3 subunit, the client peptide adopts a 180° turn, making polypeptide folding a competing reaction for N-glycosylation. Indeed, the thioredoxin subunits of the OST complex (Ost3p/Ost6p; MAGT1/TUSC1) modulate the oxidative folding of the client polypeptide, thereby extending the polypeptide substrate range of OST. As of February 2021, the UniProt database reports 1911 N-glycosylation sites in yeast and 13,648 in murine glycoproteins. Following the covalent attachment of the 14-sugar glycan to Asn-X-Ser/Thr in a protein, processing reactions trim the N-glycan in the ER. The initial steps have key roles in regulating glycoprotein folding via interactions with ER chaperones that recognize specific features of the trimmed N-glycan (Chapter 39).'
 'Retrotranslocation of misfolded glycoproteins from the ER lumen to the cytosol for proteasomal degradation ultimately depends on various protein complexes, some of which contain integral ER membrane proteins. ER membrane proteins with folding defects in the cytosolic domain are extracted from the ER membrane by the Doa10 complex via ERAD-C, whereas those in which the folding defect is present in the luminal (ERAD-L) or membrane (ERAD-M) domains use the Hrd1 complex. Both Doa10p and Hrd1p are integral membrane proteins with E3 ligase activity in their cytosolic portion. Other proteins in these complexes include chaperones, proteins with E2 ubiquitin-conjugating activity or proteins that recognize misfolded proteins. For instance, glycoproteins with N-glycans containing a terminal α1–6Man are bound by Yos9p and undergo ERAD only if the N-glycans are in unstructured protein, a feature recognized by Hrd3p in the Hrd1 complex. Finally, proteins common to both complexes such as yeast Cdc48 (p97 in mammals) are responsible for membrane extraction of misfolded proteins in an ATP-dependent manner. Although the pore by which ERAD-L substrates are actually transported to the cytosol has not been identified, it is known that the substrates must be unfolded in the ER lumen. Although studies on ERAD complexes have been mainly performed in S. cerevisiae, mammalian cells have homologs of nearly all proteins described in the yeast complexes. N-Glycans are removed from unfolded glycoproteins during proteasomal degradation. A cytoplasmic peptide:N-glycanase (PNGase, N-glycanase, NGLY1) plays an important role in both removing the glycan and constructing an efficient predegradation complex (Figure 39.3). NGLY1 recognizes only misfolded or denatured glycoproteins. The enzyme is bound to the proteasome by subunits S4 and HR23B as a complex with Cdc48, a component of ERAD complexes. Degradation of the released N-glycan occurs in two stages. First, cleavage occurs between the two GlcNAcs (chitobiose) in the core of the N-glycan via a cytoplasmic endo-β-N-acetylglucosaminidase. A cytoplasmic α-mannosidase cleaves up to four Man residues to generate Man5GlcNAc (Man c, d, e, f, and g in Figure 39.1). This glycan is then taken into the lysosome via an ATP-dependent lysosomal membrane transporter for final degradation to monosaccharides. Whether these free glycans have any function in the cytosolic/nuclear compartment before they are degraded has not been investigated. Degradation of oligomannosyl N-glycans in the endoplasmic reticulum (ER), cytoplasm, and lysosomes. Specific pathways exist for the degradation of free glycans released from misfolded glycoproteins and glycopeptides generated within the ER. Dolichol-linked (more...) Protein O-fucosyltransferases (Ofut1 in Drosophila; POFUT1 and POFUT2 in mammals) are soluble ER enzymes that O-fucosylate Ser/Thr residues. Ofut1 and POFUT1 add fucose to epidermal growth factor (EGF)–like repeats, whereas POFUT2 adds fucose to thrombospondin (TSR) type 1–like repeats (Chapter 13). EGF and TSR domains are present as tandem repeats in numerous proteins of multicellular organisms. Ofut1/POFUT1 and POFUT2 selectively fucosylate only properly folded protein domains, suggesting a role of this glycosylation in folding quality control. Indeed, several POFUT2 targets including ADAMTSL1 and ADAMTSL2 (scaffolding proteins in the extracellular matrix), ADAMTS9 (a matrix remodeling protease), and ADAMTS13 (the von Willebrand factor cleaving protease) strictly require O-fucosylation for efficient secretion.'
 'Ofut1/POFUT1 and POFUT2 selectively fucosylate only properly folded protein domains, suggesting a role of this glycosylation in folding quality control. Indeed, several POFUT2 targets including ADAMTSL1 and ADAMTSL2 (scaffolding proteins in the extracellular matrix), ADAMTS9 (a matrix remodeling protease), and ADAMTS13 (the von Willebrand factor cleaving protease) strictly require O-fucosylation for efficient secretion. Indeed, O-fucosylation appears to stabilize folded TSRs. The case of Ofut1/POFUT1 is a bit more ambiguous. Studies performed in Drosophila on the efficiency of cell-surface expression of the Ofut1 substrate Notch showed that Ofut1 is required as a chaperone for Notch folding and cell-surface expression, and that chaperone activity is largely independent of the O-fucosyltransferase activity. In contrast, POFUT1 does not appear to be absolutely required for cell-surface expression of Notch receptors in all mammalian cells, suggesting that cell-specific chaperones may be able to compensate for loss of POFUT1 in certain contexts. It has been reported recently that O-mannosylation in S. cerevisiae ER might be responsible for terminating futile cycles of association–dissociation between proteins unable to attain their native conformation and Kar2p (the budding yeast homolog of mammalian BiP/Grp78 chaperone). The loss of CNX and CRT in most multicellular organisms causes a severe phenotype. Mice deficient in CNX reach full term, but half die within 2 days of birth, and very few survive beyond 3 months. The runts that survive have obvious motor disorders with loss of large myelinated nerve fibers. CRT-deficient mice and ERp57-null mice also show embryonic lethality. In contrast, CNX and CRT null Caenorhabditis elegans mutants are viable. Yeast has CNX or CNX-like lectins (but not CRT), whereas trypanosomatid protozoa have only CRT. Another important conserved mammalian ER lectin resident is calmegin, expressed only in the testes during spermatogenesis. Calmegin shares ∼60% homology with CNX in mice. Mice deficient in calmegin are nearly sterile despite producing normal-looking sperm. The sperm are defective in migration into the oviducts and they do not adhere to the zona pellucida. UGGT is absent from S. cerevisiae but not from Schizosaccharomyces pombe cells. The enzyme is not required for the viability of the fission yeast or single mammalian cells grown under normal conditions. The enzyme is also dispensable for growth of some multicellular organisms, such as plants. However, loss of UGGT is embryonically lethal in mice. This fact, as well of the strict requirement of UGGT for the viability of S. pombe cells only when grown under severe ER stress conditions, point to a restricted set of glycoproteins absolutely requiring UGGT for proper folding. In addition to combined factor V and VIII deficiency caused by ERGIC53 mutations (see above), other congenital diseases result in retention of defective proteins in the ER and their eventual proteasomal degradation. For instance, the most common mutation in cystic fibrosis patients, CFTR-ΔF508, leads to improper folding of this chloride channel and its retention in the ER. Importantly, the mutation affects CFTR transit to the plasma membrane but not its transport activity. Similarly, UGGT recognition of a brassinosteroid receptor mutant triggers retention in the ER of Arabidopsis thaliana cells. Thus, certain diseases caused by ER retention of defective glycoproteins might be ameliorated by inhibitors of UGGT activity. One beautiful example of how the fine sensitivity of UGGT allows modulation of basic physiological processes is its role during antigen presentation by the major histocompatibility complex I (MHC I). Here, MHC I complexes loaded with suboptimal peptides are recognized by UGGT, thus triggering their retention in the ER. On the contrary, complexes formed with high-affinity peptides are poor UGGT substrates and are able to be presented on the cell surface.']","The STT3A complex (OSTA), closely associated with the translocon, contains the KCP2 and DC2 subunits, whereas the STT3B complex (OSTB) that has either MAGT1 or TUSC3 (homologs of yeast Ost3p/Ost6p) glycosylates polypeptides posttranslationally after their translocation into the ER.","The STT3A complex (OSTA), closely associated with the translocon, contains the KCP2 and DC2 subunits, whereas the STT3B complex (OSTB) that has either MAGT1 or TUSC3 (homologs of yeast Ost3p/Ost6p) glycosylates polypeptides posttranslationally after their translocation into the ER. On binding to the catalytic STT3 subunit, the client peptide adopts a 180° turn, making polypeptide folding a competing reaction for N-glycosylation. Indeed, the thioredoxin subunits of the OST complex (Ost3p/Ost6p; MAGT1/TUSC1) modulate the oxidative folding of the client polypeptide, thereby extending the polypeptide substrate range of OST. As of February 2021, the UniProt database reports 1911 N-glycosylation sites in yeast and 13,648 in murine glycoproteins.",1.0,0.593511350360167,0.8861182065436934,0.012987012987012988,0.9999999999666667,1.0
"Complete the following paragraph: Sialic acids may be modified by O-acetylation, and Gal and GlcNAc by sulfation. The length of O-GalNAc glycans may vary from a single GalNAc to more than 20 sugar residues and can include blood group and other glycan epitopes. This chapter describes the structures, biosynthesis, and functions of O-GalNAc glycans in mammals.","['GAL3ST4 is the major sulfotransferase acting on the Gal residue of core 1 O-glycans. Skeletal type keratan sulfate (KS) is also an O-GalNAc-linked highly sulfated polysaccharide (Chapter 17). O-acetyltransferases that add O-acetyl esters to one or more hydroxyl groups of Sia residues remain poorly characterized. Some evidence suggests that the esters can be added to CMP-Sias before transfer. The α1-2 fucosyltransferases FUT1 and FUT2 synthesize the blood group H determinant of O-GalNAc glycans which can be converted by an α1-3 Gal-transferase to blood group B or by an α1-3 GalNAc-transferase to blood group A (Table 10.1). In addition, α1-3 and α1-3/4 fucosyltransferases synthesize the Lewis antigens (Table 10.1). A number of uncommon and antigenic sugars are also found on O-GalNAc glycans. For example, neuropilin-2 in the nervous system has core 1 and 2 O-GalNAc glycans that carry polysialic acid residues synthesized by polysialytransferase IV (ST8SIA4). These highly charged glycans play a critical role in the negative regulation of cell adhesion during maturation of the nervous system. An α1-4 GlcNAc-transferase in gastric tissue adds GlcNAc in α1-4 linkage to β1-4 Gal in core 1 and 2 O-GalNAc glycans. The α1-4 GlcNAc-containing glycans appear to inhibit colonization by Helicobacter pylori. The functions of O-GalNAc glycans are many and varied, depending on their structure and density, as well on as the protein to which they are attached. As mentioned above, in densely glycosylated proteins such as mucins, O-glycans aid in hydration, structural support, interaction with the microbiome, and protection from proteolysis. In contrast, the function of single sites of O-GalNAc glycosylation vary widely and are still being determined. For example, O-GalNAc glycosylation at one or a few sites in certain proteins has been shown to regulate proprotein convertase cleavage, shedding of ectodomains, ligand binding, and cell–cell and cell–matrix interactions, influencing tissue formation and differentiation. Moreover, O-glycans, either in defined sites or clusters, may serve as carriers of terminal ligands such as blood type antigens like sialyl-Lewis x, which are important for host–pathogen interactions, and the circulation and homing of immune cells. The ligands for certain selectin-mediated interactions between endothelial cells and leukocytes require sialyl-Lewis x that is commonly attached to core 2 O-GalNAc glycans (Table 10.1). Finally, O-glycan terminal motifs on some immune cell subtypes can engage specific Siglecs and induce tolerance to self-antigens. Methods to determine the function of O-GalNAc glycans are diverse and include the use of biosynthetic inhibitors, the construction of cell lines that lack or overexpress specific enzymes in O-glycosylation pathways, the use of O-GalNAc glycan-specific lectins or antibodies, removal of specific sugar residues by glycosidases, and deletion/mutation of specific GALNTs in model organisms. For example, a critical role of O-GalNAc glycans in selectin-mediated cell adhesion was revealed by treating cells with GalNAc-O-benzyl, which is a competitive inhibitor of core 1 and core 2 synthesis. GalNAc-O-benzyl acts as a decoy substrate for C1GALT1 and thereby reduces the synthesis of core 1 and core 2 O-GalNAc glycans on glycoproteins. Inhibitor-treated cancer cells lose the ability to bind to E-selectin and endothelial cells in vitro. Cancer cells often express sialyl-Lewis x and may thus use the selectin-binding properties of sialyl-Lewis x as a mechanism to invade tissues.'
 'They can also carry Sia and form sialyl-Tn or sialyl-T antigens. O-GalNAc cores are often extended to form complex O-GalNAc glycans that may include the ABO and Lewis blood group determinants (Chapter 14), polysialic acid, the linear i antigen (Galβ1-4GlcNAcβ1-3Gal), and the GlcNAc β1-6-branched I antigens (Table 10.1). Extensions by Type 1 (Galβ1-3GlcNAc) or Type 2 (Galβ1-4GlcNAc) units can be repeated and provide scaffolds for the attachment of additional sugars or functional groups. The termini of O-GalNAc glycans may contain Fuc and Sia in α-linkages, and Gal, GalNAc, and GlcNAc in both α- and β-linkages, and sulfate. Many of these terminal sugars are antigenic or recognized by lectins. In particular, the sialylated and sulfated Lewis antigens are ligands for selectins (Chapter 34), and Gal-terminating structures are ligands for galectins (Chapter 36). Some sugar residues, or their modifications, may mask underlying antigens or receptors. For example, O-acetyl groups on the Sia of the sialyl-Tn antigen prevent recognition by anti-sialyl-Tn antibodies. Gut bacteria may actively remove this mask. Dense O-glycosylation of mucin domains provides almost complete protection from protease degradation. The O-linkage between GalNAc and Ser/Thr residues is labile under alkaline conditions. Thus, O-GalNAc glycans can be released by a reaction termed β-elimination (i.e., treatment with 0.1 m sodium hydroxide). The hemiacetal GalNAc produced will undergo rapid alkali-catalyzed degradation under these conditions (called peeling), but can be reduced with sodium borohydride to yield stable N-acetylgalactosaminitol at the reducing end of the released O-glycan. β-Elimination is the method of choice to release O-glycans from glycoproteins that also have N-glycans, because the latter are not susceptible to cleavage under mild conditions. O-GalNAc glycans, as well as other Ser/Thr-linked glycans (Chapter 13), are released as alditols by β-elimination, but with losses of labile O-acetyl or sulfate esters. An alternative method that preserves the reducing end of O-GalNAc uses ammonia followed by boric acid. O-GalNAc that is not substituted with another sugar can be enzymatically released by a N-acetylgalactosaminidase. Another glycosidase, termed O-glycanase, releases core 1 (Galβ1-3GalNAc-) from Ser/Thr, provided the disaccharide is not further substituted. Thus, sialidase treatment followed by O-glycanase releases most simple, core 1 O-GalNAc glycans. Terminal Sia residues can also be easily removed with mild acid treatment. There are no known enzymes that can release more complex and extended whole O-GalNAc glycans, but mixtures of exoglycosidases can be used to sequentially remove sugars from O-GalNAc glycans on a glycoprotein. Glycoproteins with clusters of sialylated O-GalNAc glycans may be digested by an O-sialoglycoprotein endopeptidase. Released, intact O-GalNAc glycans may be separated by different chromatographic methods, including high-performance liquid chromatography (HPLC). Chemical derivatization of GalNAc at the reducing end helps in the separation and subsequent analysis of sugar composition and linkages by gas chromatography and mass spectrometry (MS) (Chapter 50). Another tool to isolate O-glycans with specific epitopes is affinity chromatography using lectins. For example, Helix pomatia agglutinin binds to terminal GalNAc, whereas peanut lectin binds to unsubstituted core 1 (Table 10.1).'
 'Chemical derivatization of GalNAc at the reducing end helps in the separation and subsequent analysis of sugar composition and linkages by gas chromatography and mass spectrometry (MS) (Chapter 50). Another tool to isolate O-glycans with specific epitopes is affinity chromatography using lectins. For example, Helix pomatia agglutinin binds to terminal GalNAc, whereas peanut lectin binds to unsubstituted core 1 (Table 10.1). The structures of O-GalNAc glycans released from mucins and other glycoproteins may be determined by a combination of liquid or gas chromatography, MS, and nuclear magnetic resonance (NMR) spectroscopy. The anomeric linkage of each sugar can be determined using specific glycosidases that distinguish between α- or β-linked sugars, and by one- and two-dimensional NMR methods (Chapter 50). The sites of O-GalNAc glycan modification in mucins are difficult to determine directly, but this has been achieved by sensitive MS methods and new enzymatic tools. A big step forward in understanding the extent of the O-GalNAc glycoproteome came with the proteome-wide mapping of O-GalNAc glycosylation sites. Several MS-based strategies have been applied including modifications of the endogenous glycan structures through chemical labeling, lectin enrichment of glycans derived from native or glycoengineered cells, or O-GalNAc-specific endo-peptidase treatment. Additionally, the use of mucin-type O-proteases (OpeRATOR and StcE) that specifically cleave N-terminal to an O-glycosylated Ser/Thr have aided in mapping sites of glycosylation. Based on these methodologies, we now know that >80% of the proteins passing through the secretory pathway are modified with O-GalNAc glycans, although the occupancy and the nature of an O-GalNAc glycan associated with a glycosylated site remains elusive. O-GalNAc glycans are added to Ser/Thr residues in proteins in the Golgi apparatus. The biosynthetic glycosyltransferases are type II transmembrane proteins with a short cytoplasmic tail at the amino terminus, a transmembrane domain, a stem region, and a catalytic domain in the lumen of the Golgi. The arrangement within Golgi membranes appears to be similar to an “assembly line” with early reactions occurring in the cis-Golgi and late reactions in the trans-Golgi (Chapter 4). Many of the enzymes, however, are diffusely distributed in Golgi compartments. The subcellular localization, activity levels, and substrate specificities of glycosyltransferases involved in the assembly of O-GalNAc glycans play a critical role in determining the range of O-glycans synthesized by a cell (Table 10.2 and Figures 10.2 and 10.3). The glycosyltransferases that are involved in the assembly of O-GalNAc glycans are listed in Table 10.2. However, other enzymes that contribute to the synthesis of N-glycans and glycolipids also act on O-glycans, and some of these prefer O-glycans as acceptor substrates (Chapter 14). In vitro assays have shown that the activities of glycosyltransferases are controlled by factors such as metal ions and pH. Biosynthesis of core 1 and 2 O-GalNAc glycans as described in the text. Green lines are protein.  Glycosyltransferases that synthesize O-GalNAc glycans  The first and essential step of O-GalNAc glycosylation is the addition of GalNAc in α-linkage to Ser or Thr by a polypeptide GalNAc-transferase (ppGalNAcT; GALNT) (Table 10.2; Figure 10.2). Humans have 20 genes encoding GALNTs. The large number of GALNTs provides redundancy and also reflects differences in substrate specificity. Studies in the fly indicate that certain GALNTs (PGANTs in the fly) are required for normal development (Chapter 26). Deletion of single GALNTs in mammals results in organ and cell differentiation defects.']","Sialic acids may be modified by O-acetylation, and Gal and GlcNAc by sulfation. The length of O-GalNAc glycans may vary from a single GalNAc to more than 20 sugar residues and can include blood group and other glycan epitopes. This chapter describes the structures, biosynthesis, and functions of O-GalNAc glycans in mammals. The biosynthesis of O-GalNAc glycans involves the addition of GalNAc in α-linkage to Ser or Thr by polypeptide GalNAc-transferases (GALNTs). These enzymes play a critical role in determining the range of O-glycans synthesized by a cell. Additionally, the glycosyltransferases involved in O-GalNAc glycan assembly are localized in the Golgi apparatus and exhibit specific substrate specificities, contributing to the diverse structures of O-GalNAc glycans found in mucins and glycoproteins.","About 150 years ago, E. Eichwald and E. Hoppe-Seyler noted that highly glycosylated proteins that contain hundreds of O-GalNAc glycans, which they termed mucins, are found throughout the body (Figure 10.1). Since then we have learned that O-GalNAc glycans are not only found as dense clusters on mucins, but also at single sites on most secreted and membrane-bound proteins. O-GalNAc glycans are involved in almost every aspect of biology, including cell–cell communication, cell adhesion, signal transduction, immune surveillance, epithelial cell protection, and host–pathogen interactions.",0.75,0.7144535349842225,0.7621068153715731,0.0136986301369863,0.9999999999666667,0.3333333333333333
"Complete the following paragraph: Nearly all glycolipids in vertebrates are GSLs, which, in turn, are part of the larger family of sphingolipids (lipids built on sphingoid bases) that includes the major membrane phospholipid, sphingomyelin, and the second messenger sphingosine 1-phosphate that regulates angiogenesis and immune cell trafficking.","['NCBI Bookshelf. A service of the National Library of Medicine, National Institutes of Health. Varki A, Cummings RD, Esko JD, et al., editors. Essentials of Glycobiology [Internet]. 4th edition. Cold Spring Harbor (NY): Cold Spring Harbor Laboratory Press; 2022.  doi: 10.1101/glycobiology.4e.11 Ronald L. Schnaar, Roger Sandhoff, Michael Tiemeyer, and Taroh Kinoshita. Glycosphingolipids (GSLs), a subclass of glycolipids found in the cell membranes of organisms from bacteria to humans, are the major glycolipids of animals. The emphasis of this chapter is on vertebrate glycosphingolipids. Information on glycolipids of fungi, plants, and invertebrates is covered elsewhere (Chapters 20 and 23–26), as are glycosylphosphatidylinositols (GPIs), glycolipids attached to proteins as membrane anchors (Chapter 12). This chapter describes the characteristic features of GSLs, pathways for their biosynthesis, and insights into their biological roles in membrane structure, host–pathogen interactions, cell–cell recognition, and modulation of membrane protein function. The first GSL to be characterized was galactosylceramide (GalCer). Among the simplest of glycolipids, it is also one of the most abundant molecules in the vertebrate brain. It consists of a single galactose residue in β-glycosidic linkage to the C-1 hydroxyl group of a lipid moiety called ceramide (Figure 11.1). The structure of the lipid, a long-chain amino alcohol in amide linkage to a fatty acid, was so difficult to determine that the amino alcohol was dubbed “sphingosine” after the enigmatic Egyptian Sphinx. Animal cells synthesize various sphingosines and related long-chain amino alcohols, together referred to as sphingoid bases. Nearly all glycolipids in vertebrates are GSLs, which, in turn, are part of the larger family of sphingolipids (lipids built on sphingoid bases) that includes the major membrane phospholipid, sphingomyelin, and the second messenger sphingosine 1-phosphate that regulates angiogenesis and immune cell trafficking. Other GSLs were later identified because they accumulate to pathological levels in tissues of patients with lysosomal storage diseases, genetic disorders in which glycan degrading enzymes are faulty or missing (Chapter 44). For example, a sialic acid–containing GSL (GM2) was first isolated from the brain of a victim of Tay–Sachs disease, in which it accumulates, and was named “ganglioside” based on its location in nerve clusters or “ganglia” in the brain. Likewise, glucosylceramide (GlcCer) was first isolated from the spleen of a Gaucher disease patient, where it accumulates. As purification, separation, and analytical techniques improved, GSLs were found in all vertebrate tissues. Hundreds of unique GSL structures were found that vary in glycan structures alone, each of which are presented on several distinct ceramides. Structures of representative glycosphingolipids (GSLs) and glycoglycerolipids. GSLs, such as GalCer, are built on a ceramide lipid moiety that consists of a long-chain amino alcohol (sphingosine) in amide linkage to a fatty acid. In comparison, glycoglycerolipids, (more...) Glycoglycerolipids are distinguished from GSLs by their lipid, having glycans linked to the C-3 hydroxyl of diacylglycerol or alkyl(acyl)glycerol (Figure 11.1). Very minor constituents of most animal tissues (other than the testes), glycoglycerolipids are widely distributed in microbes and plants. Glycolipids of fungi, plants, and invertebrates are covered in Chapters 20 and 23–26.'
 'Very minor constituents of most animal tissues (other than the testes), glycoglycerolipids are widely distributed in microbes and plants. Glycolipids of fungi, plants, and invertebrates are covered in Chapters 20 and 23–26. Glycosylphosphatidylinositols (GPIs), a different family of glycolipids, are often attached to proteins as membrane, and may also exist as free glycolipids (discussed in Chapter 12). The lipopolysaccharides of Gram-negative bacteria are discussed in Chapter 21. The ceramide lipid of GSLs consists of a sphingoid base with a fatty acid amide at the C-2 amine. Sphingosine is the most common sphingoid base in mammals, with hydroxyls at the C-1 and C-3 carbons and a trans double bond between C-4 and C-5 (Figure 11.1). Sphinganine is the same structure without the double bond, and phytosphingosine lacks the double bond and has an additional hydroxyl on C-4. Ceramides containing sphinganine and phytosphingosine are less abundant in animals, whereas phytosphingosine is prominent in the glycosphingolipids of plants and fungi. The fatty acid components of ceramides vary widely, with lengths ranging from C14 to C30 or greater. Although often saturated, they may be variably unsaturated or have α-hydroxyl groups. Ceramide structures modulate membrane associations and functions of GSLs. Although ceramide variations add significant diversity to GSL structures, major structural and functional classifications are based on the glycans. The first sugars linked to ceramide in vertebrates are typically β-linked galactose (GalCer) or glucose (GlcCer). GalCer and its analog sulfatide, with sulfate at the C-3 hydroxyl of galactose, are the major glycans in the kidney and the brain. In the brain they have essential roles in the structure and function of myelin, the insulator that allows for rapid nerve conduction. Interestingly, the related sulfogalactoglycerolipid, seminolipid (Figure 11.1), is abundant only in the male reproductive tract, where it is essential for spermatogenesis. Sialylated GalCer (Neu5Acα2-3GalβCer; GM4) is also found in myelin. These galactolipids are seldom extended with larger saccharide chains; rather, most other members of the large and diverse family of GSLs in animals are built on GlcCer (Figure 11.2). GlcCer itself is abundant in certain tissues. In skin, it is a precursor of special ceramides that are required for creating the essential surface water barrier when embedded into the stratum corneum of the epidermis (see below). Glycosphingolipid (GSL) neutral cores and their designation based on IUPAC (International Union of Pure and Applied Chemistry) Nomenclature. In the official nomenclature, saccharide and other substituents that extend or branch from the neutral core structures (more...) The vast majority of GSL structures are classified based on seven common tetrasaccharide neutral sugar core sequences (Figure 11.2). GSLs sharing the same neutral core sequence are said to be of that “series”; the quantitatively major series in vertebrates are ganglio-, globo-, and neolacto-series, whereas in invertebrates the mollu- and arthro-series predominate. GSL series are expressed in tissue-specific patterns. In mammals, ganglio-series GSLs, although broadly distributed, predominate in the brain, whereas neolacto-series glycolipids are common on certain hematopoietic cells including leukocytes. In contrast, lacto-series glycolipids are prominent in secretory organs and globo-series glycolipids are the most abundant in erythrocytes. This diversity presumably reflects important differences in GSL functions. GSLs are further subclassified as neutral (no charged sugars or ionic groups), sialylated (having one or more sialic acid residues), or sulfated.'
 'In contrast, guinea pig, mouse, sheep, and goat are Forssman antigen–positive. The breakdown of GSLs occurs stepwise by the action of lysosomal hydrolases. GSLs on the outer surface of the plasma membrane are internalized, along with other membrane components, in invaginated vesicles that then fuse with endosomes, resulting in the GSL glycan facing the endosome lumen. GSL-enriched areas of the endosomal membrane may then invaginate once again to form intraluminal vesicles within the endosome. When endosomes fuse with primary lysosomes, GSLs become exposed to lysosomal hydrolases. Absence of any one of these glycosidases results in lysosomal storage diseases (Chapter 44). As GSLs are successively cleaved to smaller structures, the remaining “core” monosaccharides become inaccessible to the water-soluble lysosomal hydrolases and require assistance from activator proteins that are referred to as “liftases.” These include GM2-activator protein and four structurally related saposins, all of which are derived from a single polypeptide precursor by proteolytic cleavage. Saposins are thought to bind to their glycolipid substrate, disrupt its interaction with the local membrane environment, and facilitate access of the glycans to the water-soluble hydrolytic enzymes. In certain lysosomal storage diseases (Chapter 44), mutations in activator proteins result in pathological accumulation of glycolipids, even though there is an abundance of the hydrolase responsible for degradation, thus demonstrating the essential role of activator proteins in GSL catabolism in vivo. The final breakdown products of GSL catabolism—monosaccharides, fatty acids, and free sphingoid bases—are then available for reuse by salvage pathways. GSLs comprise from <5% (erythrocytes) to >20% (myelin) of the total membrane lipids in the plasma membranes of vertebrate cells. However, they are not uniformly distributed in the plane of the membrane but cluster in “lipid rafts,” small lateral microdomains of self-associating membrane molecules. Although the precise structure and makeup of lipid rafts is a matter of ongoing debate, their outer leaflets are believed to be enriched in sphingolipids, including GSLs and sphingomyelin (the phosphocholine derivative of ceramide). The self-association of sphingolipids is driven through the unique biophysical properties imparted by their long saturated carbon chains (Figure 11.1). Besides sphingolipids, lipid rafts are enriched in cholesterol and selected proteins, including GPI-anchored proteins and some transmembrane signaling proteins such as receptor tyrosine kinases. On the cytoplasmic side, acylated proteins, such as Src family protein tyrosine kinases and Gα subunits of G proteins, associate with lipid rafts. Lipid rafts are apparently dynamic, short-lived (msec), and small (10–50 nm in diameter), each containing perhaps hundreds of lipid molecules along with a few protein molecules. It has been argued that external clustering of lipid rafts into larger structures might bring signaling molecules such as kinases and their substrates together to enhance intracellular signaling. Thus, GSLs may act as intermediaries in the flow of information from the outside to the inside of cells. This idea is supported by the observation that antibody-induced GSL clustering activates lipid-raft-associated signaling and has led to the concept of plasma membrane “glycosignaling domains” or “glycosynapse.” Interactions between glycans and glycan-binding proteins, as well as glycan–glycan interactions, are also very much influenced by the density of glycans in terms of binding affinity. Multiple glycans clustered in a limited area can increase the avidity of cognate binding proteins compared with a single molecule of a glycan (Chapter 29). Natural multivalency adds unique functional properties to plasma membrane glycolipids. Indeed, several growth factor receptors including the epidermal growth factor (EGF) receptor, insulin receptor, and the nerve growth factor receptor are localized in membrane microdomains, and structural studies identified binding sites occupied by specific GSLs that modulate receptor signaling functions.']","Nearly all glycolipids in vertebrates are GSLs, which, in turn, are part of the larger family of sphingolipids (lipids built on sphingoid bases) that includes the major membrane phospholipid, sphingomyelin, and the second messenger sphingosine 1-phosphate that regulates angiogenesis and immune cell trafficking. These glycolipids are major components of animal cell membranes and play essential roles in various biological processes such as membrane structure, host-pathogen interactions, cell-cell recognition, and modulation of membrane protein function.","Other GSLs were later identified because they accumulate to pathological levels in tissues of patients with lysosomal storage diseases, genetic disorders in which glycan degrading enzymes are faulty or missing (Chapter 44). For example, a sialic acid–containing GSL (GM2) was first isolated from the brain of a victim of Tay–Sachs disease, in which it accumulates, and was named “ganglioside” based on its location in nerve clusters or “ganglia” in the brain. Likewise, glucosylceramide (GlcCer) was first isolated from the spleen of a Gaucher disease patient, where it accumulates. As purification, separation, and analytical techniques improved, GSLs were found in all vertebrate tissues. Hundreds of unique GSL structures were found that vary in glycan structures alone, each of which are presented on several distinct ceramides. Structures of representative glycosphingolipids (GSLs) and glycoglycerolipids. GSLs, such as GalCer, are built on a ceramide lipid moiety that consists of a long-chain amino alcohol (sphingosine) in amide linkage to a fatty acid. In comparison, glycoglycerolipids, (more...) Glycoglycerolipids are distinguished from GSLs by their lipid, having glycans linked to the C-3 hydroxyl of diacylglycerol or alkyl(acyl)glycerol (Figure 11.1).",1.0,0.4075160094822871,0.7263080853767079,0.012345679012345678,0.9999999999666667,0.625
"Complete the following paragraph: Proteins attached to glycosylphosphatidylinositol (GPI) via their carboxyl termini are generally found in the outer leaflet of the lipid bilayer facing the extracellular environment. The GPI membrane anchor may be conveniently thought of as an alternative to the single transmembrane domain of type-I integral membrane proteins. This chapter reviews the discovery, distribution, structure, biosynthesis, properties, and suggested functions of GPI anchors and related molecules, as well as their roles in diseases.","['NCBI Bookshelf. A service of the National Library of Medicine, National Institutes of Health. Varki A, Cummings RD, Esko JD, et al., editors. Essentials of Glycobiology [Internet]. 4th edition. Cold Spring Harbor (NY): Cold Spring Harbor Laboratory Press; 2022.  doi: 10.1101/glycobiology.4e.12 Sneha Sudha Komath, Morihisa Fujita, Gerald W. Hart, Michael A.J. Ferguson, and Taroh Kinoshita. Plasma membrane proteins are either peripheral proteins or integral membrane proteins. The latter include proteins that span the lipid bilayer once or several times, and a second class that are covalently attached to lipids. Proteins attached to glycosylphosphatidylinositol (GPI) via their carboxyl termini are generally found in the outer leaflet of the lipid bilayer facing the extracellular environment. The GPI membrane anchor may be conveniently thought of as an alternative to the single transmembrane domain of type-I integral membrane proteins. This chapter reviews the discovery, distribution, structure, biosynthesis, properties, and suggested functions of GPI anchors and related molecules, as well as their roles in diseases. The first tentative evidence for the existence of protein-phospholipid anchors appeared in 1963 with the finding that crude bacterial phospholipase C (PLC) selectively releases alkaline phosphatase from mammalian cells. Phosphatidylinositol (PI)-protein anchors were first postulated in the mid-1970s when highly purified bacterial PI-specific PLCs were observed to release proteins, such as alkaline phosphatase and 5′-nucleotidase, from mammalian plasma membranes. By 1985, these predictions were confirmed by compositional and structural data from studies on Torpedo acetylcholinesterase, human and bovine erythrocyte acetylcholinesterase, rat Thy-1, and the sleeping sickness parasite Trypanosoma brucei variant surface glycoprotein (VSG). The first complete GPI structures, which were for T. brucei VSG and rat Thy-1, were solved in 1988 (Chapter 1, Figure 1.3). To date, hundreds of GPI-anchored proteins (GPI-APs) have been identified in many eukaryotes, ranging from protozoa and fungi to plants and humans (Online Appendix 12A). The range of described GPI-APs and the distribution of putative GPI biosynthesis genes suggests that (1) GPI anchors are almost ubiquitous among eukaryotes; (2) GPI-APs are functionally diverse and include hydrolytic enzymes, adhesion molecules, complement regulatory proteins, receptors, protozoan coat proteins, and prion proteins; and (3) in mammals, alternative messenger RNA (mRNA) splicing may lead to the expression of transmembrane and/or soluble and GPI-anchored forms of the same gene product. These variants may be developmentally regulated. For example, neural cell adhesion molecule (NCAM) exists in GPI-anchored and soluble forms when expressed in muscle and in GPI-anchored and two transmembrane forms when expressed in brain. The substructure Manα1-4GlcNα1-6myo-inositol-1-P-lipid is a universal hallmark of GPI anchors and related structures. All but one protein-linked GPI anchor share a larger common core structure (Figure 12.1; Online Appendix 12B, panels I–IV). The protein–carbohydrate association in GPI-APs is unique in that the reducing terminus of the GPI oligosaccharide is not attached to the protein but to the D-myo-inositol head group of a PI moiety by an α1-6 linkage. A distal, nonreducing mannose (Man) is attached to the protein via an ethanolamine phosphate (EtNP) bridge between its C-6 hydroxyl and the α-carboxyl group of the carboxy-terminal amino acid. GPIs are one of the rare instances in which GlcN is found without either an N-acetyl or N-sulfate (as in proteoglycans) moiety (Chapter 17).'
 'An α2-3 sialic acid (Sia) could be added to the Gal. In T. brucei bloodstream forms, GPI-APs present glycan side-chains consisting of Gal, whereas the procyclic GPIs carry sialylated poly-N-acetyllactosamine and poly-lacto-N-biose structures. The transport of GPI-APs from the ER to the Golgi is mediated by coat protein II (COPII)-coated transport vesicles. Their packaging into the vesicles requires a transmembrane cargo receptor, a complex of four p24 family proteins, that links luminally oriented GPI to COPII components on the cytoplasmic side of the ER membrane. GPI-APs with two long hydrocarbon chains (i.e., those containing diacylglycerol, alkylacylglycerol, alkenylacylglycerol, or ceramide) are stably associated with the lipid bilayer. It follows that inositol-acylated GPI proteins with three fatty-acid chains should be more stably associated. On the other hand, Leishmania LPG, with a single C24:0 alkyl chain, has a half-life of only minutes at the cell surface and is secreted intact into the medium. The thermodynamics of bilayer interactions also depend on the length and degree of saturation of the fatty-acid chains. In this regard, the saturated nature of most (but not all) mammalian GPI anchors (Online Appendix 12B, panels III and IV) is thought to explain why GPI-APs associate with “lipid rafts.” The current model for mammalian lipid rafts is that of transient liquid-ordered nanoclusters of membrane components. These are dependent on dynamic cortical actin asters that, through adaptor proteins, cluster phosphatidylserine (PS) on the inner face of the plasma membrane bilayer. This coupling effect occurs because the long, saturated lipid chains from inner leaflet PS overlap and interact with those of GPI-APs and glycosphingolipids in the middle of the bilayer, thereby generating functional membrane domains. A compelling aspect of this model is that, although dynamic cortical actin can organize molecules across the leaflet into nanoclusters, the clustering of GPI-APs or glycosphingolipids at the outer leaflet can also, conversely, organize the inner leaflet and recruit molecules that may favor liquid-ordered domains. This provides a possible explanation for the perplexing, yet well-characterized, ability of GPI-APs to transduce signals across the plasma membrane. There are many examples of transmembrane signaling via the cross-linking of GPI-APs with antibodies and clustering with a second antibody on various cells, particularly leukocytes. Cellular responses include an increase in intracellular Ca++, tyrosine phosphorylation, proliferation, cytokine induction, and oxidative burst. These signaling events are dependent on the presence of a GPI anchor and might be mostly caused by the induction and coalescence of lipid raft nanoclusters, although their participation in ligand binding in conjunction with signal receptors (such as receptor-like-kinases in Arabidopsis) to transduce extracellular signals cannot be ruled out. GPI-APs involved in transmembrane signaling, such as the glial-cell-(line-)derived neurotrophic factor receptor-α (GDNFR-α), need to be associated with transmembrane β coreceptors to transmit their signals. Similarly, GPI-anchored CD14 (the LPS/LPS-binding protein receptor) requires to partner transmembrane Toll-like receptor-4, and can function equally well with a GPI anchor or with a spliced transmembrane domain. The replacement of carboxy-terminal transmembrane domains of type-I integral membrane proteins by GPIsps allows their expression as GPI-APs on the plasma membrane of transfected mammalian cells. This offers a useful method for producing soluble forms of membrane proteins. For example, the T-cell receptor was rendered soluble after it was expressed in the GPI-anchored form (by the action of bacterial PI-PLC), and not by simply expressing the transmembrane-deleted domain. In addition, purified GPI-APs can be used to coat hydrophobic surface plasmon resonance chips, thus providing a convenient method for orienting and presenting proteins for binding studies.'
 'A distal, nonreducing mannose (Man) is attached to the protein via an ethanolamine phosphate (EtNP) bridge between its C-6 hydroxyl and the α-carboxyl group of the carboxy-terminal amino acid. GPIs are one of the rare instances in which GlcN is found without either an N-acetyl or N-sulfate (as in proteoglycans) moiety (Chapter 17). General structure of glycosylphosphatidylinositol (GPI) anchors attached to proteins. All characterized GPI anchors share a common core consisting of ethanolamine-PO4-6Manα1-2Manα1-6Manα1-4GlcNα1-6myo-inositol-1-PO4-lipid. (more...) Beyond the common core, the structures of mature GPI anchors are quite diverse, depending on both the protein to which they are attached and the organism in which they are synthesized (Figure 12.1; Online Appendix 12B). Modifications to the core include additional EtNP and a wide variety of linear and branched glycosyl substituents of largely unknown function. There is considerable variation in the PI moiety. Indeed, GPI is a rather loose term because, strictly speaking, PI refers specifically to D-myo-inositol-1-P-3(sn-1,2-diacylglycerol) (i.e., diacyl-PI), whereas many GPIs contain other types of inositolphospholipids, such as lysoacyl-PI, alkylacyl-PI, alkenylacyl-PI, and inositolphosphoceramide (Online Appendix 12B). Another variation is the attachment of an ester-linked fatty acid at the C-2 hydroxyl of the inositol residue, which makes the anchor inherently resistant to bacterial PI-PLCs. The available structural data suggest that (1) inositolphosphoceramide-based protein-linked GPIs are mainly found in “lower” eukaryotes, such as Saccharomyces cerevisiae, Aspergillus fumigatus, Aspergillus niger, Dictyostelium discoideum, and Trypanosoma cruzi; (2) the lipid structures of GPIs generally do not reflect those of the general cellular PI or inositolphosphoceramide pool; and (3) the lipid structures of some (e.g., trypanosome) GPI-APs are under developmental control. The factors controlling the synthesis of a mature protein-linked GPI appear to be similar to those for other posttranslational modifications such as N- and O-glycosylation. Thus, primary control occurs at the cellular level, whereby the levels of specific biosynthetic and processing enzymes dictate the final repertoire of structures. Secondary control occurs at the level of the tertiary/quaternary structures of the GPI-APs, which affect accessibility to processing enzymes. Examples of primary control include (1) differences in GPI glycan side chains in human versus porcine membrane dipeptidase and brain versus thymocyte rat Thy-1 and (2) differences in glycan side chains and the lipid structure of T. brucei VSG in the bloodstream versus insect life-cycle stages of the parasite. An example of secondary control is the difference in VSG glycan side chains when VSGs with different carboxy-terminal sequences are expressed in the same trypanosome clone. In mammalian cells, some free GPIs (mature and biosynthetic intermediates) are found at the cell surface, although their functional significance remains unknown. On the other hand, several protozoa (particularly trypanosomatids) express high numbers (>107 copies per cell) of free GPIs on their cell surface as metabolic end products. These include the so-called glycoinositol phospholipids (GIPLs) and lipophosphoglycans (LPGs) of Leishmania.']","The first tentative evidence for the existence of protein-phospholipid anchors appeared in 1963 with the finding that crude bacterial phospholipase C (PLC) selectively releases alkaline phosphatase from mammalian cells. Phosphatidylinositol (PI)-protein anchors were first postulated in the mid-1970s when highly purified bacterial PI-specific PLCs were observed to release proteins, such as alkaline phosphatase and 5′-nucleotidase, from mammalian plasma membranes. By 1985, these predictions were confirmed by compositional and structural data from studies on Torpedo acetylcholinesterase, human and bovine erythrocyte acetylcholinesterase, rat Thy-1, and the sleeping sickness parasite Trypanosoma brucei variant surface glycoprotein (VSG). The first complete GPI structures, which were for T. brucei VSG and rat Thy-1, were solved in 1988. To date, hundreds of GPI-anchored proteins (GPI-APs) have been identified in many eukaryotes, ranging from protozoa and fungi to plants and humans. The range of described GPI-APs and the distribution of putative GPI biosynthesis genes suggests that GPI anchors are almost ubiquitous among eukaryotes.","The first tentative evidence for the existence of protein-phospholipid anchors appeared in 1963 with the finding that crude bacterial phospholipase C (PLC) selectively releases alkaline phosphatase from mammalian cells. Phosphatidylinositol (PI)-protein anchors were first postulated in the mid-1970s when highly purified bacterial PI-specific PLCs were observed to release proteins, such as alkaline phosphatase and 5′-nucleotidase, from mammalian plasma membranes. By 1985, these predictions were confirmed by compositional and structural data from studies on Torpedo acetylcholinesterase, human and bovine erythrocyte acetylcholinesterase, rat Thy-1, and the sleeping sickness parasite Trypanosoma brucei variant surface glycoprotein (VSG). The first complete GPI structures, which were for T. brucei VSG and rat Thy-1, were solved in 1988 (Chapter 1, Figure 1.3). To date, hundreds of GPI-anchored proteins (GPI-APs) have been identified in many eukaryotes, ranging from protozoa and fungi to plants and humans (Online Appendix 12A).",1.0,0.5220061460007339,0.990908793104083,0.014705882352941176,0.9999999999666667,1.0
"Complete the following paragraph: Other classes of eukaryotic glycoprotein glycosylation  EGF repeats, also known as EGF domains, are small protein domains (∼40 amino acids) defined by six conserved Cys residues, which form three disulfide bonds (Figure 13.1A). They are found in a few hundred cell-surface and secreted proteins in metazoans and, depending on their sequence, may be modified with O-glycans as described in Table 13.1.","['NCBI Bookshelf. A service of the National Library of Medicine, National Institutes of Health. Varki A, Cummings RD, Esko JD, et al., editors. Essentials of Glycobiology [Internet]. 4th edition. Cold Spring Harbor (NY): Cold Spring Harbor Laboratory Press; 2022.  doi: 10.1101/glycobiology.4e.13 Robert S. Haltiwanger, Lance Wells, Hudson H. Freeze, Hamed Jafar-Nejad, Tetsuya Okajima, and Pamela Stanley. This chapter focuses on less-easily categorized types of glycan linkages that occur on certain proteins or domains. O-linked sugars on epidermal growth factor (EGF)-like repeats (O-fucose, O-glucose, and O-GlcNAc) regulate Notch signaling and the functions of several other proteins. O-Fucosylation of thrombospondin type-1 repeats (TSRs) is required for folding of these domains in a number of secreted matricellular proteins. O-mannosylation of α-dystroglycan is essential for interactions with several extracellular matrix (ECM) proteins. Defects in the glycosyltransferases that add these glycans (O-fucose, O-glucose, O-GlcNAc, and O-mannose) result in human diseases. C-Mannosylation is a unique form of glycosylation in which mannose is linked through a carbon–carbon bond to tryptophan. O-Linked Glc-Gal disaccharides are added to hydroxylysine residues and play an important role in collagen fibril formation. Although the glycans described here are found on relatively few glycoproteins, they play specific and important roles in biology. In glycoproteins, the linkage between the first sugar of a glycan and the protein defines its glycosylation class (Chapter 1, Figure 1.7) including the common GlcNAc-N-Asn, GalNAc-O-Ser/Thr, and Xyl-O-Ser linkages present in glycoproteins and proteoglycans. The novel, nonclassical glycan Glcβ1–3Fucα-O-Thr was first discovered in human urine but garnered little interest at the time. However, finding O-fucose directly linked to various clotting proteins and signaling receptors, such as Notch, sparked considerable interest. Monoclonal antibodies that detect glycans on specific proteins such as α-dystroglycan provided tools to identify other novel glycans. In addition, mass spectrometry revealed unusual protein modifications, such as mannose linked to protein as a C-glycoside. Table 13.1 describes many of the less common linkages synthesized in the endoplasmic reticulum (ER)–Golgi secretory pathway. Chapters 18 and 19 describe the very few known glycosylation linkages synthesized in the nucleus and cytoplasm. Other classes of eukaryotic glycoprotein glycosylation  EGF repeats, also known as EGF domains, are small protein domains (∼40 amino acids) defined by six conserved Cys residues, which form three disulfide bonds (Figure 13.1A). They are found in a few hundred cell-surface and secreted proteins in metazoans and, depending on their sequence, may be modified with O-glycans as described in Table 13.1. Proteins with EGF repeats harboring these O-glycans include several involved in blood clot formation and dissolution, and the Notch family of receptors and canonical Notch ligands (Delta and Serrate/Jagged) involved in cell fate decisions. These glycan modifications are important because they regulate signal transduction during embryonic development and adult organ maintenance, cell differentiation, and the growth of several cancers. Moreover, mutations in several enzymes involved in the addition or elongation of these glycans have been found in human diseases (Chapter 45). Modifications of epidermal growth factor (EGF) repeats. (A) EGF repeats can be modified by O-fucose, O-glucose, and O-GlcNAc.'
 'These glycan modifications are important because they regulate signal transduction during embryonic development and adult organ maintenance, cell differentiation, and the growth of several cancers. Moreover, mutations in several enzymes involved in the addition or elongation of these glycans have been found in human diseases (Chapter 45). Modifications of epidermal growth factor (EGF) repeats. (A) EGF repeats can be modified by O-fucose, O-glucose, and O-GlcNAc. A schematic representation of an EGF repeat is shown: (yellow) conserved Cys residues; (gray lines between the cysteines) disulfide-bonding (more...) The signaling pathway best known to be regulated by O-glycans on EGF repeats is the Notch signaling pathway. Notch was originally identified in Drosophila, and homologs have been found in all metazoans, with four Notch receptors in mammals. Activation of Notch signal transduction is controlled at numerous levels, and dysregulation of Notch signaling results in a number of human diseases, including several types of cancer and a variety of developmental disorders. Two classes of canonical ligands bind to and activate Notch signaling in Drosophila: Delta and Serrate. Mammals have three Delta-like homologs (DLL1, DLL3, and DLL4), and two Serrate homologs called Jagged 1 and 2 (JAG1 and JAG2). These ligands are single-pass transmembrane glycoproteins that bind to and trans-activate Notch receptors on an adjacent cell. Binding of Notch and ligands in the same cell often results in cis-inhibition of the pathway. Work in recent years has shown that the O-glycans on Notch receptors affect both trans-activatory and cis-inhibitory interactions between Notch receptors and their ligands. The extracellular domain of Notch contains up to 36 tandem EGF repeats (Figure 13.2), many of which contain consensus sites for one or more types of O-glycan (Figure 13.1A). Notch EGF repeats can harbor O-fucose, O-GlcNAc and/or O-glucose (Figure 13.2). As discussed below, these sugar modifications regulate various aspects of Notch signal transduction, sometimes in a partially redundant manner and sometimes via distinct mechanisms. Extracellular domain of a generic Notch receptor showing the numerous sites for POFUT1 and POGLUT1 modifications that are evolutionarily conserved in Drosophila Notch, mouse NOTCH1 and NOTCH2, and human NOTCH1 and NOTCH2. Epidermal growth factor (EGF) (more...) The α-linked O-fucose modification immediately precedes the third conserved Cys of certain EGF repeats (Figure 13.1A). The consensus motif for O-fucosylation is C2X4(S/T)C3 (C2 and C3 are the second and third conserved Cys of the EGF repeat). Nearly 100 proteins in mouse or human databases contain this sequence. O-Fucose can be elongated to a tetrasaccharide (Siaα2–3/6Galβ1-4GlcNAcβ1-3Fucα-O-Ser/Thr) in certain contexts (e.g., EGF1 from human clotting factor IX and EGF12 from mouse NOTCH1) (Table 13.1), but not in others (e.g., EGF1 from human clotting factor VII and EGF5 from mouse NOTCH1). Protein O-fucosyltransferase 1 (POFUT1) transfers fucose from GDP-Fuc to a properly folded EGF repeat containing the appropriate consensus sequence (Figure 13.1B). O-Fucose can be elongated by a β1-3 N-acetylglucosaminyltransferase (β3GlcNAcT) specific for O-fucose residues in a properly folded EGF repeat. The gene encoding the O-fucose-EGF β3GlcNAcT was originally identified in Drosophila as a modifier of Notch signaling called fringe. There are three mammalian homologs: Manic fringe (MFNG), Lunatic fringe (LFNG), and Radical fringe (RFNG).'
 'NCBI Bookshelf. A service of the National Library of Medicine, National Institutes of Health. Varki A, Cummings RD, Esko JD, et al., editors. Essentials of Glycobiology [Internet]. 4th edition. Cold Spring Harbor (NY): Cold Spring Harbor Laboratory Press; 2022.  doi: 10.1101/glycobiology.4e.4 Karen J. Colley, Ajit Varki, Robert S. Haltiwanger, and Taroh Kinoshita. This chapter provides an overview of glycosylation from the perspective of a single cell, taking into account the patterns of expression, topology, and other features of the biosynthetic and degradative enzymes that are common to most cell types. The focus is mostly on the organization of glycosylation in eukaryotic cells. Chapters 21 and 22 further address prokaryotic glycosylation mechanisms. After more than three billion years of evolution, every free-living cell and every cell type within eukaryotic organisms remains covered with a dense and complex layer of glycans (Chapter 20). Even enveloped viruses that bud from infected cells carry with them the glycosylation patterns of the host. Additionally, most secreted molecules are glycosylated and extracellular matrices of multicellular organisms are rich in glycans and glycoconjugates. Matrices secreted by unicellular organisms when they congregate (e.g., bacterial biofilms [Chapter 21]) also contain glycans. Thus, evolution has repeatedly and consistently selected glycans as being the most diverse and flexible molecules to position at the interface between cells and the extracellular milieu. Possible reasons include their relative hydrophilicity, flexibility, and mobility in aqueous environments and their extreme diversity, allowing facile short-term and long-term adaptations to changing environments and pathogen regimes. In bacteria, Archaea, and fungi, glycans serve critical structural roles in the cell wall and in resisting large differences in osmolarity between cytoplasm and environment. In eukaryotes, both secretory proteins and membrane proteins typically pass through an endoplasmic reticulum (ER)–Golgi pathway, the cellular system in which many major glycosylation reactions occur (see below). Most proteins in the blood plasma of animals (with the exception of albumin) are also heavily glycosylated, and the glycosylation of these and other secreted proteins may provide solubility, hydrophilicity, and negative charge, thus reducing unwanted intermolecular interactions and protecting against proteolysis. Cell-surface membrane proteins like receptors, adhesion molecules, and channels are typically glycosylated, and this modification can promote their proper folding, ensure their stability, and impact function. The classic work of George Palade indicated that most cell-surface and secreted proteins in eukaryotic cells are cotranslationally translocated into the ER where they are folded, modified, and subjected to quality control mechanisms. They then make their way via an intermediate compartment (IC) through multiple stacks of the Golgi apparatus, finally being distributed to various destinations from the trans-Golgi network (TGN). Secretory pathway proteins can be N-glycosylated, O-glycosylated, and/or modified with glycosylphosphatidylinositol (GPI) anchors, and some called proteoglycans are modified with attached glycosaminoglycan chains. The enzymes involved in each of these modification pathways are distinct. N-linked glycans and GPI anchors are preassembled before being transferred to proteins and then further modified in the ER–Golgi pathway. The stepwise assembly of O-linked glycans and glycosaminoglycans, as well as the glycosylation of lipids, involve reactions in both the ER and Golgi (Chapters 9–13 and 17). Figure 4.1 superficially depicts some steps in the synthesis of the major glycan classes in the ER–Golgi pathway of animal cells. Initiation and maturation of the major types of eukaryotic glycoconjugates in relation to subcellular trafficking in the ER–Golgi–plasma membrane pathway.']","In addition to O-glycans, EGF repeats can also be modified with N-glycans, which are attached to asparagine residues, and glycosaminoglycans, which are long linear polysaccharides typically found in proteoglycans. These modifications play crucial roles in protein folding, stability, and function, highlighting the importance of glycosylation in regulating various biological processes.","Proteins with EGF repeats harboring these O-glycans include several involved in blood clot formation and dissolution, and the Notch family of receptors and canonical Notch ligands (Delta and Serrate/Jagged) involved in cell fate decisions. These glycan modifications are important because they regulate signal transduction during embryonic development and adult organ maintenance, cell differentiation, and the growth of several cancers. Moreover, mutations in several enzymes involved in the addition or elongation of these glycans have been found in human diseases (Chapter 45).",0.375,0.6991452823359819,0.7562633368492253,0.012048192771084338,0.9999999999666667,1.0
"Complete the following paragraph: Blood banks perform typing and cross-matching assays. First, units of erythrocyte products typed for the A and B antigens are chosen to match the patient's ABO type. To ensure that these are truly “compatible,” the patient's serum is cross-matched by mixing with a small aliquot of each prospective erythrocyte unit. Erythrocytes of compatible units do not agglutinate (form an erythrocyte clump), whereas incompatibility is indicated by agglutinated erythrocytes formed by antibodies in the patient's serum.","[""Humans with an inactive FUT2 gene do not express soluble forms of the A, B, or H determinants in saliva or milk oligosaccharides or in other tissues and are termed “nonsecretors.” Serology is used to characterize erythrocytes for transfusion and has identified variants of the A and B blood group determinants that typically yield weak reactivity with blood typing reagents. Interestingly, plant lectins were used historically to aid in typing blood. For example, the lectin from Dolichos biflorus agglutinates erythrocytes from most blood group A individuals (termed A1 individuals), but it does not agglutinate erythrocytes from individuals of the A2 subgroup, and it is still used currently to distinguish individuals with these two different blood types. The A1 and A2 subgroup antigens are distinct (Figure 14.5) reflecting the different A transferases encoded by the A1 versus A2 allele at the ABO locus. Heritable erythrocyte antigenic polymorphisms determined by the ABO locus have important medical implications. Early in the postnatal period, the immune system generates IgM antibodies against ABO antigen(s), even though they are absent from erythrocytes. This is because glycan antigens similar or identical to the A and B blood group determinants are carried by colonizing bacteria and fungi. Thus, type-O individuals do not synthesize A or B determinants but show relatively high titers of circulating IgM antibodies (termed isoagglutinins) against A and B blood group determinants. Similarly, blood group B individuals show circulating IgM anti-A isoagglutinins, but they do not make isoagglutinins against the blood group B determinant, a “self” antigen. Conversely, serum from blood group A individuals contains anti-B but not anti-A antibodies. Finally, people with the AB blood group do not make either anti-A or anti-B IgM isoagglutinins, because both are “self” antigens. Anti-H(O) antibodies are not made in most people because a substantial fraction are converted to A or B determinants or they are a “self” antigen. IgM isoagglutinins efficiently trigger the complement cascade and circulate in human plasma at titers sufficient to cause complement-dependent lysis of transfused erythrocytes that display the corresponding blood group antigens. Such rapid erythrocyte lysis causes an immediate, acute transfusion reaction, which can lead to hypotension, shock, acute renal failure, and death from circulatory collapse. This problem is avoided by ensuring that the ABO type of transfused erythrocytes is compatible with the recipient's ABO type. Thus, an A recipient may receive erythrocytes from A or O persons but not from a person of type B or AB. Blood banks perform typing and cross-matching assays. First, units of erythrocyte products typed for the A and B antigens are chosen to match the patient's ABO type. To ensure that these are truly “compatible,” the patient's serum is cross-matched by mixing with a small aliquot of each prospective erythrocyte unit. Erythrocytes of compatible units do not agglutinate (form an erythrocyte clump), whereas incompatibility is indicated by agglutinated erythrocytes formed by antibodies in the patient's serum. Blood typing is used to ensure compatibility not only for red blood cell transfusions but also for transfusion with platelets and plasma. Similar ABO compatibility concerns are important in heart, kidney, liver, and bone marrow transplantation procedures. The “type and cross” procedures have virtually eliminated ABO blood group transfusion reactions in the developed world. Attempts are being made to enzymatically modify A or B erythrocytes using glycosidases to remove GalNAc (A) and/or Gal (B), in order to convert them to “O”, the “universal donor” type. The few individuals with AB type are “universal acceptors.” In addition to accurately typing AB blood types, A1 and A2 blood group distinctions are important clinically as A2 individuals can generate anti-A1 antibodies, although these antibodies are often not clinically meaningful.""
 'Attempts are being made to enzymatically modify A or B erythrocytes using glycosidases to remove GalNAc (A) and/or Gal (B), in order to convert them to “O”, the “universal donor” type. The few individuals with AB type are “universal acceptors.” In addition to accurately typing AB blood types, A1 and A2 blood group distinctions are important clinically as A2 individuals can generate anti-A1 antibodies, although these antibodies are often not clinically meaningful. Furthermore, when crossing ABO(H) barriers during solid organ transplantation, A2 donor organs have better overall survival when compared to A1 following transplantation into a blood group O or B recipient; this is presumably because of the lower expression of the A antigen in A2 individuals. In addition to transfusion and transplantation, ABO(H) alloantigens are some of the most frequent allogeneic barriers crossed during fetal development. IgG anti-A,B antibodies present in blood group O mothers, which react with the A and B antigen, can cross the placenta and engage A or B antigens on the surface of fetal red blood cells (RBCs). However, unlike IgG antibodies against other alloantigens, such as RhD, IgG anti-A,B antibodies rarely cause life-threatening anemia in a fetus or neonate, presumably because of the relatively low level of A and B antigen expression present on fetal RBCs. However, despite the lower level of A and B expression on fetal RBCs, anti-A and anti-B antibodies present in maternal circulation can rapidly remove A or B positive fetal RBCs following exposure during parturition, reducing the probability of alloimmunization to other alloantigens. This was the first example of antibody-mediated immunosuppression clinically and formed the basis of highly successful anti-RhD formularies designed to prevent Rh alloimmunization and therefore hemolytic disease of the fetus and newborn. Cross-matching procedures helped to identify a rare ABO blood group phenotype termed the Bombay phenotype, so named because the first identified individual lived in that city (now Mumbai). Affected persons have erythrocytes and tissue cells lacking A, B, and H determinants because they have inactive FUT1 and FUT2 genes, and therefore no α1-2FucT enzyme. Bombay sera contain IgM antibodies that react with erythrocytes from virtually all donors, including O erythrocytes (H antigen-positive, A and B antigen-negative). They show robust titers of anti-H, anti-A, and anti-B IgM antibodies and cannot receive erythrocytes from any donor except those of the same Bombay blood type. A related phenotype, termed para-Bombay, occurs in people with an inactive FUT1 gene, but at least one functional Se (FUT2) allele (secretor-positive). The fact that Bombay individuals appear generally healthy implies that developmental or physiological functions for the A, B, and H antigens, if they ever existed, are no longer relevant. However, a variety of associations have been made between the ABO blood group phenotype and relative risk for infection by some pathogens and the acquisition of a spectrum of diseases. For example, people with blood group O who are also Lewis-antigen positive (see below) are the most susceptible to infection by Helicobacter pylori. This is because H. pylori binds well to glycans with terminal Fuc, such as the H and Lewis antigens. The AB blood group is associated with infection by Brucella (Brucellosis) and noroviruses that cause gastroenteritis, while blood group O individuals appear to be at an increased risk for cholera. Levels of von Willebrand factor (VWF) correlate with ABO(H) blood group inheritance, with blood group A individuals on average having the highest VWF levels. Differences in VWF among individuals of different blood group status may in part account for associations observed between blood group A individuals and the likelihood of thromboembolic events and other forms of cardiovascular disease. Blood group status has also been associated with risk of stomach and pancreatic cancers. ABO status may also be protective. Thus, enveloped viruses carry the ABO(H) glycans of their hosts and are susceptible to lysis following infection of another individual with an ABO-incompatible type. Finally, differences in susceptibility to severe complications of malaria appear to be affected by ABO blood groups.'
 'Normally, colonic mucosal proteins display heavily O-acetylated sialic acids, but these acetyl groups are diminished in ulcerative colitis. Whether this contributes to the pathology is unknown, but O-acetylated sialic acids are more resistant to bacterial sialidases (Chapter 15). Decreased sialic acid O-acetylation is also a feature of colon carcinomas. Heparin (a highly sulfated form of HS; Chapter 17) is a therapeutic agent extracted from porcine intestines or bovine lungs. It is a fast-acting and potent anticoagulant often used to avoid thrombosis, in procedures including dialysis and open-heart surgery. Its effectiveness relies on a specific sulfated heparin pentasaccharide that binds circulating antithrombin III and markedly enhances its ability to inactivate coagulation Factors Xa and IIa (thrombin) (Chapter 17). Animal-derived “unfractionated heparin” is now often replaced with low-molecular-weight heparins because they have fewer complications. One explanation is that the unfractionated heparin effects on thrombin require a long chain that interacts both with the antithrombin and with thrombin itself in a tripartite complex. In contrast, the shorter chains found in low-molecular-weight heparins only facilitate antithrombin inactivation of Factor Xa. Thus, low-molecular-weight heparins affect Xa but not thrombin activity. A synthetic pentasaccharide (fondaparinux) that binds and facilitates antithrombin inactivation of Factor Xa is an alternative to heparin. Although these improvements are valuable, unfractionated heparin has a variety of other biological effects besides anticoagulation. Thus, other beneficial effects of heparin, such as the blocking of P- and L-selectin, are reduced or even eliminated by the switch to low-molecular-weight heparins and the synthetic pentasaccharide. An uncommon but feared complication of heparin treatment is heparin-induced thrombocytopenia (HIT). During HIT, complexes between heparin and platelet factor-4 form, and the de novo formed pathogenic antibodies against these complexes deposit on platelets, causing their aggregation and loss from circulation. Paradoxically, this process results in exaggerated thrombosis, rather than bleeding. The incidence of this complication is lower with low-molecular-weight heparins and significantly curtailed with the use of the pure pentasaccharide. Sickle cell anemia is an inherited disorder of hemoglobin that leads to various acute and chronic painful complications. Symptoms were thought to be caused by vaso-occlusion due to abnormally shaped and/or membrane-modified hypoxic erythrocytes. Now, it is clear that abnormal adhesion of multiple cell types is responsible, and that this is partially mediated by selectins. Blocking selectin action with analogs of natural ligands such as sLex or heparin can restore blood flow in a mouse model of sickle cell disease. A pan-selectin inhibitor (GMI-1070, “rivipansel”) has undergone clinical trials for reduction of severity and duration of sickle cell crisis. Notably, glycopeptide mimetics of PSGL-1 and antibodies that block PSGL-1-P-selectin interactions (e.g., FDA-approved crizanlizumab) can mitigate sickle cell vaso-occlusive crises. Blood transfusion medicine first identified the ABO blood group system, defined by differential expression of α-GalNAc and α-Gal transferases across populations (Chapter 14). These and other less prominent glycan antigens can cause hemolytic transfusion and rejection reactions, mostly because of errors in blood typing. Although anti-A and anti-B titers likely influence transfusion and transplantation outcomes, simple assessment of antibody levels fails to fully account for the clinical impact(s) of an ABO(H) incompatible transfusion. Efforts to generate “universal donor” red blood cells, via enzymatic conversion of blood group A and B antigens to the O state using bacterial enzymes, are underway.']","Incompatibility is indicated by agglutinated erythrocytes formed by antibodies in the patient's serum. Blood typing is used to ensure compatibility not only for red blood cell transfusions but also for transfusion with platelets and plasma. Similar ABO compatibility concerns are important in heart, kidney, liver, and bone marrow transplantation procedures.","Blood typing is used to ensure compatibility not only for red blood cell transfusions but also for transfusion with platelets and plasma. Similar ABO compatibility concerns are important in heart, kidney, liver, and bone marrow transplantation procedures. The “type and cross” procedures have virtually eliminated ABO blood group transfusion reactions in the developed world. Attempts are being made to enzymatically modify A or B erythrocytes using glycosidases to remove GalNAc (A) and/or Gal (B), in order to convert them to “O”, the “universal donor” type. The few individuals with AB type are “universal acceptors.” In addition to accurately typing AB blood types, A1 and A2 blood group distinctions are important clinically as A2 individuals can generate anti-A1 antibodies, although these antibodies are often not clinically meaningful. Furthermore, when crossing ABO(H) barriers during solid organ transplantation, A2 donor organs have better overall survival when compared to A1 following transplantation into a blood group O or B recipient; this is presumably because of the lower expression of the A antigen in A2 individuals.",1.0,0.5898137369895972,0.7941127699862005,0.012658227848101266,0.9999999999666667,1.0
"Complete the following paragraph: Given their high density and widespread location on vertebrate cells, Sias also exert many functions via electronegative charge, such as repulsion of cell–cell interactions, protein stabilization, ion binding, and ion transport. Early nomenclature of these molecules was tied to their discovery, being first isolated by Gunnar Blix from salivary mucins in 1936 and independently by Ernst Klenk from brain glycolipids in 1941. Blix named his substance “sialic acid” after the Greek word for saliva (σíαλoν), and Klenk named his “neuraminic acid” for neurons in the brain. By the time the relationship of these substances became evident, both names were already in use and have persisted.","['NCBI Bookshelf. A service of the National Library of Medicine, National Institutes of Health. Varki A, Cummings RD, Esko JD, et al., editors. Essentials of Glycobiology [Internet]. 4th edition. Cold Spring Harbor (NY): Cold Spring Harbor Laboratory Press; 2022.  doi: 10.1101/glycobiology.4e.15 Amanda L. Lewis, Xi Chen, Ronald L. Schnaar, and Ajit Varki. Sialic acids (Sias) are abundant on vertebrate glycoproteins, glycolipids, and milk oligosaccharides, as well as on some microbial surface glycans, mediating diverse functional roles. Originally discovered within the Deuterostome lineage of animals and associated microbes, they are actually a subset of a more ancient family of α-keto acid monosaccharides with a 9-carbon backbone called nonulosonic acids (NulOs), which are also found in some Eubacteria and Archaea. Biosynthesis of all NulO-glycans requires the activation of NulO to a CMP-sugar, before the NulO is transferred to glycan acceptors. NulOs are remarkable for the number and the type of functional groups on one monosaccharide. Further complexity arises from various epimers, modifications, and diverse linkages to other glycans, making these molecules well-suited to carry information for glycan–protein, cell–cell, and pathogen–host recognition. NulOs are among the most rapidly evolving classes of monosaccharides in nature and exist in tremendous variety, particularly in the microbial world. Given their high density and widespread location on vertebrate cells, Sias also exert many functions via electronegative charge, such as repulsion of cell–cell interactions, protein stabilization, ion binding, and ion transport. Early nomenclature of these molecules was tied to their discovery, being first isolated by Gunnar Blix from salivary mucins in 1936 and independently by Ernst Klenk from brain glycolipids in 1941. Blix named his substance “sialic acid” after the Greek word for saliva (σíαλoν), and Klenk named his “neuraminic acid” for neurons in the brain. By the time the relationship of these substances became evident, both names were already in use and have persisted. Although 5-N-acetylneuraminic acid (Neu5Ac, sometimes called “NANA”) is the most common sialic acid (Sia) in humans, the Sia family is comprised of related structures (Figure 15.1) that vary at the C-5 carbon, including 5-N-glycolylneuraminic acid (Neu5Gc) and 3-deoxy-D-glycero-D-galacto-non-2-ulosonic acid (also known as 3-deoxy-nonulosonic acid, 2-keto-3-deoxy-nononic acid, or Kdn) with a hydroxyl group at C-5. Similar 9-carbon backbone 2-keto acid monosaccharides were later discovered in some bacterial lipopolysaccharides and initially called “bacterial sialic acids.” The resulting confusion was resolved by suggesting that the term “sialic acid” (Sia) be limited to its original use in describing neuraminic acid (Neu), Kdn, and their derivatives in deuterostomes and their pathogens, and that the term “nonulosonic acid” (NulO) be used to encompass the entire group of 9-carbon backbone non-2-ulosonic acids (Figure 15.1). Base structures representing the larger family of NulO molecules are shown in Figure 15.1 for comparison. This chapter will largely deal with the biology, metabolism, and functions of Sias in mammals. The evolution, distribution, and functions of the larger family of NulOs are briefly described toward the end of this chapter. Sialic acids (Sias) and other nonulosonic acids (NulOs). As shown in the figure, Sias are a subset of NulOs.'
 'Use of α2-3 or α2-8-specific sialidases can provide some insight on Sia linkages as well. Sia-glycosides are also more susceptible to acid hydrolysis than most other sugars, being released using 0.1 m HCl or even with weak acids like 2 m acetic acid or propionic acid at 80°C (albeit still with some loss or migration of labile modifications). This allows selective release of Sias from complex glycans for subsequent analysis by chromatographic methods. Free Sias react with 1,2-diamino-4,5-methylenedioxybenzene (DMB) to generate fluorescent compounds amenable to qualitative and quantitative high-pressure liquid chromatography. There are still some major limitations to methods available for Sia analysis. For example, some mass spectrometric methods result in selective loss of Sias before mass detection. Some Sia-linkages are partly or completely resistant to sialidases and some are even relatively resistant to acid release. In terms of identifying Sia modifications, the most accurate analysis requires complete release and purification with the modifications intact. The stability of each modification to analytical conditions must be considered—for example, O-acetyl groups are labile to common methods that use alkaline conditions (permethylation and beta-elimination). Sia-binding lectins are also useful for detecting sialoglycans and their linkages in situ and on isolated sialoglycans. Sambucus nigra (elderberry) lectin binds selectively to α2-6-linked Sias and Maackia amurensis lectins bind selectively to α2-3-linked Sias. Because plants do not express Sias, these lectins may perhaps deter animal ingestion. Alternatively, the natural ligands of these lectins may not be Sias. Improved probes are now being developed, taking advantage of the fact that many microbes have spent millions of years optimizing their binding to vertebrate sialomes (e.g., the B subunits of various toxins). An interesting tool for detecting a specific Sia modification is the hemagglutinin of influenza C or bovine coronavirus, which bind specifically to 9-O-acetyl Sias on isolated sialoglycans, cells, and tissues, if the esterase function is inactivated. Sias are endowed with a rich diversity of chemical modalities within a single monosaccharide, which evolution uses to modulate the biophysical environment, to mask underlying glycans, and for specific recognition by complementary Sia-binding proteins that mediate biological processes. These functions are not mutually exclusive—for example, highly sialylated molecules with major biophysical roles (such as mucins) may also express specific sialoglycans that serve as ligands in recognition processes. For simplicity, different roles of Sias are addressed separately below. Mucins are heavily glycosylated O-GalNAc-modified sialoglycoproteins secreted or membrane-bound at epithelial surfaces in airways and in the gastrointestinal and urogenital tracts of animals (Chapter 10). Mucins can be remarkably large (several in the range of 5 to >20 MDa). Their dense anionic charge and their propensity to bind water make them efficient as a hydrating and protective barrier at tissue surfaces in contact with the environment. On mucins, as well as other glycoproteins, closely spaced O-GalNAc-linked sialoglycans generate extended polypeptide configurations that would collapse without glycosylation. Clustered sialoglycans along the polypeptide chain can also protect the underlying protein from proteases. Membrane-bound sialoglycans on glycoproteins and glycolipids, which are often quite dense, provide cell surface anionic charge that acts as a barrier and regulates cell surface functions. An extreme example of these biophysical effects is polySia, whose functional impacts are detailed above. Given Sia abundance on cell surfaces (see Figure 15.3), it is not surprising that numerous animal pathogens evolved to target these molecules. Indeed, highly specific Sia-binding proteins were first discovered on human pathogens and their toxins. In the search for host cell receptors for influenza viruses, it was discovered that isolated viruses cross-linked red blood cells, resulting in hemagglutination.'
 ""A useful conceptualization of the sialome is as a “forest canopy” of the cell-surface glycan “forest” (the whole glycome) (Figure 15.3). At the outermost level are different Sia structures (leaves and flowers), which are in glycosidic linkage to underlying linear and branched oligosaccharides (stems and branches) (see Figures 15.2 and 15.3), which in turn are components of glycoproteins and glycolipids (the tree trunks). At the cell surface, glycolipids and glycoproteins organize into lateral domains (forests). Just as the forest varies greatly from place to place, the sialome varies among cell types and among domains on a given cell surface, variations that serve specific functions. As with the glycome, each cell type in each species expresses its own distinct sialome. For example, although mammalian liver sialoglycans are most abundant on glycoproteins, brain sialoglycans are much more abundant as sialoglycolipids (Chapter 11), so much so that they are termed “gangliosides” for the nerve ganglia on which they were discovered. The sialome also varies markedly in response to environmental cues. Sias can also exist as internally linked structures rather than on termini of glycans. In vertebrates, the terminal Sia of a glycan chain is rarely extended further, except with another Sia (Figure 15.3). Among bacteria, Sias and the related NulOs can also be found in diverse cellular structures, including capsular polysaccharides, lipopolysaccharide O-antigens or as part of flagella, pili, or structures such as the cell wall or S-layer (Chapter 21). Bacteria with close relationships to vertebrate hosts often mimic the terminal placement of Sias on capsules and O-antigens. However, many NulOs of bacteria, including Sias, can occur as internal glycan components within repeating units of polysaccharides, which have also been reported in some invertebrates such as echinoderms. In the latter, the C-4 hydroxyl of Neu5Ac is sometimes glycosylated with other monosaccharides such as fucose, galactose, and glucose. Overall, it appears that we do not yet know the full extent of sialoglycan diversity in nature. Polysialic acid (polySia, previously called PSA) is a linear homopolymer of Sias that sometimes reaches lengths of more than 100 residues. Shorter chains of two to three residues, called oligosialic acids, are common components of gangliosides (Figure 15.3 and Chapter 11) and are found occasionally as terminal structures on glycoprotein glycans. PolySia is a prominent structural feature of a highly select group of acceptor proteins, the best studied of which is the neural cell adhesion molecule (NCAM). Beginning early in vertebrate brain development, long polySia chains (Neu5Acα2-8)n are added to NCAM (often then called PSA-NCAM), on the termini of two specific N-glycans. The large hydration shell formed by polySia markedly increases the hydrodynamic volume of its protein carrier and interferes with NCAM's natural cell–cell adhesion function. PolySia thus converts an adhesive protein into a repelling one. During brain development, a high level of polySia likely ensures that neural precursors can migrate to their final anatomical sites. Once a destination is reached, polySia is down-regulated and firm adhesion proceeds, keeping the cells in place. When the sialyltransferases (STs) responsible for polySia formation are genetically ablated in mice, some nerve progenitor cells adhere prematurely, become stuck in place and fail to reach their proper destination. In contrast to the above-mentioned “repulsive field effects,” polySia can also act an “attractive field,” binding and locally concentrating neurotrophic factors like BDNF and FGF2. Notably, human genetic and molecular evidence indicate that variations in polysialylation may be a factor in human psychiatric diseases like schizophrenia.""]","By the time the relationship of these substances became evident, both names were already in use and have persisted. Although 5-N-acetylneuraminic acid (Neu5Ac, sometimes called “NANA”) is the most common sialic acid (Sia) in humans, the Sia family is comprised of related structures that vary at the C-5 carbon, including 5-N-glycolylneuraminic acid (Neu5Gc) and 3-deoxy-D-glycero-D-galacto-non-2-ulosonic acid (also known as 3-deoxy-nonulosonic acid, 2-keto-3-deoxy-nononic acid, or Kdn) with a hydroxyl group at C-5.","Although 5-N-acetylneuraminic acid (Neu5Ac, sometimes called “NANA”) is the most common sialic acid (Sia) in humans, the Sia family is comprised of related structures (Figure 15.1) that vary at the C-5 carbon, including 5-N-glycolylneuraminic acid (Neu5Gc) and 3-deoxy-D-glycero-D-galacto-non-2-ulosonic acid (also known as 3-deoxy-nonulosonic acid, 2-keto-3-deoxy-nononic acid, or Kdn) with a hydroxyl group at C-5. Similar 9-carbon backbone 2-keto acid monosaccharides were later discovered in some bacterial lipopolysaccharides and initially called “bacterial sialic acids.” The resulting confusion was resolved by suggesting that the term “sialic acid” (Sia) be limited to its original use in describing neuraminic acid (Neu), Kdn, and their derivatives in deuterostomes and their pathogens, and that the term “nonulosonic acid” (NulO) be used to encompass the entire group of 9-carbon backbone non-2-ulosonic acids (Figure 15.1).",1.0,0.544574898145619,0.9389512251800175,0.012658227848101266,0.9999999999666667,0.6666666666666666
"Complete the following paragraph: Large hyaluronan polymers in the extracellular space can be internalized following interaction with cell-surface receptors that trigger endocytosis, which may be facilitated by the membrane-associated hyaluronidases, HYAL2 and/or TMEM2, or through association with CEMIP.","['The Streptococcus hasA gene encodes a bifunctional protein that contains both transferase activities and assembles the polysaccharide from the reducing end. The synthase spans the membrane multiple times, presumably forming a pore for hyaluronan extrusion during capsule formation. In contrast, Pasteurella synthesizes hyaluronan by an enzyme that is unrelated to hasA and the mammalian Has gene family. In this case, the enzyme has two separable domains with independent glycosyltransferase activities—one for UDP-GlcNAc and the other for UDP-GlcA, and the elongation is on the nonreducing end. Animal cells express a set of catabolic enzymes that degrade hyaluronan. The human hyaluronidase gene (HYAL) family is complex, with two sets of three contiguous genes located on two chromosomes, a pattern that suggests two ancient gene duplications followed by a block duplication. In humans, the cluster on chromosome 3p21.3 (HYAL1, 2, and 3) appears to have major roles in somatic tissues. HYAL4 in the cluster on chromosome 7q31.3 codes for a protein that appears to have chondroitinase, but not hyaluronidase, activity; PHYAL1 is a pseudogene; and SPAM1 (sperm adhesion molecule 1, PH-20) is restricted to testes. The role of SPAM1 in fertilization is discussed below. Two additional enzymes with hyaluronan depolymerizing activity at neutral pH have been subsequently identified in multiple tissues and termed TMEM2 (transmembrane protein 2) and KIAA1199 (CEMIP, cell migration–inducing protein). The turnover of hyaluronan in most tissues is rapid (e.g., a half-life of ∼1 day in epidermal tissues), but its residence time in some tissues can be quite long and dependent on location (e.g., in cartilage). It has been estimated that an adult human contains ∼15 g of hyaluronan and that about one-third turns over daily. Turnover appears to occur by receptor-mediated endocytosis and lysosomal degradation either locally or after transport by lymph to lymph nodes or by blood to liver. The endothelial cells of the lymph node and liver sinusoids remove hyaluronan via specific receptors, such as LYVE-1 (a homolog of CD44) and HARE (hyaluronan receptor for endocytosis). HARE appears to be the major clearance receptor for hyaluronan delivered systemically by lymph and blood. The current understanding of this catabolic process is that hyaluronidases at the cell surface and in the lysosome cooperate to degrade the chains. Large hyaluronan polymers in the extracellular space can be internalized following interaction with cell-surface receptors that trigger endocytosis, which may be facilitated by the membrane-associated hyaluronidases, HYAL2 and/or TMEM2, or through association with CEMIP. The hyaluronan fragments may be returned to the extracellular space via recycling endosomes or enter a pathway to lysosomes for complete degradation to monosaccharides, probably involving HYAL1 and the two exoglycosidases β-glucuronidase and β-N-acetylglucosaminidase. The importance of the turnover process for growth and survival is demonstrated by the respective embryonic lethal phenotypes in animal models. Hyal2-null mice and Tmem2-deficient zebrafish both suffer embryonic lethality as a result of cardiac developmental defects. CEMIP is important for clearing hyaluronan accumulation during bacterial infection in mice. In humans, a lysosomal storage disorder was found to result from mutation of HYAL1 (Chapter 44). Hyaluronan fragments have been suggested to act as an endogenous signal of injury, or during infection by Group A Streptococcus, which contains a hyaluronan capsule. The signaling activity of hyaluronan fragments is mediated through binding of cell-surface receptors, such as CD44, which in turn modulates response through Toll-like receptors.'
 'The fold consists of about 100 amino acids and contains four cysteines disulfide-bonded in the pattern Cys1-Cys4 and Cys2-Cys3. This fold has only been found in vertebrates, consistent with the fact that hyaluronan is a relatively recent evolutionary invention. The link module fold is related to that found in the C-type lectins, but it lacks the Ca++ binding motif (Chapter 34). In the case of TSG-6, the interaction of hyaluronan with the protein involves ionic interactions between positively charged amino acid residues and the carboxyl groups of the uronic acids, and hydrophobic interactions between the acetamido side chains of two N-acetylglucosamine residues and hydrophobic pockets on either side of adjacent tyrosines (Figure 16.5). Many of these features are conserved in other members of the hyaluronan-binding proteins. Subgroups, however, differ in the preferred size and length of hyaluronan for binding (e.g., hexasaccharides to decasaccharides). Structure of the link module. (A) TSG-6 contains a prototypical link module defined by two α-helices (α1 and α2) and two triple-stranded antiparallel β-sheets (β1,2,6 and β3–5). (Redrawn, with permission, (more...) Some hyaluronan-binding proteins do not contain a link module (RHAMM, ITI, SPACR, SPACRCAN, CD38, CDC37, HABP1/P-32, Siglec-9, and IHABP4), and most of these are unrelated to one another by primary sequence. Some of these proteins contain sequences of nine amino acids, referred to as BX7B motifs (where B is either lysine or arginine and X can be any amino acid other than acidic residues), but the actual hyaluronan docking site of the chain with this motif has not been established. Thus, the presence of the BX7B motif should not be taken as proof that the protein interacts with hyaluronan. Hyaluronan production has long been implicated in enhanced cell adhesion and locomotion because it is present abundantly during morphogenesis and in both physiological and pathological invasive processes. Five different types of cell signaling proteins have been found to mediate the complex breadth of functions associated with hyaluronan (Figure 16.6). Hyaluronan signaling in health and disease. CD44, cluster of differentiation antigen, a type I transmembrane receptor; FAK, focal adhesion kinase; FGF, fibroblast growth factor; HARE, hyaluronan receptor for endocytosis; LYVE-1, lymphatic vessel endothelial (more...) Toll-like receptors TLR2 and TLR4, which are components of the innate immune system responsive to bacterial pro-inflammatory stimuli such as lipopolysaccharide (LPS), have been found to signal differentially in response to the generation of hyaluronan oligosaccharides by hyaluronidase. Depending on cell type, this may occur through direct binding of the hyaluronan oligosaccharides by TLR2/4. Alternatively, because hyaluronan encapsulation can obstruct access of TLR2/4 by other known ligands, hyaluronidase-mediated capsule degradation can also facilitate TLR2/4 activation by allowing other ligands to bind. HARE is expressed on the cell surface of a variety of sinusoidal endothelial cell types, where it is capable of binding hyaluronan and other glycosaminoglycan ligands, subsequently triggering receptor-mediated endocytosis and thereby clearing these components from circulation. Signaling occurs optimally during uptake of 50- to 250-kDa hyaluronan; smaller or larger hyaluronan does not activate signaling and blocks signaling by 50- to 250-kDa hyaluronan. Signaling through both TLR2/4 and HARE activate NF-κB and promote the secretion of pro-inflammatory and pro-apoptotic cytokines. CD44 is a transmembrane receptor expressed by many cell types, and it varies markedly in glycosylation, oligomerization, and protein sequence because of differential mRNA splicing.'
 'Signaling through both TLR2/4 and HARE activate NF-κB and promote the secretion of pro-inflammatory and pro-apoptotic cytokines. CD44 is a transmembrane receptor expressed by many cell types, and it varies markedly in glycosylation, oligomerization, and protein sequence because of differential mRNA splicing. CD44 contains a cytoplasmic domain, a transmembrane segment, and an ectodomain with a single link module that can bind hyaluronan. When hyaluronan binds to CD44, the cytoplasmic tail can interact with regulatory and adaptor molecules, such as SRC kinases, RHO (ras homolog) GTPases, VAV2 (a human proto-oncogene), GAB1 (a GRB2-associated binding protein), and ankyrin and ezrin (which regulate cytoskeletal assembly/disassembly and cell migration). Binding of hyaluronan to CD44H (the isoform expressed by hematopoietic cells) can mediate leukocyte rolling and extravasation in some tissues. Interaction of hyaluronan with CD44 can also regulate ErbB-family (including epithelial growth factor receptor, HER2) signaling, thereby activating the PI3K (phosphatidylinositol 3-kinase)–PKB (protein kinase B/AKT) signaling pathway and phosphorylation of FAK (focal adhesion kinase) and BAD (BCL2-antagonist of cell death), which promote cell survival. Changes in CD44 expression, notably expression of CD44 variants, are associated with a wide variety of tumors and the metastatic spread of cancer. LYVE-1 is a lymphatic vessel endothelial hyaluronan receptor that is a homolog of CD44. Importantly, LYVE-1 signals uniquely through growth factor stimuli in lymphatic vasculature and lymph nodes to promote circulating leukocyte adhesion and support lymphatic development. Many cells also express RHAMM, which is also known as HMMR (homeostasis, mitosis, and meiosis regulator) and is involved in cell motility and cell division. The RHAMM pathway is thought to induce focal adhesions to signal the cytoskeletal changes required for elevated cell motility seen in tumor progression, invasion, and metastasis. RHAMM splice variants exist, some of which may be intracellular. RHAMM possesses a BX7B sequence that promotes electrostatic interaction with hyaluronan but is also part of a basic leucine zipper motif that is capable of centrosome and microtubule interactions. Thus, RHAMM is also a nonmotor spindle assembly factor. Hyaluronan binding to RHAMM activates SRC, FAK, ERK (extracellular mitogen-regulated protein kinase), and PKC (protein tyrosine kinase C) (Chapter 40). These pathways are relevant to tumor cell survival and invasion; their inhibition by hyaluronan oligomers and soluble hyaluronan-binding proteins suggests novel therapeutic approaches for treating cancer (Chapter 47). Some pathogenic bacteria (e.g., certain strains of Streptococcus and Pasteurella) produce hyaluronan as an extracellular capsule; also see Chapter 21). Capsular hyaluronan, like other capsular polysaccharides, increases virulence by helping to shield the microbe from host defenses. For example, the capsule blocks phagocytosis and protects against complement-mediated killing. Because bacterial hyaluronan is identical in structure to host hyaluronan, the capsule can also prevent the formation of protective antibodies. Thus, the formation of hyaluronan capsules by bacteria is a form of molecular mimicry. The capsule also can aid in bacterial adhesion to host tissue, facilitating colonization (Chapter 37). Finally, the production of hyaluronan by invading bacteria can also induce a number of signaling events through hyaluronan-binding proteins that modulate the host physiology (i.e., cytokine production; Chapter 42). In addition to bacteria, an algal virus (Chlorella) encodes a hyaluronan synthase. The functional significance of viral hyaluronan production is unknown, but could be related to prevention of secondary viral infection, increase in host capacity to produce virus, or viral burst size.']","The hyaluronan fragments may be returned to the extracellular space via recycling endosomes or enter a pathway to lysosomes for complete degradation to monosaccharides, probably involving HYAL1 and the two exoglycosidases β-glucuronidase and β-N-acetylglucosaminidase.","The hyaluronan fragments may be returned to the extracellular space via recycling endosomes or enter a pathway to lysosomes for complete degradation to monosaccharides, probably involving HYAL1 and the two exoglycosidases β-glucuronidase and β-N-acetylglucosaminidase.",1.0,0.6364863921314019,0.9999339575810366,0.014084507042253521,0.9999999999666667,1.0
"Complete the following paragraph: Genetic evidence from studies of C. elegans suggests that N-acetylgalactosamine addition during chondroitin assembly is mediated by the same enzyme that is involved in chain polymerization (Sqv5), but biochemical evidence suggests that more than one enzyme may exist in vertebrates. In heparin/heparan sulfate formation, the addition of the first N-acetylglucosamine residue is catalyzed by an enzyme called EXTL3, which differs from the transferases involved in heparan polymerization (called EXT1 and EXT2).","['Genetic evidence from studies of C. elegans suggests that N-acetylgalactosamine addition during chondroitin assembly is mediated by the same enzyme that is involved in chain polymerization (Sqv5), but biochemical evidence suggests that more than one enzyme may exist in vertebrates. In heparin/heparan sulfate formation, the addition of the first N-acetylglucosamine residue is catalyzed by an enzyme called EXTL3, which differs from the transferases involved in heparan polymerization (called EXT1 and EXT2). These enzymes are important control points because they ultimately regulate the type of glycosaminoglycan chain that will assemble. Control of the addition of β4GalNAc or α4GlcNAc appears to be manifested at the level of enzyme recognition of the polypeptide substrate. Keratan sulfate chains contain a mixture of nonsulfated (Galβ4GlcNAcβ3), monosulfated (Galβ4GlcNAc6Sβ3), and disulfated (Gal6Sβ4GlcNAc6Sβ3) disaccharide units (Figure 17.2). The biosynthesis of the poly-N-acetyllactosamine backbone is described in Chapter 14. At least two classes of sulfotransferases, one or more N-acetylglucosaminyl 6-O-sulfotransferases (e.g., CHST4 or CHST6), and one or two galactosyl 6-O-sulfotransferases (CHST1 and CHST3) catalyze the sulfation reactions. These enzymes, like other sulfotransferases, use activated sulfate (PAPS [3′-phosphoadenyl-5′-phosphosulfate]) as a high-energy donor (Chapter 5). 6-O-Sulfation of N-acetylglucosamine occurs on the nonreducing terminal residue, encouraging further chain elongation, whereas sulfation of galactose residues takes place on nonreducing terminal and internal galactose residues, with a preference for galactose units adjacent to a sulfated N-acetylglucosamine residue. Sulfation of a nonreducing terminal galactose residue blocks further elongation of the chain, providing a potential mechanism for controlling chain length. The poly-N-acetyllactosamine chains of KS I are generally longer than those of KS II and may contain up to 50 disaccharide units (20–25 kDa). The chains can be fucosylated and sialylated as well (Chapter 14). Vertebrate chondroitin sulfate consists of repeating sulfate-substituted GalNAcβ4GlcAβ3 disaccharides polymerized into long chains (Figure 17.2). In contrast, invertebrates such as C. elegans and D. melanogaster make either nonsulfated or low sulfated chains. The assembly process for the backbone appears to be highly conserved, based on the presence of homologous genes for all of the reactions (Chapters 25 and 26). As described above, the assembly process is initiated by the transfer of GalNAcβ3 to the linkage tetrasaccharide (Figure 17.4). In both vertebrates and invertebrates, the polymerization step is catalyzed by one or more bifunctional enzymes (chondroitin synthases) that have both β3 glucuronosyltransferase and β4 N-acetylgalactosaminyltransferase activities. Vertebrates also express homologs that can transfer individual sugars to the chain. Chondroitin polymerization also requires the action of the chondroitin polymerizing factor (CHPF), a protein that lacks independent activity but collaborates with the polymerases to enhance the formation of polymers. Sulfation of chondroitin in vertebrates is a complex process, with multiple sulfotransferases involved in 4-O-sulfation and 6-O-sulfation of N-acetylgalactosamine residues (Figure 17.5).'
 'KS I, originally detected in cornea, is found on an N-glycan linked to protein through an asparagine residue (Chapter 9). KS II (skeletal keratan sulfate) is found on an O-glycan core 2 structure and is thus linked through N-acetylgalactosamine to serine or threonine (Chapter 10). The structural features in control of keratan sulfate substitution remain unclear, as the underlying poly-N-acetyllactosamine backbone can be found on many other glycoproteins. Notably, in humans and bovine, the large chondroitin sulfate proteoglycan found in cartilage (aggrecan) contains a segment of four to 23 hexapeptide repeats (E-E/L-P-F-P-S) where the keratan sulfate chains are located, whereas aggrecan in rats and other rodents lacks this motif and does not contain keratan sulfate. Keratan sulfates (KS) contain a sulfated poly-N-acetyllactosamine chain, linked to either asparagine or serine/threonine residues. Chst1 and 5 can add sulfate groups at the indicated positions. The actual order of the various sulfated and nonsulfated (more...) Two classes of glycosaminoglycan chains—chondroitin sulfate/dermatan sulfate and heparan sulfate/heparin—are linked to serine residues in proteins by way of xylose (Figure 17.4). Xylosyltransferase initiates the process using UDP-xylose as donor. Two isoforms of the enzyme are known in vertebrates (XYLT1 and XYLT2), but only one isozyme exists in C. elegans and D. melanogaster. A glycine residue invariably lies to the carboxy-terminal side of the serine attachment site, but a perfect consensus sequence for xylosylation does not exist. At least two acidic amino acid residues are usually present, and they can be located on one or both sides of the serine, usually within a few residues. Several proteoglycans contain clustered glycosaminoglycan attachment sites, raising the possibility that xylosyltransferase could act in a processive manner. Xylosylation is an incomplete process in some proteoglycans, which may explain why proteoglycans with multiple potential attachment sites contain different numbers of chains in different cells. The biosynthesis of chondroitin sulfate (left chain) and heparan sulfate (right chain) is initiated by the formation of a linkage region tetrasaccharide (green circles in Fig. 17.1). Addition of the first hexosamine commits the intermediate to either (more...) After xylose addition, a linkage tetrasaccharide assembles by the transfer of two galactose residues catalyzed by unique members of the β4 galactosyl-, β3 galactosyl-, and β3 glucuronosyltransferase families of enzymes (Figure 17.4). This intermediate can undergo phosphorylation at the C-2 position of xylose and in the case of chondroitin sulfate, sulfation of the galactose residues. In general, phosphorylation and sulfation occur substoichiometrically, but phosphorylation may be transient. Phosphorylation occurs early in the assembly process and creates the preferred substrate for B4GALT7; a phosphatase removes the phosphate at a later stage of biosynthesis. The function of galactose sulfation in chondroitin sulfate remains unclear. The linkage tetrasaccharide lies at a bifurcation in the biosynthetic pathway: addition of β4-linked N-acetylgalactosamine, which initiates chondroitin sulfate assembly, or addition of α4-linked N-acetylglucosamine, which initiates heparan sulfate assembly (Figure 17.4). Genetic evidence from studies of C. elegans suggests that N-acetylgalactosamine addition during chondroitin assembly is mediated by the same enzyme that is involved in chain polymerization (Sqv5), but biochemical evidence suggests that more than one enzyme may exist in vertebrates.'
 'Vertebrates also express homologs that can transfer individual sugars to the chain. Chondroitin polymerization also requires the action of the chondroitin polymerizing factor (CHPF), a protein that lacks independent activity but collaborates with the polymerases to enhance the formation of polymers. Sulfation of chondroitin in vertebrates is a complex process, with multiple sulfotransferases involved in 4-O-sulfation and 6-O-sulfation of N-acetylgalactosamine residues (Figure 17.5). Biosynthesis of chondroitin sulfate/dermatan sulfate involves the polymerization of N-acetylgalactosamine and glucuronic acid units and a series of modification reactions including O-sulfation and epimerization of glucuronic acid to iduronic acid. Heparan (more...) Additional enzymes exist for epimerization of D-glucuronic acid to L-iduronic acid in dermatan sulfate (DSE1-2), sulfation at the C-2 position of the uronic acids, and other patterns of sulfation found in unusual species of chondroitin (Table 17.2). The location of sulfate groups is easily assessed using bacterial chondroitinases (ABC, B, and ACII) that cleave the chains into disaccharides. Many chains are hybrid structures containing more than one type of chondroitin disaccharide unit. For example, dermatan sulfate is defined as having one or more iduronic acid–containing disaccharide units (chondroitin sulfate B) as well as glucuronic acid–containing disaccharides (chondroitin sulfate A and C). Animal cells also degrade chondroitin sulfate in lysosomes using a series of exolytic activities (Chapter 44). Types of chondroitin sulfates  Heparan sulfate assembles as a copolymer of GlcNAcα4GlcAβ4 (Figure 17.5), which then undergoes extensive modification reactions, catalyzed by at least four families of sulfotransferases and one epimerase. N-acetylglucosamine N-deacetylase/N-sulfotransferases (NDST1-4) act on a subset of N-acetylglucosamine residues to generate N-sulfated glucosamine (GlcNSO3) units, many of which occur in clusters along the chain. Generally, the enzyme deacetylates N-acetylglucosamine and rapidly adds sulfate to the free amino group to form GlcNSO3, but a small number of glucosamine residues with unsubstituted amino groups may arise from incomplete N-sulfation. An epimerase (GLCE), different from the one involved in dermatan sulfate synthesis, then acts on some glucuronic acid residues, followed by 2-O-sulfation of some of the iduronic acid units (catalyzed by HS2ST). Some glucuronic acid units also undergo 2-O-sulfation by the same enzyme. The addition of 2-O-sulfate groups to glucuronic or iduronic acid prevents the reversible epimerization reaction. Next, 6-O-sulfotransferases (HS6ST1-3) add sulfate groups to selected glucosamine residues. Finally, certain subsequences of sulfated sugar residues and uronic acid epimers provide targets for 3-O-sulfotransferases (HS3ST1-6). Unlike other glycosaminoglycans, heparan sulfate is further modified once displayed at the plasma membrane. A family of plasma membrane endosulfatases (SULFs) can remove sulfate groups from internal 6-O-sulfated glucosamine residues in heparan sulfate and a heparanase can cleave the chains at limited sites. This post-assembly processing of the chains at the cell surface results in altered response of cells to growth factors and morphogens. Intriguingly, the mammalian genome contains other sulfatases of unknown function, raising the possibility that other post-assembly processing reactions of glycosaminoglycans may occur.']","In heparin/heparan sulfate formation, the addition of the first N-acetylglucosamine residue is catalyzed by an enzyme called EXTL3, which differs from the transferases involved in heparan polymerization (called EXT1 and EXT2).","These enzymes are important control points because they ultimately regulate the type of glycosaminoglycan chain that will assemble. Control of the addition of β4GalNAc or α4GlcNAc appears to be manifested at the level of enzyme recognition of the polypeptide substrate. Keratan sulfate chains contain a mixture of nonsulfated (Galβ4GlcNAcβ3), monosulfated (Galβ4GlcNAc6Sβ3), and disulfated (Gal6Sβ4GlcNAc6Sβ3) disaccharide units (Figure 17.2).",1.0,0.7311711760620172,0.6132206244751617,0.016129032258064516,0.9999999999666667,1.0
"Complete the following paragraph: Highly conserved homologs of OGT and OFT are found in numerous bacterial genomes, although studies of their functional roles are essentially nonexistent.","[""In addition, both OGT and OGA are modified by both tyrosine and serine/threonine phosphorylation, nitrosylation, ubiquitination, and O-GlcNAcylation. Functions for some of these posttranslational modifications have been identified, including substrate targeting, altering protein localization, and altering specific activity. Notably, cellular O-GlcNAc levels control the maturation of OGT and OGA mRNA and, in turn, the abundance of each enzyme. Thus, when O-GlcNAc levels are elevated, OGT abundance is depressed and OGA abundance augmented. In contrast, in response to low levels of O-GlcNAc, OGA abundance is depressed, and OGT levels are augmented. O-GlcNAc transferase (OGT) is regulated by multiple complex mechanisms, including transcriptional regulation of its expression, differential mRNA splicing, proteolytic processing, posttranslational modification, and multimerization with itself and other (more...) OGT (uridine diphospho-N-acetylglucosamine: polypeptide β-N-acetylglucosaminyltransferase; EC 2.4.1.255) catalyzes the addition of N-acetylglucosamine from UDP-GlcNAc to specific serine or threonine residues to form a β-O-glycosidic linkage. The enzyme was first identified and purified from rat liver and subsequently cloned from rat, human, Caenorhabditis elegans, and other organisms. OGT resides on the X chromosome (Xq13 in humans) near the centromere and is among the most highly conserved proteins from worms to man. Mutations in OGT, both in its tetratricopeptide repeats (TPRs) and in its catalytic domain, cause X-linked intellectual disability in humans. To date, three isoforms of OGT have been well characterized: (1) the nucleocytoplasmic or full-length variant (ncOGT), which is 110 kDa; (2) a short isoform of OGT (sOGT), which is 78 kDa; and (3) a variant of OGT that is targeted to the mitochondria (mOGT; ∼90 kDa). In the nucleus and cytoplasm, OGT appears to form multimers, consisting of one or more 110-kDa subunits and 78-kDa subunits. Several useful small molecule inhibitors of OGT have been developed, including OSMI-4b, Ac45SGlcNAc, and 5SGlcNHex, with the latter effective in animal models. However, some off-target effects have been reported for these inhibitors, likely because they impact other enzymes that use UDP-GlcNAc. ncOGT has two distinct domains separated by a putative nuclear localization sequence. The amino terminus of each OGT subunit contains TPRs, which can number up to 13 (species-dependent). The major variation between the three (above) variants is in the number of the TPRs. The crystal structure of the human TPR domain of ncOGT shows that the repeats occur as stacked α-helical domains, forming a “tube-like” structure with a remarkable structural similarity to the armadillo repeat domain of the nuclear transport protein importin-α. The TPR domain mediates multimerization of OGT subunits and acts as a scaffold for protein–protein interactions, including protein substrates (Figure 19.3). OGT's glycosyltransfer reaction occurs by an ordered bi–bi mechanism with UDP-GlcNAc binding first. The TPR domains are required for substrate binding, enzymatic activity, and stability. Recent studies have demonstrated that residues in the TPR domain are critical for interactions with substrates. Such findings likely underpin the observation that there is no strict consensus motif that dictates glycosylation by OGT, although valine and alanine are preferred at the –3 and +2 positions, respectively, and there is a preference for aromatic residues at –4 position. In addition to catalyzing O-GlcNAcylation, OGT also has the remarkable ability to proteolytically cleave HCF-1, a transcription factor regulating the cell cycle. HCF-1 binds to the TPRs positioning the cleavage site at the active site of OGT.""
 'Mutations in SEC cause severe growth phenotypes, but they are not lethal. Interestingly, simultaneous mutation of SEC and the paralogous SPY gene, which encodes an OGT-related fucosyltransferase, is lethal. Studies in rice, potatoes, and other plants have also indicated that O-GlcNAcylation is important for growth regulation. Mammals and insects appear to have only a single gene encoding the catalytic subunit of the OGT. Using Cre-LoxP conditional gene disruption in mice, OGT was shown to be required for the viability of embryonic stem cells. Tissue-targeted disruption in mice and disruption of OGT expression in cell culture have established that O-GlcNAcylation is essential for viability at the single-cell level in many mammalian cell types. Disruption of OGT in the worm C. elegans causes defective carbohydrate metabolism, abnormalities in dauer formation, and reduced life span. In Drosophila, homozygous mutants in the OGT ortholog super sex combs survive for >5 days until the late larval stage, but subsequently die in the pupal cases. Targeted, inducible deletion of OGT in αCAMKII-positive (excitatory) neurons in brains of adult mice results in morbidly obese mice because of defects in satiety, further supporting the roles of O-GlcNAcylation as a nutrient sensor. The highly homologous and conserved nature of OGT among metazoans allows a transgene encoding the human sequence of OGT to be used to rescue OGT null Drosophila melanogaster. Recently, OGA has been disrupted in both C. elegans and mammalian models. Like the OGT null, the C. elegans OGA null has defective carbohydrate metabolism and abnormalities in dauer formation. In contrast to the OGT null, in C. elegans in which OGA has been disrupted, the worms have an extended life span. In murine models, deletion of OGA leads to perinatal lethality, genomic instability and severe epigenetic and metabolic phenotypes. The OGA heterozygous mouse shows widespread changes in transcription and metabolism, and an enhanced dependence on glucose metabolism. Studies from numerous laboratories have described O-GlcNAcylated proteins from virtually all cellular compartments, representing nearly all functional classes of protein (Figure 19.2; Table 19.1). Indeed, recent databases contain more than 6,000 O-GlcNAcylated proteins with more than 7,000 sites mapped (O-GlcNAcAtlas; The O-GlcNAc Database). O-GlcNAc is particularly abundant within the nucleus, in which it occurs on the transcriptional regulatory machinery, including the carboxy-terminal domain (CTD) of the RNA polymerase II catalytic subunit and basal, as well as other, transcription factors, histones, chromatin-modifying proteins, mRNA biogenesis proteins, and DNA methyltransferases. O-GlcNAcylation also appears to be particularly abundant on proteins involved in signaling, stress responses, and energy metabolism. Nearly 90 proteins within the mitochondria are dynamically O-GlcNAcylated, with the highest concentration found within the electron transport chain. O-GlcNAc also occurs on many cytoskeletal regulatory proteins, such as those regulating actin assembly (e.g., vinculin, talin, vimentin, and ankyrin) and tubulin assembly (e.g., MAPs, dynein, and tau). Even α-tubulin itself is dynamically modified by O-GlcNAc, but the stoichiometry appears to be low. Intermediate filaments, such as cytokeratins and neurofilaments in brain, are also heavily modified by O-GlcNAc. Site-mapping studies have shown that protein kinases and OGT can often modify the same serine and threonine residues, suggesting that a complex interplay exists between these two posttranslational modifications that fine-tunes signal transduction networks. In fact, major enzymes that remove O-phosphate, protein phosphatase 1 β and γ, are in a dynamic complex with OGT, suggesting that in many cases the same enzyme complex both removes O-phosphate and concomitantly attaches O-GlcNAc (Figure 19.1).'
 'Notably, the HAT domain lacks the motif required for binding acetyl-CoA, indicating it lacks HAT enzymatic activity. Like OGT, OGA is thought to be regulated by its protein interactors, posttranslational modifications, and localization. OGA can be efficiently inhibited in vitro and in vivo by a panel of highly effective inhibitors. Although many inhibitors display some cross-reactivity toward the lysosomal hexosaminidases, GlcNAcstatin B and Thiamet-G are selective for OGA. Unlike the relatively static nature of mature N- and O-glycans on glycoproteins, O-GlcNAc cycles rapidly on and off most substrates. Early studies showed that mitogen or antigen activation of lymphocytes rapidly decreased O-GlcNAcylation of many cytoplasmic proteins, but concomitantly increased O-GlcNAcylation of many nuclear proteins. Likewise, neutrophils were shown to rapidly modulate O-GlcNAcylation of several proteins in response to chemotactic agents. Recently, changes in O-GlcNAc cycling have been shown in response to cellular stress, the cell cycle, developmental stages, neuron depolarization, nutrient sensing, and insulin signaling. Pulse-chase analyses have revealed that O-GlcNAc residues on small heat-shock protein in the lens (α-crystallin) and on intermediate filament proteins (cytokeratins) turn over more rapidly than the polypeptide chains to which they are attached. These observations suggest that O-GlcNAc is a regulatory posttranslational modification analogous to phosphorylation. To date, nucleocytoplasmic O-β-GlcNAc has been found in all multicellular organisms investigated, ranging from filamentous fungi, worms, insects, and plants to humans. However, to date no OGA ortholog has been identified in plants or protozoans. Plants encode two OGT paralogs: SECRET AGENT (SEC) and SPY. Curiously, whereas SEC encodes an O-GlcNAc transferase, SPY encodes a fucosyltransferase. Notably, the SPY paralog in Dictyostelium discoideum, Giardia lamblia, Cryptosporidium parvum, and Toxoplasma gondii also fucosylates proteins. To date, O-GlcNAc and the enzymes that control its cycling do not appear to exist in yeast, such as Saccharomyces cerevisiae or Schizosaccharomyces pombe. However, recently, it was discovered that S. cerevisiae have O-mannose moieties on the same proteins and at the same sites on which O-GlcNAc is found in multicellular organisms. Recent data suggest that the O-GlcNAc modification is also found in a subset of prokaryotes, such as Listeria monocytogenes. It is currently unclear if the enzymes responsible for this modification are related to OGT or EOGT. O-GlcNAc-modified proteins have also been found on many viruses that infect metazoans (e.g., adenovirus, SV40, cytomegalovirus, rotavirus, baculovirus, plum pox, HIV, and others). In viruses, instead of being localized on the outside capsid of the virus in which “classical” N- or O-glycans are found (Chapter 42), O-GlcNAc is found deep within the viruses, on tegument and other regulatory proteins, close to the nucleic acid components. Genetic and subsequent biochemical studies in Arabidopsis thaliana showed that the gene SEC regulates growth hormone (gibberellic acid) signaling, and later studies established that SEC encodes an O-β-GlcNAc transferase. Mutations in SEC cause severe growth phenotypes, but they are not lethal. Interestingly, simultaneous mutation of SEC and the paralogous SPY gene, which encodes an OGT-related fucosyltransferase, is lethal. Studies in rice, potatoes, and other plants have also indicated that O-GlcNAcylation is important for growth regulation. Mammals and insects appear to have only a single gene encoding the catalytic subunit of the OGT.']","Highly conserved homologs of OGT and OFT are found in numerous bacterial genomes, although studies of their functional roles are essentially nonexistent.","An example of bacterial monoglycosylation that leads to a known function comes from the EF-P protein, the bacterial homolog of eukaryotic elongation initiation factor 5a. In some bacteria, EF-P suppresses translational stalling by a mechanism that involves oxidation of a critical lysyl residue, and its eukaryotic ortholog is regulated by hypusylation. A recent phylogenetic analysis of EF-P sequences revealed a subset of enzymes with an Arg in place of Lys, and a coevolving gene that was subsequently identified by biochemistry and mass spectrometry as an argininyl rhamnosyltransferase. Assembly of the Rha-Arg linkage activates EF-P and is required for pathogenicity of Pseudomonas, a Gram-negative, opportunistic human pathogen, and a number of other bacteria. The discovery of this linkage by a phylogenetic approach suggests that more noncanonical examples of glycosylation are yet to be discovered.",0.25,0.0,0.45470496302014984,0.013333333333333334,0.9999999999666667,0.4
"Complete the following paragraph: OGA was purified from rat kidney and bovine brain, and the human gene was cloned using peptide sequence information. The OGA gene was found to be identical to MGEA5, a putative hyaluronidase genetically identified because of its association with meningiomas. There are two well-characterized isoforms of OGA (short and full-length), which appear to arise from alternative splicing.","['In addition to catalyzing O-GlcNAcylation, OGT also has the remarkable ability to proteolytically cleave HCF-1, a transcription factor regulating the cell cycle. HCF-1 binds to the TPRs positioning the cleavage site at the active site of OGT. Cleavage occurs between cysteine and glutamate residues, yielding a pyroglutamate. The cleavage site glutamate is converted to serine, which is then O-GlcNAcylated. The cleavage reaction requires UDP-GlcNAc at the active site, which participates in the mechanism. The regulation of OGT is quite complex and still not well-understood. OGT is itself O-GlcNAcylated and also tyrosine-phosphorylated (Figure 19.3). Tyrosine phosphorylation appears to activate the enzyme, but the role of O-GlcNAc on OGT is not yet clear. Recent studies suggest that OGT is also targeted and regulated by Ser/Thr phosphorylation; AMPK, CAMKIV, CAMKII, and GSK3β have been reported to modify OGT, altering either the localization or activity of the enzyme. Purified or recombinant OGT modifies small synthetic peptides based on known sites from O-GlcNAcylated proteins, but OGT appears to require accessory proteins to modify many full-length protein substrates efficiently. The high-energy nucleotide sugar used by OGT is UDP-GlcNAc, which is synthesized by the hexosamine biosynthetic pathway (HBP). Increased flux through the HBP, a result of increased glucose levels or certain upstream stimuli, such as the unfolded protein response, has been shown to modulate O-GlcNAc levels (Figure 19.4). On transfer of GlcNAc to proteins, UDP is released, which is a potent feedback inhibitor of OGT. Under conditions in which UDP is rapidly removed (as occurs within the cell), OGT activity is dependent on the UDP-GlcNAc level over a remarkable range of concentrations (from the low nm range to >50 mm). Of note, the substrate specificity of OGT appears to change at different UDP-GlcNAc concentrations, suggesting that OGT regulates cellular processes in a manner dependent on nutritional status. Elevating O-GlcNAc blocks insulin signaling at many points. Glucose flux via glucose transporters (e.g., GLUT4 in insulin-sensitive cells) through the hexosamine biosynthetic pathway (HBP; which accounts for 2%–5% of total glucose usage) leads (more...) Nucleocytoplasmic OGA (EC 3.2.1.169) was first identified as a neutral cytosolic hexosaminidase (referred to as “hexosaminidase C”). OGA was purified from rat kidney and bovine brain, and the human gene was cloned using peptide sequence information. The OGA gene was found to be identical to MGEA5, a putative hyaluronidase genetically identified because of its association with meningiomas. There are two well-characterized isoforms of OGA (short and full-length), which appear to arise from alternative splicing. Short OGA is identical to full-length OGA (916 amino acids) for the first 662 amino acids but possesses an alternative carboxy-terminal sequence 15 amino acids in length. Sequence and structural analyses reveal that OGA contains an amino-terminal hexosaminidase domain and a carboxy-terminal domain, with homology to GCN5 histone acetyltransferases (HAT), separated by an intervening sequence. OGA forms an unusual arm-in-arm homodimer that is mediated by a helix within the intervening sequence. Dimerization is critical for activity and the formation of a substrate binding cleft. Notably, the HAT domain lacks the motif required for binding acetyl-CoA, indicating it lacks HAT enzymatic activity. Like OGT, OGA is thought to be regulated by its protein interactors, posttranslational modifications, and localization. OGA can be efficiently inhibited in vitro and in vivo by a panel of highly effective inhibitors. Although many inhibitors display some cross-reactivity toward the lysosomal hexosaminidases, GlcNAcstatin B and Thiamet-G are selective for OGA.'
 ""In addition, both OGT and OGA are modified by both tyrosine and serine/threonine phosphorylation, nitrosylation, ubiquitination, and O-GlcNAcylation. Functions for some of these posttranslational modifications have been identified, including substrate targeting, altering protein localization, and altering specific activity. Notably, cellular O-GlcNAc levels control the maturation of OGT and OGA mRNA and, in turn, the abundance of each enzyme. Thus, when O-GlcNAc levels are elevated, OGT abundance is depressed and OGA abundance augmented. In contrast, in response to low levels of O-GlcNAc, OGA abundance is depressed, and OGT levels are augmented. O-GlcNAc transferase (OGT) is regulated by multiple complex mechanisms, including transcriptional regulation of its expression, differential mRNA splicing, proteolytic processing, posttranslational modification, and multimerization with itself and other (more...) OGT (uridine diphospho-N-acetylglucosamine: polypeptide β-N-acetylglucosaminyltransferase; EC 2.4.1.255) catalyzes the addition of N-acetylglucosamine from UDP-GlcNAc to specific serine or threonine residues to form a β-O-glycosidic linkage. The enzyme was first identified and purified from rat liver and subsequently cloned from rat, human, Caenorhabditis elegans, and other organisms. OGT resides on the X chromosome (Xq13 in humans) near the centromere and is among the most highly conserved proteins from worms to man. Mutations in OGT, both in its tetratricopeptide repeats (TPRs) and in its catalytic domain, cause X-linked intellectual disability in humans. To date, three isoforms of OGT have been well characterized: (1) the nucleocytoplasmic or full-length variant (ncOGT), which is 110 kDa; (2) a short isoform of OGT (sOGT), which is 78 kDa; and (3) a variant of OGT that is targeted to the mitochondria (mOGT; ∼90 kDa). In the nucleus and cytoplasm, OGT appears to form multimers, consisting of one or more 110-kDa subunits and 78-kDa subunits. Several useful small molecule inhibitors of OGT have been developed, including OSMI-4b, Ac45SGlcNAc, and 5SGlcNHex, with the latter effective in animal models. However, some off-target effects have been reported for these inhibitors, likely because they impact other enzymes that use UDP-GlcNAc. ncOGT has two distinct domains separated by a putative nuclear localization sequence. The amino terminus of each OGT subunit contains TPRs, which can number up to 13 (species-dependent). The major variation between the three (above) variants is in the number of the TPRs. The crystal structure of the human TPR domain of ncOGT shows that the repeats occur as stacked α-helical domains, forming a “tube-like” structure with a remarkable structural similarity to the armadillo repeat domain of the nuclear transport protein importin-α. The TPR domain mediates multimerization of OGT subunits and acts as a scaffold for protein–protein interactions, including protein substrates (Figure 19.3). OGT's glycosyltransfer reaction occurs by an ordered bi–bi mechanism with UDP-GlcNAc binding first. The TPR domains are required for substrate binding, enzymatic activity, and stability. Recent studies have demonstrated that residues in the TPR domain are critical for interactions with substrates. Such findings likely underpin the observation that there is no strict consensus motif that dictates glycosylation by OGT, although valine and alanine are preferred at the –3 and +2 positions, respectively, and there is a preference for aromatic residues at –4 position. In addition to catalyzing O-GlcNAcylation, OGT also has the remarkable ability to proteolytically cleave HCF-1, a transcription factor regulating the cell cycle. HCF-1 binds to the TPRs positioning the cleavage site at the active site of OGT.""
 'Notably, the HAT domain lacks the motif required for binding acetyl-CoA, indicating it lacks HAT enzymatic activity. Like OGT, OGA is thought to be regulated by its protein interactors, posttranslational modifications, and localization. OGA can be efficiently inhibited in vitro and in vivo by a panel of highly effective inhibitors. Although many inhibitors display some cross-reactivity toward the lysosomal hexosaminidases, GlcNAcstatin B and Thiamet-G are selective for OGA. Unlike the relatively static nature of mature N- and O-glycans on glycoproteins, O-GlcNAc cycles rapidly on and off most substrates. Early studies showed that mitogen or antigen activation of lymphocytes rapidly decreased O-GlcNAcylation of many cytoplasmic proteins, but concomitantly increased O-GlcNAcylation of many nuclear proteins. Likewise, neutrophils were shown to rapidly modulate O-GlcNAcylation of several proteins in response to chemotactic agents. Recently, changes in O-GlcNAc cycling have been shown in response to cellular stress, the cell cycle, developmental stages, neuron depolarization, nutrient sensing, and insulin signaling. Pulse-chase analyses have revealed that O-GlcNAc residues on small heat-shock protein in the lens (α-crystallin) and on intermediate filament proteins (cytokeratins) turn over more rapidly than the polypeptide chains to which they are attached. These observations suggest that O-GlcNAc is a regulatory posttranslational modification analogous to phosphorylation. To date, nucleocytoplasmic O-β-GlcNAc has been found in all multicellular organisms investigated, ranging from filamentous fungi, worms, insects, and plants to humans. However, to date no OGA ortholog has been identified in plants or protozoans. Plants encode two OGT paralogs: SECRET AGENT (SEC) and SPY. Curiously, whereas SEC encodes an O-GlcNAc transferase, SPY encodes a fucosyltransferase. Notably, the SPY paralog in Dictyostelium discoideum, Giardia lamblia, Cryptosporidium parvum, and Toxoplasma gondii also fucosylates proteins. To date, O-GlcNAc and the enzymes that control its cycling do not appear to exist in yeast, such as Saccharomyces cerevisiae or Schizosaccharomyces pombe. However, recently, it was discovered that S. cerevisiae have O-mannose moieties on the same proteins and at the same sites on which O-GlcNAc is found in multicellular organisms. Recent data suggest that the O-GlcNAc modification is also found in a subset of prokaryotes, such as Listeria monocytogenes. It is currently unclear if the enzymes responsible for this modification are related to OGT or EOGT. O-GlcNAc-modified proteins have also been found on many viruses that infect metazoans (e.g., adenovirus, SV40, cytomegalovirus, rotavirus, baculovirus, plum pox, HIV, and others). In viruses, instead of being localized on the outside capsid of the virus in which “classical” N- or O-glycans are found (Chapter 42), O-GlcNAc is found deep within the viruses, on tegument and other regulatory proteins, close to the nucleic acid components. Genetic and subsequent biochemical studies in Arabidopsis thaliana showed that the gene SEC regulates growth hormone (gibberellic acid) signaling, and later studies established that SEC encodes an O-β-GlcNAc transferase. Mutations in SEC cause severe growth phenotypes, but they are not lethal. Interestingly, simultaneous mutation of SEC and the paralogous SPY gene, which encodes an OGT-related fucosyltransferase, is lethal. Studies in rice, potatoes, and other plants have also indicated that O-GlcNAcylation is important for growth regulation. Mammals and insects appear to have only a single gene encoding the catalytic subunit of the OGT.']","OGA was purified from rat kidney and bovine brain, and the human gene was cloned using peptide sequence information. The OGA gene was found to be identical to MGEA5, a putative hyaluronidase genetically identified because of its association with meningiomas. There are two well-characterized isoforms of OGA (short and full-length), which appear to arise from alternative splicing. Short OGA is identical to full-length OGA for the first 662 amino acids but possesses an alternative carboxy-terminal sequence 15 amino acids in length. Sequence and structural analyses reveal that OGA contains an amino-terminal hexosaminidase domain and a carboxy-terminal domain, with homology to GCN5 histone acetyltransferases (HAT), separated by an intervening sequence. OGA forms an unusual arm-in-arm homodimer that is mediated by a helix within the intervening sequence. Dimerization is critical for activity and the formation of a substrate binding cleft.","Short OGA is identical to full-length OGA (916 amino acids) for the first 662 amino acids but possesses an alternative carboxy-terminal sequence 15 amino acids in length. Sequence and structural analyses reveal that OGA contains an amino-terminal hexosaminidase domain and a carboxy-terminal domain, with homology to GCN5 histone acetyltransferases (HAT), separated by an intervening sequence. OGA forms an unusual arm-in-arm homodimer that is mediated by a helix within the intervening sequence. Dimerization is critical for activity and the formation of a substrate binding cleft. Notably, the HAT domain lacks the motif required for binding acetyl-CoA, indicating it lacks HAT enzymatic activity. Like OGT, OGA is thought to be regulated by its protein interactors, posttranslational modifications, and localization.",0.7142857142857143,0.7711862543940422,0.8593201716582597,0.01282051282051282,0.9999999999666667,1.0
"Complete the following paragraph: Giant viruses such as the algae-targeting chlorella virus and members of the amoeba-targeting Mimiviridae family have genomes large enough that they can express their own glycosylation machineries. On a smaller scale, specific viruses express glycosyltransferases as virulence factors.","['To protect its own genome, the phage modifies its DNA by replacing cytosine with 5-hydroxymethylcytosine and subsequently transferring glucose (Glc) to the 5-hydroxymethylcytosine using a specific UDP-Glc:DNA Glc-transferase. The baculovirus enzyme ecdysteroid glucosyltransferase (EGT) disrupts the hormonal balance of the insect host by catalyzing the conjugation of ecdysteroid hormones with Glc or galactose (Gal). Expression of the EGT gene allows the virus to block molting and pupation of infected insect larvae. Similarly, Chloroviruses have enzymes in CAZy family GT4 for the glycosylation of their structural proteins. Serotype conversion in Shigella flexneri is mediated by temperate bacteriophages, which encode GTs that mediate O-antigen conversion by the addition of Glc to O-antigen units. Finally, giant viruses such as Acanthamoeba polyphaga mimivirus encode 12 putative GTs for the synthesis of complex O-glycans. Bacterial GTs play a major role in their symbiosis and virulence. Some bacteria such as Campylobacter are able to N-glycosylate their proteins, but the most universal role for bacterial glycosylation is in the synthesis of cell-wall peptidoglycan, simple glycolipids, lipopolysaccharides, and complex exopolysaccharides (Chapter 21). The GTs involved in peptidoglycan biosynthesis are GT28 MurG, which adds N-acetylglucosamine (GlcNAc) to undecaprenyl diphospho-N-MurNAc, and GT51 MtgA, which polymerizes undecaprenyl diphospho-MurNAc-GlcNAc. Mycobacterium tuberculosis produces an extremely complex envelope that includes all of the above. In bacteria, the role of these glycans is to provide a barrier that affords mechanical, chemical, and biological protection to the cell. Some pathogenic or commensal bacteria produce an outer glycan layer that mimics that of their hosts, in order to evade host immune surveillance (Chapters 15 and 42). Pasteurella multocida produces a thick hyaluronan capsule. Oral streptococci produce two GTs for adhesion and virulence, and the EPax GT enables colonization of the gut by Enterococcus faecalis. Other pathogens such as Escherichia coli K1 and Neisseria meningitidis produce a poly α2–8 sialic acid capsule. Mammalian gut bacteria produce capsular polysaccharides thought to help the maturation of the host immune system. Archaea devote ∼1% of their genes to GTs but, on average, devote only 0.25% to GHs, and there is almost no correlation with the number of GH genes and the overall number of genes. Surprisingly, ∼20% of sequenced archaeal genomes appear to be completely devoid of GHs. The most striking example is Methanosphaera stadtmanae, whose genome encodes at least 43 GTs but apparently no GHs. This is not due to sequence divergence, because GHs are readily detected in some Archaea. These observations suggest that (1) horizontal transfer is likely the determining factor behind archaeal GH repertoires, and (2) the Archaea in question do not recycle glycosidic bonds elaborated by their own GTs. Although they do not make peptidoglycans like bacteria, Archaea use nucleotide-activated oligosaccharides to produce a variety of extracellular polysaccharides such as the heteropolysaccharide “methanochondroitin” made by Methanosarcina barkeri, which resembles eukaryotic chondroitin sulfate (Chapter 17). Archaea also make glycophospholipids and one relevant GT is GDP-Glc:glucosyl-3-phosphoglycerate synthase from family GT81 in Methanococcoides burtonii. In CAZy family GT55, there are several archaeal GDP-Man:mannosyl-3-phosphoglycerate synthases.'
 'Compared to other types of glycans, structural polysaccharides show relatively little variation in evolution, which may indicate a more stringent selection for chemical and mechanical properties required for their functions. Interestingly, some of these structures, such as glycosaminoglycans, can also play nonstructural roles in other biological contexts, including cell signaling, which adds additional selection forces driving their evolution. Viruses typically have minimalist genomes and use host-cell machinery for replication. Thus, glycosylation of enveloped viruses reflects that of the host. However, there are exceptions. Giant viruses such as the algae-targeting chlorella virus and members of the amoeba-targeting Mimiviridae family have genomes large enough that they can express their own glycosylation machineries. On a smaller scale, specific viruses express glycosyltransferases as virulence factors. For instance, a baculovirus-encoded glucosyltransferase glycosylates insect host ecdysteroid hormones to block molting, and bacteriophage-derived glucosyltransferases modify 5-hydroxymethyl cytosine bases in the phage DNA to protect it from bacterial restriction enzymes. Host-derived glycosylation in enveloped viruses is typically extensive and the resulting “glycan shield” protects the virus from immune reactions against the underlying polypeptide. In this regard, it has been suggested that the high frequency of heterozygous states for human congenital disorders of glycosylation (Chapter 44) may reflect selection for genomes that limit glycosylation of invading viruses. Host lectins may also be “hijacked” by glycans on viral surface glycoproteins. For example, Sialoadhesin (Siglec-1; Chapter 15) is used by the heavily sialylated porcine reproductive and respiratory syndrome virus (PRRSV) to gain entry into macrophages. Viral protein sequence can also influence host glycosylation (e.g., by structural constraints on access for glycosyltransferases or hydrolases), in a manner that favors viral antigenicity, such as the high-mannose N-glycans on HIV-1 envelope gp120 trimers. Despite the enormous potential for structural diversity, a rather limited subset of all possible monosaccharides and their possible linkages and modifications are found in eukaryotic cells. Why one encounters only such a limited subset of the possible glycan structures is a puzzling question. Could there be trade-offs between the variety of glycan structures and the additional resources, such as energy and biosynthetic pathways, that cells/organisms need in order to maintain that variety? Or maybe the variety of structures is limited by a combination of positive and negative selection due to both, its intrinsic functions and interactions with symbionts and pathogens? Regardless, this limited subset has allowed better elucidation of structures of eukaryotic glycans. In contrast, Bacteria and Archaea have had several billion additional years to respond to selective pressure from pathogens; in particular, phages. These organisms also have short generation times and can exchange genetic material across vast phylogenetic distances via plasmid-mediated horizontal gene flow. Glycosylation in Bacteria and Archaea is far more diverse, both in terms of the range of monosaccharides used or synthesized, and in the types of linkages and modifications (Chapters 21 and 22). In addition, prokaryotic cell–cell interactions both within and between species are often mediated by glycans. However, most work to date has focused on the glycans of pathogens, and we may have barely scratched the surface of prokaryotic glycan diversity. Despite great differences between pathways generating glycan structures of bacteria and those of vertebrates, occasional microbial surface structures are strikingly similar to those of mammalian cells. Interestingly, most such examples of “molecular mimicry” occur in pathogenic/symbiotic microorganisms, apparently adapting them for better survival in the host by avoiding, reducing, or manipulating host immunity.'
 'Knowledge of the ligand specificity of a GBP is required to assign in vivo functions. In cases in which there is a dearth of information, rational predictions based on the framework and sequence of existing carbohydrate-recognition domains (CRDs) have been found useful. Legume lectins represent a class of GBPs identified decades ago that continues to provide perhaps the best model for protein–glycan recognition. Moreover, discovery of the legume lectin fold (jelly-roll motif) in mammalian lectins, such as galectins (Chapter 36), calnexin, and calreticulin (Chapter 34), highlights the preeminence of this fold in carbohydrate recognition across phylogeny. Earlier work in the identification of monosaccharide-binding specificities of legume lectins provided the framework for finding their relatives in all forms of life (Chapter 32). This approach led to the assignment of glycan specificities for proteins involved in the sorting of vesicular compartments and in glycoprotein folding in the endoplasmic reticulum (ER) and Golgi compartments of mammalian cells (Chapter 39). Of similar importance is the discovery of new galectins in the galectin-10 family and galectin-like proteins in genome databases using similarity searches (Chapter 36). Likewise, Siglecs, a family of sialic acid–binding I-type lectins involved in regulating multiple biological responses (Chapter 35), show signature sequence motifs, and 17 members have been identified in primates to date. It is important to note that the mere presence of a CRD does not necessarily translate into functional glycan-recognizing activity. This is because sequence motifs used to identify CRDs are often found in a functionally inactive, lectin-like, CRD fold (Chapter 34). Glycan microarrays provide a high-throughput means of detecting the interactions of GBPs with the diverse oligosaccharide sequences of glycoproteins, glycolipids, and polysaccharides (Chapter 30). The use of glass slides, microarray printing technology, and surface patterning of engineered glycophages displaying unique carbohydrate epitopes allows the production of glycan microarrays with the potential to examine binding of all types of GBPs (lectins, antiglycan monoclonal or serum antibodies, and glycan-binding cytokines or chemokines) to several thousand unique glycans, simultaneously. Binding is assessed by fluorescent or spectrometric techniques. Glycan microarray data are provided by resources such as the Consortium for Functional Glycomics (http://www.functionalglycomics.org/glycomics/publicdata/primaryscreen.jsp) and the Imperial College Microarray Data Online Portal (https://glycosciences.med.ic.ac.uk/data.html), and several analysis software packages, including GLAD (https://glycotoolkit.com/GLAD/), MotifFinder (https://haablab.vai.org/tools/), MCAW (https://mcawdb.glycoinfo.org/) and CCARL (https://github.com/andrewguy/CCARL). Note that arrays that use different linkers and/or different attachment chemistries can give quite variable results, and the results need to be evaluated in the context of natural binding phenomena. It has long been known that many viruses use host glycans as specific binding receptors for entering the cell (Chapter 37). Similarly, several viruses encode lytic enzymes that break down host cell surface glycans to release viral particles after viral replication. Genome sequencing reveals that many double-stranded DNA viruses also take advantage by adding sugars to host glycoproteins through the use of viral GTs (Chapter 42). Although biological roles of viral GTs are poorly understood, some functions have been identified. For example, the T4 bacteriophage encodes nucleases that degrade host cell DNA. To protect its own genome, the phage modifies its DNA by replacing cytosine with 5-hydroxymethylcytosine and subsequently transferring glucose (Glc) to the 5-hydroxymethylcytosine using a specific UDP-Glc:DNA Glc-transferase. The baculovirus enzyme ecdysteroid glucosyltransferase (EGT) disrupts the hormonal balance of the insect host by catalyzing the conjugation of ecdysteroid hormones with Glc or galactose (Gal).']","These specific viruses utilize glycosyltransferases as virulence factors to modify host cell components, such as insect host ecdysteroid hormones or phage DNA, in order to disrupt normal cellular functions and promote viral replication and survival within the host organism.","For instance, a baculovirus-encoded glucosyltransferase glycosylates insect host ecdysteroid hormones to block molting, and bacteriophage-derived glucosyltransferases modify 5-hydroxymethyl cytosine bases in the phage DNA to protect it from bacterial restriction enzymes. Host-derived glycosylation in enveloped viruses is typically extensive and the resulting “glycan shield” protects the virus from immune reactions against the underlying polypeptide. In this regard, it has been suggested that the high frequency of heterozygous states for human congenital disorders of glycosylation (Chapter 44) may reflect selection for genomes that limit glycosylation of invading viruses.",1.0,0.70824621265137,0.7666317366584594,0.028169014084507043,0.9999999999666667,1.0
"Complete the following paragraph: Although the focus of this chapter is on the glycobiology of bacterial cell envelopes, there are several additional (and equally important) facets of bacterial glycobiology. Three of these are briefly mentioned here.","['NCBI Bookshelf. A service of the National Library of Medicine, National Institutes of Health. Varki A, Cummings RD, Esko JD, et al., editors. Essentials of Glycobiology [Internet]. 4th edition. Cold Spring Harbor (NY): Cold Spring Harbor Laboratory Press; 2022.  doi: 10.1101/glycobiology.4e.21 Chris Whitfield, Christine M. Szymanski, Amanda L. Lewis, and Markus Aebi. Glycoconjugates are integral components of the cell surfaces of bacteria and are often the immediate point of contact with the environment. Surface glycoconjugates contribute to the essential permeability barrier properties of the cell envelope, influence both the susceptibility and resistance of bacteria to antibiotics and other harmful compounds, participate in the formation and dispersion of biofilms, act as receptors for bacteriophages, and play pivotal roles in pathogenic and symbiotic host–microbe interactions. Reflecting these many functions, surface glycoconjugates are remarkably diverse, enabled by the propensity for bacterial genetic recombination and lateral gene transfer and shaped by environmental interactions that impart niche-specific selective pressures. Surface glycoconjugates drive a variety of important interactions with host innate and adaptive immune defenses. Some are recognized as pathogen-associated molecular patterns (PAMPs), for example, via Toll-like receptor (TLR)-mediated pathways. Others are natural targets of adaptive immunity and have been exploited in successful vaccine strategies. Because of their importance in cell viability, surface glycoconjugates are also frequent targets of antimicrobial strategies. This chapter will provide an overview of the structure and biosynthesis of glycoconjugates, together with some examples of their functions. Bacteria were historically divided into two major groups based on their response in the Gram-staining procedure (i.e., Gram-positive and Gram-negative organisms), reflecting the organization of the cell wall. The amount and location of peptidoglycan in the cell wall is an important contributor to the outcome of Gram staining. Peptidoglycan is essential for the viability of most bacteria. It consists of polysaccharide strands covalently cross-linked by short peptides, creating a three-dimensional structure that confers shape and rigidity to the cell. In Gram-negative bacteria, such as Escherichia coli, the cell wall consists of two membranes separated by a cellular compartment termed the periplasm in which thin layers of peptidoglycan reside (Figure 21.1). In Gram-positive bacteria, substantially thicker layers of peptidoglycan surround a single membrane and provide an attachment point for other glycan structures. Another class of bacteria, the Negativicutes, are related to the Gram-positive Firmicutes but nevertheless have a two-membrane architecture and stain as Gram-negative. Other bacteria produce variable responses in the Gram-staining reaction, largely because of the presence of other glycans and cell wall lipids (see below). Conceptual organization of the cell envelopes of Gram-negative bacteria, Gram-positive bacteria, and mycobacteria. The schematic comparison of the cell walls (or cell envelopes) of Gram-negative bacteria, Gram-positive bacteria, and mycobacteria illustrates (more...) The periplasm of Gram-negative bacteria contains proteins associated with cell-surface assembly and nutrient uptake but may also contain free oligosaccharides (fOS) that protect against osmotic stress. The outer membrane is an asymmetric lipid bilayer, with an outer leaflet composed mainly of a unique glycolipid called lipopolysaccharide (LPS) that is essential for the integrity of the permeability barrier imposed by the outer membrane. Many Gram-negative bacteria are covered in a surface-bound polysaccharide layer known as a capsule, and, in some cases, this capsular polysaccharide (CPS) is released from the cell in large amounts as free exopolysaccharide (EPS). Bacteria producing these products are often readily identified by their highly mucoid colonies. Structural variations in the LPS and capsules of different bacterial species are diverse and influence many types of interactions between bacteria and their environmental and host niches. Gram-positive bacteria lack the outer membrane (Figure 21.1) and depend on a much thicker multilayered peptidoglycan layer for viability.'
 'Within the biofilm, a combination of the protected environment and altered cell physiology can help protect bacteria from some antimicrobial compounds. Some bacteria may produce multiple EPSs that contribute to biofilms, and their precise structures may be critical for creation of a proper biofilm architecture, as in Pseudomonas. Certain glycan structures appear well adapted to roles in biofilm communities and are, therefore, more widely distributed. Many biofilm-forming bacteria produce PNAG, also known as polysaccharide intercellular adhesin, with this being targeted by small-molecule inhibitor and vaccine strategies to eradicate biofilm bacteria (Figure 21.6). Assembly systems for CPSs and EPSs are broadly divided into three mechanisms that are distinguished (in part) by the nature of the acceptor on which they are built (Figure 21.6). A large variety of CPSs and EPSs use undecaprenol diphosphate-linked intermediates and follow a synthetic pathway indistinguishable from that used by Wzx/Wzy-dependent O-antigens, described above. In fact, some bacteria produce O-antigens and CPSs/EPSs with the same structures. The CPS shares the same early steps in the pathway but instead of ligating the product to lipid A-core, a CPS-dedicated export machinery spanning the periplasm and outer membrane is used. The features that distinguish CPSs and EPSs in this type of assembly process are unknown. In Gram-positive bacteria with Wzx/Wzy-dependent processes, the nascent polysaccharide is then either released as an EPS or transferred from undecaprenol and attached to peptidoglycam, often via a phosphodiester linkage to MurNAc residues. In Streptococci, this may be catalyzed by an enzyme related to those that link WTAs to the same site in peptidoglycan. Several Gram-negative bacteria assemble CPSs using a conserved phosphatidylglycerol-(Kdo)n acceptor. Although prototypes are found in E. coli and N. meningitidis, the system is conserved across a range of mucosal pathogens. Here, polymerization of the lipid-linked glycan is completed in the cytoplasm, after which it is exported via an ABC transporter. The transporter is linked to additional proteins that span the periplasm and outer membrane in a configuration thought to resemble certain drug efflux pumps in bacteria. The final assembly pathway seems to operate independently of a lipid carrier and requires a processive polymerase called a synthase. Examples are found in Gram-positive and Gram-negative bacteria, but seem to be confined to EPSs. The prototypical hyaluronan and cellulose synthases from Streptococci and Gram-negative bacteria show different architectures, yet both are sufficient for both synthesis and export across the cytoplasmic membrane. The molecular details underlying these processes have been resolved by analysis of the crystal structure of the cellulose synthase. In Gram-negative bacteria, a periplasmic scaffold links the synthase to an outer membrane protein channel. Although the focus of this chapter is on the glycobiology of bacterial cell envelopes, there are several additional (and equally important) facets of bacterial glycobiology. Three of these are briefly mentioned here. First, in addition to synthesizing surface structures, bacteria also produce intracellular glycans and cytoplasmic glycosylated proteins and glycolipids. For example, glycogen and trehalose act as storage compounds within some bacteria. Mycobacteria also contain a growing list of unusual glycosylated molecules, which may be related to their ability to withstand a variety of stresses. Second, bacteria produce a wide range of glycan-binding proteins. These include adhesins that facilitate bacterial colonization, exotoxins that bind to host membrane glycans, and single-sugar-binding proteins involved in metabolism (see Chapter 42). Third, bacterial lifestyles are often defined by their capacity to digest and/or metabolize glycans. Complex nanomachines have been described for the degradation of complex carbohydrate structures. Assembling the various enzymes into a highly organized complex affords synergy and efficiency. For example, the roles of glycosyl hydrolases in biomass conversion are well documented (Chapter 59). The cellulose degradation machinery in Clostridioides sp.'
 'Third, bacterial lifestyles are often defined by their capacity to digest and/or metabolize glycans. Complex nanomachines have been described for the degradation of complex carbohydrate structures. Assembling the various enzymes into a highly organized complex affords synergy and efficiency. For example, the roles of glycosyl hydrolases in biomass conversion are well documented (Chapter 59). The cellulose degradation machinery in Clostridioides sp. and other organisms comprises a suite of glycosidases and carbohydrate-binding modules, all assembled into a single surface complex (the cellulosome) via noncatalytic cohesin and dockerin structural modules. Within the gut microbiome, Bacteroidetes encode a remarkable array of carbohydrate-active enzymes in polysaccharide utilization loci, allowing them to adapt to dietary changes by sensing, binding, and degrading different complex substrates, followed by import of the products for catabolism. Indeed, bacteria within the many biomes of the human body derive benefit from foraging, not only on plant polysaccharides, but also on host-derived mucosal glycans. We continue to learn more about the intricate pathways for the digestion, capture, and catabolism of environmental and host carbohydrates. The authors acknowledge contributions to previous versions of this chapter by Jeffrey D. Esko, Tamara L. Doering, and the late Christian Raetz and appreciate helpful comments and suggestions from Graham Heberling and Jerry Eichler.']","In addition to synthesizing surface structures, bacteria also produce intracellular glycans and cytoplasmic glycosylated proteins and glycolipids. Bacteria also produce a wide range of glycan-binding proteins, including adhesins that facilitate bacterial colonization, exotoxins that bind to host membrane glycans, and single-sugar-binding proteins involved in metabolism. Furthermore, bacterial lifestyles are often defined by their capacity to digest and/or metabolize glycans, with complex nanomachines described for the degradation of complex carbohydrate structures.","First, in addition to synthesizing surface structures, bacteria also produce intracellular glycans and cytoplasmic glycosylated proteins and glycolipids. For example, glycogen and trehalose act as storage compounds within some bacteria. Mycobacteria also contain a growing list of unusual glycosylated molecules, which may be related to their ability to withstand a variety of stresses. Second, bacteria produce a wide range of glycan-binding proteins. These include adhesins that facilitate bacterial colonization, exotoxins that bind to host membrane glycans, and single-sugar-binding proteins involved in metabolism (see Chapter 42). Third, bacterial lifestyles are often defined by their capacity to digest and/or metabolize glycans. Complex nanomachines have been described for the degradation of complex carbohydrate structures. Assembling the various enzymes into a highly organized complex affords synergy and efficiency. For example, the roles of glycosyl hydrolases in biomass conversion are well documented (Chapter 59).",1.0,0.44191019055806025,0.9447330459356968,0.0136986301369863,0.9999999999666667,1.0
"Complete the following paragraph: In comparison to N-glycan biosynthesis, relatively little is known of how archaeal O-glycans are assembled. The O-glycans of four archaeal species have been characterized to a limited extent (Figure 22.3). The only published report on archaeal O-glycan biosynthesis revealed that Haloarcula hispanica requires Dol-P-Glc as a sugar donor for the assembly of the N-linked glucose-α-(1,2)-[sulfoquinovosamine-β-(1,6)-]galactose trisaccharide and the O-linked glucose-α-(1,4)-galactose disaccharide.","['It was later reported that the major M. maripaludis pilin is modified by the same N-linked tetrasaccharide bearing an extra hexose branching from the linking GalNAc subunit. The pathway used for N-glycosylation of M. mariplaudis archaellin has been largely delineated. The process seemingly starts with the addition of UDP-GalNAc to Dol-P by an unidentified glycosyltransferase. Like Hfx. volcanii Dol-P, M. mariplaudis Dol-P includes two saturated isoprenes, likely at the α and ω positions. The AglO, AglA, and AglL glycosyltransferases add the next three nucleotide-activated sugars, respectively. AglU adds the threonine moiety to sugar three, apparently only following the addition of the fourth sugar by the glycosyltransferase AglL. AglV then methylates sugar four. The Dol-P-bound tetrasaccharide is then flipped across the membrane by an unidentified flippase, where AglB transfers the lipid-linked glycan to target Asn residues. Studies on the N-glycosylation process in Crenarchaeota have focused on the thermoacidophilic archaeon Sulfolobus acidocaldarius. In S. acidocaldarius, the S-layer glycoprotein, archaellin, and cytochrome b558/566 are modified by an N-linked hexasaccharide with the structure (Man-α1-6)(Man-α1-4)(Glc-β1-4-Qui6S-β1-3)GlcNAcβ1-4GlcNAc-β-Asn. This glycan is unusual as it contains the typical eukaryotic chitobiose core and a sulfoquinovose, a sugar generally found only in photosynthetic membranes of plants and phototrophic bacteria. Biosynthesis of the N-linked glycan begins with the transfer of GlcNAc-phosphate, derived from a nucleotide-activated precursor, onto an unusually short and highly saturated Dol-PP lipid carrier by AglH, a UDP-GlcNAc-1-P: Dol-P-GlcNAc-1-P transferase. Information concerning addition of the second and third sugars is lacking. However, Agl3 converts UDP-glucose and sodium sulphite into UDP-sulfoquinovose, which is subsequently added to Dol-PP-bound trisaccharide by an unknown glycosyltransferase. In the final steps of N-linked glycan assembly, the terminal mannose and glucose moieties are added, with Agl16, a soluble glycosyltransferase, adding the final glucose. A so-far unidentified flippase translocates the Dol-PP-bound hexasaccharide across the membrane, where AglB transfers the glycan to target protein Asn residues. In contrast to Hfx. volcanii, M. voltae, and M. maripaludis, aglB is essential in S. acidocaldarius. In comparison to N-glycan biosynthesis, relatively little is known of how archaeal O-glycans are assembled. The O-glycans of four archaeal species have been characterized to a limited extent (Figure 22.3). The only published report on archaeal O-glycan biosynthesis revealed that Haloarcula hispanica requires Dol-P-Glc as a sugar donor for the assembly of the N-linked glucose-α-(1,2)-[sulfoquinovosamine-β-(1,6)-]galactose trisaccharide and the O-linked glucose-α-(1,4)-galactose disaccharide. N-glycosylation has been considered as assisting Archaea to cope with the challenges of the extreme environments they often occupy. For instance, enhanced surface charge in the face of hypersaline conditions and hence increased solubility was offered as an explanation for the high sulfated sugar content of N-linked glycans decorating the Hbt. salinarum S-layer glycoprotein relative to its Hfx. volcanii counterpart, given the higher salinity of the locale in which the former lives.'
 'Currently defined archaeal N-linked glycans are depicted in Figure 22.3. The structural diversity of N- and O-linked glycans in Archaea. The structures of N-linked glycans found in the Euryarchaeota and Crenarchaeota are shown. The OTase (STT3 or AglB) within the endoplasmic reticulum (ER) or cytoplasmic membrane (right), (more...) The first reported archaeal N-glycosylated protein, the Halobacterium salinarum S-layer glycoprotein, was shown to be modified by two different N-linked oligosaccharides, a repeating sulfated pentasaccharide linked via N-glycosylamine to Asn-2 and a sulfated glycan linked by a glucose residue to 10 other Asn residues. The latter glycan is also N-linked to archaellins in this haloarchaeon. Efforts undertaken at the time aimed at deciphering the pathways responsible for the synthesis of these glycans relied solely on biochemical approaches because neither suitable genetic tools nor a genome sequence were available. Despite these biochemical advances, delineation of archaeal N-glycosylation pathways had to wait until the genome age and the development of tools for the genetic manipulation of various species. Through the subsequent identification of homologs of eukaryotic and/or bacterial N-glycosylation pathway components, genome scanning for additional components, the generation of deletion strains, and characterization of reporter glycoproteins, agl (archaeal glycosylation) genes comprising archaeal N-glycosylation pathways have been identified in several Archaea, including halophilic, methanogenic, and thermophilic species. In the last decade, progress in defining pathways of N-glycosylation has relied on Haloferax volcanii as a model organism. In Hfx. volcanii, a series of Agl proteins mediate the assembly and attachment of a pentasaccharide with the structure mannose-1,2-[methyl-O-4-]glucuronic acid-β1-4-galacturonic acid-α1-4-glucuronic acid-β1-4-glucose-β-Asn to the S-layer glycoprotein and archaellins (Figure 22.4). Acting at the cytoplasmic face of the plasma membrane, the glycosyltransferases AglJ, AglG, AglI, and AglE sequentially add the first four pentasaccharide residues onto a common Dol-P carrier, whereas AglD adds the final pentasaccharide residue, mannose, to a distinct Dol-P (Figure 22.3). Assembly of the Dol-P-linked tetrasaccharide also involves AglF, a glucose-1-phosphate uridyltransferase, AglM, a UDP-glucose dehydrogenase, AglP, a methyltransferase, and AglQ, a predicted isomerase. AglF and AglM have been shown to act in a sequential and coordinated manner in vitro, transforming glucose-1-phosphate into UDP-glucuronic acid. AglB, the archaeal oligosaccharyltransferase, transfers the lipid-linked tetrasaccharide to select Asn residues of target proteins. The final mannose residue is subsequently transferred from its Dol-P carrier to the protein-bound tetrasaccharide in a reaction requiring AglR, a protein that either serves as the Dol-P-mannose flippase or contributes to such activity, and AglS, a Dol-P-mannose mannosyltransferase. Interestingly, N-glycosylation of the S-layer protein is altered in response to a change in environmental conditions. When grown in low-salt medium, Hfx. volcanii alters the N-glycan structure in a site-specific manner. The pathway of N-glycosylation in Haloferax volcanii. The oligosaccharide is assembled on a dolichol phosphate lipid carrier, translocated across the plasma membrane, and transferred to a target protein by the AglB oligosaccharyltransferase. The N-linked (more...) Mass spectrometry studies elucidated the glycan N-linked to archaellins of Methanococcus voltae strain PS.'
 'N-glycosylation has been considered as assisting Archaea to cope with the challenges of the extreme environments they often occupy. For instance, enhanced surface charge in the face of hypersaline conditions and hence increased solubility was offered as an explanation for the high sulfated sugar content of N-linked glycans decorating the Hbt. salinarum S-layer glycoprotein relative to its Hfx. volcanii counterpart, given the higher salinity of the locale in which the former lives. In other instances, it is not clear how a given N-glycosylation profile contributes to life in harsh surroundings. In Hfx. volcanii, however, N-glycosylation may provide cells with the ability to respond to changes in the surrounding salinity. As noted above, the N-glycosylation profile of the S-layer glycoprotein differs in cells grown in 3.4 or 1.75 m NaCl-containing medium (Figure 22.3). Modified glycosylation in response to environmental conditions has also been reported in the case of M. hungatei, in which archaellins are only modified in a low phosphate-containing medium. Furthermore, a fully assembled N-glycan has been shown to be required for a broad range of biological functions, including motility and species-specific cell-cell recognition. Archaeal biofilms have been identified in a large variety of habitats (e.g., at low and high temperatures), as well as under acidic, alkaline, and high-salt conditions. It is proposed that Archaea, especially those that require interaction with other species, synthesize biofilms to support these cell–cell interactions. Detailed analyses of the structure and composition of extracellular polymeric substances (EPSs) of archaeal biofilms are limited. The sugar composition of a few EPSs has been analyzed by lectin binding assays. Such studies revealed that in Sulfolobales species, for instance, the EPS mainly consists of glucose, galactose, mannose, and N-acetyl-D-glucosamine. The authors acknowledge contributions to previous versions of this chapter by Jeffrey D. Esko, Tamara L. Doering, and the late Christian R.H. Raetz and appreciate helpful comments and suggestions from Ramya Chakravarthy and Debra Mohnen.']","The O-glycans of four archaeal species have been characterized to a limited extent. The only published report on archaeal O-glycan biosynthesis revealed that Haloarcula hispanica requires Dol-P-Glc as a sugar donor for the assembly of the N-linked glucose-α-(1,2)-[sulfoquinovosamine-β-(1,6)-]galactose trisaccharide and the O-linked glucose-α-(1,4)-galactose disaccharide.","N-glycosylation has been considered as assisting Archaea to cope with the challenges of the extreme environments they often occupy. For instance, enhanced surface charge in the face of hypersaline conditions and hence increased solubility was offered as an explanation for the high sulfated sugar content of N-linked glycans decorating the Hbt. salinarum S-layer glycoprotein relative to its Hfx. volcanii counterpart, given the higher salinity of the locale in which the former lives. In other instances, it is not clear how a given N-glycosylation profile contributes to life in harsh surroundings. In Hfx. volcanii, however, N-glycosylation may provide cells with the ability to respond to changes in the surrounding salinity.",0.3333333333333333,0.7599415116723264,0.6386984795736786,0.015625,0.9999999999666667,1.0
"Complete the following paragraph: A. fumigatus is an environmental mold that spreads by airborne particles. It causes serious invasive disease in immunocompromised people that is difficult to treat, leading to high mortality rates.","['In particular, these structures are recognized by the mannose receptor and by dectin-2. These are C-type lectins expressed by immune cells that are important in both innate and adaptive immune responses (see Chapter 34). PLM antigens may be shed by C. albicans and, through interactions with Toll-like receptors (TLR-2), they can induce nuclear factor-κB (NF-κB) activation and cytokine responses such as tumor necrosis factor-α (TNF-α) secretion. Galectin-3, a ubiquitous member of the galectin family of lectins that is highly expressed in macrophages, also appears to recognize C. albicans expressing β1-2-linked mannose residues, resulting in opsonization of the yeast. A. fumigatus is an environmental mold that spreads by airborne particles. It causes serious invasive disease in immunocompromised people that is difficult to treat, leading to high mortality rates. As with other fungal pathogens, the surface glycans of A. fumigatus are critical for interactions with the host. The cell wall of infectious forms of this fungus is covered with specific proteins and melanin, presumably to alter surface properties and mask these structures from recognition by host immune receptors. The hyphal wall has a core of branched β1-3-glucan covalently linked to other glucan components, chitin, and galactomannan, which consists of a mannose backbone with short galactofuranose side chains. Interestingly, galactomannan also occurs anchored to the plasma membrane by a GPI. This polysaccharide is assembled in the Golgi apparatus and is probably transferred to the cell wall by transglycosidases, in the same way as GPI-anchored proteins. A. fumigatus also produces an extracellular matrix composed of monosaccharides, α1-3-glucan, galactomannan, and a galactosaminogalactan composed of variable galactopyranose repeats linked to N-acetylgalactosamine, which are partially de-acetylated. This structure has been implicated in adhesion and fungal virulence. The extracellular matrix also plays an important role in concealing the immunogenic β1-3 glucan layer from the immune system. C. neoformans is a ubiquitous environmental basidiomycete yeast that causes severe disease in immunocompromised individuals, leading to roughly half a million deaths per year worldwide. It is unique among pathogenic fungi in having an extensive polysaccharide capsule that is required for virulence (Figure 23.6). The capsule is a dynamic structure that changes in thickness and composition depending on the environment and growth conditions. It is particularly large in the context of mammalian infection, in which it impedes host immune responses. It is composed of two large (millions of Da) polysaccharides named for their monosaccharide components: glucuronoxylomannan (GXM) and glucuronoxylomannogalactan (GXMGal). GXM is an extended α1-3 mannan substituted with β1-2Xyl, β1-4Xyl, and β1-2GlcA (Figure 23.7); a subset of the mannose residues are 6-O-acetylated (not shown). The second polymer, GXMGal, is based on α1-6 galactan, with side chains of galactose, glucuronic acid, mannose, and xylose (Figure 23.7); the backbone is also modified with small amounts of β1-2-linked galactofuranose (not shown). Association of the capsule with the cell surface relies on a cell-wall component, α1-3 glucan. Although α1-3 glucan is not present in the cell walls of S. cerevisiae or C. albicans, it is common in other fungi. N-glycans of C. neoformans are generally high mannose with modest outer chain extensions and may include xylose β1-2-linked to the trimannosyl core. Both N- and O-glycans may also be modified with xylose and xylose phosphate. A quick-freeze deep-etch image of the edge of a Cryptococcus neoformans cell.'
 'Although α1-3 glucan is not present in the cell walls of S. cerevisiae or C. albicans, it is common in other fungi. N-glycans of C. neoformans are generally high mannose with modest outer chain extensions and may include xylose β1-2-linked to the trimannosyl core. Both N- and O-glycans may also be modified with xylose and xylose phosphate. A quick-freeze deep-etch image of the edge of a Cryptococcus neoformans cell. The polysaccharide capsule (open meshwork at right) is linked to the cell wall (central structure dividing the image from upper left to lower right) via α1-3 glucan. (more...) Structures of capsular polysaccharides in Cryptococcus neoformans.  In the context of fungal diseases, the similarity of fungi to their eukaryote hosts becomes a liability, because it is challenging to develop antifungal drugs that are not hampered by toxicity. The unique features of fungal glycans may suggest drug targets to help improve this picture, and decrease the roughly one million deaths each year caused by fungal infections. The major success story using this approach is the development of echinocandin drugs. These antifungal lipopeptides inhibit β1-3-glucan synthesis in fungi including Candida and Aspergillus, leading to cell wall compromise, and are used clinically to treat invasive fungal infections, although they are not effective against all fungal pathogens. GPI-synthesis inhibitors also offer promise for treatment of fungal pathogens; compounds that selectively inhibit yeast inositol acylation are currently in clinical trials. Continued efforts to target novel aspects of fungal glycobiology may advance the ongoing search for new therapies. The authors appreciate helpful comments and suggestions from Anne Imberty and Markus Pauly.'
 'Finally, the xylans of this organism are linear β1-4-linked polymers of xylose, more typical of those found in “higher” plants and algae than in fungi. D. glabratum also synthesizes several unusual short glycolipids, including glycosyldiacylglycerolipids, which are similar to plant glycolipids and contain monosaccharides, disaccharides, and linear trisaccharides of α1-6-linked galactopyranose. This fungus thus highlights the extensive glycan diversity of the fungal kingdom. Another example of glycan diversity is offered by Cryptococcus laurentii, which has the unusual property of producing toxins that kill a pathogenic yeast, C. albicans (see below). The O-glycans of C. laurentii are unusual in that they contain mannose, xylose, and galactose (Figure 23.3C); these glycans are synthesized by a unique set of mannosyl-, xylosyl-, and galactosyltransferases that are not homologous to human enzymes. This diversity would not have been predicted by studies of model yeast alone, emphasizing the importance of examining glycans in a wide range of fungal species. Coprinopsis cinerea is a mushroom species that has gained prominence as a model for studies of diverse topics including mating, sexual development, meiosis, and the evolution of multicellularity. Its N-glycans typically are high mannose type with five to nine mannoses, but may also have a bisecting α1-4GlcNAc at the β-mannose. Pathogenic fungi are a significant cause of plant and animal disease, responsible for devastation of crops, decimation of animal populations (e.g., certain bat, amphibian, and bee species), and serious human diseases that kill an estimated one million people each year. These organisms display diverse glycans, which typically differ from those of the host and have been implicated in multiple pathogenic processes and host–pathogen interactions. For example, during plant infections plant glycosylhydrolases may partially digest wall glucans of invading fungi. Some of the released oligosaccharides, termed oligosaccharins, can then act as signals to promote plant antifungal defenses. C. albicans (an ascomycete) is a normal commensal organism that can cause illness ranging from irritations of mucosal surfaces to life-threatening systemic infections. The C. albicans cell wall contains β1-3- and β1-6-linked glucans and chitin, similar to the S. cerevisiae wall, and immunogenic mannans that are termed phosphopeptidomannans. It also produces unusual short β1-2-linked mannose chains (Figure 23.2) that are highly antigenic and are also expressed on phospholipomannan (PLM) antigens. PLM antigens contain phytoceramide derivatives of myo-inositol phosphate. The β1-2 mannosides are linked via an α-mannosylphosphate to the common glycosphingolipid Manα-1,2 inositolphosphoceramide. The abundant GPI-anchored proteins of C. albicans have been implicated in fungal adherence to host tissues. The O-glycans of C. albicans are short chains of α1-2-linked mannose (Figure 23.3A), which lack the α1-3-linked mannose caps found in S. cerevisiae. As in S. cerevisiae, deficiencies of O-mannose addition generated through genetic deletions are lethal, indicating that O-mannosylation is essential in this yeast. C. albicans mannans are also important in its interactions with host cells, including macrophages and dendritic cells. In particular, these structures are recognized by the mannose receptor and by dectin-2. These are C-type lectins expressed by immune cells that are important in both innate and adaptive immune responses (see Chapter 34). PLM antigens may be shed by C. albicans and, through interactions with Toll-like receptors (TLR-2), they can induce nuclear factor-κB (NF-κB) activation and cytokine responses such as tumor necrosis factor-α (TNF-α) secretion.']","The cell wall of infectious forms of A. fumigatus is covered with specific proteins and melanin, presumably to alter surface properties and mask these structures from recognition by host immune receptors. The hyphal wall has a core of branched β1-3-glucan covalently linked to other glucan components, chitin, and galactomannan, which consists of a mannose backbone with short galactofuranose side chains. Interestingly, galactomannan also occurs anchored to the plasma membrane by a GPI. This polysaccharide is assembled in the Golgi apparatus and is probably transferred to the cell wall by transglycosidases, in the same way as GPI-anchored proteins. A. fumigatus also produces an extracellular matrix composed of monosaccharides, α1-3-glucan, galactomannan, and a galactosaminogalactan composed of variable galactopyranose repeats linked to N-acetylgalactosamine, which are partially de-acetylated. This structure has been implicated in adhesion and fungal virulence. The extracellular matrix also plays an important role in concealing the immunogenic β1-3 glucan layer from the immune system.","As with other fungal pathogens, the surface glycans of A. fumigatus are critical for interactions with the host. The cell wall of infectious forms of this fungus is covered with specific proteins and melanin, presumably to alter surface properties and mask these structures from recognition by host immune receptors. The hyphal wall has a core of branched β1-3-glucan covalently linked to other glucan components, chitin, and galactomannan, which consists of a mannose backbone with short galactofuranose side chains. Interestingly, galactomannan also occurs anchored to the plasma membrane by a GPI. This polysaccharide is assembled in the Golgi apparatus and is probably transferred to the cell wall by transglycosidases, in the same way as GPI-anchored proteins.",1.0,0.5569651813389674,0.9398626220752545,0.03125,0.99999999995,1.0
"Complete the following paragraph: Apiogalacturonans have only been identified in the walls of duckweeds and seagrasses. The substituted galacturonan referred to as RG-II, which accounts for between 2% and 5% of the primary cell wall, is the most structurally complex polysaccharide yet identified in nature.","['In grasses, mixed linkage glucan is present mainly in young tissues, which has led to the suggestion that it is a carbohydrate storage molecule as also indicated by its metabolism during plant development. Callose, a polysaccharide composed of 1-3-linked β glucosyl residues, is another β-glucan produced by plants (Figure 24.1G). It is used to form a temporary cell wall at the cell plate during cytokinesis and is involved in regulating the permeability of plasmodesmata. It is often formed in response to abiotic and biotic stresses or damage. Pectins are structurally complex polysaccharides that contain 1-4-linked α-D-GalpA. Three structurally distinct pectins—homogalacturonan, substituted galacturonan, and rhamnogalacturonan—have been identified in plant cell walls (Figure 24.2). Homogalacturonan, which may account for up to 65% of the pectin in a primary wall, is composed of 1-4-linked α-D-GalpA. The carboxyl group may be methyl-esterified, thus neutralizing the negative charge of this glycosyl moiety, and the uronic acid itself may be acetylated at O-2 or O-3. The extent of methyl-esterification is controlled by pectin methylesterases and pectin methylesterase inhibitors present in the wall. The degree of methylesterification affects the ability of homogalacturonan-containing glycans to form ionic calcium cross-links with themselves and with other pectic polymers. Such interactions alter the mechanical properties of the wall and may influence plant growth and development. Rhamnogalacturonan-I (RG-I) is a family of polysaccharides with a backbone composed of a repeating disaccharide 4-α-D-GalpA-1-2-α-L-Rhap-1. Many of the GalpAs are acetylated at O-2 and/or O-3. Depending on the plant, between 20% and 80% of the Rhap residues may be substituted at O-4 with linear or branched side chains composed predominantly of Araf and Galp, together with smaller amounts of Fucp and GlcpA (Figure 24.2). Little is known about the functions of these side chains and their contribution to the properties of the primary wall. Substituted galacturonans have a backbone composed of 1-4-linked α-D-GalpA acid residues that are substituted to varying degrees with mono-, di-, or oligosaccharides. For example, xylogalacturonans contain single β-D-Xylp residues linked to O-3 of some of the backbone residues (Figure 24.2), whereas apiogalacturonans have β-D-apiose (Apif) and apiobiose linked to O-2 of some of the backbone residues. Apiogalacturonans have only been identified in the walls of duckweeds and seagrasses. The substituted galacturonan referred to as RG-II, which accounts for between 2% and 5% of the primary cell wall, is the most structurally complex polysaccharide yet identified in nature. It is composed of 12 different monosaccharides linked together by up to 21 distinct glycosidic linkages (Figure 24.2). Four structurally different side chains and one or two Araf substituents are attached to the galacturonan backbone. Two structurally conserved disaccharides (side chains C and D) are linked to O-3 of the backbone. The A and B side chains, which contain between 7 and 9 monosaccharides, are linked to O-2 of the backbone. Several of the monosaccharides in RG-II are O-methylated and/or O-acetylated. Virtually all of the RG-II exists in the primary wall as a dimer cross-linked by a borate ester. The ester is formed between the Apif residue in side chain A of each RG-II monomer (Figure 24.2).'
 'The A and B side chains, which contain between 7 and 9 monosaccharides, are linked to O-2 of the backbone. Several of the monosaccharides in RG-II are O-methylated and/or O-acetylated. Virtually all of the RG-II exists in the primary wall as a dimer cross-linked by a borate ester. The ester is formed between the Apif residue in side chain A of each RG-II monomer (Figure 24.2). The dimer forms rapidly in vitro when the RG-II monomer is reacted with boric acid and a divalent cation. However, the mechanism and site of dimer formation in planta has not been determined. Borate cross-linking of RG-II is likely to have substantial effects on the properties of pectin and the primary wall as RG-II is itself linked to homogalacturonan (Figure 24.2). Indeed, mutations that affect RG-II structure and cross-linking result in plants with abnormal walls and severe growth defects. Swollen primary walls and abnormal growth together with reduced RG-II cross-linking are also a characteristic of boron deficient plants. RG-II was believed to be largely resistant to fragmentation by microbial enzymes. However, recent studies have shown that bacteria present in the human gut produce glycanases capable of hydrolyzing all but one of the glycosidic bonds in RG-II. Pectin is believed to exist in the cell wall as a macromolecular complex comprised of structural domains—homogalacturonan, rhamnogalacturonan, and substituted galacturonan—that are covalently and noncovalently linked to one another. However, there is only a limited understanding of how these structural domains are organized (Figure 24.2). Molecular modeling of a pectin (∼50 kDa) containing homogalacturonan (degree of polymerization ∼100) and rhamnogalacturonan with arabinogalactan side chains, together with modeling of RG-II conformation have begun to provide insights into the conformations and relative dimensions of each pectin structural domain. The homogalacturonan region has a persistence length of approximately 20 GalAp residues, which is likely to be sufficient to stabilize junction zones formed with Ca++. In vitro studies suggest that the maximum stability of such junction zones is obtained with oligomers containing approximately 15 nonesterified GalpA residues. Thus, controlling the distribution of methyl-ester groups along the homogalacturonan backbone provides a mechanism to regulate the physical properties of pectin, including its ability to form gels. For a gel to form and not to be brittle, other features including sequences that interrupt interchain associations in the pectin macromolecule may be important. For example, the structural diversity and the conformational flexibility of the oligosaccharide side chains of the rhamnogalacturonan domain will limit or prevent interchain pairing. The presence of 1-2-linked Rhap residues does not introduce kinks into the backbone geometry of rhamnogalacturonan and thereby limit interchain associations. Rather, it is the side chains linked to these residues that are responsible for preventing or limiting interchain associations. The conformations of the four side chains attached to the homogalacturonan backbone may lead RG-II to adopt a “disk-like” shape. Well-defined tertiary structures are predicted for the RG-II monomer and the dimer. In the dimer, borate-ester cross-linking and Ca++ interchain pairing further stabilizes the two disks. The apparent resistance of RG-II to wall-modifying enzymes together with the formation of a cation-stabilized RG-II dimer likely results in a structure that resists temporal changes in the plant. In contrast, homogalacturonan is continually modified by the action of wall enzymes and its contribution to wall architecture is therefore time dependent. Increased knowledge of the physical properties of primary wall polysaccharides and proteoglycans is required to understand how modulating the amounts and structural features of a few common polysaccharides and glycan domains lead to primary walls with diverse properties and functionalities.'
 'Cellulases and other enzymes involved in cellulose hydrolysis often exist as macromolecular complexes referred to as cellulosomes. Improving the effectiveness of cellulosomes is an area of active research, to increase the conversion of plant biomass to fermentable sugar (Chapter 59). Hemicelluloses are branched polysaccharides with a backbone composed of 1-4-linked β-D-pyranosyl residues with an equatorial O-4 (Glcp, Manp, and Xylp). Xyloglucan, glucurono/arabinoxylan, and glucomannan (Figure 24.1B–E) are included under this chemical definition of hemicelluloses. Hemicelluloses and cellulose have structural and conformational similarities that allow them to form strong, noncovalent associations with one another in the cell wall, although the biological significance of these interactions is still a subject of debate. Xyloglucan and cellulose both have a backbone of 1-4-linked β-D-Glcp residues, but unlike cellulose, xyloglucan contains sidechain substituents. The xyloglucan backbone is highly substituted with α-Xylp substituents at O-6 and in some cases with O-acetyl-substituents (Figure 24.1B). Each Xylp residue may itself be extended by the addition of one or more monosaccharides including β-D-Galp, α-L-Fucp, α-L-Araf, α-L-Arap, β-D-Xylp, β-D-GalpA, and O-acetyl substituents. Twenty-three structurally unique side chains have been identified to date, although only a subset of these are synthesized by a single plant species. Early models of dicot primary walls predicted that xyloglucans acted as tethers between cellulose microfibrils and that controlled enzymatic cleavage or reorganization of xyloglucan by proteins facilitated wall expansion and thus plant cell growth. However, this notion has been challenged by genetic engineering of xyloglucan structures in Arabidopsis plants, which revealed that eliminating xyloglucan entirely from the primary wall has remarkably little effect on overall plant growth and development. In contrast, removing only selected sidechain substituents of xyloglucan is detrimental to plant growth and replacing the sidechains with various glycosyl moieties restores plant growth, independent of the glycosyl moiety added. These results have led to the suggestion that xyloglucan acts as a spacer molecule to keep cellulose microfibrils apart and that pectin has a more important role in controlling wall expansion than previously believed. Arabinoxylan (Figure 24.1D) is the predominant noncellulosic polysaccharide in the type II walls of the grasses, with only small amounts present in dicot primary walls. Its backbone is composed of 1-4-linked β-D-Xylp residues, many of which are substituted at O-3 with α-L-Araf residues. These Araf residues may be further substituted at O-2 with an α-L-Araf or a β-D-Xylp residue. A small number of the backbone residues are substituted at O-2 with α-D-GlcpA and its 4-O-methylated counterpart (MeGlcpA). The presence of 1-3, 1-4-linked β-glucans (also referred to as mixed-linkage glucans) (Figure 24.1F) in the walls of grasses was once considered to be a unique feature of these plants. However, structurally related mixed-linkage β-glucans have also been identified in the walls of Selaginella (lycopod) and Equisetum (horsetails), although the evolutionary relationship between these β-glucans is not known. In grasses, mixed linkage glucan is present mainly in young tissues, which has led to the suggestion that it is a carbohydrate storage molecule as also indicated by its metabolism during plant development. Callose, a polysaccharide composed of 1-3-linked β glucosyl residues, is another β-glucan produced by plants (Figure 24.1G).']","The A and B side chains, which contain between 7 and 9 monosaccharides, are linked to O-2 of the backbone. Several of the monosaccharides in RG-II are O-methylated and/or O-acetylated. Virtually all of the RG-II exists in the primary wall as a dimer cross-linked by a borate ester. The ester is formed between the Apif residue in side chain A of each RG-II monomer. The dimer forms rapidly in vitro when the RG-II monomer is reacted with boric acid and a divalent cation. However, the mechanism and site of dimer formation in planta has not been determined. Borate cross-linking of RG-II is likely to have substantial effects on the properties of pectin and the primary wall as RG-II is itself linked to homogalacturonan. Indeed, mutations that affect RG-II structure and cross-linking result in plants with abnormal walls and severe growth defects. Swollen primary walls and abnormal growth together with reduced RG-II cross-linking are also a characteristic of boron deficient plants. RG-II was believed to be largely resistant to fragmentation by microbial enzymes. However, recent studies have shown that bacteria present in the human gut produce glycanases capable of hydrolyzing all but one of the glycosidic bonds in RG-II. Pectin is believed to exist in the cell wall as a macromolecular complex comprised of structural domains—homogalacturonan, rhamnogalacturonan, and substituted galacturonan—that are covalently and noncovalently linked to one another. However, there is only a limited understanding of how these structural domains are organized.","It is composed of 12 different monosaccharides linked together by up to 21 distinct glycosidic linkages (Figure 24.2). Four structurally different side chains and one or two Araf substituents are attached to the galacturonan backbone. Two structurally conserved disaccharides (side chains C and D) are linked to O-3 of the backbone. The A and B side chains, which contain between 7 and 9 monosaccharides, are linked to O-2 of the backbone. Several of the monosaccharides in RG-II are O-methylated and/or O-acetylated. Virtually all of the RG-II exists in the primary wall as a dimer cross-linked by a borate ester. The ester is formed between the Apif residue in side chain A of each RG-II monomer (Figure 24.2). The dimer forms rapidly in vitro when the RG-II monomer is reacted with boric acid and a divalent cation. However, the mechanism and site of dimer formation in planta has not been determined. Borate cross-linking of RG-II is likely to have substantial effects on the properties of pectin and the primary wall as RG-II is itself linked to homogalacturonan (Figure 24.2).",1.0,0.0,0.9204386451340463,0.02702702702702703,0.9999999999666667,1.0
"Complete the following paragraph: In terms of glycosaminoglycans (GAGs), chondroitin and heparan sulfate (CS and HS) have been detected in C. elegans, but neither keratan sulfate (KS), dermatan sulfate (DS), nor hyaluronan (Chapter 16); whereas the CS chains contain a low amount of sulfate, the overall structure of HS in C. elegans is similar to the chains elaborated by vertebrates (see Figure 25.5).","['The requirement for chondroitin assembly in seemingly disparate systems may result from biophysical changes in the lumen of the vulva or between the eggshell and the embryo. One idea is that the high negative charge imparted by the glucuronic acids in chondroitin attracts counterions that raise the local osmolarity, causing a swelling pressure. Another possibility is that the chondroitin acts as a physical scaffold bound to the cell membrane or eggshell. Interestingly, the sqv screen did not detect mutations affecting genes that encode proteoglycan core proteins on which the chondroitin chains assemble, but proteomic analysis has led to the identification of nine novel chondroitin sulfate proteoglycan (CPG) core proteins modified with chondroitin chains (Figure 25.6). Two of these (CPG-1 and CPG-2) contain chitin-binding domains that presumably allow the proteoglycans to interact with chitin in the eggshell, thus positioning the proteoglycans between the eggshell and the plasma membrane of the embryo, in which they could serve as spacers or osmotic regulators. Silencing cpg-1 and cpg-2 expression by RNAi recapitulates the cytokinesis defect observed in sqv mutants, suggesting that these are the relevant proteoglycans. The proteoglycans involved in epithelial invagination have not yet been determined. Chondroitin proteoglycans (CPGs) of Caenorhabditis elegans.  HS biosynthesis in C. elegans follows the same pattern observed in vertebrate systems (Chapter 17). Mutations in the pathway for HS biosynthesis are lethal in C. elegans. Two of the key genes involved in this pathway are rib-1 and rib-2, homologs of the vertebrate genes Ext2 and Ext1, respectively, which catalyze the polymerization of the backbone of HS chains (GlcAβ1-4GlcNAcα1-4) (Chapter 17). Mutants in rib-2, the worm homolog of Ext1, have defects in development and egg laying. The worm genome also contains a single gene for glucuronic acid C-5 epimerase (hse-5) and five genes for sulfotransferase activities (GlcNAc N-deacetylase/N-sulfotransferase [Ndst], hst-1; uronyl 2-O-sulfotransferase, hst-2; 3-O-sulfotransferases, hst-3.1 and hst-3.2; and 6-O-sulfotransferase, hst-6), all of which are homologs of vertebrate genes involved in HS synthesis. In contrast, vertebrates contain four Ndsts, three 6-O-sulfotransferases, and seven 3-O-sulfotransferases. Although mutations in the epimerase (hse-5) and the sulfotransferases (hst-6, hst-2) do not affect viability, they cause defects in specific cell migration, axonal outgrowth, and/or neurite branching. Consistent with this finding, inactivation of the cell surface HS proteoglycan syndecan (sdn-1) affects neural migration and axonal guidance. C. elegans also produces two GPI-anchored HS proteoglycans. LON-2, a member of the glypican family, negatively regulates a bone morphogenetic protein-like signaling pathway that controls body length in C. elegans. Worms also contain a homolog of the vertebrate basement membrane proteoglycan perlecan (encoded by unc-52). At least three major classes of UNC-52 isoforms are produced through alternative splicing, and distinct spatial and temporal expression patterns occur throughout development. In keeping with the “uncoordinated” phenotype, unc-52 mutants affect myofilament assembly in body-wall muscle during embryonic development. Thus, as in vertebrates, HS proteoglycans mediate many fundamental processes during development and in the adult animal. The arthro-series glycolipids in C. elegans include structures modified with either phosphorylcholine or fucose residues (Figure 25.7A).'
 'KS I, originally detected in cornea, is found on an N-glycan linked to protein through an asparagine residue (Chapter 9). KS II (skeletal keratan sulfate) is found on an O-glycan core 2 structure and is thus linked through N-acetylgalactosamine to serine or threonine (Chapter 10). The structural features in control of keratan sulfate substitution remain unclear, as the underlying poly-N-acetyllactosamine backbone can be found on many other glycoproteins. Notably, in humans and bovine, the large chondroitin sulfate proteoglycan found in cartilage (aggrecan) contains a segment of four to 23 hexapeptide repeats (E-E/L-P-F-P-S) where the keratan sulfate chains are located, whereas aggrecan in rats and other rodents lacks this motif and does not contain keratan sulfate. Keratan sulfates (KS) contain a sulfated poly-N-acetyllactosamine chain, linked to either asparagine or serine/threonine residues. Chst1 and 5 can add sulfate groups at the indicated positions. The actual order of the various sulfated and nonsulfated (more...) Two classes of glycosaminoglycan chains—chondroitin sulfate/dermatan sulfate and heparan sulfate/heparin—are linked to serine residues in proteins by way of xylose (Figure 17.4). Xylosyltransferase initiates the process using UDP-xylose as donor. Two isoforms of the enzyme are known in vertebrates (XYLT1 and XYLT2), but only one isozyme exists in C. elegans and D. melanogaster. A glycine residue invariably lies to the carboxy-terminal side of the serine attachment site, but a perfect consensus sequence for xylosylation does not exist. At least two acidic amino acid residues are usually present, and they can be located on one or both sides of the serine, usually within a few residues. Several proteoglycans contain clustered glycosaminoglycan attachment sites, raising the possibility that xylosyltransferase could act in a processive manner. Xylosylation is an incomplete process in some proteoglycans, which may explain why proteoglycans with multiple potential attachment sites contain different numbers of chains in different cells. The biosynthesis of chondroitin sulfate (left chain) and heparan sulfate (right chain) is initiated by the formation of a linkage region tetrasaccharide (green circles in Fig. 17.1). Addition of the first hexosamine commits the intermediate to either (more...) After xylose addition, a linkage tetrasaccharide assembles by the transfer of two galactose residues catalyzed by unique members of the β4 galactosyl-, β3 galactosyl-, and β3 glucuronosyltransferase families of enzymes (Figure 17.4). This intermediate can undergo phosphorylation at the C-2 position of xylose and in the case of chondroitin sulfate, sulfation of the galactose residues. In general, phosphorylation and sulfation occur substoichiometrically, but phosphorylation may be transient. Phosphorylation occurs early in the assembly process and creates the preferred substrate for B4GALT7; a phosphatase removes the phosphate at a later stage of biosynthesis. The function of galactose sulfation in chondroitin sulfate remains unclear. The linkage tetrasaccharide lies at a bifurcation in the biosynthetic pathway: addition of β4-linked N-acetylgalactosamine, which initiates chondroitin sulfate assembly, or addition of α4-linked N-acetylglucosamine, which initiates heparan sulfate assembly (Figure 17.4). Genetic evidence from studies of C. elegans suggests that N-acetylgalactosamine addition during chondroitin assembly is mediated by the same enzyme that is involved in chain polymerization (Sqv5), but biochemical evidence suggests that more than one enzyme may exist in vertebrates.'
 'Vertebrates also express homologs that can transfer individual sugars to the chain. Chondroitin polymerization also requires the action of the chondroitin polymerizing factor (CHPF), a protein that lacks independent activity but collaborates with the polymerases to enhance the formation of polymers. Sulfation of chondroitin in vertebrates is a complex process, with multiple sulfotransferases involved in 4-O-sulfation and 6-O-sulfation of N-acetylgalactosamine residues (Figure 17.5). Biosynthesis of chondroitin sulfate/dermatan sulfate involves the polymerization of N-acetylgalactosamine and glucuronic acid units and a series of modification reactions including O-sulfation and epimerization of glucuronic acid to iduronic acid. Heparan (more...) Additional enzymes exist for epimerization of D-glucuronic acid to L-iduronic acid in dermatan sulfate (DSE1-2), sulfation at the C-2 position of the uronic acids, and other patterns of sulfation found in unusual species of chondroitin (Table 17.2). The location of sulfate groups is easily assessed using bacterial chondroitinases (ABC, B, and ACII) that cleave the chains into disaccharides. Many chains are hybrid structures containing more than one type of chondroitin disaccharide unit. For example, dermatan sulfate is defined as having one or more iduronic acid–containing disaccharide units (chondroitin sulfate B) as well as glucuronic acid–containing disaccharides (chondroitin sulfate A and C). Animal cells also degrade chondroitin sulfate in lysosomes using a series of exolytic activities (Chapter 44). Types of chondroitin sulfates  Heparan sulfate assembles as a copolymer of GlcNAcα4GlcAβ4 (Figure 17.5), which then undergoes extensive modification reactions, catalyzed by at least four families of sulfotransferases and one epimerase. N-acetylglucosamine N-deacetylase/N-sulfotransferases (NDST1-4) act on a subset of N-acetylglucosamine residues to generate N-sulfated glucosamine (GlcNSO3) units, many of which occur in clusters along the chain. Generally, the enzyme deacetylates N-acetylglucosamine and rapidly adds sulfate to the free amino group to form GlcNSO3, but a small number of glucosamine residues with unsubstituted amino groups may arise from incomplete N-sulfation. An epimerase (GLCE), different from the one involved in dermatan sulfate synthesis, then acts on some glucuronic acid residues, followed by 2-O-sulfation of some of the iduronic acid units (catalyzed by HS2ST). Some glucuronic acid units also undergo 2-O-sulfation by the same enzyme. The addition of 2-O-sulfate groups to glucuronic or iduronic acid prevents the reversible epimerization reaction. Next, 6-O-sulfotransferases (HS6ST1-3) add sulfate groups to selected glucosamine residues. Finally, certain subsequences of sulfated sugar residues and uronic acid epimers provide targets for 3-O-sulfotransferases (HS3ST1-6). Unlike other glycosaminoglycans, heparan sulfate is further modified once displayed at the plasma membrane. A family of plasma membrane endosulfatases (SULFs) can remove sulfate groups from internal 6-O-sulfated glucosamine residues in heparan sulfate and a heparanase can cleave the chains at limited sites. This post-assembly processing of the chains at the cell surface results in altered response of cells to growth factors and morphogens. Intriguingly, the mammalian genome contains other sulfatases of unknown function, raising the possibility that other post-assembly processing reactions of glycosaminoglycans may occur.']","In terms of glycosaminoglycans (GAGs), chondroitin and heparan sulfate (CS and HS) have been detected in C. elegans, but neither keratan sulfate (KS), dermatan sulfate (DS), nor hyaluronan; whereas the CS chains contain a low amount of sulfate, the overall structure of HS in C. elegans is similar to the chains elaborated by vertebrates.","Enzymatic and genomic data indicate that there are various domain-specific forms of glycosylation in C. elegans, including O-fucose (Fucα1-Ser/Thr) on epidermal growth factor (EGF)-like domains and thrombospondin type-1 repeats (TSRs), in the context of precise consensus sequences (Chapter 13), C-mannosylation of TSRs, and TMTC-dependent O-mannosylation of cadherins. However, POMT-mediated O-mannosylation of dystroglycan is absent. Cytoplasmic and nuclear proteins in C. elegans can be modified with O-GlcNAc as in other animals. Biosynthesis of core-1 O-glycans in Caenorhabditis elegans (A) and some O-glycans proposed to occur in adult worms (B).",0.25,0.7235271711853217,0.5980670806574633,0.015384615384615385,0.0,0.5
"Complete the following paragraph: This chapter describes glycosylation in the Arthropoda, focusing primarily on Drosophila melanogaster. The major glycan classes are similar to those described in vertebrates, with interesting differences. The powerful genetic systems available for studying gene function in D. melanogaster have proved to be effective means for understanding glycan function in early development and have provided some of the first examples of how glycans affect growth factor signaling, morphogen gradients, protein secretion, and neural function in vivo.","['NCBI Bookshelf. A service of the National Library of Medicine, National Institutes of Health. Varki A, Cummings RD, Esko JD, et al., editors. Essentials of Glycobiology [Internet]. 4th edition. Cold Spring Harbor (NY): Cold Spring Harbor Laboratory Press; 2022.  doi: 10.1101/glycobiology.4e.26 Kelly G. Ten Hagen, Hiroshi Nakato, Michael Tiemeyer, and Jeffrey D. Esko. This chapter describes glycosylation in the Arthropoda, focusing primarily on Drosophila melanogaster. The major glycan classes are similar to those described in vertebrates, with interesting differences. The powerful genetic systems available for studying gene function in D. melanogaster have proved to be effective means for understanding glycan function in early development and have provided some of the first examples of how glycans affect growth factor signaling, morphogen gradients, protein secretion, and neural function in vivo. Arthropods are among the most successful species on Earth and are found in all types of environments. One of their characteristic features is an exoskeleton composed of chitin, which provides support and physical protection. The best-studied example is the fruit fly, D. melanogaster. In 1910, T.H. Morgan published the first paper about the genetics of D. melanogaster, which showed that white eye color was a sex-linked trait. Since then, this organism has been the predominant model organism for genetic analysis in animals. Its advantages include an easily studied developmental program, a sequenced and actively annotated genome, a relatively complex neural system, and the ability to discern literally thousands of different phenotypes in morphology, development, and behavior. In pursuit of genes that regulate development, many Drosophila geneticists ran head-on into glycans. New analytical techniques have expanded the appreciation for the glycan synthetic capacity of the organism and have helped establish links between interesting phenotypes and altered glycan expression. Some of these associations have proven to be common across species and others are unique to D. melanogaster. Given the complexity of glycosylation in Drosophila, it is impossible to cover all aspects of glycans and glycan-binding proteins in this organism. Instead, we provide an overview of the major classes of arthropod glycans and examples of how studying glycans in Drosophila can lead to new discoveries that impact vertebrate as well as invertebrate biology. Although it was once thought that arthropod glycoproteins were exclusively of the high-mannose or paucimannose type (Chapter 9), annotation of the D. melanogaster genome predicted the existence of the enzymatic machinery needed to generate hybrid and complex glycans. Moreover, improved analytic techniques allowed the detection of very minor glycans. The commercial and experimental demand for eukaryotic expression systems led to the characterization of the glycosylation pathways of cells derived from the moth Spodoptera frugiperda (Sf9 cells) and from D. melanogaster (S2 cells). It is now clear that high-mannose and paucimannose glycans account for >90% of the total N-linked glycan diversity in Drosophila and other insects throughout their life cycles. However, hybrid and complex glycans, including sialylated, sulfated, glucuronylated, and zwitterionic structures, are also present, albeit as minor components (Figure 26.1). N-Linked glycan diversity in Drosophila and other insects. N-Linked glycan processing after endoplasmic reticulum (ER) mannosidase trimming to the Man5GlcNAc2 structure is shown. (Gray boxes) The predominant N-linked glycans, Man5GlcNAc2 and Man3GlcNAc (more...) Drosophila adds fucose (Fuc) in both α1-3 and α1-6–linkages to the reducing terminal N-acetylglucosamine, whereas vertebrates restrict this linkage to α1-6. Fucα1-3GlcNAc is immunogenic in humans and rabbits, resulting in the production of antibodies against the so-called horseradish peroxidase (HRP) epitope.'
 'Genes that affect the synthesis or function of Drosophila glycans  Mutations in genes responsible for subsequent processing steps have begun to reveal the importance of glycan complexity in Drosophila. Reduction in the activity of the Fdl hexosaminidase results in altered brain structure. Brain lobes, normally separated in wild-type adults, are fused together through a continuous stalk at the midline in fdl mutants, hence, the original name of the mutation, fused lobes (Figure 26.2). In the wild-type adult, the separated lobes form portions of the mushroom body, a brain structure whose function has been implicated in Drosophila learning and memory. In an interesting convergence, a null mutation in Mgat1 generates an apparently identical fused-lobes phenotype, although the glycan expression profile shifts from more complex in fdl mutants to high mannose and paucimannose in Mgat1 mutants. It is still unclear how loss of complex glycans in one case (Mgat1) or enrichment of complex glycans in another case (fdl) generates the same neural phenotype. Mgat1 mutants also show reduced locomotor activity and decreased life span. The decreased life span is rescued by re-expression of the enzyme in neural tissue alone, indicating an essential role for complex glycosylation in neural functions that impact whole organism physiology. Mutations in enzymes that process complex N-linked glycans alter adult brain morphology in D. melanogaster. (A) The major lobes of the adult brain are shown in cross section. (Hatched areas) γ-lobes; (α,β) α- and β-lobes; (more...) A terminal synthetic step in the production of N-linked glycans in mammals is the addition of sialic acid residues. Genomic annotation and biochemical studies have shown that Drosophila possesses some, but not all, of the biosynthetic machinery necessary for the production of CMP-NeuAc. A single SiaT identified in Drosophila shows a two-fold preference for transferring sialic acid to a LacdiNAc (GalNAcβ1-4GlcNAc) acceptor compared to a type II LacNAc (Galβ1-4GlcNAc) acceptor. However, the only identified sialylated N-linked glycans in Drosophila possess subterminal LacNAc instead of LacdiNAc, despite the presence of LacdiNAc terminated N-linked glycans in the organism. SiaT is detected in a very small number of neurons beginning in late embryonic stages, but expands to a larger number of central nervous system (CNS) neurons in larval and adult stages. The relatively restricted expression of the SiaT enzyme reinforces proposals that minor glycans may be restricted to small subsets of cells in specific developmental or adult stages (Chapter 7). In fact, loss of glycoprotein sialylation results in explicit neurologic defects in adult flies, including behavioral abnormalities and temperature-induced seizures, indicating the importance of this minor modification of complex glycans for normal neurophysiological function. Insects add glycans in O-linkage to serine and threonine residues on secreted, cell-surface, and intracellular proteins. Structural complexity ranges from single monosaccharides (N-acetylgalactosamine, N-acetylglucosamine, mannose, glucose, or fucose) to extensively modified glycosaminoglycan chains) (see below). The core-1 structure (Galβ1-3GalNAcα-Thr/Ser), which is found extensively on vertebrate mucin-like proteins (Chapter 10), has also been described in insects (Figure 26.3). As much as 40% of the total mass of these proteins is contributed by glycans. In Drosophila tissues, peanut agglutinin lectin and mucin-specific antibodies reveal developmentally regulated and spatially restricted expression of Galβ1-3GalNAcα-O-protein moieties. O-Linked glycan diversity in Drosophila and other insects.'
 'As much as 40% of the total mass of these proteins is contributed by glycans. In Drosophila tissues, peanut agglutinin lectin and mucin-specific antibodies reveal developmentally regulated and spatially restricted expression of Galβ1-3GalNAcα-O-protein moieties. O-Linked glycan diversity in Drosophila and other insects. Genetic and biochemical analysis of Drosophila mutants were instrumental in defining developmental roles for domain-specific, simple mono-, di- or trisaccharide modifications on serine/threonine (more...) Drosophila possesses a family of 10 polypeptide N-acetylglucosaminyltransferases (ppGalNAcT/PGANTs encoded by pgant genes; Chapter 10). Systematic mutational and RNAi-mediated knockdown analysis of individual pgant genes showed that pgant4, 5, 7, and 35A are essential for viability. Loss of pgant3 impacts extracellular matrix secretion and integrin-mediated cell adhesion during development, and pgant4 modulates proteolytic cleavage of substrates essential for secretory granule formation. Loss of pgant4 also results in loss of the secreted peritrophic membrane of the digestive tract, leading to disruption of the progenitor cell niche. pgant9 affects glycosylation of certain mucins and the morphology of secretory granules. Thus, mucin-type O-glycosylation in Drosophila regulates essential developmental programs and modulates trafficking through the secretory pathway, providing blueprints for studying similar functions in vertebrate systems. Once initiated by ppGalNAcT/PGANT enzymes, the extension of mucin type glycans in Drosophila results in the production of three different core structures. Core 1 structures predominate, but core 2 glycans are also present, as well as an incompletely defined HexNAc-HexNAc core. A family of core 1 galactosyltransferases (C1GalTs) exists in Drosophila and the loss of certain members disrupts the nervous system and neuromuscular junctions (NMJ). Each core type can be modified by the addition of glucuronic acid (GlcA), either as a terminal or as a branching residue. Loss of the glucuronic acid transferase GlcAT-P results in the loss of glucuronic acid on core 1 structures and results in nervous system defects and alterations in the NMJs. Glucuronic acid is also detected as an internal residue within an extended chain, reminiscent of a glycosaminoglycan disaccharide structural unit (Chapter 17) or of the matriglycan repeat on mammalian dystroglycan (Chapter 13). In Drosophila and mosquito, sulfated mucin type glycans are also detected. Species-specific expression also exists with regard to the relative abundance of different core structures and the existence of specific postsynthetic modifications. For example, O-glycans can be decorated with phosphoethanolamine linked to HexNAc residues in mosquito and wasp species, but not in Drosophila. Other types of O-linked glycan modifications are also present in insects. The discovery that O-GlcNAc decorates protein components of the Drosophila polytene chromosome added weight to initial demonstrations of the existence of nucleocytoplasmic glycosylation in animal cells (Chapters 18 and 19). Subsequently, this finding was reinforced by the observation that the gene encoding the O-GlcNAc transferase (OGT), was affected in super sex combs (sxc) mutants. The sxc locus is one of several polycomb group (PcG) genes that function as homeotic regulators of gene expression along the antero-posterior axis during Drosophila development. In a dramatic convergence of independent studies, major sites of PcG binding along the Drosophila genome were also shown to be major sites of genomic O-GlcNAc modification, indicating that addition of O-GlcNAc to DNA-binding proteins regulates their genomic binding specificity. Additionally, O-GlcNAc is also added to secreted and membrane proteins by the extracellular O-GlcNAc transferase EOGT.']","The chapter on glycosylation in Arthropoda, with a focus on Drosophila melanogaster, highlights the similarity of major glycan classes to those found in vertebrates, while also noting intriguing differences. The genetic systems in D. melanogaster have been instrumental in studying gene function and have demonstrated how glycans impact various processes such as growth factor signaling, morphogen gradients, protein secretion, and neural function in vivo.","Arthropods are among the most successful species on Earth and are found in all types of environments. One of their characteristic features is an exoskeleton composed of chitin, which provides support and physical protection. The best-studied example is the fruit fly, D. melanogaster. In 1910, T.H. Morgan published the first paper about the genetics of D. melanogaster, which showed that white eye color was a sex-linked trait. Since then, this organism has been the predominant model organism for genetic analysis in animals. Its advantages include an easily studied developmental program, a sequenced and actively annotated genome, a relatively complex neural system, and the ability to discern literally thousands of different phenotypes in morphology, development, and behavior. In pursuit of genes that regulate development, many Drosophila geneticists ran head-on into glycans.",1.0,0.8318276404114039,0.694114540399025,0.012658227848101266,0.8333333332916666,1.0
"Complete the following paragraph: When sea urchin sperm undergo the acrosome reaction, a protein named bindin is released from the acrosomal vesicle. Bindin cements the sperm to a large egg surface glycoprotein named egg bindin receptor 1 (EBR1). Bindin can agglutinate mammalian red blood cells much like plant lectins (Chapter 32), and glycopeptide fragments of unfertilized eggs can block bindin-induced red cell agglutination.","[""(Reprinted, with permission, courtesy of Charles Hollahan, Santa Barbara Marine Biologicals.) (Top right) Sperm binding to a sea urchin egg. (Reprinted, with permission, courtesy of M. Tegner (more...) Sea urchin eggs are covered by a hydrated jelly coat. About 80% of the weight of egg jelly is a high-molecular-weight linear fucose (Fuc) sulfate polymer (FSP) with a molecular mass of >106 Da. Receptor proteins on sperm bind to FSP, triggering the opening of two pharmacologically distinct calcium channels that induce the exocytosis of the sperm's acrosome vesicle (the “acrosome reaction”). The ionic mechanisms that trigger the acrosome reaction are conserved in mammals, but the nature of the sperm surface receptors varies. FSP is a species-selective inducer of the sea urchin sperm acrosomal reaction and most FSPs are sulfated α1-3Fuc-based linear polymers made of tri- or tetrasaccharide repeats. The number of fucoses per repeat, the linkage, and sulfation patterns all help ensure species selectivity for induction of the acrosome reaction. About 20% of the egg jelly mass is a large glycoprotein containing a unique polymer of sialic acid (Sia), which can be released from crude sea urchin egg jelly by treatment with mild base (β-elimination). The sialoglycan has a novel structure—[Neu5Gcα2-5-O-glycolylNeu5Gc]n. However, its receptor on the sperm membrane is unknown. When sea urchin sperm undergo the acrosome reaction, a protein named bindin is released from the acrosomal vesicle. Bindin cements the sperm to a large egg surface glycoprotein named egg bindin receptor 1 (EBR1). Bindin can agglutinate mammalian red blood cells much like plant lectins (Chapter 32), and glycopeptide fragments of unfertilized eggs can block bindin-induced red cell agglutination. Bindin is thought to recognize glycans on EBR1. EBR1 itself has lectin-like domains, but its glycan ligands are unknown. Most studies of glycosylation in sea urchins have identified glycosyltransferase activities and the glycans they synthesize (e.g., including N-glycans with antennal β1-3-linked Gal, β1-4GalNAc, Neu5Gc, and sulphate residues as well as traces of the “invertebrate” feature of core α1-3/α1-6-difucosylation) (Figure 27.2). The functions of glycans and glycan-binding proteins (GBPs) can be investigated using genetic strategies in sea urchins, antisense morpholinos or short hairpin RNAs (shRNAs) to knock down gene expression have been the methods of choice, but these will likely be superseded by more precise gene editing techniques such as the clustered regularly interspaced short palindromic repeats/Cas9 (CRISPR/Cas9) strategy or transcription activator–like effector (TALE) nucleases (TALENs). A few echinoderm genomes have been sequenced (Echinobase), but as with most organisms, relating glycosylation activities to genes is not straightforward (Chapter 8). N-glycan diversity in deuterostomes. Example N-glycan antennae from a brittle star and a sea cucumber (both echinoderms), zebrafish, the African clawed frog, and the mouse are shown as well as those shared between mouse and humans. ±S signifies (more...) The African clawed frog, Xenopus laevis, is a well-established model organism for studying fertilization and embryonic development (Figure 27.1). Adults are easy to maintain and can be induced to lay eggs up to three times a year by injection of human chorionic gonadotropin. The very large eggs allow easy microinjection experiments to express exogenous cDNAs encoding RNAs and proteins of interest. Although frog embryos develop quickly, the generation time for adults is long (1–2 yr), and the frog genome is tetraploid, making genetic studies difficult.""
 'NCBI Bookshelf. A service of the National Library of Medicine, National Institutes of Health. Varki A, Cummings RD, Esko JD, et al., editors. Essentials of Glycobiology [Internet]. 4th edition. Cold Spring Harbor (NY): Cold Spring Harbor Laboratory Press; 2022.  doi: 10.1101/glycobiology.4e.27 Michael Pierce, Iain B.H. Wilson, Katharina Paschinger, and Pamela Stanley. This chapter discusses some general features of glycosylation and glycan-binding interactions in a few examples of species that belong to the deuterostome lineage, with particular emphasis on sea urchins, frogs, zebrafish, and mice. These organisms provide excellent models for studying the functions of glycans in development and physiology. Animal evolution split into two major lineages ∼500–600 million years ago—the deuterostomes and the protostomes (Chapter 20). The superphylum Deuterostomia contains the major phyla of Echinodermata (sea urchins and starfish), Hemichordata (acorn worms), Urochordata (ascidians), Cephalochordata (amphioxus), and Vertebrata (fish, amphibia, reptiles, birds, and mammals). In deuterostomes, cell divisions of the zygote occur by radial cleavage, and cell fates are not precisely determined. Another characteristic feature is that the first opening to form in the blastula becomes the anus and the second opening becomes the mouth. The other superphylum, the Protostomia, contains the major phyla of Porifera (corals and sponges), Cnidara (anemones and hydra), Annelida (segmented worms), Mollusca (clams, oysters, snails, and slugs), and Arthropoda (insects, spiders, and crustacea). In protostomes, unlike deuterostomes, cell division during early development occurs in a highly organized manner and cell fate is precisely determined. Examples of well-studied protostome model organisms include the nematode Caenorhabditis elegans (Chapter 25) and the arthropod Drosophila melanogaster (Chapter 26). Deuterostomes have been extensively studied because of their relatedness to humans and because they provide excellent model systems for understanding vertebrate biology. Sea urchins, frogs, zebrafish, and mice have received the most attention and each provides certain advantages for studying functions of glycans in reproduction, early development, or adult physiology. In numerous instances, these models have revealed aspects of glycobiology that were later confirmed in more evolutionarily distant organisms, and they often serve as excellent models for understanding human disease. Challenges exist, however, in describing the glycomes of the more ancient deuterostomes, mainly because of poor genome annotation, ignorance of individual glycosyltransferase substrates, and the presence of glycans with unusual structures. Each of these models is briefly described below with references to other sections of the book for additional details. Sea urchin glycans involved in fertilization have been studied extensively. In fact, much of what we know about the biochemistry of fertilization was first discovered in this organism (Figure 27.1), and the information subsequently applied to mammalian sperm–egg interactions. One of the advantages of studying fertilization in sea urchins is that eggs and sperm are easy to obtain in large quantities. Because fertilization occurs outside the adult body, it is also easy to experimentally manipulate sperm and eggs. (Top left) The purple sea urchin Strongylocentrotus purpuratus. (Reprinted, with permission, courtesy of Charles Hollahan, Santa Barbara Marine Biologicals.) (Top right) Sperm binding to a sea urchin egg. (Reprinted, with permission, courtesy of M. Tegner (more...) Sea urchin eggs are covered by a hydrated jelly coat. About 80% of the weight of egg jelly is a high-molecular-weight linear fucose (Fuc) sulfate polymer (FSP) with a molecular mass of >106 Da.'
 'Adults are easy to maintain and can be induced to lay eggs up to three times a year by injection of human chorionic gonadotropin. The very large eggs allow easy microinjection experiments to express exogenous cDNAs encoding RNAs and proteins of interest. Although frog embryos develop quickly, the generation time for adults is long (1–2 yr), and the frog genome is tetraploid, making genetic studies difficult. Nevertheless, as for sea urchins, inhibition of gene expression has been accomplished by injection of antisense morpholinos or shRNAs into early embryos. These techniques suffer from off-target effects and the future will see a shift to newer gene editing strategies including CRISPR/Cas9 and TALENs. In addition, in situ hybridization and overexpression techniques have been used in Xenopus embryos. For example, the functions of two polypeptide N-acetylgalactosaminyltransferases in transforming growth factor-β/bone morphogenic protein signaling were distinguished, showing that this organism is useful for discovering glycan biosynthetic steps and mechanisms by which glycans regulate development. Indeed, developmental changes in the X. laevis N-glycome (Figure 27.2) have been reported, whereas the O-glycans of frog egg mucins can be extremely complicated in a species-dependent manner. X. laevis oocyte cortical granules contain a lectin called XL35, which is released at fertilization and binds to glycoproteins expressing mucin-type O-glycans (Galα1-3GalNAc) in the jelly surrounding the egg. XL35 is an oligomer made up of monomers, each of which has a molecular weight of 35 kDa. Light scattering experiments showed that the oligomer exists primarily as a 12-mer, allowing it to cross-link its glycoprotein ligands in the egg jelly to form a relatively rigid layer on the fertilization envelope. This molecular complex functions to block polyspermy and also serves as a barrier against microbial infection. Homologs of XL35, known as “X-lectins,” exist in some of the most primitive deuterostomes, such as the sea squirt, but also in more complex vertebrates such as zebrafish, mice, and humans. Mice and humans have two orthologs termed intelectins-1 and -2 (Chapter 30) because of their initial discovery in the intestines. It is interesting to note that the sea squirt homolog (Halocynthia roretzi) shows a similar monomeric molecular weight to human intelectin 1 (Hint-1) and is 34% identical at the amino acid level. Hint-1 exists as a trimer when secreted from goblet cells in intestinal and respiratory epithelia. IL-13, a cytokine involved in the type TII innate immune response, induces a remarkable increase in Hint-1 transcripts. Constitutively expressed transcripts for Hint-1 are also found in heart and lung tissue. Hint-2, in contrast, is only expressed in Paneth cells that function in immune surveillance in the crypts of the small intestine. Glycan microarray results show that both Hints bind to the glycans of a unique set of human pathogenic bacteria that have in common the presence of particular cis-diols on their outer surface polysaccharides and include both Gram-positive and Gram-negative bacteria. Crystal structures of Hint-1 and the Xenopus embryonic epidermal lectin show a conserved mechanism of glycan recognition. But clearly, the carbohydrate binding determinants for each intelectin studied are unique. It is becoming clear that the X-lectin family plays key roles in deuterostome innate immune responses against pathogens. Zebrafish (Danio rerio) provides an excellent model organism for understanding the functions of genes in early vertebrate development (Figure 27.3). Females lay several hundred eggs weekly, which undergo external fertilization. Embryos develop rapidly (in hours), and their translucence allows visualization of early development. Zebrafish are relatively easy to maintain compared with other vertebrate species.']","When sea urchin sperm undergo the acrosome reaction, a protein named bindin is released from the acrosomal vesicle. Bindin cements the sperm to a large egg surface glycoprotein named egg bindin receptor 1 (EBR1). Bindin can agglutinate mammalian red blood cells much like plant lectins, and glycopeptide fragments of unfertilized eggs can block bindin-induced red cell agglutination.","Bindin is thought to recognize glycans on EBR1. EBR1 itself has lectin-like domains, but its glycan ligands are unknown. Most studies of glycosylation in sea urchins have identified glycosyltransferase activities and the glycans they synthesize (e.g., including N-glycans with antennal β1-3-linked Gal, β1-4GalNAc, Neu5Gc, and sulphate residues as well as traces of the “invertebrate” feature of core α1-3/α1-6-difucosylation) (Figure 27.2). The functions of glycans and glycan-binding proteins (GBPs) can be investigated using genetic strategies in sea urchins, antisense morpholinos or short hairpin RNAs (shRNAs) to knock down gene expression have been the methods of choice, but these will likely be superseded by more precise gene editing techniques such as the clustered regularly interspaced short palindromic repeats/Cas9 (CRISPR/Cas9) strategy or transcription activator–like effector (TALE) nucleases (TALENs).",1.0,0.6247162867774274,0.6267265440849321,0.036585365853658534,0.99999999995,1.0
"Complete the following paragraph: A wide variety of methods for coupling monosaccharides and complex glycans to create affinity resins have been developed. As mentioned above, many sulfated-GAG-binding proteins have been discovered by affinity chromatography using immobilized GAG chains.","['The binding of L-PHA is used to identify specific types of branched N-glycans in cells. L-PHA binding is dramatically decreased in mice genetically null for the branching β1-6 N-acetylglucosaminyltransferase (MGAT5 and -5B) (Chapter 9). The expression of L- or E-PHA-binding glycoproteins is increased in many tumor cells (Chapter 47). Similar studies show E-PHA binds bisected complex-type N-glycans containing the GlcNAcβ1-4Man-R in the core, and such structures are produced by MGAT3, and E-PHA-binding glycans are also elevated in some tumor cells. Thus, using a variety of lectins and antibodies, it is possible to deduce many aspects of glycan structures. Microarrays in which a variety of lectins and antibodies are printed on a slide can also give valuable information about the glycosylation status of cells and glycoconjugates. This approach is especially sensitive in regard to defining whether biological samples differ in glycosylation. For example, such microarrays have been used to identify glycosylation differences in melanoma metastasis, leading to the identification of core fucose as a critical determinant of metastatic potential. There are several approaches to using antibodies and lectins in glycan purification, including affinity chromatography or affinity binding and immunoprecipitation or lectin-induced precipitation. The proteins may be covalently coupled to a carrier such as Sepharose or biotinylated and captured on streptavidin-Sepharose. In addition, antibodies may be noncovalently captured on protein A (or G)-Sepharose. These bound antibodies and lectins can then be used to isolate glycoconjugates expressing specific glycan determinants. ConA-Sepharose is commonly used to isolate glycoproteins as it shows little binding to nonglycosylated proteins. However, it does not bind all glycoproteins because it recognizes specific N-glycan structures. ConA-Sepharose has also been used to isolate free oligo- and polymannose-, hybrid-, and complex-type biantennary N-glycans. When combined in a serial format, multiple lectins can be used in affinity chromatography to isolate glycoconjugates containing most of the major glycan structures present in animal cells, with glycoconjugates being separated as classes that share common determinants. An example of serial lectin affinity chromatography is shown in Figure 48.8. Identification of glycoproteins through analysis of released glycopeptides gives important information on proteins carrying specific modifications. Release of glycans coupled with ion-exchange chromatography and high-performance liquid chromatography (HPLC) can yield highly pure glycans with predicted structures that can then be confirmed by mass spectrometry of native and permethylated derivatives (Chapters 50 and 51). An example of the use of different immobilized plant lectins in serial lectin affinity chromatography of complex mixtures of glycopeptides. In this example, a mixture of glycopeptides is applied to a column of immobilized concanavalin A (ConA), and the (more...) Mixed-bed lectin chromatography using a combination of different immobilized lectins is useful for simultaneously separating all types of glycoconjugates from nonglycosylated material (e.g., glycopeptides from peptides). Combinations of affinity chromatography and other chromatographic techniques can be very useful in identifying and separating glycopeptides. Thus, the ability of glycans to be recognized by lectins dependent on specific structural features in the glycans is a powerful tool for glycan identification and isolation. In some approaches, the glycans are tagged at the reducing end by fluorophores and radioisotopes or may be obtained by metabolic radiolabeling from cells or tissues grown in the presence of radiolabeled sugar precursors, such as [2-3H]mannose or [6-3H]glucosamine. Glycan fractionation shown on immobilized lectins in Figure 48.8 is currently not possible with antibodies because no antibodies are known that can distinguish such core structural features in glycans.'
 'GPI-anchored proteins (Chapter 12), with their lipid, protein, and glycan constituents, have unique physicochemical properties that can be exploited for their detection. The nonionic detergent Triton X-114 at low temperature (4°C) extracts soluble and integral membrane proteins, as well as GPI-anchored proteins. When the solution is warmed, two phases separate, and GPI-anchored and other amphiphilic proteins remain associated with the detergent-enriched phase. GPI-specific phospholipases can be used to cleave GPI anchors for further characterization. Successful cleavage by GPI-specific phospholipases can be assessed using SDS-PAGE, because removal of the GPI anchor causes a shift in molecular mass. This is a common diagnostic method for identifying the presence of a GPI anchor on a protein of interest. Another method is to treat the GPI-anchored protein with nitrous acid, which cleaves the unsubstituted glucosamine residue that links the glycan to the phosphatidylinositol. This class of glycans contains many structures, including homopolysaccharides and heteropolysaccharides, neutral and ionic polysaccharides, and linear and branched structures, with widespread molecular sizes ranging from a few monosaccharide units to thousands (Chapters 3, 21, and 22). Most of these polymers are insoluble in aqueous solutions, occurring as complex and sometimes crystalline aggregates. But many can be extracted with water, salts, chaotropic agents, or detergents and isolated by precipitation with alcohols. Detection is based on refractive index (RI) or colorimetric reactions, because sample quantity is not usually a limitation. Once the presence and general type of glycan has been established, the next challenge is to release specific types of glycans and separate different classes in sufficient quantities for structural characterization. When glycans are released before structural analysis, it is best to use a quantitative release procedure that neither destroys nor alters the glycan. Ideally, information regarding the type of linkage between the glycan and its liberated protein or lipid should be retained, although this is not always possible. Glycolipids can often be isolated and characterized by MS and/or NMR without the need for release of glycans, but, if necessary, enzymatic methods can be used, or for glycosphingolipids, ozonolysis will separate lipid from glycan. Complex, hybrid and oligomannose N-glycans can be released from glycoproteins with N-glycosidases such as PNGase F or PNGase A (Table 50.1). Endo H may be used for the selective release of high-mannose and hybrid N-glycans, but complex N-glycans are resistant (Table 50.1; Figure 50.1). Chemical approaches suitable for release of glycans from a protein include hydrazinolysis, which releases N-glycans and/or O-glycans, depending on experimental conditions. Strong base treatment can, under carefully controlled conditions, release only O-glycans in a process called β-elimination; it is generally accompanied by reduction with borohydride to give an alditol. More recently methods have been developed in which base treatment is accompanied by derivatization with pyrazolone, which acts as a UV-absorbing label during chromatographic separation. However, all of the above chemical methods can result in partial or complete loss of labile modifications of the glycan, such as O-acetylation or sulfation, and degradation of the protein. Glycans released from a glycoconjugate usually form a complex mixture. Even when only one glycosylation site in the protein is occupied, individual molecules can bear different glycan species generating multiple glycoforms. The high-throughput analysis of these glycan mixtures using glycomics technologies is described in Chapter 51. Preparation of glycan samples for structural analysis will rely on separation techniques. Chromatographic separations commonly used to isolate pure glycans, or at least glycan mixtures of reduced complexity, include size exclusion chromatography (SEC), strong or weak anion exchange chromatography (SAX or WAX), and some forms of reverse-phase high-pressure liquid chromatography (HPLC).'
 'A common method involves affinity fractionation of proteins on Sepharose columns containing covalently linked GAG chains, usually heparin. The bound proteins are eluted with different concentrations of sodium chloride, and the concentration required for elution is generally proportional to the Kd. High-affinity interactions require 0.5–2 m NaCl to displace bound ligand, which usually translates into Kd values of 10−7–10−9 m (determined under physiological salt concentrations by equilibrium binding). Proteins with lower affinity (10−5–10−7 m) often require only 0.2–0.5 m NaCl to elute. This method assumes that GAG–protein interactions are entirely ionic, which is not entirely correct. Nevertheless, it can provide an assessment of relative affinity, when comparing different GAG-binding proteins. A number of more sophisticated methods are now in use that provide detailed thermodynamic data (ΔH [change in enthalpy], ΔS [change in entropy], ΔCp [change in molar heat capacity], etc.), kinetic data (association and dissociation rates), and high-resolution data on atomic contacts in GAG–protein interactions (Table 38.2). Regardless of the technique one uses, it must be kept in mind that in vitro binding measurements are not likely to be the same as those when the protein binds to proteoglycans on the cell surface or in the extracellular matrix, where the density and variety of GAG-binding proteins, proteoglycans, and other interacting factors varies greatly. To determine the physiological relevance of the interaction, one should consider measuring binding under conditions that can lead to a biological response. For example, one can measure binding to cells with altered GAG composition (Chapter 49) or after treatment with specific lyases to remove GAG chains from the cell surface (Chapter 17) and then determine whether the same response occurs as observed in the presence of GAG chains. The interaction can then be studied more intensively using the in vitro assays described above. Methods to measure glycosaminoglycan (GAG)–protein interaction  As mentioned above, most GAG-binding proteins interact with HS and/or heparin. The likely basis for this preference is greater sequence heterogeneity and more extensive and variable sulfation compared with other GAGs. The unusual conformational flexibility of iduronic acid, which is found in heparin, HS, and DS, also has a role in their ability to bind proteins. GAGs are linear helical structures, consisting of alternating residues of N-acetylglucosamine (GlcNAc) or N-acetylgalactosamine (GalNAc) with glucuronic acid (GlcA) or IdoA (with the exception of KS, which consists of alternating N-acetylglucosamine and galactose residues; Chapter 17). Inspection of heparin oligosaccharides containing highly modified domains ([GlcNS6S-IdoA2S]n) shows that the N-sulfo and 2-O-sulfo groups of each disaccharide repeat lie on opposite sides of the helix from the 6-O-sulfo and carboxyl groups (Figure 38.1). Analysis of the conformation of individual sugars shows that N-acetylglucosamine and glucuronic acid residues assume a preferred conformation in solution, designated 4C1 (indicating that carbon 4 is above the plane defined by carbons 2, 3, and 5 and the ring oxygen, and that carbon 1 is below the plane; Chapter 2). In contrast, IdoA2S assumes the 1C4 or the 2S0 conformation (Figure 38.1), which reorients the position of the sulfo substituents, thereby creating a different orientation of charged groups. In many cases when a protein binds to an HS chain, it induces a change in conformation of the IdoA2S residue resulting in a better fit and enhanced binding. IdoA2S residues have always been found in domains rich in N-sulfo and O-sulfo groups (for biosynthetic reasons; Chapter 17), which is also where proteins usually bind.']","A wide variety of methods for coupling monosaccharides and complex glycans to create affinity resins have been developed. As mentioned above, many sulfated-GAG-binding proteins have been discovered by affinity chromatography using immobilized GAG chains. A common method involves affinity fractionation of proteins on Sepharose columns containing covalently linked GAG chains, usually heparin. The bound proteins are eluted with different concentrations of sodium chloride, and the concentration required for elution is generally proportional to the Kd. High-affinity interactions require 0.5–2 m NaCl to displace bound ligand, which usually translates into Kd values of 10−7–10−9 m (determined under physiological salt concentrations by equilibrium binding). Proteins with lower affinity (10−5–10−7 m) often require only 0.2–0.5 m NaCl to elute. This method assumes that GAG–protein interactions are entirely ionic, which is not entirely correct. Nevertheless, it can provide an assessment of relative affinity, when comparing different GAG-binding proteins.",A limitation of these approaches is that binding activity does not directly indicate a biological function and the roles of many well-characterized GBPs have not been fully determined. The observation that many lectins fall into structurally distinct families provides an alternative way to identify novel GBPs through analysis of protein sequences. Sequence motifs characteristic of CRDs are routinely used to screen sequences from whole genome sequencing. These motifs can also be used to screen specific cDNA and gene sequences of interest because of their association with biological functions.,0.8333333333333334,0.6890704149796665,0.49643838989681555,0.028169014084507043,0.49999999995,0.0
"Complete the following paragraph: Another variation is generally termed a “pull-down assay,” akin to a type of immunoprecipitation. In this approach a solution containing potential ligands is incubated with a GBP that may be immobilized on a surface (e.g., a bead). Afterward the bead-GBP is subjected to several steps (e.g., magnetic separation or centrifugation) to remove the unbound material.","['If a glycan or a glycosylated macromolecule binds tightly to an immobilized GBP, a buffer containing a known glycan ligand may be added to force dissociation of the complex. For example, oligomannose-type and hybrid-type N-glycans will bind avidly to an agarose column containing the plant lectin concanavalin A (ConA-agarose) and 10–100 mm α-methyl mannoside is required to elute the bound material efficiently. In contrast, many highly branched complex-type N-glycans will not bind. Biantennary complex-type N-glycans bind to ConA-agarose, but they do not bind as tightly as high-mannose-type N-glycans and their elution can be achieved using 10 mm α-methyl glucoside. In this manner, one can assess the binding specificity of a GBP. In practice, this approach is rather crude, and although it gives valuable practical information about the capacity of an immobilized lectin to bind specific glycans, it does not provide quantitative affinity measurements. A variant of this method is to immobilize the glycan ligand through covalent linkage or by capturing a biotinylated glycan on a streptavidin-linked surface and then measuring GBP binding. A more sophisticated version of this approach, termed frontal affinity chromatography, can provide quantitative measurements of the equilibrium binding constants. In this technique, a solution containing a glycan of known concentration is continuously applied to a column of immobilized GBP, and the elution front of the glycan from the column is monitored. Eventually, enough ligand is added through continuous addition that its concentration in the eluant equals that in the starting material. If the glycan has no affinity for the GBP, it will elute in the void volume V0; if, however, the glycan interacts with the GBP, it will elute after the V0 and at a volume Vf (Figure 29.3). Example of frontal affinity chromatography, in which different concentrations of a glycan are applied to a column of immobilized GBP. The profile depicts the elution of one glycan that binds the GBP and the elution of another glycan that does not bind (more...) The advantages of frontal affinity chromatography are similar to those discussed for equilibrium dialysis: (1) the approach is easy and inexpensive; (2) if the affinity is high, then relatively small amounts of protein are needed (typically a few milligrams), and only a single column is required; (3) correspondingly, small amounts of glycan may be used if the Kd is in the range of 10 nm to 10 mm; (4) if the glycans are stable, they may be recovered and reused; (5) radioactive glycans may be used; and (6) reliable equilibrium measurements can be made. There are some limitations to this approach, including (1) only the Kd can be derived, not kon or koff; (2) the conjugation of the GBP to the matrix must be stable and the protein must retain reasonable activity for many different column runs; (3) the amount of GBP conjugated and active must be defined; (4) many different column runs must be made with a single glycan; and (5) if the Kd is high (>1 mm), this approach is typically not feasible. Overall, frontal affinity chromatography is quite useful and is automated. Another variation is generally termed a “pull-down assay,” akin to a type of immunoprecipitation. In this approach a solution containing potential ligands is incubated with a GBP that may be immobilized on a surface (e.g., a bead). Afterward the bead-GBP is subjected to several steps (e.g., magnetic separation or centrifugation) to remove the unbound material. The material bound to the bead-GBP may then be eluted for measurement and further analyses. Using this pull-down setup, one can perform a concentration-dependent binding assay to obtain an apparent Ka of the ligand for the immobilized GBP. Isothermal titration calorimetry (ITC) is one of the most rigorous means of defining the equilibrium binding constant between a glycan and a GBP or indeed any protein and its ligand. The binding of a glycan to the GBP is measured as a change in enthalpy using a commercial microcalorimeter.'
 'The material bound to the bead-GBP may then be eluted for measurement and further analyses. Using this pull-down setup, one can perform a concentration-dependent binding assay to obtain an apparent Ka of the ligand for the immobilized GBP. Isothermal titration calorimetry (ITC) is one of the most rigorous means of defining the equilibrium binding constant between a glycan and a GBP or indeed any protein and its ligand. The binding of a glycan to the GBP is measured as a change in enthalpy using a commercial microcalorimeter. In this technique, a solution containing a glycan of interest is added in increments into a solution containing a fixed concentration of GBP. The glycan is added at many intervals and the heat evolved from binding is measured relative to a reference cell. Over the course of the experiment, the concentration of glycan is increased in the mixing cell over a glycan-to-GBP molar ratio of 0–10. The heat absorbed or evolved during binding is determined and the data are replotted as kcal/mole of injectant versus the molar ratio (Figure 29.4). These data are then analyzed by replotting data to obtain the Kd. The heat change is directly related to the enthalpy of reaction ΔHo. From knowledge of the Kd and ΔHo, and using Equation 4, it is possible to define the binding entropy ΔSo. Example of isothermal titration calorimetry (ITC). (Top) Increasing amounts of a glycan are injected to a fixed amount of glycan-binding protein (GBP) in a cell, and the heat produced upon binding is measured as μcal/sec. (Bottom) The total kcal/mol (more...) The major advantage of this approach is that it can provide thermodynamic information about the binding of a glycan to a GBP and is thus superior to equilibrium dialysis and affinity chromatography. The limitations of this approach are that (1) relatively large amounts of protein may be required to conduct multiple experiments (>10 mg); (2) relatively large amounts of glycans may be required; and (3) because of the above-mentioned problem, it is not typical for such analyses to use a wide range of different glycans. Nevertheless, this approach is rigorous and if the titration cell dimensions could be decreased in the future, then lower amounts of materials would be required. Surface plasmon resonance (SPR) is used to measure association and dissociation kinetics of ligands (analytes) with a receptor. In SPR, the association of the analyte and receptor, with one or the other immobilized on a sensor chip, which incorporates a critical metal sensing surface, induces a change in total surface plasmon waves resulting in a change in the refractive index of the layer in contact with a gold film (Figure 29.5). This change is recorded as the SPR signal or resonance units (RUs). Binding is measured in real time, and information about the association and dissociation kinetics can thus be obtained, which in turn can be used to obtain Ka and Kd from Equations 2 and 3. There are several instruments available from various companies based on the principle of SPR. Example of surface plasmon resonance (SPR). (A) In SPR, the reflected light is measured and is altered in response to binding of the analyte in the flow cell to the immobilized GBP. (B) An example of a sensorgram showing the binding of the analyte to (more...) A variety of chemistries are available for coupling ligand or receptor to the surface of the chip, including reaction with amines, thiols, or aldehydes and noncovalent biotin capture. In some approaches, a glycoprotein ligand for a GBP is immobilized and binding of the GBP is measured directly. It is also possible to degrade the immobilized glycoprotein ligand on the chip sequentially by passing over solutions containing exoglycosidases and reexamining at each step the binding to different GBPs, thereby obtaining structural information about the ligand. The immobilized ligand is usually quite stable and can be used repeatedly for hundreds of runs during a period of months.'
 'The glycans or glycan-containing materials are printed, much like DNA is printed for DNA microarrays, using contact printers or piezoelectric (noncontact) printing (Figure 29.6). Usually, a few nanoliters of solutions containing glycans in concentrations of 1–100 µm are deposited by a robotic printer on the glass surface in ∼100-µm-diameter spots. Slides are incubated for several hours to allow the chemical reactions to covalently fix the samples on the slides. The slides are then blocked to prevent nonspecific binding of reagents, and these microarrays overlaid with a buffer containing the GBP and incubated for several hours to allow equilibrium binding to occur. The slides are washed to remove unbound GBP and then analyzed. Analyses involve fluorescence detection, which means that either the GBP has to be directly fluorescent-labeled or a fluorescent-tagged antibody to the GBP must be used. Preparation of covalent glycan microarrays printed on N-hydroxysuccinimide (NHS)- or epoxide-activated glass slides. In this example, the glycans have a free amine at the reducing end and are coupled to the glass slide. After washing to remove unattached (more...) The chief features of the successful microarrays are the variety of glycans they contain. However, the clustered and relatively high amount of glycans densely packed that can bind detectable amounts of GBPs, may also promote binding of even relatively low affinity multivalent GBPs. Thus, the density of the ligand should be taken into account when interpreting the results. The type of linker used and the state of the monosaccharide at the reducing end (i.e., open ring, open or closed ring form attached to the linker) can also affect binding. Binding is visualized or imaged as intensely fluorescent spots against a dark background. The data are visually imaged on a scanner and then graphically represented. In a typical successful analysis a GBP may bind to several glycans that share structural features, often termed glycan-binding determinants or motifs. If desired, the GBP can then be tested for its binding to the identified candidates by other methods such as titration microcalorimetry or fluorescence polarization, to define the Kd as discussed above. The use of microarrays in characterizing GBPs is a central component of functional glycomics (Chapter 51). Publicly available glycan microarray binding data repositories are increasingly used in the field. A variation of glycan microarrays is a bead-based Luminex-type assay. In this high-throughput approach glycans are covalently immobilized on Luminex beads of different fluorophore properties. Thus, a multiplexed approach is taken where a GBP is mixed with a set of conjugated beads each identifiable by its fluorescent properties. The GBP may be biotinylated, allowing detection by fluorescent streptavidin, or the GBP may be detected by binding to specific antibody or another reagent if the GBP is epitope-tagged. The degree of binding of the GBP is a measure of its affinity and specificity for a particular glycan. The advantages of this approach is that it is high-throughput, allowing thousands of assays to be performed automatically, as well as utilizing small amounts of both glycan and GBP. The collection of data and its analysis are also automated. A limitation of the approach is that each glycan to be derivatized must be activated by having a primary amine or other chemistry for conjugation, and each conjugation of a glycan needs to be independently validated. Multivalent GBPs interacting with multivalent ligands, as expressed on cells, can cause the cells to agglutinate. This can be exploited by allowing one to measure the ability of a soluble glycan to block the agglutination activity of the GBP. The concentration of the soluble glycan that provides 50% inhibition of agglutination is taken as the inhibitory concentration (IC50). Such approaches have been used for many years in studies on lectin-induced agglutination of cells and were useful in elucidating the nature of the human blood group substances. If a sufficiently large panel of soluble glycans is used, then the relative efficacies of each of these can be measured to help define the specificity of the GBP. A major advantage of this technique is that it does not require tagging of the glycans.']","The material bound to the bead-GBP may then be eluted for measurement and further analyses. Using this pull-down setup, one can perform a concentration-dependent binding assay to obtain an apparent Ka of the ligand for the immobilized GBP.","The material bound to the bead-GBP may then be eluted for measurement and further analyses. Using this pull-down setup, one can perform a concentration-dependent binding assay to obtain an apparent Ka of the ligand for the immobilized GBP. Isothermal titration calorimetry (ITC) is one of the most rigorous means of defining the equilibrium binding constant between a glycan and a GBP or indeed any protein and its ligand. The binding of a glycan to the GBP is measured as a change in enthalpy using a commercial microcalorimeter. In this technique, a solution containing a glycan of interest is added in increments into a solution containing a fixed concentration of GBP. The glycan is added at many intervals and the heat evolved from binding is measured relative to a reference cell. Over the course of the experiment, the concentration of glycan is increased in the mixing cell over a glycan-to-GBP molar ratio of 0–10. The heat absorbed or evolved during binding is determined and the data are replotted as kcal/mole of injectant versus the molar ratio (Figure 29.4).",0.75,0.6013766942103702,0.8156044915266678,0.024096385542168676,0.9999999999666667,1.0
"Complete the following paragraph: It is important to note that structural methodology is continually evolving, with additional information coming from techniques like small-angle X-ray scattering (SAXS) and cryo-electron microscopy (cryo-EM). Recent advances in cryo-EM provide many exciting opportunities to study protein–glycan interactions, which will also be discussed.","['If the geometry of the pocket is known, this allows elucidation of the orientation or polarity of the glycan in the binding pocket. The above provides a glimpse of NMR experiments that can be used to investigate protein–glycan interactions. There are many others that take advantage of additional properties such as differences in translational diffusion constants and specific interactions with water molecules. Many of these have been adopted as screening methods used in fragment based drug discovery programs. Information about these is available in Further Reading. With the development of direct electron detectors, cryo-electron microscopy (cryo-EM) has become one of the most powerful techniques to obtain high-resolution structural information on biological macromolecules. With reported resolutions exceeding 2 Å, many molecular details are revealed under native-like conditions. By eliminating the need for growing well-ordered three-dimensional (3D) crystals and operating at fairly low sample concentrations, cryo-EM can provide atomic level insights into many biological samples, from soluble and membrane-integrated protein complexes to filamentous polymers and entire viruses. Cryo-EM can be roughly divided into two main directions: one working with single (usually purified) particles, single-particle analysis (SPA), and the other using a tomography approach to analyze species in larger assemblies, such as in vitro–assembled scaffolds or even native cells and tissues. For SPA, samples are generally analyzed in a thin layer of vitreous ice containing the particles in random orientations. Data is collected in the form of movies, which allows correction for beam-induced drift, followed by estimation of the contrast transfer function for each micrograph; both are necessary to obtain near-atomic resolutions. The individual particles are then computationally extracted from the micrographs, sorted, and ultimately aligned in three dimensions to reconstruct the molecular structure. For cryo-electron tomography of, for example, a vitrified cell or virus particle, a tilt series of images is acquired to obtain different “specimen views” necessary for 3D reconstruction. This technique continues to face technical challenges, in part because of limitations on the tilt angles that can be achieved. However, it is a powerful tool to image, for example, the glycocalyx of various tissues, plant and fungal cells walls, or microbial cell envelopes and capsules. A major advantage of cryo-EM is that sample heterogeneity and/or conformational flexibility does not preclude analyses. To obtain well-diffracting crystals of a glycosylated protein, for example, the conformationally heterogenous glycans are often removed enzymatically to facilitate crystallization. For cryo-EM, these pretreatments are generally unnecessary, thereby providing molecular details of proteins in the context of posttranslational modifications. Analyses of fully glycosylated viral envelope proteins are fascinating examples that document the potential of cryo-EM for studying protein–carbohydrate interactions (Figure 30.5). Other examples include polysaccharide-synthesizing enzymes bound to their polymeric products as well as integral membrane transporters associated with lipopolysaccharide substrates. Cryo-electron microscopy structure of the native fully glycosylated HIV-1 envelope trimer. Protein subunits are shown as gray surfaces and glycans are shown as ball and sticks (PDB entry 5FUU). Carbohydrates are colored green and pale green (β- (more...) We can thus look forward to correlating unprecedented structural insights on protein glycosylation and complex carbohydrate interactions with biochemical, functional, spectroscopic, and in silico approaches in the coming years. Experimental structural information obtained by crystallographic, NMR, and cryo-EM methods have clearly been of value in building an understanding of the molecular interactions that lead to glycan recognition by proteins. However, systems in which interactions are of interest far outnumber the cases in which these methods can be applied. Most crystal structures contain either small ligands or yield useful electron densities for only parts of larger ligands. The same is true to a certain extent for cryo-EM structures. NMR methods, although giving detailed information on bound ligand geometries, frequently give only qualitative information on parts of ligands or protein that are in intimate contact with each other. All three methods require substantial effort, particularly in preparing samples for investigation. A particular problem for glycans of interest is that they are often complex molecules that are difficult to prepare in highly pure forms or in the quantities needed for experimental investigation.'
 'An initial structure for the minimal acceptor, Galβ1-4GlcNAc, was generated using the GLYCAM WebTool, but glycosidic bonds and hydroxyl groups were allowed to rotate during docking. Docking used the program AutoDock Vina. As in the previous example, an additional MD step in explicit water was used to refine the top ranked docked structure containing protein, donor, and acceptor. Interaction energies were then generated by applying MM/GBSA routines from Amber12 to 100-nsec MD production runs. Although the positions of donor and amino acid residues near the donor were modeled to be quite similar to those seen in other transferases, the docking/MD procedure provides a unique view of a possible acceptor position and its interactions. Most of the interaction energy holding the acceptor in place comes from interactions with the galactose ring, which is well-positioned to allow nucleophilic attack on the anomeric carbon of the nucleotide-activated Neu5Ac. This energy results from hydrophobic stacking of Tyr-366 with the nonpolar face of the pyranose ring and a network of hydrogen bonds between Asp-271, Asn-230, His-367, and Gln-232 of the protein and O2, O3, O4, and O6 hydroxyl groups of Gal. The position of the GlcNAc is more variable but does contribute to binding energy. The position and interactions among protein, donor, and acceptor are depicted in Figure 30.7. Stereo view of interactions between the donor (CMP-Neu5Ac), acceptor (GlcNAcβ1-4Gal), and protein residues in the active site of ST6Gal1. (Reproduced, with permission, from Meng L, et al. 2013. J Biol Chem 288: 34680−34698.)  Structural biology is an evolving area of science both in terms of methodology and questions to be answered. The principle methodologies discussed here are each evolving: crystallographic methods using new X-ray sources (e.g., X-ray lasers) are allowing the analysis of microcrystals at room temperature and femtosecond timescales, thereby eliminating temperature- and beam-induced artifacts. Cryo-EM single-particle methods are approaching resolutions previously confined to X-ray crystallography. Single-particle and tomography EM approaches are continuing to undergo rapid development in terms of EM infrastructure, sample preparation, and data acquisition. Several user-friendly pipeline data processing packages exist, making this technology attractive to an increasing scientific audience. Hyperpolarization methods are reducing the sensitivity limitations of NMR, and solid-state NMR methods are allowing application to amorphous materials, including fibrils, cell-wall structures, and membrane fragments. Advances in computational technology are enabling simulation of ever larger systems and timescales. At the same time, structural targets are shifting from detailed characterization of single proteins and protein–glycan complexes to large-scale assemblies that cooperate to elicit a functional response. This is a promising situation for improved understanding of glycan function in biological systems. The authors appreciate helpful comments and suggestions from Barbara Mulloy, Dillon Chen, and Sean Stowell.'
 'NCBI Bookshelf. A service of the National Library of Medicine, National Institutes of Health. Varki A, Cummings RD, Esko JD, et al., editors. Essentials of Glycobiology [Internet]. 4th edition. Cold Spring Harbor (NY): Cold Spring Harbor Laboratory Press; 2022.  doi: 10.1101/glycobiology.4e.30 Jesús Angulo, Jochen Zimmer, Anne Imberty, and James H. Prestegard. The biological effects that glycans elicit are frequently dependent on recognition of specific glycan features by the proteins with which they interact. In this chapter, some of the key structural features underlying glycan–protein interactions, as well as the primary experimental methods that have led to an understanding of these features, are discussed, specifically X-ray crystallography, nuclear magnetic resonance (NMR), cryo-electron microscopy, and computational modeling. As emphasized in previous chapters, the numbers of distinct glycans produced by various organisms are enormous, but at the same time, glycans lack the diversity in functional groups displayed by other molecules. To achieve specificity in glycan recognition, proteins rely as much on the stereospecific placement of glycan hydroxyl groups at chiral centers, use of different linkage sites, and extensive branching as they rely on specific modifications of hydroxyl groups by processes such as sulfation, phosphorylation, and esterification. This puts placement of various residues and functional groups in three dimensions at a premium. Building a three-dimensional picture of how recognition of glycans by proteins occurs is therefore essential if we are to understand how glycans are synthesized and recognized in the many physiological and pathological processes they control. It is also essential if we are to use knowledge of glycan recognition as a basis for the production of therapeutic agents that can control these processes in the event of disease. Building a structure depicting glycan recognition is not without its challenges. Most glycans are highly dynamic in solution, sampling many conformations. Often, a single or a small subset of conformations is selected when a complex forms. This works against the formation of stable complexes for structural studies and the direct use of solution conformational data in defining conformations of bound glycans. The search for a structural basis of glycan recognition by proteins is not new. The concept of glycans fitting into pockets on protein surfaces dates back to Emil Fischer, who used the phrase “lock and key” to refer to enzymes that recognize specific glycan substrates. Lysozyme was the first “carbohydrate-binding protein” to be crystallized and have its three-dimensional structure determined. Subsequent work in the late 1960s and early 1970s led to a structure complexed with a tetrasaccharide that confirmed the existence of specific interactions occurring between sugars and proteins, and the ability of proteins to select the appropriate “key” from numerous possibilities. Today, protein crystallography has reached a very high degree of sophistication and is responsible for the vast majority of the more than 170,000 structures deposited in the Protein Data Bank (PDB); however, producing a structure with ligands in place is still challenging. The structures that exist tend to have ligands that are relatively small and interact with particularly high binding constants. Glycan recognition frequently involves contacts with multiple residues to achieve specificity. So, native glycan ligands are often larger than other types of ligands. Often, high avidity is achieved through multivalent interactions, in which case the affinity for an isolated ligand–protein interaction is small. Nevertheless, there are a significant number of crystal structures for glycan–protein complexes, and these have contributed greatly to our understanding of the types of interactions that make glycan recognition possible. Structural information on bound glycan ligands that is complementary to that from X-ray crystallography is increasingly coming from NMR methods. This is particularly valuable in that it is applicable to ligands with a broader range of affinities, including many that have the lower affinities amplified in multivalent interactions. It is also applicable in solution under near-physiological conditions in which concerns about the effects of crystal lattice contacts and occlusion of some interaction sites are absent. It is even possible to conduct some experiments on assemblies that mimic a membrane surface environment, an environment in which many protein–glycan interactions occur.']","It is important to note that structural methodology is continually evolving, with additional information coming from techniques like small-angle X-ray scattering (SAXS) and cryo-electron microscopy (cryo-EM). Recent advances in cryo-EM provide many exciting opportunities to study protein–glycan interactions, which will also be discussed. These advancements in cryo-EM offer high-resolution structural information on biological macromolecules, allowing for detailed insights into protein-glycan interactions without the need for well-ordered 3D crystals. Cryo-EM can capture molecular details under native-like conditions, making it a powerful tool for investigating a wide range of biological samples, including soluble and membrane-integrated protein complexes, filamentous polymers, viruses, and even native cells and tissues. The technique's ability to handle sample heterogeneity and conformational flexibility makes it particularly valuable for studying complex carbohydrate interactions and glycan recognition by proteins.","The fundamental understanding of glycan–protein interactions, as enriched by experimental studies of all types, has now been encoded in powerful molecular simulation programs that provide a computational approach to generating three dimensional pictures of glycan–protein complexes. These are important because it is difficult to produce complex glycan ligands in the amounts and purity required for most experimental approaches. These methods, although still evolving toward increased confidence in outcomes, provide models for experimentally inaccessible systems that can be tested with a variety of nonstructural approaches. They can also be leveraged with sparse structural data that alone could not provide detailed structural information.",0.5555555555555556,0.436009568801331,0.6597771479958401,0.012048192771084338,0.9999999999666667,0.0
"Complete the following paragraph: Ricinus communis is native to Africa and India and has been used for millennia, by many cultural groups, for numerous medical and industrial purposes. Two lectins, originally termed RCA-I and RCA-II, can be purified from the seeds.","['NCBI Bookshelf. A service of the National Library of Medicine, National Institutes of Health. Varki A, Cummings RD, Esko JD, et al., editors. Essentials of Glycobiology [Internet]. 4th edition. Cold Spring Harbor (NY): Cold Spring Harbor Laboratory Press; 2022.  doi: 10.1101/glycobiology.4e.31 Richard D. Cummings, Ronald L. Schnaar, and Yasuhiro Ozeki. The R-type lectin superfamily is characterized by a carbohydrate-recognition domain (CRD) originally reported in a polypeptide of ricin, a plant toxin. Ricin was the first lectin discovered, and the R-type lectins are named after it. Through evolution, the R-type lectin domain has given rise to various protein forms, some containing this domain alone and others containing additional functional domains (e.g., enzyme or toxin). We will discuss the diversity of this superfamily in terms of molecular tinkering and “bricolage,” based on structure–function relationships. In 1888, Peter Hermann Stillmark at the University of Dorpat (now University of Tartu, Estonia) reported that protein extracts from seeds of Ricinus communis (commonly called “castor oil plant”; seeds are called “castor beans”) contained a factor (which he termed “ricin”) capable of agglutinating erythrocytes. Ricin was already well known as a toxin, but its carbohydrate-binding specificity was not analyzed in detail until the mid-20th century, when it was classified as a lectin. Structural analysis of ricin, performed around a century after its discovery, showed that the CRD had a “β-trefoil” (three-leaved) fold with a common Q-x-W motif in each subdomain. This domain structure defines the R(icin)-type lectins, a superfamily also classified as carbohydrate-binding molecule (CBM) 13 (http://www.cazy.org/CBM13.html) in the Carbohydrate-Active Enzymes (CAZy) database (Chapter 6). These lectins are widely present in all three biological domains (and their viruses) as glycan-binding proteins, including enzymes and toxins (Figure 31.1). The R-type lectin superfamily. Different groups within the superfamily are characterized by the domain structures shown.  Ricinus communis is native to Africa and India and has been used for millennia, by many cultural groups, for numerous medical and industrial purposes. Two lectins, originally termed RCA-I and RCA-II, can be purified from the seeds. RCA-I (molecular mass ∼120 kDa) is a hemagglutinin and a very weak toxin. RCA-II (∼60 kDa), better known as ricin, is an agglutinin and a very potent toxin. Ricin is easily extractable from castor beans and can kill humans at very small doses. RCA-II (ricin; Figure 31.2) is synthesized as a single prepropolypeptide of 576 amino acid (aa) residues containing a secretion signal peptide (residues 1–35), an A chain (residues 36–302), a 12-aa linker region (residues 303–314), and a B chain (residues 315–576). The A-chain toxin is an N-glycoside hydrolase (EC 3.2.2.22) that inactivates the 60S ribosome. The B-chain lectin domain binds to galactose (Gal) and β-galactosides. The amino-terminal signal sequence brings the propolypeptide to the endoplasmic reticulum (ER), where the signal is cleaved off, and the polypeptide is glycosylated. The A chain is linked to the B chain by a disulfide bond between cysteine residues 294 and 318 (Cys4 in the free B chain), and four intrachain disulfide bonds are formed. After glycosylation, ricin is transported to protein storage bodies in castor beans, where the mature ricin protein is generated by removal of the linker peptide by an endopeptidase. Structure of ricin. (A) Ricinus communis (beans and plants).'
 'The A chain is linked to the B chain by a disulfide bond between cysteine residues 294 and 318 (Cys4 in the free B chain), and four intrachain disulfide bonds are formed. After glycosylation, ricin is transported to protein storage bodies in castor beans, where the mature ricin protein is generated by removal of the linker peptide by an endopeptidase. Structure of ricin. (A) Ricinus communis (beans and plants). (B) Crystal structure of ricin (RCA-II); resolution 2.5 Å. (Rutenber E, et al. 1991. Proteins 10: 240–250. Image from PDB entry 2AAI.)  RCA-I (agglutinin) is a tetramer consisting of two noncovalently associated ricin-like heterodimers. Each heterodimer contains an A chain disulfide-linked to a Gal-binding B chain. The A-chain sequences of RCA-I and RCA-II differ in 18 residues and are 93% similar, whereas the B-chain sequences differ in 41 of 262 residues and are 84% similar. The subunits are all N-glycosylated and usually display oligomannose-type N-glycans. Several other lectins having high homology with ricin are also encoded by the R. communis genome; some of these are termed ricin-A, -B, -C, -D (ricin), and -E. The B chain of both RCA-I (agglutinin) and RCA-II (ricin) contains two CRDs in the polypeptide. RCA-I binds preferentially to terminal β-linked Gal, whereas RCA-II binds to either terminal β-linked Gal or GalNAc. These lectins are often purified and separated by differential elution from Gal-based affinity resins; RCA-II is eluted with GalNAc, and RCA-I is then eluted with Gal. These lectins have very low binding affinities for monosaccharides (Kd in the range 10−3 to 10−4 m), but very high affinities (10−7 to 10−8 m) for cells, because of their multivalency and enhanced binding to multiple surface glycans having nonreducing terminal Galβ1-4GlcNAc-R (type-2 LacNAc) sequences. Both lectins also bind strongly to glycans with GalNAcβ1-4GlcNAc-R (LacdiNAc), and weakly to the isomer Galβ1-3GlcNAc-R (type-1 LacNAc). Neither lectin binds appreciably to glycoconjugates having nonreducing terminal α-linked Gal residues. Ricin is highly toxic and the effects of ingestion are severe, with symptoms appearing after a 2- to 24-h latent period. The lethal dose (LD50) of ricin is extremely low (3–5 µg/kg body weight). Ricin is classified as a type II ribosome-inactivating protein (RIP-II). RCA-I (agglutinin) is less toxic than ricin, because of the weaker enzymatic activity of its A-chain. Type I ribosome-inactivating proteins (RIP-I), which lack a B chain with R-type lectin domains, are much less toxic than ricin because toxin entry into target cells is facilitated by B-chain carbohydrate-binding activity. RIP-I expressed in tissues of various types of plants affects disease resistance. Horizontal transmission of RIP-I gene to the genome of whitefly (Hemiptera, Insecta) feeding on such plants was recently demonstrated. Ricin bound to a β-linked cell-surface Gal/GalNAc containing glycans is transported into endosomes (Figure 31.3), and then migrates by retrograde trafficking to ER via the trans-Golgi network and Golgi apparatus. In the ER, A and B chains separate following reduction of the disulfide bond, perhaps catalyzed by the enzyme protein disulfide isomerase. A portion of the free A chain, which may be partially denatured in the ER, escapes by retrotranslocation through the Sec61 translocon and enters the cytoplasm.'
 ""Each subdomain could conceivably have a carbohydrate-binding site; however, in most R-type lectins only one or two subdomains bind a carbohydrate ligand. Carbohydrate-binding of RCA-I and RCA-II arises from aromatic amino acids stacking against Gal/GalNAc residues and from hydrogen bonding between aa's and hydroxyl groups of carbohydrate ligands. A wide variety of R-type lectins with diverse configurations, including RIP-IIs and heterotetramers such as RCA-II, have been purified from various plant tissues. Nontoxic lectins isolated from elderberry (genus Sambucus) bark include SSA (Sambucus sieboldiana agglutinin) and SNA (Sambucus nigra agglutinin UniProt Q41358). These are useful because it is the rare R-type lectin that binds strongly to α2-6-linked sialic acid–modified glycans, but not to α2-3-linked sialylated ligands. Both are heterotetramers (∼140 kDa) composed of two heterodimers, each containing an A chain (resembling ricin A chain) disulfide-bonded to a B chain (R-type lectin). Expression of R-type lectins in roots and shoots of rice (Oryza sativa) was shown to be up-regulated in response to changing environmental conditions, based on genome informatics of Man and Gal-binding β-trefoil fold group EUL (UniProt B3SV73) found in Euonymus europaeus. Analysis of the promoter region of rice EUL genes revealed diverse stress-responsive elements. Analysis of expression profiles revealed that the genes were regulated in response to various types of stress (drought, osmotic, hormonal). Thus, β-trefoil fold lectins are involved in plant stress signaling and defense. Molecular structures of plant proteins having R-type lectin or β-trefoil fold domains vary extensively. Amaranth (Amaranthus caudatus) is an ancient South American crop plant with high nutritional value. Amaranthin (PDB 1JLX), purified from amaranth seeds, is a homodimeric lectin (Mr 66,000) consisting of two identical tandem-repeat β-trefoil fold domains. The primary structure of the lectin is ∼20% similar to that of ricin B-chain. Amaranthin specifically recognizes Thomsen–Fredenreich (TF or T antigen) (Galβ1-3GalNAcα1-) and sialyl-T (Siaα2-3Galβ1-3GalNAcα1-) antigens. A GalNAc residue of the T-antigen disaccharide is captured by β- and γ-subdomains; thus, the mechanism of oligosaccharide binding by amaranthin differs from that of ricin B-chain and FGF (PDB 2AXM), in which a disaccharide is captured by a single subdomain. Phylogenetic survey of plant genomes revealed that many families have amaranthin-like R-type lectin domain sequences in their polypeptides. The sequences consist either of solely lectin domains (prototype R-type lectin), and include tandem repeats, or of a combination of lectin with various functional domains (chimera-type R-type lectin). Plants use R-type lectin domain by combining it with functional domains such as “aerolysin,” a pore-forming bacterial toxin. Tandem-repeat and chimera-type genes containing an amaranthin-like R-type lectin domain are expressed in many tissues and at different developmental stages, suggesting that R-type lectins respond to various external environmental stimuli. R-type lectins are present in fungi, protists, invertebrates, and vertebrates. Almost all of them have the same Q-x-W sequence and bind to Gal, GalNAc, and Man. Some are dimeric or oligomeric forms of simple β-trefoil subunits (prototype R-type lectin); others are tandem-repeat R-type lectins having two CRDs in the polypeptide chain. Chimeric forms have functional domains (enzymes, toxins) associated with R-type lectin, similar to those in plants and bacteria. Diverse forms of R-type lectins have been found in fungi (Chapter 23). Some consist solely of β-trefoil subunits.""]","RCA-I (molecular mass ∼120 kDa) is a hemagglutinin and a very weak toxin. RCA-II (∼60 kDa), better known as ricin, is an agglutinin and a very potent toxin. Ricin is easily extractable from castor beans and can kill humans at very small doses.","RCA-I (molecular mass ∼120 kDa) is a hemagglutinin and a very weak toxin. RCA-II (∼60 kDa), better known as ricin, is an agglutinin and a very potent toxin. Ricin is easily extractable from castor beans and can kill humans at very small doses. RCA-II (ricin; Figure 31.2) is synthesized as a single prepropolypeptide of 576 amino acid (aa) residues containing a secretion signal peptide (residues 1–35), an A chain (residues 36–302), a 12-aa linker region (residues 303–314), and a B chain (residues 315–576). The A-chain toxin is an N-glycoside hydrolase (EC 3.2.2.22) that inactivates the 60S ribosome. The B-chain lectin domain binds to galactose (Gal) and β-galactosides. The amino-terminal signal sequence brings the propolypeptide to the endoplasmic reticulum (ER), where the signal is cleaved off, and the polypeptide is glycosylated.",1.0,0.3963105517063085,0.9334843115991476,0.023809523809523808,0.9999999999666667,1.0
"Complete the following paragraph: A common feature of the legume L-type lectins is their monomeric structure. The structures of the monomers consist of three antiparallel β-sandwich: a flat six-stranded “back” sheet, a concave seven-stranded “front” sheet, and a short “top” sheet that keeps the two major sheets together (Figure 32.1A,B). All of these lectins require Ca++ and a transition metal ion (usually Mn++) for their carbohydrate-binding activity.","['A common feature of the legume L-type lectins is their monomeric structure. The structures of the monomers consist of three antiparallel β-sandwich: a flat six-stranded “back” sheet, a concave seven-stranded “front” sheet, and a short “top” sheet that keeps the two major sheets together (Figure 32.1A,B). All of these lectins require Ca++ and a transition metal ion (usually Mn++) for their carbohydrate-binding activity. The glycan-binding and metal-binding sites are localized in close proximity to each other at the top of the “front” sheet. The glycan-binding site is composed of four loops: A, B, C, and D (Figure 32.3, top). These loops contain four invariant amino acids that are essential for carbohydrate binding (Figure 32.3, bottom). Loop A contains an invariant aspartate, which forms hydrogen bonds between its side chain and the glycan ligand. This amino acid is linked to its preceding amino acid (usually alanine) by a rare cis-peptide bond, which is stabilized by the metal ions and is necessary for the proper orientation of the aspartate in the combining site. Loop B contains an invariant glycine, which also forms hydrogen bonds with the ligand. An exception to this case is found in two lectins (ConA and the closely related Dioclea grandiflora lectin) in which the glycine is replaced with an arginine. Both the glycine and arginine form hydrogen bonds with the ligand via their main-chain amides. Loop C contains an invariant asparagine, which forms a hydrogen bond with the ligand via its side chain, and an invariant hydrophobic amino acid. Besides these invariant amino acids, backbone atoms of the residues of loop D also contribute to monosaccharide recognition. (Top) Three-dimensional structure of a peanut agglutinin (PNA) monomer showing the four loops involved in sugar binding: loops A, B, C, and D. The bound sugar (lactose) is shown as a “ball-and-stick” model. Calcium and manganese ions are (more...) The legume L-type lectins are generally classified into groups based on their carbohydrate specificities as often identified by the ability of monosaccharides to inhibit their agglutinating activity. These differences in specificities are brought about by variability in the conformation and size of the D loop and to some extent by the C loop. Although the main specificity regions of the legume lectins are determined by the loops, there are sites other than these that contribute to lectin specificity. There are several additional modes of refining these specificities, such as interaction with water, posttranslational modifications, and state of oligomerization. Legume L-type lectins are oligomeric—mostly dimeric or tetrameric in nature—and adopt a variety of quaternary structures. The back β-sheet in the monomeric unit is involved in oligomerization. Small differences in the monomeric structure of the different legume lectins result in different modes of association of the β-sheet during oligomerization. For instance, although both ConA and PNA are tetrameric—being dimers of dimers—the quaternary association in ConA involves the association of the two six-stranded back β-sheets to form an extended 12-stranded β-sheet in each dimer, whereas the quaternary association in PNA involves a back-to-back arrangement of the back β-sheets. The tetrameric structure of ConA is shown in Figure 32.1C,D. Although some of the other lectins occur as dimeric and tetrameric structures, several other different orientations of the β-sheets account for the variability in dimeric and tetrameric structures of other lectins in this class. Interestingly, some legume lectins have a hydrophobic binding site that binds adenine and adenine-derived plant hormones with micromolar affinity; this is two to three orders of magnitude higher than their affinity for monosaccharides.'
 'Fewer, but significant, homologies in primary structure have been found between legume L-type lectins compared with some L-type lectins from far distant sources, such as ERGIC-53 and VIP36, found in vertebrates. Yet, in other L-type lectins, no homology is found with the seed lectins, although they contain similar lectin folds. For example, a comparison of the tertiary structure of the legume soybean lectin with the structure of human galectin-3 shows that both proteins contain the typical L-type lectin fold, but no amino acid sequence homology exists between the two lectins (Figure 32.2). Structure of concanavalin A (ConA), a legume seed lectin in complex with a branched pentasaccharide GlcNAcβ1-2Manα1-3(GlcNAcαβ1-2Manα1-6)Man to 2.7 Å. The pentasaccharide is depicted in the center. The tetrameric (more...) Comparison of the subunit structures of soybean agglutinin (A) complexed with a pentasaccharide containing Galβ1-4GlcNAc-R and human galectin-3 at 1.4 Å (B) complexed with Galβ1-4GlcNAc. Both lectins display a related β-barrel (more...) Relationships between sequences of L-type lectins from legumes compared with the phylogeny of the various species within the Fabaceae family of plants suggest that these lectins most probably arose from divergent evolution. It remains an open possibility that the tertiary structures of some of the other members of the “L-type lectin family” arose by convergent evolution. It must also be noted that for a protein to be firmly placed in the L-type lectin category it must have the lectin fold and glycan-binding activity. All soluble L-type lectins found to date are multimeric proteins, although all do not have the same quaternary structure. Thus, these lectins are multivalent with more than one glycan-binding site per lectin molecule. The same multivalent principle applies to the membrane bound L-type lectins because the presence of two or more molecules on a membrane surface essentially presents a multivalent situation. In addition to increasing the avidity of the lectins for branched and/or cell-surface glycans, this multivalence can have great biological significance. Binding of the lectins to the cell surface can lead to aggregation of specific glycan receptors, promoting a variety of biological responses such as mitogenesis and various signal transduction processes. Plant L-type lectins are primarily found in the seeds of leguminous plants and are synthesized during seed development several weeks after flowering; they are transported to the vacuole where they become condensed into specialized vesicles called protein bodies. They are stable during desiccation of the seeds and can remain in that state indefinitely until the seeds germinate. They represent one of several classes of proteins stored in high concentrations in the seeds and are often called storage proteins. During seed germination, the storage bodies become the vacuoles of the cotyledons, which appear as the first leafy appendages of the plant. During the first week of development, these cotyledons provide food for the plant and eventually shrivel up and disappear. L-type lectins have also been found in the bark of some leguminous trees, and very low amounts of these lectins are also found in other vegetative tissues of legumes. In some cases, these latter lectins are encoded by separate but very similar genes. More than 100 of the seed legume L-type lectins have been characterized and are the most extensively studied proteins of this class. It also should be noted that the L-type fold has been observed in noncarbohydrate binding proteins, such as lectin-like receptor kinases in plants that are important in development and stress responses. A common feature of the legume L-type lectins is their monomeric structure. The structures of the monomers consist of three antiparallel β-sandwich: a flat six-stranded “back” sheet, a concave seven-stranded “front” sheet, and a short “top” sheet that keeps the two major sheets together (Figure 32.1A,B).'
 'NCBI Bookshelf. A service of the National Library of Medicine, National Institutes of Health. Varki A, Cummings RD, Esko JD, et al., editors. Essentials of Glycobiology [Internet]. 4th edition. Cold Spring Harbor (NY): Cold Spring Harbor Laboratory Press; 2022.  doi: 10.1101/glycobiology.4e.32 Richard D. Cummings, Marilynn E. Etzler, T.N.C. Ramya, Koichi Kato, Gabriel A. Rabinovich, and Avadhesha Surolia. The L-type lectins occur in the seeds of leguminous plants. They have structural motifs present in a variety of glycan-binding proteins (GBPs) from other eukaryotic organisms. The structures of many of these lectins have been characterized, and many L-type lectins are used in a wide range of biomedical and analytical procedures and implicated in biomedical processes. This chapter discusses the structure–function relationships of these lectins and the various biological roles they have in different organisms. The L-type lectins have a rich history going back to the end of the 19th century when it was found that extracts from the seeds of leguminous plants (Fabaceae family but also called the Leguminosae family) could agglutinate red blood cells. These agglutinins (later named lectins) were found to be soluble proteins abundant in the seeds of leguminous plants. Different species of legumes were found to differ in hemagglutination specificity. Much work on these proteins was performed in the early part of the 20th century, including the crystallization of concanavalin A (ConA; the hemagglutinin [HA] from jack beans), which was first isolated by James Sumner in 1919 and crystallized in 1936 and was the first commercially available lectin. The legume lectins were also found to have hemagglutinating properties because of their ability to bind glycans on the cell surface. The abundance of these proteins in the soluble extracts of legume seeds (up to ∼5%–10% total protein) enabled many lectins to be isolated and characterized. Such seed lectins have considerable amino acid sequence homology, and the variety of carbohydrate-binding specificities found among these lectins made them useful tools in a wide variety of analytical and biomedical procedures. The crystal structures of a number of legume seed lectins allowed the identification of the carbohydrate-binding sites. Structural similarities in the tertiary structures were identified among these lectins and several other lectins, including the galectins (see Chapter 36), as will be discussed in this chapter. For this reason, the term “L-type lectins” has recently been designated as a classification for all proteins with this legume seed lectin-like protein structure. The L-type lectins are distinguished from other lectins primarily based on tertiary structure and not the primary structure. In general, either the entire lectin monomer or the carbohydrate-recognition domains (CRDs) of the more complex lectins is composed of antiparallel β-sheets connected by short loops and β-bends, and they usually lack any α-helices. These sheets form a dome-like structure related to the “jelly-roll fold,” which is often called a “lectin fold.” The carbohydrate-binding site is generally localized toward the apex of this dome. The tertiary structure of the monomer of ConA, the lectin from the seeds of the legume Canavalia ensiformis, is shown in Figure 32.1. The crystal structures of at least 20 other legume L-type lectin monomers have been determined by high-resolution X-ray crystallography and are almost superimposable on this structure. Thus, it is not surprising that the amino acid sequences of legume lectins show remarkable homology with one another and of the sequences of many other legume seed lectins sequenced but not yet crystallized. Fewer, but significant, homologies in primary structure have been found between legume L-type lectins compared with some L-type lectins from far distant sources, such as ERGIC-53 and VIP36, found in vertebrates. Yet, in other L-type lectins, no homology is found with the seed lectins, although they contain similar lectin folds.']","All of these lectins require Ca++ and a transition metal ion (usually Mn++) for their carbohydrate-binding activity. The glycan-binding and metal-binding sites are localized in close proximity to each other at the top of the “front” sheet. The glycan-binding site is composed of four loops: A, B, C, and D. These loops contain four invariant amino acids that are essential for carbohydrate binding. Loop A contains an invariant aspartate, which forms hydrogen bonds between its side chain and the glycan ligand. This amino acid is linked to its preceding amino acid (usually alanine) by a rare cis-peptide bond, which is stabilized by the metal ions and is necessary for the proper orientation of the aspartate in the combining site. Loop B contains an invariant glycine, which also forms hydrogen bonds with the ligand. An exception to this case is found in two lectins (ConA and the closely related Dioclea grandiflora lectin) in which the glycine is replaced with an arginine. Both the glycine and arginine form hydrogen bonds with the ligand via their main-chain amides. Loop C contains an invariant asparagine, which forms a hydrogen bond with the ligand via its side chain, and an invariant hydrophobic amino acid. Besides these invariant amino acids, backbone atoms of the residues of loop D also contribute to monosaccharide recognition.","The glycan-binding and metal-binding sites are localized in close proximity to each other at the top of the “front” sheet. The glycan-binding site is composed of four loops: A, B, C, and D (Figure 32.3, top). These loops contain four invariant amino acids that are essential for carbohydrate binding (Figure 32.3, bottom). Loop A contains an invariant aspartate, which forms hydrogen bonds between its side chain and the glycan ligand. This amino acid is linked to its preceding amino acid (usually alanine) by a rare cis-peptide bond, which is stabilized by the metal ions and is necessary for the proper orientation of the aspartate in the combining site. Loop B contains an invariant glycine, which also forms hydrogen bonds with the ligand.",1.0,0.6342754378436501,0.861966717219073,0.012195121951219513,0.9999999999666667,1.0
"Complete the following paragraph: The original experiments of Neufeld showed that a portion of newly synthesized lysosomal enzymes are secreted into the medium, but may be recaptured by the same cell or by adjacent cells expressing cell-surface CI-MPRs (Figure 33.1). Enzymes that bind to such cell-surface MPRs are endocytosed via clathrin-coated pits and vesicles, eventually reaching the same late endosomal compartments in which newly synthesized molecules arrive from the Golgi.","['Although the cryo-EM structure at pH 7.4 is unable to visualize the N- (domains 1–3) and C- (domain 15) termini with sufficient resolution, it does provide insight into the arrangement of the entire extracellular region of the CI-MPR. The proposed cryo-EM model does not position the two M6P-binding domains (3 and 9) sufficiently close to bind a single, diphosphorylated N-glycan. This suggests that the high-affinity binding of this N-glycan is due to the spanning of binding sites located on different monomers of the CI-MPR. An alternative possibility is that the receptor is dynamic, with the spacing between the two M6P-binding sites being flexible, to enhance interactions with lysosomal enzymes containing phosphorylated glycans at various positions on their protein backbones. The dynamic nature of the receptor is supported by structural and biophysical studies which show that the conformation of the CI-MPR is affected by pH. The CI-MPR adopts a more compact structure under acidic conditions that may facilitate unloading of lysosomal enzymes in the acidic environment of endosomal compartments. Targeted disruption of the CD-MPR gene in mice is associated with normal or only slightly elevated levels of lysosomal enzymes in the circulation and an otherwise grossly normal phenotype. However, thymocytes or primary cultured fibroblasts from such mice show an increase in the amount of phosphorylated lysosomal enzymes secreted into the medium. This indicates that mechanisms exist, which can compensate for the deficiency in vivo. Intravenous injection of inhibitors of other glycan-specific receptors capable of mediating endocytosis (e.g., the mannose receptor of macrophages and the asialoglycoprotein receptor of hepatocytes; see Chapter 34) gives rise to a marked increase in lysosomal enzymes in the serum of the deficient mice. Thus, such receptors are likely part of the compensatory mechanisms in vivo. Like fibroblasts that lack only CD-MPR, fibroblasts that lack only CI-MPR have a partial impairment in sorting. Fibroblasts from embryos that lack both receptors show a massive missorting of multiple lysosomal enzymes. Thus, both receptors are required for efficient intracellular targeting of lysosomal enzymes. Comparison of lysosomal enzymes secreted by the different cell types indicates that the two receptors may interact preferentially with different subgroups of enzymes. Thus, the structural heterogeneity of the M6P recognition marker within a single lysosomal enzyme and between different enzymes is one explanation for the evolution of two MPRs with complementary binding properties: that is, to provide an efficient but varied targeting of lysosomal proteins in different cell types or tissues. What initially appeared to be a precise lock-and-key mechanism turned out to be a far more complex and flexible system, with functionally useful biological flexibility. At steady state, MPRs are concentrated in the TGN and late endosomes, but they cycle constitutively between these organelles, early (sorting) endosomes, recycling endosomes, and the plasma membrane (Figure 33.5). MPRs avoid delivery to lysosomes, in which they would be degraded. This trafficking is governed by a number of short amino acid sorting signals in the cytoplasmic tails of the receptors. The TGN is the site in which newly synthesized lysosomal enzymes bind to MPRs that are then collected into clathrin-coated pits and packaged into clathrin-coated vesicles for delivery to the early endosome. This process involves interaction of the MPRs with two types of coat proteins: the GGAs (Golgi-localized, γ-ear–containing, ADP-ribosylation factor binding) and AP1 (adapter protein 1). In addition to binding MPRs, the coat proteins recruit clathrin for the assembly of clathrin-coated vesicles. Following delivery to early endosomes, lysosomal enzymes are released from MPRs as the endosomes mature to late endosomes and the pH decreases. Late endosomes then undergo dynamic fusion/fission with lysosomes, allowing selective transfer of lysosomal enzymes to the lysosomes and leaving the MPRs behind in subdomains of the late endosomes.'
 'In addition to binding MPRs, the coat proteins recruit clathrin for the assembly of clathrin-coated vesicles. Following delivery to early endosomes, lysosomal enzymes are released from MPRs as the endosomes mature to late endosomes and the pH decreases. Late endosomes then undergo dynamic fusion/fission with lysosomes, allowing selective transfer of lysosomal enzymes to the lysosomes and leaving the MPRs behind in subdomains of the late endosomes. These MPRs may then either return to the TGN mediated by a multiprotein retromer complex or move to the plasma membrane, in which internalization via clathrin-coated pits occurs, mediated by the coat protein AP2. There are several pathways for the MPRs to be returned to the TGN from the various endosomal compartments, although the relative importance of the different pathways is unclear. Subcellular trafficking pathways of glycoproteins, lysosomal enzymes, and M6P receptors (MPRs). Newly synthesized glycoproteins originating from the rough endoplasmic reticulum (ER) pass through the Golgi stacks and are then sorted to various destinations. (more...) The original experiments of Neufeld showed that a portion of newly synthesized lysosomal enzymes are secreted into the medium, but may be recaptured by the same cell or by adjacent cells expressing cell-surface CI-MPRs (Figure 33.1). Enzymes that bind to such cell-surface MPRs are endocytosed via clathrin-coated pits and vesicles, eventually reaching the same late endosomal compartments in which newly synthesized molecules arrive from the Golgi. This secretion–recapture pathway is a minor one in most cells, but plays a critical role in enzyme replacement therapy. As described in Chapter 44, there are many genetic disorders in glycan degradation that result from decreased activity of a given lysosomal enzyme. Some of these enzymes that are targeted to lysosomes via the M6P pathway have been prepared in large quantities as recombinant soluble proteins and used in enzyme replacement therapy. To date, the benefits have been variable but less than optimal. There are a number of potential reasons for this. First, some of the preparations may not contain the physiologic complement of the phosphomannosyl recognition marker. It is reasonable to suggest that a greater M6P content may improve the efficacy of enzyme replacement in these patients. This has been shown to be the case in mouse and dog model systems. However, even with fully phosphorylated enzymes there may be obstacles that are difficult to overcome. For example, some cell types in the body may not express adequate levels of the CI-MPR on their surfaces to endocytose sufficient enzyme to restore normal lysosomal function. Also, the organ that is most seriously affected in many of these diseases (the brain) is inaccessible because of the blood–brain barrier. Although the first intraventricular M6P-dependent enzyme replacement therapy for children deficient for the lysosomal tripeptidyl peptidase 1 are very promising, further studies are needed. Although the MPR pathway has a major role in vertebrate lysosomal enzyme trafficking, its contribution in invertebrate systems is not prominent. Lysosomal enzymes are targeted in organisms such as Saccharomyces, Trypanosoma, and Dictyostelium, without the aid of identifiable MPRs. The slime mold Dictyostelium discoideum produces a novel methylphosphomannose structure on some of its lysosomal enzymes that can be recognized in vitro by the mammalian CI-MPR (not the CD-MPR). However, despite the presence of a GlcNAc-P-T that recognizes α1-2-linked mannose residues, the enzyme does not specifically recognize lysosomal enzymes, and no receptor for M6P has been found in this organism. Additionally, the Dictyostelium GlcNAc-P-T appears to differ from its mammalian hexameric counterpart because sequences related to the γ subunit have not been found in the Dictyostelium genome. The protozoan Acanthamoeba produces a GlcNAc-P-T that specifically recognizes lysosomal enzymes. However, this organism lacks a gene that could encode an “uncovering” enzyme, and so would not be expected to form M6P available to an MPR.'
 'NCBI Bookshelf. A service of the National Library of Medicine, National Institutes of Health. Varki A, Cummings RD, Esko JD, et al., editors. Essentials of Glycobiology [Internet]. 4th edition. Cold Spring Harbor (NY): Cold Spring Harbor Laboratory Press; 2022.  doi: 10.1101/glycobiology.4e.33 Nancy Dahms, Thomas Braulke, and Ajit Varki. Lysosomes are intracellular membrane-bound organelles that turn over and degrade many types of macromolecules, via the action of lysosomal enzymes (also called acid hydrolases because of the low-pH characteristic of lysosomes). These enzymes are synthesized in the endoplasmic reticulum (ER) on membrane-bound ribosomes and traverse the ER–Golgi pathway along with other newly synthesized proteins. At the terminal Golgi compartment, they are segregated from other glycoproteins and selectively delivered to lysosomes. In most “higher” animal cells, this specialized trafficking is achieved primarily through the recognition of N-glycans containing mannose 6-phosphate (M6P) by “P-type” lectins. As the first clear-cut example of a biological role for glycans on mammalian glycoproteins and the first shown link between glycoprotein biosynthesis and human disease, the interesting history of its discovery is described in some detail. More recent data on other proteins with “P-type” lectin domains are also mentioned. Early studies of human genetic “storage disorders” by Elizabeth Neufeld indicated a failure to degrade cellular components, which therefore accumulated in lysosomes (Chapter 44). Soluble corrective factors from normal cells could reverse these defects when added to the culture media. These factors were later identified as lysosomal enzymes that were found to be deficient in patients with storage disorders. These enzymes, secreted in small quantities by normal cells in culture, or by cells from patients with a different “complementary” defect (Figure 33.1), existed in two forms: a “high-uptake” form, recognized by saturable, high-affinity receptors that could correct the defect in deficient cells, and an inactive “low-uptake” form that could not correct. Cross-correction of lysosomal enzyme deficiencies in cultured cells. Small amounts of high-uptake lysosomal enzymes secreted by normal fibroblasts (thin arrows) were taken up by fibroblasts from a patient with a genetic lack of a single lysosomal enzyme, (more...) Fibroblasts from patients with a rare genetic disease showing prominent inclusion bodies in cultured cells (therefore termed “I-cell” disease) were found to be deficient in almost all lysosomal enzymes. Interestingly, all these enzymes are actually synthesized by I-cells, but are mostly secreted into the medium, instead of being retained in lysosomes. Neufeld showed that although I-cells incorporated the high-uptake enzymes secreted by normal cells, enzymes secreted by I-cells were not taken up by other cells (Figure 33.1). She therefore proposed that I-cell disease results from a failure to add a common recognition marker to lysosomal enzymes. This marker was assumed to be responsible for the proper trafficking of newly synthesized enzymes to lysosomes in normal cells. The “high-uptake” property was destroyed by strong periodate treatment, which oxidizes vicinal hydroxyl groups in glycans, predicting that the recognition marker was a glycan. High uptake of lysosomal enzymes was next found, by William Sly, to be blocked by M6P and its stereoisomer fructose 1-phosphate, but not by other sugar phosphates. Treatment of lysosomal enzymes with alkaline phosphatase also abolished high-uptake activity. By this time, the general pathway for N-glycan processing had been defined (see Chapter 9). Because oligomannosyl N-glycans are rich in mannose residues, these were predicted to be phosphorylated on lysosomal enzymes. Indeed, the M6P moiety detected on oligomannosyl N-glycans was released by endo-β-N-acetylglucosaminidase H (endo H) from high-uptake forms of lysosomal enzymes, confirming the hypothesis.']","This secretion-recapture pathway plays a critical role in enzyme replacement therapy. Newly synthesized lysosomal enzymes that are secreted into the medium can be recaptured by the same cell or adjacent cells expressing cell-surface CI-MPRs. These enzymes bind to the cell-surface MPRs, are endocytosed via clathrin-coated pits and vesicles, and eventually reach the same late endosomal compartments where newly synthesized molecules from the Golgi arrive.","This secretion–recapture pathway is a minor one in most cells, but plays a critical role in enzyme replacement therapy. As described in Chapter 44, there are many genetic disorders in glycan degradation that result from decreased activity of a given lysosomal enzyme. Some of these enzymes that are targeted to lysosomes via the M6P pathway have been prepared in large quantities as recombinant soluble proteins and used in enzyme replacement therapy. To date, the benefits have been variable but less than optimal. There are a number of potential reasons for this. First, some of the preparations may not contain the physiologic complement of the phosphomannosyl recognition marker. It is reasonable to suggest that a greater M6P content may improve the efficacy of enzyme replacement in these patients. This has been shown to be the case in mouse and dog model systems. However, even with fully phosphorylated enzymes there may be obstacles that are difficult to overcome. For example, some cell types in the body may not express adequate levels of the CI-MPR on their surfaces to endocytose sufficient enzyme to restore normal lysosomal function. Also, the organ that is most seriously affected in many of these diseases (the brain) is inaccessible because of the blood–brain barrier. Although the first intraventricular M6P-dependent enzyme replacement therapy for children deficient for the lysosomal tripeptidyl peptidase 1 are very promising, further studies are needed.",1.0,0.48638155409766304,0.7431360779477383,0.012048192771084338,0.9999999999666667,0.9166666666666666
"Complete the following paragraph: C-type lectins (CTLs) are Ca++-dependent glycan-binding proteins (GBPs) that share primary and secondary structural homology in their carbohydrate-recognition domains (CRDs). The CRD of CTLs is more generally defined as the CTL domain (CTLD), because not all proteins with this domain bind either glycans or Ca++.","['NCBI Bookshelf. A service of the National Library of Medicine, National Institutes of Health. Varki A, Cummings RD, Esko JD, et al., editors. Essentials of Glycobiology [Internet]. 4th edition. Cold Spring Harbor (NY): Cold Spring Harbor Laboratory Press; 2022.  doi: 10.1101/glycobiology.4e.34 Richard D. Cummings, Elise Chiffoleau, Yvette van Kooyk, and Rodger P. McEver. C-type lectins (CTLs) are Ca++-dependent glycan-binding proteins (GBPs) that share primary and secondary structural homology in their carbohydrate-recognition domains (CRDs). The CRD of CTLs is more generally defined as the CTL domain (CTLD), because not all proteins with this domain bind either glycans or Ca++. CTLs include collectins, selectins, endocytic receptors, and proteoglycans, some of which are secreted and others are transmembrane proteins. They often oligomerize, which increases their avidity for multivalent ligands and enhance recognition of pattern recognition receptor (PRRs). CTLs differ significantly in the types of ligands that they recognize with high affinity (e.g., glycans, proteins, lipids, and inorganic compounds). These proteins that recognize pathogens or self-expressed ligands function as adhesion, phagocytic, and signaling receptors in many pathways, including homeostasis and innate and adaptive immunity, and are crucial in inflammatory responses, leukocyte and platelet trafficking, and tissue remodeling. The CTL family is remarkably diverse and is the largest family of known GBPs. The first CTL identified in animals was the hepatic asialoglycoprotein receptor (ASGPR), also termed the hepatic Gal/GalNAc receptor or Ashwell–Morell receptor (AMR). The sequences of the AMR and other CTLs revealed a CRD unique to this family of proteins. Glycan binding by CTLs is typically Ca++-dependent because of specific amino acid residues that coordinate Ca++ and bind the hydroxyl groups of sugars, but some CTLDs bind glycans without coordinating Ca++. The CTLD is defined by the sequence of amino acids and Cys positions, as well as the folded structure. Interestingly, comparisons of the folded structure of the CTLD to that in other proteins revealed a common folded structure, termed the CTL fold (CTLF), which is a structurally rigid scaffold that comprises a remarkable number of sequence variations, yet may have no sequence in common with CTLs, such as the major tropism determinant (Mtd), which is a receptor-binding protein of Bordetella bacteriophage. The evolutionarily ancient CTLF may occur in at least 1013 different sequences, a diversity that rivals the immunoglobulin fold in its conservation of structure using millions of different primary amino acid sequences. The CRD of CTLs is a compact region of 110–130 amino acid residues with a double-looped, two-stranded antiparallel β-sheet formed by the amino- and carboxy-terminal residues connected by two α-helices and a three-stranded antiparallel β-sheet (Figure 34.1). The CRD has two conserved disulfide bonds and up to four sites for binding Ca++, with site occupancy depending on the lectin. Amino acid residues with carbonyl side chains are often coordinated to Ca++ in the CRD, and these residues directly bind to sugars when Ca++ is bound in site 2. A ternary complex may form between a sugar, the Ca++ ion in site 2, and amino acids within the CRD, whereas the specific residues within the CRD determine sugar specificity. Key conserved residues that bind sugars include the “EPN” motif (which promotes binding to Man, GlcNAc, Fuc, and Glc) and “WND” motif (which promotes binding to Gal and GalNAc), as seen in mouse L-selectin and rat mannose-binding protein C (Figure 34.1). However, because the CTLD is relatively shallow with few contacts to sugars, it is not possible to predict the glycan structures that bind to a particular CTL. In several CTLs, such as P-selectin and the AMR, Ca++ binding induces structural changes in the CRD that stabilize the double-loop region.'
 'However, because the CTLD is relatively shallow with few contacts to sugars, it is not possible to predict the glycan structures that bind to a particular CTL. In several CTLs, such as P-selectin and the AMR, Ca++ binding induces structural changes in the CRD that stabilize the double-loop region. Loss of Ca++ can lead to destabilization of these loops and loss of ligand binding, even when Ca++ is not directly involved in complexing the ligand, as seen in the macrophage mannose receptor. This destabilization is also important in pH-induced changes that lead to loss of ligand-binding affinity, because of the pH-induced loss of Ca++. In CTLD-containing proteins such as human tetranectin, which is not known to bind glycans, the CTLD can bind Ca++, but in the absence of Ca++ the CTLD is important for interactions with kringle-domain-containing proteins, such as plasminogen. Structure of C-type lectins (CTLs). (A) Ribbon diagram of the carbohydrate-recognition domain (CRD) of rat mannose-binding protein A (MBP-A). (Light green spheres) Ca++-binding sites, where 1 is the auxiliary binding site and 2 is the principal binding (more...) CTLs occur as both monomers and oligomers, such as the trimeric rat mannose-binding protein (MBP)-A (Figure 34.2). The rat MBP was the first CTL structurally characterized with ligand by crystallography. The CRD of trimeric lectins is angled to the side of the stalk domain through which the protein associates to form the trimer. The CRDs are at the top of the trimer and enhance multivalent interactions with glycan ligands. Crystal structure of trimeric rat mannose-binding protein-A complexed with α-methylmannoside. (Created from PDB deposited structure 1kwu and with permission of the American Society for Biochemistry and Biology from Ng KK, et al. 2002. J Biol Chem (more...) CTLDs have been categorized into 16 groups that are distinguished by their domain architecture. There are 86 proteins encoded in the human genome that contain a CTLD (mice have 123) (Figure 34.3). Most of these groups have a single CTLD, but the macrophage mannose receptor (group 6) is an example of a multi-CTLD protein and has eight of these domains. Several groups have CTLDs that lack critical Ca++ residues, but can bind glycans (e.g., dectin-1 and layilin in group 5); the REG group 7 lacks Ca++ binding but it is unclear whether they bind glycans, whereas tetranectin in group 9 binds Ca++ and again it is unclear if it binds glycans. From a functional perspective, we know most about collectins, endocytic receptors, myeloid lectins, and selectins, as discussed below. Different groups of C-type lectins (CTLs) and their domain structures. (A) Sixteen groups are shown, defined by their phylogenetic relationships and domain structures. Some of the groups are soluble proteins and others are transmembrane proteins. (B) (more...) CTLF-containing proteins are found in all metazoans and many nonmetazoans. This latter group includes bacterial toxins (e.g., pertussis toxin), outer-membrane adhesion proteins (e.g., invasin from Yersinia pseudotuberculosis), and viral proteins (e.g., envelope protein in Epstein–Barr virus). Interestingly, the viral proteins have more similarity to mammalian CTLD-containing proteins than the bacterial proteins. There are at least 278 genes encoding CTLDs within the genome of Caenorhabditis elegans, but only a small number have the key amino acid residues required to form the primary Ca++ binding site. The AMR is expressed primarily on the sinusoidal surface of hepatocytes and was discovered serendipitously during studies on clearance of the serum glycoprotein ceruloplasmin, a major copper carrier in mammalian plasma.'
 'Carboxy-terminal proteolysis of PC1 during its secretion releases a cytoplasmic portion that becomes nuclear and regulates cell signaling pathways. Interestingly, the CTLD of PC1 appears to bind collagen in a Ca++-dependent fashion that is inhibitable by sugars, including dextrans, but the precise nature of the interaction is still unclear. Some small proteins with CTLDs include Reg3α and PSP (pancreatic stone protein), which are in the REG group 7 of CTLs, and are essentially isolated CTLDs that are preceded by a signal sequence. Reg3α (also known as HIP/PAP) is a secreted CTL that an amino-terminal signal sequence and a 16 kDa CTLD. Reg3α is an anti-inflammatory protein with scavenging activity toward ROS and can bind peptidoglycan and directly kill Gram-positive, but not Gram-negative, bacteria. Reg3α kills bacteria by first binding to peptidoglycan and then binding to membrane phospholipids and forms a hexameric membrane-permeabilizing oligomeric pore. Lower vertebrates, invertebrates, and some viruses also contain CTLDs. The galactose-specific lectin from Crotalus atrox binds a variety of galactose-containing glycolipids in a Ca++-dependent fashion. A number of related venom proteins inhibit platelet function and/or the coagulation cascade. Alboaggregin A from the white-lipped pit viper (Trimeresurus albolabris) binds to the platelet GPIb-V-IX complex and stimulates platelet agglutination, but the potential role of glycan recognition in this process is unclear. In contrast, the gp42 protein of Epstein–Barr virus (EBV) has a CTLD that is NK-receptor like, and ectodomain of the poxvirus (Poxviridae) protein A33, a target of subunit vaccine development, has two CTLDs in dimeric form, and has resemblance to the CTLDs of the NK lectins. But, neither of these domains in these viral proteins binds either Ca++ or glycans, and may have evolved by convergent evolution. The authors acknowledge the helpful comments of Robert Sackstein.']","CTLs include collectins, selectins, endocytic receptors, and proteoglycans, some of which are secreted and others are transmembrane proteins. They often oligomerize, which increases their avidity for multivalent ligands and enhance recognition of pattern recognition receptor (PRRs). CTLs differ significantly in the types of ligands that they recognize with high affinity (e.g., glycans, proteins, lipids, and inorganic compounds). These proteins that recognize pathogens or self-expressed ligands function as adhesion, phagocytic, and signaling receptors in many pathways, including homeostasis and innate and adaptive immunity, and are crucial in inflammatory responses, leukocyte and platelet trafficking, and tissue remodeling. The CTL family is remarkably diverse and is the largest family of known GBPs.","CTLs include collectins, selectins, endocytic receptors, and proteoglycans, some of which are secreted and others are transmembrane proteins. They often oligomerize, which increases their avidity for multivalent ligands and enhance recognition of pattern recognition receptor (PRRs). CTLs differ significantly in the types of ligands that they recognize with high affinity (e.g., glycans, proteins, lipids, and inorganic compounds). These proteins that recognize pathogens or self-expressed ligands function as adhesion, phagocytic, and signaling receptors in many pathways, including homeostasis and innate and adaptive immunity, and are crucial in inflammatory responses, leukocyte and platelet trafficking, and tissue remodeling. The CTL family is remarkably diverse and is the largest family of known GBPs.",1.0,0.6589893063485766,1.0000000000000004,0.014705882352941176,0.9999999999666667,1.0
"Complete the following paragraph: Of all the Siglecs, CD22 has the most conserved specificity for sialylated ligands, binding primarily to α2-6-linked Sias of the type Neu5Ac(or Neu5Gc)α2-6Galβ1-4GlcNAc, which are common capping structures of many complex-type N-glycans. Additional specificity can be conferred by the nature of the Sia moiety as well as sulfation of the underlying glycan. Neither human nor mouse CD22 binds 9-O-acetylated Sias; mouse CD22 has a strong preference for Neu5Gc over Neu5Ac, whereas human CD22 binds both of the latter forms.","['CD22 has seven Ig-like domains and the intracellular region has six tyrosine-based signaling motifs, three of which could function as ITIMs. CD22 is a well-established negative regulator of B-cell activation, making an important contribution toward the threshold for signaling via the B-cell receptor (BCR) complex. Following BCR cross-linking, CD22 is rapidly tyrosine-phosphorylated on its ITIMs by the protein tyrosine kinase Lyn. This leads to recruitment and activation of the SHP-1 tyrosine phosphatase and subsequent inhibition of downstream signaling mediated via the BCR. Although some activating molecules are also recruited to the phosphorylated tyrosine motifs in CD22, the net phenotype of CD22-deficient mice is consistent with a primary role of CD22 in negative regulatory signaling, manifested by enhanced BCR-induced calcium signaling, enhanced B-cell turnover, reduced numbers of recirculating B cells in the bone marrow, and reduced numbers of marginal zone B cells. Of all the Siglecs, CD22 has the most conserved specificity for sialylated ligands, binding primarily to α2-6-linked Sias of the type Neu5Ac(or Neu5Gc)α2-6Galβ1-4GlcNAc, which are common capping structures of many complex-type N-glycans. Additional specificity can be conferred by the nature of the Sia moiety as well as sulfation of the underlying glycan. Neither human nor mouse CD22 binds 9-O-acetylated Sias; mouse CD22 has a strong preference for Neu5Gc over Neu5Ac, whereas human CD22 binds both of the latter forms. Recombinant soluble CD22 can precipitate a subset of glycoproteins from B-cell lysates including CD45, a major sialoprotein of T and B cells. However, on B cells, CD22 appears to mainly be either cis-associated with other CD22 molecules in a glycan-dependent manner, or with the BCR, which it inhibits in a glycan-independent manner. These interactions are consistent with studies of mouse mutants that either lack CD22 glycan ligands or express mutated forms of CD22 unable to bind glycans. B cells from ST6Gal-I-deficient mice that lack CD22 ligands show an anergic phenotype, essentially the opposite of the phenotype observed in CD22-deficient mice. Mice expressing a lectin-inactive version of CD22 with a mutated binding site arginine also show reduced BCR signaling (anergy) and, similar to ST6Gal-I-deficient mice, they show increased CD22-BCR association and stronger CD22 phosphorylation (Figure 35.3). Likewise, Cmah-null mice deficient in Neu5Gc have reduced ligands for mouse CD22 and Siglec-G (see below) and show B cell hyperactivity. Proposed biological functions mediated by CD22. CD22 glycan-dependent homotypic interactions in equilibrium with CD22–BCR interactions. CD22 is clustered together by Sia-dependent homotypic interaction and kept away from BCR on wild-type B cells, (more...) Besides regulating B-cell functions via cis-interactions, CD22 can also mediate trans-interactions with sialylated ligands on other cells that sequester CD22 away from the BCR. This could be important for raising B-cell activation thresholds to “self”-antigens and may help to ensure that signaling through the BCR can only occur in lymphoid tissues in which CD22 α2-6-sialylated ligands are abundant. Although CD22-deficiency alone does not lead to extensive autoimmune reactions, mice deficient in both CD22 and the other major B-cell Siglec, Siglec-G, develop SLE-like symptoms, including production of IgG autoantibodies and glomerulonephritis. The restricted expression and properties of CD22 make it an attractive therapeutic target. Antibody-based CD22-targeting agents, such as antibody–drug conjugate inotuzumab ozogamicin and recombinant antibody–toxin fusion protein moxetumomab pasudotox, have been approved for clinical use (for acute B-cell leukemia and hairy cell leukemia, respectively).'
 'Structural basis of Siglec binding to ligands. X-ray crystal structures of the V-set domains of sialoadhesin (Sn) (A) and Siglec-7 (B) are shown complexed with sialic acid. (C,D) Molecular details of the interactions of sialic acid with Sn and Siglec-7. (more...) The cell-surface glycocalyx of most vertebrate cells is richly decorated in glycoconjugates that contain Sias (Chapter 15). The high local concentration of Sias is likely to greatly exceed the Kd value of each Siglec, resulting in self-binding to sialoglycans on the same membrane (cis) that can be directly functional or that can “mask” the Sia-binding site from interacting with sialoglycans on other cells (trans). Consequently, the Sia-dependent binding activity of most naturally expressed Siglecs is strongly enhanced following treatment of cells with sialidase to eliminate the cis-interacting sialylated glycans. A notable exception is Sn, which was discovered via its native property as a Sia-dependent cell-adhesion molecule on macrophages. The “masked” state of most Siglecs is a dynamic equilibrium with multiple cis ligands. Thus, an external probe, a cell surface or a pathogen bearing high-affinity ligands or very high densities of Sia residues, can effectively compete for binding to “masked” Siglecs. In addition, changes in expression of glycosyltransferases or sialidases of endogenous or exogenous origin could influence masking and unmasking of Siglecs at the cell surface, especially during immune and inflammatory responses. Siglecs show restricted patterns of expression in single or related cell types (see below). This is most striking for the conserved Siglecs—Sn (macrophage), CD22 (B lymphocyte), MAG (myelin-forming cell), and Siglec-15 (osteoclast). This theme extends to some of the CD33rSiglecs, most notably in humans, including Siglec-6 on placental trophoblasts, Siglec-7 on NK (natural killer) cells, and Siglec-11 and -16 on tissue macrophages, including brain microglia in humans. In the mouse, Siglec-H and CD33 are excellent markers of plasmacytoid dendritic cells (DCs) and blood neutrophils, respectively, and Siglec-F is a useful marker of eosinophils and alveolar macrophages. These cell type–restricted expression patterns are thought to reflect discrete, cell-specific functions mediated by each of these Siglecs. However, certain key cells of the human immune system, such as monocytes and conventional DCs, express multiple CD33rSiglecs. Most Siglecs have one or more tyrosine-based signaling motifs in their cytoplasmic tails or associate with membrane adaptor proteins containing cytosolic tyrosine motifs. The most prevalent motif is the ITIM with the consensus sequence (V/I/L)XYXX(L/V), where X is any amino acid. Up to 300 ITIM-containing membrane proteins are identified in the human genome, and many of these are established inhibitory receptors of the hematopoietic and immune systems. Following tyrosine phosphorylation by Src family kinases, they function by recruiting and activating SH2-domain-containing effectors, especially the protein tyrosine phosphatases SHP-1 and SHP-2. These counteract activating signals triggered by receptors containing ITAMs. Some Siglecs, notably Siglecs-14, -15, -16, and -H and mouse CD33, have a positively charged residue within the transmembrane region, which can associate with the DAP12 ITAM-containing adaptor, thereby mediating activating functions. Sn (CD169) was identified as a Sia-dependent sheep erythrocyte receptor expressed by mouse stromal macrophages. Sn has an unusually large number of Ig domains (seventeen), which are conserved among mammals and reptiles. These may be important for extending the Sia-binding site away from the plasma membrane to promote intercellular interactions.'
 'ICAM-1 plays crucial roles in cell–cell interactions, extravasation, inflammation, and host defense. Hemolin is an IgSF plasma protein from lepidopteran insects that binds lipopolysaccharide (LPS) from Gram-negative bacteria and lipoteichoic acid from Gram-positive bacteria. Hemolin appears to have two binding sites for LPS—one that interacts with the phosphate groups of lipid A and another that interacts with the O-specific glycan antigen and the outer-core glycans of LPS. There is indirect and less convincing evidence for interactions of other IgSF molecules with glycans, such as the peripheral myelin protein P0 with HNK-1, CD83 with Sias, and CD2 with Lewis x (Lex). Overall, with the exception of the Siglecs and the PILRs, the direct assignment of an IgSF fold as the actual binding pocket for glycans has not been achieved. The rest of this chapter is devoted to Siglecs, the best-characterized I-type lectins. All Siglecs are type-1 membrane proteins with a Sia-binding, amino-terminal V-set domain and varying numbers of C-set Ig domains that act as spacers, projecting the Sia-binding site away from the plasma membrane. The V-set domain and the adjacent C-set domain contain a small number of invariant amino acid residues, including an “essential” arginine on the F β-strand required for Sia binding, and an unusual organization of cysteine residues. Instead of the typical intersheet disulfide bond between the B and F β-strands, the V-set domain of Siglecs displays an intrasheet disulfide bond between the B and E β-strands, permitting increased separation between the β-sheets. The resulting exposure of hydrophobic residues allows specific interactions with constituents of Sia ligands. All Siglecs studied so far also appear to contain an additional unusual disulfide bond between the V-set domain and the adjacent C-set domain, which would be expected to promote tight packing at the interface between the first two Ig domains. Although the significance of this bond for ligand recognition is unclear, optimal Sia-binding activity of many Siglecs requires the adjacent C-set domain, probably for correct folding and stability. Three-dimensional structures for the mouse Sn, human Siglec-7, and human CD33 V-set domains, the V-set and adjacent C-set domain of Siglec-5, first three Ig-like domains of human CD22, and all five Ig-like domains of mouse MAG have been determined by X-ray crystallography, in the presence and absence of Sia ligands (Figure 35.2). Along with the nuclear magnetic resonance (NMR) structure of Siglec-8, structural templates for Sia recognition by Siglecs appear to be shared among Siglecs. In all instances, an “essential” arginine residue is located in the middle of the F β-strand, making a bidentate salt bridge with the carboxylate of Sia. Siglecs also contain conserved hydrophobic amino acids on the A and G β-strands that interact with the N-acetyl group and glycerol side chain of Sia, respectively. Although all Siglecs appear to use a common template for recognizing Sias, their binding preferences for extended glycan chains vary greatly. The peptide loop between the C and C′ β-strands is highly variable among Siglecs and has a key role in determining their fine sugar specificity. For example, molecular grafting of the C–C′ loop between Siglec-7 and Siglec-9 resulted in switched sugar-binding specificities. Structural studies have shown that this loop appears to be highly flexible, being able to make specific and varied interactions with long glycan chains. In addition, V-set domain sequences are the most rapidly evolving regions in these molecules, likely explaining species differences in binding specificity. Structural basis of Siglec binding to ligands. X-ray crystal structures of the V-set domains of sialoadhesin (Sn) (A) and Siglec-7 (B) are shown complexed with sialic acid. (C,D) Molecular details of the interactions of sialic acid with Sn and Siglec-7. (more...) The cell-surface glycocalyx of most vertebrate cells is richly decorated in glycoconjugates that contain Sias (Chapter 15).']","CD22 has a strong preference for Neu5Gc over Neu5Ac, binding primarily to α2-6-linked Sias of the type Neu5Ac(or Neu5Gc)α2-6Galβ1-4GlcNAc. Additional specificity can be conferred by the nature of the Sia moiety as well as sulfation of the underlying glycan. Neither human nor mouse CD22 binds 9-O-acetylated Sias.","Recombinant soluble CD22 can precipitate a subset of glycoproteins from B-cell lysates including CD45, a major sialoprotein of T and B cells. However, on B cells, CD22 appears to mainly be either cis-associated with other CD22 molecules in a glycan-dependent manner, or with the BCR, which it inhibits in a glycan-independent manner. These interactions are consistent with studies of mouse mutants that either lack CD22 glycan ligands or express mutated forms of CD22 unable to bind glycans. B cells from ST6Gal-I-deficient mice that lack CD22 ligands show an anergic phenotype, essentially the opposite of the phenotype observed in CD22-deficient mice. Mice expressing a lectin-inactive version of CD22 with a mutated binding site arginine also show reduced BCR signaling (anergy) and, similar to ST6Gal-I-deficient mice, they show increased CD22-BCR association and stronger CD22 phosphorylation (Figure 35.3). Likewise, Cmah-null mice deficient in Neu5Gc have reduced ligands for mouse CD22 and Siglec-G (see below) and show B cell hyperactivity.",1.0,0.7343869484704314,0.6909686965129629,0.04,0.9999999999666667,1.0
"Complete the following paragraph: Following the discovery of the Ashwell–Morell asialoglycoprotein receptor (AMR) in the liver, many investigators sought other such receptors by affinity chromatography with immobilized asialoglycoproteins. In 1975, a novel lectin of ∼15 kDa was isolated from electric organs of the electric eel, and named “electrolectin.” This noncovalently linked homodimer displayed hemagglutinating activity toward trypsinized rabbit erythrocytes that was inhibitable by β-galactosides; inclusion of β-mercaptoethanol in the isolation buffers was required to maintain the binding activity.","['Interestingly, the viral proteins have more similarity to mammalian CTLD-containing proteins than the bacterial proteins. There are at least 278 genes encoding CTLDs within the genome of Caenorhabditis elegans, but only a small number have the key amino acid residues required to form the primary Ca++ binding site. The AMR is expressed primarily on the sinusoidal surface of hepatocytes and was discovered serendipitously during studies on clearance of the serum glycoprotein ceruloplasmin, a major copper carrier in mammalian plasma. Glycosylation of ceruloplasmin was found to regulate its lifetime in the rabbit circulation; enzymatic desialylation of radiolabeled ceruloplasmin exposed penultimate β-linked Gal residues and caused rapid accumulation of asialoceruloplasmin into hepatocytes. Removal or modification of the exposed Gal residues lessened the rate of clearance. In 1974, the Ca++-dependent AMR was purified from rabbit liver by affinity chromatography on asialoorosomucoid-Sepharose. The rabbit AMR is a heterooligomer containing two subunits of 48 kDa and 40 kDa, whereas the human AMR contains two subunits of 50 kDa (H1) and 46 kDa (H2) that occur as a heterooligomeric type I transmembrane protein (trimers and high-order oligomers) comprised of small and large subunits. The purified rabbit AMR agglutinated desialylated human and rabbit erythrocytes and induced mitogenesis in desialylated peripheral lymphocytes, which represented the first demonstration that an animal GBP could profoundly affect cellular metabolism. Interestingly, hepatic AMR can also recognize some sialylated ligands (Siaα2-6Galβ1-4GlcNAc-R). A homologous GBP identified in chicken hepatocytes recognizes glycoproteins containing terminal GlcNAc, rather than Gal, residues. Interestingly, circulating glycoproteins in birds constitutively lack sialic acid (Sia) compared with their mammalian counterparts. The AMR was one of the first proteins shown to participate in receptor-mediated endocytosis (RME) and, along with the low-density lipoprotein (LDL) receptor, transferrin receptor, and mannose 6-phosphate receptor (M6PR), represents some of the best characterized receptors. The AMR internalizes its ligands captured at the cell surface at physiological pH; via coated pits, the AMR in complex with its ligand is internalized into coated vesicles (Figure 34.4), and changes in pH in late endosomes lead to dissociation of Ca++ from the AMR and release of ligand. The uncomplexed AMR then recycles to the plasma membrane, whereas the ligand is delivered to lysosomes where it is degraded. For some nonrecycling receptors (e.g., dendritic cell [DC]-specific intercellular adhesion molecule-3-grabbing nonintegrin [DC-SIGN]), both the ligand and receptor are targeted to lysosomes and degraded. Internalization of ligands by the AMR in hepatocytes is rapid, occurring in 2–3 minutes, and the receptor recycles to the surface within 4–5 minutes. The efficiency of the AMR in endocytosis has led it to be a target for gene therapy and delivery of molecules to hepatocytes. Some C-type lectins (CTLs) are endocytic receptors. Ligands are internalized by clathrin-dependent pathways and delivered to early and then late endosomes. Receptors may be recycled or degraded, depending on the receptor and the type of ligand it endocytoses. (more...) The precise orientation of the trimers within the AMR can dictate its affinity to specific glycans that have multivalent presentations. The AMR binds glycans with terminal β-linked Gal or GalNAc residues; however, tri- and tetra-antennary N-glycans, with appropriate branching and presentation of nonreducing terminal Gal/GalNAc, bind to the rat AMR with >100,000× higher affinity (∼nm range) than ligands with a single terminal Gal/GalNAc residue. Surprisingly, mice null for the AMR were found to be phenotypically normal without challenge.'
 'Lectins and antibodies are useful for characterizing cell-surface glycans when limited numbers of cells are available. Studies on glycosylation of embryonic stem cells have been greatly aided by using panels of specific lectins to identify unique glycan determinants and changes in their expression during cellular differentiation. A recent variation of this approach is to use a microarray of immobilized lectins, which are probed with fluorescently labeled glycoproteins in extracts of cells. Such assays can reveal minor differences in protein glycosylation between different samples and give insight into the glycan structures that are present. One of the oldest uses of lectins is in the agglutination and precipitation of glycoconjugates, cells, and membrane vesicle preparations. The easiest assay for many soluble lectins that are multivalent is agglutination of target cells, such as erythrocytes, leukocytes, or even bacteria or fungi. Agglutination can often be easily observed without a microscope, but it is also measurable in instruments such as aggregometers. In these assays, a lectin solution is serially diluted and the reciprocal of the final dilution that gives measurable cell agglutination is taken to define the activity. Bacterial agglutination by plant and animal lectins is often used to explore the surface glycocalyx and changes in glycocalyx on culture conditions and to define phenotypes of different strains or serotypes. Lectin precipitation and aggregation can be used to define the glycan composition and overall architecture of polysaccharides, as has been done for bacterial, algal, plant, and animal polysaccharides. Combining many different GRP, including lectins and antibodies, into a lectin microarray is another way in which the glycome of cells may be explored. Such arrays have dozens of specific proteins immobilized in a microarray format and can provide valuable information about the glycosylation status of cells and glycoconjugates. Fluorescent-tagged glycoproteins from a source (e.g., cell or tissue extracts) can be applied to these arrays and the binding pattern compared to a control sample can reveal features of the glycome of the material, such as patterns of sialylation, fucosylation, and even linkages of residues with glycans using linkage-specific reagents. The advantages of this approach is the microscale in which it can be performed, the relatively high-throughput nature of the technology, and the precision of discrimination in terms of differential glycosylation between two samples. The system is particularly adaptable to include new reagents as they become available (e.g., new lectins or engineered proteins). An important use of lectins and antibodies has been in the selection of cell lines (e.g., Chinese hamster ovary [CHO] cells) that express altered cell-surface glycans. The common lectins that have been used are ConA, WGA (wheat germ agglutinin), L-PHA, LCA, PSA (Pisum sativum agglutinin), E-PHA, ricin, modeccin, and abrin. The latter three lectins are heterodimeric, disulfide-bonded proteins that are classified as type-II ribosome-inactivating proteins; they contain an A subunit that constitutes an enzyme called RNA-N-glycosidase, which inactivates the 28S ribosome, and a B subunit that is a galactose-binding lectin (Chapter 31). Other plant lectins such as ConA, WGA, or LCA (which lack an enzymatic or toxic A subunit) are still toxic to animal cells via poorly understood mechanisms, whereas yet others, such as soybean agglutinin (SBA) and peanut agglutinin (PNA), are not highly toxic to animal cells in culture. One mechanism of toxicity of plant lectins is the induction of apoptosis, perhaps by blocking receptor or nutrient transport functions in cells, or by cross-linking apoptotic receptors. Noncytotoxic lectins and antibodies to specific glycans can be rendered toxic by conjugation to ricin A subunit or other toxic proteins. Using such agents, both loss-of-function (e.g., loss of a glycosyl-transferase or glycosidase) and gain-of-function (e.g., activation of a latent transferase gene) mutants have been obtained.'
 'The AMR binds glycans with terminal β-linked Gal or GalNAc residues; however, tri- and tetra-antennary N-glycans, with appropriate branching and presentation of nonreducing terminal Gal/GalNAc, bind to the rat AMR with >100,000× higher affinity (∼nm range) than ligands with a single terminal Gal/GalNAc residue. Surprisingly, mice null for the AMR were found to be phenotypically normal without challenge. However, it is now known that the AMR is required to clear platelets (thrombocytes) during Streptococcus pneumoniae–related sepsis, which is accompanied by microbial-dependent desialylation of platelets and consequent thrombocytopenia. Clearance helps to limit disseminated intravascular coagulation (DIC) caused by the infection. Such clearance of platelets during sepsis or as a result of platelet aging is also linked to production of thrombopoietin that regulates platelet production. Many other CTLs, both type I and type II transmembrane proteins, also deliver bound ligands to lysosomes via RME through their cytoplasmic motifs (Figure 34.4). Endocytosis of ligands by CTLs in DCs and macrophages can lead to receptor accumulation and degradation in phagolysosomes or to recycling of the receptor to the cell surface. The pathway taken is dependent on the bound ligand. Dectin-1 is degraded when it internalizes zymosan, but it is recycled when it endocytoses soluble ligands. Stimulation of CTLs such as dectin-1 in myeloid cells activates mitogen-activated protein kinase (MAPK) and nuclear factor-κB (NF-κB), and enhances transcription of genes important in innate immune responses. Internalization of antigens via the CTLs in DCs induces production of reactive oxygen species (ROS) and other responses. CLEC9A (DNGR-1) and the mannose receptor divert cargo away from lysosomal compartments to allow retrieval of antigens for cross-presentation. Clustering and density of the CTLDs may determine both their specificity and their affinity for ligands because each individual CRD can act independently to bind sugar. Although the hepatic lectins subunits have a single CTLD, the macrophage mannose receptor has eight CTLDs in a single polypeptide. The adjacent CTLDs may promote binding to specific multivalent, mannose-containing glycans. The macrophage mannose receptor internalizes lysosomal enzymes containing oligomannose-type N-glycans and facilitates phagocytosis of several pathogens such as yeast, Pneumocystis carinii, and Leishmania. Interestingly, domains in some CTLs outside of the CTLD may also have receptor activity. For example, the cysteine-rich domain of the mannose receptor is an R-type domain (Chapter 31) that binds to glycans containing R-GalNAc-4-SO4 on pituitary glycoprotein hormones and thus acts to clear these hormones from the circulation. The collectins are a family of soluble and membrane-bound CTLs that contain a collagen-like domain amino-terminal to the CTLD and usually assemble in large oligomeric complexes containing 9–27 subunits (Figure 34.3). Bovine conglutinin was identified in the early 1900s by Bordet and Streng as a plasma protein that agglutinated erythrocytes following reactions with antibody and complement, now known to be through Ca++-dependent interactions with the exposed glycans on iC3b after proteolytic conversion from C3b. Bovine conglutinin and human conglutinin bind yeast glycans, and GlcNAc can inhibit interactions. The term conglutinin was coined in 1993 based on evidence that conglutinin had a collagen-like sequence and exhibited lectin activity. To date, nine different collectins have been identified: conglutinin, mannose-binding lectin (MBL), surfactant proteins SP-A and SP-D (which were originally found in the lung but also expressed in the intestine), and collectins CL-43, CL-46, CL-P1, CL-L1, and CL-K1.']","In 1975, a novel lectin of ∼15 kDa was isolated from electric organs of the electric eel, and named “electrolectin.” This noncovalently linked homodimer displayed hemagglutinating activity toward trypsinized rabbit erythrocytes that was inhibitable by β-galactosides; inclusion of β-mercaptoethanol in the isolation buffers was required to maintain the binding activity.","Soon thereafter, in 1976, similar β-galactoside-binding lectins were isolated from chicken muscle and from extracts of calf heart and lung (∼15 kDa; now designated as galectin-1). These proteins were initially referred to as S-type lectins to denote their sulfhydryl dependency, presence of free cysteine residues, and solubility, along with shared primary sequence. In the early 1980s, a 35-kDa protein termed CBP35 that also bound to β-galactosides was identified in mouse fibroblasts. The same protein was studied by other groups under the names IgE-binding protein, L-29, and L-31 and is currently known as galectin-3. The nomenclature for galectins was systematized in 1994 and the first galectin type found (∼15 kDa, discussed above) retained the name galectin-1. All other members of this family were numbered consecutively by order of discovery.",0.0,0.6790914951523539,0.5738280692556323,0.028985507246376812,0.9999999999666667,1.0
"Complete the following paragraph: Examination of a high-resolution, three-dimensional structure of FimH bound to mannose revealed that, although mannose exists as a mixture of α and β anomers in solution, only the former was found in the complex. Mannose binds FimH at a deep and negatively charged site of FimH (Figure 37.4). FimH has “catch-bond” properties, such that the binding strength of individual FimH adhesins is augmented by increasing the shear forces on surface-bound E. coli cells.","[""The envelope protein monomer is shown in ribbon form, displayed along its longitudinal axis and as an external side view. Note the alignment of positively (more...) Bacterial lectins occur commonly in the form of elongated multisubunit protein appendages, known as fimbriae (hairs) or pili (threads), which interact with glycoprotein and glycolipid receptors on host cells. Similar to viral glycan-binding proteins, adhesin-receptor binding is generally of low affinity. Because the adhesins and the receptors often cluster in the plane of the membrane, the resulting combinatorial avidity can be great. An analogy for adhesin–receptor binding is the interaction of the two faces of Velcro strips. The most well-characterized bacterial lectins include the mannose-specific type-1 fimbriae, the galabiose-specific P fimbriae, and the N-acetylglucosamine-binding F-17 fimbriae, which are produced by different strains of Escherichia coli. Fimbriated bacteria express 100 to 400 of these appendages, which typically have a diameter of 5–7 nm and can extend hundreds of nanometers in length (Figure 37.3) Thus, pili extend well beyond the bacterial glycocalyx comprised of lipopolysaccharide and capsular polysaccharides (see Chapter 21). Escherichia coli express hundreds of pili, as indicated by the fine filaments extending from the bacterium. (Reprinted, with permission of Elsevier, from Sharon N. 2006. Biochim Biophys Acta 1760: 527–537; courtesy of David L. Hasty, University (more...) Examination of a high-resolution, three-dimensional structure of FimH bound to mannose revealed that, although mannose exists as a mixture of α and β anomers in solution, only the former was found in the complex. Mannose binds FimH at a deep and negatively charged site of FimH (Figure 37.4). FimH has “catch-bond” properties, such that the binding strength of individual FimH adhesins is augmented by increasing the shear forces on surface-bound E. coli cells. This is relevant for urinary tract infections, in which type-1 fimbriae mediate binding of the bacteria to the glycoprotein uroplakin Ia on the surface of bladder epithelial cells. Uroplakin Ia presents high levels of terminally exposed mannose residues that are capable of specifically interacting with FimH. Alternatively, type-1 fimbriae can bind to high mannose glycans on the soluble urinary Tamm–Horsfall glycoprotein/uromodulin, that forms long fibers. The resulting bacterial aggregates are flushed out of the urinary tract. Mice lacking the gene encoding the Tamm–Horsfall glycoprotein are considerably more susceptible to bladder colonization by type-1-fimbriated E. coli than normal mice. The α anomer of mannose in the binding site of FimH. The mannose residue is buried in a unique site at the tip of the carbohydrate-recognition domain (left) in a deep and negatively charged pocket (right). FimH prefers to bind D-mannose in the (more...) Most bacteria (and possibly other microorganisms) have multiple adhesins with diverse carbohydrate specificities. Many of these have been described (examples in Table 37.2), wherein the specificity of lectin binding can help define the range of susceptible tissues in the host (i.e., the microbe's ecological niche). The columnar epithelium that lines the large intestine expresses receptors with Galα1–4Gal-Cer residues, whereas cells lining the small intestine do not. Thus, Bacterioides, Clostridium, E. coli, and Lactobacillus only colonize the large intestine under normal conditions. P-fimbriated E. coli and some toxins bind specifically to galabiose (Galα1–4Gal) and galabiose-containing oligosaccharides, most commonly as constituents of glycolipids. Binding can occur to either internal (i.e., when the disaccharide is capped by other sugars) or terminal nonreducing galabiose units.""
 ""Both receptors bind with highest affinity to glycans carrying two M6P residues (Figure 33.2, structure C) whereas only the CI-MPR interacts with molecules bearing GlcNAc-P-Man phosphodiesters (Figure 33.2, structures A and B). Binding to molecules carrying one M6P (Figure 33.2, structure D) is intermediate in affinity. Removal of outer mannose residues by processing Golgi mannosidases enhances binding. Genes encoding both MPRs have been cloned and extensively characterized. Both are type I transmembrane glycoproteins with extracytoplasmic, transmembrane, and carboxy-terminal cytoplasmic domains. The CI-MPR has 15 contiguous repetitive units of ∼145 amino acids with partial identity to one another. The CD-MPR has a single extracellular domain, showing homology with the repeating domains of the CI-MPR (Figure 33.4A). Together with conservation of certain intron–exon boundaries, this homology suggests that the two genes evolved from a common ancestor. On the basis of their sequence relationships and unique binding properties to M6P, the two MPRs have been formally classified as P-type lectins. Structural homologs of the MPRs are present in yeast and Drosophila, but these proteins lack M6P-binding ability. (A) Schematic diagram of cation-independent (CI-MPR) and cation-dependent mannose 6-phosphate receptors (CD-MPR). (B) Ribbon diagram of the bovine CD-MPR. Shown are the two monomers (magenta and cyan ribbons) of the dimer as well as the ligand M6P (gold (more...) The CD-MPR exists mainly as a dimer, with each monomer binding one M6P residue. The CI-MPR also seems to be a dimer in the membrane, although it readily dissociates on solubilization. Two of its repeating units (3 and 9) bind M6P phosphomonoesters with high affinity, a third (5) binds M6P phosphodiesters, and a fourth (15) binds both M6P phosphomonoesters and diesters with equal affinity. Mutagenesis studies have identified the specific residues of these receptors involved in M6P binding, and crystal structures of several M6P-binding domains have been obtained in complex with M6P. Comparison of the binding pockets reveals four residues (Gln, Arg, Glu, Tyr) are positionally conserved and form the same contacts with the mannose ring. The CD-MPR has been crystallized as a dimer, with each monomer folded into a nine-stranded flattened β-barrel that has a striking resemblance to the protein folds in avidin (Figure 33.4B). The distance between the two ligand-binding sites of the dimer provides a good explanation for the differences in binding affinity shown by the CD-MPR toward various lysosomal enzymes. Crystal structures of recombinant forms of the CI-MPR have also been solved that encompass all but two of the 15 contiguous domains in its extracellular region (i.e., domains 1–5, domains 7–11, and domains 11–14). Each domain shows a topology similar to that of the CD-MPR. Cryo-electron microscopy (cryo-EM) of the CI-MPR isolated from bovine liver has been carried out under conditions: (1) not conducive to ligand binding (pH 4.5), and (2) found at the cell surface (pH 7.4) and bound to the non-glycosylated ligand, insulin-like growth factor II (IGF-II) via CI-MPR's domain 11. Although the cryo-EM structure at pH 7.4 is unable to visualize the N- (domains 1–3) and C- (domain 15) termini with sufficient resolution, it does provide insight into the arrangement of the entire extracellular region of the CI-MPR. The proposed cryo-EM model does not position the two M6P-binding domains (3 and 9) sufficiently close to bind a single, diphosphorylated N-glycan.""
 'The heparin fragment ([GlcNS6Sα1-4IdoA2Sα1-4]3) was helical and bound to a turn-rich heparin-binding site on the surface of FGF2. Only one N-sulfo group and the 2-O-sulfo group from the adjacent iduronic acid are bound to the growth factor in the turn-rich binding domain, and the next GlcNS residue is bound to a second site, consistent with the minimal binding sequence determined with oligosaccharide fragments. Unlike antithrombin–heparin interaction, no significant conformational change in FGF2 occurs on heparin binding. The crystal structure of acidic FGF (FGF1) has also been solved and shows similar sequences on its surface. However, the oligosaccharide sequence that binds with high affinity to FGF1 contains 6-O-sulfo groups. Crystal and solution structures of GAG–protein complexes. (A) Crystal structure of the FGF2–hexasaccharide complex (PDB: 1BFC). Key interactions between the hexasaccharide and FGF2 are shown in black dotted lines. The hexasaccharide is (more...) The cocrystal structure of the complex of (FGF2-FGFR)2, first solved in the absence of heparin/HS ligand, showed a canyon of positively charged amino acid residues, suggestive of an unoccupied heparin-binding site. Subsequently, the heparin–oligosaccharide-containing complex was solved after introduction of heparin oligosaccharides, suggesting a 2:2:2 complex of FGF2:FGFR1:HS (Figure 38.3). Another important feature of this complex is the orientation of the nonreducing ends of the HS chains that terminate in an N-sulfoglucosamine residue, which arises by endolytic cleavage of chains by the enzyme heparanase (Chapter 17). The structure of the FGF1–FGFR2–HS complex is not without controversy; structural analysis of complexes formed in solution and purified by gel filtration has suggested a very different structure consisting of a 2:2:1 complex (Figure 38.3). Chemokines are another class of proteins exhibiting strong interactions with GAGs. However, these interactions do not directly affect activities of inhibitors or signaling molecules as in previous examples. Instead, they stabilize chemotactic gradients of chemokines; these gradients, in turn, direct leukocytes to sites of injury or infection. They may also facilitate cell migration through the endothelial layer of the blood vessels in which they circulate. This is no easy task; blood is flowing rapidly in these vessels and would easily destroy gradients in the absence of these interactions. CCL5, also called RANTES, is a member of a chemokine subclass that has two adjacent cysteines (CC) near its amino terminus. It is among the earliest discovered and among the most studied of the chemokines. CCL5 binds both HS and CS; but given the abundance of CS chains in normal plasma and the association of CS proteoglycans with vascular development and disease, a specific discussion of CCL5–CS interactions seems appropriate. Although CCL5 is a small protein (∼8 kDa), it exists primarily as dimers (Kd<1 µM) that assemble into larger filamentous structures, especially in the presence of GAGs. These characteristics have made it difficult to study CCL5 structurally. Most studies have involved a mutated form (E66S) and/or study at lower pH—conditions that limit oligomerization to a dimer. Nevertheless, complementary solution data, including nuclear magnetic resonance (NMR) and small angle X-ray scattering (SAXS) have allowed construction of filament models, both with and without GAGs present. Figure 38.3D shows a model of a tetramer built on the known dimer structure (PDB id, 1U4L) and complexed with CS hexamers 4-O-sulfated on all three N-acetylgalactosamine residues of the GlcAβ1-3GalNAc repeats. Individual dimers are shown as green and sea green ribbons.']","This is relevant for urinary tract infections, in which type-1 fimbriae mediate binding of the bacteria to the glycoprotein uroplakin Ia on the surface of bladder epithelial cells. Uroplakin Ia presents high levels of terminally exposed mannose residues that are capable of specifically interacting with FimH. Alternatively, type-1 fimbriae can bind to high mannose glycans on the soluble urinary Tamm–Horsfall glycoprotein/uromodulin, that forms long fibers. The resulting bacterial aggregates are flushed out of the urinary tract. Mice lacking the gene encoding the Tamm–Horsfall glycoprotein are considerably more susceptible to bladder colonization by type-1-fimbriated E. coli than normal mice.","This is relevant for urinary tract infections, in which type-1 fimbriae mediate binding of the bacteria to the glycoprotein uroplakin Ia on the surface of bladder epithelial cells. Uroplakin Ia presents high levels of terminally exposed mannose residues that are capable of specifically interacting with FimH. Alternatively, type-1 fimbriae can bind to high mannose glycans on the soluble urinary Tamm–Horsfall glycoprotein/uromodulin, that forms long fibers. The resulting bacterial aggregates are flushed out of the urinary tract. Mice lacking the gene encoding the Tamm–Horsfall glycoprotein are considerably more susceptible to bladder colonization by type-1-fimbriated E. coli than normal mice.",1.0,0.4338578498888028,1.0000000000000002,0.04,0.9999999999666667,1.0
"Complete the following paragraph: In contrast to lectins, which tend to fall into evolutionarily conserved families (Chapters 28–37), GAG-binding proteins do not have common folds and instead appear to have evolved by convergent evolution. Several hundred GAG-binding proteins have been discovered, which make up the GAG-interactome and fall into the broad classes presented in Table 38.1.","['NCBI Bookshelf. A service of the National Library of Medicine, National Institutes of Health. Varki A, Cummings RD, Esko JD, et al., editors. Essentials of Glycobiology [Internet]. 4th edition. Cold Spring Harbor (NY): Cold Spring Harbor Laboratory Press; 2022.  doi: 10.1101/glycobiology.4e.28 Maureen E. Taylor, Kurt Drickamer, Anne Imberty, Yvette van Kooyk, Ronald L. Schnaar, Marilynn E. Etzler, and Ajit Varki. This chapter provides an overview of naturally occurring glycan-binding proteins (GBPs), the history of their discovery, some of their biological functions, ways in which GBPs are identified, and challenges in defining their biologically relevant ligands. The chapters that follow describe the analysis of glycan–protein interactions (Chapter 29), the physical principles involved (Chapter 30), and the structures and biological functions of important subclasses of GBPs (Chapters 31–38). GBPs (which exclude glycan-specific antibodies) are found in all living organisms and fall into two overarching groups—lectins and sulfated glycosaminoglycan (GAG)-binding proteins (compared in Online Appendix 28A). Lectins are further classified into evolutionarily related families identified by carbohydrate-recognition domains (CRDs) based on primary and/or three-dimensional structural similarities (Figure 28.1). CRDs can exist as stand-alone proteins or as domains within larger multidomain proteins. They typically recognize terminal groups on glycans, which fit into shallow but well-defined binding pockets (Chapters 29 and 30). In contrast, proteins that bind to sulfated GAGs (heparan, chondroitin, dermatan, and keratan sulfates; Chapter 17) do so via clusters of positively charged amino acids that bind specific arrangements of carboxylic acid and sulfate groups along GAG chains. Most of these proteins are evolutionarily unrelated. GBPs that bind to the nonsulfated GAG hyaluronic acid (hyaladherins) share an evolutionarily conserved fold that facilitates recognition of short segments of the invariant hyaluronan repeating disaccharide (Chapter 16), so they are best classified as lectins rather than grouped with sulfated GAG-binding proteins. The rest of this chapter emphasizes lectins, different families of which are detailed in Chapters 31–37. Sulfated GAG-binding proteins are also discussed, and are detailed further in Chapter 38. Representative structures from four common animal lectin families. The emphasis is on the extracellular domain structure and topology. The following are the defined carbohydrate-binding domains (CRDs) shown: (CL) C-type lectin; (GL) galectin; (MP) P-type (more...) Lectins were discovered in plants in 1888 when extracts of castor bean seeds were found to agglutinate animal red blood cells. Subsequently, seeds of many plants were found to contain such “agglutinins,” later renamed lectins (Latin for “select”) when they were found to distinguish human ABO blood groups (Chapter 14), important for blood transfusions. Lectins are particularly common in the seeds of leguminous plants and these “L-type” lectins, including concanavalin A and phytohemagglutinin, have been extensively studied. Although their specific glycan-binding activities make such plant lectins extremely useful scientific tools, their biological functions in plants remain mostly unknown. The first animal lectin discovered was the asialoglycoprotein receptor (ASGPR) identified by Anatol Morell and Gilbert Ashwell in the late 1960s during investigations of the turnover of a serum glycoprotein, ceruloplasmin. Like most glycoproteins circulating in blood, ceruloplasmin has complex N-glycans with sialic acid termini. To prepare radiolabeled ceruloplasmin, the terminal sialic acids were removed, leaving an exposed galactose. Surprisingly, asialoceruloplasmin had a circulation half-life (in rabbits) of minutes, whereas intact ceruloplasmin remained in the blood for hours.'
