question,contexts,answer,ground_truth,faithfulness,answer_relevancy,answer_similarity,context_relevancy,context_precision,context_recall
"Complete the following paragraph: A more complete paradigm of molecular biology must therefore include glycans, often in covalent combination with other macromolecules (i.e., glycoconjugates, such as glycoproteins and glycolipids). In analogy to the current situation in Cosmology, glycans can be considered as the “dark matter” of the biological universe: a major and critical component that has yet to be fully incorporated into the “standard model” of biology.","['NCBI Bookshelf. A service of the National Library of Medicine, National Institutes of Health. Varki A, Cummings RD, Esko JD, et al., editors. Essentials of Glycobiology [Internet]. 4th edition. Cold Spring Harbor (NY): Cold Spring Harbor Laboratory Press; 2022.  doi: 10.1101/glycobiology.4e.1 Ajit Varki and Stuart Kornfeld. This chapter provides a historical background to the field of glycobiology and an overview of this book. General terms found in the volume are considered, common monosaccharide units of glycoconjugates mentioned, and a uniform symbol nomenclature used for structural depictions presented. The major glycan classes discussed in the book are described, and an overview of the general pathways for their biosynthesis is provided. Topological issues relevant to biosynthesis and functions of glycoconjugates are also considered, and the growing role of these molecules in medicine, biotechnology, nanotechnology, bioenergy, and materials science is mentioned. Defined in the broadest sense, glycobiology is the study of the structure, biosynthesis, biology, and evolution of saccharides (also called carbohydrates, sugar chains, or glycans) that are widely distributed in nature and of the proteins that recognize them. How does glycobiology fit into the modern concepts of molecular biology? The central paradigm driving research in molecular biology has been that biological information flows from DNA to RNA to protein. The power of this concept lies in its template-based precision, the ability to manipulate one class of molecules based on knowledge of another, and the patterns of sequence homology and relatedness that predict function and reveal evolutionary relationships. With ongoing sequencing of numerous genomes, spectacular gains in understanding the biology of nucleic acids and proteins have occurred. Thus, many scientists assume that studying just these molecules will explain the makeup of cells, tissues, organs, physiological systems, and intact organisms. In fact, making a cell requires many small molecule metabolites as well as two other major classes of macromolecules—lipids and carbohydrates—which serve as intermediates in generating energy and as signaling effectors, recognition markers, and structural components. Taken together with the fact that they encompass some of the major posttranslational modifications of proteins, lipids, and carbohydrates help explain how the relatively small number of genes in the typical genome can generate the enormous biological complexities inherent in the development, growth, and functioning of diverse organisms. The biological roles of carbohydrates are particularly prominent in the assembly of complex multicellular organs and organisms, which requires interactions between cells and the surrounding matrix. However, without any known exception, all cells and numerous macromolecules in nature carry an array of covalently attached sugars (monosaccharides) or sugar chains (oligosaccharides), which are generically referred to in this book as “glycans.” Sometimes glycans can also be freestanding entities. Being on the outer surface of cellular and secreted macromolecules, many glycans are in a position to modulate or mediate a variety of events in cell–cell, cell–matrix, and cell–molecule interactions critical to the development and function of a complex multicellular organism. They can also mediate interactions between organisms (e.g., between host and a parasite, pathogen, or a symbiont). In addition, simple, rapidly turning over, protein-bound glycans are abundant within the nucleus and cytoplasm, in which they can serve as regulatory switches. A more complete paradigm of molecular biology must therefore include glycans, often in covalent combination with other macromolecules (i.e., glycoconjugates, such as glycoproteins and glycolipids). In analogy to the current situation in Cosmology, glycans can be considered as the “dark matter” of the biological universe: a major and critical component that has yet to be fully incorporated into the “standard model” of biology. However, unlike the situation with dark matter in the Universe, there is already a lot known about glycans. The chemistry and metabolism of carbohydrates were prominent matters of interest in the first part of the 20th century. Although engendering much attention, they were primarily considered as a source of energy or as structural materials, apparently lacking other biological activities.'
 'However, unlike the situation with dark matter in the Universe, there is already a lot known about glycans. The chemistry and metabolism of carbohydrates were prominent matters of interest in the first part of the 20th century. Although engendering much attention, they were primarily considered as a source of energy or as structural materials, apparently lacking other biological activities. Furthermore, during the molecular biology revolution of the 1970s, studies of glycans lagged far behind those of other major classes of molecules. This was in part because of their inherent structural complexity, the difficulty in determining their sequences, and the fact that their biosynthesis could not be directly predicted from a DNA template. The development of many new technologies for exploring the structures and functions of glycans has since opened a new frontier of molecular biology called “glycobiology”—a word first coined in the late 1980s to recognize the coming together of the traditional disciplines of carbohydrate chemistry and biochemistry with a modern understanding of the cell and molecular biology of glycans and, in particular, their conjugates with proteins and lipids. Glycobiology is now one of the more rapidly growing fields in the natural sciences, with broad relevance to many areas of basic research, biomedicine, and biotechnology. The field includes the chemistry of carbohydrates, the enzymology of glycan formation and degradation, the recognition of glycans by specific proteins, roles of glycans in complex biological systems, and their analysis or manipulation by various techniques. Research in glycobiology thus requires a foundation not only in the nomenclature, biosynthesis, structure, chemical synthesis, and functions of glycans, but also in the general disciplines of molecular genetics, protein chemistry, cell biology, developmental biology, physiology, and medicine. This book provides an overview of the field, with relative emphasis on the glycans of animal systems. It is assumed that the reader has a basic background in advanced undergraduate-level chemistry, biochemistry, and cell biology. Some of the major investigators who influenced the early development of Glycobiology are shown in Figure 1.1, and more are listed in Online Appendix 1A. Many others have made major contributions as well, and a summary of the general principles gained from all this research is presented in Table 1.1. Nobel laureates in fields related to the history of glycobiology. Listed are the Laureates and their original Nobel citations: Hermann Emil Fischer (Chemistry, 1902), “in recognition of the extraordinary services he has rendered by his work on (more...) General principles of glycobiology  Carbohydrates are defined as polyhydroxyaldehydes, polyhydroxyketones and their simple derivatives, or larger compounds that can be hydrolyzed into such units. A monosaccharide is a carbohydrate that usually cannot be hydrolyzed into a simpler form. It has a potential carbonyl group at the end of the carbon chain (an aldehyde group) or at an inner carbon (a ketone group). These two types of monosaccharides are therefore named aldoses and ketoses, respectively (for examples, see below, and for more details, see Chapter 2). Free monosaccharides can exist in open-chain or ring forms (Figure 1.2). Ring forms of the monosaccharides are the general rule in oligosaccharides, which are linear or branched chains of monosaccharides attached to one another via glycosidic linkages (the term “polysaccharide” is typically used for large glycans composed of repeating oligosaccharide motifs; for examples, see Chapter 3). The ring form of a monosaccharide generates a chiral anomeric center at C-1 for aldo sugars or at C-2 for keto sugars (for details, see Chapter 2). A glycosidic linkage involves the attachment of a monosaccharide to another residue, typically via the hydroxyl group of this anomeric center, generating α-linkages or β-linkages that are defined based on the relationship of the glycosidic oxygen to the anomeric carbon and ring (Chapter 2).'
 'NCBI Bookshelf. A service of the National Library of Medicine, National Institutes of Health. Varki A, Cummings RD, Esko JD, et al., editors. Essentials of Glycobiology [Internet]. 4th edition. Cold Spring Harbor (NY): Cold Spring Harbor Laboratory Press; 2022.  doi: 10.1101/glycobiology.4e.51 Pauline M. Rudd, Niclas G. Karlsson, Kay-Hooi Khoo, Morten Thaysen-Andersen, Lance Wells, and Nicolle H. Packer. The term genomics arose from the availability of complete genome sequence data as well as computational methods for their analysis. However, <2% of genes in the human genome encode proteins. These genes are transcribed into messenger RNAs (mRNAs) that make up the “transcriptome,” of which ∼30% are assigned to protein coding. The total complement of proteins expressed by the cell is collectively termed the “proteome.” Most eukaryotic proteins are post translationally modified (e.g., by phosphorylation, sulfation, oxidation, ubiquitination, acetylation, methylation, lipidation, or glycosylation). These modifications, combined with alternative RNA splicing in eukaryotes, render the proteome considerably more complex than the transcriptome. Although it has been estimated that approximately 120,000 different protein splice forms are expressed by human cells, the total number of modified proteoforms is likely to be at least an order of magnitude higher. The systems-level analysis of all proteins expressed by cells, tissues, or organisms is known as “proteomics.” The proteome, like the transcriptome, but unlike the DNA sequence of the genome, is fundamentally dynamic. The repertoire of proteins expressed by a cell is highly dependent on tissue type, microenvironment, and stage within the life cycle. As cells receive external and internal cues in the form of growth factors, hormones, metabolites, or cell–cell interactions, the expression of various genes is modulated and may be transcribed at levels ranging from silence to more than 104 mRNA copies per cell and 107 protein molecules per cell. Thus, proteomes and their modifications vary during cell differentiation, activation, trafficking, and malignant transformation. However, no systems-level analysis of a biological process is complete without interrogating the glycome, defined as the entire complement of glycan structures (be it protein-/lipid-bound or -free) produced by cells, in addition to the genome, transcriptome, proteome, lipidome and metabolome. Vertebrates synthesize N-linked and O-linked glycoproteins, glycolipids (Chapters 11 and 12), proteoglycans, glycosaminoglycans (GAGs), and glycosylphosphatidylinositol (GPI) anchors covalently attached to proteins, as well as free oligosaccharides (Chapter 3). As with the proteome, each cell type has its own distinct glycome that is governed by local cues and the metabolic state of the cell. Other organisms have distinct glycomes; those of plants (Chapter 24) and prokaryotes (Chapter 21) are distinctly different from the vertebrate and invertebrate glycomes (Chapters 25–27). The size of any particular cellular glycome has not yet been established, but the combinatorial possibilities that can occur with numerous glycan structures on multiple glycoconjugates means that determining a “complete” glycome is not straightforward. The notion that glycans should be studied as a totality (glycomics), as well as simply one glycan or glycoconjugate at a time, developed when it became apparent that glycans form patterns on cells that change during development (Chapter 41), cancer progression (Chapter 47), infection (Chapters 42 and 43), and many other diseases (Chapters 44–46). Many glycan-binding proteins, such as lectins, are oligomerized on the cell surface and interact with multivalent arrays of glycans on the same or opposing cells (Chapters 28–38). Sometimes, multiple discrete glycans and their matching glycan-binding proteins work together to engage two cells or to deliver signals between cells.'
 'What Are the Complete Structures of All the Glycans within the Human Glycome or Any Animal or Plant Glycome?  Every day witnesses new glycan structures being identified, with previously unknown and novel sugar linkages, along with unique and unanticipated modifications, such as acetylation, methylation, phosphodiesters, and sulfation. How many such glycan structures exist within a glycome, to what glycoproteins or lipids are they attached, and where are they attached? Much of our knowledge of the human glycome comes from studying serum glycoproteins and several cell lines, but there is little information about the overall complexity of the human glycome either at the glycan level or the glycoprotein level.  What Is the True Extent of Diversity of Glycans, Glycan-Binding Proteins, and Glycan-Degrading Enzymes in the Microbiome?  It is clear that investigators are just beginning to scratch the surface of the organismal diversity within the complex diverse microbiomes that occupy various niches in nature. Each time a new species within a given microbiome is sequenced, the genomes are found to predict hundreds of “carbohydrate-active” enzymes. Understanding the mechanisms and functions of all these molecules is a major challenge for the future, as is the deciphering of the structures of the complex glycans they generate, bind, or degrade.  Do More Complex Biological Systems Have Simpler Glycosylation?  Of the hundreds of known monosaccharides in nature, less than a dozen are found in vertebrates, and many more tend to be found in simpler, earlier evolved systems. Is this an ascertainment bias or does increasing biological complexity place limits on the fraction of the genome that can be committed to controlling glycosylation?  What Is the Significance of Lineage-Specific Gains and Losses of Specific Glycans during Evolution?  Current data indicate that glycans are the most rapidly diverging components of life-forms, with distinct gains and losses that sometimes become (or stay) polymorphic in various lineages and clades. It seems likely that this is a consequence of the intimate involvement of glycans in the most rapidly evolving aspects of biological systems (i.e., host–pathogen interactions, immunity, and reproduction). Further studies are needed to ascertain if glycans are indeed involved in the process of speciation.  When Will the Integration of Glyosciences into the Mainstream of Bioinformatics Be Achieved?  Currently, searches of the main genome and protein databases used by essentially all biologists yield almost no information on the glycosylation state of glycoproteins. Indeed, there is as yet no central comprehensive database of glycan structures that an investigator can mine to determine the occurrence, provenance, or phylogeny of a specific glycan of interest. An international effort led by nearly every major country involved in the glycosciences has come together to agree on uniform standards for describing glycans in computer databases and to develop methods to curate and maintain glycan structural data. Together with the expanding use of uniform symbol nomenclature (Chapter 1), this is the first step toward integrating glycomic data into mainstream protein databases (Chapter 52).  When Will Glycobiology Completely Merge into a Holistic Approach to Biology?  As with other fields like protein sciences, there will always be a small cadre of investigators whose primary interest is in the structure, chemistry, biochemistry, and biology of glycans. But a combination of advances in methodology and education will eventually integrate glycosciences into the general awareness of biologists who are currently not trained to understand the significance of glycans. As our understanding of the functions of glycans increases, biochemists and biologists will come to recognize that glycan modifications are no less important than the amino acids that make up the polypeptide backbone or the nucleotides and nucleotide derivatives that make up DNA and RNA. In the long run, glycobiology will merge into a holistic approach to biological systems. When that intellectual singularity is eventually achieved, further editions of this book may no longer be necessary.'
 ""Because of their inherent flexibility, oligosaccharides typically exist in solution or on proteins, as an ensemble of conformations, making it a challenge to describe their 3D structure (see Chapters 30 and 50 for a description of 3D structures). Computational chemistry is an essential tool in analyzing glycan experimental data, to make predictions that may be tested experimentally, and to unravel and explain chemical processes at the atomic level. Web-based tools are available to generate a theoretical model of a carbohydrate 3D structure. A useful resource is GLYCAM-Web that provides tools for modeling oligosaccharides and glycoproteins in addition to providing downloadable structure files that can be used for molecular modeling. SWEET-II is also a carbohydrate 3D builder that is available on the GLYCOSCIENCES.de website. The two major databases for storing experimentally determined 3D carbohydrate structures are the PDB and the Cambridge Structural Database. Crystal structures of oligosaccharides are also available at Glyco3D. A recent extension of the latter is GAG-DB, centered on the 3D description of glycosaminoglycan-binding proteins. Most of the carbohydrates in the PDB are either connected covalently to a glycoprotein or form a complex with a lectin, enzyme, or antibody. Recently, the PDB has undergone a carbohydrate remediation, ensuring that carbohydrates are accurately annotated. Therefore PDB entries now contain glycan annotations, which are available in LINUCS, GLYCAM (IUPAC-like), and WURCS formats. Despite the known sequon (NXT/S, X is not Pro) for N-linked glycosylation, many potential sites are not glycosylated in vivo, and there are no clear motif(s) for predicting O-linked glycosylation. Understanding the “rules'' of attachment site specificity for the glycosylation of proteins is thus an ongoing challenge for glycoinformaticians. Over the past 20 years, neural networks, hidden Markov models (HMMs), and support vector machines (SVMs) have been implemented to predict N- or O-glycosylation and C-mannosylation. Although the original tools were hosted on the Danish CBS Prediction Servers, additional resources have emerged in the last few years. Glycoprotein informatic resources of GlyGen, GlyCosmos, and Glycomics@Expasy now provide information on the glycan structures as attached to proteins in a complementary manner. The coverage and content depend on both automated and manual efforts to mine or curate current literature that contains characterized glycan structures and their sites of attachment to proteins and on supporting data from experimental conditions and biological sources. This collaborative, international bioinformatic integration of complex molecular data from all types of glycoanalytical techniques and interactions is in constant development and is essential for the continued progress of glycobiological research. Systems biology involves the development, simulation, and analysis of biological systems (including whole-body and environmental systems) at the molecular and cellular levels. As research on glycan biosynthetic pathway simulation progresses, its integration with genomics, transcriptomics, proteomics, lipidomics, and metabolomics data represents the next step. This will result in a holistic understanding of biological processes (Figure 52.1), such that glycomics data can be viewed in the context of complementary data. Such integrated knowledge will result in better elucidation of the glycosylation process, reveal new interactions with GBPs, and enhance our understanding of related functional consequences. The current coordinated trend toward RDF-based data integration is already shaping future developments of glycoscience databases. It will help bridge the gap between glycomics and other -omics that have already adopted RDF ontologies but that are still very much DNA sequence–centered. Indeed, 50 years after the advent of sequencing technology, DNA sequences, along with their links to other data types (gene expression, protein structure, etc.), remain the most prominent entities in molecular biology databases and repositories. Scientists gather sequence-centered information in the course of elucidating a cellular process or a pathological behavior, simply because a gene/protein sequence is usually the common element shared across -omics domains. The problem here is that glycans are only linked to the gene via their biosynthetic enzymes and substrates.""]","A more complete paradigm of molecular biology must therefore include glycans, often in covalent combination with other macromolecules (i.e., glycoconjugates, such as glycoproteins and glycolipids). In analogy to the current situation in Cosmology, glycans can be considered as the “dark matter” of the biological universe: a major and critical component that has yet to be fully incorporated into the “standard model” of biology. Just as dark matter plays a crucial role in the structure and behavior of the universe despite being largely unseen and not fully understood, glycans are essential components that influence a wide range of biological processes and interactions, yet their significance and complexity are still not fully integrated into the mainstream understanding of biological systems.","However, unlike the situation with dark matter in the Universe, there is already a lot known about glycans. The chemistry and metabolism of carbohydrates were prominent matters of interest in the first part of the 20th century. Although engendering much attention, they were primarily considered as a source of energy or as structural materials, apparently lacking other biological activities. Furthermore, during the molecular biology revolution of the 1970s, studies of glycans lagged far behind those of other major classes of molecules. This was in part because of their inherent structural complexity, the difficulty in determining their sequences, and the fact that their biosynthesis could not be directly predicted from a DNA template.",1.0,0.465180286042251,0.7609734011144365,0.015503875968992248,0.99999999998,1.0
"Complete the following paragraph: Monosaccharide names are frequently abbreviated; most common are three-letter abbreviations for simple monosaccharides (e.g., Gal, Glc, Man, Xyl, Fuc). There are nine common monosaccharides found in vertebrate glycoconjugates (Figure 2.4). Once incorporated into a glycan, these nine monosaccharide building blocks can be further modified to generate additional sugar structures.","['As mentioned briefly in Chapter 1, all monosaccharides consist of a chain of chiral hydroxymethylene units, which terminates at one end with a hydroxymethyl group and at the other with either an aldehyde group (aldoses) or an α-hydroxy ketone group (ketoses). Glyceraldehyde is the simplest aldose and dihydroxyacetone is the simplest ketose (Figure 2.1). The structures of glyceraldehyde and dihydroxyacetone are distinct in that glyceraldehyde contains an asymmetric (chiral) carbon atom (Figure 2.1), whereas dihydroxyacetone does not. With the exception of dihydroxyacetone, all monosaccharides have at least one asymmetric carbon atom, the total number being equal to the number of internal (CHOH) groups (n–2 for aldoses and n–3 for ketoses with n carbon atoms). The number of stereoisomers corresponds to 2k, where k equals the number of asymmetric carbon atoms. For example, an aldohexose with the general formula C6H12O6 and four asymmetric carbon atoms (i.e., four (CHOH) groups) can be described in 16 possible isomeric forms (Figure 2.1). Structures of glyceraldehyde and dihydroxyacetone. (A) Fischer projection. (B) D- and L-glyceraldehyde. The chiral central carbon in glyceraldehyde gives rise to two possible configurations of the molecule, termed D and L.  The numbering of carbon atoms follows the rules of organic chemistry nomenclature. The aldehyde carbon is referred to as C-1 and the carbonyl group in ketoses is referred to as C-2. The overall configuration (D or L) of each sugar is determined by the absolute configuration of the stereogenic center furthest from the carbonyl group (i.e., with the highest numbered asymmetric carbon atom; this is C-5 in hexoses and C-4 in pentoses). The configuration of a monosaccharide is most easily determined by representing the structure in a Fischer projection. If the OH (or other non-H group) is on the right in the Fischer projection, the overall configuration is D. If the OH (or other non-H group) is on the left, the overall configuration is L (Figure 2.2). This figure also shows D- and L-glucose in the cyclic form (chair conformation) found in solution. Most vertebrate monosaccharides have the D configuration with the exception of fucose and iduronic acid (IdoA) L sugars. The Fischer projections shown in Figure 2.3 illustrate the acyclic structures of all D-aldoses through the aldohexose group. D- and L-glucopyranose in Fischer projection and chair conformation.  Fischer projections for the acyclic forms of the D series of aldoses, ranging from triose to hexose.  Any two sugars that differ only in the configuration around a single chiral carbon atom are called epimers. For example, D-mannose is the C-2 epimer of D-glucose, whereas D-galactose is the C-4 epimer of D-glucose (Figure 2.4). Monosaccharide names are frequently abbreviated; most common are three-letter abbreviations for simple monosaccharides (e.g., Gal, Glc, Man, Xyl, Fuc). There are nine common monosaccharides found in vertebrate glycoconjugates (Figure 2.4). Once incorporated into a glycan, these nine monosaccharide building blocks can be further modified to generate additional sugar structures. For example, glucuronic acid (GlcA) can be epimerized at C-5 to generate IdoA. Many more monosaccharides exist in glycoconjugates from other species and as intermediates in metabolism. We use a symbolic notation for the monosaccharides that are most abundant in vertebrate glycoconjugates (see Chapter 1). Common monosaccharides found in vertebrates. N-Acetylneuraminic acid is the most common form of sialic acid.  Monosaccharides exist in solution as an equilibrium mixture of acyclic and cyclic forms.'
 'Note that the polypeptide (more...) (Upper left) Historical electron micrograph of endothelial cells from a blood capillary in the rat diaphragm muscle, showing the lumenal cell membrane of the cells (facing the blood) decorated with particles of cationized ferritin (arrowheads). These (more...) Nucleotides and proteins are linear polymers that can each contain only one basic type of linkage between monomers. In contrast, each monosaccharide can theoretically generate either an α- or a β-linkage to any one of several positions on another monosaccharide in a chain or to another type of molecule. Thus, whereas three different nucleotides or amino acids can only generate six trimers, three different hexoses could theoretically produce (depending on which of their forms are considered) anywhere from 1056 to 27,648 unique trisaccharides. This difference in complexity becomes even greater as the number of monosaccharide units found in natural glycan increases (now numbering in the hundreds). Fortunately for the student of glycobiology, naturally occurring biological macromolecules in a given species tend to contain relatively few of the possible monosaccharide units, and they are in a limited number of combinations. Of course, the great majority of glycans in most species have yet to be discovered and structurally defined. Thus, much of the possible diversity may yet exist in nature. Although several hundred distinct monosaccharides are known in nature, only a minority of these are commonly found in well-studied glycans. Examples of common monosaccharides in vertebrate cells are listed below, along with their standard abbreviations (for details regarding their structures, see Chapter 2, and embedded links from the symbols in Online Appendix 1B). Pentoses: five-carbon neutral sugars—D-xylose (Xyl)Hexoses: six-carbon neutral sugars—for example, D-glucose (Glc)Hexosamines: hexoses with an amino group at the 2-position, which can be either free or, more commonly, N-acetylated—for example, N-acetyl-D-glucosamine (GlcNAc)6-Deoxyhexoses: for example, L-fucose (Fuc)Uronic acids: hexoses with a carboxylate at the 6-position—for example, D-glucuronic acid (GlcA)Nonulosonic acids: family of nine-carbon acidic sugars, of which the most common in animals is the sialic acid N-acetylneuraminic acid (Neu5Ac, also sometimes called NeuAc or, historically, NANA) (see Chapter 15) For simplicity, the symbols D- and L- are omitted from the full names of common monosaccharides from here on unless a less common variant occurs. This limited set of monosaccharides dominates the glycobiology of more recently evolved (so-called “higher”) animals, but several others have been found in “lower” animals (e.g., tyvelose [Chapters 25 and 26], bacteria and Archaea [e.g., keto-deoxyoctulosonic acid, rhamnose, L-arabinose, and muramic acid; Chapters 21 and 22], and plants [e.g., arabinose, apiose, and galacturonic acid; Chapter 24]). A variety of modifications of glycans further enhance their diversity in nature and often serve to mediate specific biological functions. Thus, the hydroxyl groups of different monosaccharides can be subject to modifications such as phosphorylation, sulfation, methylation, O-acetylation, or fatty acylation. Although amino groups are commonly N-acetylated, they can be N-sulfated or remain unsubstituted. Carboxyl groups are occasionally subject to lactonization to nearby hydroxyl groups or even lactamization to nearby amino groups. Details regarding the structural depiction of monosaccharides, linkages, and oligosaccharides are discussed in Chapter 2. Many figures in this volume use a symbolic depiction of sugar chains (see Online Appendix 1B and examples in Figure 1.5). This Symbol Nomenclature for Glycans (SNFG) is expanded from the Second Edition and has been vetted and adopted by many investigators.'
 'NCBI Bookshelf. A service of the National Library of Medicine, National Institutes of Health. Varki A, Cummings RD, Esko JD, et al., editors. Essentials of Glycobiology [Internet]. 4th edition. Cold Spring Harbor (NY): Cold Spring Harbor Laboratory Press; 2022.  doi: 10.1101/glycobiology.4e.2 Peter H. Seeberger. This chapter covers the basic building blocks of glycans and fundamental considerations regarding glycan structure by introducing chemical concepts. Modes of linking glycans and structural depiction of the same are discussed to provide the groundwork for understanding longer glycans (Chapter 3). In this book, as well as in the earlier editions, the term glycan is used. Still, a host of names are commonly used to refer to sugar polymers in other textbooks and the literature. In the 19th century, sugar-based substances were referred to as carbohydrates, or “hydrates of carbon,” that are based on the general formula C x(H2O)n that also possess a carbonyl group, either an aldehyde or a ketone. Monosaccharides are the simplest of these polyhydroxylated carbonyl compounds (saccharide is derived from the Greek word for sugar or sweetness). Monosaccharides are joined together to give rise to oligosaccharides or polysaccharides. Typically, the term “oligosaccharide” refers to any glycan that contains less than 20 monosaccharide residues connected by glycosidic linkages. The term “polysaccharide” is typically used to denote any linear or branched polymer consisting of monosaccharide residues, such as cellulose (Chapters 14 and 24). Thus, the relationship of monosaccharides to oligosaccharides or polysaccharides is analogous to that of amino acids and proteins or nucleotides and nucleic acids (polynucleotides). The term “glycoconjugate” is often used to describe a macromolecule that contains monosaccharides covalently linked to proteins or lipids. The prefix “glyco” and the suffixes “saccharide” and “glycan” indicate the presence of carbohydrate constituents (e.g., glycoproteins, glycolipids, and proteoglycans). Just as is observed with proteins in nature, additional structural diversity can be imparted to glycans by modifying their hydroxyl groups with phosphate, sulfate, or acetyl esters, and/or their amino groups with acetyl or sulfate groups. A carbohydrate may be termed “complex” if it contains more than one type of monosaccharide building unit. The glucose-based polymer cellulose is an example of a “simple” carbohydrate, whereas a galactomannan polysaccharide, composed of both galactose and mannose, is an example of a complex carbohydrate. However, even so-called simple glycans, such as cellulose and starch, often have very complex molecular structures in three dimensions. The term complex carbohydrates includes glycoconjugates, whereas the term carbohydrates per se would not. Additional nomenclature issues are covered in this chapter and Chapter 3. A more detailed and comprehensive listing of carbohydrate nomenclature rules has been published (see McNaught 1997 and Varki et al. 2015 in Further Reading at the end of this chapter, and Online Appendix 1B). The classification of monosaccharide structures began in the late 19th century with the pioneering work of Emil Fischer. All simple monosaccharides have the general empirical formula Cx(H2O)n, where n is an integer ranging from 3 to 9. As mentioned briefly in Chapter 1, all monosaccharides consist of a chain of chiral hydroxymethylene units, which terminates at one end with a hydroxymethyl group and at the other with either an aldehyde group (aldoses) or an α-hydroxy ketone group (ketoses). Glyceraldehyde is the simplest aldose and dihydroxyacetone is the simplest ketose (Figure 2.1).'
 'Two isomeric disaccharides.  The relationship of the glycosidic bond to oligosaccharides is analogous to the relationship of the amide bond to polypeptides and the phosphodiester bond to polynucleotides. However, amino acids and nucleotides are linked in only one fashion during the formation of polypeptides and nucleic acids, respectively; there is no stereochemical or regiochemical diversity in these biopolymers. The number of monomeric residues contained in an oligosaccharide is designated in the nomenclature—disaccharide, trisaccharide, and so on. Just as polypeptides have amino and carboxyl termini and polynucleotides have 5′ and 3′ termini, oligosaccharides have a polarity that is defined by their reducing and nonreducing termini (Figure 2.15). The reducing end of the oligosaccharide bears a free anomeric center that is not engaged in a glycosidic bond and thus retains the chemical reactivity of the aldehyde. However, it continues to be referred to as reducing end even when it is engaged in a linkage (e.g., to the hydroxyl of serine or threonine in glycoproteins). Structures are commonly written from the nonreducing end on the left toward the reducing end on the right. For some structures, there is no reducing end. For example, the common disaccharides sucrose and trehalose have glycosidic linkages between the anomeric centers of two monosaccharide constituents (Figure 2.16). Reducing and nonreducing ends of a disaccharide.  Nonreducing disaccharides.  The glycosidic linkage is the most flexible part of a disaccharide structure. Whereas the chair conformation of the constituent monosaccharides is relatively rigid, the torsion angles around the glycosidic bond (φ, ψ, and ω; Figure 2.17) can vary. Thus, a disaccharide of well-defined primary structure can adopt multiple conformations in solution that differ in the relative orientation of the two monosaccharides. The combination of structural rigidity and flexibility is typical of complex carbohydrates and essential to their biological functions. Torsion angles that define the conformation of the glycosidic linkages φ, ψ, and ω. (A) Newman projection along the C1—O1 bond illustrating φ for the 1-6 glycosidic bond. (B) Newman projection along the C6′—O1 (more...) Glycans are linked to other biomolecules, such as lipids or amino acids within polypeptides, through glycosidic linkages to form glycoconjugates (see Chapters 9, 10, 11, and 12). Glycans are often referred to as the glycone of a glycoconjugate and the noncarbohydrate component is named the aglycone. The glycan may be a mono- or an oligosaccharide. In conclusion, monosaccharide building blocks can be linked to various regio- and stereochemistries, and the resulting oligosaccharides can be assembled on protein or lipid scaffolds (see Chapter 3). The authors acknowledge contributions to previous versions of this chapter by Carolyn R. Bertozzi and David Rabuka and appreciate helpful comments and suggestions from Dirk Lefeber, Todd Lowary, and Sriram Neelamegham.'
 'Many more monosaccharides exist in glycoconjugates from other species and as intermediates in metabolism. We use a symbolic notation for the monosaccharides that are most abundant in vertebrate glycoconjugates (see Chapter 1). Common monosaccharides found in vertebrates. N-Acetylneuraminic acid is the most common form of sialic acid.  Monosaccharides exist in solution as an equilibrium mixture of acyclic and cyclic forms. The percentage of each form depends on the sugar structure. The cyclic form of a monosaccharide is characterized by a hemiacetal group formed by the reaction of one of the hydroxyl groups with the C-1 aldehyde or ketone. For reasons of chemical stability, five- and six-membered rings are most commonly formed from acyclic monosaccharides. Hexoses (six-carbon aldoses) and hexuloses (six-carbon ketoses) form six-membered rings via a C-1—O—C-5 ring closure; they form five-membered rings through a C-1—O—C-4 ring closure (Figure 2.5). A five-membered cyclic hemiacetal is labeled a “furanose” and a six-membered cyclic hemiacetal is called a “pyranose.” Pentoses can form both pyranose and furanose forms. Cyclization of acyclic D-glucose to form pyranose and furanose structures. The cyclization reaction produces both the α and β anomers (i.e., C-1 epimers).  Monosaccharides can also be represented as Haworth projections in which both five- and six-membered cyclic structures are depicted as planar ring systems, with the hydroxy groups oriented either above or below the plane of the ring (Figure 2.6). Although not truly representative of the three-dimensional structure of a monosaccharide, the Haworth representation has been used since the late 1920s as an easy-to-draw formula that permits a quick evaluation of stereochemistry around the monosaccharide ring. The Haworth representations are preferably drawn with the ring oxygen atom at the top (for furanose) or the top right-hand corner (for pyranose) of the structure; the numbering of the ring carbons increases in a clockwise direction. Conversion from Fischer to Haworth projection. Each hydroxyl group projected to the right in the Fischer projection points down in the Haworth formula.  For any D sugar, the conversion of a Fischer projection into a Haworth projection proceeds as follows: (1) any groups (atoms) that are directed to the right in the Fischer structure are given a downward orientation in the Haworth structure, (2) any groups (atoms) that are directed to the left in the Fischer structure are given an upward orientation in the Haworth structure, and (3) the terminal —CH2OH group is given an upward orientation in the Haworth structure. For an L sugar, (1) and (2) are the same, but the terminal —CH2OH group is projected downward. The planar Haworth structures are distorted representations of the actual molecules. The preferred conformation of a pyranose ring is the “chair” conformation, similar to the structure of cyclohexane. The conversion from Haworth projection to chair conformation leaves the downward or upward orientation of ring substituents unaltered. Two chair conformations can be distinguished and designated as 4C1 and 1C4, respectively (Figure 2.7A), and these conformers can interconvert by a process called the “ring flip.” The first numeral in the chair conformer designation (superscript) indicates the number of the ring carbon atom above the “seat of the chair (C)” and the second numeral (subscript) indicates the number of the ring carbon atom below the plane of the seat (spanned by C-2, C-3, C-5, and the ring O). Chair conformations are designated from structures with the ring oxygen atom in the top right-hand corner of the ring “seat,” resulting in the clockwise appearance of the ring numbering.']","Once incorporated into a glycan, these nine monosaccharide building blocks can be further modified to generate additional sugar structures. Common monosaccharides found in vertebrates include Gal (galactose), Glc (glucose), Man (mannose), Xyl (xylose), Fuc (fucose), GlcNAc (N-acetylglucosamine), Neu5Ac (N-acetylneuraminic acid), GlcA (glucuronic acid), and Neu5Gc (N-glycolylneuraminic acid).","For example, glucuronic acid (GlcA) can be epimerized at C-5 to generate IdoA. Many more monosaccharides exist in glycoconjugates from other species and as intermediates in metabolism. We use a symbolic notation for the monosaccharides that are most abundant in vertebrate glycoconjugates (see Chapter 1). Common monosaccharides found in vertebrates. N-Acetylneuraminic acid is the most common form of sialic acid.  Monosaccharides exist in solution as an equilibrium mixture of acyclic and cyclic forms. The percentage of each form depends on the sugar structure. The cyclic form of a monosaccharide is characterized by a hemiacetal group formed by the reaction of one of the hydroxyl groups with the C-1 aldehyde or ketone. For reasons of chemical stability, five- and six-membered rings are most commonly formed from acyclic monosaccharides. Hexoses (six-carbon aldoses) and hexuloses (six-carbon ketoses) form six-membered rings via a C-1—O—C-5 ring closure; they form five-membered rings through a C-1—O—C-4 ring closure (Figure 2.5). A five-membered cyclic hemiacetal is labeled a “furanose” and a six-membered cyclic hemiacetal is called a “pyranose.” Pentoses can form both pyranose and furanose forms. Cyclization of acyclic D-glucose to form pyranose and furanose structures. The cyclization reaction produces both the α and β anomers (i.e., C-1 epimers).",0.9090909090909091,0.6830027837079929,0.7376843006292382,0.023622047244094488,0.99999999998,0.5714285714285714
"Complete the following paragraph: In solution, NMR studies show IdoA2S and IdoA residues to be present in a mixture of 1C4 and 2S0 conformations. The conformational flexibility in IdoA residues likely allows orientation of the sulfate groups in HS to maximize the binding affinity to proteins.","['A common method involves affinity fractionation of proteins on Sepharose columns containing covalently linked GAG chains, usually heparin. The bound proteins are eluted with different concentrations of sodium chloride, and the concentration required for elution is generally proportional to the Kd. High-affinity interactions require 0.5–2 m NaCl to displace bound ligand, which usually translates into Kd values of 10−7–10−9 m (determined under physiological salt concentrations by equilibrium binding). Proteins with lower affinity (10−5–10−7 m) often require only 0.2–0.5 m NaCl to elute. This method assumes that GAG–protein interactions are entirely ionic, which is not entirely correct. Nevertheless, it can provide an assessment of relative affinity, when comparing different GAG-binding proteins. A number of more sophisticated methods are now in use that provide detailed thermodynamic data (ΔH [change in enthalpy], ΔS [change in entropy], ΔCp [change in molar heat capacity], etc.), kinetic data (association and dissociation rates), and high-resolution data on atomic contacts in GAG–protein interactions (Table 38.2). Regardless of the technique one uses, it must be kept in mind that in vitro binding measurements are not likely to be the same as those when the protein binds to proteoglycans on the cell surface or in the extracellular matrix, where the density and variety of GAG-binding proteins, proteoglycans, and other interacting factors varies greatly. To determine the physiological relevance of the interaction, one should consider measuring binding under conditions that can lead to a biological response. For example, one can measure binding to cells with altered GAG composition (Chapter 49) or after treatment with specific lyases to remove GAG chains from the cell surface (Chapter 17) and then determine whether the same response occurs as observed in the presence of GAG chains. The interaction can then be studied more intensively using the in vitro assays described above. Methods to measure glycosaminoglycan (GAG)–protein interaction  As mentioned above, most GAG-binding proteins interact with HS and/or heparin. The likely basis for this preference is greater sequence heterogeneity and more extensive and variable sulfation compared with other GAGs. The unusual conformational flexibility of iduronic acid, which is found in heparin, HS, and DS, also has a role in their ability to bind proteins. GAGs are linear helical structures, consisting of alternating residues of N-acetylglucosamine (GlcNAc) or N-acetylgalactosamine (GalNAc) with glucuronic acid (GlcA) or IdoA (with the exception of KS, which consists of alternating N-acetylglucosamine and galactose residues; Chapter 17). Inspection of heparin oligosaccharides containing highly modified domains ([GlcNS6S-IdoA2S]n) shows that the N-sulfo and 2-O-sulfo groups of each disaccharide repeat lie on opposite sides of the helix from the 6-O-sulfo and carboxyl groups (Figure 38.1). Analysis of the conformation of individual sugars shows that N-acetylglucosamine and glucuronic acid residues assume a preferred conformation in solution, designated 4C1 (indicating that carbon 4 is above the plane defined by carbons 2, 3, and 5 and the ring oxygen, and that carbon 1 is below the plane; Chapter 2). In contrast, IdoA2S assumes the 1C4 or the 2S0 conformation (Figure 38.1), which reorients the position of the sulfo substituents, thereby creating a different orientation of charged groups. In many cases when a protein binds to an HS chain, it induces a change in conformation of the IdoA2S residue resulting in a better fit and enhanced binding. IdoA2S residues have always been found in domains rich in N-sulfo and O-sulfo groups (for biosynthetic reasons; Chapter 17), which is also where proteins usually bind.'
 'Structural diversity of these polymers is primarily a result of additional sulfation of hydroxyl groups and is discussed below for the diverse HS polymers found in mammals. GAGs found in other animals can be distinct from mammalian GAGs by virtue of further modifications. For example, marine invertebrates can carry particularly unique sulfation patterns (i.e., 3-O-sulfation on GlcA residues) and distinct side-chain modifications (i.e., fucosylation on chondroitin sulfate). Structures of (A) disaccharide repeating units of different glycosaminoglycans and (B) the conformations of monosaccharides from heparan sulfate.  GAGs show biological function primarily through their interactions with the hundreds of GAG-binding proteins found on cellular surfaces and in extracellular spaces. The structural factors that affect the strength and specificity of binding are key to the elicitation of a proper biological response. HS, the most studied member of the GAG family, provides a good illustration of the wide range of physiological and pathophysiological functions affected. HS, for example, is involved in trimolecular interactions with growth factors and growth factor receptors, and thereby participates in regulating embryonic development. HS interacts with proteases and protease inhibitors in the blood to control the coagulation process and binds to viral envelope proteins as a receptor for viral infections. Also, heparin, a highly sulfated form of HS, is a commonly used anticoagulant drug in the clinic. A more complete discussion of the biological function of HS can be found in Chapters 17 and Chapter 38. This section uses the interaction between HS and proteins to illustrate how structural factors affect binding between GAGs and proteins in general. One factor that contributes to the structural diversity of HS-protein interactions is the conformational flexibility of L-IdoA and its derivative, L-IdoA2S (2-O-sulfo iduronic acid). Present in the pyranose form, the six-membered ring structure of IdoA or IdoA2S can adopt either chair or skew-boat conformations (Figure 3.3B). Until now, only the 4C1 chair conformation has been verified experimentally for GlcA and GlcN in HS, but both the 1C4 chair and the 2S0 conformations have been found for IdoA2S residues in crystal structures containing HS. In solution, NMR studies show IdoA2S and IdoA residues to be present in a mixture of 1C4 and 2S0 conformations. The conformational flexibility in IdoA residues likely allows orientation of the sulfate groups in HS to maximize the binding affinity to proteins. Structural elements that dictate preferences for one form over the other, including the possible effects from the sulfated monosaccharide sequences around the IdoA/IdoA2S residue, are subject to further investigation. A second factor contributing to structural diversity and selective interactions with certain HS-binding proteins is the size of the sulfated saccharide domains. HS isolated from natural sources shows domain-like structures, with clusters of six to eight saccharides forming the highly sulfated domains known as S-domains. These regions are separated by nonsulfated saccharide residues, consisting of GlcA-GlcNAc RUs, known as NAc-domains. The S-domains contain primarily IdoA residues that likely contribute the flexibility needed to optimize binding to proteins and elicit desired biological activities. The contribution of NAc-domains to the functions of HS has not been fully established. However, a possible role may be to appropriately position S-domains in a single polysaccharide chain for interaction with multiple proteins. One example is the interaction of heparin with antithrombin and thrombin. In this complex, one part of the heparin chain interacts with antithrombin, and another part of the heparin chain interacts with thrombin. Between the antithrombin-binding domain and thrombin-binding domain, a linker of six to seven saccharide residues exists. Unlike proteins and nucleic acids, the biosynthesis of GAGs is not regulated by a well-defined template. Instead, each member of the GAG family is synthesized by a unique pathway (Chapter 17).'
 'In many cases when a protein binds to an HS chain, it induces a change in conformation of the IdoA2S residue resulting in a better fit and enhanced binding. IdoA2S residues have always been found in domains rich in N-sulfo and O-sulfo groups (for biosynthetic reasons; Chapter 17), which is also where proteins usually bind. Thus, the greater degree of conformational flexibility in these modified regions may explain why so many more proteins bind with high affinity to heparin, HS, and DS than to other GAGs. The presence of an N-acetyl group in an N-acetylglucosamine residue changes the preferred conformation of the neighboring IdoA residue, showing that even minor modifications can influence conformation and chain flexibility. Binding to GAGs that have a low degree of sulfation may require larger domains in the protein to interact with longer stretches of an oligosaccharide. Molecular dynamic simulations on large heparin oligosaccharides, even in the presence of proteins, are possible with recent advances in computer performance (Online Appendix 38A). Such simulations can be used to predict the conformational flexibility of different domains within the chain and, when combined with recent advances in protein–GAG docking, can provide additional insights into GAG–protein interactions. Conformation of heparin oligosaccharides. (A) Glucosamine (GlcN) and glucuronic acid (GlcA) exist in the 4C1 conformation, whereas iduronic acid (IdoA) exists in equally energetic conformations designated 1C4 and 2S0. (B) Space-filling model of a heparin (more...) The discovery of multiple GAG-binding proteins led a number of investigators to examine whether there is a consensus amino acid sequence for GAG binding. In retrospect, this strategy was overly simplistic because it assumed that all GAG-binding proteins have a common evolutionary origin and would recognize the same oligosaccharide sequence within heparin or, at least, sequences that would share many common features. It is now known that the convergently evolved GAG-binding proteins interact with different oligosaccharide sequences. The binding sites in the protein always contain basic amino acids (lysine and arginine), whose positive charges presumably interact with the negatively charged sulfates and carboxylates of the GAG chains. However, the arrangement of these basic amino acids can be quite variable, consistent with the variable positioning of sulfo groups in the GAG partner. Selectivity is also a function of H-bonding and van der Waal interactions of amino acid residues with the oligosaccharide. Most proteins are formed from α-helices, β-strands, and loops. Therefore, to engage a linear GAG chain electrostatically, the positively charged amino acid residues must align along the same side of the protein segment. α-Helices have periodicities of 3.4 residues per turn, which would require the basic residues to occur every third or fourth position along the helix to align with an oligosaccharide. In β-strands, the amino acid side chains alternate sides every other residue. Thus, to bind a GAG chain, the positively charged residues in a β-strand would be located quite differently than in an α-helix. On the basis of the structure of several heparin-binding proteins that were available in 1991, Alan Cardin and Herschel Weintraub proposed that typical heparin-binding sites had the sequence XBBXBX or XBBBXXBX, where B is lysine or arginine and X is any other amino acid. From the structural arguments provided above, it should be obvious that only some of the basic residues in these sequences could participate in GAG binding, the actual number being determined by whether the peptide sequence exists as an α-helix or a β-sheet. It is now known that the presence of these sequences in a protein merely suggests a possible interaction with heparin (or another GAG chain), but it does not prove that the interaction occurs under physiological conditions. In fact, the predicted binding sites for heparin in fibroblast growth factor 2 (FGF2) turned out to be incorrect once the crystal structure was determined.'
 'Figure 38.3D shows a model of a tetramer built on the known dimer structure (PDB id, 1U4L) and complexed with CS hexamers 4-O-sulfated on all three N-acetylgalactosamine residues of the GlcAβ1-3GalNAc repeats. Individual dimers are shown as green and sea green ribbons. Additional dimers can be added to each end to build a filament structure. The interactions between protein residues and charged groups on the CS involve a classic BBXB motif (R44, K45, N46, R47) plus a more remote arginine (R17). Each positively charged arginine is positioned to have strong electrostatic and hydrogen bond interactions with the negatively charged carboxylate of a glucuronic acid residue and 4-O-sulfo group of the following N-acetylgalactosamine residue. The positioning of these arginine residues may be unique to CS, and other GAG segments may bind quite differently. The model of the filament in Figure 38.3D is also not unique, and both positioning of dimeric subunits and flexibility in CS binding geometry may allow longer GAG chains to cross-link adjacent dimers and facilitate oligomerization. A final point of note is that the groups responsible for interaction with the CCR5 receptor on leukocytes are near the amino terminus, a segment deeply buried in the dimer interface. These groups may be transiently exposed on filament dissociation to release monomers or they may be more permanently exposed on filament ends. Much additional structural work will be required to fully understand the function of CCL5. In some cases, the interaction of GAG chains with proteins may depend on metal cofactors. For example, L- and P-selectins have been shown to bind to a subfraction of HS chains and heparin in a divalent-cation-dependent manner. This observation raises the possibility that other examples of cation-dependent interactions with GAG chains may exist. Indeed, annexin A2 and annexin V have been shown to bind HS in a calcium-dependent manner. The co-crystal structures of annexin A2 and annexin V with heparin oligosaccharides revealed that calcium ions can either directly or indirectly (through sequestered water) participate in the interactions with HS. Another example is calcium-dependent interaction between cytokine S100A12 and HS. In this case, formation of the functional HS-binding site requires a calcium-induced conformational change of S100A12. Although the vast majority of GAG–protein interactions were identified and studied under neutral pH, quite a few GAG-binding proteins have been shown to interact with GAG only under acidic pH. Such proteins include histidine-rich glycoproteins, cystatin-C, selenoprotein P, and serum amyloid A. There is good reason to believe that the interactions between these proteins and GAG are physiologically relevant because extracellular environments with acidic pH exist under many physiological and pathological conditions. In fact, for these proteins, pH change essentially functions as an on/off switch of their interactions with GAG, which might bear physiological significances. Not surprisingly, histidines are often found in the GAG-binding site of these proteins because of its pH-dependent protonation of the imidazole ring. A main technical challenge to understand GAG–protein interactions is to dissect the essential structural elements of GAGs that contribute to the binding. Unlike researchers studying DNA-binding proteins who have access to all possible DNA sequences, researchers studying GAG-binding proteins traditionally do not have access to GAG oligosaccharides with defined structures. Fortunately, this situation has begun to change in the last 5 years. With the rapid progress of chemoenzymatic and chemical synthesis (or a combination of both) of HS/CS oligosaccharides, a growing number of structural defined oligosaccharides (dp4-dp20) have become available. Many of the oligosaccharides have been used to generate microarrays for rapid determination of structural preference of GAG-binding proteins. Although we have not yet reached a stage at which we can freely design any GAG structures that we wish, the current technology can already provide a surprisingly large array of structures for structure–function studies of GAG-binding proteins.'
 'In some cases, there may be relatively little information on where the binding site on a protein is, so the characterization involves locating the best binding site, finding the best conformation for the ligand in the bound state, and finding the best conformations for the parts of the protein involved in binding. The whole process is referred to as “docking” a ligand onto a protein surface. Most docking programs (e.g., AutoDock, AutoDock Vina, and Glide) are designed to make the initial search for a site very efficient. To do this, they break the process into stages beginning with a rigid-body docking step that is designed to identify the best docking site and best initial “poses” for the ligand. Force fields are often simplified or interaction energies precalculated on a grid to speed up the process. Rigid-body docking generally works well for many small drug-like molecules. Also, in many situations, there is a crystal structure of the protein with a native ligand in the binding site, mitigating the problem of finding the binding pocket and optimizing side-chain conformations. For glycans, the situation is more complicated; the ligands are often flexible and protein structures with a native glycan in a binding site are often lacking. In molecular docking, the objective is not to generate a single bound structure in the first stage but hundreds of “poses” that can be scored and ranked so that a subset can be selected for subsequent stages. Scoring functions are variable but usually include some sort of interaction energy as part of the score. Subsequent phases typically allow increased flexibility of side-chains and finally an MD refinement of poses, often in explicit water. Final scoring or ranking of poses by energy, even when performed with force fields used in MD programs, seldom leads to a single clear solution, and it has become common to filter poses with additional experimental information such as binding epitopes from STD NMR experiments or interactions with residues that have been identified as important in mutational studies. Some docking programs are emerging (e.g., HADDOCK) that make use of experimental data in earlier stages to guide the selection of initial poses as well as maintain known preferences for glycan conformations or specific ligand–protein contacts. Some of the contributions to understanding of glycan–protein interactions that have come from docking exercises, as well as more advanced applications that merge QM with MD, are described in more detail in the following sections. Heparan sulfate (HS) chains, synthesized initially as a repeating disaccharide of glucuronic acid (GlcA) and N-acetylglucosamine (GlcNAc), and modified subsequently by sulfation and epimerization of some GlcA residues to iduronic acid (IdoA), are known to interact with a number of growth factors, receptors, and chemokines (Chapters 17 and 38). Despite the interest in the roles of these interactions in cell migration and differentiation, there are relatively few experimental structures depicting interactions with large HS fragments. The fact that suitable crystals are less apt to form in the presence of HS oligomers contributes to the lack of structures of complexes. Also, it is difficult to obtain homogeneous preparations of large oligomers, because of the variable sulfation patterns and variable conversion of GlcA to IdoA. Computational modeling offers an alternative route to structures for many of these complexes. Specific patterns of sulfation and IdoA substitution are generated with ease. Yet, there are some challenges related to the flexibility of the HS chains and the ionic character of interactions that dominate their energetics; glycosidic angles in HS chains are variable, and IdoA rings sample several conformations, including a chair, 1C4, and a skew-boat conformer, 2S0. Moreover, orientations of the sulfate groups are variable, as are the side-chains of the lysine and arginine residues with which they tend to interact. Enhanced docking methodology combined with MD simulations overcomes some of these challenges. Leukocyte common antigen-related protein (LAR) is a type IIa receptor protein tyrosine phosphatase (RPTP) important for signal transduction in biological processes, including axon growth and regeneration. Glycosaminoglycan chains, including HS, act as ligands that regulate LAR signal transduction.']",This conformational flexibility in IdoA residues likely allows orientation of the sulfate groups in HS to maximize the binding affinity to proteins.,"Structural elements that dictate preferences for one form over the other, including the possible effects from the sulfated monosaccharide sequences around the IdoA/IdoA2S residue, are subject to further investigation. A second factor contributing to structural diversity and selective interactions with certain HS-binding proteins is the size of the sulfated saccharide domains. HS isolated from natural sources shows domain-like structures, with clusters of six to eight saccharides forming the highly sulfated domains known as S-domains. These regions are separated by nonsulfated saccharide residues, consisting of GlcA-GlcNAc RUs, known as NAc-domains. The S-domains contain primarily IdoA residues that likely contribute the flexibility needed to optimize binding to proteins and elicit desired biological activities.",1.0,0.6664867934168577,0.7311015703468967,0.016129032258064516,0.99999999998,1.0
"Complete the following paragraph: After more than three billion years of evolution, every free-living cell and every cell type within eukaryotic organisms remains covered with a dense and complex layer of glycans (Chapter 20). Even enveloped viruses that bud from infected cells carry with them the glycosylation patterns of the host. Additionally, most secreted molecules are glycosylated and extracellular matrices of multicellular organisms are rich in glycans and glycoconjugates. Matrices secreted by unicellular organisms when they congregate (e.g., bacterial biofilms [Chapter 21]) also contain glycans. Thus, evolution has repeatedly and consistently selected glycans as being the most diverse and flexible molecules to position at the interface between cells and the extracellular milieu.","['NCBI Bookshelf. A service of the National Library of Medicine, National Institutes of Health. Varki A, Cummings RD, Esko JD, et al., editors. Essentials of Glycobiology [Internet]. 4th edition. Cold Spring Harbor (NY): Cold Spring Harbor Laboratory Press; 2022.  doi: 10.1101/glycobiology.4e.4 Karen J. Colley, Ajit Varki, Robert S. Haltiwanger, and Taroh Kinoshita. This chapter provides an overview of glycosylation from the perspective of a single cell, taking into account the patterns of expression, topology, and other features of the biosynthetic and degradative enzymes that are common to most cell types. The focus is mostly on the organization of glycosylation in eukaryotic cells. Chapters 21 and 22 further address prokaryotic glycosylation mechanisms. After more than three billion years of evolution, every free-living cell and every cell type within eukaryotic organisms remains covered with a dense and complex layer of glycans (Chapter 20). Even enveloped viruses that bud from infected cells carry with them the glycosylation patterns of the host. Additionally, most secreted molecules are glycosylated and extracellular matrices of multicellular organisms are rich in glycans and glycoconjugates. Matrices secreted by unicellular organisms when they congregate (e.g., bacterial biofilms [Chapter 21]) also contain glycans. Thus, evolution has repeatedly and consistently selected glycans as being the most diverse and flexible molecules to position at the interface between cells and the extracellular milieu. Possible reasons include their relative hydrophilicity, flexibility, and mobility in aqueous environments and their extreme diversity, allowing facile short-term and long-term adaptations to changing environments and pathogen regimes. In bacteria, Archaea, and fungi, glycans serve critical structural roles in the cell wall and in resisting large differences in osmolarity between cytoplasm and environment. In eukaryotes, both secretory proteins and membrane proteins typically pass through an endoplasmic reticulum (ER)–Golgi pathway, the cellular system in which many major glycosylation reactions occur (see below). Most proteins in the blood plasma of animals (with the exception of albumin) are also heavily glycosylated, and the glycosylation of these and other secreted proteins may provide solubility, hydrophilicity, and negative charge, thus reducing unwanted intermolecular interactions and protecting against proteolysis. Cell-surface membrane proteins like receptors, adhesion molecules, and channels are typically glycosylated, and this modification can promote their proper folding, ensure their stability, and impact function. The classic work of George Palade indicated that most cell-surface and secreted proteins in eukaryotic cells are cotranslationally translocated into the ER where they are folded, modified, and subjected to quality control mechanisms. They then make their way via an intermediate compartment (IC) through multiple stacks of the Golgi apparatus, finally being distributed to various destinations from the trans-Golgi network (TGN). Secretory pathway proteins can be N-glycosylated, O-glycosylated, and/or modified with glycosylphosphatidylinositol (GPI) anchors, and some called proteoglycans are modified with attached glycosaminoglycan chains. The enzymes involved in each of these modification pathways are distinct. N-linked glycans and GPI anchors are preassembled before being transferred to proteins and then further modified in the ER–Golgi pathway. The stepwise assembly of O-linked glycans and glycosaminoglycans, as well as the glycosylation of lipids, involve reactions in both the ER and Golgi (Chapters 9–13 and 17). Figure 4.1 superficially depicts some steps in the synthesis of the major glycan classes in the ER–Golgi pathway of animal cells. Initiation and maturation of the major types of eukaryotic glycoconjugates in relation to subcellular trafficking in the ER–Golgi–plasma membrane pathway.'
 'NCBI Bookshelf. A service of the National Library of Medicine, National Institutes of Health. Varki A, Cummings RD, Esko JD, et al., editors. Essentials of Glycobiology [Internet]. 4th edition. Cold Spring Harbor (NY): Cold Spring Harbor Laboratory Press; 2022.  doi: 10.1101/glycobiology.4e.20 Pascal Gagneux, Vladislav Panin, Thierry Hennet, Markus Aebi, and Ajit Varki. This chapter provides an overview of glycosylation patterns across biological taxa and discusses glycan complexity and diversity from an evolutionary perspective. As much of the currently available information concerns vertebrates, this chapter emphasizes comparisons between vertebrate glycans and those of other taxa. Evolutionary processes that likely determine generation of glycan diversity are briefly considered, including intrinsic host glycan-binding protein functions and interactions of hosts with extrinsic pathogens or symbionts. The genetic code is shared by all known organisms, and core functions such as gene transcription and energy generation are conserved across taxa. Complex glycans are found in all organisms in nature, and some have argued that polysaccharides were the original macromolecules contributing to the origin of life itself. Regardless of their origins, they vary immensely in structure and expression (abundance and patterns of distribution in and on cells, secretions, and extracellular matrices) both within and between evolutionary lineages. Partly because of inherent difficulties in elucidating their structures, our knowledge about this diversity remains limited, and there are few comprehensive data sets. For many taxa, there is a lack of any information on glycan profiles. Sufficient data are available to indicate that even though all living cells require a glycocalyx (a dense and complex array of cell-surface glycans), there is no evidence for a universal “glycan code,” akin to the genetic code. Importantly, glycan structures are not directly encoded in the genome. They are synthesized and modified by a network of enzymes in a template-independent manner, and glycophenotypes represent the outcome of co-expressed gene networks and nutrients. Glycans expressed by most free-living Bacteria (Eubacteria) and Archaea have relatively little in common with those of eukaryotes. They contain a much larger number of monosaccharide types and include many glycans exclusive to such microbes. In contrast, most major glycan classes in animal cells seem to be represented in some related form among other eukaryotes, and sometimes in Archaea. Figure 20.1 shows a circular depiction of the phylogeny of cellular life on earth. The rich glycan diversity encountered in the best-studied vertebrate species suggests similar diversity in other groups of organisms, and existing information points to complicated patterns. On the one hand, glycan patterns can form “trends” and characterize entire phylogenetic lineages, wherein one encounters further biochemical variation with subsets unique to certain sublineages. Conversely, many glycans show discontinuous distribution across phyla and distantly related organisms can produce surprisingly similar glycans, using either shared, ancient pathways or convergently (independently) evolved mechanisms. Circular depiction of phylogeny of cellular forms of life on earth. The lines inside the circle represent all 2.3 million species that have been named. However, biologists have genomic sequences for only ∼5% of them; as more sequences become available, (more...) The broadest base of evolutionary information concerns asparagine–N-linked glycans, a “general” glycosylation system found in all domains of life (Chapter 9). In prokaryotes, protein N-glycosylation takes place in the periplasm at the plasma membrane, whereas in eukaryotes, covalent attachment of an oligosaccharide takes place intracellularly at the endoplasmic reticulum (ER) membrane, with the protein-bound glycan being further processed in the ER and Golgi.'
 'The diverse functions ascribed to glycans can be simply divided into two general categories: (i) structural and modulatory functions (involving the glycans themselves or their modulation of the molecules to which they are attached) and (ii) specific recognition of glycans by glycan-binding proteins. Of course, any given glycan can mediate one or both types of functions. The binding proteins in turn fall into two broad groups: lectins and sulfated GAG-binding proteins (Chapters 27, 28, and 38). Such molecules can be either intrinsic to the organism that synthesized the cognate glycans (e.g., see Chapters 31–36, 38, and 39) or extrinsic (see Chapters 37 and 42 for information concerning microbial proteins that bind to specific glycans on host cells). The atomic details of these glycan–protein interactions have been elucidated in many instances (Chapters 29 and 30). Although there are exceptions to this notion, the following general theme has emerged regarding lectins: monovalent binding tends to be of relatively low affinity, and such systems typically achieve their specificity and function by achieving high avidity, via interactions of multivalent arrays of glycans with cognate lectin-binding sites. Whenever a new tool (e.g., an antibody or lectin) specific for detecting a particular glycan is developed and used to probe its expression in intact organisms, it is common to find exquisitely specific temporal and spatial patterns of expression of that glycan in relation to cellular activation, embryonic development, organogenesis, and differentiation (see Chapter 41 for examples). Certain relatively specific changes in expression of glycans are also often found in the course of transformation and progression to malignancy (Chapter 47), as well as other pathological situations such as inflammation (Chapter 46). These spatially and temporally controlled patterns of glycan expression imply the involvement of glycans in many normal and pathological processes, the precise mechanisms of which are understood in only some cases. Remarkably little is still known about the evolution of glycosylation. There are clearly shared and unique features of glycosylation in different kingdoms and taxa. Among animals, there may be a trend toward increasing complexity of N- and O-glycans in more recently evolved (“higher”) taxa. Intraspecies and interspecies variations in glycosylation are also relatively common. It has been suggested that the more specific biological roles of glycans are often mediated by uncommon structures, unusual presentations of common structures, or further modifications of the commonly occurring saccharides themselves. Such unusual structures likely result from unique expression patterns of the relevant glycosyltransferases or other glycan-modifying enzymes. On the other hand, such uncommon glycans can be targets for specific recognition by infectious microorganisms and various toxins. Thus, at least some of the diversity in glycan expression in nature must be related to the evolutionary selection pressures generated by interspecies interactions (e.g., of host with pathogen or symbiont). In other words, the two different classes of glycan recognition mentioned above (mediated by intrinsic and extrinsic glycan-binding proteins) are in competition with each other with regard to a particular glycan target. The specialized glycans expressed by parasites and microbes that are of great interest from the biomedical point of view (Chapters 21, 22, 23, and 43) may themselves be subject to evolutionary selection pressures. These issues are further considered in Chapter 20, which also discusses the limited information concerning how various glycan biosynthetic pathways appear to have evolved and diverged in different life-forms. Numerous natural bioactive molecules are glycoconjugates, and the attached glycans can have dramatic effects on the biosynthesis, stability, action, and turnover of these molecules in intact organisms. For example, the sulfated glycosaminoglycan heparin and its derivatives are among the most commonly used drugs in the world. The aminoglycoside antibiotics all have carbohydrate components essential for activity. For this and many other reasons, glycobiology and carbohydrate chemistry have become increasingly important in modern biotechnology. Patenting a glycoprotein drug, obtaining FDA approval for its use, and monitoring its production all require knowledge of the structure of its glycans.'
 'Compared to other types of glycans, structural polysaccharides show relatively little variation in evolution, which may indicate a more stringent selection for chemical and mechanical properties required for their functions. Interestingly, some of these structures, such as glycosaminoglycans, can also play nonstructural roles in other biological contexts, including cell signaling, which adds additional selection forces driving their evolution. Viruses typically have minimalist genomes and use host-cell machinery for replication. Thus, glycosylation of enveloped viruses reflects that of the host. However, there are exceptions. Giant viruses such as the algae-targeting chlorella virus and members of the amoeba-targeting Mimiviridae family have genomes large enough that they can express their own glycosylation machineries. On a smaller scale, specific viruses express glycosyltransferases as virulence factors. For instance, a baculovirus-encoded glucosyltransferase glycosylates insect host ecdysteroid hormones to block molting, and bacteriophage-derived glucosyltransferases modify 5-hydroxymethyl cytosine bases in the phage DNA to protect it from bacterial restriction enzymes. Host-derived glycosylation in enveloped viruses is typically extensive and the resulting “glycan shield” protects the virus from immune reactions against the underlying polypeptide. In this regard, it has been suggested that the high frequency of heterozygous states for human congenital disorders of glycosylation (Chapter 44) may reflect selection for genomes that limit glycosylation of invading viruses. Host lectins may also be “hijacked” by glycans on viral surface glycoproteins. For example, Sialoadhesin (Siglec-1; Chapter 15) is used by the heavily sialylated porcine reproductive and respiratory syndrome virus (PRRSV) to gain entry into macrophages. Viral protein sequence can also influence host glycosylation (e.g., by structural constraints on access for glycosyltransferases or hydrolases), in a manner that favors viral antigenicity, such as the high-mannose N-glycans on HIV-1 envelope gp120 trimers. Despite the enormous potential for structural diversity, a rather limited subset of all possible monosaccharides and their possible linkages and modifications are found in eukaryotic cells. Why one encounters only such a limited subset of the possible glycan structures is a puzzling question. Could there be trade-offs between the variety of glycan structures and the additional resources, such as energy and biosynthetic pathways, that cells/organisms need in order to maintain that variety? Or maybe the variety of structures is limited by a combination of positive and negative selection due to both, its intrinsic functions and interactions with symbionts and pathogens? Regardless, this limited subset has allowed better elucidation of structures of eukaryotic glycans. In contrast, Bacteria and Archaea have had several billion additional years to respond to selective pressure from pathogens; in particular, phages. These organisms also have short generation times and can exchange genetic material across vast phylogenetic distances via plasmid-mediated horizontal gene flow. Glycosylation in Bacteria and Archaea is far more diverse, both in terms of the range of monosaccharides used or synthesized, and in the types of linkages and modifications (Chapters 21 and 22). In addition, prokaryotic cell–cell interactions both within and between species are often mediated by glycans. However, most work to date has focused on the glycans of pathogens, and we may have barely scratched the surface of prokaryotic glycan diversity. Despite great differences between pathways generating glycan structures of bacteria and those of vertebrates, occasional microbial surface structures are strikingly similar to those of mammalian cells. Interestingly, most such examples of “molecular mimicry” occur in pathogenic/symbiotic microorganisms, apparently adapting them for better survival in the host by avoiding, reducing, or manipulating host immunity.'
 'Last but not least, innate immune mechanisms are kept in check in vivo via recognition of self-associated molecular patterns (SAMPs). Pathogens that invade multicellular animals sometimes decorate themselves with glycan structures that are identical or nearly identical to those on host cell surfaces (Chapters 42 and 43). Such glycans block recognition of underlying antigenic epitopes, restrict immune cell complement system activation, and can also mimic SAMPs of hosts, all of which are successful strategies for evading host immune responses. Perhaps not surprisingly, pathogens have evolved this state of molecular mimicry by making use of “every possible trick in the book,” including direct or indirect appropriation of host glycans, convergent evolution toward similar biosynthetic pathways, and even lateral gene transfer. In some instances, the impact of the pathogen is aggravated by autoimmune reactions, resulting from host reactions to these self-like antigens. Pathogens and parasites also engage in glycogimmickry—to cite just a few examples, the gut symbiont Bacteroides fragilis induces tolerogenic states of gut immunity using a pentasaccharide called polysaccharide A, mycobacterial lipoarabinomannan (LAM) binding to host dendritic cell–specific intercellular adhesion molecule-3-grabbingcnonintegrin (DC-SIGN) induces expression of the inhibitory cytokine IL-10, and helminthic parasites have evolved many ways to modulate the immune response of their hosts toward prolonged tolerance, using specific immunomodulatory glycans. Secreted and soluble milk oligosaccharides (all extensions of the disaccharide lactose) of mammals provide an example of trans-generational glycan manipulation of microbial symbionts or pathogens in the infant by maternal glycans. These glycans have potent effects by favoring symbionts and blocking pathogenic microbes (bacteria and viruses) of the infant gut. Expression of certain glycans on different glycoconjugates in different tissues at different stages of development implies diverse roles for these glycan structures within the same organism. For example, Man-6-P-containing glycans were first found on lysosomal enzymes and are involved in lysosomal trafficking (Chapter 33). However, such glycans are now known to occur on some apparently unrelated proteins, for different functional roles. Likewise, the sialylated fucosylated lactosamines critical for selectin recognition (Chapter 34) are found in a variety of unrelated cell types in mammals, and the polySia chains that play an important part in embryonic nervous system neural cell adhesion molecule (NCAM) function (Chapter 15) are also found on a G protein–coupled receptor (GPCR) (CCR7) expressed in dendritic cells, where they appear to be important for targeting of these cells to the lymph nodes. Given that glycans are added posttranslationally, these observations should not be surprising. Once a new glycan or modification has been expressed in an organism, several distinct functions could evolve independently in different tissues and at different times in development. If any of these situations mediated a function valuable to survival and reproduction, the genetic mechanisms responsible for expression of the glycan and its expression pattern would remain conserved in evolution. A further example of dual roles is the recognition of fragments of structural glycans as danger or damage-associated molecular patterns (DAMPs) by the immune systems of multicellular organisms. Examples include cell wall fragments in plants and hyaluronan fragments in vertebrates. The core structures of major glycan classes tend to be conserved across many species; for example, the core structure of N-glycans is conserved across all eukaryotes and at least some Archaea (Chapter 9). However, there can be considerable diversity in outer-chain glycosylation, even among relatively similar species. Such interspecies variation in glycan structure indicates that some glycan sequences do not have fundamental and universal roles in all tissues and cell types in which they are expressed. Of course, such diversity could be involved in generating differences in morphology and function between species. Such variations could also reflect the outcome of differing selection pressures by exposure to variant pathogen regimes. Furthermore, significant intraspecies polymorphism in glycan structure can exist without obvious functional value, although they may be involved in the interplay between parasites and host populations (Chapter 20).']","Evolution has consistently favored glycans as the most diverse and flexible molecules to position at the interface between cells and the extracellular milieu. This is evident in the dense and complex layer of glycans covering every free-living cell and cell type within eukaryotic organisms, the glycosylation patterns carried by enveloped viruses from infected cells, the glycosylation of most secreted molecules, and the presence of glycans and glycoconjugates in extracellular matrices of multicellular organisms and matrices secreted by unicellular organisms like bacterial biofilms.","Possible reasons include their relative hydrophilicity, flexibility, and mobility in aqueous environments and their extreme diversity, allowing facile short-term and long-term adaptations to changing environments and pathogen regimes. In bacteria, Archaea, and fungi, glycans serve critical structural roles in the cell wall and in resisting large differences in osmolarity between cytoplasm and environment. In eukaryotes, both secretory proteins and membrane proteins typically pass through an endoplasmic reticulum (ER)–Golgi pathway, the cellular system in which many major glycosylation reactions occur (see below). Most proteins in the blood plasma of animals (with the exception of albumin) are also heavily glycosylated, and the glycosylation of these and other secreted proteins may provide solubility, hydrophilicity, and negative charge, thus reducing unwanted intermolecular interactions and protecting against proteolysis. Cell-surface membrane proteins like receptors, adhesion molecules, and channels are typically glycosylated, and this modification can promote their proper folding, ensure their stability, and impact function.",1.0,0.6660570466725865,0.7515235673916615,0.03731343283582089,0.99999999998,1.0
"Complete the following paragraph: In eukaryotic cells, glycosylation occurs mostly in the endoplasmic reticulum (ER) and Golgi apparatus, whereas monosaccharide activation and interconversions occur mostly in the cytoplasm. Nucleotide sugar–specific transporters carry activated sugar donors into the Golgi and to a lesser extent into the ER. In some cases, nucleotide sugars are used to synthesize activated lipid-linked intermediates before glycan transfer. This chapter describes how cells accomplish these tasks, with an emphasis on animal cells.","['NCBI Bookshelf. A service of the National Library of Medicine, National Institutes of Health. Varki A, Cummings RD, Esko JD, et al., editors. Essentials of Glycobiology [Internet]. 4th edition. Cold Spring Harbor (NY): Cold Spring Harbor Laboratory Press; 2022.  doi: 10.1101/glycobiology.4e.5 Hudson H. Freeze, Michael Boyce, Natasha E. Zachara, Gerald W. Hart, and Ronald L. Schnaar. In nature, most glycans are synthesized by glycosyltransferases, enzymes that transfer activated forms of monosaccharides from nucleotide sugars and lipid-linked sugar intermediates to acceptors, including proteins, lipids, and growing glycan chains. Monosaccharide precursors are imported into the cell, salvaged from degraded glycans, or created enzymatically from other sugars within the cell. In eukaryotic cells, glycosylation occurs mostly in the endoplasmic reticulum (ER) and Golgi apparatus, whereas monosaccharide activation and interconversions occur mostly in the cytoplasm. Nucleotide sugar–specific transporters carry activated sugar donors into the Golgi and to a lesser extent into the ER. In some cases, nucleotide sugars are used to synthesize activated lipid-linked intermediates before glycan transfer. This chapter describes how cells accomplish these tasks, with an emphasis on animal cells. Glucose and fructose are the major carbon and energy sources for organisms as diverse as yeast and humans. Most organisms can synthesize the other monosaccharides needed for glycan biosynthesis from these sources. Not all of these biosynthetic pathways are equally active in all types of cells. However, there are some general principles. Monosaccharides must be activated to a high-energy donor for use in glycan synthesis. This process requires nucleoside triphosphates (typically UTP or GTP) and a glycosyl-1-P (monosaccharide with a phosphate at the anomeric carbon). They can be activated by a kinase (reaction 1) or generated from a previously synthesized activated nucleotide sugar (reactions 2 and 3):    The most common nucleotide sugar donors in animal cells are shown in Table 5.1. Sialic acids and their evolutionary ancestors (prokaryotic nonulosonic acids and Kdo) are the only monosaccharides in animals activated as CMP-mononucleotides. Iduronic acid does not have a nucleotide sugar parent because it is formed by epimerization of glucuronic acid after it is incorporated into glycosaminoglycan (GAG) chains. In some instances, one nucleotide sugar can be formed from another either by direct epimerization (reaction 2 above) or by a nucleotide exchange reaction (reaction 3 above). For example, UDP-Gal is made from UDP-Glc by exchange of Gal-1-P for Glc-1-P. Activated sugar donors in animal cells  Three types of sugar transporters carry sugars across the plasma membrane into cells. First are energy-independent facilitated diffusion transporters, such as the glucose transporter (GLUT) family of hexose transporters found in yeast and most mammalian cells. The genes encoding these proteins are named SLC2A (solute carriers 2A). Second are energy-dependent transporters—for example, the sodium-dependent glucose transporters (SGLT; gene names SLC5A) in intestinal and kidney epithelial cells. The third type includes transporters that couple ATP-dependent phosphorylation with sugar import. These are found in bacteria (Chapter 21) and are not covered in this chapter. GLUT family transporters were first described in yeast, where at least 18 genes are known. Humans have 14 GLUT homologs. GLUT transporters range in size from ∼40 to 70 kDa and have a similar structure, containing 12 membrane-spanning domains, which is typical of many eukaryotic transporters. The transmembrane domains form a barrel with a small pore for sugar passage. Compared with GLUT1, the other family members have a modest (28%–65%) amino acid identity.'
 'Figure 4.1 superficially depicts some steps in the synthesis of the major glycan classes in the ER–Golgi pathway of animal cells. Initiation and maturation of the major types of eukaryotic glycoconjugates in relation to subcellular trafficking in the ER–Golgi–plasma membrane pathway. This illustration outlines the different mechanisms and topology for initiation, (more...) In the ER–Golgi pathway, some glycan chains are made on the cytoplasmic face of intracellular membranes and flipped across to the other side, but most are added to the growing chain on the inside of the ER or the Golgi (Figure 4.1). Regardless, the portion of a molecule that faces the inside of the lumen of the ER or Golgi will ultimately face the outside of the cell or the inside of a secretory granule or lysosome. To date, there are no well-documented exceptions to this topological rule. Of course, these topological considerations are reversed for nuclear and cytoplasmic glycosylation (see below), because the active sites of the relevant glycosyltransferases for these reactions face the cytoplasm. Not surprisingly then, the types of glycans found on the two sides of the cell membrane so far appear to be distinct from each other. Some “leaderless secretory proteins” destined for the extracellular space never enter the ER lumen, but are instead transferred directly through the plasma membrane, by as yet poorly defined mechanisms, including cytokines such as IL-1β and IL-18, growth factors such as fibroblast growth factor 2 (FGF2), and galectins. Interestingly, many of these proteins have glycan binding properties, which would presumably cause problems if they instead traversed the glycan rich ER–Golgi pathway. Regardless of location, most glycosylation reactions use activated forms of monosaccharides (often nucleotide sugars and in some cases lipid-phosphate-linked sugars, such as dolichol phosphate mannose) as donors for glycosyltransferases (see Chapter 5 for a listing of some enzymes, their donors and corresponding transporters, and details about their biochemistry). A variety of glycan modifications also occur in nature (Chapter 6). Of these, the most common are generated by sulfotransferases, acetyltransferases, and methyltransferases, which use activated forms of sulfate (3′-phosphoadenyl-5′-phosphosulfate; PAPS), acetate (acetyl-CoA), and methyl groups (S-adenosylmethionine; AdoMet), respectively. Almost all donors for glycosylation reactions and glycan modifications are synthesized within the cytosolic compartment, from precursors of endogenous origin. In eukaryotes, most of these donors are actively transported across a membrane bilayer by specific multipass transporter proteins, becoming available for reactions within the lumen of the ER–Golgi pathway. For many years, the nucleus and cytosol (which are topologically semicontinuous via nuclear pores) were assumed to be devoid of glycosylation capacity. It is now established that distinct glycoconjugates are synthesized and reside within these compartments. Indeed, one of them (O-linked GlcNAc; Chapter 19) may well be quantitatively the most common type of glycoconjugate in many cells. Both the O-GlcNAc transferase (OGT) responsible for synthesizing O-linked GlcNAc on nuclear and cytosolic proteins and the O-GlcNAcase (OGA) that removes this monosaccharide are soluble proteins in these compartments. In addition, select cytosolic proteins can be modified with O-Glc, O-Fuc, or O-Man (Chapters 18 and 19). Because prokaryotic cells do not have an ER–Golgi pathway, they typically generate their cell-surface glycans at the interface of the cytoplasmic membrane and the cytoplasm or in the periplasm (see below). Other glycoconjugates like hyaluronan in vertebrate cells, chitin in invertebrate cells, and cellulose in plant cells are synthesized on the cytoplasmic face of the plasma membrane and simultaneously extruded across the membrane to the outside (Chapters 16, 24, and 26).'
 'This transport mechanism was determined biochemically in isolated vesicles and genetically in various mutant cell lines. The Km of the transporters ranges from 1 to 10 µm. Using in vitro systems, the transporters have been shown to increase the concentration of the nucleotide sugars within the Golgi lumen by 10- to 50-fold. This is usually sufficient to reach or exceed the calculated Km of glycosyltransferases that use these donors. Some known transporters for nucleotide sugars, PAPS (3′-phosphoadenosine-5′-phosphosulfate), and ATP are located in the Golgi membranes of mammals, yeast, protozoa, and plants. These proteins are antiporters and return the corresponding (more...) Most of these antiporters are found in the Golgi, but some are also found in the ER. They are organelle-specific and their location usually corresponds to the location of the relevant glycosyltransferases (Table 5.2; Figure 5.4). Nucleotide sugar import into the Golgi is not energy-dependent nor affected by ionophores. However, the import is competitively inhibited by the corresponding nucleoside monophosphates and diphosphates in the cytosol but not by the monosaccharides. There are also transporters for ATP and PAPS (3′-phosphoadenosine-5′-phosphosulfate), which are used for carbohydrate and protein sulfation. Nucleotide transport in Golgi and ER  The glucuronidation of bile and xenobiotic compounds in the ER explains the need for UDP-GlcA transporter in the ER of liver cells. The presence of a Golgi transporter is consistent with the location of the glycosyltransferases that use UDP-GlcA for the formation of GAG chains and other classes of glycans. The observation that reglycosylation of misfolded glycoproteins occurs in the ER (Chapter 39) explains the need for an ER UDP-Glc transporter. Under stressful conditions, synthesis of lumenal uridine diphosphatase increases to accommodate increased transport of UDP-Glc needed for reglycosylation of misfolded glycoproteins. The existence of UDP-GlcNAc, UDP-GalNAc, and UDP-Xyl transporters in the ER may mean that some reactions thought to occur exclusively in the Golgi may also occur in the ER. A good example is the synthesis of O-fucosylated proteins, such as Notch, in the ER versus fucosylation of N- and O-linked chains in the Golgi (Chapter 13). Other, as-yet-undiscovered, glycosylation reactions may also occur in the ER. Mutations in several nucleotide sugar transporters, UDP-Gal, CMP-Sia, GDP-Fuc, UDP-GlcA/UDP-GalNAc, and UDP-GlcNAc cause human glycosylation disorders (Chapter 45), generating incomplete sugar chains. Mutant mammalian cell lines also lack specific nucleotide sugar transporters (e.g., for UDP-Gal or CMP-Sia; Chapter 49). However, there is some “leakiness” in such mutants. For instance, loss of the UDP-Gal transporter in the Golgi of mutant MDCK (Madin–Darby canine kidney) cells decreases the synthesis of keratan sulfate and galactosylated glycoproteins and glycolipids, but leaves heparan and chondroitin sulfate unaffected. This is probably because the galactosyltransferases that synthesize the core region tetrasaccharide common to GAG chains have lower Km values for their donors (Chapter 17). Many putative transporters were identified by homology in the genomes of mammals, Drosophila melanogaster, C. elegans, plants, and yeast. Like the plasma membrane GLUT transporters discussed above, all are multimembrane-spanning (type III) proteins, but the level of amino acid identity does not give any clue to the substrate specificity. The UDP-GlcNAc transporters from mammalian cells and yeast are 22% identical, whereas mammalian CMP-Sia, UDP-Gal, and UDP-GlcNAc transporters have 40%–50% identity.'
 'Because prokaryotic cells do not have an ER–Golgi pathway, they typically generate their cell-surface glycans at the interface of the cytoplasmic membrane and the cytoplasm or in the periplasm (see below). Other glycoconjugates like hyaluronan in vertebrate cells, chitin in invertebrate cells, and cellulose in plant cells are synthesized on the cytoplasmic face of the plasma membrane and simultaneously extruded across the membrane to the outside (Chapters 16, 24, and 26). The enzymes involved in the synthesis of these glycoconjugates appear to mediate this extrusion. Typical eukaryotic Golgi glycosylation enzymes have also been found at the cell surface or as soluble forms in the extracellular space, as described below. Whether these glycosyltransferases would routinely have adequate supplies of nucleotide sugar donors to modify cell-surface glycans is unclear, but at least one example has been documented (see below). On the other hand, there are examples of remodeling of cell-surface glycans in animal cells—for example, the endosulfatases (Sulf enzymes) that modify heparan sulfate glycosaminoglycan (Chapter 17) and endogenous sialidases that remove cell-surface sialic acids (Chapter 15). Some protozoan parasites, such as trypanosomes, transfer sialic acids from host glycoconjugates to their cell-surface glycans using trans-sialidases (Chapter 43). Prokaryotic assembly pathways of polysaccharides and oligosaccharides are very similar to pathways found in the ER and the plasma membrane of eukaryotes. They are assembled in the cytoplasm and then translocated across the plasma membrane. For many biosynthetic pathways, such as O-antigen biosynthesis in Gram-negative bacteria, N-linked protein glycosylation in Archaea, and some Gram-negative bacteria or S-layer biosynthesis in Gram-positive bacteria, oligosaccharides are assembled on lipid carriers at the inner site of the plasma membrane and then flipped to the periplasmic site (Chapters 21 and 22). Synthesis of oligosaccharides can continue in the periplasm, but for these reactions, isoprenoid-linked monosaccharides serve as activated substrates as is the case in cell wall biogenesis of actinobacteria (mycobacteria) (Chapter 21). Much effort has gone into understanding the mechanisms of glycosylation and glycan modification within the ER and the Golgi apparatus, and it is clear that a variety of interacting and competing factors determine the final outcome of the reactions. The glycosyltransferases and processing glycosidases are well-studied (Chapter 6), and their location has helped to define various functional compartments of the ER–Golgi pathway. Despite lack of sequence homology among different glycosyltransferase families, most Golgi enzymes share some features. Early studies of vertebrate glycosyltransferases found some of these activities in soluble form in secretions and body fluids; others were identified as membrane-bound activities within cells, and some showed both properties. Subsequent molecular cloning defined the sequences of Golgi glycosyltransferases, revealing that they share a common topology and domain structure that can account for these observations. The majority of Golgi glycosylation enzymes are type II membrane proteins consisting of three parts: an amino-terminal cytoplasmic tail, followed by a transmembrane (TM) region that also acts as an uncleavable signal sequence, and a large carboxy-terminal region containing a membrane-proximal, proteolytically sensitive stem region as well as a large catalytic domain. The type II topology of these Golgi enzymes places their catalytic sequences in the Golgi lumen, where they participate in the synthesis of the glycan chains on proteins and lipids during their transit through the secretory pathway (Figure 4.2). Topology and localization of Golgi glycosylation enzymes. Golgi glycosyltransferases and glycosidases are type II membrane proteins with their catalytic sequences facing the lumen of the Golgi.'
 'In contrast, bacterial and plant polysaccharides and glycoproteins frequently contain a variety of deoxysugars, deoxyaminosugars, and branched-chain sugars. These diverse sugars often have potent biological properties. For example, aminoglycoside antibiotics like streptomycin bind to the bacterial ribosome to disrupt protein synthesis. Deoxyhexoses are often immunological determinants of lipopolysaccharides or O-antigens of the Salmonella species. Five of the eight possible 3,6-dideoxyhexoses have been found in these organisms at the nonreducing end of the Gram-negative cell wall lipopolysaccharide. Other deoxyhexoses, such as a 4,6-dideoxy-hexose and a 2,3,6-trideoxyhexose, are also biologically significant but so far seem to be uncommon in nature. Biosynthesis of both deoxysugars and dideoxysugars begins with the oxidation of C-4, similar to the first step of the conversion of GDP-Man to GDP-Fuc. The nucleotide (N) differs for the various sugars, and the individual pathways use different dehydratases. For example, biosynthesis of most 3,6-dideoxyhexoses (except colitose) begins with conversion of CDP-glucose to CDP-4-keto-6-deoxyhexose by NAD+-dependent CDP-glucose dehydratase. In the biosynthesis of abequose (3,6-dideoxy-D-xylohexose), the product, CDP-6-deoxy-L-threo-D-glycero-hexulose, is then converted in two additional steps to CDP-3,6-dideoxy-D-glycero-D-glycero-4-hexulose by a second dehydratase followed by a reductase. Amino sugars, such as glucosamine, arise from keto sugars by the addition of an amino group from glutamine (Figure 5.1). In addition, bacteria and plants have many 6-deoxy-hexoses with amino groups in the 2, 3, or 4 positions. For example, daunosamine is a 3-amino-6-deoxyhexose that is found in the antibiotic daunomycin. Here, TDP-glucose is dehydrated to 3-keto-6-deoxyglucose and the amino group is added via a transamination reaction, probably involving a vitamin B6-dependent reaction. Plants and bacteria also contain a number of branched-chain sugars. For instance, apiose is a component of the polysaccharide apiogalacturonan of L. minor, and strepose is a component of the antibiotic streptomycin, produced by Streptomyces griseus. Apiose (Figure 5.2) is synthesized from UDP-GlcA via a 4-keto intermediate that can yield UDP-Xyl or UDP-apiose. Apiose synthesis removes carbon 3 from the chain to give the branched sugar by an unknown mechanism. Although the syntheses of other branched-chain sugars have not been delineated, they probably follow similar reaction pathways. In eukaryotes, nucleotide sugars are synthesized in the cytoplasm or nucleus, whereas most glycosylation occurs inside the ER or Golgi compartments (exceptions being hyaluronan [Chapter 16] and nucleocytoplasmic glycosylation [Chapters 18 and 19]). Therefore, newly synthesized nucleotide sugars are on the “wrong” side of the membrane for most glycosylation reactions and so must be transported into the ER and Golgi. Negative charge prevents these donors from simply diffusing into these compartments. To overcome this hurdle, eukaryotic cells have a set of energy-independent nucleotide sugar antiporters that deliver nucleotide sugars into the lumen of these organelles, with the simultaneous exiting of nucleoside monophosphates, most of which must first be generated from the nucleoside diphosphates by a nucleoside diphosphatase (Figure 5.4). This transport mechanism was determined biochemically in isolated vesicles and genetically in various mutant cell lines. The Km of the transporters ranges from 1 to 10 µm.']","The chapter describes how cells accomplish glycosylation tasks, emphasizing animal cells. Glycosylation primarily occurs in the ER and Golgi, while monosaccharide activation and interconversions mainly take place in the cytoplasm. Nucleotide sugar transporters play a crucial role in carrying activated sugar donors into the Golgi and, to a lesser extent, into the ER. Additionally, in some instances, nucleotide sugars are utilized to generate activated lipid-linked intermediates before glycan transfer.","Glucose and fructose are the major carbon and energy sources for organisms as diverse as yeast and humans. Most organisms can synthesize the other monosaccharides needed for glycan biosynthesis from these sources. Not all of these biosynthetic pathways are equally active in all types of cells. However, there are some general principles. Monosaccharides must be activated to a high-energy donor for use in glycan synthesis. This process requires nucleoside triphosphates (typically UTP or GTP) and a glycosyl-1-P (monosaccharide with a phosphate at the anomeric carbon). They can be activated by a kinase (reaction 1) or generated from a previously synthesized activated nucleotide sugar (reactions 2 and 3)",1.0,0.6782481171227095,0.6430643595747216,0.015748031496062992,0.99999999998,0.8333333333333334
"Complete the following paragraph: The biosynthesis of glycans is primarily determined by glycosyltransferases that assemble monosaccharide moieties into linear and branched glycan chains. As might be expected from the complex array of glycan structures found in nature, glycosyltransferases constitute a very large family of enzymes.","['NCBI Bookshelf. A service of the National Library of Medicine, National Institutes of Health. Varki A, Cummings RD, Esko JD, et al., editors. Essentials of Glycobiology [Internet]. 4th edition. Cold Spring Harbor (NY): Cold Spring Harbor Laboratory Press; 2022.  doi: 10.1101/glycobiology.4e.6 James M. Rini, Kelley W. Moremen, Benjamin G. Davis, and Jeffrey D. Esko. Glycosyltransferases and glycosidases are responsible for the assembly, processing, and turnover of glycans. In addition, there are a number of transferases that modify glycans by the addition of acetyl, methyl, phosphate, sulfate, and other groups. This chapter covers the general characteristics of enzymes involved in glycan initiation, assembly, and processing, including aspects of substrate specificity, primary sequence relationships, structures, and enzyme mechanisms. The biosynthesis of glycans is primarily determined by glycosyltransferases that assemble monosaccharide moieties into linear and branched glycan chains. As might be expected from the complex array of glycan structures found in nature, glycosyltransferases constitute a very large family of enzymes. In many cases, they catalyze a group-transfer reaction in which the monosaccharide moiety of a simple nucleotide sugar donor (electrophile) substrate (e.g., UDP-Gal, GDP-Fuc, or CMP-Sia; Chapter 5) is transferred to the acceptor (nucleophile) substrate. In some instances, the donor substrates contain a lipid moiety, such as dolichol-phosphate, linked to mannose or glucose. For other glycosyltransferases, the donor substrate is dolichol-pyrophosphate, linked to an oligosaccharide, and in these cases the entire oligosaccharide is transferred en bloc to the acceptor substrate (Chapter 9). Similarly, other lipid-linked sugars serve as donor substrates for bacterial glycosyltransferases involved in the assembly of peptidoglycan (e.g., GlcNAc-MurNAc(pentapeptide)-undecaprenyl pyrophosphate), lipopolysaccharide, and capsules (Chapters 21 and 22). Glycosyltransferases that use monosaccharides, oligosaccharides, proteins, lipids, small organic molecules, and DNA as acceptor substrates have been characterized (activity to RNA has also been suggested), but only glycosyltransferases involved in the biosynthesis of glycoproteins, proteoglycans, and glycolipids are discussed in this chapter. Among these enzymes, the vast majority is responsible for elongating the glycan moieties of these glycoconjugates; the remainder is responsible for the transfer of either a mono- or oligosaccharide directly to the polypeptide or lipid. Generally speaking, the enzymes that elongate glycans act sequentially so that the product of one enzyme yields a preferred acceptor substrate for the subsequent action of another. The end result is a linear and/or branched structure composed of monosaccharides linked to one another. Acceptor recognition by these glycan-elongating glycosyltransferases does not typically involve the polypeptide or lipid moiety of the acceptor substrate when it exists, although there are several notable exceptions as discussed below. Glycosidases that remove monosaccharides to form intermediates that are then acted on by glycosyltransferases also play a role in the biosynthesis of some glycan types. These are to be contrasted with glycosidases that are involved in the degradation of glycans (e.g., in lysosomes [Chapter 44]). In addition, glycans can be modified by many other enzyme types, including sulfotransferases, phosphotransferases, O-acetyltransferases, O-methyltransferases, pyruvyltransferases, and phosphoethanolamine transferases. Most glycosyltransferases show a high degree of specificity for both their donor and acceptor substrates, and this led Saul Roseman and coworkers to advance the “one enzyme–one linkage” hypothesis. The human B blood group α1-3 galactosyltransferase exemplifies this concept.'
 'Upon entry of water in the enzyme active site, the formed glycosyl linkage is hydrolyzed in another SN2-like process to release glucose from the enzyme active site. Next to retention of configuration, the hydrolysis of interglycosidic bonds can also take place with “inversion of configuration” and is normally the result of an SN2 displacement–like process of a protonated aglycon by water. Although not necessarily relevant for the product formation in nature (sugar hemiacetals being prone to mutarotation at physiological pH), the different mechanisms employed by “retaining glycosidases” (involvement of a covalent intermediate) and “inverting glycosidases” (no covalent intermediate involved) bears consequences for their use in glycan synthesis. The use of Leloir-type glycosyltransferases in glycan synthesis requires access to the natural donor glycosides, which are sugar nucleotides. Thus, the intrinsic advantage of glycosyltransferase-mediated synthesis (excellent regio- and stereoselectivity) can be offset by the limitation on the access to the required donor glycosides. However, this challenge may be overcome by in situ biosynthesis/regeneration of the consumed sugar nucleotides. The power of glycosyltransferase-mediated glycan synthesis was demonstrated in 1992 by the synthesis of sialyl-Lewis x derivative 5 (Figure 54.2). Allyl lactoside 2, derived by chemical synthesis (see Chapter 53), is reacted with CMP-sialic acid 1 using a recombinant α-2,3-sialyltransferase (α-2,3-SiaT) as the catalyst. The resulting trisaccharide 3 is further extended with GDP-fucose 4 as the donor and recombinant fucosyltransferase (FucT) as the catalyst to deliver allyl sialyl-Lewis x. Glycosyltransferase-mediated synthesis of sialyl-Lewis x. (CMP) Cytidine monophosphate, (CDP) cytidine diphosphate, (CTP) cytidine triphosphate.  In the first step of the assembly line, the expensive sugar nucleotide, CMP-sialic acid, is consumed, and on transfer of the sialic acid, cytosine monophosphate (CMP) is produced. With the aid of two consecutive kinases (nucleoside monophosphate kinase and pyruvate kinase), CMP can be transformed in situ into the corresponding triphosphate (CTP), which is then condensed by the enzyme CMP-sialic acid synthetase with sialic acid to regenerate CMP-Neu5Ac 2. Glycosyltransferase-mediated synthesis of ganglio-oligosaccharides.  The synthesis of GalNAc-GD1a heptasaccharide 7 equipped with a biotin at the reducing end (replacing the sphingolipids present in the natural product) was accomplished by submitting synthetic lactoside 6 to the consecutive action of four glycosyltransferases, one of which (α-2,3-SiaT) was employed twice (Figure 54.3). By using this method with various donor sugar nucleotides and glycosyltransferases, a comprehensive series of glycosphingolipid glycans and their analogs have been obtained. The methodology, especially with respect to enzymatic sialic acid introduction, is competitive when compared to chemical gangliosides synthesis. Chemoenzymatic synthesis of a library of mammalian N-glycans.  The synthesis of complex, asymmetrically branched mammalian N-glycans was accomplished using combined chemical and glycosyltransferase-mediated enzymatic synthesis. As an example, decasaccharide 8 was prepared via contemporary solution phase chemical oligosaccharide synthesis (see Chapter 53). The asymmetrically branched decasaccharide features two nonreducing galactopyranose moieties, one of which is introduced as the tetra-acetate (in bold) whereas the other is unprotected. Decasaccharide 8 is thus designed to allow for specific enzymatic sialylation of the unprotected galactose residue (Figure 54.4).'
 'Glycosyltransferases that add O-Glc and O-GlcNAc to other serine and threonine residues in the EGF-like domain also exist and these enzymes also recognize a specific sequence motif and require a folded EGF-like domain. A number of the glycan-elongating glycosyltransferases that act on glycoproteins also recognize the polypeptide moiety of their acceptor substrates. The glycoprotein hormone GalNAc transferase (a member of the family of β1-4GalNAcTs) provides an interesting example in which modification of an N-glycan is dependent on the presence of the protein sequence motif Pro-X-Arg/Lys positioned several amino acids amino-terminally to the N-glycan being modified. The motif is typically followed closely by additional positively charged residues. The X-ray crystal structure of its acceptor substrate, human chorionic gonadotropin, shows that the Pro-X-Arg/Lys motif is at the beginning of a short surface-exposed helix that also contains the additional positively charged residues (Figure 6.2). The N-acetylgalactosamine residue transferred by this enzyme subsequently undergoes a biologically important 4-O-sulfation reaction that, in the case of luteinizing hormone and follicle-stimulating hormone, generates a determinant recognized by specific liver clearance receptors that remove them from the blood (Chapter 34). Glycosyltransferases that only elongate the fucose moiety added by POFUT1 or POFUT2 also exist (Chapter 13). The specificity shown by these enzymes stems from their ability to recognize both the fucose moiety and the EGF-like and TSR components of their acceptor substrates. Additional examples of enzymes that elongate glycans on specific glycoprotein substrates include the polysialyltransferases that act on neural cell adhesion molecule (NCAM) and neuropilin-2 (Chapter 15), and the N-acetylglucosaminyltransferase, EXTL3, that adds N-acetylglucosamine in α1-4-linkage to glucuronic acid in the first committed step to heparan sulfate biosynthesis on proteoglycans (Chapter 17). Human chorionic gonadotropin showing the determinants of recognition used by glycoprotein hormone N-acetylgalactosaminyl (GalNAc) transferase. Ribbon diagram of a fragment (residues 34–58) of human chorionic gonadotropin (PDB [protein data bank] (more...) In a variation on this theme, GlcNAc-1-phosphotransferase selectively modifies the N-glycans found on a large family of lysosomal enzymes that differ in three-dimensional structure and that lack any obvious and common protein sequence motif. In this case, modification by this enzyme has been shown to be dependent on lysine residues appropriately spaced and positioned relative to the N-glycan site (Chapter 33). The ER-resident glucosyltransferase, UGGT, is also able to transfer sugar to the N-glycans on a large but unique subset of glycoprotein substrates (Chapter 39). In this case, the enzyme adds a glucose moiety to the N-glycans of misfolded glycoproteins rendering them substrates for the ER-resident lectins calnexin and calreticulin. These lectins in turn recruit folding catalysts that promote correct disulfide bond formation and the cis–trans isomerization of proline residues. Approximately 1% of genes in the mammalian genome are involved in the production or modification of glycans. More than 750,000 glycosyltransferase sequences are known across all kingdoms, and the numbers are growing rapidly. Based on sequence analysis, they have been categorized into more than 110 glycosyltransferase families as described in the Carbohydrate-Active Enzymes (CAZy) database (Chapter 8). Although the absence of significant sequence similarity between members of one family and another constitutes the basis for this classification, short sequence motifs common to the members of more than one family have been identified.'
 'Because prokaryotic cells do not have an ER–Golgi pathway, they typically generate their cell-surface glycans at the interface of the cytoplasmic membrane and the cytoplasm or in the periplasm (see below). Other glycoconjugates like hyaluronan in vertebrate cells, chitin in invertebrate cells, and cellulose in plant cells are synthesized on the cytoplasmic face of the plasma membrane and simultaneously extruded across the membrane to the outside (Chapters 16, 24, and 26). The enzymes involved in the synthesis of these glycoconjugates appear to mediate this extrusion. Typical eukaryotic Golgi glycosylation enzymes have also been found at the cell surface or as soluble forms in the extracellular space, as described below. Whether these glycosyltransferases would routinely have adequate supplies of nucleotide sugar donors to modify cell-surface glycans is unclear, but at least one example has been documented (see below). On the other hand, there are examples of remodeling of cell-surface glycans in animal cells—for example, the endosulfatases (Sulf enzymes) that modify heparan sulfate glycosaminoglycan (Chapter 17) and endogenous sialidases that remove cell-surface sialic acids (Chapter 15). Some protozoan parasites, such as trypanosomes, transfer sialic acids from host glycoconjugates to their cell-surface glycans using trans-sialidases (Chapter 43). Prokaryotic assembly pathways of polysaccharides and oligosaccharides are very similar to pathways found in the ER and the plasma membrane of eukaryotes. They are assembled in the cytoplasm and then translocated across the plasma membrane. For many biosynthetic pathways, such as O-antigen biosynthesis in Gram-negative bacteria, N-linked protein glycosylation in Archaea, and some Gram-negative bacteria or S-layer biosynthesis in Gram-positive bacteria, oligosaccharides are assembled on lipid carriers at the inner site of the plasma membrane and then flipped to the periplasmic site (Chapters 21 and 22). Synthesis of oligosaccharides can continue in the periplasm, but for these reactions, isoprenoid-linked monosaccharides serve as activated substrates as is the case in cell wall biogenesis of actinobacteria (mycobacteria) (Chapter 21). Much effort has gone into understanding the mechanisms of glycosylation and glycan modification within the ER and the Golgi apparatus, and it is clear that a variety of interacting and competing factors determine the final outcome of the reactions. The glycosyltransferases and processing glycosidases are well-studied (Chapter 6), and their location has helped to define various functional compartments of the ER–Golgi pathway. Despite lack of sequence homology among different glycosyltransferase families, most Golgi enzymes share some features. Early studies of vertebrate glycosyltransferases found some of these activities in soluble form in secretions and body fluids; others were identified as membrane-bound activities within cells, and some showed both properties. Subsequent molecular cloning defined the sequences of Golgi glycosyltransferases, revealing that they share a common topology and domain structure that can account for these observations. The majority of Golgi glycosylation enzymes are type II membrane proteins consisting of three parts: an amino-terminal cytoplasmic tail, followed by a transmembrane (TM) region that also acts as an uncleavable signal sequence, and a large carboxy-terminal region containing a membrane-proximal, proteolytically sensitive stem region as well as a large catalytic domain. The type II topology of these Golgi enzymes places their catalytic sequences in the Golgi lumen, where they participate in the synthesis of the glycan chains on proteins and lipids during their transit through the secretory pathway (Figure 4.2). Topology and localization of Golgi glycosylation enzymes. Golgi glycosyltransferases and glycosidases are type II membrane proteins with their catalytic sequences facing the lumen of the Golgi.'
 'NCBI Bookshelf. A service of the National Library of Medicine, National Institutes of Health. Varki A, Cummings RD, Esko JD, et al., editors. Essentials of Glycobiology [Internet]. 4th edition. Cold Spring Harbor (NY): Cold Spring Harbor Laboratory Press; 2022.  doi: 10.1101/glycobiology.4e.54 Hermen S. Overkleeft and Peter H. Seeberger. Glycosyltransferases are the biosynthetic enzymes responsible for the construction of interglycosidic linkages and glycosidases catalyze the opposite reaction, hydrolysis of interglycosidic linkages. The diversity of natural glycans is reflected by the numerous glycosyltransferases and glycosidases encountered in nature, each exhibiting a defined substrate specificity. Natural glycans are often encountered in heterogeneous form and often produced in minute amounts making their isolation and characterization from natural sources often cumbersome. Therefore, glycobiology relies heavily on synthetic glycans, and synthetic methodology to produce glycans has witnessed tremendous progress (see Chapter 53). Glycosyltransferases and glycosidases offer advantages in the construction of glycans as these biocatalysts are very powerful under controlled conditions. This chapter summarizes recent developments in the use of (mutant) glycosidases and glycosyltransferases for the synthesis of tailored glycans, including combinations of both enzyme classes and in conjunction with chemically synthesized intermediates are presented. The mechanism of action of glycosyltransferases resembles the way an interglycosidic linkage is installed by chemical synthesis (Chapter 53). An activated donor saccharide, represented by UDP-glucose (Figure 54.1) is condensed with an acceptor moiety (here, ceramide) to give, after expulsion of the leaving group (here, UDP), the glycoconjugate (glucosylceramide). In contrast to chemical synthesis, the regioselectivity is regulated by the enzyme active site that also selects for the donor and the acceptor. The glucosylceramide synthase (GCS)-catalyzed synthesis of glucosylceramide (Figure 54.1) proceeds with “inversion” of the anomeric configuration, with the α-glucosidic linkage in UDP-glucose transformed into the β-glucosidic linkage in glucosylceramide. Nature employs a limited set of donor glycosides—most prominently the sugar nucleotides for Leloir-type glycosyltransferases, next to UDP-glucose for instance CMP-sialic acid, GDP-mannose—and the nature of the glycosyltransferase determines whether glycosylation proceeds with “retention” or “inversion” of configuration at the anomeric center. The mechanisms employed by most Leloir glycosyltransferases are now resolved. Formation and hydrolysis of the glycosphingolipid, glucosylceramide. (GCS) Glucosylceramide synthase, (UDP) uridine diphosphate glucose, (GBA) acid glucosylceramidase.  Glucosylceramide is hydrolyzed by the lysosomal exo-glucosidase, acid glucosylceramidase (GBA). Hydrolysis takes place with “retention of configuration” and is the result of a double displacement mechanism. Upon protonation of the aglycon, ceramide is displaced in an SN2 substitution–like process to yield a covalent enzyme-glycoside adduct. Upon entry of water in the enzyme active site, the formed glycosyl linkage is hydrolyzed in another SN2-like process to release glucose from the enzyme active site. Next to retention of configuration, the hydrolysis of interglycosidic bonds can also take place with “inversion of configuration” and is normally the result of an SN2 displacement–like process of a protonated aglycon by water.']","Glycosyltransferases are the biosynthetic enzymes responsible for the construction of interglycosidic linkages, while glycosidases catalyze the opposite reaction, hydrolysis of interglycosidic linkages. The diversity of natural glycans is reflected by the numerous glycosyltransferases and glycosidases encountered in nature, each exhibiting a defined substrate specificity. Natural glycans are often encountered in heterogeneous form and often produced in minute amounts, making their isolation and characterization from natural sources often cumbersome. Therefore, glycobiology relies heavily on synthetic glycans, and synthetic methodology to produce glycans has witnessed tremendous progress. Glycosyltransferases and glycosidases offer advantages in the construction of glycans as these biocatalysts are very powerful under controlled conditions.","In many cases, they catalyze a group-transfer reaction in which the monosaccharide moiety of a simple nucleotide sugar donor (electrophile) substrate (e.g., UDP-Gal, GDP-Fuc, or CMP-Sia; Chapter 5) is transferred to the acceptor (nucleophile) substrate. In some instances, the donor substrates contain a lipid moiety, such as dolichol-phosphate, linked to mannose or glucose. For other glycosyltransferases, the donor substrate is dolichol-pyrophosphate, linked to an oligosaccharide, and in these cases the entire oligosaccharide is transferred en bloc to the acceptor substrate (Chapter 9). Similarly, other lipid-linked sugars serve as donor substrates for bacterial glycosyltransferases involved in the assembly of peptidoglycan (e.g., GlcNAc-MurNAc(pentapeptide)-undecaprenyl pyrophosphate), lipopolysaccharide, and capsules (Chapters 21 and 22). Glycosyltransferases that use monosaccharides, oligosaccharides, proteins, lipids, small organic molecules, and DNA as acceptor substrates have been characterized (activity to RNA has also been suggested), but only glycosyltransferases involved in the biosynthesis of glycoproteins, proteoglycans, and glycolipids are discussed in this chapter.",1.0,0.6389281954410525,0.6892117627006695,0.017094017094017096,0.99999999998,1.0
"Complete the following paragraph: Over the years, many theories have been advanced regarding biological roles of glycans. Although there is evidence to support all the theories, exceptions to each one can also be found. This should not be surprising, given the abundance and enormous diversity of glycans in nature. Complexities also arise because glycans are frequently bound by microbes and microbial toxins, making them a liability to the organism that synthesizes them. Biological functions of glycans can be divided into three broad categories:","['NCBI Bookshelf. A service of the National Library of Medicine, National Institutes of Health. Varki A, Cummings RD, Esko JD, et al., editors. Essentials of Glycobiology [Internet]. 4th edition. Cold Spring Harbor (NY): Cold Spring Harbor Laboratory Press; 2022.  doi: 10.1101/glycobiology.4e.7 Pascal Gagneux, Thierry Hennet, and Ajit Varki. This chapter provides an overview of the biological functions of glycans in three broad categories: structural roles in, on, and outside cells; energy metabolism, including nutrient storage and sequestration; and information carriers, that is, specific recognition—most commonly by glycan-binding proteins of intrinsic or extrinsic origin. The chapter then presents some general principles for understanding and further exploring biological functions of glycans. For details, see the sources cited and other chapters in this book. As with other major classes of macromolecules, the biological functions of glycans span the spectrum from relatively subtle to crucial for development, growth, maintenance, or survival of the organism that synthesizes them. For many glycans, specific functions are not yet evident. The same glycan may also have different functions depending on which aglycone (protein or lipid) it is attached to. Over the years, many theories have been advanced regarding biological roles of glycans. Although there is evidence to support all the theories, exceptions to each one can also be found. This should not be surprising, given the abundance and enormous diversity of glycans in nature. Complexities also arise because glycans are frequently bound by microbes and microbial toxins, making them a liability to the organism that synthesizes them. Biological functions of glycans can be divided into three broad categories: (1) structural contributions (e.g., extracellular scaffolds: cell walls and extracellular matrices, protein folding and function); (2) energy metabolism (e.g., carbohydrates as carbon sources for storage and manipulation of animal behavior: pollination and seed dispersal); and (3) information carriers (e.g., molecular patterns recognized by glycan binding proteins [GBPs]) (Figure 7.1). The GBPs can be subdivided into two groups: (1) intrinsic GBPs, which recognize glycans from the same organism and (2) extrinsic GBPs, which recognize glycans from another organism. Intrinsic GBPs typically mediate cell–cell interactions or recognize extracellular molecules, but they can also recognize glycans on the glycocalyx of same cell. Extrinsic GBPs comprise pathogenic microbial adhesins, agglutinins, or toxins, which evolved for host colonization or invasion, but also include proteins that mediate symbiotic relationships or host defense directed at microbial glycans. Intrinsic and extrinsic glycan recognition can also act as opposing selective forces, simultaneously constraining and driving evolutionary change respectively (Chapter 20), likely accounting for the enormous diversity of glycans in nature. Further diversity arises because microbial pathogens also engage in “molecular mimicry,” evading immune reactions by decorating themselves with glycans typical of their hosts, and even in “glycan gimmickry,” modulating host immunity toward increased tolerance. Finally, most microbes are also themselves targets of pathogens that use microbial glycans for attachment and infection (e.g., bacteriophages that invade bacteria). General classification of the biological functions of glycans. A simplified and broad classification is presented, emphasizing the roles of organism-intrinsic and -extrinsic glycan-binding proteins in recognizing glycans. There is some overlap between (more...) Other general principles emerge based on existing literature. The biological consequences of experimentally altering glycosylation in various systems seem to be highly variable and unpredictable. Also, a given glycan can have different roles in different tissues, at different times in development (organism-intrinsic functions) or in different environmental contexts (organism-extrinsic functions). As a broad generalization, it can be stated that terminal sequences, unusual structures, and modifications of glycans are more likely to mediate specific biological functions within the organism. However, such glycans or their modifications are also more likely to be targets for pathogens and toxins.'
 'The biological consequences of experimentally altering glycosylation in various systems seem to be highly variable and unpredictable. Also, a given glycan can have different roles in different tissues, at different times in development (organism-intrinsic functions) or in different environmental contexts (organism-extrinsic functions). As a broad generalization, it can be stated that terminal sequences, unusual structures, and modifications of glycans are more likely to mediate specific biological functions within the organism. However, such glycans or their modifications are also more likely to be targets for pathogens and toxins. Perhaps as a consequence, intra- and interspecies variations in glycosylation are relatively common, and at least some of the diversity of glycans in nature may represent signatures of past or current host–pathogen or symbiotic interactions (Chapter 20). Finally, genetic defects in glycosylation are easily obtained in cultured cells, but often have limited biological consequences in vitro. In contrast, the same defects often have major and even catastrophic consequences in whole organisms. This generalization indicates that many major functions of glycans are operative mainly within an intact, multicellular organism. Some of these principles are briefly discussed below. Experimental approaches to elucidating biological roles of glycans include prevention of initial glycosylation, prevention of glycan chain elongation, alteration of glycan processing, enzymatic or chemical deglycosylation of completed chains, genetic elimination of glycosylation sites, addition of unnatural monosaccharides, and studies of mutant and naturally occurring genetic variants in glycosylation enzymes. The consequences of such manipulations can range from being essentially undetectable, to the complete loss of particular functions, or even to loss of the entire glycoconjugate bearing the altered glycan. Even within a particular class of molecules (e.g., cell-surface receptors), the effects of altering glycosylation are variable and unpredictable. Moreover, the same glycosylation change can have markedly different effects in different cell types or when studied in vivo or in vitro. The effect may depend on the structure of the glycan, the biological context (including interactions with cognate glycan receptors), GBPs, and the specific biological function. Given all of the above considerations, it is difficult to predict the functions that a given glycan on a given glycoconjugate might mediate and its relative importance to the organism. Glycans have many protective, stabilizing, organizational, and barrier functions. The glycocalyx that covers all eukaryotic cells and the polysaccharide coats of various prokaryotes represent a substantial physical barrier. Cellulose provides the material for cell walls in plants, and chitin fulfills this role in fungi. Arthropods evolved resistant chitin-rich exoskeletons. Cellulose and chitin represent the two most abundant biopolymers on the planet. In multicellular organisms, glycan constituents of matrix molecules, such as proteoglycans, are important for maintenance of tissue structure, porosity, and integrity. Such molecules can also contain binding sites for other specific glycans, which, in turn, aid overall matrix organization. The external location of glycans on most glycoproteins can provide a general shield, protecting the underlying polypeptide from recognition by proteases (mucins), blocking antibody binding (viral glycoproteins), and even (as in the case of mucins) protecting entire tissue surfaces from microbial attachment. Another structural role of glycans is their involvement in folding of newly synthesized polypeptides in the endoplasmic reticulum (ER) and/or in the subsequent maintenance of protein solubility and conformation (Chapter 39). Indeed, when some proteins are incorrectly glycosylated, they can fail to fold properly and/or to exit the ER. Such misfolded glycoproteins are translocated to the cytoplasm for degradation in proteasomes. Conversely, there are examples of glycoproteins whose synthesis, folding, trafficking, sensitivity to proteolysis, or immune recognition seem unaffected by altering their glycosylation. Moreover, inhibitors (Chapter 55) or genetic mutations (Chapter 45) that only affect later steps of glycan processing often do not interfere with basic structural functions. Although structural functions of glycans are obviously of great importance to the intact organism, they do not explain the evolution of such a diverse and complex range of molecules.'
 'Glycomic analysis thus needs to be complemented by classical methods such as tissue-section staining or flow cytometry, using lectins or glycan-specific antibodies that aid in understanding the glycome by taking into account the heterogeneity of glycosylation at the level of the different cell types and subcellular domains in the tissue under study. This is even more important because of the common observation that removing cells from their normal milieu and placing them into tissue culture can result in major changes in the glycosylation machinery of the cell. However, such classical approaches suffer from poor quantitation and relative insensitivity to structural details. A combination of the two approaches is now potentially feasible via laser-capture microdissection of specific cell types directly from tissue sections, with the resulting samples being studied by mass spectrometry. New methods for in situ imaging and characterization of glycans in the intact “forest” are clearly needed. Because most of the genes involved in glycan biosynthetic pathways have been cloned from multiple organisms, it is possible today to obtain an indirect genomic and transcriptomic view of the glycome in a specific cell type (Chapter 8). However, given the relatively poor correlation between mRNA and protein levels, and the complex assembly line and competitive nature of the cellular Golgi glycosylation pathways, even complete knowledge of the mRNA expression patterns of all relevant genes in a given cell cannot allow accurate prediction of the distribution and structures of glycans in that cell type. Thus, there is as yet no reliable indirect route toward elucidating the glycome, other than by actual analysis using an array of methods. Many mutant variants of cultured cell lines with altered glycan structures and specific glycan biosynthetic defects have been described, the most common of which are lectin-resistant (Chapter 49). Indeed, with few exceptions, mutants with specific defects at most steps of the major pathways of glycan biosynthesis have been found in cultured animal cells. The use of such cell lines has been of great value in elucidating the details of glycan biosynthetic pathways. Their existence implies that many types of glycans are not crucial to the optimal growth of single cells growing in the sheltered and relatively unchanging environment of the culture dish. Rather, most glycan structures must be more important in mediating cell–cell and cell–matrix interactions in intact multicellular organisms and/or interactions between organisms. In keeping with this supposition, genetic defects completely eliminating major glycan classes in intact animals all cause embryonic lethality (Chapter 45). As might be expected, naturally occurring viable animal mutants of this type tend to have disease phenotypes of intermediate severity and show complex phenotypes involving multiple systems. Less severe genetic alterations of outer chain components of glycans tend to give viable organisms with more specific phenotypes (Chapter 45). Overall, there is much to be learned by studying the consequences of natural or induced genetic defects in intact multicellular organisms, including humans (Chapter 45). A major theme of this volume is the exploration and elucidation of the biological roles of glycans. It is interesting to note that, in the short time since the first edition, we have gone from asking “what is it that glycans do anyway?” to having to explain a large number of complex and sometimes nonviable glycosylation-modified phenotypes in humans, mice, flies, and other organisms. Like any biological system, the optimal approach carefully considers the relationship of structure and biosynthesis to function (Chapter 7). As might be imagined from their ubiquitous and complex nature, the biological roles of glycans are remarkably varied. Indeed, asking what these roles are is akin to asking the same question about proteins. Thus, all of the proposed theories regarding glycan function turn out to be partly correct, and exceptions to each can also be found. Not surprisingly for such a diverse group of molecules, the biological roles of glycans also span the spectrum from those that are subtle to those that are crucial for the development, growth, function, or survival of an organism (Chapter 7). The diverse functions ascribed to glycans can be simply divided into two general categories: (i) structural and modulatory functions (involving the glycans themselves or their modulation of the molecules to which they are attached) and (ii) specific recognition of glycans by glycan-binding proteins. Of course, any given glycan can mediate one or both types of functions.'
 'The diverse functions ascribed to glycans can be simply divided into two general categories: (i) structural and modulatory functions (involving the glycans themselves or their modulation of the molecules to which they are attached) and (ii) specific recognition of glycans by glycan-binding proteins. Of course, any given glycan can mediate one or both types of functions. The binding proteins in turn fall into two broad groups: lectins and sulfated GAG-binding proteins (Chapters 27, 28, and 38). Such molecules can be either intrinsic to the organism that synthesized the cognate glycans (e.g., see Chapters 31–36, 38, and 39) or extrinsic (see Chapters 37 and 42 for information concerning microbial proteins that bind to specific glycans on host cells). The atomic details of these glycan–protein interactions have been elucidated in many instances (Chapters 29 and 30). Although there are exceptions to this notion, the following general theme has emerged regarding lectins: monovalent binding tends to be of relatively low affinity, and such systems typically achieve their specificity and function by achieving high avidity, via interactions of multivalent arrays of glycans with cognate lectin-binding sites. Whenever a new tool (e.g., an antibody or lectin) specific for detecting a particular glycan is developed and used to probe its expression in intact organisms, it is common to find exquisitely specific temporal and spatial patterns of expression of that glycan in relation to cellular activation, embryonic development, organogenesis, and differentiation (see Chapter 41 for examples). Certain relatively specific changes in expression of glycans are also often found in the course of transformation and progression to malignancy (Chapter 47), as well as other pathological situations such as inflammation (Chapter 46). These spatially and temporally controlled patterns of glycan expression imply the involvement of glycans in many normal and pathological processes, the precise mechanisms of which are understood in only some cases. Remarkably little is still known about the evolution of glycosylation. There are clearly shared and unique features of glycosylation in different kingdoms and taxa. Among animals, there may be a trend toward increasing complexity of N- and O-glycans in more recently evolved (“higher”) taxa. Intraspecies and interspecies variations in glycosylation are also relatively common. It has been suggested that the more specific biological roles of glycans are often mediated by uncommon structures, unusual presentations of common structures, or further modifications of the commonly occurring saccharides themselves. Such unusual structures likely result from unique expression patterns of the relevant glycosyltransferases or other glycan-modifying enzymes. On the other hand, such uncommon glycans can be targets for specific recognition by infectious microorganisms and various toxins. Thus, at least some of the diversity in glycan expression in nature must be related to the evolutionary selection pressures generated by interspecies interactions (e.g., of host with pathogen or symbiont). In other words, the two different classes of glycan recognition mentioned above (mediated by intrinsic and extrinsic glycan-binding proteins) are in competition with each other with regard to a particular glycan target. The specialized glycans expressed by parasites and microbes that are of great interest from the biomedical point of view (Chapters 21, 22, 23, and 43) may themselves be subject to evolutionary selection pressures. These issues are further considered in Chapter 20, which also discusses the limited information concerning how various glycan biosynthetic pathways appear to have evolved and diverged in different life-forms. Numerous natural bioactive molecules are glycoconjugates, and the attached glycans can have dramatic effects on the biosynthesis, stability, action, and turnover of these molecules in intact organisms. For example, the sulfated glycosaminoglycan heparin and its derivatives are among the most commonly used drugs in the world. The aminoglycoside antibiotics all have carbohydrate components essential for activity. For this and many other reasons, glycobiology and carbohydrate chemistry have become increasingly important in modern biotechnology. Patenting a glycoprotein drug, obtaining FDA approval for its use, and monitoring its production all require knowledge of the structure of its glycans.'
 'Such interspecies variation in glycan structure indicates that some glycan sequences do not have fundamental and universal roles in all tissues and cell types in which they are expressed. Of course, such diversity could be involved in generating differences in morphology and function between species. Such variations could also reflect the outcome of differing selection pressures by exposure to variant pathogen regimes. Furthermore, significant intraspecies polymorphism in glycan structure can exist without obvious functional value, although they may be involved in the interplay between parasites and host populations (Chapter 20). Given all of the above, it is challenging to predict which glycan structures are likely to mediate the more specific or crucial biological roles within an organism. As mentioned above, terminal sugar sequences, unusual structures, or modifications of glycans are more likely to be involved in such specific roles. The predictive value of this observation is reduced by the fact that such entities are also more likely to be involved in interactions with microorganisms and other potentially noxious agents. Further complexity arises from “microheterogeneity” in glycan structure (Chapter 20), wherein the same glycosylation site on the same protein in the same species can carry a variety of related glycan structures or none at all. The challenge then is to predict and sort out which distinct roles can be assigned to a given glycan structure in a given cell type and organism. In the coevolutionary arms race between pathogens and hosts, pathogens will tend to exploit glycans that are difficult for the host to change (those constrained by their intrinsic host function), and because hosts are unable to alter their glycans easily owing to their slower evolutionary rates and functional constraints of existing glycans, the extrinsic and intrinsic functions of these glycans are bound to overlap. Hosts can, however, to the degree possible, be expected to evolve glycans that are difficult for microbes to mimic, such as the vertebrate-specific sialic acid Neu5Gc (Chapter 15) and sulfated GAGs, prokaryotes do not seem to have reinvented (Chapter 17). Because microorganisms and parasites that bind glycans evolve in parallel with their multicellular hosts, they must adapt their glycan-binding “repertoire” to any change in glycan structure presented by the host. At the same time, each of these microorganisms is itself host to its own suite of parasites (phages), known to exploit the cell surface glycans of microbes in order to infect these. Host populations (multicellular organisms infected by microbes or microbes infected by phages) may evolve new modifications of the structures targeted by their parasites, especially if the latter had meanwhile evolved a vital function elsewhere within the organism. This would constrain the preservation of the underlying scaffolding on which the latest modification was placed, while adding yet another layer of complexity to host glycans. Such cycles of evolutionary interaction between (nested sets of) microbes and hosts might explain some of the complex and extended sugar chains found in multicellular organisms, especially in areas of frequent microbial contact, such as in secreted mucins on mucosal surfaces. In this manner, “junk” glycans (i.e., glycans without current adaptive value) could accumulate, akin to “junk” DNA. An important distinction is that much of the junk DNA consists of selfish DNA elements capable of replicating, whereas glycans cannot encode additional copies of themselves, given that their synthesis relies on the activity of a coordinated network of gene products. Although such structures may still function as structural scaffolding, they may have no other specific role in a particular cell type at that particular time in evolution. They would, of course, provide fodder for future evolutionary selection, either for new organism-intrinsic functions or selective responses to a new pathogen. Additionally, neutral drift (which is now acknowledged as a major process in evolution) may explain some of the apparent “junk” glycans. The microheterogeneity inherent in glycan synthesis processes may be producing “neutral noise,” but this noise may also contribute to evolutionary flexibility. Some functions of glycans are discovered serendipitously. In other instances, the investigator who has elucidated complete details of the structure and biosynthesis of a specific glycan is left without knowing its functions. It is necessary to design experiments that can differentiate between trivial and crucial functions mediated by each glycan. Various approaches are discussed below, emphasizing the advantages and disadvantages of each approach (also presented in schematic form in Figure 7.2).']","structural contributions (e.g., extracellular scaffolds: cell walls and extracellular matrices, protein folding and function); energy metabolism (e.g., carbohydrates as carbon sources for storage and manipulation of animal behavior: pollination and seed dispersal); and information carriers (e.g., molecular patterns recognized by glycan binding proteins [GBPs])","(1) structural contributions (e.g., extracellular scaffolds: cell walls and extracellular matrices, protein folding and function); (2) energy metabolism (e.g., carbohydrates as carbon sources for storage and manipulation of animal behavior: pollination and seed dispersal); and (3) information carriers (e.g., molecular patterns recognized by glycan binding proteins [GBPs])",1.0,0.7418977481669007,0.9589698622498567,0.035211267605633804,0.99999999998,1.0
"Complete the following paragraph: The glycome comprises all the glycan structures synthesized by an organism. It is analogous to the genome, the transcriptome, and/or the proteome but even more dynamic, and it has higher structural complexity that has yet to be fully defined. Cells of different types synthesize a subset of the glycome based on their differentiation state and physiological environment.","['NCBI Bookshelf. A service of the National Library of Medicine, National Institutes of Health. Varki A, Cummings RD, Esko JD, et al., editors. Essentials of Glycobiology [Internet]. 4th edition. Cold Spring Harbor (NY): Cold Spring Harbor Laboratory Press; 2022.  doi: 10.1101/glycobiology.4e.51 Pauline M. Rudd, Niclas G. Karlsson, Kay-Hooi Khoo, Morten Thaysen-Andersen, Lance Wells, and Nicolle H. Packer. The term genomics arose from the availability of complete genome sequence data as well as computational methods for their analysis. However, <2% of genes in the human genome encode proteins. These genes are transcribed into messenger RNAs (mRNAs) that make up the “transcriptome,” of which ∼30% are assigned to protein coding. The total complement of proteins expressed by the cell is collectively termed the “proteome.” Most eukaryotic proteins are post translationally modified (e.g., by phosphorylation, sulfation, oxidation, ubiquitination, acetylation, methylation, lipidation, or glycosylation). These modifications, combined with alternative RNA splicing in eukaryotes, render the proteome considerably more complex than the transcriptome. Although it has been estimated that approximately 120,000 different protein splice forms are expressed by human cells, the total number of modified proteoforms is likely to be at least an order of magnitude higher. The systems-level analysis of all proteins expressed by cells, tissues, or organisms is known as “proteomics.” The proteome, like the transcriptome, but unlike the DNA sequence of the genome, is fundamentally dynamic. The repertoire of proteins expressed by a cell is highly dependent on tissue type, microenvironment, and stage within the life cycle. As cells receive external and internal cues in the form of growth factors, hormones, metabolites, or cell–cell interactions, the expression of various genes is modulated and may be transcribed at levels ranging from silence to more than 104 mRNA copies per cell and 107 protein molecules per cell. Thus, proteomes and their modifications vary during cell differentiation, activation, trafficking, and malignant transformation. However, no systems-level analysis of a biological process is complete without interrogating the glycome, defined as the entire complement of glycan structures (be it protein-/lipid-bound or -free) produced by cells, in addition to the genome, transcriptome, proteome, lipidome and metabolome. Vertebrates synthesize N-linked and O-linked glycoproteins, glycolipids (Chapters 11 and 12), proteoglycans, glycosaminoglycans (GAGs), and glycosylphosphatidylinositol (GPI) anchors covalently attached to proteins, as well as free oligosaccharides (Chapter 3). As with the proteome, each cell type has its own distinct glycome that is governed by local cues and the metabolic state of the cell. Other organisms have distinct glycomes; those of plants (Chapter 24) and prokaryotes (Chapter 21) are distinctly different from the vertebrate and invertebrate glycomes (Chapters 25–27). The size of any particular cellular glycome has not yet been established, but the combinatorial possibilities that can occur with numerous glycan structures on multiple glycoconjugates means that determining a “complete” glycome is not straightforward. The notion that glycans should be studied as a totality (glycomics), as well as simply one glycan or glycoconjugate at a time, developed when it became apparent that glycans form patterns on cells that change during development (Chapter 41), cancer progression (Chapter 47), infection (Chapters 42 and 43), and many other diseases (Chapters 44–46). Many glycan-binding proteins, such as lectins, are oligomerized on the cell surface and interact with multivalent arrays of glycans on the same or opposing cells (Chapters 28–38). Sometimes, multiple discrete glycans and their matching glycan-binding proteins work together to engage two cells or to deliver signals between cells.'
 ""Many glycan-binding proteins, such as lectins, are oligomerized on the cell surface and interact with multivalent arrays of glycans on the same or opposing cells (Chapters 28–38). Sometimes, multiple discrete glycans and their matching glycan-binding proteins work together to engage two cells or to deliver signals between cells. Thus, the term “glycomics” was coined to describe the many aspects of glycobiology that can be understood only with a systems-level analysis of the glycome. Clues regarding the composition and complexity of the glycome are found in the genome, transcriptome, and proteome of a cell. Thus, if a gene encoding a glycosyltransferase is not expressed (absent from the transcriptome), no glycans in that cell can carry the sugar transferred by that glycosyltransferase at that particular time. The action of many glycosyltransferases and glycoside hydrolases competing for the same substrates in the biosynthetic pathway renders the complete glycome impossible to predict with current tools and knowledge. As an example, the reduced expression of a single glycosyltransferase can perturb the biosynthesis of dozens of glycans. Furthermore, unlike the genome, the glycome is sensitive to exogenous nutrient levels and metabolic fluxes including salvage pathways. Thus, variations in dietary monosaccharides, such as glucose, galactose, glucosamine, fucose, mannose, and N-glycolylneuraminic acid (Chapter 15), may change the composition of the glycome. The numerous factors that influence the glycome (the transcriptome, the proteome, environmental nutrients, the secretory machinery, pH, and many other determinants) create a glycome that is highly diverse, adaptable, and dynamic. Thus, the glycome of a cell can change dramatically over time. It is this enormous structural plasticity in response to cellular and environmental states that underlies the essential roles of glycans in development, communication, and disease processes. Because the glycome is influenced by both genetic and environmental factors, the information contained therein sheds light on intra- and interspecies variations, including providing indicators of disease that can be used for diagnosis and for monitoring the efficacy of drugs. Comparative glycomics, the comparison of glycome profiles obtained from two or more individuals, tissues, or conditions of interest, is therefore an exciting frontier in biology and medicine. For example, as discussed in detail in Chapter 47, numerous changes in the glycome have been associated with malignancy and metastasis, including altered N- and O- linked protein glycosylation, up-regulation of conjugated sialylated and fucosylated glycans, and altered GAGs. Regardless of functional consequence, a change in the glycome that is highly correlated with malignancy (or any disease) may serve as a diagnostic marker candidate. Notably, glycans altered in a disease may reflect downstream consequences of the disease on remote organs, changes in the patient's immune system, or other effects of the disease. One major caveat is the currently unknown extent of natural variation among individual human glycomes. The glycome is known to respond to dietary and environmental changes and vary in elusive ways with age, gender, and acquired disease susceptibility (Chapter 46). Studies of evolutionary biology also have much to gain from comparative glycomics. Evolution of the vertebrate immune system, for example, was accompanied by the acquisition of new classes of glycan-binding proteins, including Siglecs (Chapter 35) and selectins (Chapter 34). Likewise, the glycomes and glycan-binding proteins of microbes and their vertebrate hosts appear to have coevolved in some instances (Chapter 42). The glycome can be determined at different levels of granularity. First, “glycomics” constructs an inventory of glycans separated from their protein or lipid scaffolds from the cell, organ, or organism of interest. This is an important starting point for any comprehensive glycome analysis. The second level of analysis defines specific glycans associated with individual proteins or lipids. Analysis of the complete repertoire of a cell's glycoconjugates, including the microheterogeneity of glycans present at individual sites of attachment, lies, for example, at the intersection of glycomics and proteomics (“glycoproteomics”) and of glycomics and lipidomics (“glycolipidomics”).""
 'The final complete degradation of most eukaryotic glycans is generally performed by multiple glycosidases in the lysosome. Once degraded, their individual unit monosaccharides are then typically exported from the lysosome into the cytosol for reuse (Figure 1.8). In contrast to the relatively slow turnover of glycans derived from the ER–Golgi pathway, the O-GlcNAc monosaccharide modifications of the nucleus and cytoplasm appear more dynamic (Chapter 19). In some instances, extracellular or intracellular free glycans can also serve as signaling molecules (Chapter 40). Biosynthesis, use, and turnover of a common monosaccharide. This schematic shows the biosynthesis, fate, and turnover of galactose, a common monosaccharide constituent of animal glycans. Although small amounts of galactose can be taken up from the outside (more...) Unlike oligonucleotides and proteins, glycans are not commonly found in a linear, unbranched fashion. Even when linear (e.g., GAGs), they often contain a variety of substituents, such as sulfate groups, which are not uniformly distributed. Thus, complete sequencing of glycans is usually impossible by a single method and requires iterative combinations of physical, chemical, and enzymatic approaches that together yield the details of structure (for a discussion of low- and high-resolution separation and analysis, including mass spectrometry and nuclear magnetic resonance [NMR], see Chapter 50). Less detailed information on structure may be sufficient to explore the biology of some glycans and can be obtained by simple techniques, such as the use of enzymes (endoglycosidases and exoglycosidases), lectins, and other glycan-binding proteins (Chapters 48 and 50), chemical modification or cleavage, metabolic radioactive labeling, antibodies, or cloned glycosyltransferases (Chapters 53 and 54). Glycosylation can also be perturbed in various ways, for example, by glycosylation inhibitors and primers (Chapters 55 and 56) and by genetic manipulation of glycosylation in intact cells and organisms (Chapter 49). Directed in vitro synthesis of glycans by chemical and enzymatic methods has also made great strides in recent years, providing many new tools for exploring glycobiology (Chapters 53, 54, and 57). The generation of complex glycan libraries by a variety of routes has further enhanced this interface of chemistry and biology (Chapters 53 and 54), including the generation of glycan microarrays. Analogous to genomics and proteomics, glycomics represents the systematic methodological elucidation of the “glycome” (the totality of glycan structures) of a given cell type or organism (Chapters 51 and 52). In reality, the glycome is far more complex than the genome or proteome. In addition to the vastly greater structural diversity in glycans, one is faced with the complexities of glycosylation microheterogeneity (see above) and the dynamic changes that occur in the course of development, differentiation, metabolic changes, aging, malignancy, inflammation, or infection. Added diversity arises from intraspecies and interspecies variations in glycosylation. Thus, a given cell type in a given species can manifest a large number of possible glycome states. Glycomic analysis today generally consists of extracting entire cell types, organs, or organisms; releasing all the glycan chains from their linkages; and cataloging them via approaches such as mass spectrometry. In a variation called glycoproteomics, the glycans are analyzed while still attached to protease-generated fragments of glycoproteins. The results obtained represent a spectacular improvement over what was possible a few decades ago, but they are still analogous to cutting down all the trees in a forest and cataloging them, without attention to the layout of the forest and the landscape (Chapter 15 discusses this complex issue from the perspective of just one monosaccharide class, sialic acids; see Figure 15.3). Glycomic analysis thus needs to be complemented by classical methods such as tissue-section staining or flow cytometry, using lectins or glycan-specific antibodies that aid in understanding the glycome by taking into account the heterogeneity of glycosylation at the level of the different cell types and subcellular domains in the tissue under study.'
 'Schematic examples of modular glycosyltransferases. GT family modules are shown in red and blue. Other modules in various colors are CBM13, ricin-like carbohydrate-binding module; SH3, src homology domain 3; X84, putative glycan-binding module; PBP, penicillin-binding (more...) Other modular GTs can feature an appended GBP domain. The best-known examples are polypeptide N-acetylgalactosaminyltransferases (ppGalNAcTs; GALNT) that transfer N-acetylgalactosamine (GalNAc) to Ser or Thr residues (Chapters 6 and 10). In these enzymes, a GT27 catalytic domain is linked to a GBP domain related to ricin and classified as CBM13 in the CAZy database. The GBP domain binds to the GalNAc residue transferred to protein by the GT27 catalytic domain and tethers the enzyme to the substrate. Another example is mouse polypeptide β-xylosyltransferase 2, in which a GT14 catalytic domain is linked to a carboxy-terminal domain that is thought to act as a GBP. The GHs can also be modular, with the catalytic domain appended to one or more other modules whose role is to bind polysaccharides. Although human GHs are infrequently modular, those of microbes involved in plant cell-wall degradation can have more than five different modules assembled in a single polypeptide. Human acidic chitinase is an example of a mammalian modular GH having a CBM14 domain appended at the carboxyl terminus of the GH18 catalytic domain. The most intricate architecture of GHs is found in certain bacteria, such as Clostridium thermocellum, which elaborate a macromolecular complex called a “cellulosome” in which a large variety of modular plant cell-wall hydrolases are assembled together on a scaffolding protein. This strategy enables the assembly of dozens of catalytic modules simultaneously targeting the various polysaccharides that make up the plant cell wall. In summary, the genome, comprising the DNA of an organism, includes all the genes that produce the glycome, which comprises all of the glycans made by an organism. Although, within an organism, almost every cell that contains a nucleus and mitochondria has an identical genome; cells typically differ in the portion of the genome and, therefore the glycome, they express. Thus, the glycan complement of a cell depends on which genes are actively transcribed and which transcripts are translated and stably expressed. Transcription, splicing, translation, and posttranslational processing may vary depending on the state of differentiation and the physiological environment of a cell. Therefore, during development and differentiation, and under different environmental conditions, the glycan repertoire of a cell represents a subset of all the glycans that an organism is capable of making. To describe this variation, it is common to qualify the term glycome when referring to the glycans made by a particular tissue or cell type (e.g., T-cell glycome, hepatocyte glycome, or serum glycome), and to note the particular stage of development (e.g., fetal liver glycome, breast cancer serum glycome). The glycome of a given cell in an organism can undergo substantial changes in response to environmental stimuli ranging from pH and ionic strength to hormonal stimulation or inflammation. Combined with the “assembly-line” nature of the Golgi apparatus (Chapter 4) and potential remodeling by GHs, full knowledge of the GT and GH transcriptome is only a rough predictor of the actual glycome of a given cell type, albeit a very helpful one. Apart from transcriptional control, the glycome is regulated by posttranscriptional control by microRNAs (miRs). For example, GALNT7 is a target of miR-30d, a microRNA that is known to promote melanoma metastasis in patients and mouse models. The down-regulation of GALNT7 phenocopied the expression of miR-30d. Subsequently, miRNAs have emerged as key regulators of the glycome owing to their ability to regulate multiple GT and GH mRNA targets. Nearly 80 GT and GH genes have been identified as targets of miRNAs to date. The authors appreciate helpful comments and suggestions from Kelley Moremen and Tadashi Suzuki.'
 'Another type of glycosaminoglycan, hyaluronan (a polymer of GlcNAcβ1-4GlcA), appears to exist primarily as a free glycan unattached to any aglycone (Chapter 16). Some glycosaminoglycans have sulfate esters substituting either amino or hydroxyl groups (i.e., N- or O-sulfate groups). Another anionic polysaccharide that can be extended from LacNAc units is polysialic acid, a homopolymer of sialic acid that is selectively expressed only on a few proteins in vertebrates. Polysialic acids and hyaluronan are also found as the capsular polysaccharides of certain pathogenic bacteria (Chapter 15). For simplicity, this section has focused primarily on vertebrate glycans. Many other classes of glycans exist in other branches of the tree of life (Chapters 21–26). Unlike protein sequences, which are primary gene products, glycan structures are not encoded directly in the genome and are secondary gene products. A few percent of known genes in the human genome are dedicated to producing the enzymes and transporters responsible for the biosynthesis and assembly of glycans (Chapter 8), typically as posttranslational modifications of proteins or by glycosylation of core lipids. The glycans themselves represent numerous combinatorial possibilities, generated by a variety of competing and sequentially acting glycosidases and glycosyltransferases (Chapter 6) and the subcompartmentalized “assembly-line” mechanisms of glycan biosynthesis in the Golgi apparatus of eukaryotes (Chapter 4). Thus, even with full knowledge of the expression levels of all relevant gene products, one cannot accurately predict the precise structures of glycans elaborated by a given cell type. Furthermore, small changes in environmental cues can cause dramatic changes in glycans produced by a given cell. It is this variable and dynamic nature of glycosylation that makes it a powerful way to generate and modulate biological diversity and complexity. Of course, it also makes glycans much more difficult to study than nucleic acids and proteins. One of the most fascinating and yet frustrating aspects of protein glycosylation is the phenomenon of microheterogeneity. Thus, at any particular glycan attachment site on a given protein synthesized by a particular cell type, a range of variations might be found in the structures of the attached glycan (and in some instances, the glycan may be missing). Effectively, a given polypeptide encoded by a single gene can exist in numerous “glycoforms,” each constituting a distinct molecular species. For some glycoproteins the microheterogeneity at a particular site may be quite limited, whereas for other sites it may be extensive, even within the same glycoprotein species. Mechanistically, microheterogeneity might be generated by the rapidity with which multiple, sequential, partially competitive glycosylation and deglycosylation reactions take place in the endoplasmic reticulum (ER) and Golgi apparatus, through which a newly synthesized glycoprotein passes, along with the lack of a template for directing the synthesis and the accessibility of glycans at a site to the modifying enzymes (Chapter 4). An alternate possibility is that each individual cell or cell type is in fact exquisitely specific in the glycosylation it produces, but that intercellular variations result in the observed microheterogeneity of samples from natural multicellular sources. Whatever the origin of microheterogeneity, it explains the anomalous behavior of glycoproteins in analytical/separation techniques and makes complete structural analysis of a glycoprotein a difficult task. From a functional point of view, the biological significance of microheterogeneity remains unclear. It is possible that this is a type of diversity generator, intended for diversifying endogenous recognition functions and/or for evading microbes and parasites, each of which can bind with high specificity only to certain glycan structures (Chapters 37 and 42). Most well-characterized pathways for the biosynthesis of major classes of eukaryotic glycans are within ER and Golgi compartments (Chapter 4). Newly synthesized proteins originating in the ER are either cotranslationally or posttranslationally modified with glycans at various stages in their itinerary toward their final destinations.']","The glycome comprises all the glycan structures synthesized by an organism. It is analogous to the genome, the transcriptome, and the proteome but even more dynamic, and it has higher structural complexity that has yet to be fully defined. Cells of different types synthesize a subset of the glycome based on their differentiation state and physiological environment.","The human and mouse glycomes have many glycan structures in common, but a few are unique or have divergent functional properties. For example, unlike humans, rodents synthesize cytidine monophospho-N-glycolylneuraminic acid (CMP-Neu5Gc), for the transfer of Neu5Gc to N- and O-glycans (Chapter 15). Similarly, the gene encoding α-1,3-galactosyltransferase (A3GALT2) is functional in the mouse but not in human (Chapter 20). The human and fly genomes include orthologous genes encoding GTs that catalyze the same reaction, but they also have GTs that are unique. Thus, protein O-fucosyltransferase 1 (POFUT1) in mammals and Ofut1 in flies transfer fucose to Notch receptors and are examples of an evolutionarily conserved GT. In contrast, flies do not make complex N-glycans with four branches, which are common in mammalian glycoproteins (Chapters 9 and 20). Additionally, flies make unique glycolipids absent from mammals that are important for conserved signaling pathways mediated by the epidermal growth factor (EGF) receptor or Notch receptors (Chapter 26).",1.0,0.7221502826161805,0.5873307426522445,0.015748031496062992,0.99999999998,0.14285714285714285
"Complete the following paragraph: In mammals, there are two different catalytic STT3 subunits that both associate with ribophorins I and II, OST48, OST4, and DAD1 proteins (homologs of the yeast Ost1p, Swp1p, Wbp1p, Ost4p, and Ost2p, respectively).","['The Man5GlcNAc2-P-P-Dol precursor translocates across the ER membrane bilayer via a “flippase” encoded by the RFT1 locus in yeast. Man5GlcNAc2-P-P-Dol is extended by the addition of four Man and three Glc residues transferred from Dol-P-Man and Dol-P-Glc, respectively. Dol-P-Man and Dol-P-Glc donors are formed on the cytoplasmic side of the ER membrane from GDP-Man and UDP-Glc. Dol-P-Man and Dol-P-Glc must also be flipped across the ER membrane. Mammalian MPDU1 is an ER membrane protein necessary for the utilization of Dol-P-Man and Dol-P-Glc in the ER lumen in the synthesis of the mature N-glycan precursor Glc3Man9GlcNAc2-P-P-Dol (Figure 9.3). This 14-sugar glycan is transferred by oligosaccharyltransferase (OST) to Asn in receptive Asn-X-Ser/Thr sequons in protein regions that have translocated across the ER membrane. OST is a multisubunit protein complex in the ER membrane, except in the case of the kinetoplastids (Chapter 43). OST catalyzes the transfer of the oligosaccharide from Dol-P-P to Asn-X-Ser/Thr in newly synthesized regions of proteins during passage through the translocon into the ER. OST has a high specificity for the completely assembled oligosaccharide, which is Glc3Man9GlcNAc2 in most eukaryotes. When incomplete oligosaccharides are assembled, transfer efficiency is reduced, resulting in hypoglycosylation of glycoproteins that mature with empty N-glycan sites. All OST subunits are transmembrane proteins with between one and 13 transmembrane domains. The OST complex cleaves the high-energy GlcNAc-P bond, releasing Dol-P-P in the process (Figure 9.3). Yeast OST is comprised of eight different subunits Stt3p, Ost1p, Wbp1p, Swp1p, Ost2p, Ost4p, Ost5p, and Ost3p or Ost6p. Stt3p is the catalytic subunit of the enzyme. The two OST complexes (containing either of the thioredoxin-subunit Ost3p or Ost6p) have a different protein–substrate specificity. The complexity of OST increases in multicellular organisms. In mammals, there are two different catalytic STT3 subunits that both associate with ribophorins I and II, OST48, OST4, and DAD1 proteins (homologs of the yeast Ost1p, Swp1p, Wbp1p, Ost4p, and Ost2p, respectively). The STT3A complex (OSTA), closely associated with the translocon, contains the KCP2 and DC2 subunits, whereas the STT3B complex (OSTB) that has either MAGT1 or TUSC3 (homologs of yeast Ost3p/Ost6p) glycosylates polypeptides posttranslationally after their translocation into the ER. On binding to the catalytic STT3 subunit, the client peptide adopts a 180° turn, making polypeptide folding a competing reaction for N-glycosylation. Indeed, the thioredoxin subunits of the OST complex (Ost3p/Ost6p; MAGT1/TUSC1) modulate the oxidative folding of the client polypeptide, thereby extending the polypeptide substrate range of OST. As of February 2021, the UniProt database reports 1911 N-glycosylation sites in yeast and 13,648 in murine glycoproteins. Following the covalent attachment of the 14-sugar glycan to Asn-X-Ser/Thr in a protein, processing reactions trim the N-glycan in the ER. The initial steps have key roles in regulating glycoprotein folding via interactions with ER chaperones that recognize specific features of the trimmed N-glycan (Chapter 39).'
 'Retrotranslocation of misfolded glycoproteins from the ER lumen to the cytosol for proteasomal degradation ultimately depends on various protein complexes, some of which contain integral ER membrane proteins. ER membrane proteins with folding defects in the cytosolic domain are extracted from the ER membrane by the Doa10 complex via ERAD-C, whereas those in which the folding defect is present in the luminal (ERAD-L) or membrane (ERAD-M) domains use the Hrd1 complex. Both Doa10p and Hrd1p are integral membrane proteins with E3 ligase activity in their cytosolic portion. Other proteins in these complexes include chaperones, proteins with E2 ubiquitin-conjugating activity or proteins that recognize misfolded proteins. For instance, glycoproteins with N-glycans containing a terminal α1–6Man are bound by Yos9p and undergo ERAD only if the N-glycans are in unstructured protein, a feature recognized by Hrd3p in the Hrd1 complex. Finally, proteins common to both complexes such as yeast Cdc48 (p97 in mammals) are responsible for membrane extraction of misfolded proteins in an ATP-dependent manner. Although the pore by which ERAD-L substrates are actually transported to the cytosol has not been identified, it is known that the substrates must be unfolded in the ER lumen. Although studies on ERAD complexes have been mainly performed in S. cerevisiae, mammalian cells have homologs of nearly all proteins described in the yeast complexes. N-Glycans are removed from unfolded glycoproteins during proteasomal degradation. A cytoplasmic peptide:N-glycanase (PNGase, N-glycanase, NGLY1) plays an important role in both removing the glycan and constructing an efficient predegradation complex (Figure 39.3). NGLY1 recognizes only misfolded or denatured glycoproteins. The enzyme is bound to the proteasome by subunits S4 and HR23B as a complex with Cdc48, a component of ERAD complexes. Degradation of the released N-glycan occurs in two stages. First, cleavage occurs between the two GlcNAcs (chitobiose) in the core of the N-glycan via a cytoplasmic endo-β-N-acetylglucosaminidase. A cytoplasmic α-mannosidase cleaves up to four Man residues to generate Man5GlcNAc (Man c, d, e, f, and g in Figure 39.1). This glycan is then taken into the lysosome via an ATP-dependent lysosomal membrane transporter for final degradation to monosaccharides. Whether these free glycans have any function in the cytosolic/nuclear compartment before they are degraded has not been investigated. Degradation of oligomannosyl N-glycans in the endoplasmic reticulum (ER), cytoplasm, and lysosomes. Specific pathways exist for the degradation of free glycans released from misfolded glycoproteins and glycopeptides generated within the ER. Dolichol-linked (more...) Protein O-fucosyltransferases (Ofut1 in Drosophila; POFUT1 and POFUT2 in mammals) are soluble ER enzymes that O-fucosylate Ser/Thr residues. Ofut1 and POFUT1 add fucose to epidermal growth factor (EGF)–like repeats, whereas POFUT2 adds fucose to thrombospondin (TSR) type 1–like repeats (Chapter 13). EGF and TSR domains are present as tandem repeats in numerous proteins of multicellular organisms. Ofut1/POFUT1 and POFUT2 selectively fucosylate only properly folded protein domains, suggesting a role of this glycosylation in folding quality control. Indeed, several POFUT2 targets including ADAMTSL1 and ADAMTSL2 (scaffolding proteins in the extracellular matrix), ADAMTS9 (a matrix remodeling protease), and ADAMTS13 (the von Willebrand factor cleaving protease) strictly require O-fucosylation for efficient secretion.'
 'Ofut1/POFUT1 and POFUT2 selectively fucosylate only properly folded protein domains, suggesting a role of this glycosylation in folding quality control. Indeed, several POFUT2 targets including ADAMTSL1 and ADAMTSL2 (scaffolding proteins in the extracellular matrix), ADAMTS9 (a matrix remodeling protease), and ADAMTS13 (the von Willebrand factor cleaving protease) strictly require O-fucosylation for efficient secretion. Indeed, O-fucosylation appears to stabilize folded TSRs. The case of Ofut1/POFUT1 is a bit more ambiguous. Studies performed in Drosophila on the efficiency of cell-surface expression of the Ofut1 substrate Notch showed that Ofut1 is required as a chaperone for Notch folding and cell-surface expression, and that chaperone activity is largely independent of the O-fucosyltransferase activity. In contrast, POFUT1 does not appear to be absolutely required for cell-surface expression of Notch receptors in all mammalian cells, suggesting that cell-specific chaperones may be able to compensate for loss of POFUT1 in certain contexts. It has been reported recently that O-mannosylation in S. cerevisiae ER might be responsible for terminating futile cycles of association–dissociation between proteins unable to attain their native conformation and Kar2p (the budding yeast homolog of mammalian BiP/Grp78 chaperone). The loss of CNX and CRT in most multicellular organisms causes a severe phenotype. Mice deficient in CNX reach full term, but half die within 2 days of birth, and very few survive beyond 3 months. The runts that survive have obvious motor disorders with loss of large myelinated nerve fibers. CRT-deficient mice and ERp57-null mice also show embryonic lethality. In contrast, CNX and CRT null Caenorhabditis elegans mutants are viable. Yeast has CNX or CNX-like lectins (but not CRT), whereas trypanosomatid protozoa have only CRT. Another important conserved mammalian ER lectin resident is calmegin, expressed only in the testes during spermatogenesis. Calmegin shares ∼60% homology with CNX in mice. Mice deficient in calmegin are nearly sterile despite producing normal-looking sperm. The sperm are defective in migration into the oviducts and they do not adhere to the zona pellucida. UGGT is absent from S. cerevisiae but not from Schizosaccharomyces pombe cells. The enzyme is not required for the viability of the fission yeast or single mammalian cells grown under normal conditions. The enzyme is also dispensable for growth of some multicellular organisms, such as plants. However, loss of UGGT is embryonically lethal in mice. This fact, as well of the strict requirement of UGGT for the viability of S. pombe cells only when grown under severe ER stress conditions, point to a restricted set of glycoproteins absolutely requiring UGGT for proper folding. In addition to combined factor V and VIII deficiency caused by ERGIC53 mutations (see above), other congenital diseases result in retention of defective proteins in the ER and their eventual proteasomal degradation. For instance, the most common mutation in cystic fibrosis patients, CFTR-ΔF508, leads to improper folding of this chloride channel and its retention in the ER. Importantly, the mutation affects CFTR transit to the plasma membrane but not its transport activity. Similarly, UGGT recognition of a brassinosteroid receptor mutant triggers retention in the ER of Arabidopsis thaliana cells. Thus, certain diseases caused by ER retention of defective glycoproteins might be ameliorated by inhibitors of UGGT activity. One beautiful example of how the fine sensitivity of UGGT allows modulation of basic physiological processes is its role during antigen presentation by the major histocompatibility complex I (MHC I). Here, MHC I complexes loaded with suboptimal peptides are recognized by UGGT, thus triggering their retention in the ER. On the contrary, complexes formed with high-affinity peptides are poor UGGT substrates and are able to be presented on the cell surface.'
 'Chimera-type R-type lectins connect with various functional domains in invertebrates. Pierisin in cabbage butterfly (Arthropoda, order Lepidoptera) larvae expresses R-type lectin domain at the carboxyl terminus of an ADP-ribosyltransferase domain (Uniprot Q9U8Q4) and induces apoptosis of cancer cells. This lectin domain was found to bind to glycan ligands of Gb3 and Gb4 (GalNAcβ1-3Galα1-4Galβ1-4Glc) glycosphingolipids on cancer cells termed, respectively, Pk and P antigens (Chapter 14). Clotting factor G α-subunit (Uniprot Q27082) in horseshoe crab (Arthropoda, order Crustacea) blood contained two glycoside-hydrolase domains on either side of a central R-type lectin domain. Another R-type lectin, CEL-III (PDB 2Z48), in sea cucumber (Echinodermata, Deuterostomia; Chapter 27) has both a pore-forming domain and a tandem-repeat-type R-type lectin domain and displays hemolytic effect on mammalian erythrocytes. Almost all the configurations seen in invertebrate R-type lectins are also found in bacterial R-type lectins. β-trefoil fold is a very effective protein scaffold for biological functions. Living systems have evidently improved their survival strategies by evolutionary tinkering of the R-type lectin domain per se, or by linking it with other functional domains. UDP-GalNAc: polypeptide α-N-acetylgalactosaminyltransferases (ppGalNAcTs: EC 2.4.1.41) have chimeric-form R-type lectin structures consisting of a catalytic subdomain (amino-terminal) and an R-type lectin domain (carboxy-terminal) (PDB 1HXB). Mucin-type O-glycans have a common core structure GalNAcα1-Ser/Thr (Figure 31.5), which can be modified by addition of Gal or GalNAc residues (Chapter 10). Most proteins (∼80%) that pass through the secretory apparatus have at least one Ser or Thr residue modified with α-linked GalNAc. A family of ppGalNAcTs functioning in the Golgi are responsible for modification of Ser/Thr residues. Structure and function of UDP-GalNAc:polypeptide α-N-acetylgalactosaminyltransferases (ppGalNAcTs). (A) ppGalNAcT activity with Ser/Thr-containing acceptor peptide and UDP-GalNAc as donor. Some ppGalNAcTs act preferentially on the product of this (more...) These enzymes are widely distributed in vertebrates, invertebrates, and protists, but so far have not been found in bacteria, plants, or fungi (Chapter 26). In humans, 20 ppGalNAcT-encoding isoform genes have been studied with regard to structure, substrate specificity, and function (Chapter 6). A ppGalNAcT (Uniprot S5S833) was found in a snail that serves as an intermediate host for trematodes, the primary group of schistosomes that infect humans. The snail ppGalNAcT, in contrast to those in vertebrates, has affinity for a wide range of substrates and only one isoform. Enzymes in this family of ppGalNAcTs have multidomain structure and are type II transmembrane proteins having the amino terminus in cytosol and carboxyl terminus on the other side of the membrane. They interact dynamically with their polypeptide substrates. In ppGalNAcT2, the R-type lectin domain interacts primarily with GalNAc on modified residues, whereas other regions of the polypeptide substrate lie in a groove next to the active site of the catalytic domain. The proximity of these two interactions positions the enzyme to bind special acceptor peptides.'
 'Recently, a second β-linked O-glucose modification site has been identified between the third and the fourth Cys of the EGF repeats at the putative consensus sequence C3XNTXGSFXC4 (Figure 13.1A), which is found in more than 30 proteins in mouse and human databases. Homologs of POGLUT1, termed POGLUT2 and POGLUT3, are responsible for modifying this site. The O-glucose at this site has not been reported to be elongated past the monosaccharide. Although β-linked O-GlcNAc is very common on proteins in the nuclear and cytosolic compartments (Chapter 19), the same modification can be found in comparatively few membrane and secreted proteins. Addition of O-GlcNAc occurs between the fifth and sixth conserved Cys of an EGF repeat at the putative consensus C5XXXX(S/T)GX2-3C6 (Figure 13.1A) in mouse and Drosophila Notch. However, sites have been mapped on only a few proteins. The O-GlcNAc can be elongated by β1,4Gal followed by a sialic acid to form Siaα2-3/6Galβ1-4GlcNAc. The EGF-specific O-GlcNAc transferase, EOGT, is distinct from OGT, the GlcNAc-transferase that modifies nuclear and cytoplasmic proteins (Chapter 19). Inactivation of Drosophila Eogt is pupal lethal and causes a wing-blistering defect if deleted in the wing. The Drosophila phenotype can be explained by an EOGT substrate Dumpy and no obvious Notch-deficient phenotypes have been observed. However, genetic interactions between eogt and Notch pathway gene mutations occur in the fly and mutations in human EOGT result in skin and skeletal problems in AOS (Adams–Oliver syndrome type 4; OMIM 615297), a disorder with links to the Notch pathway. Consistently, EOGT in mice regulates vascular development and integrity by potentiating Delta-like ligand-mediated Notch signaling. O-Fucose is also found on TSRs. Similar to EGF repeats, TSRs are small protein domains (50–60 amino acids) with six conserved Cys that form three disulfide bonds (Figure 13.4). Like EGF repeats, TSRs are found in a subset of cell-surface and secreted proteins in metazoans, and they appear to function in protein–protein interactions. The O-fucose site occurs between the first and second conserved Cys residues at the putative consensus sequence C1X2(S/T)C2 in TSRs in about 50 proteins (Table 13.1). The O-fucose on TSRs can be elongated to form the disaccharide Glcβ1-3Fucα-O-Ser/Thr, first observed in 1975 in glycosides from human urine. The enzyme that fucosylates TSRs is POFUT2. It is expressed in many cells and tissues and is distinct from POFUT1. Elimination of Pofut2 in mice results in early embryonic lethality with defects in gastrulation. The gene encoding the β3-glucosyltransferase that elongates O-fucose on TSRs is B3GLCT. Mutations in B3GLCT in humans result in a multifaceted severe developmental disorder known as Peters-plus syndrome (OMIM 261540). Elimination of B3glct in mice phenocopies many of the defects seen in Peters-plus syndrome. TSRs are also often frequently modified with C-mannose (Figure 13.4), although the relationship between the two modifications is not yet clear. A number of biologically interesting proteins are known or predicted to contain this modification, including thrombospondin-1 and -2, all ADAMTS (a disintegrin and metalloproteinase with thrombospondin motifs; ADAMTS 1–20) and ADAMTS-like proteins, properdin, and F-spondin (Table 13.1).']","The STT3A complex (OSTA), closely associated with the translocon, contains the KCP2 and DC2 subunits, whereas the STT3B complex (OSTB) that has either MAGT1 or TUSC3 (homologs of yeast Ost3p/Ost6p) glycosylates polypeptides posttranslationally after their translocation into the ER.","The STT3A complex (OSTA), closely associated with the translocon, contains the KCP2 and DC2 subunits, whereas the STT3B complex (OSTB) that has either MAGT1 or TUSC3 (homologs of yeast Ost3p/Ost6p) glycosylates polypeptides posttranslationally after their translocation into the ER. On binding to the catalytic STT3 subunit, the client peptide adopts a 180° turn, making polypeptide folding a competing reaction for N-glycosylation. Indeed, the thioredoxin subunits of the OST complex (Ost3p/Ost6p; MAGT1/TUSC1) modulate the oxidative folding of the client polypeptide, thereby extending the polypeptide substrate range of OST. As of February 2021, the UniProt database reports 1911 N-glycosylation sites in yeast and 13,648 in murine glycoproteins.",1.0,0.583000512134815,0.8861182065436934,0.008064516129032258,0.999999999975,1.0
"Complete the following paragraph: Sialic acids may be modified by O-acetylation, and Gal and GlcNAc by sulfation. The length of O-GalNAc glycans may vary from a single GalNAc to more than 20 sugar residues and can include blood group and other glycan epitopes. This chapter describes the structures, biosynthesis, and functions of O-GalNAc glycans in mammals.","['GAL3ST4 is the major sulfotransferase acting on the Gal residue of core 1 O-glycans. Skeletal type keratan sulfate (KS) is also an O-GalNAc-linked highly sulfated polysaccharide (Chapter 17). O-acetyltransferases that add O-acetyl esters to one or more hydroxyl groups of Sia residues remain poorly characterized. Some evidence suggests that the esters can be added to CMP-Sias before transfer. The α1-2 fucosyltransferases FUT1 and FUT2 synthesize the blood group H determinant of O-GalNAc glycans which can be converted by an α1-3 Gal-transferase to blood group B or by an α1-3 GalNAc-transferase to blood group A (Table 10.1). In addition, α1-3 and α1-3/4 fucosyltransferases synthesize the Lewis antigens (Table 10.1). A number of uncommon and antigenic sugars are also found on O-GalNAc glycans. For example, neuropilin-2 in the nervous system has core 1 and 2 O-GalNAc glycans that carry polysialic acid residues synthesized by polysialytransferase IV (ST8SIA4). These highly charged glycans play a critical role in the negative regulation of cell adhesion during maturation of the nervous system. An α1-4 GlcNAc-transferase in gastric tissue adds GlcNAc in α1-4 linkage to β1-4 Gal in core 1 and 2 O-GalNAc glycans. The α1-4 GlcNAc-containing glycans appear to inhibit colonization by Helicobacter pylori. The functions of O-GalNAc glycans are many and varied, depending on their structure and density, as well on as the protein to which they are attached. As mentioned above, in densely glycosylated proteins such as mucins, O-glycans aid in hydration, structural support, interaction with the microbiome, and protection from proteolysis. In contrast, the function of single sites of O-GalNAc glycosylation vary widely and are still being determined. For example, O-GalNAc glycosylation at one or a few sites in certain proteins has been shown to regulate proprotein convertase cleavage, shedding of ectodomains, ligand binding, and cell–cell and cell–matrix interactions, influencing tissue formation and differentiation. Moreover, O-glycans, either in defined sites or clusters, may serve as carriers of terminal ligands such as blood type antigens like sialyl-Lewis x, which are important for host–pathogen interactions, and the circulation and homing of immune cells. The ligands for certain selectin-mediated interactions between endothelial cells and leukocytes require sialyl-Lewis x that is commonly attached to core 2 O-GalNAc glycans (Table 10.1). Finally, O-glycan terminal motifs on some immune cell subtypes can engage specific Siglecs and induce tolerance to self-antigens. Methods to determine the function of O-GalNAc glycans are diverse and include the use of biosynthetic inhibitors, the construction of cell lines that lack or overexpress specific enzymes in O-glycosylation pathways, the use of O-GalNAc glycan-specific lectins or antibodies, removal of specific sugar residues by glycosidases, and deletion/mutation of specific GALNTs in model organisms. For example, a critical role of O-GalNAc glycans in selectin-mediated cell adhesion was revealed by treating cells with GalNAc-O-benzyl, which is a competitive inhibitor of core 1 and core 2 synthesis. GalNAc-O-benzyl acts as a decoy substrate for C1GALT1 and thereby reduces the synthesis of core 1 and core 2 O-GalNAc glycans on glycoproteins. Inhibitor-treated cancer cells lose the ability to bind to E-selectin and endothelial cells in vitro. Cancer cells often express sialyl-Lewis x and may thus use the selectin-binding properties of sialyl-Lewis x as a mechanism to invade tissues.'
 'They can also carry Sia and form sialyl-Tn or sialyl-T antigens. O-GalNAc cores are often extended to form complex O-GalNAc glycans that may include the ABO and Lewis blood group determinants (Chapter 14), polysialic acid, the linear i antigen (Galβ1-4GlcNAcβ1-3Gal), and the GlcNAc β1-6-branched I antigens (Table 10.1). Extensions by Type 1 (Galβ1-3GlcNAc) or Type 2 (Galβ1-4GlcNAc) units can be repeated and provide scaffolds for the attachment of additional sugars or functional groups. The termini of O-GalNAc glycans may contain Fuc and Sia in α-linkages, and Gal, GalNAc, and GlcNAc in both α- and β-linkages, and sulfate. Many of these terminal sugars are antigenic or recognized by lectins. In particular, the sialylated and sulfated Lewis antigens are ligands for selectins (Chapter 34), and Gal-terminating structures are ligands for galectins (Chapter 36). Some sugar residues, or their modifications, may mask underlying antigens or receptors. For example, O-acetyl groups on the Sia of the sialyl-Tn antigen prevent recognition by anti-sialyl-Tn antibodies. Gut bacteria may actively remove this mask. Dense O-glycosylation of mucin domains provides almost complete protection from protease degradation. The O-linkage between GalNAc and Ser/Thr residues is labile under alkaline conditions. Thus, O-GalNAc glycans can be released by a reaction termed β-elimination (i.e., treatment with 0.1 m sodium hydroxide). The hemiacetal GalNAc produced will undergo rapid alkali-catalyzed degradation under these conditions (called peeling), but can be reduced with sodium borohydride to yield stable N-acetylgalactosaminitol at the reducing end of the released O-glycan. β-Elimination is the method of choice to release O-glycans from glycoproteins that also have N-glycans, because the latter are not susceptible to cleavage under mild conditions. O-GalNAc glycans, as well as other Ser/Thr-linked glycans (Chapter 13), are released as alditols by β-elimination, but with losses of labile O-acetyl or sulfate esters. An alternative method that preserves the reducing end of O-GalNAc uses ammonia followed by boric acid. O-GalNAc that is not substituted with another sugar can be enzymatically released by a N-acetylgalactosaminidase. Another glycosidase, termed O-glycanase, releases core 1 (Galβ1-3GalNAc-) from Ser/Thr, provided the disaccharide is not further substituted. Thus, sialidase treatment followed by O-glycanase releases most simple, core 1 O-GalNAc glycans. Terminal Sia residues can also be easily removed with mild acid treatment. There are no known enzymes that can release more complex and extended whole O-GalNAc glycans, but mixtures of exoglycosidases can be used to sequentially remove sugars from O-GalNAc glycans on a glycoprotein. Glycoproteins with clusters of sialylated O-GalNAc glycans may be digested by an O-sialoglycoprotein endopeptidase. Released, intact O-GalNAc glycans may be separated by different chromatographic methods, including high-performance liquid chromatography (HPLC). Chemical derivatization of GalNAc at the reducing end helps in the separation and subsequent analysis of sugar composition and linkages by gas chromatography and mass spectrometry (MS) (Chapter 50). Another tool to isolate O-glycans with specific epitopes is affinity chromatography using lectins. For example, Helix pomatia agglutinin binds to terminal GalNAc, whereas peanut lectin binds to unsubstituted core 1 (Table 10.1).'
 'Chemical derivatization of GalNAc at the reducing end helps in the separation and subsequent analysis of sugar composition and linkages by gas chromatography and mass spectrometry (MS) (Chapter 50). Another tool to isolate O-glycans with specific epitopes is affinity chromatography using lectins. For example, Helix pomatia agglutinin binds to terminal GalNAc, whereas peanut lectin binds to unsubstituted core 1 (Table 10.1). The structures of O-GalNAc glycans released from mucins and other glycoproteins may be determined by a combination of liquid or gas chromatography, MS, and nuclear magnetic resonance (NMR) spectroscopy. The anomeric linkage of each sugar can be determined using specific glycosidases that distinguish between α- or β-linked sugars, and by one- and two-dimensional NMR methods (Chapter 50). The sites of O-GalNAc glycan modification in mucins are difficult to determine directly, but this has been achieved by sensitive MS methods and new enzymatic tools. A big step forward in understanding the extent of the O-GalNAc glycoproteome came with the proteome-wide mapping of O-GalNAc glycosylation sites. Several MS-based strategies have been applied including modifications of the endogenous glycan structures through chemical labeling, lectin enrichment of glycans derived from native or glycoengineered cells, or O-GalNAc-specific endo-peptidase treatment. Additionally, the use of mucin-type O-proteases (OpeRATOR and StcE) that specifically cleave N-terminal to an O-glycosylated Ser/Thr have aided in mapping sites of glycosylation. Based on these methodologies, we now know that >80% of the proteins passing through the secretory pathway are modified with O-GalNAc glycans, although the occupancy and the nature of an O-GalNAc glycan associated with a glycosylated site remains elusive. O-GalNAc glycans are added to Ser/Thr residues in proteins in the Golgi apparatus. The biosynthetic glycosyltransferases are type II transmembrane proteins with a short cytoplasmic tail at the amino terminus, a transmembrane domain, a stem region, and a catalytic domain in the lumen of the Golgi. The arrangement within Golgi membranes appears to be similar to an “assembly line” with early reactions occurring in the cis-Golgi and late reactions in the trans-Golgi (Chapter 4). Many of the enzymes, however, are diffusely distributed in Golgi compartments. The subcellular localization, activity levels, and substrate specificities of glycosyltransferases involved in the assembly of O-GalNAc glycans play a critical role in determining the range of O-glycans synthesized by a cell (Table 10.2 and Figures 10.2 and 10.3). The glycosyltransferases that are involved in the assembly of O-GalNAc glycans are listed in Table 10.2. However, other enzymes that contribute to the synthesis of N-glycans and glycolipids also act on O-glycans, and some of these prefer O-glycans as acceptor substrates (Chapter 14). In vitro assays have shown that the activities of glycosyltransferases are controlled by factors such as metal ions and pH. Biosynthesis of core 1 and 2 O-GalNAc glycans as described in the text. Green lines are protein.  Glycosyltransferases that synthesize O-GalNAc glycans  The first and essential step of O-GalNAc glycosylation is the addition of GalNAc in α-linkage to Ser or Thr by a polypeptide GalNAc-transferase (ppGalNAcT; GALNT) (Table 10.2; Figure 10.2). Humans have 20 genes encoding GALNTs. The large number of GALNTs provides redundancy and also reflects differences in substrate specificity. Studies in the fly indicate that certain GALNTs (PGANTs in the fly) are required for normal development (Chapter 26). Deletion of single GALNTs in mammals results in organ and cell differentiation defects.'
 'NCBI Bookshelf. A service of the National Library of Medicine, National Institutes of Health. Varki A, Cummings RD, Esko JD, et al., editors. Essentials of Glycobiology [Internet]. 4th edition. Cold Spring Harbor (NY): Cold Spring Harbor Laboratory Press; 2022.  doi: 10.1101/glycobiology.4e.10 Inka Brockhausen, Hans H. Wandall, Kelly G. Ten Hagen, and Pamela Stanley. Many glycoproteins carry glycans initiated by GalNAc attached to the hydroxyl of Ser or Thr residues. Mucins are the class of glycoproteins carrying the greatest number of O-GalNAc glycans (also called mucin-type O-glycans), but this posttranslational modification is common among many glycoproteins. The sugars found in O-GalNAc glycans include GalNAc, Gal, GlcNAc, Fuc, and Sia, whereas Man, Glc, or Xyl residues are not represented. Sialic acids may be modified by O-acetylation, and Gal and GlcNAc by sulfation. The length of O-GalNAc glycans may vary from a single GalNAc to more than 20 sugar residues and can include blood group and other glycan epitopes. This chapter describes the structures, biosynthesis, and functions of O-GalNAc glycans in mammals. About 150 years ago, E. Eichwald and E. Hoppe-Seyler noted that highly glycosylated proteins that contain hundreds of O-GalNAc glycans, which they termed mucins, are found throughout the body (Figure 10.1). Since then we have learned that O-GalNAc glycans are not only found as dense clusters on mucins, but also at single sites on most secreted and membrane-bound proteins. O-GalNAc glycans are involved in almost every aspect of biology, including cell–cell communication, cell adhesion, signal transduction, immune surveillance, epithelial cell protection, and host–pathogen interactions. A simplified model of a large secreted mucin. The PTS domain, rich in Pro, Thr, and Ser, is highly O-glycosylated on Ser/Thr. The mucin assumes an extended “bottle brush” conformation. The cysteine-rich regions form disulfide bonds generating (more...) GalNAc O-linked to Ser/Thr is the initiating sugar of O-GalNAc glycans and is usually extended to form one of four common core structures (Table 10.1; Figure 10.1). Each core can subsequently be extended to give a mature linear or branched O-GalNAc glycan. O-GalNAc glycan cores and antigenic epitopes of mucins  The great variety of O-GalNAc glycans often makes it very difficult to assign functions to individual O-GalNAc glycans at particular attachment sites, and most functions have historically been ascribed to the densely glycosylated mucins. In mucins, O-GalNAc glycans control chemical, physical, and biological properties. Because O-GalNAc glycans are hydrophilic, and usually negatively charged, they promote binding of water and salts and are major contributors to the viscosity and adhesiveness of mucins and the mucus they form. Mucins line the epithelial surfaces of the body, including the gastrointestinal, genitourinary, and respiratory tracts, where they shield epithelial cells against physical and chemical damage and protect against infection. Mucins can be antiadhesive and repel cell-surface interactions or, alternatively, promote adhesion by mediating recognition of glycan-binding proteins via their O-GalNAc glycans. A number of diseases are associated with abnormal mucin gene expression and abnormal mucin O-GalNAc glycans. These include cancer (Chapter 47), inflammatory bowel disease, congenital disorders of glycosylation (Chapter 45), and hypersecretory bronchial and lung diseases. Humans have about 20 different mucin genes encoding both secreted and membrane-bound mucins, which vary considerably in their primary sequence and tissue-specific expression.'
 'Humans have 20 genes encoding GALNTs. The large number of GALNTs provides redundancy and also reflects differences in substrate specificity. Studies in the fly indicate that certain GALNTs (PGANTs in the fly) are required for normal development (Chapter 26). Deletion of single GALNTs in mammals results in organ and cell differentiation defects. The GALNTs are found throughout the animal kingdom but not in bacteria, yeast, or plants. All GALNTs are classified in the GT27 CaZy family with a GT-A fold (Chapter 8), and most have a lectin (ricin-like) domain at the carboxyl terminus, which is unique among glycosyltransferases. GALNTs coordinate the transfer of GalNAc from the donor substrate (UDP-GalNAc) to the hydroxyl group of Ser/Thr on acceptor substrates and fall into two general categories: those that require the presence of an extant GalNAc on a peptide or protein before they will add additional GalNAcs (glycopeptide-preferring transferases), and those that will transfer GalNAc to a modified or unmodified protein (peptide transferases). Crystal structures of a number of GALNTs have revealed key details in the mechanisms of action of these enzymes and their unique substrate specificities. The conserved DXH motif found in all GALNTs coordinates Mn++ and UDP-GalNAc binding. Acceptor substrate preferences are dictated by unique amino acids present within the catalytic domain of each GALNT. For example, some GALNTs have “proline pockets” within the catalytic domain, thus conferring a strong preference for Pro residues near the site of O-glycosylation. The lectin domain recognizes extant O-GalNAc residues on previously glycosylated substrates to position the catalytic domain for further GalNAc addition. More recent work has demonstrated that charged residues within the lectin domain can also influence the glycosylation of charged protein substrates (in the absence of prior glycosylation). Additionally, the flexible linker in between the catalytic and lectin domains (which varies in length and sequence among the GALNTs) has been shown to influence sites of GalNAc addition. Databases that estimate the likelihood of O-glycosylation at a specific site are based on known sequences around O-glycosylation sites, as well as in vitro determinations of sequence preferences for certain GALNTs (e.g., NetOGlyc and ISOGlyP). However, these predictions do not account for the different GALNTs expressed in the cell type producing a particular glycoprotein and do not apply to mucins. Because of overlapping localization of GALNTs and the extension enzymes, it is likely that a heterogeneous mixture of different O-GalNAc glycans is present on all mature glycoproteins. Also, the presence of O-GalNAc glycans on proteins is likely often missed because of this limited predictive value of surrounding amino acid sequence. As mentioned above, O-GalNAc glycan synthesis begins with the transfer of GalNAc from UDP-GalNAc to Ser/Thr catalyzed by a GALNT. Although a single, unextended GalNAc linked to Ser/Thr (the Tn antigen) is uncommon in normal mucins, it is often found at increased levels in tumor mucins. This suggests that the extension of O-GalNAc glycans beyond the first sugar is blocked in some cancer cells. Sia added to GalNAc by the α2-6 sialyltransferase ST6GALNAC1 generates the sialyl-Tn antigen, which is common in advanced tumors. Other sugars are not known to be added to this O-glycan, but it can be O-acetylated by Sia O-acetyltransferase, which prevents detection by anti-sialyl-Tn antibodies. The addition of one or two neutral sugars to O-GalNAc generates one of the different cores of O-GalNAc glycans (Table 10.1; Figure 10.2). Core 1 (Galβ1-3GalNAc-O-Ser/Thr) is generated by C1GALT1.']","O-GalNAc glycans in mammals exhibit a wide range of lengths, from a single GalNAc to over 20 sugar residues, encompassing various blood group and other glycan epitopes. The chapter delves into the structures, biosynthesis, and functions of these diverse O-GalNAc glycans in mammalian systems.","About 150 years ago, E. Eichwald and E. Hoppe-Seyler noted that highly glycosylated proteins that contain hundreds of O-GalNAc glycans, which they termed mucins, are found throughout the body (Figure 10.1). Since then we have learned that O-GalNAc glycans are not only found as dense clusters on mucins, but also at single sites on most secreted and membrane-bound proteins. O-GalNAc glycans are involved in almost every aspect of biology, including cell–cell communication, cell adhesion, signal transduction, immune surveillance, epithelial cell protection, and host–pathogen interactions.",1.0,0.5827598079479281,0.753517805395755,0.0078125,0.99999999998,1.0
"Complete the following paragraph: Nearly all glycolipids in vertebrates are GSLs, which, in turn, are part of the larger family of sphingolipids (lipids built on sphingoid bases) that includes the major membrane phospholipid, sphingomyelin, and the second messenger sphingosine 1-phosphate that regulates angiogenesis and immune cell trafficking.","['NCBI Bookshelf. A service of the National Library of Medicine, National Institutes of Health. Varki A, Cummings RD, Esko JD, et al., editors. Essentials of Glycobiology [Internet]. 4th edition. Cold Spring Harbor (NY): Cold Spring Harbor Laboratory Press; 2022.  doi: 10.1101/glycobiology.4e.11 Ronald L. Schnaar, Roger Sandhoff, Michael Tiemeyer, and Taroh Kinoshita. Glycosphingolipids (GSLs), a subclass of glycolipids found in the cell membranes of organisms from bacteria to humans, are the major glycolipids of animals. The emphasis of this chapter is on vertebrate glycosphingolipids. Information on glycolipids of fungi, plants, and invertebrates is covered elsewhere (Chapters 20 and 23–26), as are glycosylphosphatidylinositols (GPIs), glycolipids attached to proteins as membrane anchors (Chapter 12). This chapter describes the characteristic features of GSLs, pathways for their biosynthesis, and insights into their biological roles in membrane structure, host–pathogen interactions, cell–cell recognition, and modulation of membrane protein function. The first GSL to be characterized was galactosylceramide (GalCer). Among the simplest of glycolipids, it is also one of the most abundant molecules in the vertebrate brain. It consists of a single galactose residue in β-glycosidic linkage to the C-1 hydroxyl group of a lipid moiety called ceramide (Figure 11.1). The structure of the lipid, a long-chain amino alcohol in amide linkage to a fatty acid, was so difficult to determine that the amino alcohol was dubbed “sphingosine” after the enigmatic Egyptian Sphinx. Animal cells synthesize various sphingosines and related long-chain amino alcohols, together referred to as sphingoid bases. Nearly all glycolipids in vertebrates are GSLs, which, in turn, are part of the larger family of sphingolipids (lipids built on sphingoid bases) that includes the major membrane phospholipid, sphingomyelin, and the second messenger sphingosine 1-phosphate that regulates angiogenesis and immune cell trafficking. Other GSLs were later identified because they accumulate to pathological levels in tissues of patients with lysosomal storage diseases, genetic disorders in which glycan degrading enzymes are faulty or missing (Chapter 44). For example, a sialic acid–containing GSL (GM2) was first isolated from the brain of a victim of Tay–Sachs disease, in which it accumulates, and was named “ganglioside” based on its location in nerve clusters or “ganglia” in the brain. Likewise, glucosylceramide (GlcCer) was first isolated from the spleen of a Gaucher disease patient, where it accumulates. As purification, separation, and analytical techniques improved, GSLs were found in all vertebrate tissues. Hundreds of unique GSL structures were found that vary in glycan structures alone, each of which are presented on several distinct ceramides. Structures of representative glycosphingolipids (GSLs) and glycoglycerolipids. GSLs, such as GalCer, are built on a ceramide lipid moiety that consists of a long-chain amino alcohol (sphingosine) in amide linkage to a fatty acid. In comparison, glycoglycerolipids, (more...) Glycoglycerolipids are distinguished from GSLs by their lipid, having glycans linked to the C-3 hydroxyl of diacylglycerol or alkyl(acyl)glycerol (Figure 11.1). Very minor constituents of most animal tissues (other than the testes), glycoglycerolipids are widely distributed in microbes and plants. Glycolipids of fungi, plants, and invertebrates are covered in Chapters 20 and 23–26.'
 'Very minor constituents of most animal tissues (other than the testes), glycoglycerolipids are widely distributed in microbes and plants. Glycolipids of fungi, plants, and invertebrates are covered in Chapters 20 and 23–26. Glycosylphosphatidylinositols (GPIs), a different family of glycolipids, are often attached to proteins as membrane, and may also exist as free glycolipids (discussed in Chapter 12). The lipopolysaccharides of Gram-negative bacteria are discussed in Chapter 21. The ceramide lipid of GSLs consists of a sphingoid base with a fatty acid amide at the C-2 amine. Sphingosine is the most common sphingoid base in mammals, with hydroxyls at the C-1 and C-3 carbons and a trans double bond between C-4 and C-5 (Figure 11.1). Sphinganine is the same structure without the double bond, and phytosphingosine lacks the double bond and has an additional hydroxyl on C-4. Ceramides containing sphinganine and phytosphingosine are less abundant in animals, whereas phytosphingosine is prominent in the glycosphingolipids of plants and fungi. The fatty acid components of ceramides vary widely, with lengths ranging from C14 to C30 or greater. Although often saturated, they may be variably unsaturated or have α-hydroxyl groups. Ceramide structures modulate membrane associations and functions of GSLs. Although ceramide variations add significant diversity to GSL structures, major structural and functional classifications are based on the glycans. The first sugars linked to ceramide in vertebrates are typically β-linked galactose (GalCer) or glucose (GlcCer). GalCer and its analog sulfatide, with sulfate at the C-3 hydroxyl of galactose, are the major glycans in the kidney and the brain. In the brain they have essential roles in the structure and function of myelin, the insulator that allows for rapid nerve conduction. Interestingly, the related sulfogalactoglycerolipid, seminolipid (Figure 11.1), is abundant only in the male reproductive tract, where it is essential for spermatogenesis. Sialylated GalCer (Neu5Acα2-3GalβCer; GM4) is also found in myelin. These galactolipids are seldom extended with larger saccharide chains; rather, most other members of the large and diverse family of GSLs in animals are built on GlcCer (Figure 11.2). GlcCer itself is abundant in certain tissues. In skin, it is a precursor of special ceramides that are required for creating the essential surface water barrier when embedded into the stratum corneum of the epidermis (see below). Glycosphingolipid (GSL) neutral cores and their designation based on IUPAC (International Union of Pure and Applied Chemistry) Nomenclature. In the official nomenclature, saccharide and other substituents that extend or branch from the neutral core structures (more...) The vast majority of GSL structures are classified based on seven common tetrasaccharide neutral sugar core sequences (Figure 11.2). GSLs sharing the same neutral core sequence are said to be of that “series”; the quantitatively major series in vertebrates are ganglio-, globo-, and neolacto-series, whereas in invertebrates the mollu- and arthro-series predominate. GSL series are expressed in tissue-specific patterns. In mammals, ganglio-series GSLs, although broadly distributed, predominate in the brain, whereas neolacto-series glycolipids are common on certain hematopoietic cells including leukocytes. In contrast, lacto-series glycolipids are prominent in secretory organs and globo-series glycolipids are the most abundant in erythrocytes. This diversity presumably reflects important differences in GSL functions. GSLs are further subclassified as neutral (no charged sugars or ionic groups), sialylated (having one or more sialic acid residues), or sulfated.'
 'In contrast, guinea pig, mouse, sheep, and goat are Forssman antigen–positive. The breakdown of GSLs occurs stepwise by the action of lysosomal hydrolases. GSLs on the outer surface of the plasma membrane are internalized, along with other membrane components, in invaginated vesicles that then fuse with endosomes, resulting in the GSL glycan facing the endosome lumen. GSL-enriched areas of the endosomal membrane may then invaginate once again to form intraluminal vesicles within the endosome. When endosomes fuse with primary lysosomes, GSLs become exposed to lysosomal hydrolases. Absence of any one of these glycosidases results in lysosomal storage diseases (Chapter 44). As GSLs are successively cleaved to smaller structures, the remaining “core” monosaccharides become inaccessible to the water-soluble lysosomal hydrolases and require assistance from activator proteins that are referred to as “liftases.” These include GM2-activator protein and four structurally related saposins, all of which are derived from a single polypeptide precursor by proteolytic cleavage. Saposins are thought to bind to their glycolipid substrate, disrupt its interaction with the local membrane environment, and facilitate access of the glycans to the water-soluble hydrolytic enzymes. In certain lysosomal storage diseases (Chapter 44), mutations in activator proteins result in pathological accumulation of glycolipids, even though there is an abundance of the hydrolase responsible for degradation, thus demonstrating the essential role of activator proteins in GSL catabolism in vivo. The final breakdown products of GSL catabolism—monosaccharides, fatty acids, and free sphingoid bases—are then available for reuse by salvage pathways. GSLs comprise from <5% (erythrocytes) to >20% (myelin) of the total membrane lipids in the plasma membranes of vertebrate cells. However, they are not uniformly distributed in the plane of the membrane but cluster in “lipid rafts,” small lateral microdomains of self-associating membrane molecules. Although the precise structure and makeup of lipid rafts is a matter of ongoing debate, their outer leaflets are believed to be enriched in sphingolipids, including GSLs and sphingomyelin (the phosphocholine derivative of ceramide). The self-association of sphingolipids is driven through the unique biophysical properties imparted by their long saturated carbon chains (Figure 11.1). Besides sphingolipids, lipid rafts are enriched in cholesterol and selected proteins, including GPI-anchored proteins and some transmembrane signaling proteins such as receptor tyrosine kinases. On the cytoplasmic side, acylated proteins, such as Src family protein tyrosine kinases and Gα subunits of G proteins, associate with lipid rafts. Lipid rafts are apparently dynamic, short-lived (msec), and small (10–50 nm in diameter), each containing perhaps hundreds of lipid molecules along with a few protein molecules. It has been argued that external clustering of lipid rafts into larger structures might bring signaling molecules such as kinases and their substrates together to enhance intracellular signaling. Thus, GSLs may act as intermediaries in the flow of information from the outside to the inside of cells. This idea is supported by the observation that antibody-induced GSL clustering activates lipid-raft-associated signaling and has led to the concept of plasma membrane “glycosignaling domains” or “glycosynapse.” Interactions between glycans and glycan-binding proteins, as well as glycan–glycan interactions, are also very much influenced by the density of glycans in terms of binding affinity. Multiple glycans clustered in a limited area can increase the avidity of cognate binding proteins compared with a single molecule of a glycan (Chapter 29). Natural multivalency adds unique functional properties to plasma membrane glycolipids. Indeed, several growth factor receptors including the epidermal growth factor (EGF) receptor, insulin receptor, and the nerve growth factor receptor are localized in membrane microdomains, and structural studies identified binding sites occupied by specific GSLs that modulate receptor signaling functions.'
 ""Infants with severe Gaucher disease, in which β-glucocerebrosidase activity is nearly absent and GlcCer is not catabolized, are prone to dehydration because of high skin permeability. The relationship among GlcCer, ceramide, and skin permeability was confirmed in mice engineered with the same mutation in β-glucocerebrosidase as found in these infants. The mice unable to catabolize GlcCer died within days of birth by dehydration through the skin. This established the role of GlcCer as the obligate precursor to the ceramide required to build the outermost protective layer (stratum corneum) of the skin. GlcCer is synthesized, transported to the stratum corneum, and then enzymatically hydrolyzed, resulting in ceramide deposition. More complex GSLs function both in cell–cell recognition and in the regulation of signal transduction. As with sulfatide, these functions are sometimes subtle, as exemplified by the effects of blocking ganglioside biosynthesis on nervous system physiology. Given the complexity of complex ganglioside biosynthesis (Figure 11.3), it was surprising to discover that major alterations in ganglioside expression resulted in only modest phenotypic changes in mice. When the N-acetylgalactosaminyltransferase responsible for ganglioside elongation (GM2/GD2 synthase) was inactivated in mice, none of the major complex gangliosides (GM1, GD1a, GD1b, or GT1b) were expressed, and a comparable concentration of the simple gangliosides GM3 and GD3 were found in the adult brain. The resulting mice were grossly normal, but as they aged, mice without the normal spectrum of brain gangliosides displayed signs of axon degeneration and demyelination, hallmarks of a problem in myelin–axon cell–cell communication. These deficits arise from loss of ganglioside binding to a protein on the myelin membrane, myelin-associated glycoprotein (MAG), a member of the Siglec family of sialic acid–dependent carbohydrate-binding proteins (Chapter 35). MAG is expressed on the innermost myelin wrap, directly across from the axon surface. Mice engineered to lack MAG have many of the same phenotypic changes as mice lacking GM2/GD2 synthase, and biochemical and cell-biological studies showed that the major brain gangliosides GD1a and GT1b are excellent ligands for MAG. These results support the conclusion that MAG on the innermost myelin membrane binds to GD1a and GT1b on the axon cell surface to stabilize myelin–axon interactions. Disruption of the same ganglioside biosynthetic gene in humans leads to a similar phenotype: hereditary spastic paraplegia. A second trans recognition role for GSLs is evident in the interaction of leukocytes with the blood vessel wall during the process of inflammation, the body's protection against bacterial infection. As discussed in Chapter 34, the first step in inflammation is the binding of white blood cells (leukocytes) to the endothelial cells lining the blood vessel near sites of infection (activated endothelium). This cell–cell interaction is initiated when glycan-binding proteins of the selectin family, expressed on the activated endothelium, bind to complementary glycans on the surface of passing leukocytes. One of the selectins, E-selectin, binds to glycoconjugates found on human leukocytes. The glycan receptor(s) for E-selectin are resistant to protease treatment, indicating that they may be GSLs. A candidate class of GSLs, myeloglycans, has been identified in leukocytes. The candidate GSLs have long sugar chains consisting of a neutral core with Galβ1-4GlcNAcβ1-3 repeats (Chapter 14), substituted with a terminal sialic acid and fucose residues on one or more of the N-acetylglucosamine residues. Another role for GSLs in mediating inflammatory responses involves lipid-specific antigen presentation. Natural killer T (NKT) cells, which carry both T- and NKT-cell receptors, are involved in the suppression of autoimmune reactions, cancer metastasis, and the graft rejection response.""
 'In contrast, lacto-series glycolipids are prominent in secretory organs and globo-series glycolipids are the most abundant in erythrocytes. This diversity presumably reflects important differences in GSL functions. GSLs are further subclassified as neutral (no charged sugars or ionic groups), sialylated (having one or more sialic acid residues), or sulfated. Traditionally, all sialylated GSLs are known as “gangliosides” regardless of whether they are based on the ganglio-series neutral sugar core. In the official nomenclature, saccharide and other substituents that extend or branch from the neutral core structures are indicated by a roman numeral designating which of the neutral core sugars carries the substituent (counting the sugar closest to the ceramide as “I”), and a superscript designating which hydroxyl on that sugar is modified (Figure 11.2). This nomenclature is too complex for daily use, so the most common GSLs are usually referred to by unofficial names. For example, in the widely used nomenclature of Svennerholm, the ganglioside Galβ1-3GalNAcβ1-4(Neu5Acα2-3)Galβ1-4GlcβCer is designated “GM1” (Figure 11.3). In this nomenclature, G refers to ganglioside series, the second letter refers to the number of sialic acid residues (mono, di, tri, quattro [or tetra], penta, etc.), and the number (1, 2, 3, etc.) refers to the order of migration of the ganglioside on thin-layer chromatography (TLC) (e.g., GM3 > GM2 > GM1) with respect to the starting point. Therefore, the neutral core oligosaccharide shrinks in size (and moves farther by TLC) as the number increases. Glycosphingolipids (GSLs) are synthesized by the stepwise addition of sugars first to ceramide and then to the growing glycans. Shown as examples are major brain GSLs. Ceramide (Cer) is the acceptor for UDP-Gal:ceramide β-galactosyltransferase (more...) Organic solvents are used to extract glycolipids from tissues and cells, where they are found primarily in the external leaflet of plasma membranes. Extraction procedures, most often using defined chloroform–methanol–water mixtures, are optimized to precipitate and remove proteins and nucleic acids while maximizing solubilization of GSLs (along with other lipids). Because GSLs aggregate with one another and other lipids in aqueous solution, organic solvents are used throughout subsequent purification steps, which typically involve solvent partition, ion-exchange, and adsorption chromatographies. Because of their amphipathic nature, glycolipids are well-suited for TLC analysis, which is useful for monitoring their purification, qualitative and quantitative determination of their expression in normal and diseased tissues, partial structural analysis, and detecting biological activities including immunoreactivity and binding activity toward toxins, viruses, bacteria, and eukaryotic cells. After separation by TLC, picomole to nanomole quantities of glycolipids can be chemically detected with orcinol reagent for hexoses and with resorcinol-HCl reagent for sialic acid. Normal phase TLC robustly resolves GSLs based on oligosaccharide diversity but is less effective at separating differences due to ceramides. To study glycolipid receptors, TLC-resolved glycolipids are overlaid with potential binding proteins or organisms (e.g., antibodies, lectins, toxins, viruses, bacteria, or cells). After washing, glycolipid species that bind can be identified by detection of the bound material at precise positions on the TLC plate. Two-dimensional TLC with exposure to ammonia vapor after the first dimension can be useful in identifying the presence of O-acetyl modifications on sialic acids, which are especially common in the brain. Complete structural analyses of glycolipids require a combination of techniques to determine the composition, sequence, linkage positions, and anomeric configurations of the glycan moiety and the fatty acid and long-chain base of the ceramide moiety.']","GSLs, or glycosphingolipids, are a major type of glycolipids found in vertebrates. They are part of the broader family of sphingolipids, which are lipids built on sphingoid bases. This family includes sphingomyelin, a major membrane phospholipid, and sphingosine 1-phosphate, a second messenger that plays a role in regulating angiogenesis and immune cell trafficking.","Other GSLs were later identified because they accumulate to pathological levels in tissues of patients with lysosomal storage diseases, genetic disorders in which glycan degrading enzymes are faulty or missing (Chapter 44). For example, a sialic acid–containing GSL (GM2) was first isolated from the brain of a victim of Tay–Sachs disease, in which it accumulates, and was named “ganglioside” based on its location in nerve clusters or “ganglia” in the brain. Likewise, glucosylceramide (GlcCer) was first isolated from the spleen of a Gaucher disease patient, where it accumulates. As purification, separation, and analytical techniques improved, GSLs were found in all vertebrate tissues. Hundreds of unique GSL structures were found that vary in glycan structures alone, each of which are presented on several distinct ceramides. Structures of representative glycosphingolipids (GSLs) and glycoglycerolipids. GSLs, such as GalCer, are built on a ceramide lipid moiety that consists of a long-chain amino alcohol (sphingosine) in amide linkage to a fatty acid. In comparison, glycoglycerolipids, (more...) Glycoglycerolipids are distinguished from GSLs by their lipid, having glycans linked to the C-3 hydroxyl of diacylglycerol or alkyl(acyl)glycerol (Figure 11.1).",1.0,0.5880268334785,0.731565212071537,0.007936507936507936,0.99999999998,1.0
"Complete the following paragraph: Proteins attached to glycosylphosphatidylinositol (GPI) via their carboxyl termini are generally found in the outer leaflet of the lipid bilayer facing the extracellular environment. The GPI membrane anchor may be conveniently thought of as an alternative to the single transmembrane domain of type-I integral membrane proteins. This chapter reviews the discovery, distribution, structure, biosynthesis, properties, and suggested functions of GPI anchors and related molecules, as well as their roles in diseases.","['NCBI Bookshelf. A service of the National Library of Medicine, National Institutes of Health. Varki A, Cummings RD, Esko JD, et al., editors. Essentials of Glycobiology [Internet]. 4th edition. Cold Spring Harbor (NY): Cold Spring Harbor Laboratory Press; 2022.  doi: 10.1101/glycobiology.4e.12 Sneha Sudha Komath, Morihisa Fujita, Gerald W. Hart, Michael A.J. Ferguson, and Taroh Kinoshita. Plasma membrane proteins are either peripheral proteins or integral membrane proteins. The latter include proteins that span the lipid bilayer once or several times, and a second class that are covalently attached to lipids. Proteins attached to glycosylphosphatidylinositol (GPI) via their carboxyl termini are generally found in the outer leaflet of the lipid bilayer facing the extracellular environment. The GPI membrane anchor may be conveniently thought of as an alternative to the single transmembrane domain of type-I integral membrane proteins. This chapter reviews the discovery, distribution, structure, biosynthesis, properties, and suggested functions of GPI anchors and related molecules, as well as their roles in diseases. The first tentative evidence for the existence of protein-phospholipid anchors appeared in 1963 with the finding that crude bacterial phospholipase C (PLC) selectively releases alkaline phosphatase from mammalian cells. Phosphatidylinositol (PI)-protein anchors were first postulated in the mid-1970s when highly purified bacterial PI-specific PLCs were observed to release proteins, such as alkaline phosphatase and 5′-nucleotidase, from mammalian plasma membranes. By 1985, these predictions were confirmed by compositional and structural data from studies on Torpedo acetylcholinesterase, human and bovine erythrocyte acetylcholinesterase, rat Thy-1, and the sleeping sickness parasite Trypanosoma brucei variant surface glycoprotein (VSG). The first complete GPI structures, which were for T. brucei VSG and rat Thy-1, were solved in 1988 (Chapter 1, Figure 1.3). To date, hundreds of GPI-anchored proteins (GPI-APs) have been identified in many eukaryotes, ranging from protozoa and fungi to plants and humans (Online Appendix 12A). The range of described GPI-APs and the distribution of putative GPI biosynthesis genes suggests that (1) GPI anchors are almost ubiquitous among eukaryotes; (2) GPI-APs are functionally diverse and include hydrolytic enzymes, adhesion molecules, complement regulatory proteins, receptors, protozoan coat proteins, and prion proteins; and (3) in mammals, alternative messenger RNA (mRNA) splicing may lead to the expression of transmembrane and/or soluble and GPI-anchored forms of the same gene product. These variants may be developmentally regulated. For example, neural cell adhesion molecule (NCAM) exists in GPI-anchored and soluble forms when expressed in muscle and in GPI-anchored and two transmembrane forms when expressed in brain. The substructure Manα1-4GlcNα1-6myo-inositol-1-P-lipid is a universal hallmark of GPI anchors and related structures. All but one protein-linked GPI anchor share a larger common core structure (Figure 12.1; Online Appendix 12B, panels I–IV). The protein–carbohydrate association in GPI-APs is unique in that the reducing terminus of the GPI oligosaccharide is not attached to the protein but to the D-myo-inositol head group of a PI moiety by an α1-6 linkage. A distal, nonreducing mannose (Man) is attached to the protein via an ethanolamine phosphate (EtNP) bridge between its C-6 hydroxyl and the α-carboxyl group of the carboxy-terminal amino acid. GPIs are one of the rare instances in which GlcN is found without either an N-acetyl or N-sulfate (as in proteoglycans) moiety (Chapter 17).'
 'An α2-3 sialic acid (Sia) could be added to the Gal. In T. brucei bloodstream forms, GPI-APs present glycan side-chains consisting of Gal, whereas the procyclic GPIs carry sialylated poly-N-acetyllactosamine and poly-lacto-N-biose structures. The transport of GPI-APs from the ER to the Golgi is mediated by coat protein II (COPII)-coated transport vesicles. Their packaging into the vesicles requires a transmembrane cargo receptor, a complex of four p24 family proteins, that links luminally oriented GPI to COPII components on the cytoplasmic side of the ER membrane. GPI-APs with two long hydrocarbon chains (i.e., those containing diacylglycerol, alkylacylglycerol, alkenylacylglycerol, or ceramide) are stably associated with the lipid bilayer. It follows that inositol-acylated GPI proteins with three fatty-acid chains should be more stably associated. On the other hand, Leishmania LPG, with a single C24:0 alkyl chain, has a half-life of only minutes at the cell surface and is secreted intact into the medium. The thermodynamics of bilayer interactions also depend on the length and degree of saturation of the fatty-acid chains. In this regard, the saturated nature of most (but not all) mammalian GPI anchors (Online Appendix 12B, panels III and IV) is thought to explain why GPI-APs associate with “lipid rafts.” The current model for mammalian lipid rafts is that of transient liquid-ordered nanoclusters of membrane components. These are dependent on dynamic cortical actin asters that, through adaptor proteins, cluster phosphatidylserine (PS) on the inner face of the plasma membrane bilayer. This coupling effect occurs because the long, saturated lipid chains from inner leaflet PS overlap and interact with those of GPI-APs and glycosphingolipids in the middle of the bilayer, thereby generating functional membrane domains. A compelling aspect of this model is that, although dynamic cortical actin can organize molecules across the leaflet into nanoclusters, the clustering of GPI-APs or glycosphingolipids at the outer leaflet can also, conversely, organize the inner leaflet and recruit molecules that may favor liquid-ordered domains. This provides a possible explanation for the perplexing, yet well-characterized, ability of GPI-APs to transduce signals across the plasma membrane. There are many examples of transmembrane signaling via the cross-linking of GPI-APs with antibodies and clustering with a second antibody on various cells, particularly leukocytes. Cellular responses include an increase in intracellular Ca++, tyrosine phosphorylation, proliferation, cytokine induction, and oxidative burst. These signaling events are dependent on the presence of a GPI anchor and might be mostly caused by the induction and coalescence of lipid raft nanoclusters, although their participation in ligand binding in conjunction with signal receptors (such as receptor-like-kinases in Arabidopsis) to transduce extracellular signals cannot be ruled out. GPI-APs involved in transmembrane signaling, such as the glial-cell-(line-)derived neurotrophic factor receptor-α (GDNFR-α), need to be associated with transmembrane β coreceptors to transmit their signals. Similarly, GPI-anchored CD14 (the LPS/LPS-binding protein receptor) requires to partner transmembrane Toll-like receptor-4, and can function equally well with a GPI anchor or with a spliced transmembrane domain. The replacement of carboxy-terminal transmembrane domains of type-I integral membrane proteins by GPIsps allows their expression as GPI-APs on the plasma membrane of transfected mammalian cells. This offers a useful method for producing soluble forms of membrane proteins. For example, the T-cell receptor was rendered soluble after it was expressed in the GPI-anchored form (by the action of bacterial PI-PLC), and not by simply expressing the transmembrane-deleted domain. In addition, purified GPI-APs can be used to coat hydrophobic surface plasmon resonance chips, thus providing a convenient method for orienting and presenting proteins for binding studies.'
 'A distal, nonreducing mannose (Man) is attached to the protein via an ethanolamine phosphate (EtNP) bridge between its C-6 hydroxyl and the α-carboxyl group of the carboxy-terminal amino acid. GPIs are one of the rare instances in which GlcN is found without either an N-acetyl or N-sulfate (as in proteoglycans) moiety (Chapter 17). General structure of glycosylphosphatidylinositol (GPI) anchors attached to proteins. All characterized GPI anchors share a common core consisting of ethanolamine-PO4-6Manα1-2Manα1-6Manα1-4GlcNα1-6myo-inositol-1-PO4-lipid. (more...) Beyond the common core, the structures of mature GPI anchors are quite diverse, depending on both the protein to which they are attached and the organism in which they are synthesized (Figure 12.1; Online Appendix 12B). Modifications to the core include additional EtNP and a wide variety of linear and branched glycosyl substituents of largely unknown function. There is considerable variation in the PI moiety. Indeed, GPI is a rather loose term because, strictly speaking, PI refers specifically to D-myo-inositol-1-P-3(sn-1,2-diacylglycerol) (i.e., diacyl-PI), whereas many GPIs contain other types of inositolphospholipids, such as lysoacyl-PI, alkylacyl-PI, alkenylacyl-PI, and inositolphosphoceramide (Online Appendix 12B). Another variation is the attachment of an ester-linked fatty acid at the C-2 hydroxyl of the inositol residue, which makes the anchor inherently resistant to bacterial PI-PLCs. The available structural data suggest that (1) inositolphosphoceramide-based protein-linked GPIs are mainly found in “lower” eukaryotes, such as Saccharomyces cerevisiae, Aspergillus fumigatus, Aspergillus niger, Dictyostelium discoideum, and Trypanosoma cruzi; (2) the lipid structures of GPIs generally do not reflect those of the general cellular PI or inositolphosphoceramide pool; and (3) the lipid structures of some (e.g., trypanosome) GPI-APs are under developmental control. The factors controlling the synthesis of a mature protein-linked GPI appear to be similar to those for other posttranslational modifications such as N- and O-glycosylation. Thus, primary control occurs at the cellular level, whereby the levels of specific biosynthetic and processing enzymes dictate the final repertoire of structures. Secondary control occurs at the level of the tertiary/quaternary structures of the GPI-APs, which affect accessibility to processing enzymes. Examples of primary control include (1) differences in GPI glycan side chains in human versus porcine membrane dipeptidase and brain versus thymocyte rat Thy-1 and (2) differences in glycan side chains and the lipid structure of T. brucei VSG in the bloodstream versus insect life-cycle stages of the parasite. An example of secondary control is the difference in VSG glycan side chains when VSGs with different carboxy-terminal sequences are expressed in the same trypanosome clone. In mammalian cells, some free GPIs (mature and biosynthetic intermediates) are found at the cell surface, although their functional significance remains unknown. On the other hand, several protozoa (particularly trypanosomatids) express high numbers (>107 copies per cell) of free GPIs on their cell surface as metabolic end products. These include the so-called glycoinositol phospholipids (GIPLs) and lipophosphoglycans (LPGs) of Leishmania.'
 'This offers a useful method for producing soluble forms of membrane proteins. For example, the T-cell receptor was rendered soluble after it was expressed in the GPI-anchored form (by the action of bacterial PI-PLC), and not by simply expressing the transmembrane-deleted domain. In addition, purified GPI-APs can be used to coat hydrophobic surface plasmon resonance chips, thus providing a convenient method for orienting and presenting proteins for binding studies. It is clear that purified GPI-APs will spontaneously insert into lipid bilayers. The physiological significance of direct GPI-protein exchange between membranes is still uncertain, particularly because all mammals express potent GPI-PLD activity in serum that can remove the lipid (phosphatidic acid) component of the anchor and, thus, prevent GPI-protein re-insertion. However, the re-insertion property of GPI-APs has been exploited experimentally to “paint” exogenous proteins onto cell surfaces. GPI anchors are essential for life in some, but not all, eukaryotic microbes. In S. cerevisiae, and probably most fungi, the presence of a GPI anchor targets certain mannoproteins for covalent incorporation into the β-glucan layer of the cell wall via a transglycosylation reaction, whereby Man-1 within the GPI-anchor core is transferred to the β-glucan polymer, probably by the actions of Dfg5 and Dcw1. Defects in cell wall biosynthesis are detrimental to yeast and this may be one of the reasons why GPI biosynthesis is essential for this organism. Certain unique phenotypes of C. albicans GPI biosynthetic mutants are strictly associated with a single gene defect, suggestive of highly specific cross-talk of the related GPI biosynthetic step with other cellular pathways. GPI biosynthesis is essential for the bloodstream form of T. brucei, even in tissue culture. This may be due to nutritional stress, given that this parasite uses an essential GPI-anchored transferrin receptor. On the other hand, surprisingly, GPI biosynthesis and/or transfer to protein are not essential for the insect-dwelling forms of T. brucei or L. major. In Arabidopsis thaliana, GPI biosynthesis is required for cell wall synthesis, morphogenesis, and pollen tube development. The availability of GPI-deficient mammalian cell lines shows that GPI-APs are not essential at the cellular level. However, mouse knockouts and tissue-specific conditional knockouts of the PIGA gene clearly show that GPI-APs are essential for early embryo and tissue development. GPI anchors impart to their attached proteins the ability to be shed from the cell surface in soluble form through the action of cellular or serum GPI-cleaving enzymes. Mammalian sperms acquire the ability to fuse with oocytes after GPI-anchored TEX101 and LY6K are released by a sperm-associated GPI-cleaving enzyme tACE (testis form angiotensin converting enzyme). The cleavage of GPI-APs is required for maturation of ADAM3, a metalloprotease on the sperm surface. Certain proliferating motor neurons initiate differentiation after the GPI-anchored proteinase inhibitor, RECK, is released by the GPI-cleaving enzyme, GDE2. This relieves the inhibition of ADAM10 metalloproteinase, allowing it to degrade the Notch-ligand to terminate Notch signaling. Thus, the cell switches from proliferation to differentiation. GPI-anchored CRIPTO acts as a coreceptor for Nodal signaling. Shedding of CRIPTO by a GPI-phospholipase A2, PGAP6, followed by a PLD-like enzyme, regulates Nodal signaling. In “lower” eukaryotes, GPI anchors may be useful for assembling particularly dense cell-surface protein coats, such as the VSG coat of T. brucei. In this case, each parasite expresses five million VSG dimers on the cell surface to protect it against complement-mediated lysis. If each VSG monomer had a single transmembrane domain instead of a GPI anchor, there would be little room for other integral membrane proteins such as hexose and nucleoside transporters. Generally, GPI-APs do recycle through intracellular compartments but, compared to typical transmembrane proteins, they reside in higher proportions on the cell surface and have longer half-lives.'
 'Two processes are involved in these structural changes. First, remodeling from the diacyl-PI to diradyl-PI (mixtures of 1-alkyl-2-acyl-PI and diacyl-PI), having unsaturated fatty acid at the sn-2-position, occurs early in the pathway, within the ER, to produce GlcN-aPI with the remodeled lipid tail. The reaction responsible for this is not known, but alkyl phospholipids synthesized in the peroxisome serve as the alkyl donors. Second, fatty-acid remodeling, involving exchange of the unsaturated sn-2 fatty acid for a saturated fatty acid, mainly stearate (C18:0), occurs after the GPI-APs are transported to the Golgi. The GPI pathway genes were identified principally by expression cloning using GPI-deficient mutants of mammalian cells and temperature-sensitive yeast mutants. More recently, epitope tagging/pull-down/proteomic approaches have been used to identify GPI pathway–associated components. Some basic details of the known mammalian and yeast components and their topologies in the ER membrane are described in Table 12.1. Predicted topologies for the mammalian enzymes are shown in Figure 12.3. The GPI precursor is transferred to proteins via a multisubunit transamidase complex. The reaction involves two complex substrates, the preassembled GPI precursor and the carboxyl terminus of a partially folded nascent protein (Figure 12.4). The carboxy-terminal GPI-addition signal peptide (GPIsp) contains three domains: (1) three relatively small amino acids (Ala, Asn, Asp, Cys, Gly, or Ser) located at ω, ω+1, and ω+2, where ω is the amino acid attached to the GPI anchor and ω+1 and ω+2 are the first two residues of the cleaved peptide; (2) a relatively polar domain of typically five to 10 residues; and (3) a hydrophobic domain typically comprising 15–20 hydrophobic amino acids. These GPIsp sequences have no strict consensus, but are easily identified by eye and by automated algorithms. The final hydrophobic stretch of amino acids often resembles a transmembrane domain, but the absence of positively charged and polar residues immediately downstream makes a GPIsp easy to spot. Like N-glycosylation sequons, a GPIsp will only be functional if the protein is translocated into the ER. Hence, all GPI-APs are synthesized with an amino-terminal ER localization signal peptide as well. (A) Features of glycosylphosphatidylinositol (GPI)-anchored proteins and their processing by GPI transamidase. GPI-anchored proteins have an amino-terminal signal peptide for translocation into the ER and a carboxy-terminal GPI-addition signal peptide (more...) GPIs present microheterogeneity in their glycan side-chains depending on the species, cell types, and proteins (Online Appendix 12B, panels I–IV). A small number of enzymes involved in these reactions in mammals, yeast and T. brucei are known (Online Appendix 12B, panel V). Yeast and some mammalian GPIs possess a fourth α1-2Man (Man-4) residue added by Smp3/PIG-Z during GPI precursor assembly in the ER. Yeast GPI-APs have a fifth αMan (Man-5) residue added in the Golgi. A proportion of mammalian GPI-APs contain Man-1 modified by a β1-4N-acetylgalactosamine (GalNAc), and which may be further modified with a β1-4galactose (Gal), in the Golgi. An α2-3 sialic acid (Sia) could be added to the Gal. In T. brucei bloodstream forms, GPI-APs present glycan side-chains consisting of Gal, whereas the procyclic GPIs carry sialylated poly-N-acetyllactosamine and poly-lacto-N-biose structures. The transport of GPI-APs from the ER to the Golgi is mediated by coat protein II (COPII)-coated transport vesicles.']","The first tentative evidence for the existence of protein-phospholipid anchors appeared in 1963 with the finding that crude bacterial phospholipase C (PLC) selectively releases alkaline phosphatase from mammalian cells. Phosphatidylinositol (PI)-protein anchors were first postulated in the mid-1970s when highly purified bacterial PI-specific PLCs were observed to release proteins, such as alkaline phosphatase and 5′-nucleotidase, from mammalian plasma membranes. By 1985, these predictions were confirmed by compositional and structural data from studies on Torpedo acetylcholinesterase, human and bovine erythrocyte acetylcholinesterase, rat Thy-1, and the sleeping sickness parasite Trypanosoma brucei variant surface glycoprotein (VSG). The first complete GPI structures, which were for T. brucei VSG and rat Thy-1, were solved in 1988.","The first tentative evidence for the existence of protein-phospholipid anchors appeared in 1963 with the finding that crude bacterial phospholipase C (PLC) selectively releases alkaline phosphatase from mammalian cells. Phosphatidylinositol (PI)-protein anchors were first postulated in the mid-1970s when highly purified bacterial PI-specific PLCs were observed to release proteins, such as alkaline phosphatase and 5′-nucleotidase, from mammalian plasma membranes. By 1985, these predictions were confirmed by compositional and structural data from studies on Torpedo acetylcholinesterase, human and bovine erythrocyte acetylcholinesterase, rat Thy-1, and the sleeping sickness parasite Trypanosoma brucei variant surface glycoprotein (VSG). The first complete GPI structures, which were for T. brucei VSG and rat Thy-1, were solved in 1988 (Chapter 1, Figure 1.3). To date, hundreds of GPI-anchored proteins (GPI-APs) have been identified in many eukaryotes, ranging from protozoa and fungi to plants and humans (Online Appendix 12A).",1.0,0.3514784720032974,0.9779454777565286,0.008333333333333333,0.99999999998,1.0
"Complete the following paragraph: Other classes of eukaryotic glycoprotein glycosylation  EGF repeats, also known as EGF domains, are small protein domains (∼40 amino acids) defined by six conserved Cys residues, which form three disulfide bonds (Figure 13.1A). They are found in a few hundred cell-surface and secreted proteins in metazoans and, depending on their sequence, may be modified with O-glycans as described in Table 13.1.","['NCBI Bookshelf. A service of the National Library of Medicine, National Institutes of Health. Varki A, Cummings RD, Esko JD, et al., editors. Essentials of Glycobiology [Internet]. 4th edition. Cold Spring Harbor (NY): Cold Spring Harbor Laboratory Press; 2022.  doi: 10.1101/glycobiology.4e.13 Robert S. Haltiwanger, Lance Wells, Hudson H. Freeze, Hamed Jafar-Nejad, Tetsuya Okajima, and Pamela Stanley. This chapter focuses on less-easily categorized types of glycan linkages that occur on certain proteins or domains. O-linked sugars on epidermal growth factor (EGF)-like repeats (O-fucose, O-glucose, and O-GlcNAc) regulate Notch signaling and the functions of several other proteins. O-Fucosylation of thrombospondin type-1 repeats (TSRs) is required for folding of these domains in a number of secreted matricellular proteins. O-mannosylation of α-dystroglycan is essential for interactions with several extracellular matrix (ECM) proteins. Defects in the glycosyltransferases that add these glycans (O-fucose, O-glucose, O-GlcNAc, and O-mannose) result in human diseases. C-Mannosylation is a unique form of glycosylation in which mannose is linked through a carbon–carbon bond to tryptophan. O-Linked Glc-Gal disaccharides are added to hydroxylysine residues and play an important role in collagen fibril formation. Although the glycans described here are found on relatively few glycoproteins, they play specific and important roles in biology. In glycoproteins, the linkage between the first sugar of a glycan and the protein defines its glycosylation class (Chapter 1, Figure 1.7) including the common GlcNAc-N-Asn, GalNAc-O-Ser/Thr, and Xyl-O-Ser linkages present in glycoproteins and proteoglycans. The novel, nonclassical glycan Glcβ1–3Fucα-O-Thr was first discovered in human urine but garnered little interest at the time. However, finding O-fucose directly linked to various clotting proteins and signaling receptors, such as Notch, sparked considerable interest. Monoclonal antibodies that detect glycans on specific proteins such as α-dystroglycan provided tools to identify other novel glycans. In addition, mass spectrometry revealed unusual protein modifications, such as mannose linked to protein as a C-glycoside. Table 13.1 describes many of the less common linkages synthesized in the endoplasmic reticulum (ER)–Golgi secretory pathway. Chapters 18 and 19 describe the very few known glycosylation linkages synthesized in the nucleus and cytoplasm. Other classes of eukaryotic glycoprotein glycosylation  EGF repeats, also known as EGF domains, are small protein domains (∼40 amino acids) defined by six conserved Cys residues, which form three disulfide bonds (Figure 13.1A). They are found in a few hundred cell-surface and secreted proteins in metazoans and, depending on their sequence, may be modified with O-glycans as described in Table 13.1. Proteins with EGF repeats harboring these O-glycans include several involved in blood clot formation and dissolution, and the Notch family of receptors and canonical Notch ligands (Delta and Serrate/Jagged) involved in cell fate decisions. These glycan modifications are important because they regulate signal transduction during embryonic development and adult organ maintenance, cell differentiation, and the growth of several cancers. Moreover, mutations in several enzymes involved in the addition or elongation of these glycans have been found in human diseases (Chapter 45). Modifications of epidermal growth factor (EGF) repeats. (A) EGF repeats can be modified by O-fucose, O-glucose, and O-GlcNAc.'
 'These glycan modifications are important because they regulate signal transduction during embryonic development and adult organ maintenance, cell differentiation, and the growth of several cancers. Moreover, mutations in several enzymes involved in the addition or elongation of these glycans have been found in human diseases (Chapter 45). Modifications of epidermal growth factor (EGF) repeats. (A) EGF repeats can be modified by O-fucose, O-glucose, and O-GlcNAc. A schematic representation of an EGF repeat is shown: (yellow) conserved Cys residues; (gray lines between the cysteines) disulfide-bonding (more...) The signaling pathway best known to be regulated by O-glycans on EGF repeats is the Notch signaling pathway. Notch was originally identified in Drosophila, and homologs have been found in all metazoans, with four Notch receptors in mammals. Activation of Notch signal transduction is controlled at numerous levels, and dysregulation of Notch signaling results in a number of human diseases, including several types of cancer and a variety of developmental disorders. Two classes of canonical ligands bind to and activate Notch signaling in Drosophila: Delta and Serrate. Mammals have three Delta-like homologs (DLL1, DLL3, and DLL4), and two Serrate homologs called Jagged 1 and 2 (JAG1 and JAG2). These ligands are single-pass transmembrane glycoproteins that bind to and trans-activate Notch receptors on an adjacent cell. Binding of Notch and ligands in the same cell often results in cis-inhibition of the pathway. Work in recent years has shown that the O-glycans on Notch receptors affect both trans-activatory and cis-inhibitory interactions between Notch receptors and their ligands. The extracellular domain of Notch contains up to 36 tandem EGF repeats (Figure 13.2), many of which contain consensus sites for one or more types of O-glycan (Figure 13.1A). Notch EGF repeats can harbor O-fucose, O-GlcNAc and/or O-glucose (Figure 13.2). As discussed below, these sugar modifications regulate various aspects of Notch signal transduction, sometimes in a partially redundant manner and sometimes via distinct mechanisms. Extracellular domain of a generic Notch receptor showing the numerous sites for POFUT1 and POGLUT1 modifications that are evolutionarily conserved in Drosophila Notch, mouse NOTCH1 and NOTCH2, and human NOTCH1 and NOTCH2. Epidermal growth factor (EGF) (more...) The α-linked O-fucose modification immediately precedes the third conserved Cys of certain EGF repeats (Figure 13.1A). The consensus motif for O-fucosylation is C2X4(S/T)C3 (C2 and C3 are the second and third conserved Cys of the EGF repeat). Nearly 100 proteins in mouse or human databases contain this sequence. O-Fucose can be elongated to a tetrasaccharide (Siaα2–3/6Galβ1-4GlcNAcβ1-3Fucα-O-Ser/Thr) in certain contexts (e.g., EGF1 from human clotting factor IX and EGF12 from mouse NOTCH1) (Table 13.1), but not in others (e.g., EGF1 from human clotting factor VII and EGF5 from mouse NOTCH1). Protein O-fucosyltransferase 1 (POFUT1) transfers fucose from GDP-Fuc to a properly folded EGF repeat containing the appropriate consensus sequence (Figure 13.1B). O-Fucose can be elongated by a β1-3 N-acetylglucosaminyltransferase (β3GlcNAcT) specific for O-fucose residues in a properly folded EGF repeat. The gene encoding the O-fucose-EGF β3GlcNAcT was originally identified in Drosophila as a modifier of Notch signaling called fringe. There are three mammalian homologs: Manic fringe (MFNG), Lunatic fringe (LFNG), and Radical fringe (RFNG).'
 'NCBI Bookshelf. A service of the National Library of Medicine, National Institutes of Health. Varki A, Cummings RD, Esko JD, et al., editors. Essentials of Glycobiology [Internet]. 4th edition. Cold Spring Harbor (NY): Cold Spring Harbor Laboratory Press; 2022.  doi: 10.1101/glycobiology.4e.4 Karen J. Colley, Ajit Varki, Robert S. Haltiwanger, and Taroh Kinoshita. This chapter provides an overview of glycosylation from the perspective of a single cell, taking into account the patterns of expression, topology, and other features of the biosynthetic and degradative enzymes that are common to most cell types. The focus is mostly on the organization of glycosylation in eukaryotic cells. Chapters 21 and 22 further address prokaryotic glycosylation mechanisms. After more than three billion years of evolution, every free-living cell and every cell type within eukaryotic organisms remains covered with a dense and complex layer of glycans (Chapter 20). Even enveloped viruses that bud from infected cells carry with them the glycosylation patterns of the host. Additionally, most secreted molecules are glycosylated and extracellular matrices of multicellular organisms are rich in glycans and glycoconjugates. Matrices secreted by unicellular organisms when they congregate (e.g., bacterial biofilms [Chapter 21]) also contain glycans. Thus, evolution has repeatedly and consistently selected glycans as being the most diverse and flexible molecules to position at the interface between cells and the extracellular milieu. Possible reasons include their relative hydrophilicity, flexibility, and mobility in aqueous environments and their extreme diversity, allowing facile short-term and long-term adaptations to changing environments and pathogen regimes. In bacteria, Archaea, and fungi, glycans serve critical structural roles in the cell wall and in resisting large differences in osmolarity between cytoplasm and environment. In eukaryotes, both secretory proteins and membrane proteins typically pass through an endoplasmic reticulum (ER)–Golgi pathway, the cellular system in which many major glycosylation reactions occur (see below). Most proteins in the blood plasma of animals (with the exception of albumin) are also heavily glycosylated, and the glycosylation of these and other secreted proteins may provide solubility, hydrophilicity, and negative charge, thus reducing unwanted intermolecular interactions and protecting against proteolysis. Cell-surface membrane proteins like receptors, adhesion molecules, and channels are typically glycosylated, and this modification can promote their proper folding, ensure their stability, and impact function. The classic work of George Palade indicated that most cell-surface and secreted proteins in eukaryotic cells are cotranslationally translocated into the ER where they are folded, modified, and subjected to quality control mechanisms. They then make their way via an intermediate compartment (IC) through multiple stacks of the Golgi apparatus, finally being distributed to various destinations from the trans-Golgi network (TGN). Secretory pathway proteins can be N-glycosylated, O-glycosylated, and/or modified with glycosylphosphatidylinositol (GPI) anchors, and some called proteoglycans are modified with attached glycosaminoglycan chains. The enzymes involved in each of these modification pathways are distinct. N-linked glycans and GPI anchors are preassembled before being transferred to proteins and then further modified in the ER–Golgi pathway. The stepwise assembly of O-linked glycans and glycosaminoglycans, as well as the glycosylation of lipids, involve reactions in both the ER and Golgi (Chapters 9–13 and 17). Figure 4.1 superficially depicts some steps in the synthesis of the major glycan classes in the ER–Golgi pathway of animal cells. Initiation and maturation of the major types of eukaryotic glycoconjugates in relation to subcellular trafficking in the ER–Golgi–plasma membrane pathway.'
 'The enzyme that catalyzes the addition of O-GlcNAc to EGF repeats (EOGT) is located in the endoplasmic reticulum (ER) and is closely related to the enzymes that catalyze mucin-like glycosylation, but not the O-GlcNAc transferase (OGT; catalyzes the addition of O-GlcNAc). Unlike intracellular O-GlcNAcylation, modification of EGF repeats by O-GlcNAc is static and can be extended by the addition of galactose. Recent studies show that O-GlcNAc is found on thousands of nuclear, mitochondrial, and cytoplasmic proteins, including many heavily studied proteins such as RNA polymerase II, histones, and ribosomal proteins (Figure 19.2; Table 19.1). Yet, although phosphorylation was discovered in 1954, O-GlcNAc was not discovered until 1983. So why did O-GlcNAc remain undetected for so long? First, the long-standing dogma was that glycosylation (other than glycogen storage) did not occur with the nucleocytosolic compartment. Second, unlike charged modifications (e.g., phosphate), addition and removal of O-GlcNAc generally does not affect the migration of polypeptides on SDS-PAGE (sodium dodecyl sulfate polyacrylamide gel electrophoresis). A small shift in protein migration might be seen if the O-GlcNAc residues are highly clustered or if the protein is extensively O-GlcNAcylated at multiple sites (e.g., p62 nuclear pore protein). Third, all cells contain high levels of hydrolases, including abundant lysosomal hexosaminidases and nucleocytoplasmic β-N-acetylglucosaminidases, that rapidly remove O-GlcNAc from intracellular proteins when the cell is damaged or lysed. Thus, O-GlcNAc is often lost during the isolation of a protein. Finally, O-GlcNAc is particularly difficult to detect by physical techniques, such as mass spectrometry, because it often occurs at substoichiometric amounts on a protein and is readily lost during the ionization process in a mass spectrometer. In both electrospray ionization (ESI) mass spectrometry and matrix-assisted laser desorption time of flight (MALDI-TOF) mass spectrometry analyses of a mixture of unmodified and O-GlcNAc-modified peptides, not only is the O-GlcNAc lost during ionization but the signal from the O-GlcNAc-modified peptides that remain is suppressed by the presence of the unmodified peptide. Our ability to detect O-GlcNAc has been improved in recent years by the development of monoclonal antibodies, lectins and mutant glycoside hydrolases that bind O-GlcNAc, the use of “click chemistry” compatible sugars (Chapters 51 and 56), and the invention of more sophisticated mass spectrometric techniques, such as electron transfer dissociation (ETD) mass spectrometry. In mammals, the dynamic cycling of O-GlcNAc on proteins is regulated by the concerted actions of enzymes encoded by just two genes: OGT and a neutral β-hexosaminidase known as O-GlcNAcase (OGA) (Figure 19.1). The regulation of the transcription start site and alternative splicing results in the synthesis of at least three isoforms of OGT and two isoforms of OGA. Nonetheless, the question remains: “How can so few enzymes specifically glycosylate and deglycosylate so many substrates?” Although both OGT and OGA each have only a single catalytic subunit, they actually exist within the cell as a multitude of different holoenzymes in which their catalytic subunits are noncovalently bound to a myriad of accessory proteins that appear to control their targeting (Figure 19.3). In addition, both OGT and OGA are modified by both tyrosine and serine/threonine phosphorylation, nitrosylation, ubiquitination, and O-GlcNAcylation. Functions for some of these posttranslational modifications have been identified, including substrate targeting, altering protein localization, and altering specific activity.'
 'Because prokaryotic cells do not have an ER–Golgi pathway, they typically generate their cell-surface glycans at the interface of the cytoplasmic membrane and the cytoplasm or in the periplasm (see below). Other glycoconjugates like hyaluronan in vertebrate cells, chitin in invertebrate cells, and cellulose in plant cells are synthesized on the cytoplasmic face of the plasma membrane and simultaneously extruded across the membrane to the outside (Chapters 16, 24, and 26). The enzymes involved in the synthesis of these glycoconjugates appear to mediate this extrusion. Typical eukaryotic Golgi glycosylation enzymes have also been found at the cell surface or as soluble forms in the extracellular space, as described below. Whether these glycosyltransferases would routinely have adequate supplies of nucleotide sugar donors to modify cell-surface glycans is unclear, but at least one example has been documented (see below). On the other hand, there are examples of remodeling of cell-surface glycans in animal cells—for example, the endosulfatases (Sulf enzymes) that modify heparan sulfate glycosaminoglycan (Chapter 17) and endogenous sialidases that remove cell-surface sialic acids (Chapter 15). Some protozoan parasites, such as trypanosomes, transfer sialic acids from host glycoconjugates to their cell-surface glycans using trans-sialidases (Chapter 43). Prokaryotic assembly pathways of polysaccharides and oligosaccharides are very similar to pathways found in the ER and the plasma membrane of eukaryotes. They are assembled in the cytoplasm and then translocated across the plasma membrane. For many biosynthetic pathways, such as O-antigen biosynthesis in Gram-negative bacteria, N-linked protein glycosylation in Archaea, and some Gram-negative bacteria or S-layer biosynthesis in Gram-positive bacteria, oligosaccharides are assembled on lipid carriers at the inner site of the plasma membrane and then flipped to the periplasmic site (Chapters 21 and 22). Synthesis of oligosaccharides can continue in the periplasm, but for these reactions, isoprenoid-linked monosaccharides serve as activated substrates as is the case in cell wall biogenesis of actinobacteria (mycobacteria) (Chapter 21). Much effort has gone into understanding the mechanisms of glycosylation and glycan modification within the ER and the Golgi apparatus, and it is clear that a variety of interacting and competing factors determine the final outcome of the reactions. The glycosyltransferases and processing glycosidases are well-studied (Chapter 6), and their location has helped to define various functional compartments of the ER–Golgi pathway. Despite lack of sequence homology among different glycosyltransferase families, most Golgi enzymes share some features. Early studies of vertebrate glycosyltransferases found some of these activities in soluble form in secretions and body fluids; others were identified as membrane-bound activities within cells, and some showed both properties. Subsequent molecular cloning defined the sequences of Golgi glycosyltransferases, revealing that they share a common topology and domain structure that can account for these observations. The majority of Golgi glycosylation enzymes are type II membrane proteins consisting of three parts: an amino-terminal cytoplasmic tail, followed by a transmembrane (TM) region that also acts as an uncleavable signal sequence, and a large carboxy-terminal region containing a membrane-proximal, proteolytically sensitive stem region as well as a large catalytic domain. The type II topology of these Golgi enzymes places their catalytic sequences in the Golgi lumen, where they participate in the synthesis of the glycan chains on proteins and lipids during their transit through the secretory pathway (Figure 4.2). Topology and localization of Golgi glycosylation enzymes. Golgi glycosyltransferases and glycosidases are type II membrane proteins with their catalytic sequences facing the lumen of the Golgi.']","In glycoproteins, the linkage between the first sugar of a glycan and the protein defines its glycosylation class, including common GlcNAc-N-Asn, GalNAc-O-Ser/Thr, and Xyl-O-Ser linkages present in glycoproteins and proteoglycans. The novel, nonclassical glycan Glcβ1–3Fucα-O-Thr was first discovered in human urine but garnered little interest at the time. However, finding O-fucose directly linked to various clotting proteins and signaling receptors, such as Notch, sparked considerable interest. Monoclonal antibodies that detect glycans on specific proteins such as α-dystroglycan provided tools to identify other novel glycans. In addition, mass spectrometry revealed unusual protein modifications, such as mannose linked to protein as a C-glycoside.","Proteins with EGF repeats harboring these O-glycans include several involved in blood clot formation and dissolution, and the Notch family of receptors and canonical Notch ligands (Delta and Serrate/Jagged) involved in cell fate decisions. These glycan modifications are important because they regulate signal transduction during embryonic development and adult organ maintenance, cell differentiation, and the growth of several cancers. Moreover, mutations in several enzymes involved in the addition or elongation of these glycans have been found in human diseases (Chapter 45).",1.0,0.3339930283562787,0.6217850926705659,0.00819672131147541,0.999999999975,1.0
"Complete the following paragraph: Blood banks perform typing and cross-matching assays. First, units of erythrocyte products typed for the A and B antigens are chosen to match the patient's ABO type. To ensure that these are truly “compatible,” the patient's serum is cross-matched by mixing with a small aliquot of each prospective erythrocyte unit. Erythrocytes of compatible units do not agglutinate (form an erythrocyte clump), whereas incompatibility is indicated by agglutinated erythrocytes formed by antibodies in the patient's serum.","[""Humans with an inactive FUT2 gene do not express soluble forms of the A, B, or H determinants in saliva or milk oligosaccharides or in other tissues and are termed “nonsecretors.” Serology is used to characterize erythrocytes for transfusion and has identified variants of the A and B blood group determinants that typically yield weak reactivity with blood typing reagents. Interestingly, plant lectins were used historically to aid in typing blood. For example, the lectin from Dolichos biflorus agglutinates erythrocytes from most blood group A individuals (termed A1 individuals), but it does not agglutinate erythrocytes from individuals of the A2 subgroup, and it is still used currently to distinguish individuals with these two different blood types. The A1 and A2 subgroup antigens are distinct (Figure 14.5) reflecting the different A transferases encoded by the A1 versus A2 allele at the ABO locus. Heritable erythrocyte antigenic polymorphisms determined by the ABO locus have important medical implications. Early in the postnatal period, the immune system generates IgM antibodies against ABO antigen(s), even though they are absent from erythrocytes. This is because glycan antigens similar or identical to the A and B blood group determinants are carried by colonizing bacteria and fungi. Thus, type-O individuals do not synthesize A or B determinants but show relatively high titers of circulating IgM antibodies (termed isoagglutinins) against A and B blood group determinants. Similarly, blood group B individuals show circulating IgM anti-A isoagglutinins, but they do not make isoagglutinins against the blood group B determinant, a “self” antigen. Conversely, serum from blood group A individuals contains anti-B but not anti-A antibodies. Finally, people with the AB blood group do not make either anti-A or anti-B IgM isoagglutinins, because both are “self” antigens. Anti-H(O) antibodies are not made in most people because a substantial fraction are converted to A or B determinants or they are a “self” antigen. IgM isoagglutinins efficiently trigger the complement cascade and circulate in human plasma at titers sufficient to cause complement-dependent lysis of transfused erythrocytes that display the corresponding blood group antigens. Such rapid erythrocyte lysis causes an immediate, acute transfusion reaction, which can lead to hypotension, shock, acute renal failure, and death from circulatory collapse. This problem is avoided by ensuring that the ABO type of transfused erythrocytes is compatible with the recipient's ABO type. Thus, an A recipient may receive erythrocytes from A or O persons but not from a person of type B or AB. Blood banks perform typing and cross-matching assays. First, units of erythrocyte products typed for the A and B antigens are chosen to match the patient's ABO type. To ensure that these are truly “compatible,” the patient's serum is cross-matched by mixing with a small aliquot of each prospective erythrocyte unit. Erythrocytes of compatible units do not agglutinate (form an erythrocyte clump), whereas incompatibility is indicated by agglutinated erythrocytes formed by antibodies in the patient's serum. Blood typing is used to ensure compatibility not only for red blood cell transfusions but also for transfusion with platelets and plasma. Similar ABO compatibility concerns are important in heart, kidney, liver, and bone marrow transplantation procedures. The “type and cross” procedures have virtually eliminated ABO blood group transfusion reactions in the developed world. Attempts are being made to enzymatically modify A or B erythrocytes using glycosidases to remove GalNAc (A) and/or Gal (B), in order to convert them to “O”, the “universal donor” type. The few individuals with AB type are “universal acceptors.” In addition to accurately typing AB blood types, A1 and A2 blood group distinctions are important clinically as A2 individuals can generate anti-A1 antibodies, although these antibodies are often not clinically meaningful.""
 'Attempts are being made to enzymatically modify A or B erythrocytes using glycosidases to remove GalNAc (A) and/or Gal (B), in order to convert them to “O”, the “universal donor” type. The few individuals with AB type are “universal acceptors.” In addition to accurately typing AB blood types, A1 and A2 blood group distinctions are important clinically as A2 individuals can generate anti-A1 antibodies, although these antibodies are often not clinically meaningful. Furthermore, when crossing ABO(H) barriers during solid organ transplantation, A2 donor organs have better overall survival when compared to A1 following transplantation into a blood group O or B recipient; this is presumably because of the lower expression of the A antigen in A2 individuals. In addition to transfusion and transplantation, ABO(H) alloantigens are some of the most frequent allogeneic barriers crossed during fetal development. IgG anti-A,B antibodies present in blood group O mothers, which react with the A and B antigen, can cross the placenta and engage A or B antigens on the surface of fetal red blood cells (RBCs). However, unlike IgG antibodies against other alloantigens, such as RhD, IgG anti-A,B antibodies rarely cause life-threatening anemia in a fetus or neonate, presumably because of the relatively low level of A and B antigen expression present on fetal RBCs. However, despite the lower level of A and B expression on fetal RBCs, anti-A and anti-B antibodies present in maternal circulation can rapidly remove A or B positive fetal RBCs following exposure during parturition, reducing the probability of alloimmunization to other alloantigens. This was the first example of antibody-mediated immunosuppression clinically and formed the basis of highly successful anti-RhD formularies designed to prevent Rh alloimmunization and therefore hemolytic disease of the fetus and newborn. Cross-matching procedures helped to identify a rare ABO blood group phenotype termed the Bombay phenotype, so named because the first identified individual lived in that city (now Mumbai). Affected persons have erythrocytes and tissue cells lacking A, B, and H determinants because they have inactive FUT1 and FUT2 genes, and therefore no α1-2FucT enzyme. Bombay sera contain IgM antibodies that react with erythrocytes from virtually all donors, including O erythrocytes (H antigen-positive, A and B antigen-negative). They show robust titers of anti-H, anti-A, and anti-B IgM antibodies and cannot receive erythrocytes from any donor except those of the same Bombay blood type. A related phenotype, termed para-Bombay, occurs in people with an inactive FUT1 gene, but at least one functional Se (FUT2) allele (secretor-positive). The fact that Bombay individuals appear generally healthy implies that developmental or physiological functions for the A, B, and H antigens, if they ever existed, are no longer relevant. However, a variety of associations have been made between the ABO blood group phenotype and relative risk for infection by some pathogens and the acquisition of a spectrum of diseases. For example, people with blood group O who are also Lewis-antigen positive (see below) are the most susceptible to infection by Helicobacter pylori. This is because H. pylori binds well to glycans with terminal Fuc, such as the H and Lewis antigens. The AB blood group is associated with infection by Brucella (Brucellosis) and noroviruses that cause gastroenteritis, while blood group O individuals appear to be at an increased risk for cholera. Levels of von Willebrand factor (VWF) correlate with ABO(H) blood group inheritance, with blood group A individuals on average having the highest VWF levels. Differences in VWF among individuals of different blood group status may in part account for associations observed between blood group A individuals and the likelihood of thromboembolic events and other forms of cardiovascular disease. Blood group status has also been associated with risk of stomach and pancreatic cancers. ABO status may also be protective. Thus, enveloped viruses carry the ABO(H) glycans of their hosts and are susceptible to lysis following infection of another individual with an ABO-incompatible type. Finally, differences in susceptibility to severe complications of malaria appear to be affected by ABO blood groups.'
 'Normally, colonic mucosal proteins display heavily O-acetylated sialic acids, but these acetyl groups are diminished in ulcerative colitis. Whether this contributes to the pathology is unknown, but O-acetylated sialic acids are more resistant to bacterial sialidases (Chapter 15). Decreased sialic acid O-acetylation is also a feature of colon carcinomas. Heparin (a highly sulfated form of HS; Chapter 17) is a therapeutic agent extracted from porcine intestines or bovine lungs. It is a fast-acting and potent anticoagulant often used to avoid thrombosis, in procedures including dialysis and open-heart surgery. Its effectiveness relies on a specific sulfated heparin pentasaccharide that binds circulating antithrombin III and markedly enhances its ability to inactivate coagulation Factors Xa and IIa (thrombin) (Chapter 17). Animal-derived “unfractionated heparin” is now often replaced with low-molecular-weight heparins because they have fewer complications. One explanation is that the unfractionated heparin effects on thrombin require a long chain that interacts both with the antithrombin and with thrombin itself in a tripartite complex. In contrast, the shorter chains found in low-molecular-weight heparins only facilitate antithrombin inactivation of Factor Xa. Thus, low-molecular-weight heparins affect Xa but not thrombin activity. A synthetic pentasaccharide (fondaparinux) that binds and facilitates antithrombin inactivation of Factor Xa is an alternative to heparin. Although these improvements are valuable, unfractionated heparin has a variety of other biological effects besides anticoagulation. Thus, other beneficial effects of heparin, such as the blocking of P- and L-selectin, are reduced or even eliminated by the switch to low-molecular-weight heparins and the synthetic pentasaccharide. An uncommon but feared complication of heparin treatment is heparin-induced thrombocytopenia (HIT). During HIT, complexes between heparin and platelet factor-4 form, and the de novo formed pathogenic antibodies against these complexes deposit on platelets, causing their aggregation and loss from circulation. Paradoxically, this process results in exaggerated thrombosis, rather than bleeding. The incidence of this complication is lower with low-molecular-weight heparins and significantly curtailed with the use of the pure pentasaccharide. Sickle cell anemia is an inherited disorder of hemoglobin that leads to various acute and chronic painful complications. Symptoms were thought to be caused by vaso-occlusion due to abnormally shaped and/or membrane-modified hypoxic erythrocytes. Now, it is clear that abnormal adhesion of multiple cell types is responsible, and that this is partially mediated by selectins. Blocking selectin action with analogs of natural ligands such as sLex or heparin can restore blood flow in a mouse model of sickle cell disease. A pan-selectin inhibitor (GMI-1070, “rivipansel”) has undergone clinical trials for reduction of severity and duration of sickle cell crisis. Notably, glycopeptide mimetics of PSGL-1 and antibodies that block PSGL-1-P-selectin interactions (e.g., FDA-approved crizanlizumab) can mitigate sickle cell vaso-occlusive crises. Blood transfusion medicine first identified the ABO blood group system, defined by differential expression of α-GalNAc and α-Gal transferases across populations (Chapter 14). These and other less prominent glycan antigens can cause hemolytic transfusion and rejection reactions, mostly because of errors in blood typing. Although anti-A and anti-B titers likely influence transfusion and transplantation outcomes, simple assessment of antibody levels fails to fully account for the clinical impact(s) of an ABO(H) incompatible transfusion. Efforts to generate “universal donor” red blood cells, via enzymatic conversion of blood group A and B antigens to the O state using bacterial enzymes, are underway.'
 'Synthesis of H (O), A, and B blood group determinants. For details, see text. LN designates N-acetyllactosamine unit.  A or B blood group determinants are subsequently formed from H Type-1, -2, -3, or -4 determinants by glycosyltransferases encoded by the ABO locus. The A allele encodes the α1-3GalNAcT (A3GALNT) that generates the A glycan epitope forming the A blood group (Figure 14.5). The B allele of the ABO locus encodes the α1-3GalT (A3GALT1) that forms the B glycan determinant and generates the B blood group (Figure 14.5). O alleles at the ABO locus encode a functionally inactive A/B glycosyltransferase. Individuals who synthesize exclusively A determinants are blood group A and have the genotype AA or AO, blood group B individuals are BB or BO, and individuals that express one A and one B allele have the genotype AB. Blood group O individuals expressing inactive A/B glycosyltransferase have the genotype OO. They express only the H antigen. Blood type designations are the same as the blood group genotypes above. In terms of nomenclature, the O blood group includes the H antigen and occasionally the term ABO(H) is used. Additional variants of α1-3GalNAcT and α1-3GalT exist that are enzymatically active, but at a much lower level. These variants are largely responsible for individuals who are initially typed as blood group O, but actually express very low levels of the A or B blood group antigen. The ABO antigens are expressed on membrane glycoproteins and glycolipids on the surface of erythrocytes and many epithelial or endothelial cells in tissues. Some tissues also synthesize soluble forms on secreted glycoproteins, glycolipids, and free glycans. As discussed below, the ability to secrete soluble molecules carrying ABO(H) blood group antigens is a genetically determined function of alleles at the Se (FUT2) locus. On each human red blood cell, ∼80% of the 1–2 million ABO(H) determinants are attached to the anion transport protein Band 3, and ∼15% are carried by the erythrocyte glucose transport protein Band 4.5. Both of these integral membrane proteins carry ABO(H) antigens on a single, branched N-glycan with poly-LacNAc. Each erythrocyte has other glycoproteins and approximately half a million glycolipids with ABO(H) determinants. Many of these glycolipids have A, B, and H determinants on poly-LacNAc chains and have been termed polyglycosylceramides or macroglycolipids. A, B, and H determinants based on Type-4 chains (Figure 14.4) are also present in human erythrocyte glycolipids. A, B, and H determinants of the epidermis are primarily on Type-2 units, whereas mucins of the gastric mucosa and in ovarian cyst fluid carry A, B, and H antigens on Type-3 units (Figure 14.4). Epithelial cells lining the digestive, respiratory, urinary, and reproductive tracts, and epithelia of some salivary and exocrine glands, synthesize soluble forms of the ABO(H) determinants, largely carried on Type-1 units (Figure 14.4). Expression of the A, B, and H determinants in secretory tissues is a function of the α1-2FucT encoded by the Se gene (FUT2), because the H gene (FUT1) is not expressed there. Humans with an inactive FUT2 gene do not express soluble forms of the A, B, or H determinants in saliva or milk oligosaccharides or in other tissues and are termed “nonsecretors.” Serology is used to characterize erythrocytes for transfusion and has identified variants of the A and B blood group determinants that typically yield weak reactivity with blood typing reagents. Interestingly, plant lectins were used historically to aid in typing blood.'
 'The resulting glycomimetic had E-selectin binding affinity comparable to sialyl-Lewis x. Glycomimetic E-selectin inhibitors based on sialyl-Lewis x.  GMI-1070, targeting E-, P-, and L-selectin, yielded unconvincing results in Phase 3 clinical trials as a treatment for sickle cell crisis and is under further investigation. A variety of glycans, including the classical A and B blood group determinants, can act as barriers to blood transfusion and transplantation of organs (Chapters 13 and 46). Rejection of mismatched blood or organs occurs because hosts have a high titer of preexisting antibodies against the glycan epitopes, presumably as a prior reaction to related structures found on bacteria or other microbes. In the case of the ABO blood groups, incompatibility is routinely managed by blood and tissue typing and finding an appropriate donor for the recipient. Bacterial enzymes can be used in vitro to remove the A and B blood group determinants from A and B red cells, converting them into “universal donor” O red cells. A related problem is found in xenotransplantation (i.e., the transplantation of organs between species), which is actively being pursued as a solution for the shortage of human organs for patients. The animal donors of preference are pigs, because many porcine organs resemble those of humans in size, physiology, and anatomy. However, unlike humans and certain other primates, pigs and most other mammals produce the terminal “α-Gal” epitope on glycoproteins and glycolipids. Because humans have naturally occurring high-titer antibodies in blood directed toward this epitope, this results in hyperacute rejection of porcine organ transplants, via reaction of the antibodies with endothelial cells of blood vessels. Attempts to prevent this reaction, include blood filtration over glycan affinity columns to remove xenoreactive antibodies and blockade of the interaction by infusing soluble competing oligosaccharides. Transgenic pigs lacking the reactive epitope have also been produced, as have animals with an excess of complement-controlling proteins on their cell surfaces. Pig organs also have high levels of the nonhuman sialic acid (Neu5Gc), against which most humans have antibodies. Even if this problem is solved, there are other glycan and protein structural differences between humans and pigs that cause later stages of graft rejection, thus necessitating immunosuppression. The authors acknowledge helpful comments and suggestions from Morten Thaysen-Andersen.']","Incompatibility is indicated by agglutinated erythrocytes formed by antibodies in the patient's serum. Blood typing is used to ensure compatibility not only for red blood cell transfusions but also for transfusion with platelets and plasma. Similar ABO compatibility concerns are important in heart, kidney, liver, and bone marrow transplantation procedures.","Blood typing is used to ensure compatibility not only for red blood cell transfusions but also for transfusion with platelets and plasma. Similar ABO compatibility concerns are important in heart, kidney, liver, and bone marrow transplantation procedures. The “type and cross” procedures have virtually eliminated ABO blood group transfusion reactions in the developed world. Attempts are being made to enzymatically modify A or B erythrocytes using glycosidases to remove GalNAc (A) and/or Gal (B), in order to convert them to “O”, the “universal donor” type. The few individuals with AB type are “universal acceptors.” In addition to accurately typing AB blood types, A1 and A2 blood group distinctions are important clinically as A2 individuals can generate anti-A1 antibodies, although these antibodies are often not clinically meaningful. Furthermore, when crossing ABO(H) barriers during solid organ transplantation, A2 donor organs have better overall survival when compared to A1 following transplantation into a blood group O or B recipient; this is presumably because of the lower expression of the A antigen in A2 individuals.",1.0,0.5897692937817176,0.793631561104839,0.008130081300813009,0.99999999998,1.0
"Complete the following paragraph: Given their high density and widespread location on vertebrate cells, Sias also exert many functions via electronegative charge, such as repulsion of cell–cell interactions, protein stabilization, ion binding, and ion transport. Early nomenclature of these molecules was tied to their discovery, being first isolated by Gunnar Blix from salivary mucins in 1936 and independently by Ernst Klenk from brain glycolipids in 1941. Blix named his substance “sialic acid” after the Greek word for saliva (σíαλoν), and Klenk named his “neuraminic acid” for neurons in the brain. By the time the relationship of these substances became evident, both names were already in use and have persisted.","['NCBI Bookshelf. A service of the National Library of Medicine, National Institutes of Health. Varki A, Cummings RD, Esko JD, et al., editors. Essentials of Glycobiology [Internet]. 4th edition. Cold Spring Harbor (NY): Cold Spring Harbor Laboratory Press; 2022.  doi: 10.1101/glycobiology.4e.15 Amanda L. Lewis, Xi Chen, Ronald L. Schnaar, and Ajit Varki. Sialic acids (Sias) are abundant on vertebrate glycoproteins, glycolipids, and milk oligosaccharides, as well as on some microbial surface glycans, mediating diverse functional roles. Originally discovered within the Deuterostome lineage of animals and associated microbes, they are actually a subset of a more ancient family of α-keto acid monosaccharides with a 9-carbon backbone called nonulosonic acids (NulOs), which are also found in some Eubacteria and Archaea. Biosynthesis of all NulO-glycans requires the activation of NulO to a CMP-sugar, before the NulO is transferred to glycan acceptors. NulOs are remarkable for the number and the type of functional groups on one monosaccharide. Further complexity arises from various epimers, modifications, and diverse linkages to other glycans, making these molecules well-suited to carry information for glycan–protein, cell–cell, and pathogen–host recognition. NulOs are among the most rapidly evolving classes of monosaccharides in nature and exist in tremendous variety, particularly in the microbial world. Given their high density and widespread location on vertebrate cells, Sias also exert many functions via electronegative charge, such as repulsion of cell–cell interactions, protein stabilization, ion binding, and ion transport. Early nomenclature of these molecules was tied to their discovery, being first isolated by Gunnar Blix from salivary mucins in 1936 and independently by Ernst Klenk from brain glycolipids in 1941. Blix named his substance “sialic acid” after the Greek word for saliva (σíαλoν), and Klenk named his “neuraminic acid” for neurons in the brain. By the time the relationship of these substances became evident, both names were already in use and have persisted. Although 5-N-acetylneuraminic acid (Neu5Ac, sometimes called “NANA”) is the most common sialic acid (Sia) in humans, the Sia family is comprised of related structures (Figure 15.1) that vary at the C-5 carbon, including 5-N-glycolylneuraminic acid (Neu5Gc) and 3-deoxy-D-glycero-D-galacto-non-2-ulosonic acid (also known as 3-deoxy-nonulosonic acid, 2-keto-3-deoxy-nononic acid, or Kdn) with a hydroxyl group at C-5. Similar 9-carbon backbone 2-keto acid monosaccharides were later discovered in some bacterial lipopolysaccharides and initially called “bacterial sialic acids.” The resulting confusion was resolved by suggesting that the term “sialic acid” (Sia) be limited to its original use in describing neuraminic acid (Neu), Kdn, and their derivatives in deuterostomes and their pathogens, and that the term “nonulosonic acid” (NulO) be used to encompass the entire group of 9-carbon backbone non-2-ulosonic acids (Figure 15.1). Base structures representing the larger family of NulO molecules are shown in Figure 15.1 for comparison. This chapter will largely deal with the biology, metabolism, and functions of Sias in mammals. The evolution, distribution, and functions of the larger family of NulOs are briefly described toward the end of this chapter. Sialic acids (Sias) and other nonulosonic acids (NulOs). As shown in the figure, Sias are a subset of NulOs.'
 'Use of α2-3 or α2-8-specific sialidases can provide some insight on Sia linkages as well. Sia-glycosides are also more susceptible to acid hydrolysis than most other sugars, being released using 0.1 m HCl or even with weak acids like 2 m acetic acid or propionic acid at 80°C (albeit still with some loss or migration of labile modifications). This allows selective release of Sias from complex glycans for subsequent analysis by chromatographic methods. Free Sias react with 1,2-diamino-4,5-methylenedioxybenzene (DMB) to generate fluorescent compounds amenable to qualitative and quantitative high-pressure liquid chromatography. There are still some major limitations to methods available for Sia analysis. For example, some mass spectrometric methods result in selective loss of Sias before mass detection. Some Sia-linkages are partly or completely resistant to sialidases and some are even relatively resistant to acid release. In terms of identifying Sia modifications, the most accurate analysis requires complete release and purification with the modifications intact. The stability of each modification to analytical conditions must be considered—for example, O-acetyl groups are labile to common methods that use alkaline conditions (permethylation and beta-elimination). Sia-binding lectins are also useful for detecting sialoglycans and their linkages in situ and on isolated sialoglycans. Sambucus nigra (elderberry) lectin binds selectively to α2-6-linked Sias and Maackia amurensis lectins bind selectively to α2-3-linked Sias. Because plants do not express Sias, these lectins may perhaps deter animal ingestion. Alternatively, the natural ligands of these lectins may not be Sias. Improved probes are now being developed, taking advantage of the fact that many microbes have spent millions of years optimizing their binding to vertebrate sialomes (e.g., the B subunits of various toxins). An interesting tool for detecting a specific Sia modification is the hemagglutinin of influenza C or bovine coronavirus, which bind specifically to 9-O-acetyl Sias on isolated sialoglycans, cells, and tissues, if the esterase function is inactivated. Sias are endowed with a rich diversity of chemical modalities within a single monosaccharide, which evolution uses to modulate the biophysical environment, to mask underlying glycans, and for specific recognition by complementary Sia-binding proteins that mediate biological processes. These functions are not mutually exclusive—for example, highly sialylated molecules with major biophysical roles (such as mucins) may also express specific sialoglycans that serve as ligands in recognition processes. For simplicity, different roles of Sias are addressed separately below. Mucins are heavily glycosylated O-GalNAc-modified sialoglycoproteins secreted or membrane-bound at epithelial surfaces in airways and in the gastrointestinal and urogenital tracts of animals (Chapter 10). Mucins can be remarkably large (several in the range of 5 to >20 MDa). Their dense anionic charge and their propensity to bind water make them efficient as a hydrating and protective barrier at tissue surfaces in contact with the environment. On mucins, as well as other glycoproteins, closely spaced O-GalNAc-linked sialoglycans generate extended polypeptide configurations that would collapse without glycosylation. Clustered sialoglycans along the polypeptide chain can also protect the underlying protein from proteases. Membrane-bound sialoglycans on glycoproteins and glycolipids, which are often quite dense, provide cell surface anionic charge that acts as a barrier and regulates cell surface functions. An extreme example of these biophysical effects is polySia, whose functional impacts are detailed above. Given Sia abundance on cell surfaces (see Figure 15.3), it is not surprising that numerous animal pathogens evolved to target these molecules. Indeed, highly specific Sia-binding proteins were first discovered on human pathogens and their toxins. In the search for host cell receptors for influenza viruses, it was discovered that isolated viruses cross-linked red blood cells, resulting in hemagglutination.'
 ""A useful conceptualization of the sialome is as a “forest canopy” of the cell-surface glycan “forest” (the whole glycome) (Figure 15.3). At the outermost level are different Sia structures (leaves and flowers), which are in glycosidic linkage to underlying linear and branched oligosaccharides (stems and branches) (see Figures 15.2 and 15.3), which in turn are components of glycoproteins and glycolipids (the tree trunks). At the cell surface, glycolipids and glycoproteins organize into lateral domains (forests). Just as the forest varies greatly from place to place, the sialome varies among cell types and among domains on a given cell surface, variations that serve specific functions. As with the glycome, each cell type in each species expresses its own distinct sialome. For example, although mammalian liver sialoglycans are most abundant on glycoproteins, brain sialoglycans are much more abundant as sialoglycolipids (Chapter 11), so much so that they are termed “gangliosides” for the nerve ganglia on which they were discovered. The sialome also varies markedly in response to environmental cues. Sias can also exist as internally linked structures rather than on termini of glycans. In vertebrates, the terminal Sia of a glycan chain is rarely extended further, except with another Sia (Figure 15.3). Among bacteria, Sias and the related NulOs can also be found in diverse cellular structures, including capsular polysaccharides, lipopolysaccharide O-antigens or as part of flagella, pili, or structures such as the cell wall or S-layer (Chapter 21). Bacteria with close relationships to vertebrate hosts often mimic the terminal placement of Sias on capsules and O-antigens. However, many NulOs of bacteria, including Sias, can occur as internal glycan components within repeating units of polysaccharides, which have also been reported in some invertebrates such as echinoderms. In the latter, the C-4 hydroxyl of Neu5Ac is sometimes glycosylated with other monosaccharides such as fucose, galactose, and glucose. Overall, it appears that we do not yet know the full extent of sialoglycan diversity in nature. Polysialic acid (polySia, previously called PSA) is a linear homopolymer of Sias that sometimes reaches lengths of more than 100 residues. Shorter chains of two to three residues, called oligosialic acids, are common components of gangliosides (Figure 15.3 and Chapter 11) and are found occasionally as terminal structures on glycoprotein glycans. PolySia is a prominent structural feature of a highly select group of acceptor proteins, the best studied of which is the neural cell adhesion molecule (NCAM). Beginning early in vertebrate brain development, long polySia chains (Neu5Acα2-8)n are added to NCAM (often then called PSA-NCAM), on the termini of two specific N-glycans. The large hydration shell formed by polySia markedly increases the hydrodynamic volume of its protein carrier and interferes with NCAM's natural cell–cell adhesion function. PolySia thus converts an adhesive protein into a repelling one. During brain development, a high level of polySia likely ensures that neural precursors can migrate to their final anatomical sites. Once a destination is reached, polySia is down-regulated and firm adhesion proceeds, keeping the cells in place. When the sialyltransferases (STs) responsible for polySia formation are genetically ablated in mice, some nerve progenitor cells adhere prematurely, become stuck in place and fail to reach their proper destination. In contrast to the above-mentioned “repulsive field effects,” polySia can also act an “attractive field,” binding and locally concentrating neurotrophic factors like BDNF and FGF2. Notably, human genetic and molecular evidence indicate that variations in polysialylation may be a factor in human psychiatric diseases like schizophrenia.""
 'An extreme example of these biophysical effects is polySia, whose functional impacts are detailed above. Given Sia abundance on cell surfaces (see Figure 15.3), it is not surprising that numerous animal pathogens evolved to target these molecules. Indeed, highly specific Sia-binding proteins were first discovered on human pathogens and their toxins. In the search for host cell receptors for influenza viruses, it was discovered that isolated viruses cross-linked red blood cells, resulting in hemagglutination. Over time, the red cells dispersed and could no longer be agglutinated by fresh viruses. This led to the concept of a viral “hemagglutinin” (a term still used in virus typing; e.g., the “H” in H1N1) that binds to a receptor on the red blood cell, which is also susceptible to a “receptor destroying enzyme” from the virus. The component released by receptor-destroying enzyme was identified as Sia, the hemagglutinin as a Sia-binding protein, and the receptor-destroying enzyme as a sialidase (viral neuraminidase, the “N” in H1N1). Interestingly, the Sia-linkage specificity of the hemagglutinin defines host restrictions; with bird influenza virus preferentially binding to Sias in α2-3-linkage and human virus to Sias in α2-6-linkage. Scientists monitoring influenza virus outbreaks test α2-3- versus α2-6-specificity to detect potential emerging human influenza strains. Molecules designed to block the viral sialidases are useful anti-influenza drugs (Chapter 57). Sia-specific binding proteins are widespread in pathogens and include numerous viral hemagglutinins, bacterial adhesins, bacterial toxins, and parasite-binding proteins (see Table 15.1 for a few examples). Helicobacter pylori causes stomach ulcers and cancers. It expresses a Sia-specific adhesin called SabA, which contributes to its chronic colonization of the stomach lining. The merozoite stage of the malarial parasite P. falciparum can bind to erythrocyte sialoglycans to initiate cell entry. Several bacterial toxins also target sialoglycans. Cholera toxin and the structurally related E. coli heat-labile enterotoxin both bind to Sias on ganglioside GM1 on the intestinal epithelium, whereas tetanus and related botulinum toxins bind to more complex gangliosides (Chapter 37). The toxin from the human pathogen Salmonella Typhi binds specifically to Neu5Ac on glycans but not Neu5Gc; influenza C virus expresses a hemagglutinin that binds only to 9-O-acetylated Sias. The complexities of Sia diversification are thought to be the outcome of an ongoing evolutionary “arms race” between animals and microbial pathogens (Chapter 20). In this regard, it is notable that O-acetyl and N-glycolyl groups on Sias can limit action of bacterial sialidases and block the binding of some pathogens. Alternately, the same modifications may facilitate binding of pathogens that have adapted to them. Sialoglycans at environmental surfaces (like mucins) or free in biological fluids might provide protection by virtue of their “decoy” inhibition of microbial adherence and/or sialidases. The evolutionary persistence of sialoglycans despite their role in virulent diseases suggests critical physiological roles, some of which are addressed below. A few classic examples of sialic acid–binding proteins in nature  Sias in vertebrates can act as “biological masks,” preventing recognition of underlying glycans (especially β-linked Gal residues) by intrinsic and extrinsic glycan-binding proteins. They are also essential components of recognition molecules, with roles that vary according to cell type, tissue type, and species. The first mammalian Sia-binding protein found was the complement regulatory molecule factor H, a soluble serum factor that binds cell-surface Sias and protects cells from autoimmune attack, providing recognition of “self-associated molecular patterns” (SAMPs), which are also recognized by CD33-related Siglecs (Chapter 35). Human mutations in the Sia-binding site of factor H result in atypical hemolytic uremic syndrome in humans, a disease caused by excessive complement activation, because of the failure of factor H function.'
 'The 3D structures of pathogen sialidases are used for drug development (Chapter 42). Sialidases vary in their substrate specificity from highly selective (e.g., the α2-3-specific sialidase SpNanB and SpNanC from Streptococcus pneumoniae) to broadly acting (e.g., the α2-3, α2-6, α2-8 sialidase from Arthrobacter ureafaciens and SpNanA from S. pneumoniae). The products of sialidases also differ with free Sias as the most common ones (e.g., released by SpNanA) whereas 2,7-anhydro-Sias (e.g., released by SpNanB) and 2,3-dehydro-2-deoxy-sialic acids (Sia2ens) (e.g., released by SpNanC) are less common. Interestingly, some pathogen sialidases have additional lectin (sugar-binding) domains that appear to direct the action of the enzymes to particular sites. Some Sia linkages resist release even by sialidases with broad specificity. A branched α2-3Sia on the brain ganglioside GM2 requires a special helper protein (GM2-activator) to facilitate its cleavage, and mutation of GM2-activator protein results in GM2 buildup in the brain (Chapter 44). O-Methylation and O-acetylation of Sias also can hinder or even prevent hydrolysis by sialidases, as is the case for 4-O-acetyl group. These properties are likely biologically significant, but have not been well investigated. Microbial sialidases and trans-sialidases (see also Chapter 43) can be powerful virulence factors that may promote cellular invasion, unmask potential binding sites, and modulate the immune system. Sias liberated by sialidases at mucosal sites also provide nutrients for some bacteria or provide access to underlying carbohydrates. Viral neuraminidases facilitate release and spreading of newly formed viruses, and specific viral neuraminidase inhibitors are widely used as the antiviral drugs such as anti-influenza A virus drugs Relenza and Tamiflu (Chapter 42). Once a free Sia molecule is released in the lysosome of a vertebrate cell, it is returned to the cytosol by a specific exporter (SLC17A5, also called Sialin), in which it is either reused or degraded. Human mutations in Sialin cause Salla disease and infantile sialic acid storage disease, resulting in accumulation of Sia in lysosomes and excretion of excess Sia in the urine. Some pathogens scavenge Sias from the extracellular space, using high-efficiency transporters to concentrate them from trace levels. In contrast, there is no evidence for plasma membrane Sia transporters in eukaryotic cells. Nevertheless, free Sias can be taken up into mammalian cells via fluid-phase macropinocytosis, eventually arriving in the lysosomes, from which they are exported into the cytoplasm by Sialin. Intact sialoglycans can also be taken up and transported to lysosomes, where sialidases release Sias for delivery to the cytoplasm and then to the nucleus to be reused by the cellular CMP-Sia synthetase. However, at the whole-body level, free Sias in the bloodstream derived from cellular sources or digestive processes are rapidly excreted in the urine. Thus, uptake of sialoglycoproteins (followed by lysosomal release by NEU1 and export by Sialin) may better account for the incorporation of dietary Neu5Gc in human tissues. In vertebrates, O-acetylated Sias are de-O-acetylated by Sia-specific O-acetylesterases, including the human enzyme coded by the SIAE gene, which may regulate B-cell development and immune tolerance by modulating recognition by Siglecs (Chapter 35). Enzymes with Sia 9-O-acetylesterase activity are also found in some bacteria and viruses.']","Sialic acids (Sias) are abundant on vertebrate glycoproteins, glycolipids, and milk oligosaccharides, as well as on some microbial surface glycans, mediating diverse functional roles. Originally discovered within the Deuterostome lineage of animals and associated microbes, they are actually a subset of a more ancient family of α-keto acid monosaccharides with a 9-carbon backbone called nonulosonic acids (NulOs), which are also found in some Eubacteria and Archaea. Biosynthesis of all NulO-glycans requires the activation of NulO to a CMP-sugar, before the NulO is transferred to glycan acceptors. NulOs are remarkable for the number and the type of functional groups on one monosaccharide. Further complexity arises from various epimers, modifications, and diverse linkages to other glycans, making these molecules well-suited to carry information for glycan–protein, cell–cell, and pathogen–host recognition. NulOs are among the most rapidly evolving classes of monosaccharides in nature and exist in tremendous variety, particularly in the microbial world. Given their high density and widespread location on vertebrate cells, Sias also exert many functions via electronegative charge, such as repulsion of cell–cell interactions, protein stabilization, ion binding, and ion transport. Early nomenclature of these molecules was tied to their discovery, being first isolated by Gunnar Blix from salivary mucins in 1936 and independently by Ernst Klenk from brain glycolipids in 1941. Blix named his substance “sialic acid” after the Greek word for saliva (σíαλoν), and Klenk named his “neuraminic acid” for neurons in the brain. By the time the relationship of these substances became evident, both names were already in use and have persisted.","Although 5-N-acetylneuraminic acid (Neu5Ac, sometimes called “NANA”) is the most common sialic acid (Sia) in humans, the Sia family is comprised of related structures (Figure 15.1) that vary at the C-5 carbon, including 5-N-glycolylneuraminic acid (Neu5Gc) and 3-deoxy-D-glycero-D-galacto-non-2-ulosonic acid (also known as 3-deoxy-nonulosonic acid, 2-keto-3-deoxy-nononic acid, or Kdn) with a hydroxyl group at C-5. Similar 9-carbon backbone 2-keto acid monosaccharides were later discovered in some bacterial lipopolysaccharides and initially called “bacterial sialic acids.” The resulting confusion was resolved by suggesting that the term “sialic acid” (Sia) be limited to its original use in describing neuraminic acid (Neu), Kdn, and their derivatives in deuterostomes and their pathogens, and that the term “nonulosonic acid” (NulO) be used to encompass the entire group of 9-carbon backbone non-2-ulosonic acids (Figure 15.1).",0.9722222222222222,0.6873441185262159,0.7954077559025967,0.007936507936507936,0.99999999998,0.6666666666666666
"Complete the following paragraph: Large hyaluronan polymers in the extracellular space can be internalized following interaction with cell-surface receptors that trigger endocytosis, which may be facilitated by the membrane-associated hyaluronidases, HYAL2 and/or TMEM2, or through association with CEMIP.","['The Streptococcus hasA gene encodes a bifunctional protein that contains both transferase activities and assembles the polysaccharide from the reducing end. The synthase spans the membrane multiple times, presumably forming a pore for hyaluronan extrusion during capsule formation. In contrast, Pasteurella synthesizes hyaluronan by an enzyme that is unrelated to hasA and the mammalian Has gene family. In this case, the enzyme has two separable domains with independent glycosyltransferase activities—one for UDP-GlcNAc and the other for UDP-GlcA, and the elongation is on the nonreducing end. Animal cells express a set of catabolic enzymes that degrade hyaluronan. The human hyaluronidase gene (HYAL) family is complex, with two sets of three contiguous genes located on two chromosomes, a pattern that suggests two ancient gene duplications followed by a block duplication. In humans, the cluster on chromosome 3p21.3 (HYAL1, 2, and 3) appears to have major roles in somatic tissues. HYAL4 in the cluster on chromosome 7q31.3 codes for a protein that appears to have chondroitinase, but not hyaluronidase, activity; PHYAL1 is a pseudogene; and SPAM1 (sperm adhesion molecule 1, PH-20) is restricted to testes. The role of SPAM1 in fertilization is discussed below. Two additional enzymes with hyaluronan depolymerizing activity at neutral pH have been subsequently identified in multiple tissues and termed TMEM2 (transmembrane protein 2) and KIAA1199 (CEMIP, cell migration–inducing protein). The turnover of hyaluronan in most tissues is rapid (e.g., a half-life of ∼1 day in epidermal tissues), but its residence time in some tissues can be quite long and dependent on location (e.g., in cartilage). It has been estimated that an adult human contains ∼15 g of hyaluronan and that about one-third turns over daily. Turnover appears to occur by receptor-mediated endocytosis and lysosomal degradation either locally or after transport by lymph to lymph nodes or by blood to liver. The endothelial cells of the lymph node and liver sinusoids remove hyaluronan via specific receptors, such as LYVE-1 (a homolog of CD44) and HARE (hyaluronan receptor for endocytosis). HARE appears to be the major clearance receptor for hyaluronan delivered systemically by lymph and blood. The current understanding of this catabolic process is that hyaluronidases at the cell surface and in the lysosome cooperate to degrade the chains. Large hyaluronan polymers in the extracellular space can be internalized following interaction with cell-surface receptors that trigger endocytosis, which may be facilitated by the membrane-associated hyaluronidases, HYAL2 and/or TMEM2, or through association with CEMIP. The hyaluronan fragments may be returned to the extracellular space via recycling endosomes or enter a pathway to lysosomes for complete degradation to monosaccharides, probably involving HYAL1 and the two exoglycosidases β-glucuronidase and β-N-acetylglucosaminidase. The importance of the turnover process for growth and survival is demonstrated by the respective embryonic lethal phenotypes in animal models. Hyal2-null mice and Tmem2-deficient zebrafish both suffer embryonic lethality as a result of cardiac developmental defects. CEMIP is important for clearing hyaluronan accumulation during bacterial infection in mice. In humans, a lysosomal storage disorder was found to result from mutation of HYAL1 (Chapter 44). Hyaluronan fragments have been suggested to act as an endogenous signal of injury, or during infection by Group A Streptococcus, which contains a hyaluronan capsule. The signaling activity of hyaluronan fragments is mediated through binding of cell-surface receptors, such as CD44, which in turn modulates response through Toll-like receptors.'
 'The fold consists of about 100 amino acids and contains four cysteines disulfide-bonded in the pattern Cys1-Cys4 and Cys2-Cys3. This fold has only been found in vertebrates, consistent with the fact that hyaluronan is a relatively recent evolutionary invention. The link module fold is related to that found in the C-type lectins, but it lacks the Ca++ binding motif (Chapter 34). In the case of TSG-6, the interaction of hyaluronan with the protein involves ionic interactions between positively charged amino acid residues and the carboxyl groups of the uronic acids, and hydrophobic interactions between the acetamido side chains of two N-acetylglucosamine residues and hydrophobic pockets on either side of adjacent tyrosines (Figure 16.5). Many of these features are conserved in other members of the hyaluronan-binding proteins. Subgroups, however, differ in the preferred size and length of hyaluronan for binding (e.g., hexasaccharides to decasaccharides). Structure of the link module. (A) TSG-6 contains a prototypical link module defined by two α-helices (α1 and α2) and two triple-stranded antiparallel β-sheets (β1,2,6 and β3–5). (Redrawn, with permission, (more...) Some hyaluronan-binding proteins do not contain a link module (RHAMM, ITI, SPACR, SPACRCAN, CD38, CDC37, HABP1/P-32, Siglec-9, and IHABP4), and most of these are unrelated to one another by primary sequence. Some of these proteins contain sequences of nine amino acids, referred to as BX7B motifs (where B is either lysine or arginine and X can be any amino acid other than acidic residues), but the actual hyaluronan docking site of the chain with this motif has not been established. Thus, the presence of the BX7B motif should not be taken as proof that the protein interacts with hyaluronan. Hyaluronan production has long been implicated in enhanced cell adhesion and locomotion because it is present abundantly during morphogenesis and in both physiological and pathological invasive processes. Five different types of cell signaling proteins have been found to mediate the complex breadth of functions associated with hyaluronan (Figure 16.6). Hyaluronan signaling in health and disease. CD44, cluster of differentiation antigen, a type I transmembrane receptor; FAK, focal adhesion kinase; FGF, fibroblast growth factor; HARE, hyaluronan receptor for endocytosis; LYVE-1, lymphatic vessel endothelial (more...) Toll-like receptors TLR2 and TLR4, which are components of the innate immune system responsive to bacterial pro-inflammatory stimuli such as lipopolysaccharide (LPS), have been found to signal differentially in response to the generation of hyaluronan oligosaccharides by hyaluronidase. Depending on cell type, this may occur through direct binding of the hyaluronan oligosaccharides by TLR2/4. Alternatively, because hyaluronan encapsulation can obstruct access of TLR2/4 by other known ligands, hyaluronidase-mediated capsule degradation can also facilitate TLR2/4 activation by allowing other ligands to bind. HARE is expressed on the cell surface of a variety of sinusoidal endothelial cell types, where it is capable of binding hyaluronan and other glycosaminoglycan ligands, subsequently triggering receptor-mediated endocytosis and thereby clearing these components from circulation. Signaling occurs optimally during uptake of 50- to 250-kDa hyaluronan; smaller or larger hyaluronan does not activate signaling and blocks signaling by 50- to 250-kDa hyaluronan. Signaling through both TLR2/4 and HARE activate NF-κB and promote the secretion of pro-inflammatory and pro-apoptotic cytokines. CD44 is a transmembrane receptor expressed by many cell types, and it varies markedly in glycosylation, oligomerization, and protein sequence because of differential mRNA splicing.'
 'Signaling through both TLR2/4 and HARE activate NF-κB and promote the secretion of pro-inflammatory and pro-apoptotic cytokines. CD44 is a transmembrane receptor expressed by many cell types, and it varies markedly in glycosylation, oligomerization, and protein sequence because of differential mRNA splicing. CD44 contains a cytoplasmic domain, a transmembrane segment, and an ectodomain with a single link module that can bind hyaluronan. When hyaluronan binds to CD44, the cytoplasmic tail can interact with regulatory and adaptor molecules, such as SRC kinases, RHO (ras homolog) GTPases, VAV2 (a human proto-oncogene), GAB1 (a GRB2-associated binding protein), and ankyrin and ezrin (which regulate cytoskeletal assembly/disassembly and cell migration). Binding of hyaluronan to CD44H (the isoform expressed by hematopoietic cells) can mediate leukocyte rolling and extravasation in some tissues. Interaction of hyaluronan with CD44 can also regulate ErbB-family (including epithelial growth factor receptor, HER2) signaling, thereby activating the PI3K (phosphatidylinositol 3-kinase)–PKB (protein kinase B/AKT) signaling pathway and phosphorylation of FAK (focal adhesion kinase) and BAD (BCL2-antagonist of cell death), which promote cell survival. Changes in CD44 expression, notably expression of CD44 variants, are associated with a wide variety of tumors and the metastatic spread of cancer. LYVE-1 is a lymphatic vessel endothelial hyaluronan receptor that is a homolog of CD44. Importantly, LYVE-1 signals uniquely through growth factor stimuli in lymphatic vasculature and lymph nodes to promote circulating leukocyte adhesion and support lymphatic development. Many cells also express RHAMM, which is also known as HMMR (homeostasis, mitosis, and meiosis regulator) and is involved in cell motility and cell division. The RHAMM pathway is thought to induce focal adhesions to signal the cytoskeletal changes required for elevated cell motility seen in tumor progression, invasion, and metastasis. RHAMM splice variants exist, some of which may be intracellular. RHAMM possesses a BX7B sequence that promotes electrostatic interaction with hyaluronan but is also part of a basic leucine zipper motif that is capable of centrosome and microtubule interactions. Thus, RHAMM is also a nonmotor spindle assembly factor. Hyaluronan binding to RHAMM activates SRC, FAK, ERK (extracellular mitogen-regulated protein kinase), and PKC (protein tyrosine kinase C) (Chapter 40). These pathways are relevant to tumor cell survival and invasion; their inhibition by hyaluronan oligomers and soluble hyaluronan-binding proteins suggests novel therapeutic approaches for treating cancer (Chapter 47). Some pathogenic bacteria (e.g., certain strains of Streptococcus and Pasteurella) produce hyaluronan as an extracellular capsule; also see Chapter 21). Capsular hyaluronan, like other capsular polysaccharides, increases virulence by helping to shield the microbe from host defenses. For example, the capsule blocks phagocytosis and protects against complement-mediated killing. Because bacterial hyaluronan is identical in structure to host hyaluronan, the capsule can also prevent the formation of protective antibodies. Thus, the formation of hyaluronan capsules by bacteria is a form of molecular mimicry. The capsule also can aid in bacterial adhesion to host tissue, facilitating colonization (Chapter 37). Finally, the production of hyaluronan by invading bacteria can also induce a number of signaling events through hyaluronan-binding proteins that modulate the host physiology (i.e., cytokine production; Chapter 42). In addition to bacteria, an algal virus (Chlorella) encodes a hyaluronan synthase. The functional significance of viral hyaluronan production is unknown, but could be related to prevention of secondary viral infection, increase in host capacity to produce virus, or viral burst size.'
 'CEMIP is important for clearing hyaluronan accumulation during bacterial infection in mice. In humans, a lysosomal storage disorder was found to result from mutation of HYAL1 (Chapter 44). Hyaluronan fragments have been suggested to act as an endogenous signal of injury, or during infection by Group A Streptococcus, which contains a hyaluronan capsule. The signaling activity of hyaluronan fragments is mediated through binding of cell-surface receptors, such as CD44, which in turn modulates response through Toll-like receptors. Signaling through these and other receptors is affected by the size of the hyaluronan fragments, but the mechanism underlying the dependence of activity on the size of the fragments remains an area of active research. Hyaluronan has multiple roles in early development, tissue organization, and cell proliferation. The Has2-null mouse shows an embryonic lethal phenotype at the time of heart formation, whereas Has1-, Has3-null, and Has1/3 compound mutant mice show no obvious developmental phenotype. Interestingly, explanted cells from the Has2-null embryonic heart do not synthesize hyaluronan or undergo epithelial–mesenchymal transformation and migration unless small amounts of hyaluronan are added to the culture medium. This finding indicates that the production of hyaluronan at key points may be essential for many tissue morphogenetic transformations—in this case, formation of the tricuspid and mitral valves. Many of the activities of hyaluronan depend on binding proteins present on the cell surface and/or secreted into the extracellular matrix. A class of proteins that bind selectively to hyaluronan was first discovered in cartilage. This class is now referred to as the link module family of hyaladherins (Figure 16.3). Proteoglycans were efficiently extracted from this tissue with denaturing solvents and were shown to reaggregate when restored to renaturing conditions. An essential protein, referred to as the link protein (HAPLN-1), was shown to be necessary for stabilizing the proteoglycan aggregates, and subsequently, the structure of the aggregate was defined (Figure 16.4). The link protein contains two homologous repeats of a sequence motif, now named the link module. Proteins that have a link module, including link proteins (HAPLN-1 through HAPLN-4 in humans), several proteoglycans, and other extracellular matrix proteins, can interact specifically with hyaluronan. The major cartilage proteoglycan, now named aggrecan (Chapter 17), also contains a globular domain, the G1 domain, with two homologous link modules that interact with hyaluronan. An additional domain in HAPLN-1 cooperatively interacts with a homologous domain in G1, which locks the proteoglycan on the hyaluronan chain. In the absence of the HAPLN-1, aggrecan fails to anchor to hyaluronan. Mice deficient in HAPLN-1 show defects in cartilage development and delayed bone formation (short limbs and craniofacial anomalies). Most mutant mice die shortly after birth as a result of respiratory failure, and the few survivors develop progressive skeletal deformities. Modular organization of the link module superfamily of hyaluronan-binding proteins. These proteins contain one or two link modules that bind to hyaluronan. Like many extracellular matrix proteins, the link module superfamily members contain various subdomains, (more...) The large cartilage chondroitin sulfate (CS) proteoglycan (aggrecan) forms an aggregate with hyaluronan and link protein.  Interestingly, there are four proteoglycan genes with homologous G1 domains that interact with hyaluronan (versican, neurocan, brevican, and aggrecan) (Figure 16.3). Versican is a major component of many soft tissues and is especially important in vascular biology. Neurocan and brevican are expressed predominantly in brain tissue. Versican and aggrecan are anchored to hyaluronan in tissues by similar link protein-dependent mechanisms, and it is likely that neurocan and brevican are organized similarly. In the brain, these complexes form perineuronal nets.'
 'Versican is a major component of many soft tissues and is especially important in vascular biology. Neurocan and brevican are expressed predominantly in brain tissue. Versican and aggrecan are anchored to hyaluronan in tissues by similar link protein-dependent mechanisms, and it is likely that neurocan and brevican are organized similarly. In the brain, these complexes form perineuronal nets. Thus, hyaluronan acts as a scaffold on which to build proteoglycan aggregate structures adapted to diverse tissue functions. An impressive example of the requirement for a hyaluronan-based matrix occurs during the process of cumulus oophorus expansion in the mammalian preovulatory follicle. At the beginning of this process, the oocyte is surrounded by about 1000 cumulus cells tightly compacted and in gap-junction contact with the oocyte. In response to hormonal stimuli, the cumulus cells up-regulate HAS2 and tumor necrosis factor (TNF)-α-stimulated gene 6 (TSG-6; see the next section). The expression of these proteins initiates production of hyaluronan and its organization into an expanding matrix around the cumulus cells. Concurrently, the follicle becomes permeable to serum, which introduces an unusual molecule called inter-α-trypsin inhibitor (ITI), composed of the trypsin inhibitor bikunin and two heavy chains all covalently bound to a chondroitin sulfate chain. TSG-6 catalyzes the transfer of heavy chains that are covalently linked to chondroitin sulfate onto the newly synthesized hyaluronan. In the absence of either TSG-6 or ITI, the matrix does not form, and the phenotype of mice null for either of these molecules is female infertility. At the time of ovulation, hyaluronan synthesis ceases, and ovulation of the expanded cumulus cell–oocyte complex occurs. Before fertilization, individual sperm undergo capacitation enabling them to penetrate and fertilize an ovum. During this process, SPAM1, a GPI-anchored hyaluronidase, redistributes and accumulates in the sperm head. SPAM1 binds hyaluronan in the cumulus, causing an increase in Ca++ flux and sperm motility. It also helps dissolve the cumulus matrix as the sperm moves through the hyaluronan vestment. A soluble form of SPAM1 is secreted during the acrosome reaction. The release of acrosomal hyaluronidase and proteases renders the sperm capable of fusing with the egg and eventually destroys the entire matrix to allow the fertilized oocyte to implant and develop. There are several hyaluronan-binding proteins with homologous link modules (Figure 16.3). The four homologous link proteins belong to a subfamily called the “hyaluronan and proteoglycan link proteins” (HAPLNs); these are expressed in many tissues. Four cell-surface receptors have extracellular domains with one link module: CD44, LYVE-1 (lymphatic vessel endothelial hyaluronan receptor), HARE/Stabilin-2 (hepatic hyaluronan clearance receptor), and Stabilin-1, which are expressed on discontinuous endothelial cells and some activated macrophages. Of these, all functionally bind hyaluronan through the link module except Stabilin-1. Other hyaluronan-binding proteins are secreted and include the chondroitin sulfate proteoglycans that comprise the aggrecan superfamily and TSG-6, which has one link module. The three-dimensional structure of the link module fold in TSG-6 has been determined by nuclear magnetic resonance and defines a consensus fold of the two α-helices and two triple-stranded antiparallel β-sheets (Figure 16.5). The fold consists of about 100 amino acids and contains four cysteines disulfide-bonded in the pattern Cys1-Cys4 and Cys2-Cys3. This fold has only been found in vertebrates, consistent with the fact that hyaluronan is a relatively recent evolutionary invention. The link module fold is related to that found in the C-type lectins, but it lacks the Ca++ binding motif (Chapter 34).']","The hyaluronan fragments may be returned to the extracellular space via recycling endosomes or enter a pathway to lysosomes for complete degradation to monosaccharides, probably involving HYAL1 and the two exoglycosidases β-glucuronidase and β-N-acetylglucosaminidase.","The hyaluronan fragments may be returned to the extracellular space via recycling endosomes or enter a pathway to lysosomes for complete degradation to monosaccharides, probably involving HYAL1 and the two exoglycosidases β-glucuronidase and β-N-acetylglucosaminidase.",1.0,0.6364748919574338,1.0000000000000004,0.0078125,0.99999999998,1.0
"Complete the following paragraph: Genetic evidence from studies of C. elegans suggests that N-acetylgalactosamine addition during chondroitin assembly is mediated by the same enzyme that is involved in chain polymerization (Sqv5), but biochemical evidence suggests that more than one enzyme may exist in vertebrates. In heparin/heparan sulfate formation, the addition of the first N-acetylglucosamine residue is catalyzed by an enzyme called EXTL3, which differs from the transferases involved in heparan polymerization (called EXT1 and EXT2).","['Genetic evidence from studies of C. elegans suggests that N-acetylgalactosamine addition during chondroitin assembly is mediated by the same enzyme that is involved in chain polymerization (Sqv5), but biochemical evidence suggests that more than one enzyme may exist in vertebrates. In heparin/heparan sulfate formation, the addition of the first N-acetylglucosamine residue is catalyzed by an enzyme called EXTL3, which differs from the transferases involved in heparan polymerization (called EXT1 and EXT2). These enzymes are important control points because they ultimately regulate the type of glycosaminoglycan chain that will assemble. Control of the addition of β4GalNAc or α4GlcNAc appears to be manifested at the level of enzyme recognition of the polypeptide substrate. Keratan sulfate chains contain a mixture of nonsulfated (Galβ4GlcNAcβ3), monosulfated (Galβ4GlcNAc6Sβ3), and disulfated (Gal6Sβ4GlcNAc6Sβ3) disaccharide units (Figure 17.2). The biosynthesis of the poly-N-acetyllactosamine backbone is described in Chapter 14. At least two classes of sulfotransferases, one or more N-acetylglucosaminyl 6-O-sulfotransferases (e.g., CHST4 or CHST6), and one or two galactosyl 6-O-sulfotransferases (CHST1 and CHST3) catalyze the sulfation reactions. These enzymes, like other sulfotransferases, use activated sulfate (PAPS [3′-phosphoadenyl-5′-phosphosulfate]) as a high-energy donor (Chapter 5). 6-O-Sulfation of N-acetylglucosamine occurs on the nonreducing terminal residue, encouraging further chain elongation, whereas sulfation of galactose residues takes place on nonreducing terminal and internal galactose residues, with a preference for galactose units adjacent to a sulfated N-acetylglucosamine residue. Sulfation of a nonreducing terminal galactose residue blocks further elongation of the chain, providing a potential mechanism for controlling chain length. The poly-N-acetyllactosamine chains of KS I are generally longer than those of KS II and may contain up to 50 disaccharide units (20–25 kDa). The chains can be fucosylated and sialylated as well (Chapter 14). Vertebrate chondroitin sulfate consists of repeating sulfate-substituted GalNAcβ4GlcAβ3 disaccharides polymerized into long chains (Figure 17.2). In contrast, invertebrates such as C. elegans and D. melanogaster make either nonsulfated or low sulfated chains. The assembly process for the backbone appears to be highly conserved, based on the presence of homologous genes for all of the reactions (Chapters 25 and 26). As described above, the assembly process is initiated by the transfer of GalNAcβ3 to the linkage tetrasaccharide (Figure 17.4). In both vertebrates and invertebrates, the polymerization step is catalyzed by one or more bifunctional enzymes (chondroitin synthases) that have both β3 glucuronosyltransferase and β4 N-acetylgalactosaminyltransferase activities. Vertebrates also express homologs that can transfer individual sugars to the chain. Chondroitin polymerization also requires the action of the chondroitin polymerizing factor (CHPF), a protein that lacks independent activity but collaborates with the polymerases to enhance the formation of polymers. Sulfation of chondroitin in vertebrates is a complex process, with multiple sulfotransferases involved in 4-O-sulfation and 6-O-sulfation of N-acetylgalactosamine residues (Figure 17.5).'
 'KS I, originally detected in cornea, is found on an N-glycan linked to protein through an asparagine residue (Chapter 9). KS II (skeletal keratan sulfate) is found on an O-glycan core 2 structure and is thus linked through N-acetylgalactosamine to serine or threonine (Chapter 10). The structural features in control of keratan sulfate substitution remain unclear, as the underlying poly-N-acetyllactosamine backbone can be found on many other glycoproteins. Notably, in humans and bovine, the large chondroitin sulfate proteoglycan found in cartilage (aggrecan) contains a segment of four to 23 hexapeptide repeats (E-E/L-P-F-P-S) where the keratan sulfate chains are located, whereas aggrecan in rats and other rodents lacks this motif and does not contain keratan sulfate. Keratan sulfates (KS) contain a sulfated poly-N-acetyllactosamine chain, linked to either asparagine or serine/threonine residues. Chst1 and 5 can add sulfate groups at the indicated positions. The actual order of the various sulfated and nonsulfated (more...) Two classes of glycosaminoglycan chains—chondroitin sulfate/dermatan sulfate and heparan sulfate/heparin—are linked to serine residues in proteins by way of xylose (Figure 17.4). Xylosyltransferase initiates the process using UDP-xylose as donor. Two isoforms of the enzyme are known in vertebrates (XYLT1 and XYLT2), but only one isozyme exists in C. elegans and D. melanogaster. A glycine residue invariably lies to the carboxy-terminal side of the serine attachment site, but a perfect consensus sequence for xylosylation does not exist. At least two acidic amino acid residues are usually present, and they can be located on one or both sides of the serine, usually within a few residues. Several proteoglycans contain clustered glycosaminoglycan attachment sites, raising the possibility that xylosyltransferase could act in a processive manner. Xylosylation is an incomplete process in some proteoglycans, which may explain why proteoglycans with multiple potential attachment sites contain different numbers of chains in different cells. The biosynthesis of chondroitin sulfate (left chain) and heparan sulfate (right chain) is initiated by the formation of a linkage region tetrasaccharide (green circles in Fig. 17.1). Addition of the first hexosamine commits the intermediate to either (more...) After xylose addition, a linkage tetrasaccharide assembles by the transfer of two galactose residues catalyzed by unique members of the β4 galactosyl-, β3 galactosyl-, and β3 glucuronosyltransferase families of enzymes (Figure 17.4). This intermediate can undergo phosphorylation at the C-2 position of xylose and in the case of chondroitin sulfate, sulfation of the galactose residues. In general, phosphorylation and sulfation occur substoichiometrically, but phosphorylation may be transient. Phosphorylation occurs early in the assembly process and creates the preferred substrate for B4GALT7; a phosphatase removes the phosphate at a later stage of biosynthesis. The function of galactose sulfation in chondroitin sulfate remains unclear. The linkage tetrasaccharide lies at a bifurcation in the biosynthetic pathway: addition of β4-linked N-acetylgalactosamine, which initiates chondroitin sulfate assembly, or addition of α4-linked N-acetylglucosamine, which initiates heparan sulfate assembly (Figure 17.4). Genetic evidence from studies of C. elegans suggests that N-acetylgalactosamine addition during chondroitin assembly is mediated by the same enzyme that is involved in chain polymerization (Sqv5), but biochemical evidence suggests that more than one enzyme may exist in vertebrates.'
 'Vertebrates also express homologs that can transfer individual sugars to the chain. Chondroitin polymerization also requires the action of the chondroitin polymerizing factor (CHPF), a protein that lacks independent activity but collaborates with the polymerases to enhance the formation of polymers. Sulfation of chondroitin in vertebrates is a complex process, with multiple sulfotransferases involved in 4-O-sulfation and 6-O-sulfation of N-acetylgalactosamine residues (Figure 17.5). Biosynthesis of chondroitin sulfate/dermatan sulfate involves the polymerization of N-acetylgalactosamine and glucuronic acid units and a series of modification reactions including O-sulfation and epimerization of glucuronic acid to iduronic acid. Heparan (more...) Additional enzymes exist for epimerization of D-glucuronic acid to L-iduronic acid in dermatan sulfate (DSE1-2), sulfation at the C-2 position of the uronic acids, and other patterns of sulfation found in unusual species of chondroitin (Table 17.2). The location of sulfate groups is easily assessed using bacterial chondroitinases (ABC, B, and ACII) that cleave the chains into disaccharides. Many chains are hybrid structures containing more than one type of chondroitin disaccharide unit. For example, dermatan sulfate is defined as having one or more iduronic acid–containing disaccharide units (chondroitin sulfate B) as well as glucuronic acid–containing disaccharides (chondroitin sulfate A and C). Animal cells also degrade chondroitin sulfate in lysosomes using a series of exolytic activities (Chapter 44). Types of chondroitin sulfates  Heparan sulfate assembles as a copolymer of GlcNAcα4GlcAβ4 (Figure 17.5), which then undergoes extensive modification reactions, catalyzed by at least four families of sulfotransferases and one epimerase. N-acetylglucosamine N-deacetylase/N-sulfotransferases (NDST1-4) act on a subset of N-acetylglucosamine residues to generate N-sulfated glucosamine (GlcNSO3) units, many of which occur in clusters along the chain. Generally, the enzyme deacetylates N-acetylglucosamine and rapidly adds sulfate to the free amino group to form GlcNSO3, but a small number of glucosamine residues with unsubstituted amino groups may arise from incomplete N-sulfation. An epimerase (GLCE), different from the one involved in dermatan sulfate synthesis, then acts on some glucuronic acid residues, followed by 2-O-sulfation of some of the iduronic acid units (catalyzed by HS2ST). Some glucuronic acid units also undergo 2-O-sulfation by the same enzyme. The addition of 2-O-sulfate groups to glucuronic or iduronic acid prevents the reversible epimerization reaction. Next, 6-O-sulfotransferases (HS6ST1-3) add sulfate groups to selected glucosamine residues. Finally, certain subsequences of sulfated sugar residues and uronic acid epimers provide targets for 3-O-sulfotransferases (HS3ST1-6). Unlike other glycosaminoglycans, heparan sulfate is further modified once displayed at the plasma membrane. A family of plasma membrane endosulfatases (SULFs) can remove sulfate groups from internal 6-O-sulfated glucosamine residues in heparan sulfate and a heparanase can cleave the chains at limited sites. This post-assembly processing of the chains at the cell surface results in altered response of cells to growth factors and morphogens. Intriguingly, the mammalian genome contains other sulfatases of unknown function, raising the possibility that other post-assembly processing reactions of glycosaminoglycans may occur.'
 'The requirement for chondroitin assembly in seemingly disparate systems may result from biophysical changes in the lumen of the vulva or between the eggshell and the embryo. One idea is that the high negative charge imparted by the glucuronic acids in chondroitin attracts counterions that raise the local osmolarity, causing a swelling pressure. Another possibility is that the chondroitin acts as a physical scaffold bound to the cell membrane or eggshell. Interestingly, the sqv screen did not detect mutations affecting genes that encode proteoglycan core proteins on which the chondroitin chains assemble, but proteomic analysis has led to the identification of nine novel chondroitin sulfate proteoglycan (CPG) core proteins modified with chondroitin chains (Figure 25.6). Two of these (CPG-1 and CPG-2) contain chitin-binding domains that presumably allow the proteoglycans to interact with chitin in the eggshell, thus positioning the proteoglycans between the eggshell and the plasma membrane of the embryo, in which they could serve as spacers or osmotic regulators. Silencing cpg-1 and cpg-2 expression by RNAi recapitulates the cytokinesis defect observed in sqv mutants, suggesting that these are the relevant proteoglycans. The proteoglycans involved in epithelial invagination have not yet been determined. Chondroitin proteoglycans (CPGs) of Caenorhabditis elegans.  HS biosynthesis in C. elegans follows the same pattern observed in vertebrate systems (Chapter 17). Mutations in the pathway for HS biosynthesis are lethal in C. elegans. Two of the key genes involved in this pathway are rib-1 and rib-2, homologs of the vertebrate genes Ext2 and Ext1, respectively, which catalyze the polymerization of the backbone of HS chains (GlcAβ1-4GlcNAcα1-4) (Chapter 17). Mutants in rib-2, the worm homolog of Ext1, have defects in development and egg laying. The worm genome also contains a single gene for glucuronic acid C-5 epimerase (hse-5) and five genes for sulfotransferase activities (GlcNAc N-deacetylase/N-sulfotransferase [Ndst], hst-1; uronyl 2-O-sulfotransferase, hst-2; 3-O-sulfotransferases, hst-3.1 and hst-3.2; and 6-O-sulfotransferase, hst-6), all of which are homologs of vertebrate genes involved in HS synthesis. In contrast, vertebrates contain four Ndsts, three 6-O-sulfotransferases, and seven 3-O-sulfotransferases. Although mutations in the epimerase (hse-5) and the sulfotransferases (hst-6, hst-2) do not affect viability, they cause defects in specific cell migration, axonal outgrowth, and/or neurite branching. Consistent with this finding, inactivation of the cell surface HS proteoglycan syndecan (sdn-1) affects neural migration and axonal guidance. C. elegans also produces two GPI-anchored HS proteoglycans. LON-2, a member of the glypican family, negatively regulates a bone morphogenetic protein-like signaling pathway that controls body length in C. elegans. Worms also contain a homolog of the vertebrate basement membrane proteoglycan perlecan (encoded by unc-52). At least three major classes of UNC-52 isoforms are produced through alternative splicing, and distinct spatial and temporal expression patterns occur throughout development. In keeping with the “uncoordinated” phenotype, unc-52 mutants affect myofilament assembly in body-wall muscle during embryonic development. Thus, as in vertebrates, HS proteoglycans mediate many fundamental processes during development and in the adult animal. The arthro-series glycolipids in C. elegans include structures modified with either phosphorylcholine or fucose residues (Figure 25.7A).'
 'A family of plasma membrane endosulfatases (SULFs) can remove sulfate groups from internal 6-O-sulfated glucosamine residues in heparan sulfate and a heparanase can cleave the chains at limited sites. This post-assembly processing of the chains at the cell surface results in altered response of cells to growth factors and morphogens. Intriguingly, the mammalian genome contains other sulfatases of unknown function, raising the possibility that other post-assembly processing reactions of glycosaminoglycans may occur. In contrast to chondroitin chains, which tend to have long tracts of fully modified disaccharides, the modification reactions in heparan sulfate biosynthesis occur in clusters along the chain, with regions devoid of sulfate separating the modified domains. In general, the reactions proceed in the order indicated, with evidence for functional interdependence within and between the biosynthetic enzyme families, but they often fail to go to completion, resulting in tremendous chemical heterogeneity. The disaccharide composition of glycosaminoglycan chains can be readily assessed using bacterial lyases or chemical degradation methods (which are more useful for differentiating glucuronic and iduronic acids). Direct sequencing of the chains has proved difficult because of their heterogeneity, however the application of specific lysosomal exoenzymes involved in glycosaminoglycan degradation and new mass spectrometry methods are making significant inroads into sequencing of glycosaminoglycans (Chapter 50). The specific arrangement of sulfated residues and uronic acid epimers in heparin/heparan sulfate and dermatan sulfate gives rise to binding sequences for proteins. The three examples shown in Figure 17.5 show sequences that can interact with antithrombin, heparin cofactor II, and other potential proteins. More modified sequences can interact as well, and the binding of many ligands is dependent on the presence of correctly orientated charged clusters rather than the specific presence of individual sulfated groups. Binding of glycosaminoglycans to proteins is described in greater detail in Chapter 38. A major question remains regarding how the enzymes and biosynthetic pathways are regulated to achieve tissue-specific expression of protein-binding sequences. During the last decade, most if not all of the enzymes involved in glycosaminoglycan synthesis have been purified and molecularly cloned from mammals and model organisms. Several important features have emerged from these studies, which may shed light on how different protein-binding sequences arise. Arrays of synthetic glycosaminoglycans used to probe the importance of chain length, sulfation pattern, and chain density are now in common use and enable the rapid screening of glycosaminoglycan–protein interactions. As highlighted above, care needs to be taken when inferring a biological effect from these interactions. However, recently developed chemical strategies for creating artificial proteoglycans at the cell surface together with new opportunities for altering cell surface display of glycosaminoglycans using gene editing, or by application of soluble inhibitors/activators to influence components of the biosynthetic pathway, offer controlled environments with which to test glycosaminoglycan–protein interactions at the cellular level. Considerable confusion exists regarding the definition of heparin and heparan sulfate (even the spelling is often in error!). Heparin is produced by a limited number of cells, notably connective tissue-type mast cells and bipotential glial progenitor cells, whereas heparan sulfate is made by virtually all types of cells. During biosynthesis, heparin undergoes more extensive sulfation and uronic acid epimerization, such that >80% of the N-acetylglucosamine residues are N-deacetylated and N-sulfated and >70% of the glucuronic acids undergo epimerization to iduronic acid. Heparin derived from porcine entrails and bovine lung is prepared commercially by selective precipitation and is sold by pharmaceutical companies as an anticoagulant because of its high capacity to bind to antithrombin (Chapters 38 and 57). The active sequence is a pentasaccharide shown in Figure 17.5, which is now sold as a purely synthetic anticoagulant (Arixtra). Low-molecular-weight heparins are derived from commercial unfractionated heparin by chemical or enzymatic cleavage, depending on the brand.']","In heparin/heparan sulfate formation, the addition of the first N-acetylglucosamine residue is catalyzed by an enzyme called EXTL3, which differs from the transferases involved in heparan polymerization (called EXT1 and EXT2).","These enzymes are important control points because they ultimately regulate the type of glycosaminoglycan chain that will assemble. Control of the addition of β4GalNAc or α4GlcNAc appears to be manifested at the level of enzyme recognition of the polypeptide substrate. Keratan sulfate chains contain a mixture of nonsulfated (Galβ4GlcNAcβ3), monosulfated (Galβ4GlcNAc6Sβ3), and disulfated (Gal6Sβ4GlcNAc6Sβ3) disaccharide units (Figure 17.2).",1.0,0.7311711760620172,0.6132206244751617,0.009259259259259259,0.99999999998,1.0
"Complete the following paragraph: Highly conserved homologs of OGT and OFT are found in numerous bacterial genomes, although studies of their functional roles are essentially nonexistent.","[""In addition, both OGT and OGA are modified by both tyrosine and serine/threonine phosphorylation, nitrosylation, ubiquitination, and O-GlcNAcylation. Functions for some of these posttranslational modifications have been identified, including substrate targeting, altering protein localization, and altering specific activity. Notably, cellular O-GlcNAc levels control the maturation of OGT and OGA mRNA and, in turn, the abundance of each enzyme. Thus, when O-GlcNAc levels are elevated, OGT abundance is depressed and OGA abundance augmented. In contrast, in response to low levels of O-GlcNAc, OGA abundance is depressed, and OGT levels are augmented. O-GlcNAc transferase (OGT) is regulated by multiple complex mechanisms, including transcriptional regulation of its expression, differential mRNA splicing, proteolytic processing, posttranslational modification, and multimerization with itself and other (more...) OGT (uridine diphospho-N-acetylglucosamine: polypeptide β-N-acetylglucosaminyltransferase; EC 2.4.1.255) catalyzes the addition of N-acetylglucosamine from UDP-GlcNAc to specific serine or threonine residues to form a β-O-glycosidic linkage. The enzyme was first identified and purified from rat liver and subsequently cloned from rat, human, Caenorhabditis elegans, and other organisms. OGT resides on the X chromosome (Xq13 in humans) near the centromere and is among the most highly conserved proteins from worms to man. Mutations in OGT, both in its tetratricopeptide repeats (TPRs) and in its catalytic domain, cause X-linked intellectual disability in humans. To date, three isoforms of OGT have been well characterized: (1) the nucleocytoplasmic or full-length variant (ncOGT), which is 110 kDa; (2) a short isoform of OGT (sOGT), which is 78 kDa; and (3) a variant of OGT that is targeted to the mitochondria (mOGT; ∼90 kDa). In the nucleus and cytoplasm, OGT appears to form multimers, consisting of one or more 110-kDa subunits and 78-kDa subunits. Several useful small molecule inhibitors of OGT have been developed, including OSMI-4b, Ac45SGlcNAc, and 5SGlcNHex, with the latter effective in animal models. However, some off-target effects have been reported for these inhibitors, likely because they impact other enzymes that use UDP-GlcNAc. ncOGT has two distinct domains separated by a putative nuclear localization sequence. The amino terminus of each OGT subunit contains TPRs, which can number up to 13 (species-dependent). The major variation between the three (above) variants is in the number of the TPRs. The crystal structure of the human TPR domain of ncOGT shows that the repeats occur as stacked α-helical domains, forming a “tube-like” structure with a remarkable structural similarity to the armadillo repeat domain of the nuclear transport protein importin-α. The TPR domain mediates multimerization of OGT subunits and acts as a scaffold for protein–protein interactions, including protein substrates (Figure 19.3). OGT's glycosyltransfer reaction occurs by an ordered bi–bi mechanism with UDP-GlcNAc binding first. The TPR domains are required for substrate binding, enzymatic activity, and stability. Recent studies have demonstrated that residues in the TPR domain are critical for interactions with substrates. Such findings likely underpin the observation that there is no strict consensus motif that dictates glycosylation by OGT, although valine and alanine are preferred at the –3 and +2 positions, respectively, and there is a preference for aromatic residues at –4 position. In addition to catalyzing O-GlcNAcylation, OGT also has the remarkable ability to proteolytically cleave HCF-1, a transcription factor regulating the cell cycle. HCF-1 binds to the TPRs positioning the cleavage site at the active site of OGT.""
 'Mutations in SEC cause severe growth phenotypes, but they are not lethal. Interestingly, simultaneous mutation of SEC and the paralogous SPY gene, which encodes an OGT-related fucosyltransferase, is lethal. Studies in rice, potatoes, and other plants have also indicated that O-GlcNAcylation is important for growth regulation. Mammals and insects appear to have only a single gene encoding the catalytic subunit of the OGT. Using Cre-LoxP conditional gene disruption in mice, OGT was shown to be required for the viability of embryonic stem cells. Tissue-targeted disruption in mice and disruption of OGT expression in cell culture have established that O-GlcNAcylation is essential for viability at the single-cell level in many mammalian cell types. Disruption of OGT in the worm C. elegans causes defective carbohydrate metabolism, abnormalities in dauer formation, and reduced life span. In Drosophila, homozygous mutants in the OGT ortholog super sex combs survive for >5 days until the late larval stage, but subsequently die in the pupal cases. Targeted, inducible deletion of OGT in αCAMKII-positive (excitatory) neurons in brains of adult mice results in morbidly obese mice because of defects in satiety, further supporting the roles of O-GlcNAcylation as a nutrient sensor. The highly homologous and conserved nature of OGT among metazoans allows a transgene encoding the human sequence of OGT to be used to rescue OGT null Drosophila melanogaster. Recently, OGA has been disrupted in both C. elegans and mammalian models. Like the OGT null, the C. elegans OGA null has defective carbohydrate metabolism and abnormalities in dauer formation. In contrast to the OGT null, in C. elegans in which OGA has been disrupted, the worms have an extended life span. In murine models, deletion of OGA leads to perinatal lethality, genomic instability and severe epigenetic and metabolic phenotypes. The OGA heterozygous mouse shows widespread changes in transcription and metabolism, and an enhanced dependence on glucose metabolism. Studies from numerous laboratories have described O-GlcNAcylated proteins from virtually all cellular compartments, representing nearly all functional classes of protein (Figure 19.2; Table 19.1). Indeed, recent databases contain more than 6,000 O-GlcNAcylated proteins with more than 7,000 sites mapped (O-GlcNAcAtlas; The O-GlcNAc Database). O-GlcNAc is particularly abundant within the nucleus, in which it occurs on the transcriptional regulatory machinery, including the carboxy-terminal domain (CTD) of the RNA polymerase II catalytic subunit and basal, as well as other, transcription factors, histones, chromatin-modifying proteins, mRNA biogenesis proteins, and DNA methyltransferases. O-GlcNAcylation also appears to be particularly abundant on proteins involved in signaling, stress responses, and energy metabolism. Nearly 90 proteins within the mitochondria are dynamically O-GlcNAcylated, with the highest concentration found within the electron transport chain. O-GlcNAc also occurs on many cytoskeletal regulatory proteins, such as those regulating actin assembly (e.g., vinculin, talin, vimentin, and ankyrin) and tubulin assembly (e.g., MAPs, dynein, and tau). Even α-tubulin itself is dynamically modified by O-GlcNAc, but the stoichiometry appears to be low. Intermediate filaments, such as cytokeratins and neurofilaments in brain, are also heavily modified by O-GlcNAc. Site-mapping studies have shown that protein kinases and OGT can often modify the same serine and threonine residues, suggesting that a complex interplay exists between these two posttranslational modifications that fine-tunes signal transduction networks. In fact, major enzymes that remove O-phosphate, protein phosphatase 1 β and γ, are in a dynamic complex with OGT, suggesting that in many cases the same enzyme complex both removes O-phosphate and concomitantly attaches O-GlcNAc (Figure 19.1).'
 'Notably, the HAT domain lacks the motif required for binding acetyl-CoA, indicating it lacks HAT enzymatic activity. Like OGT, OGA is thought to be regulated by its protein interactors, posttranslational modifications, and localization. OGA can be efficiently inhibited in vitro and in vivo by a panel of highly effective inhibitors. Although many inhibitors display some cross-reactivity toward the lysosomal hexosaminidases, GlcNAcstatin B and Thiamet-G are selective for OGA. Unlike the relatively static nature of mature N- and O-glycans on glycoproteins, O-GlcNAc cycles rapidly on and off most substrates. Early studies showed that mitogen or antigen activation of lymphocytes rapidly decreased O-GlcNAcylation of many cytoplasmic proteins, but concomitantly increased O-GlcNAcylation of many nuclear proteins. Likewise, neutrophils were shown to rapidly modulate O-GlcNAcylation of several proteins in response to chemotactic agents. Recently, changes in O-GlcNAc cycling have been shown in response to cellular stress, the cell cycle, developmental stages, neuron depolarization, nutrient sensing, and insulin signaling. Pulse-chase analyses have revealed that O-GlcNAc residues on small heat-shock protein in the lens (α-crystallin) and on intermediate filament proteins (cytokeratins) turn over more rapidly than the polypeptide chains to which they are attached. These observations suggest that O-GlcNAc is a regulatory posttranslational modification analogous to phosphorylation. To date, nucleocytoplasmic O-β-GlcNAc has been found in all multicellular organisms investigated, ranging from filamentous fungi, worms, insects, and plants to humans. However, to date no OGA ortholog has been identified in plants or protozoans. Plants encode two OGT paralogs: SECRET AGENT (SEC) and SPY. Curiously, whereas SEC encodes an O-GlcNAc transferase, SPY encodes a fucosyltransferase. Notably, the SPY paralog in Dictyostelium discoideum, Giardia lamblia, Cryptosporidium parvum, and Toxoplasma gondii also fucosylates proteins. To date, O-GlcNAc and the enzymes that control its cycling do not appear to exist in yeast, such as Saccharomyces cerevisiae or Schizosaccharomyces pombe. However, recently, it was discovered that S. cerevisiae have O-mannose moieties on the same proteins and at the same sites on which O-GlcNAc is found in multicellular organisms. Recent data suggest that the O-GlcNAc modification is also found in a subset of prokaryotes, such as Listeria monocytogenes. It is currently unclear if the enzymes responsible for this modification are related to OGT or EOGT. O-GlcNAc-modified proteins have also been found on many viruses that infect metazoans (e.g., adenovirus, SV40, cytomegalovirus, rotavirus, baculovirus, plum pox, HIV, and others). In viruses, instead of being localized on the outside capsid of the virus in which “classical” N- or O-glycans are found (Chapter 42), O-GlcNAc is found deep within the viruses, on tegument and other regulatory proteins, close to the nucleic acid components. Genetic and subsequent biochemical studies in Arabidopsis thaliana showed that the gene SEC regulates growth hormone (gibberellic acid) signaling, and later studies established that SEC encodes an O-β-GlcNAc transferase. Mutations in SEC cause severe growth phenotypes, but they are not lethal. Interestingly, simultaneous mutation of SEC and the paralogous SPY gene, which encodes an OGT-related fucosyltransferase, is lethal. Studies in rice, potatoes, and other plants have also indicated that O-GlcNAcylation is important for growth regulation. Mammals and insects appear to have only a single gene encoding the catalytic subunit of the OGT.'
 'In addition to catalyzing O-GlcNAcylation, OGT also has the remarkable ability to proteolytically cleave HCF-1, a transcription factor regulating the cell cycle. HCF-1 binds to the TPRs positioning the cleavage site at the active site of OGT. Cleavage occurs between cysteine and glutamate residues, yielding a pyroglutamate. The cleavage site glutamate is converted to serine, which is then O-GlcNAcylated. The cleavage reaction requires UDP-GlcNAc at the active site, which participates in the mechanism. The regulation of OGT is quite complex and still not well-understood. OGT is itself O-GlcNAcylated and also tyrosine-phosphorylated (Figure 19.3). Tyrosine phosphorylation appears to activate the enzyme, but the role of O-GlcNAc on OGT is not yet clear. Recent studies suggest that OGT is also targeted and regulated by Ser/Thr phosphorylation; AMPK, CAMKIV, CAMKII, and GSK3β have been reported to modify OGT, altering either the localization or activity of the enzyme. Purified or recombinant OGT modifies small synthetic peptides based on known sites from O-GlcNAcylated proteins, but OGT appears to require accessory proteins to modify many full-length protein substrates efficiently. The high-energy nucleotide sugar used by OGT is UDP-GlcNAc, which is synthesized by the hexosamine biosynthetic pathway (HBP). Increased flux through the HBP, a result of increased glucose levels or certain upstream stimuli, such as the unfolded protein response, has been shown to modulate O-GlcNAc levels (Figure 19.4). On transfer of GlcNAc to proteins, UDP is released, which is a potent feedback inhibitor of OGT. Under conditions in which UDP is rapidly removed (as occurs within the cell), OGT activity is dependent on the UDP-GlcNAc level over a remarkable range of concentrations (from the low nm range to >50 mm). Of note, the substrate specificity of OGT appears to change at different UDP-GlcNAc concentrations, suggesting that OGT regulates cellular processes in a manner dependent on nutritional status. Elevating O-GlcNAc blocks insulin signaling at many points. Glucose flux via glucose transporters (e.g., GLUT4 in insulin-sensitive cells) through the hexosamine biosynthetic pathway (HBP; which accounts for 2%–5% of total glucose usage) leads (more...) Nucleocytoplasmic OGA (EC 3.2.1.169) was first identified as a neutral cytosolic hexosaminidase (referred to as “hexosaminidase C”). OGA was purified from rat kidney and bovine brain, and the human gene was cloned using peptide sequence information. The OGA gene was found to be identical to MGEA5, a putative hyaluronidase genetically identified because of its association with meningiomas. There are two well-characterized isoforms of OGA (short and full-length), which appear to arise from alternative splicing. Short OGA is identical to full-length OGA (916 amino acids) for the first 662 amino acids but possesses an alternative carboxy-terminal sequence 15 amino acids in length. Sequence and structural analyses reveal that OGA contains an amino-terminal hexosaminidase domain and a carboxy-terminal domain, with homology to GCN5 histone acetyltransferases (HAT), separated by an intervening sequence. OGA forms an unusual arm-in-arm homodimer that is mediated by a helix within the intervening sequence. Dimerization is critical for activity and the formation of a substrate binding cleft. Notably, the HAT domain lacks the motif required for binding acetyl-CoA, indicating it lacks HAT enzymatic activity. Like OGT, OGA is thought to be regulated by its protein interactors, posttranslational modifications, and localization. OGA can be efficiently inhibited in vitro and in vivo by a panel of highly effective inhibitors. Although many inhibitors display some cross-reactivity toward the lysosomal hexosaminidases, GlcNAcstatin B and Thiamet-G are selective for OGA.'
 'γ-Proteobacteria, such as Haemophilus influenzae, Yersinia enterocolitica, and Actinobacillus pleuropneumoniae, possess a nontraditional cytoplasmic pathway for N-glycosylation that does not involve assembly of oligosaccharides on a lipid-linked intermediate, but instead transfers single glycan moieties to proteins from nucleotide-activated precursors. The soluble GTs (NGTs) required for N-glycosylation in these organisms are also completely unrelated to the conventional STT3-orthologous OTases, yet prefer the eukaryotic sequon, N-X-S/T. H. influenzae N-glycosylates its autotransporter adhesion HMW1 with single glucose and galactose residues. In contrast, Shewanella oneidensis, Pseudomonas aeruginosa, and N. meningitidis add rhamnose to Arg32 of their polyproline specific elongation factor to rescue stalled ribosomes. In addition to N-glycosylation, bacteria possess both canonical and noncanonical pathways for O-glycosylation. For the O-glycosylation system that mirrors the process in eukaryotes, both Gram-positive and Gram-negative bacteria use nucleotide-activated sugars and soluble GTs in the cytoplasm to modify serine and threonine residues on specific proteins, particularly surface structures, such as flagella, pili, and adhesins. Pseudaminic acids, legionaminic acids, and related nonulosonic sugars are common monosaccharides attached by C. jejuni, Helicobacter pylori, and Aeromonas caviae to their flagella and these modifications are essential for filament assembly and bacterial motility. The noncanonical pathway for O-glycosylation in Gram-negative bacteria involves glycosyltransferase assembly of nucleotide-activated sugars onto undecaprenylphosphate, flipping of the completed oligosaccharide en bloc across the inner membrane into the periplasm, and addition of glycans onto S/T residues by a general OTase. This alternate pathway has been thoroughly characterized in Neisseria species, in which multiple proteins (including pilin) are glycosylated with an oligosaccharide containing diNAcBac (or variants such as glyceramidoacetamidotrideoxyhexose or diacetamidodideoxyglucopyranose) at the reducing end, the same carbohydrate attached to Asn residues by the C. jejuni N-glycosylation pathway. Gram-positive bacteria lack surface LPS, but many instead possess a regular array of glycoproteins known as S-layer proteins. The oligosaccharides on these S-layer proteins are also first assembled onto an undecaprenylphosphate carrier and subsequently added onto S/T residues of these proteins, but can also be coupled to hydroxyl groups of tyrosine residues. Bacteria encounter extreme differences in osmolarity in the environment (and must withstand up to 6 atmospheres of turgor pressure!) and have thus evolved both physical and chemical mechanisms to resist disruption. Peptidoglycan, as discussed earlier, provides a structural barrier to osmotic swelling. In many α-, β-, and γ-proteobacteria, a chemical mechanism also exists to protect the inner membrane. In these Gram-negative organisms, osmoregulated periplasmic glucans (OPGs; previously known as membrane-derived oligosaccharides [MDOs]) contribute to an osmotic buffer. These compounds constitute up to 5% of the dry weight of E. coli, and their synthesis is induced by low osmotic conditions. These characteristics are similar to the production of fOS derived from the N-glycosylation pathways of Campylobacter species, which lack normal OPGs. OPGs were first discovered during analysis of Agrobacterium tumefaciens culture supernatants and rediscovered in studies of phospholipid turnover in E. coli, which showed that the polar head groups of phosphatidylglycerol were transferred to low-molecular-weight, water-soluble oligosaccharides (and thus named MDOs). Other organisms, including Pseudomonas, Rhizobia, Brucella, and Salmonella, also make these compounds.']","Highly conserved homologs of OGT and OFT are found in numerous bacterial genomes, although studies of their functional roles are essentially nonexistent. These bacterial homologs likely play important roles in posttranslational modifications and glycosylation processes within bacterial cells, similar to their counterparts in eukaryotic organisms. Further research is needed to elucidate the specific functions and significance of these bacterial OGT and OFT homologs in cellular physiology and disease progression.","An example of bacterial monoglycosylation that leads to a known function comes from the EF-P protein, the bacterial homolog of eukaryotic elongation initiation factor 5a. In some bacteria, EF-P suppresses translational stalling by a mechanism that involves oxidation of a critical lysyl residue, and its eukaryotic ortholog is regulated by hypusylation. A recent phylogenetic analysis of EF-P sequences revealed a subset of enzymes with an Arg in place of Lys, and a coevolving gene that was subsequently identified by biochemistry and mass spectrometry as an argininyl rhamnosyltransferase. Assembly of the Rha-Arg linkage activates EF-P and is required for pathogenicity of Pseudomonas, a Gram-negative, opportunistic human pathogen, and a number of other bacteria. The discovery of this linkage by a phylogenetic approach suggests that more noncanonical examples of glycosylation are yet to be discovered.",0.0,0.8821759711210083,0.5538215932253752,0.00819672131147541,0.99999999998,1.0
"Complete the following paragraph: OGA was purified from rat kidney and bovine brain, and the human gene was cloned using peptide sequence information. The OGA gene was found to be identical to MGEA5, a putative hyaluronidase genetically identified because of its association with meningiomas. There are two well-characterized isoforms of OGA (short and full-length), which appear to arise from alternative splicing.","['In addition to catalyzing O-GlcNAcylation, OGT also has the remarkable ability to proteolytically cleave HCF-1, a transcription factor regulating the cell cycle. HCF-1 binds to the TPRs positioning the cleavage site at the active site of OGT. Cleavage occurs between cysteine and glutamate residues, yielding a pyroglutamate. The cleavage site glutamate is converted to serine, which is then O-GlcNAcylated. The cleavage reaction requires UDP-GlcNAc at the active site, which participates in the mechanism. The regulation of OGT is quite complex and still not well-understood. OGT is itself O-GlcNAcylated and also tyrosine-phosphorylated (Figure 19.3). Tyrosine phosphorylation appears to activate the enzyme, but the role of O-GlcNAc on OGT is not yet clear. Recent studies suggest that OGT is also targeted and regulated by Ser/Thr phosphorylation; AMPK, CAMKIV, CAMKII, and GSK3β have been reported to modify OGT, altering either the localization or activity of the enzyme. Purified or recombinant OGT modifies small synthetic peptides based on known sites from O-GlcNAcylated proteins, but OGT appears to require accessory proteins to modify many full-length protein substrates efficiently. The high-energy nucleotide sugar used by OGT is UDP-GlcNAc, which is synthesized by the hexosamine biosynthetic pathway (HBP). Increased flux through the HBP, a result of increased glucose levels or certain upstream stimuli, such as the unfolded protein response, has been shown to modulate O-GlcNAc levels (Figure 19.4). On transfer of GlcNAc to proteins, UDP is released, which is a potent feedback inhibitor of OGT. Under conditions in which UDP is rapidly removed (as occurs within the cell), OGT activity is dependent on the UDP-GlcNAc level over a remarkable range of concentrations (from the low nm range to >50 mm). Of note, the substrate specificity of OGT appears to change at different UDP-GlcNAc concentrations, suggesting that OGT regulates cellular processes in a manner dependent on nutritional status. Elevating O-GlcNAc blocks insulin signaling at many points. Glucose flux via glucose transporters (e.g., GLUT4 in insulin-sensitive cells) through the hexosamine biosynthetic pathway (HBP; which accounts for 2%–5% of total glucose usage) leads (more...) Nucleocytoplasmic OGA (EC 3.2.1.169) was first identified as a neutral cytosolic hexosaminidase (referred to as “hexosaminidase C”). OGA was purified from rat kidney and bovine brain, and the human gene was cloned using peptide sequence information. The OGA gene was found to be identical to MGEA5, a putative hyaluronidase genetically identified because of its association with meningiomas. There are two well-characterized isoforms of OGA (short and full-length), which appear to arise from alternative splicing. Short OGA is identical to full-length OGA (916 amino acids) for the first 662 amino acids but possesses an alternative carboxy-terminal sequence 15 amino acids in length. Sequence and structural analyses reveal that OGA contains an amino-terminal hexosaminidase domain and a carboxy-terminal domain, with homology to GCN5 histone acetyltransferases (HAT), separated by an intervening sequence. OGA forms an unusual arm-in-arm homodimer that is mediated by a helix within the intervening sequence. Dimerization is critical for activity and the formation of a substrate binding cleft. Notably, the HAT domain lacks the motif required for binding acetyl-CoA, indicating it lacks HAT enzymatic activity. Like OGT, OGA is thought to be regulated by its protein interactors, posttranslational modifications, and localization. OGA can be efficiently inhibited in vitro and in vivo by a panel of highly effective inhibitors. Although many inhibitors display some cross-reactivity toward the lysosomal hexosaminidases, GlcNAcstatin B and Thiamet-G are selective for OGA.'
 ""In addition, both OGT and OGA are modified by both tyrosine and serine/threonine phosphorylation, nitrosylation, ubiquitination, and O-GlcNAcylation. Functions for some of these posttranslational modifications have been identified, including substrate targeting, altering protein localization, and altering specific activity. Notably, cellular O-GlcNAc levels control the maturation of OGT and OGA mRNA and, in turn, the abundance of each enzyme. Thus, when O-GlcNAc levels are elevated, OGT abundance is depressed and OGA abundance augmented. In contrast, in response to low levels of O-GlcNAc, OGA abundance is depressed, and OGT levels are augmented. O-GlcNAc transferase (OGT) is regulated by multiple complex mechanisms, including transcriptional regulation of its expression, differential mRNA splicing, proteolytic processing, posttranslational modification, and multimerization with itself and other (more...) OGT (uridine diphospho-N-acetylglucosamine: polypeptide β-N-acetylglucosaminyltransferase; EC 2.4.1.255) catalyzes the addition of N-acetylglucosamine from UDP-GlcNAc to specific serine or threonine residues to form a β-O-glycosidic linkage. The enzyme was first identified and purified from rat liver and subsequently cloned from rat, human, Caenorhabditis elegans, and other organisms. OGT resides on the X chromosome (Xq13 in humans) near the centromere and is among the most highly conserved proteins from worms to man. Mutations in OGT, both in its tetratricopeptide repeats (TPRs) and in its catalytic domain, cause X-linked intellectual disability in humans. To date, three isoforms of OGT have been well characterized: (1) the nucleocytoplasmic or full-length variant (ncOGT), which is 110 kDa; (2) a short isoform of OGT (sOGT), which is 78 kDa; and (3) a variant of OGT that is targeted to the mitochondria (mOGT; ∼90 kDa). In the nucleus and cytoplasm, OGT appears to form multimers, consisting of one or more 110-kDa subunits and 78-kDa subunits. Several useful small molecule inhibitors of OGT have been developed, including OSMI-4b, Ac45SGlcNAc, and 5SGlcNHex, with the latter effective in animal models. However, some off-target effects have been reported for these inhibitors, likely because they impact other enzymes that use UDP-GlcNAc. ncOGT has two distinct domains separated by a putative nuclear localization sequence. The amino terminus of each OGT subunit contains TPRs, which can number up to 13 (species-dependent). The major variation between the three (above) variants is in the number of the TPRs. The crystal structure of the human TPR domain of ncOGT shows that the repeats occur as stacked α-helical domains, forming a “tube-like” structure with a remarkable structural similarity to the armadillo repeat domain of the nuclear transport protein importin-α. The TPR domain mediates multimerization of OGT subunits and acts as a scaffold for protein–protein interactions, including protein substrates (Figure 19.3). OGT's glycosyltransfer reaction occurs by an ordered bi–bi mechanism with UDP-GlcNAc binding first. The TPR domains are required for substrate binding, enzymatic activity, and stability. Recent studies have demonstrated that residues in the TPR domain are critical for interactions with substrates. Such findings likely underpin the observation that there is no strict consensus motif that dictates glycosylation by OGT, although valine and alanine are preferred at the –3 and +2 positions, respectively, and there is a preference for aromatic residues at –4 position. In addition to catalyzing O-GlcNAcylation, OGT also has the remarkable ability to proteolytically cleave HCF-1, a transcription factor regulating the cell cycle. HCF-1 binds to the TPRs positioning the cleavage site at the active site of OGT.""
 'Notably, the HAT domain lacks the motif required for binding acetyl-CoA, indicating it lacks HAT enzymatic activity. Like OGT, OGA is thought to be regulated by its protein interactors, posttranslational modifications, and localization. OGA can be efficiently inhibited in vitro and in vivo by a panel of highly effective inhibitors. Although many inhibitors display some cross-reactivity toward the lysosomal hexosaminidases, GlcNAcstatin B and Thiamet-G are selective for OGA. Unlike the relatively static nature of mature N- and O-glycans on glycoproteins, O-GlcNAc cycles rapidly on and off most substrates. Early studies showed that mitogen or antigen activation of lymphocytes rapidly decreased O-GlcNAcylation of many cytoplasmic proteins, but concomitantly increased O-GlcNAcylation of many nuclear proteins. Likewise, neutrophils were shown to rapidly modulate O-GlcNAcylation of several proteins in response to chemotactic agents. Recently, changes in O-GlcNAc cycling have been shown in response to cellular stress, the cell cycle, developmental stages, neuron depolarization, nutrient sensing, and insulin signaling. Pulse-chase analyses have revealed that O-GlcNAc residues on small heat-shock protein in the lens (α-crystallin) and on intermediate filament proteins (cytokeratins) turn over more rapidly than the polypeptide chains to which they are attached. These observations suggest that O-GlcNAc is a regulatory posttranslational modification analogous to phosphorylation. To date, nucleocytoplasmic O-β-GlcNAc has been found in all multicellular organisms investigated, ranging from filamentous fungi, worms, insects, and plants to humans. However, to date no OGA ortholog has been identified in plants or protozoans. Plants encode two OGT paralogs: SECRET AGENT (SEC) and SPY. Curiously, whereas SEC encodes an O-GlcNAc transferase, SPY encodes a fucosyltransferase. Notably, the SPY paralog in Dictyostelium discoideum, Giardia lamblia, Cryptosporidium parvum, and Toxoplasma gondii also fucosylates proteins. To date, O-GlcNAc and the enzymes that control its cycling do not appear to exist in yeast, such as Saccharomyces cerevisiae or Schizosaccharomyces pombe. However, recently, it was discovered that S. cerevisiae have O-mannose moieties on the same proteins and at the same sites on which O-GlcNAc is found in multicellular organisms. Recent data suggest that the O-GlcNAc modification is also found in a subset of prokaryotes, such as Listeria monocytogenes. It is currently unclear if the enzymes responsible for this modification are related to OGT or EOGT. O-GlcNAc-modified proteins have also been found on many viruses that infect metazoans (e.g., adenovirus, SV40, cytomegalovirus, rotavirus, baculovirus, plum pox, HIV, and others). In viruses, instead of being localized on the outside capsid of the virus in which “classical” N- or O-glycans are found (Chapter 42), O-GlcNAc is found deep within the viruses, on tegument and other regulatory proteins, close to the nucleic acid components. Genetic and subsequent biochemical studies in Arabidopsis thaliana showed that the gene SEC regulates growth hormone (gibberellic acid) signaling, and later studies established that SEC encodes an O-β-GlcNAc transferase. Mutations in SEC cause severe growth phenotypes, but they are not lethal. Interestingly, simultaneous mutation of SEC and the paralogous SPY gene, which encodes an OGT-related fucosyltransferase, is lethal. Studies in rice, potatoes, and other plants have also indicated that O-GlcNAcylation is important for growth regulation. Mammals and insects appear to have only a single gene encoding the catalytic subunit of the OGT.'
 'Mutations in SEC cause severe growth phenotypes, but they are not lethal. Interestingly, simultaneous mutation of SEC and the paralogous SPY gene, which encodes an OGT-related fucosyltransferase, is lethal. Studies in rice, potatoes, and other plants have also indicated that O-GlcNAcylation is important for growth regulation. Mammals and insects appear to have only a single gene encoding the catalytic subunit of the OGT. Using Cre-LoxP conditional gene disruption in mice, OGT was shown to be required for the viability of embryonic stem cells. Tissue-targeted disruption in mice and disruption of OGT expression in cell culture have established that O-GlcNAcylation is essential for viability at the single-cell level in many mammalian cell types. Disruption of OGT in the worm C. elegans causes defective carbohydrate metabolism, abnormalities in dauer formation, and reduced life span. In Drosophila, homozygous mutants in the OGT ortholog super sex combs survive for >5 days until the late larval stage, but subsequently die in the pupal cases. Targeted, inducible deletion of OGT in αCAMKII-positive (excitatory) neurons in brains of adult mice results in morbidly obese mice because of defects in satiety, further supporting the roles of O-GlcNAcylation as a nutrient sensor. The highly homologous and conserved nature of OGT among metazoans allows a transgene encoding the human sequence of OGT to be used to rescue OGT null Drosophila melanogaster. Recently, OGA has been disrupted in both C. elegans and mammalian models. Like the OGT null, the C. elegans OGA null has defective carbohydrate metabolism and abnormalities in dauer formation. In contrast to the OGT null, in C. elegans in which OGA has been disrupted, the worms have an extended life span. In murine models, deletion of OGA leads to perinatal lethality, genomic instability and severe epigenetic and metabolic phenotypes. The OGA heterozygous mouse shows widespread changes in transcription and metabolism, and an enhanced dependence on glucose metabolism. Studies from numerous laboratories have described O-GlcNAcylated proteins from virtually all cellular compartments, representing nearly all functional classes of protein (Figure 19.2; Table 19.1). Indeed, recent databases contain more than 6,000 O-GlcNAcylated proteins with more than 7,000 sites mapped (O-GlcNAcAtlas; The O-GlcNAc Database). O-GlcNAc is particularly abundant within the nucleus, in which it occurs on the transcriptional regulatory machinery, including the carboxy-terminal domain (CTD) of the RNA polymerase II catalytic subunit and basal, as well as other, transcription factors, histones, chromatin-modifying proteins, mRNA biogenesis proteins, and DNA methyltransferases. O-GlcNAcylation also appears to be particularly abundant on proteins involved in signaling, stress responses, and energy metabolism. Nearly 90 proteins within the mitochondria are dynamically O-GlcNAcylated, with the highest concentration found within the electron transport chain. O-GlcNAc also occurs on many cytoskeletal regulatory proteins, such as those regulating actin assembly (e.g., vinculin, talin, vimentin, and ankyrin) and tubulin assembly (e.g., MAPs, dynein, and tau). Even α-tubulin itself is dynamically modified by O-GlcNAc, but the stoichiometry appears to be low. Intermediate filaments, such as cytokeratins and neurofilaments in brain, are also heavily modified by O-GlcNAc. Site-mapping studies have shown that protein kinases and OGT can often modify the same serine and threonine residues, suggesting that a complex interplay exists between these two posttranslational modifications that fine-tunes signal transduction networks. In fact, major enzymes that remove O-phosphate, protein phosphatase 1 β and γ, are in a dynamic complex with OGT, suggesting that in many cases the same enzyme complex both removes O-phosphate and concomitantly attaches O-GlcNAc (Figure 19.1).'
 'The enzyme that catalyzes the addition of O-GlcNAc to EGF repeats (EOGT) is located in the endoplasmic reticulum (ER) and is closely related to the enzymes that catalyze mucin-like glycosylation, but not the O-GlcNAc transferase (OGT; catalyzes the addition of O-GlcNAc). Unlike intracellular O-GlcNAcylation, modification of EGF repeats by O-GlcNAc is static and can be extended by the addition of galactose. Recent studies show that O-GlcNAc is found on thousands of nuclear, mitochondrial, and cytoplasmic proteins, including many heavily studied proteins such as RNA polymerase II, histones, and ribosomal proteins (Figure 19.2; Table 19.1). Yet, although phosphorylation was discovered in 1954, O-GlcNAc was not discovered until 1983. So why did O-GlcNAc remain undetected for so long? First, the long-standing dogma was that glycosylation (other than glycogen storage) did not occur with the nucleocytosolic compartment. Second, unlike charged modifications (e.g., phosphate), addition and removal of O-GlcNAc generally does not affect the migration of polypeptides on SDS-PAGE (sodium dodecyl sulfate polyacrylamide gel electrophoresis). A small shift in protein migration might be seen if the O-GlcNAc residues are highly clustered or if the protein is extensively O-GlcNAcylated at multiple sites (e.g., p62 nuclear pore protein). Third, all cells contain high levels of hydrolases, including abundant lysosomal hexosaminidases and nucleocytoplasmic β-N-acetylglucosaminidases, that rapidly remove O-GlcNAc from intracellular proteins when the cell is damaged or lysed. Thus, O-GlcNAc is often lost during the isolation of a protein. Finally, O-GlcNAc is particularly difficult to detect by physical techniques, such as mass spectrometry, because it often occurs at substoichiometric amounts on a protein and is readily lost during the ionization process in a mass spectrometer. In both electrospray ionization (ESI) mass spectrometry and matrix-assisted laser desorption time of flight (MALDI-TOF) mass spectrometry analyses of a mixture of unmodified and O-GlcNAc-modified peptides, not only is the O-GlcNAc lost during ionization but the signal from the O-GlcNAc-modified peptides that remain is suppressed by the presence of the unmodified peptide. Our ability to detect O-GlcNAc has been improved in recent years by the development of monoclonal antibodies, lectins and mutant glycoside hydrolases that bind O-GlcNAc, the use of “click chemistry” compatible sugars (Chapters 51 and 56), and the invention of more sophisticated mass spectrometric techniques, such as electron transfer dissociation (ETD) mass spectrometry. In mammals, the dynamic cycling of O-GlcNAc on proteins is regulated by the concerted actions of enzymes encoded by just two genes: OGT and a neutral β-hexosaminidase known as O-GlcNAcase (OGA) (Figure 19.1). The regulation of the transcription start site and alternative splicing results in the synthesis of at least three isoforms of OGT and two isoforms of OGA. Nonetheless, the question remains: “How can so few enzymes specifically glycosylate and deglycosylate so many substrates?” Although both OGT and OGA each have only a single catalytic subunit, they actually exist within the cell as a multitude of different holoenzymes in which their catalytic subunits are noncovalently bound to a myriad of accessory proteins that appear to control their targeting (Figure 19.3). In addition, both OGT and OGA are modified by both tyrosine and serine/threonine phosphorylation, nitrosylation, ubiquitination, and O-GlcNAcylation. Functions for some of these posttranslational modifications have been identified, including substrate targeting, altering protein localization, and altering specific activity.']","OGA was purified from rat kidney and bovine brain, and the human gene was cloned using peptide sequence information. The OGA gene was found to be identical to MGEA5, a putative hyaluronidase genetically identified because of its association with meningiomas. There are two well-characterized isoforms of OGA (short and full-length), which appear to arise from alternative splicing. Short OGA is identical to full-length OGA for the first 662 amino acids but possesses an alternative carboxy-terminal sequence 15 amino acids in length. Sequence and structural analyses reveal that OGA contains an amino-terminal hexosaminidase domain and a carboxy-terminal domain, with homology to GCN5 histone acetyltransferases (HAT), separated by an intervening sequence. OGA forms an unusual arm-in-arm homodimer that is mediated by a helix within the intervening sequence. Dimerization is critical for activity and the formation of a substrate binding cleft.","Short OGA is identical to full-length OGA (916 amino acids) for the first 662 amino acids but possesses an alternative carboxy-terminal sequence 15 amino acids in length. Sequence and structural analyses reveal that OGA contains an amino-terminal hexosaminidase domain and a carboxy-terminal domain, with homology to GCN5 histone acetyltransferases (HAT), separated by an intervening sequence. OGA forms an unusual arm-in-arm homodimer that is mediated by a helix within the intervening sequence. Dimerization is critical for activity and the formation of a substrate binding cleft. Notably, the HAT domain lacks the motif required for binding acetyl-CoA, indicating it lacks HAT enzymatic activity. Like OGT, OGA is thought to be regulated by its protein interactors, posttranslational modifications, and localization.",0.9285714285714286,0.7129227915291031,0.8593201716582597,0.01639344262295082,0.99999999998,1.0
"Complete the following paragraph: Giant viruses such as the algae-targeting chlorella virus and members of the amoeba-targeting Mimiviridae family have genomes large enough that they can express their own glycosylation machineries. On a smaller scale, specific viruses express glycosyltransferases as virulence factors.","['To protect its own genome, the phage modifies its DNA by replacing cytosine with 5-hydroxymethylcytosine and subsequently transferring glucose (Glc) to the 5-hydroxymethylcytosine using a specific UDP-Glc:DNA Glc-transferase. The baculovirus enzyme ecdysteroid glucosyltransferase (EGT) disrupts the hormonal balance of the insect host by catalyzing the conjugation of ecdysteroid hormones with Glc or galactose (Gal). Expression of the EGT gene allows the virus to block molting and pupation of infected insect larvae. Similarly, Chloroviruses have enzymes in CAZy family GT4 for the glycosylation of their structural proteins. Serotype conversion in Shigella flexneri is mediated by temperate bacteriophages, which encode GTs that mediate O-antigen conversion by the addition of Glc to O-antigen units. Finally, giant viruses such as Acanthamoeba polyphaga mimivirus encode 12 putative GTs for the synthesis of complex O-glycans. Bacterial GTs play a major role in their symbiosis and virulence. Some bacteria such as Campylobacter are able to N-glycosylate their proteins, but the most universal role for bacterial glycosylation is in the synthesis of cell-wall peptidoglycan, simple glycolipids, lipopolysaccharides, and complex exopolysaccharides (Chapter 21). The GTs involved in peptidoglycan biosynthesis are GT28 MurG, which adds N-acetylglucosamine (GlcNAc) to undecaprenyl diphospho-N-MurNAc, and GT51 MtgA, which polymerizes undecaprenyl diphospho-MurNAc-GlcNAc. Mycobacterium tuberculosis produces an extremely complex envelope that includes all of the above. In bacteria, the role of these glycans is to provide a barrier that affords mechanical, chemical, and biological protection to the cell. Some pathogenic or commensal bacteria produce an outer glycan layer that mimics that of their hosts, in order to evade host immune surveillance (Chapters 15 and 42). Pasteurella multocida produces a thick hyaluronan capsule. Oral streptococci produce two GTs for adhesion and virulence, and the EPax GT enables colonization of the gut by Enterococcus faecalis. Other pathogens such as Escherichia coli K1 and Neisseria meningitidis produce a poly α2–8 sialic acid capsule. Mammalian gut bacteria produce capsular polysaccharides thought to help the maturation of the host immune system. Archaea devote ∼1% of their genes to GTs but, on average, devote only 0.25% to GHs, and there is almost no correlation with the number of GH genes and the overall number of genes. Surprisingly, ∼20% of sequenced archaeal genomes appear to be completely devoid of GHs. The most striking example is Methanosphaera stadtmanae, whose genome encodes at least 43 GTs but apparently no GHs. This is not due to sequence divergence, because GHs are readily detected in some Archaea. These observations suggest that (1) horizontal transfer is likely the determining factor behind archaeal GH repertoires, and (2) the Archaea in question do not recycle glycosidic bonds elaborated by their own GTs. Although they do not make peptidoglycans like bacteria, Archaea use nucleotide-activated oligosaccharides to produce a variety of extracellular polysaccharides such as the heteropolysaccharide “methanochondroitin” made by Methanosarcina barkeri, which resembles eukaryotic chondroitin sulfate (Chapter 17). Archaea also make glycophospholipids and one relevant GT is GDP-Glc:glucosyl-3-phosphoglycerate synthase from family GT81 in Methanococcoides burtonii. In CAZy family GT55, there are several archaeal GDP-Man:mannosyl-3-phosphoglycerate synthases.'
 'Compared to other types of glycans, structural polysaccharides show relatively little variation in evolution, which may indicate a more stringent selection for chemical and mechanical properties required for their functions. Interestingly, some of these structures, such as glycosaminoglycans, can also play nonstructural roles in other biological contexts, including cell signaling, which adds additional selection forces driving their evolution. Viruses typically have minimalist genomes and use host-cell machinery for replication. Thus, glycosylation of enveloped viruses reflects that of the host. However, there are exceptions. Giant viruses such as the algae-targeting chlorella virus and members of the amoeba-targeting Mimiviridae family have genomes large enough that they can express their own glycosylation machineries. On a smaller scale, specific viruses express glycosyltransferases as virulence factors. For instance, a baculovirus-encoded glucosyltransferase glycosylates insect host ecdysteroid hormones to block molting, and bacteriophage-derived glucosyltransferases modify 5-hydroxymethyl cytosine bases in the phage DNA to protect it from bacterial restriction enzymes. Host-derived glycosylation in enveloped viruses is typically extensive and the resulting “glycan shield” protects the virus from immune reactions against the underlying polypeptide. In this regard, it has been suggested that the high frequency of heterozygous states for human congenital disorders of glycosylation (Chapter 44) may reflect selection for genomes that limit glycosylation of invading viruses. Host lectins may also be “hijacked” by glycans on viral surface glycoproteins. For example, Sialoadhesin (Siglec-1; Chapter 15) is used by the heavily sialylated porcine reproductive and respiratory syndrome virus (PRRSV) to gain entry into macrophages. Viral protein sequence can also influence host glycosylation (e.g., by structural constraints on access for glycosyltransferases or hydrolases), in a manner that favors viral antigenicity, such as the high-mannose N-glycans on HIV-1 envelope gp120 trimers. Despite the enormous potential for structural diversity, a rather limited subset of all possible monosaccharides and their possible linkages and modifications are found in eukaryotic cells. Why one encounters only such a limited subset of the possible glycan structures is a puzzling question. Could there be trade-offs between the variety of glycan structures and the additional resources, such as energy and biosynthetic pathways, that cells/organisms need in order to maintain that variety? Or maybe the variety of structures is limited by a combination of positive and negative selection due to both, its intrinsic functions and interactions with symbionts and pathogens? Regardless, this limited subset has allowed better elucidation of structures of eukaryotic glycans. In contrast, Bacteria and Archaea have had several billion additional years to respond to selective pressure from pathogens; in particular, phages. These organisms also have short generation times and can exchange genetic material across vast phylogenetic distances via plasmid-mediated horizontal gene flow. Glycosylation in Bacteria and Archaea is far more diverse, both in terms of the range of monosaccharides used or synthesized, and in the types of linkages and modifications (Chapters 21 and 22). In addition, prokaryotic cell–cell interactions both within and between species are often mediated by glycans. However, most work to date has focused on the glycans of pathogens, and we may have barely scratched the surface of prokaryotic glycan diversity. Despite great differences between pathways generating glycan structures of bacteria and those of vertebrates, occasional microbial surface structures are strikingly similar to those of mammalian cells. Interestingly, most such examples of “molecular mimicry” occur in pathogenic/symbiotic microorganisms, apparently adapting them for better survival in the host by avoiding, reducing, or manipulating host immunity.'
 'Knowledge of the ligand specificity of a GBP is required to assign in vivo functions. In cases in which there is a dearth of information, rational predictions based on the framework and sequence of existing carbohydrate-recognition domains (CRDs) have been found useful. Legume lectins represent a class of GBPs identified decades ago that continues to provide perhaps the best model for protein–glycan recognition. Moreover, discovery of the legume lectin fold (jelly-roll motif) in mammalian lectins, such as galectins (Chapter 36), calnexin, and calreticulin (Chapter 34), highlights the preeminence of this fold in carbohydrate recognition across phylogeny. Earlier work in the identification of monosaccharide-binding specificities of legume lectins provided the framework for finding their relatives in all forms of life (Chapter 32). This approach led to the assignment of glycan specificities for proteins involved in the sorting of vesicular compartments and in glycoprotein folding in the endoplasmic reticulum (ER) and Golgi compartments of mammalian cells (Chapter 39). Of similar importance is the discovery of new galectins in the galectin-10 family and galectin-like proteins in genome databases using similarity searches (Chapter 36). Likewise, Siglecs, a family of sialic acid–binding I-type lectins involved in regulating multiple biological responses (Chapter 35), show signature sequence motifs, and 17 members have been identified in primates to date. It is important to note that the mere presence of a CRD does not necessarily translate into functional glycan-recognizing activity. This is because sequence motifs used to identify CRDs are often found in a functionally inactive, lectin-like, CRD fold (Chapter 34). Glycan microarrays provide a high-throughput means of detecting the interactions of GBPs with the diverse oligosaccharide sequences of glycoproteins, glycolipids, and polysaccharides (Chapter 30). The use of glass slides, microarray printing technology, and surface patterning of engineered glycophages displaying unique carbohydrate epitopes allows the production of glycan microarrays with the potential to examine binding of all types of GBPs (lectins, antiglycan monoclonal or serum antibodies, and glycan-binding cytokines or chemokines) to several thousand unique glycans, simultaneously. Binding is assessed by fluorescent or spectrometric techniques. Glycan microarray data are provided by resources such as the Consortium for Functional Glycomics (http://www.functionalglycomics.org/glycomics/publicdata/primaryscreen.jsp) and the Imperial College Microarray Data Online Portal (https://glycosciences.med.ic.ac.uk/data.html), and several analysis software packages, including GLAD (https://glycotoolkit.com/GLAD/), MotifFinder (https://haablab.vai.org/tools/), MCAW (https://mcawdb.glycoinfo.org/) and CCARL (https://github.com/andrewguy/CCARL). Note that arrays that use different linkers and/or different attachment chemistries can give quite variable results, and the results need to be evaluated in the context of natural binding phenomena. It has long been known that many viruses use host glycans as specific binding receptors for entering the cell (Chapter 37). Similarly, several viruses encode lytic enzymes that break down host cell surface glycans to release viral particles after viral replication. Genome sequencing reveals that many double-stranded DNA viruses also take advantage by adding sugars to host glycoproteins through the use of viral GTs (Chapter 42). Although biological roles of viral GTs are poorly understood, some functions have been identified. For example, the T4 bacteriophage encodes nucleases that degrade host cell DNA. To protect its own genome, the phage modifies its DNA by replacing cytosine with 5-hydroxymethylcytosine and subsequently transferring glucose (Glc) to the 5-hydroxymethylcytosine using a specific UDP-Glc:DNA Glc-transferase. The baculovirus enzyme ecdysteroid glucosyltransferase (EGT) disrupts the hormonal balance of the insect host by catalyzing the conjugation of ecdysteroid hormones with Glc or galactose (Gal).'
 'These secreted toxins show the remarkable ability of translocating across the surface membrane into the cytoplasm of mammalian target cells. The enterotoxins from Clostridium difficile (ToxA) and Clostridium sordellii are α-glucosyltransferases from CAZy family GT44 that use UDP-glucose (UDP-Glc) as the donor. In contrast, a similar toxin from Clostridium novyi is an O-αGlcNAc transferase that uses UDP-GlcNAc as the donor. The C. novyi toxin has no primary sequence relationship to host glycosyltransferases. A distantly related toxin from Legionella pneumophila, also delivered by a type IV secretion system, installs an αGlc residue on elongation factor 1A in a broad range of eukaryotic host cells. The target residue, Ser53, is located in the G domain near the switch-1 region of the GTPase, and glucosylation inhibits its activity in vitro and in vivo. The recent discovery of a new effector glucosyltransferase, LtpM, shows that this is an expanding field of glycosyltransferase discovery. Interestingly, an unrelated toxin from Yersinia, which enters host cells via a phage tail-derived translocation system, was found to be an αGlcNAc-transferase that modifies Tyr-34 of RhoA. Typically, the sugar–amino acid linkage is not recognized by endogenous glycosidases, allowing the pathogen to irreversibly alter the function of the target—typically a GTPase domain. Other Gram-negative bacteria use a type 3 secretion system to inject virulence factors that mediate a different form of monoglycosylation: GlcNAcα-Arg. This novel reaction is catalyzed by NleB-related glycosyltransferases that promote host-cell longevity during infection. NleB and NleB orthologs target arginine side-chains within death domains of death receptors and associated proteins TRADD, FADD, RIPK1, and TNFR1. Importantly, these factors all work to attenuate NF-κB signaling to dampen host-cell antibacterial and inflammatory responses. Furthermore, various components of glucose metabolism such as GAPDH (glyceraldehyde 3-phosphate dehydrogenase) and HIF-1α are also targeted to reduced NF-κB signaling. Although these examples involve monoglycosylation mediated by exogenous glycosyltransferases (see Table 18.1), their existence reinforces the potential impact of glycosylation as a regulatory mechanism, and the diversity of glycosylation events that probably remain to be discovered. Although the focus of this chapter is on nuclear and cytoplasmic glycoproteins, it should be noted that specific bases in DNA have long been known to be a target of bacteriophage-encoded glycosyltransferases. Modification of T4-phage DNA hydroxymethylcytosine residues by βGlcTs or αGlcTs (Table 18.1) aids in the distinction of native and foreign DNA, rendering them resistant to host restriction enzyme digestion and impairing a subset of CRISPR/Cas systems. The use of Glc disaccharide, arabinose, and other sugar modifications of bases suggests that the full diversity of sugar modifications remains to be described. A related modification occurs in a protist, Trypanosoma brucei, in the form of base J. Using a mechanism resembling Skp1 glycosylation (vide infra), DNA thymidine residues are initially hydroxylated by an O2-dependent nonheme dioxygenase generating hydroxymethyl moieties suitable for glycosylation by a novel nuclear β-glucosyltransferase, JGT, a CAZy GT2 glycosyltransferase (Table 18.1). Base J influences Pol II termination by recruiting a complex containing protein phosphatase 1 to dephosphorylate RNA polymerase II. Disruption in complex formation affects polycistronic transcription termination in the wider group of kinetoplastids. Complex glycans, consisting of more than a single sugar, have also been reported in the nucleocytoplasmic compartment (Figure 18.1B).'
 'Influenza-C virions (and many coronaviruses) contain a single “hemagglutinin-esterase” that possesses both hemagglutinin and receptor-destroying activities, which in this case is an esterase that cleaves the 9-O-acetyl group from the target O-acetylated sialic acid receptors (Table 37.1). Some coronaviruses have evolved to adapt the spike “S” proteins to target O-acetylated sialic acid receptors. The severe acute respiratory syndrome coronavirus 2 (SARS-CoV-2), causative agent of the COVID-19 pandemic, has completely lost its hemagglutinin-esterase protein, but encodes an S protein that has evolved further, to bind more robustly to heparan sulfate (HS) proteoglycans, which can also act as a cofactor facilitating binding to a high-affinity protein receptor ACE2. Rotaviruses, the major killer of children worldwide, can also bind to sialic acid residues. These viruses only bind to the intestinal epithelium of newborn infants during a period that appears to correlate with the expression of specific types and arrangements of sialic acids on glycoproteins. Claims regarding “sialic acid–independent” rotaviruses may be explained by internal sialic acids resistant to bacterial sialidases. Many other viruses (e.g., adenovirus, reovirus, Sendai virus, and polyomavirus) also use sialic acids for infection, and crystal structures are now available for several of their sialic acid–binding domains. A number of viruses, including herpes simplex virus (HSV), foot-and-mouth disease virus, human immunodeficiency virus (HIV), and dengue flavivirus, use heparan sulfate proteoglycans as adhesion receptors (Table 37.1). In many cases, the proteoglycans may be part of a coreceptor system in which viruses make initial contact with a cell-surface proteoglycan and later with another receptor. For example, HSV infection is thought to initially involve the binding of viral glycoproteins gB and/or gC to cell-surface heparan sulfate proteoglycans. Glycoprotein gB promotes virus-cell fusion, syncytium formation (cell–cell fusion), and adherence, whereas gC binds to the C3b component of complement and blocks complement-mediated inhibition of the virus. These events are followed by HSV glycoprotein gD binding to one of several cell-surface receptors, including protein receptors and heparan sulfate, ultimately leading to fusion of the viral envelope with the host-cell plasma membrane. Interestingly, the interaction of gD with heparan sulfate shows specificity for a particular substructure in heparan sulfate containing a 3-O-sulfated glucosamine residue, the formation of which is catalyzed by specific isozymes of the glucosaminyl 3-O-sulfotransferase gene family. Thus, the heparan sulfate–binding adhesins appear to recognize carbohydrate units within the polysaccharide chains as opposed to binding terminal sugars. Dengue flavivirus, the causative agent of dengue hemorrhagic fever, also binds to heparan sulfate. Computational modeling to compare the primary dengue viral envelope protein sequence with the crystal structure of a related virion envelope protein suggests that the heparan sulfate–binding site may lie along a positively charged amino acid groove (Figure 37.2). The recently emerging Zika virus belongs to the same family. Furthermore, HIV can bind heparan sulfate and other sulfated polysaccharides by way of the V3 loop of its gp120 glycoprotein. Two views of a putative heparin sulfate–binding site on the dengue virus envelope protein. The envelope protein monomer is shown in ribbon form, displayed along its longitudinal axis and as an external side view. Note the alignment of positively (more...) Bacterial lectins occur commonly in the form of elongated multisubunit protein appendages, known as fimbriae (hairs) or pili (threads), which interact with glycoprotein and glycolipid receptors on host cells. Similar to viral glycan-binding proteins, adhesin-receptor binding is generally of low affinity.']","This paragraph highlights that giant viruses like the algae-targeting chlorella virus and members of the amoeba-targeting Mimiviridae family have genomes large enough to independently express their glycosylation machineries. Additionally, specific viruses utilize glycosyltransferases as virulence factors, showcasing the diverse strategies employed by viruses in manipulating host-cell interactions through glycosylation mechanisms.","For instance, a baculovirus-encoded glucosyltransferase glycosylates insect host ecdysteroid hormones to block molting, and bacteriophage-derived glucosyltransferases modify 5-hydroxymethyl cytosine bases in the phage DNA to protect it from bacterial restriction enzymes. Host-derived glycosylation in enveloped viruses is typically extensive and the resulting “glycan shield” protects the virus from immune reactions against the underlying polypeptide. In this regard, it has been suggested that the high frequency of heterozygous states for human congenital disorders of glycosylation (Chapter 44) may reflect selection for genomes that limit glycosylation of invading viruses.",0.75,0.6502813266971827,0.701398801110661,0.017391304347826087,0.99999999998,1.0
"Complete the following paragraph: Although the focus of this chapter is on the glycobiology of bacterial cell envelopes, there are several additional (and equally important) facets of bacterial glycobiology. Three of these are briefly mentioned here.","['NCBI Bookshelf. A service of the National Library of Medicine, National Institutes of Health. Varki A, Cummings RD, Esko JD, et al., editors. Essentials of Glycobiology [Internet]. 4th edition. Cold Spring Harbor (NY): Cold Spring Harbor Laboratory Press; 2022.  doi: 10.1101/glycobiology.4e.21 Chris Whitfield, Christine M. Szymanski, Amanda L. Lewis, and Markus Aebi. Glycoconjugates are integral components of the cell surfaces of bacteria and are often the immediate point of contact with the environment. Surface glycoconjugates contribute to the essential permeability barrier properties of the cell envelope, influence both the susceptibility and resistance of bacteria to antibiotics and other harmful compounds, participate in the formation and dispersion of biofilms, act as receptors for bacteriophages, and play pivotal roles in pathogenic and symbiotic host–microbe interactions. Reflecting these many functions, surface glycoconjugates are remarkably diverse, enabled by the propensity for bacterial genetic recombination and lateral gene transfer and shaped by environmental interactions that impart niche-specific selective pressures. Surface glycoconjugates drive a variety of important interactions with host innate and adaptive immune defenses. Some are recognized as pathogen-associated molecular patterns (PAMPs), for example, via Toll-like receptor (TLR)-mediated pathways. Others are natural targets of adaptive immunity and have been exploited in successful vaccine strategies. Because of their importance in cell viability, surface glycoconjugates are also frequent targets of antimicrobial strategies. This chapter will provide an overview of the structure and biosynthesis of glycoconjugates, together with some examples of their functions. Bacteria were historically divided into two major groups based on their response in the Gram-staining procedure (i.e., Gram-positive and Gram-negative organisms), reflecting the organization of the cell wall. The amount and location of peptidoglycan in the cell wall is an important contributor to the outcome of Gram staining. Peptidoglycan is essential for the viability of most bacteria. It consists of polysaccharide strands covalently cross-linked by short peptides, creating a three-dimensional structure that confers shape and rigidity to the cell. In Gram-negative bacteria, such as Escherichia coli, the cell wall consists of two membranes separated by a cellular compartment termed the periplasm in which thin layers of peptidoglycan reside (Figure 21.1). In Gram-positive bacteria, substantially thicker layers of peptidoglycan surround a single membrane and provide an attachment point for other glycan structures. Another class of bacteria, the Negativicutes, are related to the Gram-positive Firmicutes but nevertheless have a two-membrane architecture and stain as Gram-negative. Other bacteria produce variable responses in the Gram-staining reaction, largely because of the presence of other glycans and cell wall lipids (see below). Conceptual organization of the cell envelopes of Gram-negative bacteria, Gram-positive bacteria, and mycobacteria. The schematic comparison of the cell walls (or cell envelopes) of Gram-negative bacteria, Gram-positive bacteria, and mycobacteria illustrates (more...) The periplasm of Gram-negative bacteria contains proteins associated with cell-surface assembly and nutrient uptake but may also contain free oligosaccharides (fOS) that protect against osmotic stress. The outer membrane is an asymmetric lipid bilayer, with an outer leaflet composed mainly of a unique glycolipid called lipopolysaccharide (LPS) that is essential for the integrity of the permeability barrier imposed by the outer membrane. Many Gram-negative bacteria are covered in a surface-bound polysaccharide layer known as a capsule, and, in some cases, this capsular polysaccharide (CPS) is released from the cell in large amounts as free exopolysaccharide (EPS). Bacteria producing these products are often readily identified by their highly mucoid colonies. Structural variations in the LPS and capsules of different bacterial species are diverse and influence many types of interactions between bacteria and their environmental and host niches. Gram-positive bacteria lack the outer membrane (Figure 21.1) and depend on a much thicker multilayered peptidoglycan layer for viability.'
 'Within the biofilm, a combination of the protected environment and altered cell physiology can help protect bacteria from some antimicrobial compounds. Some bacteria may produce multiple EPSs that contribute to biofilms, and their precise structures may be critical for creation of a proper biofilm architecture, as in Pseudomonas. Certain glycan structures appear well adapted to roles in biofilm communities and are, therefore, more widely distributed. Many biofilm-forming bacteria produce PNAG, also known as polysaccharide intercellular adhesin, with this being targeted by small-molecule inhibitor and vaccine strategies to eradicate biofilm bacteria (Figure 21.6). Assembly systems for CPSs and EPSs are broadly divided into three mechanisms that are distinguished (in part) by the nature of the acceptor on which they are built (Figure 21.6). A large variety of CPSs and EPSs use undecaprenol diphosphate-linked intermediates and follow a synthetic pathway indistinguishable from that used by Wzx/Wzy-dependent O-antigens, described above. In fact, some bacteria produce O-antigens and CPSs/EPSs with the same structures. The CPS shares the same early steps in the pathway but instead of ligating the product to lipid A-core, a CPS-dedicated export machinery spanning the periplasm and outer membrane is used. The features that distinguish CPSs and EPSs in this type of assembly process are unknown. In Gram-positive bacteria with Wzx/Wzy-dependent processes, the nascent polysaccharide is then either released as an EPS or transferred from undecaprenol and attached to peptidoglycam, often via a phosphodiester linkage to MurNAc residues. In Streptococci, this may be catalyzed by an enzyme related to those that link WTAs to the same site in peptidoglycan. Several Gram-negative bacteria assemble CPSs using a conserved phosphatidylglycerol-(Kdo)n acceptor. Although prototypes are found in E. coli and N. meningitidis, the system is conserved across a range of mucosal pathogens. Here, polymerization of the lipid-linked glycan is completed in the cytoplasm, after which it is exported via an ABC transporter. The transporter is linked to additional proteins that span the periplasm and outer membrane in a configuration thought to resemble certain drug efflux pumps in bacteria. The final assembly pathway seems to operate independently of a lipid carrier and requires a processive polymerase called a synthase. Examples are found in Gram-positive and Gram-negative bacteria, but seem to be confined to EPSs. The prototypical hyaluronan and cellulose synthases from Streptococci and Gram-negative bacteria show different architectures, yet both are sufficient for both synthesis and export across the cytoplasmic membrane. The molecular details underlying these processes have been resolved by analysis of the crystal structure of the cellulose synthase. In Gram-negative bacteria, a periplasmic scaffold links the synthase to an outer membrane protein channel. Although the focus of this chapter is on the glycobiology of bacterial cell envelopes, there are several additional (and equally important) facets of bacterial glycobiology. Three of these are briefly mentioned here. First, in addition to synthesizing surface structures, bacteria also produce intracellular glycans and cytoplasmic glycosylated proteins and glycolipids. For example, glycogen and trehalose act as storage compounds within some bacteria. Mycobacteria also contain a growing list of unusual glycosylated molecules, which may be related to their ability to withstand a variety of stresses. Second, bacteria produce a wide range of glycan-binding proteins. These include adhesins that facilitate bacterial colonization, exotoxins that bind to host membrane glycans, and single-sugar-binding proteins involved in metabolism (see Chapter 42). Third, bacterial lifestyles are often defined by their capacity to digest and/or metabolize glycans. Complex nanomachines have been described for the degradation of complex carbohydrate structures. Assembling the various enzymes into a highly organized complex affords synergy and efficiency. For example, the roles of glycosyl hydrolases in biomass conversion are well documented (Chapter 59). The cellulose degradation machinery in Clostridioides sp.'
 'Third, bacterial lifestyles are often defined by their capacity to digest and/or metabolize glycans. Complex nanomachines have been described for the degradation of complex carbohydrate structures. Assembling the various enzymes into a highly organized complex affords synergy and efficiency. For example, the roles of glycosyl hydrolases in biomass conversion are well documented (Chapter 59). The cellulose degradation machinery in Clostridioides sp. and other organisms comprises a suite of glycosidases and carbohydrate-binding modules, all assembled into a single surface complex (the cellulosome) via noncatalytic cohesin and dockerin structural modules. Within the gut microbiome, Bacteroidetes encode a remarkable array of carbohydrate-active enzymes in polysaccharide utilization loci, allowing them to adapt to dietary changes by sensing, binding, and degrading different complex substrates, followed by import of the products for catabolism. Indeed, bacteria within the many biomes of the human body derive benefit from foraging, not only on plant polysaccharides, but also on host-derived mucosal glycans. We continue to learn more about the intricate pathways for the digestion, capture, and catabolism of environmental and host carbohydrates. The authors acknowledge contributions to previous versions of this chapter by Jeffrey D. Esko, Tamara L. Doering, and the late Christian Raetz and appreciate helpful comments and suggestions from Graham Heberling and Jerry Eichler.'
 'Bacteria producing these products are often readily identified by their highly mucoid colonies. Structural variations in the LPS and capsules of different bacterial species are diverse and influence many types of interactions between bacteria and their environmental and host niches. Gram-positive bacteria lack the outer membrane (Figure 21.1) and depend on a much thicker multilayered peptidoglycan layer for viability. The Gram-positive cell wall is modified with additional specialized cell wall glycan polymers covalently linked to peptidoglycan (e.g., wall teichoic acids [WTAs]), whereas glycolipids, such as lipoteichoic acids (LTAs), are anchored in the cell membrance. Mycobacteria and related Actinobacteria are not considered to be Gram-positive or Gram-negative, and are instead classified as acid-fast bacteria because they possess distinctive cell walls that confer an aberrant response to the classical Gram-staining procedure. Their complex cell walls have a high content of remarkable glycan and glycolipid structures (Figure 21.1). The unique arabinogalactan (AG) component that characterizes these organisms is covalently attached to peptidoglycan and provides an attachment point for characteristic long-chain (C60–C90) α-alkyl-β-hydroxymycolic acids. The resulting mycolyl-AG-peptidoglycan complex underpins a permeability barrier conferring resistance to antibiotics and other harmful molecules. Mycolic acids help form an envelope layer referred to as an “outer membrane,” although its structure shares no similarity with its namesake in Gram-negative bacteria. Peptidoglycan (also known as murein) forms a rigid sacculus enveloping the cytoplasmic membrane, conferring cell shape, and contributing to the ability of bacteria to resist the effects of internal osmotic (turgor) pressure. Although most bacteria possess peptidoglycan, it is absent in some obligate intracellular pathogens, such as Mycoplasma sp., and can be conditionally expendable in certain bacteria that produce L-forms. Given its distribution, peptidoglycan is recognized by host defenses as a marker of infection. Released peptidoglycan is a PAMP recognized by TLR2 and pattern recognition proteins, such as nucleotide-binding oligomerization domain (NOD)-like receptors (NLRs), to activate an inflammatory response as part of innate immunity. Peptidoglycan makes up ∼10% of the dry weight of the cell wall in Gram-negative bacteria, in which it exists in a structure one to three layers thick. In contrast, Gram-positive bacteria have a thicker cell wall containing 10 to 20 layers of peptidoglycan, representing as much as 20%–25% of the dry weight of the cell. The overall chemical structure of peptidoglycan is similar across bacterial genera (Figure 21.2) and consists of parallel strands of polysaccharides composed of a β1-4-linked disaccharide of N-acetylglucosamine (GlcNAc) and N-acetylmuramic acid (MurNAc). The average chain length of the glycan strands in E. coli is 25–35 disaccharide units but may increase several-fold in Gram-positive bacteria. Adjacent strands are connected to one another via cross-links between short peptide strands attached to the MurNAc residues (Figure 21.2). Individual glycan strands are thought to be arranged parallel to the membrane and the helical conformation of the glycan strands enables cross-linking in three dimensions, within and between layers, to create the functional higher-order structure. Although the amino acid composition varies in different bacteria, the peptides are typically composed of L-Ala, unusual D-amino acids (e.g., D-Glu and D-Ala) and a dibasic amino acid, such as meso-diaminopimelic acid (m-A2pm or m-DAP) or L-Lys, to facilitate the cross-linking. Cross-links may be direct peptide bonds or (in some Gram-positive bacteria) include several amino acids, such as Gly5. This, and the frequency of cross-linking, will have spatial implications for the final meshwork.'
 'NCBI Bookshelf. A service of the National Library of Medicine, National Institutes of Health. Varki A, Cummings RD, Esko JD, et al., editors. Essentials of Glycobiology [Internet]. 4th edition. Cold Spring Harbor (NY): Cold Spring Harbor Laboratory Press; 2022.  doi: 10.1101/glycobiology.4e.1 Ajit Varki and Stuart Kornfeld. This chapter provides a historical background to the field of glycobiology and an overview of this book. General terms found in the volume are considered, common monosaccharide units of glycoconjugates mentioned, and a uniform symbol nomenclature used for structural depictions presented. The major glycan classes discussed in the book are described, and an overview of the general pathways for their biosynthesis is provided. Topological issues relevant to biosynthesis and functions of glycoconjugates are also considered, and the growing role of these molecules in medicine, biotechnology, nanotechnology, bioenergy, and materials science is mentioned. Defined in the broadest sense, glycobiology is the study of the structure, biosynthesis, biology, and evolution of saccharides (also called carbohydrates, sugar chains, or glycans) that are widely distributed in nature and of the proteins that recognize them. How does glycobiology fit into the modern concepts of molecular biology? The central paradigm driving research in molecular biology has been that biological information flows from DNA to RNA to protein. The power of this concept lies in its template-based precision, the ability to manipulate one class of molecules based on knowledge of another, and the patterns of sequence homology and relatedness that predict function and reveal evolutionary relationships. With ongoing sequencing of numerous genomes, spectacular gains in understanding the biology of nucleic acids and proteins have occurred. Thus, many scientists assume that studying just these molecules will explain the makeup of cells, tissues, organs, physiological systems, and intact organisms. In fact, making a cell requires many small molecule metabolites as well as two other major classes of macromolecules—lipids and carbohydrates—which serve as intermediates in generating energy and as signaling effectors, recognition markers, and structural components. Taken together with the fact that they encompass some of the major posttranslational modifications of proteins, lipids, and carbohydrates help explain how the relatively small number of genes in the typical genome can generate the enormous biological complexities inherent in the development, growth, and functioning of diverse organisms. The biological roles of carbohydrates are particularly prominent in the assembly of complex multicellular organs and organisms, which requires interactions between cells and the surrounding matrix. However, without any known exception, all cells and numerous macromolecules in nature carry an array of covalently attached sugars (monosaccharides) or sugar chains (oligosaccharides), which are generically referred to in this book as “glycans.” Sometimes glycans can also be freestanding entities. Being on the outer surface of cellular and secreted macromolecules, many glycans are in a position to modulate or mediate a variety of events in cell–cell, cell–matrix, and cell–molecule interactions critical to the development and function of a complex multicellular organism. They can also mediate interactions between organisms (e.g., between host and a parasite, pathogen, or a symbiont). In addition, simple, rapidly turning over, protein-bound glycans are abundant within the nucleus and cytoplasm, in which they can serve as regulatory switches. A more complete paradigm of molecular biology must therefore include glycans, often in covalent combination with other macromolecules (i.e., glycoconjugates, such as glycoproteins and glycolipids). In analogy to the current situation in Cosmology, glycans can be considered as the “dark matter” of the biological universe: a major and critical component that has yet to be fully incorporated into the “standard model” of biology. However, unlike the situation with dark matter in the Universe, there is already a lot known about glycans. The chemistry and metabolism of carbohydrates were prominent matters of interest in the first part of the 20th century. Although engendering much attention, they were primarily considered as a source of energy or as structural materials, apparently lacking other biological activities.']","In addition to synthesizing surface structures, bacteria also produce intracellular glycans and cytoplasmic glycosylated proteins and glycolipids. Bacteria also produce a wide range of glycan-binding proteins, including adhesins that facilitate bacterial colonization, exotoxins that bind to host membrane glycans, and single-sugar-binding proteins involved in metabolism. Furthermore, bacterial lifestyles are often defined by their capacity to digest and/or metabolize glycans, with complex nanomachines described for the degradation of complex carbohydrate structures.","First, in addition to synthesizing surface structures, bacteria also produce intracellular glycans and cytoplasmic glycosylated proteins and glycolipids. For example, glycogen and trehalose act as storage compounds within some bacteria. Mycobacteria also contain a growing list of unusual glycosylated molecules, which may be related to their ability to withstand a variety of stresses. Second, bacteria produce a wide range of glycan-binding proteins. These include adhesins that facilitate bacterial colonization, exotoxins that bind to host membrane glycans, and single-sugar-binding proteins involved in metabolism (see Chapter 42). Third, bacterial lifestyles are often defined by their capacity to digest and/or metabolize glycans. Complex nanomachines have been described for the degradation of complex carbohydrate structures. Assembling the various enzymes into a highly organized complex affords synergy and efficiency. For example, the roles of glycosyl hydrolases in biomass conversion are well documented (Chapter 59).",1.0,0.4418732564754513,0.9447330459356968,0.007874015748031496,0.99999999998,1.0
"Complete the following paragraph: In comparison to N-glycan biosynthesis, relatively little is known of how archaeal O-glycans are assembled. The O-glycans of four archaeal species have been characterized to a limited extent (Figure 22.3). The only published report on archaeal O-glycan biosynthesis revealed that Haloarcula hispanica requires Dol-P-Glc as a sugar donor for the assembly of the N-linked glucose-α-(1,2)-[sulfoquinovosamine-β-(1,6)-]galactose trisaccharide and the O-linked glucose-α-(1,4)-galactose disaccharide.","['It was later reported that the major M. maripaludis pilin is modified by the same N-linked tetrasaccharide bearing an extra hexose branching from the linking GalNAc subunit. The pathway used for N-glycosylation of M. mariplaudis archaellin has been largely delineated. The process seemingly starts with the addition of UDP-GalNAc to Dol-P by an unidentified glycosyltransferase. Like Hfx. volcanii Dol-P, M. mariplaudis Dol-P includes two saturated isoprenes, likely at the α and ω positions. The AglO, AglA, and AglL glycosyltransferases add the next three nucleotide-activated sugars, respectively. AglU adds the threonine moiety to sugar three, apparently only following the addition of the fourth sugar by the glycosyltransferase AglL. AglV then methylates sugar four. The Dol-P-bound tetrasaccharide is then flipped across the membrane by an unidentified flippase, where AglB transfers the lipid-linked glycan to target Asn residues. Studies on the N-glycosylation process in Crenarchaeota have focused on the thermoacidophilic archaeon Sulfolobus acidocaldarius. In S. acidocaldarius, the S-layer glycoprotein, archaellin, and cytochrome b558/566 are modified by an N-linked hexasaccharide with the structure (Man-α1-6)(Man-α1-4)(Glc-β1-4-Qui6S-β1-3)GlcNAcβ1-4GlcNAc-β-Asn. This glycan is unusual as it contains the typical eukaryotic chitobiose core and a sulfoquinovose, a sugar generally found only in photosynthetic membranes of plants and phototrophic bacteria. Biosynthesis of the N-linked glycan begins with the transfer of GlcNAc-phosphate, derived from a nucleotide-activated precursor, onto an unusually short and highly saturated Dol-PP lipid carrier by AglH, a UDP-GlcNAc-1-P: Dol-P-GlcNAc-1-P transferase. Information concerning addition of the second and third sugars is lacking. However, Agl3 converts UDP-glucose and sodium sulphite into UDP-sulfoquinovose, which is subsequently added to Dol-PP-bound trisaccharide by an unknown glycosyltransferase. In the final steps of N-linked glycan assembly, the terminal mannose and glucose moieties are added, with Agl16, a soluble glycosyltransferase, adding the final glucose. A so-far unidentified flippase translocates the Dol-PP-bound hexasaccharide across the membrane, where AglB transfers the glycan to target protein Asn residues. In contrast to Hfx. volcanii, M. voltae, and M. maripaludis, aglB is essential in S. acidocaldarius. In comparison to N-glycan biosynthesis, relatively little is known of how archaeal O-glycans are assembled. The O-glycans of four archaeal species have been characterized to a limited extent (Figure 22.3). The only published report on archaeal O-glycan biosynthesis revealed that Haloarcula hispanica requires Dol-P-Glc as a sugar donor for the assembly of the N-linked glucose-α-(1,2)-[sulfoquinovosamine-β-(1,6)-]galactose trisaccharide and the O-linked glucose-α-(1,4)-galactose disaccharide. N-glycosylation has been considered as assisting Archaea to cope with the challenges of the extreme environments they often occupy. For instance, enhanced surface charge in the face of hypersaline conditions and hence increased solubility was offered as an explanation for the high sulfated sugar content of N-linked glycans decorating the Hbt. salinarum S-layer glycoprotein relative to its Hfx. volcanii counterpart, given the higher salinity of the locale in which the former lives.'
 'Currently defined archaeal N-linked glycans are depicted in Figure 22.3. The structural diversity of N- and O-linked glycans in Archaea. The structures of N-linked glycans found in the Euryarchaeota and Crenarchaeota are shown. The OTase (STT3 or AglB) within the endoplasmic reticulum (ER) or cytoplasmic membrane (right), (more...) The first reported archaeal N-glycosylated protein, the Halobacterium salinarum S-layer glycoprotein, was shown to be modified by two different N-linked oligosaccharides, a repeating sulfated pentasaccharide linked via N-glycosylamine to Asn-2 and a sulfated glycan linked by a glucose residue to 10 other Asn residues. The latter glycan is also N-linked to archaellins in this haloarchaeon. Efforts undertaken at the time aimed at deciphering the pathways responsible for the synthesis of these glycans relied solely on biochemical approaches because neither suitable genetic tools nor a genome sequence were available. Despite these biochemical advances, delineation of archaeal N-glycosylation pathways had to wait until the genome age and the development of tools for the genetic manipulation of various species. Through the subsequent identification of homologs of eukaryotic and/or bacterial N-glycosylation pathway components, genome scanning for additional components, the generation of deletion strains, and characterization of reporter glycoproteins, agl (archaeal glycosylation) genes comprising archaeal N-glycosylation pathways have been identified in several Archaea, including halophilic, methanogenic, and thermophilic species. In the last decade, progress in defining pathways of N-glycosylation has relied on Haloferax volcanii as a model organism. In Hfx. volcanii, a series of Agl proteins mediate the assembly and attachment of a pentasaccharide with the structure mannose-1,2-[methyl-O-4-]glucuronic acid-β1-4-galacturonic acid-α1-4-glucuronic acid-β1-4-glucose-β-Asn to the S-layer glycoprotein and archaellins (Figure 22.4). Acting at the cytoplasmic face of the plasma membrane, the glycosyltransferases AglJ, AglG, AglI, and AglE sequentially add the first four pentasaccharide residues onto a common Dol-P carrier, whereas AglD adds the final pentasaccharide residue, mannose, to a distinct Dol-P (Figure 22.3). Assembly of the Dol-P-linked tetrasaccharide also involves AglF, a glucose-1-phosphate uridyltransferase, AglM, a UDP-glucose dehydrogenase, AglP, a methyltransferase, and AglQ, a predicted isomerase. AglF and AglM have been shown to act in a sequential and coordinated manner in vitro, transforming glucose-1-phosphate into UDP-glucuronic acid. AglB, the archaeal oligosaccharyltransferase, transfers the lipid-linked tetrasaccharide to select Asn residues of target proteins. The final mannose residue is subsequently transferred from its Dol-P carrier to the protein-bound tetrasaccharide in a reaction requiring AglR, a protein that either serves as the Dol-P-mannose flippase or contributes to such activity, and AglS, a Dol-P-mannose mannosyltransferase. Interestingly, N-glycosylation of the S-layer protein is altered in response to a change in environmental conditions. When grown in low-salt medium, Hfx. volcanii alters the N-glycan structure in a site-specific manner. The pathway of N-glycosylation in Haloferax volcanii. The oligosaccharide is assembled on a dolichol phosphate lipid carrier, translocated across the plasma membrane, and transferred to a target protein by the AglB oligosaccharyltransferase. The N-linked (more...) Mass spectrometry studies elucidated the glycan N-linked to archaellins of Methanococcus voltae strain PS.'
 'N-glycosylation has been considered as assisting Archaea to cope with the challenges of the extreme environments they often occupy. For instance, enhanced surface charge in the face of hypersaline conditions and hence increased solubility was offered as an explanation for the high sulfated sugar content of N-linked glycans decorating the Hbt. salinarum S-layer glycoprotein relative to its Hfx. volcanii counterpart, given the higher salinity of the locale in which the former lives. In other instances, it is not clear how a given N-glycosylation profile contributes to life in harsh surroundings. In Hfx. volcanii, however, N-glycosylation may provide cells with the ability to respond to changes in the surrounding salinity. As noted above, the N-glycosylation profile of the S-layer glycoprotein differs in cells grown in 3.4 or 1.75 m NaCl-containing medium (Figure 22.3). Modified glycosylation in response to environmental conditions has also been reported in the case of M. hungatei, in which archaellins are only modified in a low phosphate-containing medium. Furthermore, a fully assembled N-glycan has been shown to be required for a broad range of biological functions, including motility and species-specific cell-cell recognition. Archaeal biofilms have been identified in a large variety of habitats (e.g., at low and high temperatures), as well as under acidic, alkaline, and high-salt conditions. It is proposed that Archaea, especially those that require interaction with other species, synthesize biofilms to support these cell–cell interactions. Detailed analyses of the structure and composition of extracellular polymeric substances (EPSs) of archaeal biofilms are limited. The sugar composition of a few EPSs has been analyzed by lectin binding assays. Such studies revealed that in Sulfolobales species, for instance, the EPS mainly consists of glucose, galactose, mannose, and N-acetyl-D-glucosamine. The authors acknowledge contributions to previous versions of this chapter by Jeffrey D. Esko, Tamara L. Doering, and the late Christian R.H. Raetz and appreciate helpful comments and suggestions from Ramya Chakravarthy and Debra Mohnen.'
 ""NCBI Bookshelf. A service of the National Library of Medicine, National Institutes of Health. Varki A, Cummings RD, Esko JD, et al., editors. Essentials of Glycobiology [Internet]. 4th edition. Cold Spring Harbor (NY): Cold Spring Harbor Laboratory Press; 2022.  doi: 10.1101/glycobiology.4e.22 Benjamin H. Meyer, Sonja-Verena Albers, Jerry Eichler, and Markus Aebi. This chapter describes the current knowledge of archaeal glycobiology. As in bacteria and eukaryotes, the archaeal cell surface is covered with glycans, which serve as an essential part of the cell wall polysaccharides and as a modification of lipids or surface proteins, as well as the major component of the extracellular matrix. Recent discoveries shed light on a tremendous structural and functional diversity of carbohydrates in this domain of life. In particular, the pathways of N-linked protein glycosylation, homologous to the eukaryotic N-glycosylation machinery, generate a wide variety of N-linked glycans in different archaeal species. Based on Carl Woese's pioneering use of 16S ribosomal (r)RNA analysis, the Archaea were first recognized as a separate domain of life, distinct from either Bacteria or Eukarya. As the first Archaea identified were isolated from some of the most physically challenging environments on the planet, such as those defined by extremes in salinity, pH, or temperature, it was assumed that all Archaea were extremophiles. However, the discovery of Archaea in a variety of “normal” as well as “extreme” biological niches revealed that Archaea represent a major portion of the microbial population and that they play crucial roles in geochemical cycles on Earth. Furthermore, the discoveries of new archaeal lineages in the last decade, predominantly based on metagenomics studies, have led to extensive expansion and reconstruction of the archaeal phylogenetic tree. At present, attempts to cultivate these newly identified Archaea have rarely been successful. Nevertheless, the study of cultivated Archaea has led to many important discoveries. Since Neuberger's discovery of protein glycosylation in the late 1930s (Chapter 1) and his description of the N-acetylglucosamine (GlcNAc)-β-asparagine linkage of a glycan to the modified protein, it became generally accepted that protein glycosylation was a process limited to eukaryotes. This long-held belief was challenged in 1976, when Mescher and Strominger showed that the surface (S)-layer glycoprotein of the archaeon Halobacterium salinarum was subject to both N- and O-glycosylation, thus offering the first example of a noneukaryotic glycoprotein. Today, it is clear that protein glycosylation is an almost universal trait of the Archaea. The discovery that Archaea do not contain murein in their cell wall was one of the main arguments used to distinguish this group of prokaryotes from Bacteria. Indeed, at the time, cell wall composition was considered to be “the only useful phylogenetic criterion, other than direct molecular phylogenetic measurement” to distinguish between the two prokaryotic domains. Some methanogenic Archaea were, however, shown to include a distinct polymer termed pseudomurein (or pseudopeptidoglycan) in their cell wall, whereas other archaeal species were found to assemble cell walls based on different sugar-based polymers. Today, as more and more archaeal species are cultivated, it is becoming clear that Archaea present numerous variations in the composition of the cell surface. For instance, although many species seem to mainly rely on a cell envelope in which the cytoplasmic membrane is enclosed by a two-dimensional crystalline proteinaceous layer called the surface (S)-layer, strains surrounded by two membranes have been identified. Figure 22.1 summarizes current knowledge about archaeal cell surfaces. Diversity of archaeal cell wall structures. The different cell wall components are shown on the right. In the inner circle, the number of loci encoding putative oligosaccharyltransferases in the respective genomes is shown.  Similar to the Bacteria, there is no cell wall structure unique to all Archaea.""
 'Although the building blocks of heteropolysaccharide have been suggested, biosynthesis of this cell wall structure has yet to be described. Individual cells of Methanosarcina rely on an S-layer as their cell wall. A cubic aggregate of four cells (sarcina) is covered by an additional rigid fibrillar polymer called methanochondroitin. Degradation of methanochondroitin results in the disaggregation of the cells, underlining that the matrix is responsible for maintenance of the aggregate. Methanochondroitin, which is similar to eukaryotic connective tissue chondroitin, is composed of a repeating trimer of uronic acid and two GalNAc residues. Yet unlike chondroitin, methanochondroitin is not sulfated. A pathway of methanochondroitin biosynthesis has been proposed based on activated precursors in Methanosarcina barkeri cell extracts. Methanosarcina species can further modify the methanochondroitin condition largely through the addition of glucose and galactose acids. Members of the thermoacidophilic order Thermoplasmatales (pH 1–2 and 60°C), such as Ferroplasma acidophilum and Thermoplasma acidophilum, lack a rigid cell envelope. Such organisms thus display a pleomorphic shape, similar to mycoplasma. Stabilization of the cell is most likely realized by the oligosaccharide portions of lipoglycans and membrane-associated glycoproteins. The outwardly oriented glycan chains form a protective slime coat called the glycocalyx. A recent study of different T. acidophilum cell-surface glycoproteins identified an N-linked branched octosaccharide described below. The majority of characterized Archaea rely on a proteinaceous cell wall, the S-layer, comprising a regularly structured two-dimensional array based on a single protein species, the S-layer glycoprotein, or a limited number of proteins (Figure 22.1). In some archaeal species, the S-layer can be further supported by polysaccharides, by a second S-layer sheet, or by additional surface glycoproteins. For example, the S-layer of Methanospirillum hungatei is further enclosed by a tubular proteinaceous sheath. These sheaths form a paracrystalline structure based on a simple p2 lattice, which is distinct from that of the S-layer. Depending on the species, the proteinaceous sheaths can be glycosylated. Another example is the extremely halophilic Haloquadratum walsbyi. The unique square-shaped cells, with a thickness of only 0.1–0.5 µm, are surrounded by one or two S-layer sheets. An extremely large glycoprotein, termed halomucin, highly similar to mammalian mucin, is loosely connected to the S-layer. Halomucin is heavily glycosylated, containing more than 280 potential N-glycosylation sites (on average one site every 32 residues). This cell envelope is further enforced by analogues of halomucin, termed Hmu2 and Hmu3, and most likely by a poly-γ-glutamate capsule. To date, glycoproteins from Archaea isolated from a wide range of habitats have been studied to various degrees of detail. Possibly reflecting the varied niches occupied by these organisms, their S-layer glycoproteins and other glycoproteins, such as archaellins and pilins, bear N-linked glycans that present wider diversity in terms of size; degree of branching; the identity of the linking sugar; modification of sugar components by amino acids, sulfate, and methyl groups; and the presence of unique sugars than reported to date in Bacteria or Eukarya. Currently defined archaeal N-linked glycans are depicted in Figure 22.3. The structural diversity of N- and O-linked glycans in Archaea. The structures of N-linked glycans found in the Euryarchaeota and Crenarchaeota are shown.']","The biosynthesis of archaeal O-glycans remains relatively understudied compared to N-glycan biosynthesis. Among the limited characterized O-glycans in archaeal species, Haloarcula hispanica has been reported to utilize Dol-P-Glc as a sugar donor for the assembly of the N-linked glucose-α-(1,2)-[sulfoquinovosamine-β-(1,6)-]galactose trisaccharide and the O-linked glucose-α-(1,4)-galactose disaccharide.","N-glycosylation has been considered as assisting Archaea to cope with the challenges of the extreme environments they often occupy. For instance, enhanced surface charge in the face of hypersaline conditions and hence increased solubility was offered as an explanation for the high sulfated sugar content of N-linked glycans decorating the Hbt. salinarum S-layer glycoprotein relative to its Hfx. volcanii counterpart, given the higher salinity of the locale in which the former lives. In other instances, it is not clear how a given N-glycosylation profile contributes to life in harsh surroundings. In Hfx. volcanii, however, N-glycosylation may provide cells with the ability to respond to changes in the surrounding salinity.",1.0,0.7648880850402422,0.6495488210588127,0.008130081300813009,0.99999999998,0.75
"Complete the following paragraph: A. fumigatus is an environmental mold that spreads by airborne particles. It causes serious invasive disease in immunocompromised people that is difficult to treat, leading to high mortality rates.","['In particular, these structures are recognized by the mannose receptor and by dectin-2. These are C-type lectins expressed by immune cells that are important in both innate and adaptive immune responses (see Chapter 34). PLM antigens may be shed by C. albicans and, through interactions with Toll-like receptors (TLR-2), they can induce nuclear factor-κB (NF-κB) activation and cytokine responses such as tumor necrosis factor-α (TNF-α) secretion. Galectin-3, a ubiquitous member of the galectin family of lectins that is highly expressed in macrophages, also appears to recognize C. albicans expressing β1-2-linked mannose residues, resulting in opsonization of the yeast. A. fumigatus is an environmental mold that spreads by airborne particles. It causes serious invasive disease in immunocompromised people that is difficult to treat, leading to high mortality rates. As with other fungal pathogens, the surface glycans of A. fumigatus are critical for interactions with the host. The cell wall of infectious forms of this fungus is covered with specific proteins and melanin, presumably to alter surface properties and mask these structures from recognition by host immune receptors. The hyphal wall has a core of branched β1-3-glucan covalently linked to other glucan components, chitin, and galactomannan, which consists of a mannose backbone with short galactofuranose side chains. Interestingly, galactomannan also occurs anchored to the plasma membrane by a GPI. This polysaccharide is assembled in the Golgi apparatus and is probably transferred to the cell wall by transglycosidases, in the same way as GPI-anchored proteins. A. fumigatus also produces an extracellular matrix composed of monosaccharides, α1-3-glucan, galactomannan, and a galactosaminogalactan composed of variable galactopyranose repeats linked to N-acetylgalactosamine, which are partially de-acetylated. This structure has been implicated in adhesion and fungal virulence. The extracellular matrix also plays an important role in concealing the immunogenic β1-3 glucan layer from the immune system. C. neoformans is a ubiquitous environmental basidiomycete yeast that causes severe disease in immunocompromised individuals, leading to roughly half a million deaths per year worldwide. It is unique among pathogenic fungi in having an extensive polysaccharide capsule that is required for virulence (Figure 23.6). The capsule is a dynamic structure that changes in thickness and composition depending on the environment and growth conditions. It is particularly large in the context of mammalian infection, in which it impedes host immune responses. It is composed of two large (millions of Da) polysaccharides named for their monosaccharide components: glucuronoxylomannan (GXM) and glucuronoxylomannogalactan (GXMGal). GXM is an extended α1-3 mannan substituted with β1-2Xyl, β1-4Xyl, and β1-2GlcA (Figure 23.7); a subset of the mannose residues are 6-O-acetylated (not shown). The second polymer, GXMGal, is based on α1-6 galactan, with side chains of galactose, glucuronic acid, mannose, and xylose (Figure 23.7); the backbone is also modified with small amounts of β1-2-linked galactofuranose (not shown). Association of the capsule with the cell surface relies on a cell-wall component, α1-3 glucan. Although α1-3 glucan is not present in the cell walls of S. cerevisiae or C. albicans, it is common in other fungi. N-glycans of C. neoformans are generally high mannose with modest outer chain extensions and may include xylose β1-2-linked to the trimannosyl core. Both N- and O-glycans may also be modified with xylose and xylose phosphate. A quick-freeze deep-etch image of the edge of a Cryptococcus neoformans cell.'
 'Although α1-3 glucan is not present in the cell walls of S. cerevisiae or C. albicans, it is common in other fungi. N-glycans of C. neoformans are generally high mannose with modest outer chain extensions and may include xylose β1-2-linked to the trimannosyl core. Both N- and O-glycans may also be modified with xylose and xylose phosphate. A quick-freeze deep-etch image of the edge of a Cryptococcus neoformans cell. The polysaccharide capsule (open meshwork at right) is linked to the cell wall (central structure dividing the image from upper left to lower right) via α1-3 glucan. (more...) Structures of capsular polysaccharides in Cryptococcus neoformans.  In the context of fungal diseases, the similarity of fungi to their eukaryote hosts becomes a liability, because it is challenging to develop antifungal drugs that are not hampered by toxicity. The unique features of fungal glycans may suggest drug targets to help improve this picture, and decrease the roughly one million deaths each year caused by fungal infections. The major success story using this approach is the development of echinocandin drugs. These antifungal lipopeptides inhibit β1-3-glucan synthesis in fungi including Candida and Aspergillus, leading to cell wall compromise, and are used clinically to treat invasive fungal infections, although they are not effective against all fungal pathogens. GPI-synthesis inhibitors also offer promise for treatment of fungal pathogens; compounds that selectively inhibit yeast inositol acylation are currently in clinical trials. Continued efforts to target novel aspects of fungal glycobiology may advance the ongoing search for new therapies. The authors appreciate helpful comments and suggestions from Anne Imberty and Markus Pauly.'
 'Finally, the xylans of this organism are linear β1-4-linked polymers of xylose, more typical of those found in “higher” plants and algae than in fungi. D. glabratum also synthesizes several unusual short glycolipids, including glycosyldiacylglycerolipids, which are similar to plant glycolipids and contain monosaccharides, disaccharides, and linear trisaccharides of α1-6-linked galactopyranose. This fungus thus highlights the extensive glycan diversity of the fungal kingdom. Another example of glycan diversity is offered by Cryptococcus laurentii, which has the unusual property of producing toxins that kill a pathogenic yeast, C. albicans (see below). The O-glycans of C. laurentii are unusual in that they contain mannose, xylose, and galactose (Figure 23.3C); these glycans are synthesized by a unique set of mannosyl-, xylosyl-, and galactosyltransferases that are not homologous to human enzymes. This diversity would not have been predicted by studies of model yeast alone, emphasizing the importance of examining glycans in a wide range of fungal species. Coprinopsis cinerea is a mushroom species that has gained prominence as a model for studies of diverse topics including mating, sexual development, meiosis, and the evolution of multicellularity. Its N-glycans typically are high mannose type with five to nine mannoses, but may also have a bisecting α1-4GlcNAc at the β-mannose. Pathogenic fungi are a significant cause of plant and animal disease, responsible for devastation of crops, decimation of animal populations (e.g., certain bat, amphibian, and bee species), and serious human diseases that kill an estimated one million people each year. These organisms display diverse glycans, which typically differ from those of the host and have been implicated in multiple pathogenic processes and host–pathogen interactions. For example, during plant infections plant glycosylhydrolases may partially digest wall glucans of invading fungi. Some of the released oligosaccharides, termed oligosaccharins, can then act as signals to promote plant antifungal defenses. C. albicans (an ascomycete) is a normal commensal organism that can cause illness ranging from irritations of mucosal surfaces to life-threatening systemic infections. The C. albicans cell wall contains β1-3- and β1-6-linked glucans and chitin, similar to the S. cerevisiae wall, and immunogenic mannans that are termed phosphopeptidomannans. It also produces unusual short β1-2-linked mannose chains (Figure 23.2) that are highly antigenic and are also expressed on phospholipomannan (PLM) antigens. PLM antigens contain phytoceramide derivatives of myo-inositol phosphate. The β1-2 mannosides are linked via an α-mannosylphosphate to the common glycosphingolipid Manα-1,2 inositolphosphoceramide. The abundant GPI-anchored proteins of C. albicans have been implicated in fungal adherence to host tissues. The O-glycans of C. albicans are short chains of α1-2-linked mannose (Figure 23.3A), which lack the α1-3-linked mannose caps found in S. cerevisiae. As in S. cerevisiae, deficiencies of O-mannose addition generated through genetic deletions are lethal, indicating that O-mannosylation is essential in this yeast. C. albicans mannans are also important in its interactions with host cells, including macrophages and dendritic cells. In particular, these structures are recognized by the mannose receptor and by dectin-2. These are C-type lectins expressed by immune cells that are important in both innate and adaptive immune responses (see Chapter 34). PLM antigens may be shed by C. albicans and, through interactions with Toll-like receptors (TLR-2), they can induce nuclear factor-κB (NF-κB) activation and cytokine responses such as tumor necrosis factor-α (TNF-α) secretion.'
 'The promoter for AOX is methanol inducible, and transcripts driven by this promoter may comprise up to 5% of the total poly(A)+ RNA in induced cells. P. pastoris has several advantages over Escherichia coli as an expression system, because it does not produce inclusion bodies and it promotes the correct folding of eukaryotic proteins. It also has certain advantages over typical model yeast. First, although its basic N-glycosylation pathway is similar to that of S. cerevisiae and yields glycoproteins with oligomannose-type N-glycans, these structures in P. pastoris have only five to 15 mannose residues (typically Man9GlcNAc2Asn and Man8GlcNAc2Asn) compared with the 50 to 150 mannose residues found in glycoproteins from S. cerevisiae (see Figure 23.2). Hyperglycosylation in S. cerevisiae can interfere with protein folding, requiring use of mnn mutants to limit hyperglycosylation and avoid this problem. Also, P. pastoris does not add outer α1-3-linked mannose residues to its N-glycans. These structures are highly antigenic to humans, making proteins expressed in S. cerevisiae unsuitable for human pharmaceutical use. P. pastoris synthesizes O-glycans with an O-linked mannose core attached to Ser/Thr residues; most of these are short α1-2-linked mannose structures (see Figure 23.3A). Genetic tools have been used to manipulate the machinery for glycoprotein assembly of both S. cerevisiae and P. pastoris. Deletion of ER- and Golgi-specific functionalities in combination with the introduction of heterologous hydrolases and glycosyltransferases has generated “humanized” yeasts and filamentous fungi for the production of therapeutic glycoproteins (Chapter 56). P. pastoris has emerged as a potent orthogonal host to produce exogenous polysaccharides such as those occurring in the plant cell wall. Kluyveromyces lactis metabolizes lactose to lactic acid and, along with Aspergillus niger and E. coli, is grown to produce rennet for making cheese and other products. K. lactis is also a rich source of β-galactosidase, which hydrolyzes lactose. K. lactis synthesizes mannans similar to those in S. cerevisiae, but they lack mannose phosphate modifications and some side chains are capped with a residue of N-acetylglucosamine. A K. lactis mutant that lacks these N-acetylglucosamine residues because of a deficiency of the Golgi UDP-GlcNAc nucleotide sugar transporter has been productively exploited in studies of heterologous transporters. To convey the enormous diversity of fungi we will consider the basidiomycete phylum, which encompasses fungi that produce spores from a pedestal-like structure called the basidium. Basidiomycetes range from fungi with gills or pores, such as common mushrooms and bracket fungi, to budding yeast that are deadly human pathogens. The basidiomycete Dictyonema glabratum illustrates a distinct fungal lifestyle. It lives in symbiosis with cyanobacteria Scytonema sp. forming a lichen, which is notable for its many unusual glycans. For example, although the β-glucans of most lichens are linear, in D. glabratum they are branched with β1-3 and β1-6 linkages. The mannans of D. glabratum also have an α1-3-linked backbone, rather than the typical α1-6 linkages found in other lichens, along with branches at the 2 and 4 positions. Finally, the xylans of this organism are linear β1-4-linked polymers of xylose, more typical of those found in “higher” plants and algae than in fungi. D. glabratum also synthesizes several unusual short glycolipids, including glycosyldiacylglycerolipids, which are similar to plant glycolipids and contain monosaccharides, disaccharides, and linear trisaccharides of α1-6-linked galactopyranose.'
 ""Life cycle of Plasmodium falciparum, a parasitic protozoan that causes the most severe form of malaria in humans. The bite of the female Anopheles mosquito introduces sporozoites into the human host, which mature as they travel to the liver and ultimately (more...) Following inoculation into the bloodstream, the sporozoite's major circumsporozoite protein (CSP) interacts with heparan sulfate (HS) on the surface of hepatocytes, which allows invasion and the first replication in the mammalian host. Liver HS possesses an unusually high degree of sulfation compared to similar glycosaminoglycans from other organs, suggesting the basis for the selective targeting of Plasmodium to hepatocytes. A recombinant form of the pre-erythrocytic CSP made in yeast is a components of the RTS,S vaccine currently being implemented worldwide. Interestingly, the T-cell epitope of CSP is O-fucosylated, but the recombinant yeast-derived protein is not O-fucosylated. On exit from the liver, Plasmodium merozoites use multiple ligand–receptor interactions to invade host erythrocytes. The merozoite proteins, such as the erythrocyte binding-like (EBL) proteins (Table 43.4), vary in their dependency on sialic acid residues on the erythrocyte surface and play an important role in erythrocyte invasion. Some major parasites and their glycan-binding proteins  The glycophorins are the major sialic acid–containing glycoproteins on erythrocytes. The EBL protein EBA-175 (erythrocyte-binding antigen-175) recognizes clusters of sialylated O-glycans attached to glycophorin A, particularly within a 30-amino-acid region that carries 11 O-glycans. Desialylation of erythrocytes precludes interactions of some strains of P. falciparum, and individuals lacking glycophorins A or B are refractory to invasion. Some strains of P. falciparum can reversibly switch from sialic acid–dependent to sialic acid–independent invasion, and this has important implications for vaccine design against malaria parasites. Pregnancy-associated malaria is a major cause of suffering and arises when P. falciparum–infected erythrocytes are sequestered in the placenta of pregnant women. The parasite expresses the VAR2CSA protein, which mediates adherence of the infected erythrocytes to placental chondroitin sulfate A (CSA) with very high specificity and affinity (Kd∼15 nm), promoting parasite infection and invasion. Eruption of the merozoites from infected erythrocytes releases free glycosylphosphatidylinositols (GPIs), which are prominent virulence factors contributing to malaria pathogenesis (Chapter 12). P. falciparum GPIs mimic host GPIs and activate host GPI-associated signaling pathways. The GPIs can activate host's macrophages, mainly through Toll-like receptor-2 signaling, leading to the production of inflammatory cytokines and up-regulation of cell-adhesion molecules, such as E-selectin in endothelial cells. Antibodies to these GPIs can neutralize their effects and mitigate the pathology of the disease independently of direct infection. In addition, the P. falciparum genome encodes a number of enzymes involved in N-glycosylation and O-glycosylation (O-fucosylation) and C-mannosylation. Whereas N-glycans are truncated and typically contain only a chitobiosyl core, GlcNAcβ1-4GlcNAcβ-Asn, mannose is abundantly present in GPI anchors. There is also evidence suggesting that Plasmodia may express a number of unusual glycoconjugates, such as galactose- and glucose-containing glycoproteins and glucose-containing glycolipids. African trypanosomes (Trypanosoma brucei) transmitted by blood-sucking tsetse flies are the etiologic agents of nagana disease in cattle and sleeping sickness in humans. A remarkable feature of these organisms is their ability to survive extracellularly in the host bloodstream, where they are constantly exposed to the immune system.""]","The cell wall of infectious forms of A. fumigatus is covered with specific proteins and melanin, presumably to alter surface properties and mask these structures from recognition by host immune receptors. The hyphal wall has a core of branched β1-3-glucan covalently linked to other glucan components, chitin, and galactomannan, which consists of a mannose backbone with short galactofuranose side chains. Interestingly, galactomannan also occurs anchored to the plasma membrane by a GPI. This polysaccharide is assembled in the Golgi apparatus and is probably transferred to the cell wall by transglycosidases, in the same way as GPI-anchored proteins. A. fumigatus also produces an extracellular matrix composed of monosaccharides, α1-3-glucan, galactomannan, and a galactosaminogalactan composed of variable galactopyranose repeats linked to N-acetylgalactosamine, which are partially de-acetylated. This structure has been implicated in adhesion and fungal virulence. The extracellular matrix also plays an important role in concealing the immunogenic β1-3 glucan layer from the immune system.","As with other fungal pathogens, the surface glycans of A. fumigatus are critical for interactions with the host. The cell wall of infectious forms of this fungus is covered with specific proteins and melanin, presumably to alter surface properties and mask these structures from recognition by host immune receptors. The hyphal wall has a core of branched β1-3-glucan covalently linked to other glucan components, chitin, and galactomannan, which consists of a mannose backbone with short galactofuranose side chains. Interestingly, galactomannan also occurs anchored to the plasma membrane by a GPI. This polysaccharide is assembled in the Golgi apparatus and is probably transferred to the cell wall by transglycosidases, in the same way as GPI-anchored proteins.",1.0,0.5569651813389674,0.9398626220752545,0.01818181818181818,0.9999999999666667,1.0
"Complete the following paragraph: Apiogalacturonans have only been identified in the walls of duckweeds and seagrasses. The substituted galacturonan referred to as RG-II, which accounts for between 2% and 5% of the primary cell wall, is the most structurally complex polysaccharide yet identified in nature.","['In grasses, mixed linkage glucan is present mainly in young tissues, which has led to the suggestion that it is a carbohydrate storage molecule as also indicated by its metabolism during plant development. Callose, a polysaccharide composed of 1-3-linked β glucosyl residues, is another β-glucan produced by plants (Figure 24.1G). It is used to form a temporary cell wall at the cell plate during cytokinesis and is involved in regulating the permeability of plasmodesmata. It is often formed in response to abiotic and biotic stresses or damage. Pectins are structurally complex polysaccharides that contain 1-4-linked α-D-GalpA. Three structurally distinct pectins—homogalacturonan, substituted galacturonan, and rhamnogalacturonan—have been identified in plant cell walls (Figure 24.2). Homogalacturonan, which may account for up to 65% of the pectin in a primary wall, is composed of 1-4-linked α-D-GalpA. The carboxyl group may be methyl-esterified, thus neutralizing the negative charge of this glycosyl moiety, and the uronic acid itself may be acetylated at O-2 or O-3. The extent of methyl-esterification is controlled by pectin methylesterases and pectin methylesterase inhibitors present in the wall. The degree of methylesterification affects the ability of homogalacturonan-containing glycans to form ionic calcium cross-links with themselves and with other pectic polymers. Such interactions alter the mechanical properties of the wall and may influence plant growth and development. Rhamnogalacturonan-I (RG-I) is a family of polysaccharides with a backbone composed of a repeating disaccharide 4-α-D-GalpA-1-2-α-L-Rhap-1. Many of the GalpAs are acetylated at O-2 and/or O-3. Depending on the plant, between 20% and 80% of the Rhap residues may be substituted at O-4 with linear or branched side chains composed predominantly of Araf and Galp, together with smaller amounts of Fucp and GlcpA (Figure 24.2). Little is known about the functions of these side chains and their contribution to the properties of the primary wall. Substituted galacturonans have a backbone composed of 1-4-linked α-D-GalpA acid residues that are substituted to varying degrees with mono-, di-, or oligosaccharides. For example, xylogalacturonans contain single β-D-Xylp residues linked to O-3 of some of the backbone residues (Figure 24.2), whereas apiogalacturonans have β-D-apiose (Apif) and apiobiose linked to O-2 of some of the backbone residues. Apiogalacturonans have only been identified in the walls of duckweeds and seagrasses. The substituted galacturonan referred to as RG-II, which accounts for between 2% and 5% of the primary cell wall, is the most structurally complex polysaccharide yet identified in nature. It is composed of 12 different monosaccharides linked together by up to 21 distinct glycosidic linkages (Figure 24.2). Four structurally different side chains and one or two Araf substituents are attached to the galacturonan backbone. Two structurally conserved disaccharides (side chains C and D) are linked to O-3 of the backbone. The A and B side chains, which contain between 7 and 9 monosaccharides, are linked to O-2 of the backbone. Several of the monosaccharides in RG-II are O-methylated and/or O-acetylated. Virtually all of the RG-II exists in the primary wall as a dimer cross-linked by a borate ester. The ester is formed between the Apif residue in side chain A of each RG-II monomer (Figure 24.2).'
 'The A and B side chains, which contain between 7 and 9 monosaccharides, are linked to O-2 of the backbone. Several of the monosaccharides in RG-II are O-methylated and/or O-acetylated. Virtually all of the RG-II exists in the primary wall as a dimer cross-linked by a borate ester. The ester is formed between the Apif residue in side chain A of each RG-II monomer (Figure 24.2). The dimer forms rapidly in vitro when the RG-II monomer is reacted with boric acid and a divalent cation. However, the mechanism and site of dimer formation in planta has not been determined. Borate cross-linking of RG-II is likely to have substantial effects on the properties of pectin and the primary wall as RG-II is itself linked to homogalacturonan (Figure 24.2). Indeed, mutations that affect RG-II structure and cross-linking result in plants with abnormal walls and severe growth defects. Swollen primary walls and abnormal growth together with reduced RG-II cross-linking are also a characteristic of boron deficient plants. RG-II was believed to be largely resistant to fragmentation by microbial enzymes. However, recent studies have shown that bacteria present in the human gut produce glycanases capable of hydrolyzing all but one of the glycosidic bonds in RG-II. Pectin is believed to exist in the cell wall as a macromolecular complex comprised of structural domains—homogalacturonan, rhamnogalacturonan, and substituted galacturonan—that are covalently and noncovalently linked to one another. However, there is only a limited understanding of how these structural domains are organized (Figure 24.2). Molecular modeling of a pectin (∼50 kDa) containing homogalacturonan (degree of polymerization ∼100) and rhamnogalacturonan with arabinogalactan side chains, together with modeling of RG-II conformation have begun to provide insights into the conformations and relative dimensions of each pectin structural domain. The homogalacturonan region has a persistence length of approximately 20 GalAp residues, which is likely to be sufficient to stabilize junction zones formed with Ca++. In vitro studies suggest that the maximum stability of such junction zones is obtained with oligomers containing approximately 15 nonesterified GalpA residues. Thus, controlling the distribution of methyl-ester groups along the homogalacturonan backbone provides a mechanism to regulate the physical properties of pectin, including its ability to form gels. For a gel to form and not to be brittle, other features including sequences that interrupt interchain associations in the pectin macromolecule may be important. For example, the structural diversity and the conformational flexibility of the oligosaccharide side chains of the rhamnogalacturonan domain will limit or prevent interchain pairing. The presence of 1-2-linked Rhap residues does not introduce kinks into the backbone geometry of rhamnogalacturonan and thereby limit interchain associations. Rather, it is the side chains linked to these residues that are responsible for preventing or limiting interchain associations. The conformations of the four side chains attached to the homogalacturonan backbone may lead RG-II to adopt a “disk-like” shape. Well-defined tertiary structures are predicted for the RG-II monomer and the dimer. In the dimer, borate-ester cross-linking and Ca++ interchain pairing further stabilizes the two disks. The apparent resistance of RG-II to wall-modifying enzymes together with the formation of a cation-stabilized RG-II dimer likely results in a structure that resists temporal changes in the plant. In contrast, homogalacturonan is continually modified by the action of wall enzymes and its contribution to wall architecture is therefore time dependent. Increased knowledge of the physical properties of primary wall polysaccharides and proteoglycans is required to understand how modulating the amounts and structural features of a few common polysaccharides and glycan domains lead to primary walls with diverse properties and functionalities.'
 'Cellulases and other enzymes involved in cellulose hydrolysis often exist as macromolecular complexes referred to as cellulosomes. Improving the effectiveness of cellulosomes is an area of active research, to increase the conversion of plant biomass to fermentable sugar (Chapter 59). Hemicelluloses are branched polysaccharides with a backbone composed of 1-4-linked β-D-pyranosyl residues with an equatorial O-4 (Glcp, Manp, and Xylp). Xyloglucan, glucurono/arabinoxylan, and glucomannan (Figure 24.1B–E) are included under this chemical definition of hemicelluloses. Hemicelluloses and cellulose have structural and conformational similarities that allow them to form strong, noncovalent associations with one another in the cell wall, although the biological significance of these interactions is still a subject of debate. Xyloglucan and cellulose both have a backbone of 1-4-linked β-D-Glcp residues, but unlike cellulose, xyloglucan contains sidechain substituents. The xyloglucan backbone is highly substituted with α-Xylp substituents at O-6 and in some cases with O-acetyl-substituents (Figure 24.1B). Each Xylp residue may itself be extended by the addition of one or more monosaccharides including β-D-Galp, α-L-Fucp, α-L-Araf, α-L-Arap, β-D-Xylp, β-D-GalpA, and O-acetyl substituents. Twenty-three structurally unique side chains have been identified to date, although only a subset of these are synthesized by a single plant species. Early models of dicot primary walls predicted that xyloglucans acted as tethers between cellulose microfibrils and that controlled enzymatic cleavage or reorganization of xyloglucan by proteins facilitated wall expansion and thus plant cell growth. However, this notion has been challenged by genetic engineering of xyloglucan structures in Arabidopsis plants, which revealed that eliminating xyloglucan entirely from the primary wall has remarkably little effect on overall plant growth and development. In contrast, removing only selected sidechain substituents of xyloglucan is detrimental to plant growth and replacing the sidechains with various glycosyl moieties restores plant growth, independent of the glycosyl moiety added. These results have led to the suggestion that xyloglucan acts as a spacer molecule to keep cellulose microfibrils apart and that pectin has a more important role in controlling wall expansion than previously believed. Arabinoxylan (Figure 24.1D) is the predominant noncellulosic polysaccharide in the type II walls of the grasses, with only small amounts present in dicot primary walls. Its backbone is composed of 1-4-linked β-D-Xylp residues, many of which are substituted at O-3 with α-L-Araf residues. These Araf residues may be further substituted at O-2 with an α-L-Araf or a β-D-Xylp residue. A small number of the backbone residues are substituted at O-2 with α-D-GlcpA and its 4-O-methylated counterpart (MeGlcpA). The presence of 1-3, 1-4-linked β-glucans (also referred to as mixed-linkage glucans) (Figure 24.1F) in the walls of grasses was once considered to be a unique feature of these plants. However, structurally related mixed-linkage β-glucans have also been identified in the walls of Selaginella (lycopod) and Equisetum (horsetails), although the evolutionary relationship between these β-glucans is not known. In grasses, mixed linkage glucan is present mainly in young tissues, which has led to the suggestion that it is a carbohydrate storage molecule as also indicated by its metabolism during plant development. Callose, a polysaccharide composed of 1-3-linked β glucosyl residues, is another β-glucan produced by plants (Figure 24.1G).'
